Image File,Inference Result
img1.png,"F and an ex onU; help need & se Is of intrines3
to ins"
img2.png,"ex multiple in this-

_age THivOS ofau
inesg'3"
img3.png,"Hall, v? a U ser n V; V se sc'' raes an EN li"
img4.png,"cre?
on it Santa
li AND s of des Dli centre a viri ishe"
img5.png,sub scue s magn leo com and bysesg en1en des this
img6.png,"sub d pl-s' ha car an ina dea center, de from-imos"
img7.png,"W n center r




met in,
ons anpfo, for"
img8.png,"center met and
on care by will itemsmot-s'16 de barualinsa"
img9.png,"Hall factors (
. name with as in cell theoniav sub on manufact Eoation"
img10.png,"Hall on a a service center is about it aa ser

a and in of like to"
img11.png,"This* ha H7ER3

to2 before conv  onioes (2 sc"
img12.png,"st l ( that is- need of above not 
the one b above  sofen"
img13.png,"and bre center is S
one n it: of is center P ( without; in of and"
img14.png,"s we
in- wood' _  in in need is vi from de inter des. of"
img15.png,"hall he Sh we-
s of? on h as is like to'in data?s"
img16.png,un met ( we and par- de for- den?- en no. ab? har b
img17.png,"It we
- un  about and on (change on desli in inism and in"
img18.png,the high? the need we set this to fitio rate? we and ituck? help this
img19.png,"Put it make sil on-rate-S to a F in center lotcer is 
se"
img20.png,"b from ar process
power and in
name is look- cla"" (3 [ s"
img21.png,"n bre center is that can ca it on sc as factor s, find- on ""is a"
img22.png,in we centre to- par co serv Onam To that thes in toa  and?
img23.png,"in problem in center, or2 location, that see the or 
by insesa"
img24.png,A that center- this is this to? locy that limit l ( A tomd h
img25.png,hall but a vic here role out?  we cos of for on s  on this li all
img26.png,"sp met
inserove in timi to , be onige is known o"
img27.png,"Is this with center-vi from and on the advis?. in water, a l Ty"
img28.png,sub on is andor h on we- in onv mar  diber a center on band
img29.png,"de N in no one for in a even and Is'
toag release can can on"
img30.png,it up reason ins or in andv t theic de-li osç- li
img31.png,In d a  in term gore in from an in resource & to/ flyn's
img32.png,H pl about your hand av rep-32 centre in bu? Centre s f TH/
img33.png,"the de r ... a, in the of independent. andd ven c s r place by water"
img34.png,"hall center center of-
sOs and and, banson se' ad for s and"
img35.png,"Is problem to s b bo ing (

on'- sythg of zone,"
img36.png,"the number May of very it down r,
. band from 3  s sim"
img37.png,"T or silence with before fromman has A Canes bank- toases

load s"
img38.png,"Is bak's track and further and! iMl
whOR and 0ine"
img39.png,"parts;  in chemical something ani'th'?
a s err on-based?"
img40.png,"In thee toland in Is
a and
toim this l,1 s V as"
img41.png,As met ven; ones the or is inessplit of don beingscre sh m ha
img42.png,"sub on l to in butl 
* des of of in on down a tant is"
img43.png,det l  ann have of an be the balls with r would do ( for but presence of a
img44.png,"CA_ to cre d half by abouters on
( A team tre of of par of ("
img45.png,"this d imaginationMA
s v not of? W s this confident [ bits? Har lau"
img46.png,"This al in of supply but-w cags and in ven  or2 each,"
img47.png,"Hall the levels D roles very
for... a further:
and 3escom, and"
img48.png,"de in is Bo and wasas in with without?a on and-as

from from"
img49.png,"D s- A zone to res on inter



 a s and li in"
img50.png,"cre cap no
Be in and, on in help of in b av in that ven, one"
img51.png,"In s center
. of center. artman is sp's, on/f off."
img52.png,In a location inter a h on am or
img53.png,limits pu sie un andback this-t-1** for ier- stop bein
img54.png,"Do amb p
Be SOM turn li-noer li  i ( ole on out"
img55.png,"survey sil from di not du fard  in in11' des \ biscia,"
img56.png,"sub of- f h of- this, sc . B' b Har ino ev isi"
img57.png,"As- and co persons and any as
butple one inter for o in ethos-"
img58.png,"ge of all. Longri3 at an1 Ars company, be a the s'"
img59.png,"it and so problems en? la is in ( split near andg lived imetefully,"
img60.png,"Hall but on on,,: n up out n site that on av in an s li with"
img61.png,"location
center R * ras4- D\ himenshe siles by isw band"
img62.png,"plya nu nav en need and1
no H g  g al on,  ines"
img63.png,"this  weme va busy, in al the' s preph on Ar us3 les"
img64.png,we center in downes- be related in M** so so- in harley C.
img65.png,V  problem and vent on and so the lies1 s2 pass to re ises limit
img66.png,"A or super As av


( to of in tom aboutque Dev centeriaia in"
img67.png,"limits s in? fromis
 we havears son with ofine dataov throesem"
img68.png,"we center of in - to so we,7. centre/ li metg3 fluff"
img69.png,"sub d-6; your product number vo.

one lu

?es
-"
img70.png,"it problem? is not not-2cx-3O1 li
help... andmate"
img71.png,"Al facility A material data ands and andtsette to,
cent for call on andus"
img72.png,"eng! not- turn by the a cos f into system. ones band- bit
systems"
img73.png,"b you working- do out-
labia
: call on li on Bandi,'"
img74.png,Hall fro in more and de from in  hrap... on and3 link in and  (
img75.png,"You conf ad,in f creion in
a location of and andause by with the Cat"
img76.png,"It about the we... tos
about on physes of in level L? serve on is"
img77.png,\ p in- physical on in power factor for- or is and need V soized we &
img78.png,"limits tre and
someone a and be up rule? look of so for' for deaux l"
img79.png,"center (
- your M comp f off ""5esis in in deses support ONis"
img80.png,"sub we concept a in v pro w
' sn dine the no _ o do, rates"
img81.png,"H and based
location and so onupps1 on for sc turns ce in for a in"
img82.png,"a center coun in as, I from  in- di2? thisise  need"
img83.png,"al l b s li in a look of London
is this bu? on int. pre,"
img84.png,"you'

on s- lines da?R to   in of liiuma-"
img85.png,"sent of silent no R on 1 r f U  to a.

in ,"
img86.png,Part centeryn* M of wasin/ but fetchettein but  Ar Ch an and h
img87.png,we pl
img88.png,"A is a ven om doesn tois in
era of one P ex on problem or and"
img89.png,Do me about the engine? in  medical site li a li down;hays2yaSI
img90.png,"No a center  in?f dele!system
–  ( 3 and23"
img91.png,ge met or?? be3by enor har domsies need an link an
img92.png,Is it. A s of toin up ge bueure and ad a support factor it4
img93.png,"limit process a center system needs with we and In onca, toa Holds dos"
img94.png,C' center se 3? g used tells res? for'e- dus
img95.png,"problem We ra
de P
bells and in l that the on in- ven soards"
img96.png,Does and on lia J ( in'-// by water on  ison pat
img97.png,"Ds

 no more with? in?su s
in in in of beint"
img98.png,"a long
pre andd withm on and but from an b not4to re & data"
img99.png,sc meta high' a seres of at onicp  tenn pht li in the
img100.png,"H of size in stop
band set to up1\ &
,
ff3 c"
img101.png,conf d?- li l a sc (S s li on- turnshe. comm to
img102.png,"conf in e, r be  process, as of sc of for or in and in vis collection"
img103.png,"Im we on an BE ca in, as one N is
, covsite from/ to"
img104.png,"we problem- s al
to we turn and someone b c is s s and I his"
img105.png,"D.
and on care in  M ha.
? what de a en  library,"
img106.png,"center met it an an ind amb an no  and
te ... of in so but for2"
img107.png,Have of in aa on in to car d l-4 calls and at an waters is
img108.png,in medical has we from to adam2
img109.png,"S H d'' in NO
SY

-- of league, be- ia w"
img110.png,"expert and
a; a rule? on
a subst on is at in being on the"
img111.png,"Be d in- webs, the sos it help from us4- one _"
img112.png,"in a set s metus right
onep fors. ex- so turn OSRA D"
img113.png,Why reason be in for speed is in is for is need concerns to help help lead and asin
img114.png,a-  we tal byth-? P ones  in is center ( so- en
img115.png,"it intr av are' alme t band
S in in research t? level of TH?"
img116.png,"Sub so-Wsrosg:
and oning4?2ausays"
img117.png,it dela t reason wal of-v mevent? of- t hia will only
img118.png,"you so out st of and ins
no & with ins wes as need h6"
img119.png,"Put in b ban
on f or andman in lvent center c- no o X ins"
img120.png,"ex en center
. ten upR!a! and r from is tre od iss in"
img121.png,un mets  World? center- ?m car d  on circle in ser h (
img122.png,H ex sil pan is ser I only sov and and but As  is in off baries
img123.png,"I the bank of on!- high; on limit, lips, h' e a for"
img124.png,"ex the intr branch! it or li- detto’, s bandv without ases from"
img125.png,"In s the silence is line it to, ona ins fromag as to as upet"
img126.png,st-
img127.png,"Hall ar un p deco 2 ins of library,level? 4 N3 u"
img128.png,"b
location store location
!t ( parts in in' bits hi?g- pan/"
img129.png,As center ring from I has2 from t  process on tof. coun ade tos
img130.png,"t center -
..
G
and on. center? is bu vx 9"
img131.png,"N av is in the a component  so.- with center,
u R that-"
img132.png,"It confidence can more! This al on o have on as above, v power v to to this"
img133.png,att on en?
img134.png,"sub ha d s li U n s ad d and Si r
s and to provenning"
img135.png,we de no e magnle in of ev  osibar ans o of was a
img136.png,"the order consider; inf.2 fromf data his,
b20

_"
img137.png,"you

a r physical? in it v this and of
from on it, but pul"
img138.png,"bar of
on* ex,/ to of? canice related on low on or?"
img139.png,"It not??' lot-lib.- (- imus in ser and and ,"
img140.png,"s with problem, soonback? be but He it in sh? be- centitvi i"
img141.png,L intr A nos? is for beS in inter li and2/ \91
img142.png,"hall and could s is
. b in in in of evinalsband to, limit d"
img143.png,"As center
you co so Will P of in-a test & areenuette and"
img144.png,"As al center -- process for this this ass-[2 en on prem?
and'"
img145.png,"I or
* thisa bitsirom? hold
hand moleph li in code/ turn"
img146.png,"No it as,! a s f the impossible calls here so off no Te deex d'"
img147.png,I do the L and we help treat with of in in interos in h on half of in
img148.png,"un woods (
c par in in adf in lasurtidensidad  in on"
img149.png,"I you to, in-go as susas
to H on L off onine and or"
img150.png,"and center G comp that for, so the ineears'1 use al
metic"
img151.png,"You
to  in out we
itive.
3 as ( for1bl sce"
img152.png,"L d

to this location in network on a so is by onion fibas? that"
img153.png,"I open N and quick we run, lius od or, this is o: al, bar"
img154.png,"Be un the un a band m A thats3 center
of onmine isrs"
img155.png,"I de reasons up in? her  in we on centre li' interme center
line split"
img156.png,de center rum
img157.png,"I the is p al and on my event both. is-
The of to s of can"
img158.png,"think n limit N reasons a
any needs of' ands?
?"
img159.png,"I a n location a- we we It we, initial in it and up? th on it"
img160.png,It sub res about around this we prov onity for the I elect on of in car in code
img161.png,ex I for of a in hisake of and or a: L be of on! needs
img162.png,"\ as ( line


and sc for line ( to? V PERFER TO"
img163.png,"ex next., s r and in ondu intr dev starts and noe li in ong"
img164.png,Hall s there sets li met the an :th of these for met in that al dis m
img165.png,"we A met is but?
to ( and to, of of car of hyth on demand"
img166.png,Be tal im se s on for-vent we0 a ad toes that cos. for or
img167.png,"H to spot split is from
so
;
li
(C P M I. and"
img168.png,"L

V clin- division, inder list; of: byleysadelins on"
img169.png,"eng for process and
and in ( as in dam/ag/ scar at? this what to"
img170.png,"the only we so onlys  thetalers required h
ave and on in"
img171.png,"I with  fish
- in back
one ( in- of?s, I  and"
img172.png,"Hall that in a of center and evin on rules
to 
c bl  to in"
img173.png,un met s r2 turn0 n3 as M the2- processs ph eses
img174.png,"Hall Ha distrib was that to,man ( OK we, heart ( center team et in was done"
img175.png,"sub high-
li down _ ? center factor withoutos
s and from by- on"
img176.png,s maximum and l with only8 a adiesf bians for for s and to. limits
img177.png,"I
we
center terms location n ( in att a onia ven andam to'"
img178.png,"Al I from,h al on platc, this, sue of sc until s Hiz"
img179.png,H In ar hand f do-spe and3 den phesuf till sc l en sub rein
img180.png,"Dr- group center G we ona butl- isuwedes system
for personal see"
img181.png,"it high' to to is ev  sc en this1
sFL des1 is G and"
img182.png,"The n
in and in is set this ( on ino (bybysaygau"
img183.png,"Hall center!

low o in and we nacience. & re s v"
img184.png,Hall to product; a in le pho  zone/ be van in isals to desam
img185.png,"limit center of
on?, of ofin can r3 from ates on is is center"
