img161.png,eye. anni et Fr,"eye, side, eyes, terra, Buen, ET, Comput, Admin, рон, Opt","0.006461656652390957, 0.004423713311553001, 0.004389287903904915, 0.0036388474982231855, 0.0031738588586449623, 0.0025803290773183107, 0.002405131235718727, 0.0023039747029542923, 0.0022949923295527697, 0.002172855194658041"
img162.png,ere Beachtesih Hall,"ere, eyes, span, ieben, etti, Opt, reality, Opt, forever, fun","0.007743645925074816, 0.006270995829254389, 0.005845210514962673, 0.00455225445330143, 0.0044816783629357815, 0.0033697595354169607, 0.0031043682247400284, 0.0030088566709309816, 0.0023895171470940113, 0.002209942089393735"
img163.png,ieben impossibleende dedicated Vor,"ieben, Channel, hands, expos, bec, appen, Contents, sid, Comput, impossible","0.005896160379052162, 0.005389526952058077, 0.004907220136374235, 0.004381654318422079, 0.004213795997202396, 0.004068228416144848, 0.003912376705557108, 0.003661009483039379, 0.0033203912898898125, 0.0026164052542299032"
img164.png,handsssemeatorirome,"hands, hop, An, surprise, etti, beat, Ron, span, unnel, section","0.008051161654293537, 0.004605368245393038, 0.004551714286208153, 0.003970075864344835, 0.0034627618733793497, 0.002870730357244611, 0.0028152051381766796, 0.0027073565870523453, 0.002583377528935671, 0.0024650762788951397"
img165.png,sideoriori pat span,"side, Ny, ny, n, hop, fun, Buen, ут, hall, side","0.0077879708260297775, 0.0054795220494270325, 0.005352588836103678, 0.0040245940908789635, 0.003469417104497552, 0.0029675497207790613, 0.002723176497966051, 0.002608643379062414, 0.002598473336547613, 0.0025782519951462746"
img166.png,hopisterrozigny Buen,"hop, сь, compile, side, ieben, contents, everywhere, reality, ettings, бу","0.005481115076690912, 0.003538873977959156, 0.002956839744001627, 0.0027560777962207794, 0.0026298677548766136, 0.0025589317083358765, 0.0025390179362148046, 0.002275960985571146, 0.0022406752686947584, 0.002214570762589574"
img167.png,sideausella. death,"side, Admin, friend, Admin, n, core, An, Channel, prime, fun","0.008938753977417946, 0.004898033104836941, 0.004601276014000177, 0.003935679793357849, 0.003920336253941059, 0.003275563707575202, 0.003224780783057213, 0.0029708067886531353, 0.002959225093945861, 0.002747547347098589"
img168.png,edo main nucle aria Juan,"edo, upload, ere, Opt, appen, rio, optim, anni, зан, mac","0.005280033219605684, 0.0025833542458713055, 0.002494111191481352, 0.0024843874853104353, 0.0022444569040089846, 0.0021084723994135857, 0.002100252080708742, 0.0019884787034243345, 0.001868002931587398, 0.0018534660339355469"
img169.png,etti inclivi eventually wide,"etti, sil, Comput, racy, Fil, Lu, Buen, Comput, side, appen","0.01172903086990118, 0.004889387171715498, 0.004281290806829929, 0.0035493148025125265, 0.003453577868640423, 0.0031445184722542763, 0.003120047738775611, 0.003000520635396242, 0.0028743227012455463, 0.002679163357242942"
img170.png,sections ere devotedстаonn,"sections, Lu, reality, ieben, refix, side, reload, appen, ут, surprise","0.004947875160723925, 0.003929410595446825, 0.003883631434291601, 0.0035638208501040936, 0.0029893380124121904, 0.0029893380124121904, 0.0028082230128347874, 0.002638081554323435, 0.002458962146192789, 0.0024398264940828085"
img171.png,span Buen Buenero tempt,"span, side, span, reality, ere, anni, bed, Opt, compile, rown","0.009380532428622246, 0.005667398683726788, 0.003630672115832567, 0.003267250955104828, 0.002418549032881856, 0.0022021138574928045, 0.002109495922923088, 0.002068694680929184, 0.001898340880870819, 0.0018327616853639483"
img172.png,hands ere ravairo happ,"hands, igny, Opt, ieben, reality, estaven, Opt, side, composition, developers","0.007127118296921253, 0.005464551504701376, 0.005275776144117117, 0.004029307514429092, 0.003583740210160613, 0.0034062969498336315, 0.0032250171061605215, 0.003041480900719762, 0.002705149119719863, 0.002350274473428726"
img173.png,ere Vice. Opt ende,"ere, sul, fun, silent, 영, line, Fil, anni, sil, ari","0.026001065969467163, 0.0078069353476166725, 0.005962449125945568, 0.004981812555342913, 0.004735145717859268, 0.004050184972584248, 0.003166632726788521, 0.003045320976525545, 0.0030334482435137033, 0.0027619863394647837"
img174.png,ere tri Martchoroup,"ere, fun, anni, n, division, An, рон, col, reality, side","0.008945702575147152, 0.006858908571302891, 0.005137084983289242, 0.003877675160765648, 0.003877675160765648, 0.0034623744431883097, 0.0033167514484375715, 0.0032781101763248444, 0.002915611257776618, 0.0027389635797590017"
img175.png,erekarNB Buen ere,"ere, beat, Kol, An, acon, instructions, Seg, Tamb, Buen, span","0.006043415050953627, 0.003694265615195036, 0.0034840244334191084, 0.00336366705596447, 0.002865880262106657, 0.002854707185178995, 0.0027239806950092316, 0.0026505058631300926, 0.0026505058631300926, 0.0025291303172707558"
img176.png,sideih ereiesen hop,"side, ere, side, fun, bu, compile, бу, hop, Buen, 영","0.01498076319694519, 0.012226942926645279, 0.004658987279981375, 0.0034085880033671856, 0.003355742897838354, 0.002949886955320835, 0.002706968691200018, 0.002417051000520587, 0.00209178333170712, 0.002075504744425416"
img177.png,Contents shock CHAPTER York span,"Contents, eyes, Ny, eye, Lista, surprise, contents, ieben, estaven, Хронологија","0.008992518298327923, 0.007455059792846441, 0.0040374440141022205, 0.0038375358562916517, 0.00363330589607358, 0.0035353039857000113, 0.003426533890888095, 0.0031198945362120867, 0.002988675609230995, 0.0028967242687940598"
img178.png,ieben Buen Vor Buenppa,"ieben, eyes, eye, fun, eman, administrator, atti, surprise, an, рон","0.011622459627687931, 0.00595940463244915, 0.005097349174320698, 0.0038476812187582254, 0.0032654842361807823, 0.002707181964069605, 0.0025037338491529226, 0.002342870458960533, 0.0020434882026165724, 0.0019806164782494307"
img179.png,hop Buen Buenare wide,"hop, atti, influen, fun, Buen, ieben, Herm, ma, eman, Medicine","0.004674711264669895, 0.004174047149717808, 0.003982903435826302, 0.002642842009663582, 0.002492437371984124, 0.0024252082221210003, 0.0021570248063653708, 0.0021235833410173655, 0.0021153041161596775, 0.001956336433067918"
img180.png,eyesSSattirefix Gran,"eyes, side, eye, An, pi, isan, appen, fun, Kant, ュ","0.010054117068648338, 0.008078710176050663, 0.006697486620396376, 0.006242743693292141, 0.0030663323123008013, 0.0028028548695147038, 0.0027810425963252783, 0.002706028986722231, 0.002684970386326313, 0.0025720444973558187"
img181.png,ieben entettidedping,"ieben, eye, eyes, An, instructions, administrator, Contents, reality, Admin, refix","0.011502359062433243, 0.0044868276454508305, 0.0038528076838701963, 0.0032954809721559286, 0.003257087431848049, 0.0031816367991268635, 0.0030958179850131273, 0.002546550240367651, 0.002373645780608058, 0.0021612292621284723"
img182.png,Festival ereey maiju,"Festival, side, ired, ixed, ere, ice, orem, ieben, uda, festival","0.005586347542703152, 0.0055428738705813885, 0.0046312445774674416, 0.004436460789293051, 0.004283201415091753, 0.0032968975137919188, 0.0032712409738451242, 0.002966886619105935, 0.0025179642252624035, 0.00249836896546185"
img183.png,DS destocker Negivi,"DS, Contents, Opt, etti, ут, administrator, Lat, Admin, ere, Opt","0.004222895484417677, 0.003500903258100152, 0.0033275617752224207, 0.003077491419389844, 0.002936562756076455, 0.0023321041371673346, 0.002278081141412258, 0.0022691998165100813, 0.0022079921327531338, 0.00190340809058398"
img184.png,sil Juan eyeurst sed,"sil, fun, eye, Sil, alive, etti, Opt, appen, cope, ieben","0.018366845324635506, 0.005870396737009287, 0.005324218422174454, 0.005282784812152386, 0.0050804042257368565, 0.004810030106455088, 0.004680288024246693, 0.004050451796501875, 0.0033579424489289522, 0.0032546292059123516"
img185.png,ere Wassikon IntegrIntegr,"ere, ieben, side, sil, mac, fun, compile, eye, surprise, incl","0.004634244833141565, 0.004236042965203524, 0.003609153674915433, 0.0035118027590215206, 0.0030991551466286182, 0.002992093563079834, 0.002911386778578162, 0.0027243320364505053, 0.002197630237787962, 0.0020888180006295443"
