Image File,Inference Result,Top 10 Words,Top 10 Probabilities
img1.png,beat legend Buen Buen Buen,"beat, An, Sil, igny, legend, ro, force, reality, hands, ice","0.009052645415067673, 0.004411906935274601, 0.003773704171180725, 0.0036008937750011683, 0.003586855251342058, 0.0032404535450041294, 0.0030204348731786013, 0.0025936265010386705, 0.0025835148990154266, 0.002455596113577485"
img2.png,diseaseedo Boargeteme,"disease, etti, sections, Lu, ere, eyes, An, warn, ieben, refix","0.008517862297594547, 0.007908566854894161, 0.007695247419178486, 0.006556432228535414, 0.004200208466500044, 0.003721178276464343, 0.0031458106823265553, 0.002898056758567691, 0.002733127446845174, 0.002711858134716749"
img3.png,ereaju ere fixedetti,"ere, division, legend, ended, Opt, ired, <0xB8>, n, Opt, Ari","0.018851689994335175, 0.004239371977746487, 0.0031875697895884514, 0.0030894987285137177, 0.0030179305467754602, 0.002642588224261999, 0.0025914758443832397, 0.002492198022082448, 0.002463163109496236, 0.0023688008077442646"
img4.png,ere ext Vor eye bef,"ere, Engineering, An, eye, side, span, ут, ieben, 鉄, heart","0.007837217301130295, 0.00705273263156414, 0.006943390239030123, 0.005962240509688854, 0.0034506800584495068, 0.003318486735224724, 0.0024564757477492094, 0.0024564757477492094, 0.002380897756665945, 0.0021848345641046762"
img5.png,Contents Pav Opt Buen Buen,"Contents, ere, side, atti, administrator, ieben, aterra, 영, friend, expos","0.00568148959428072, 0.00552824093028903, 0.003419180866330862, 0.0027366778813302517, 0.0026942496187984943, 0.002652479102835059, 0.00260117556899786, 0.0025113169103860855, 0.002322588348761201, 0.0022336114197969437"
img6.png,Anende ereocker Sr,"An, Ron, legend, бу, Contents, Channel, creature, n, span, bed","0.004250215366482735, 0.003900216892361641, 0.003593048080801964, 0.0031832640524953604, 0.0031339123379439116, 0.0030613155104219913, 0.002712175017222762, 0.0026493475306779146, 0.002274976344779134, 0.002266107127070427"
img7.png,reality ereocker quietimo,"reality, eyes, sense, sil, Ron, Sil, anni, ron, An, ieben","0.005531356204301119, 0.0036134098190814257, 0.003571311943233013, 0.0029723094776272774, 0.00294917868450284, 0.0027596959844231606, 0.0024641312193125486, 0.0023790067061781883, 0.002351290313526988, 0.0023421235382556915"
img8.png,ere Vortes attitudeoup,"ere, ieben, sd, sil, NR, sil, Channel, anni, Ny, eyes","0.02421261928975582, 0.008942187763750553, 0.0058644297532737255, 0.0046755303628742695, 0.0035708777140825987, 0.0033284241799265146, 0.0031024322379380465, 0.0030424261931329966, 0.00277016032487154, 0.0022965436801314354"
img9.png,legendss gla Buenovis,"legend, sections, surprise, Channel, boot, Boot, eye, section, се, content","0.008189454674720764, 0.00671019870787859, 0.005807192530483007, 0.005266895517706871, 0.004281955771148205, 0.0036912765353918076, 0.0032448400743305683, 0.0031205322593450546, 0.002863561036065221, 0.002863561036065221"
img10.png,ere ViceŻtestes,"ere, 영, reen, Library, An, atti, ET, sd, refix, gre","0.014821833930909634, 0.008645500056445599, 0.0049453373067080975, 0.0036464629229158163, 0.0030586582142859697, 0.002918591955676675, 0.0027958401478827, 0.0025556047912687063, 0.0022553130984306335, 0.002237762324512005"
img11.png,Bootcha Language administrationenberg,"Boot, sil, Engineering, Sil, ieben, sections, An, surprise, ri, anni","0.005420977715402842, 0.005152566824108362, 0.004859332926571369, 0.004840388428419828, 0.004205402452498674, 0.004107984248548746, 0.003472808748483658, 0.003300857963040471, 0.0026523140259087086, 0.0024149594828486443"
img12.png,sideuv eyeendeargent,"side, ari, ere, Kan, anni, eye, surprise, i, An, Lu","0.0046967011876404285, 0.0038183911237865686, 0.003773905336856842, 0.0036864825524389744, 0.0035591316409409046, 0.003140922635793686, 0.0029391206335276365, 0.002837587147951126, 0.002728880848735571, 0.002583652501925826"
img13.png,ere Vorcgiih Buen,"ere, appen, Buen, ieben, fun, Contents, Comput, Opt, рон, side","0.013784713111817837, 0.012356536462903023, 0.008426426909863949, 0.005569527391344309, 0.005051342770457268, 0.00340458401478827, 0.003351800609380007, 0.0030045348685234785, 0.0029007415287196636, 0.0026206017937511206"
img14.png,sidestalrozhn dest,"side, ieben, Opt, An, hands, administrator, reality, compile, span, Community","0.00537751242518425, 0.0035962157417088747, 0.0034992138389497995, 0.003418154548853636, 0.003261625999584794, 0.0031985407695174217, 0.0031489518005400896, 0.0026829405687749386, 0.0025007755029946566, 0.0024910259526222944"
img15.png,hands ereocker et et,"hands, Ari, ieben, span, anni, An, beat, reality, compile, forever","0.007412781473249197, 0.006828974466770887, 0.004602700937539339, 0.004461090546101332, 0.004290188662707806, 0.004273463040590286, 0.0037566146347671747, 0.0035706120543181896, 0.0032384044025093317, 0.003030338790267706"
img16.png,hands bruurst fra◄,"hands, legend, beat, etti, surprise, aden, eben, span, reality, ro","0.0035691310185939074, 0.0035413557197898626, 0.003199348459020257, 0.0031374674290418625, 0.0030290824361145496, 0.0029016833286732435, 0.0028791017830371857, 0.0028014429844915867, 0.002715251874178648, 0.0023224777542054653"
img17.png,happyedoockerausri,"happy, hands, anni, ieben, etti, An, Kan, span, ere, Eb","0.004713105037808418, 0.004532549064606428, 0.0038317276630550623, 0.0036849360913038254, 0.003054919419810176, 0.002926433691754937, 0.0024836319498717785, 0.00245469668880105, 0.0024072187952697277, 0.0023884852416813374"
img18.png,spanedoded metalubre,"span, surprise, ere, Channel, An, ieben, anni, disease, Lat, compile","0.007443858776241541, 0.006884443573653698, 0.0061231511645019054, 0.004731604363769293, 0.004568148870021105, 0.004462327808141708, 0.004110889043658972, 0.0032015638425946236, 0.002858674619346857, 0.002858674619346857"
img19.png,iebenurst stampodelange,"ieben, sil, ут, anni, ere, hop, dra, An, hands, forever","0.01454604510217905, 0.00537213496863842, 0.005007380153983831, 0.003930337727069855, 0.0034147368278354406, 0.0030729304999113083, 0.0030134946573525667, 0.0028419960290193558, 0.0028088856488466263, 0.002711851615458727"
img20.png,An hallome vol鉄,"An, reality, sil, side, ere, ma, span, Ron, fun, Sil","0.009698141366243362, 0.007123082410544157, 0.006796892732381821, 0.004819718189537525, 0.004744995851069689, 0.003652353538200259, 0.0032996265217661858, 0.0030516553670167923, 0.002934748539701104, 0.002923307241871953"
img21.png,beat nervyd erecker,"beat, side, side, ere, Submit, submission, iding, eyes, digit, ettings","0.004370768088847399, 0.0038571893237531185, 0.003172837430611253, 0.002866419730708003, 0.002703291131183505, 0.0023763454519212246, 0.0022498785983771086, 0.002197760157287121, 0.0020405512768775225, 0.0018872014479711652"
img22.png,reality fr BuenDL alive,"reality, бу, side, happy, An, silent, ieben, hop, Sil, bed","0.005184920504689217, 0.004332163371145725, 0.0036910492926836014, 0.003662325209006667, 0.003662325209006667, 0.003453901968896389, 0.0031694783829152584, 0.003108175005763769, 0.0027216090820729733, 0.00266896840184927"
img23.png,eye lidetti aptreh,"eye, hop, span, Division, sections, fun, instruct, amin, 영, hands","0.006617501378059387, 0.005978414323180914, 0.005839924328029156, 0.004495150409638882, 0.003237735480070114, 0.002971113193780184, 0.0027585849165916443, 0.002694682450965047, 0.002673712093383074, 0.002642562612891197"
img24.png,Ron JuanSStotype Rena,"Ron, ro, side, beat, hop, ут, ma, An, heart, ere","0.007112469989806414, 0.004164904356002808, 0.004021026194095612, 0.00334659474901855, 0.0031684923451393843, 0.003156139515340328, 0.0028736977837979794, 0.002742101438343525, 0.00255591981112957, 0.0025162938982248306"
img25.png,Anende Buen pulrefix,"An, sil, wherever, ere, Buen, бу, Oper, beat, etti, bed","0.006638501770794392, 0.005997386761009693, 0.004725826904177666, 0.004026454873383045, 0.0034440094605088234, 0.0033120715525001287, 0.0032480102963745594, 0.0031235809437930584, 0.002671740483492613, 0.0026200641877949238"
img26.png,ereponangezi et,"ere, silence, reality, бу, ✓, happy, instruct, instructions, core, Boot","0.005270431749522686, 0.004742875229567289, 0.004072674084454775, 0.003931981511414051, 0.0033895804081112146, 0.0027557092253118753, 0.0026398077607154846, 0.0026090529281646013, 0.0025189220905303955, 0.0023570829071104527"
img27.png,rareorioiredrost j,"rare, span, surprise, Lat, ere, compile, anni, bord, Tamb, bed","0.005982156842947006, 0.0038173727225512266, 0.0037289434112608433, 0.002892782213166356, 0.002870270051062107, 0.0027928496710956097, 0.002562863053753972, 0.002217972883954644, 0.0021330039016902447, 0.002051289426162839"
img28.png,ere repeating etorem et,"ere, ieben, eyes, hands, reality, Ny, Comput, etti, middle, Opt","0.005688398610800505, 0.00397114222869277, 0.0039095752872526646, 0.0038041211664676666, 0.0028049831744283438, 0.0024465499445796013, 0.001973551930859685, 0.001965858042240143, 0.0019128323765471578, 0.0018252371810376644"
img29.png,eye anni Optoup alive,"eye, incl, ere, Opt, An, refix, Sil, digit, fun, anni","0.005375088192522526, 0.0048749931156635284, 0.004669957794249058, 0.004025754984468222, 0.003737787017598748, 0.0034840006846934557, 0.002799473237246275, 0.002640154678374529, 0.002640154678374529, 0.002489903010427952"
img30.png,dern� death Festival ere,"dern, reality, anni, Ron, ieben, DS, бу, expos, Opt, Ny","0.009183482266962528, 0.0066664936020970345, 0.0037104624789208174, 0.0034182381350547075, 0.00331307016313076, 0.0030048240441828966, 0.0026106364093720913, 0.002462064614519477, 0.002105915453284979, 0.0020895269699394703"
img31.png,spanedodedella fixed,"span, рон, sections, appen, edo, ron, 영, Channel, surprise, atti","0.008749555796384811, 0.008251617662608624, 0.0066045112907886505, 0.006204363889992237, 0.005561556201428175, 0.005561556201428175, 0.004831963684409857, 0.004521512892097235, 0.00445141363888979, 0.0042475685477256775"
img32.png,An silentebenensoatori,"An, etti, бу, eye, span, reality, oon, Nur, hop, length","0.010653958655893803, 0.005233048461377621, 0.004028021357953548, 0.003858608193695545, 0.0035270533990114927, 0.0029933711048215628, 0.002889963798224926, 0.0028451590333133936, 0.0028451590333133936, 0.002779251430183649"
img33.png,sideuv ere Juan Mey,"side, An, reality, format, silence, Ron, Dur, Opt, Buen, side","0.004517281427979469, 0.00432729022577405, 0.003909381106495857, 0.003658205969259143, 0.003545654471963644, 0.00343656656332314, 0.003317848779261112, 0.0032536759972572327, 0.003068508580327034, 0.0029394507873803377"
img34.png,hopdra Buen volrp,"hop, rij, sections, atti, Boot, compile, eye, divis, etti, division","0.0093272989615798, 0.00570166390389204, 0.004915141500532627, 0.0041877529583871365, 0.003652622690424323, 0.0032870047725737095, 0.0029007713310420513, 0.0026308854576200247, 0.0025599217042326927, 0.002349116373807192"
img35.png,eyeseenvid Buen fr,"eye, compile, eyes, Village, impossible, anni, An, Library, ieben, E","0.017027385532855988, 0.0050332858227193356, 0.004156472627073526, 0.003814193420112133, 0.0034324026200920343, 0.0032497334759682417, 0.0030172751285135746, 0.0029589158948510885, 0.002856699051335454, 0.0026523552369326353"
img36.png,impossible bed pioneihhn,"impossible, ettings, fun, Buen, eye, Rena, anni, ere, Bian, Vid","0.00821265671402216, 0.006296862382441759, 0.004643015097826719, 0.00374536938033998, 0.003615983761847019, 0.002729487605392933, 0.002594341291114688, 0.0023900193627923727, 0.0022540029603987932, 0.0020522931590676308"
img37.png,ere Geme flower pel Nem,"ere, side, friend, ired, ettings, col, Fil, ma, Perm, Festival","0.033467307686805725, 0.007266141474246979, 0.005571143701672554, 0.003997100051492453, 0.003682300914078951, 0.0033790695015341043, 0.002982018282637, 0.0028790028300136328, 0.00265226187184453, 0.0023223981261253357"
img38.png,silri hastedoorem,"sil, eye, side, ere, instructions, 영, ice, ny, influen, racy","0.007376312743872404, 0.00643373467028141, 0.004302565474063158, 0.004302565474063158, 0.0037674519699066877, 0.0034036091528832912, 0.0034036091528832912, 0.003273218870162964, 0.003074904438108206, 0.0030036745592951775"
img39.png,ereleur Cup Kan coron,"ere, ieben, bed, sd, hands, behave, viol, span, reality, An","0.014789608307182789, 0.009111613035202026, 0.005314757116138935, 0.00365277542732656, 0.0033389071468263865, 0.0033129234798252583, 0.0032488456927239895, 0.0028447844088077545, 0.002590205753222108, 0.0023862093221396208"
img40.png,spanodocov Buenema,"span, reality, compile, happy, fun, anni, surprise, An, eye, rare","0.008357604965567589, 0.006458256859332323, 0.006407998502254486, 0.0062351529486477375, 0.006019757594913244, 0.005250525660812855, 0.004025717731565237, 0.0031108336988836527, 0.002777661429718137, 0.0027027390897274017"
img41.png,erepon Pav erecope,"ere, Ron, grace, 영, span, eye, **, compile, Vi, aria","0.007274609990417957, 0.006520918104797602, 0.004326933063566685, 0.0042932601645588875, 0.003278923686593771, 0.0030802637338638306, 0.003008909523487091, 0.002665746258571744, 0.002593842102214694, 0.002352512674406171"
img42.png,sideuv Nur鉄 impossible,"side, span, anni, Ny, side, eh, бу, Side, Social, so","0.008088554255664349, 0.004484407138079405, 0.004115123301744461, 0.003192366799339652, 0.0029180594719946384, 0.0027953297831118107, 0.0026777617167681456, 0.0025953755248337984, 0.002061146777123213, 0.001884040771983564"
img43.png,fun cha Buen Huralo,"fun, rare, eye, ere, бу, ieben, 영, an, Lu, Kan","0.0043870811350643635, 0.0030269951093941927, 0.0026094329077750444, 0.002470561536028981, 0.0022232644259929657, 0.0021131832618266344, 0.0020561835262924433, 0.0019851517863571644, 0.0019240750698372722, 0.0019240750698372722"
img44.png,Beauri impossiblepossuda,"Beau, odo, ri, Ron, eden, rio, ere, cup, aus, subm","0.006588401272892952, 0.0054619768634438515, 0.004839043132960796, 0.004220688249915838, 0.0037247443106025457, 0.003638460533693433, 0.0035680863074958324, 0.0034990734420716763, 0.0032614951487630606, 0.003051946172490716"
img45.png,reality ereocker et impossible,"reality, ieben, 영, appen, ere, Contents, anni, eyes, Ron, icon","0.013471424579620361, 0.010740355588495731, 0.003541793441399932, 0.003314235480502248, 0.003113436046987772, 0.0025312055367976427, 0.0024919630959630013, 0.0024342366959899664, 0.002387154148891568, 0.0022689581383019686"
img46.png,anni Vorтон handseses,"anni, ieben, zi, ere, animate, hands, hop, princip, appen, administrator","0.0034129717387259007, 0.0032187390606850386, 0.002546231960877776, 0.0025165677070617676, 0.0022035802248865366, 0.0021949894726276398, 0.002186431782320142, 0.0021525342017412186, 0.0021274564787745476, 0.002110900357365608"
img47.png,Anende Bib driv et,"An, ere, sections, eyes, eye, bed, digit, Bed, fun, Browser","0.006567083764821291, 0.005705581046640873, 0.0043236552737653255, 0.003830546047538519, 0.003598464885726571, 0.0034606100525707006, 0.003225642954930663, 0.003175634192302823, 0.003053977619856596, 0.003053977619856596"
img48.png,An Hoff et Juan Buen,"An, appen, eye, etti, ieben, fun, eyes, an, alive, impossible","0.006887610536068678, 0.006174013949930668, 0.0060782949440181255, 0.0056435056030750275, 0.004606095142662525, 0.003955222200602293, 0.0030563585460186005, 0.002997243544086814, 0.0028824207838624716, 0.002739702118560672"
img49.png,compile Buenocker Buen Cha,"compile, impossible, ere, del, side, Opt, refix, ettings, Sil, Fil","0.00520473625510931, 0.004382827784866095, 0.003549321787431836, 0.003321280237287283, 0.0030358959920704365, 0.002931019524112344, 0.0028855782002210617, 0.002829766133800149, 0.0028077445458620787, 0.002637631958350539"
img50.png,ieben nestijuiju else,"ieben, ettings, side, ere, dorf, sd, behave, refix, ут, appen","0.012768646702170372, 0.005666052922606468, 0.005039491690695286, 0.004447335377335548, 0.003848848631605506, 0.003730431664735079, 0.003658278612419963, 0.0032032958697527647, 0.0027939644642174244, 0.0027399242389947176"
img51.png,silyrelenangeidentifier,"sil, ere, Buen, fun, expos, legend, hop, ieben, An, n","0.009627616964280605, 0.009009048342704773, 0.005839444696903229, 0.004583432804793119, 0.003997740801423788, 0.003889908781275153, 0.0026115612126886845, 0.0025912378914654255, 0.002501722425222397, 0.0023778534960001707"
img52.png,sectionsoupittingProtocolEP,"sections, eye, side, reality, surprise, anni, sex, eyes, appen, side","0.009437580592930317, 0.005012261215597391, 0.004992720205336809, 0.004545923788100481, 0.0029696663841605186, 0.0025104975793510675, 0.002471575513482094, 0.002442781114950776, 0.00234919972717762, 0.0023037621285766363"
img53.png,ieben sensepio Adolfходи,"ieben, An, Comput, Opt, Ron, sections, reality, Ari, рон, Division","0.006804348900914192, 0.006292994134128094, 0.005446133203804493, 0.004159415606409311, 0.004031443502753973, 0.0034889234229922295, 0.00300764013081789, 0.002836474683135748, 0.002613082993775606, 0.0025826396886259317"
img54.png,iebenategory Bianykobi,"ieben, reality, side, legend, eyes, eye, 영, Lu, anni, mid","0.06988951563835144, 0.008781936019659042, 0.005452828016132116, 0.005264457780867815, 0.004719029646366835, 0.0044158343225717545, 0.0027850321494042873, 0.0024770586751401424, 0.002391487592831254, 0.002326981397345662"
img55.png,realityokal dol Buenront,"reality, viol, Medicine, sil, ere, format, format, legend, load, hop","0.006725936196744442, 0.00548954913392663, 0.0046407561749219894, 0.0037876751739531755, 0.002949844114482403, 0.0028927891980856657, 0.0028815113473683596, 0.002696376061066985, 0.0024937400594353676, 0.0024840179830789566"
img56.png,eyes Beau delurst worst,"eyes, eye, ere, side, reen, hands, anni, sil, се, odo","0.008126329630613327, 0.004232384730130434, 0.004199447575956583, 0.004150523338466883, 0.004038569517433643, 0.0035640252754092216, 0.0031823161989450455, 0.0031823161989450455, 0.003120764857158065, 0.003060403745621443"
img57.png,ieben Buen Vor Juanani,"ieben, tre, reality, An, an, SM, Buen, бу, fun, hop","0.01234429981559515, 0.004418722819536924, 0.0038995088543742895, 0.0032328064553439617, 0.003157918807119131, 0.0031456071883440018, 0.0029898574575781822, 0.0029898574575781822, 0.002932028379291296, 0.0029092109762132168"
img58.png,ereibile await Neilhostname,"ere, Ny, Comput, Opt, ny, fun, mas, Ocean, span, etti","0.015691708773374557, 0.006515775807201862, 0.0036981028970330954, 0.0032763376366347075, 0.00308988057076931, 0.002971509238705039, 0.002902674488723278, 0.0027697512414306402, 0.002663643565028906, 0.002512055216357112"
img59.png,ere Juan viceieben Buen,"ere, sil, side, s, viol, eye, An, ron, Islands, sd","0.043542832136154175, 0.004698214586824179, 0.004113894421607256, 0.003397241933271289, 0.00331854447722435, 0.003105330280959606, 0.002928605303168297, 0.0026874393224716187, 0.0026769619435071945, 0.002604755572974682"
img60.png,BuenDL fateih Cher,"Buen, eye, sd, ere, Sil, ieben, reality, beat, wherever, side","0.007758605293929577, 0.004970348905771971, 0.004705831874161959, 0.004234790802001953, 0.0039012718480080366, 0.0031470293179154396, 0.0028878762386739254, 0.002854231745004654, 0.002755630761384964, 0.002744887489825487"
img61.png,side hast Optemeaterra,"side, 영, reality, Andrew, format, ло, expose, cope, sections, span","0.004708436783403158, 0.004653582349419594, 0.004653582349419594, 0.00349901313893497, 0.003351849503815174, 0.002992864465340972, 0.002641193801537156, 0.002641193801537156, 0.0026002456434071064, 0.002490882994607091"
img62.png,ieben Buenodore ereiesen,"ieben, side, Buen, ere, anni, compile, refix, OC, Comput, atori","0.00774230994284153, 0.0056203147396445274, 0.003923611715435982, 0.003832721384242177, 0.003743936773389578, 0.0029849265702068806, 0.0028930900152772665, 0.0027931469958275557, 0.00276060588657856, 0.0027072106022387743"
img63.png,eye happundle­ Opt,"eye, sd, side, ere, ettings, бу, compile, ieben, An, surprise","0.00569186033681035, 0.004115738905966282, 0.0032558171078562737, 0.0032558171078562737, 0.003022924065589905, 0.0029877061024308205, 0.002907118061557412, 0.002709731925278902, 0.002545557450503111, 0.0023542558774352074"
img64.png,reality ereorr Buen Buen,"reality, Buen, ime, side, span, Opt, admin, Opt, administrator, virus","0.005964549258351326, 0.005161887034773827, 0.003881206037476659, 0.0035615949891507626, 0.003046393860131502, 0.002964222338050604, 0.0028284809086471796, 0.002752187428995967, 0.0026675115805119276, 0.0025653208140283823"
img65.png,etti lid Buenurst name,"etti, An, reality, span, hop, hands, Admin, administrator, fun, бу","0.008356759324669838, 0.006767510436475277, 0.006090100388973951, 0.004912685602903366, 0.004597048740833998, 0.004301691427826881, 0.004025310277938843, 0.0035246796905994415, 0.0033111299853771925, 0.003298221156001091"
img66.png,Opt Buenoup Ana Opt,"Opt, anni, Buen, span, OPT, isan, Lat, Opt, appen, Contents","0.0044435178861021996, 0.004323661793023348, 0.0034606154076755047, 0.0032636714167892933, 0.0030066350009292364, 0.002960021374747157, 0.002674156567081809, 0.0026637306436896324, 0.0025616849306970835, 0.002369171241298318"
img67.png,handsP ere destarga,"hands, reality, fingers, ieben, ron, An, skin, compile, appen, etti","0.011956344358623028, 0.006974074523895979, 0.003912101034075022, 0.0034121950156986713, 0.002907226327806711, 0.0028733564540743828, 0.0028398807626217604, 0.0024481303989887238, 0.002363558392971754, 0.002229047939181328"
img68.png,sideuv ere OptOpt,"side, An, fun, ieben, Ron, reality, span, Side, compile, OC","0.008207316510379314, 0.006366945803165436, 0.004585938528180122, 0.004308090545237064, 0.004094782285392284, 0.003846692154183984, 0.0035299232695251703, 0.0030909038614481688, 0.0026959343813359737, 0.0026541377883404493"
img69.png,maaterraToggle Adolfoup,"ma, ere, ieben, pi, boot, fun, incl, inc, ne, Island","0.012254124507308006, 0.0096938107162714, 0.009000398218631744, 0.005879593081772327, 0.005610347259789705, 0.0029912947211414576, 0.0029796326998621225, 0.0029564453288912773, 0.0027773231267929077, 0.0026295168790966272"
img70.png,Contentsfon Pac setupflug,"Contents, surprise, appen, anni, An, Sil, reality, бу, princip, ут","0.008196603506803513, 0.005699843168258667, 0.004990949295461178, 0.004913571756333113, 0.004725336097180843, 0.004652076400816441, 0.004010340664535761, 0.0037969141267240047, 0.0034842442255467176, 0.002922589424997568"
img71.png,appenocrat adj Buenpon,"appen, ere, ieben, sil, loat, Kol, eben, alive, force, viol","0.01180401723831892, 0.0098626259714365, 0.005958663299679756, 0.0047506606206297874, 0.0037875566631555557, 0.0028478519525378942, 0.002836749190464616, 0.0027602326590567827, 0.002572819823399186, 0.002483940217643976"
img72.png,realityidi Maurice free stamp,"reality, ieben, ere, 任, integration, integrate, anni, side, compile, Customer","0.006838157773017883, 0.0033067171461880207, 0.003230117028579116, 0.003180038882419467, 0.0030701830983161926, 0.0024573435075581074, 0.002438220428302884, 0.002272670855745673, 0.0022113698069006205, 0.0020134749356657267"
img73.png,Buen ereTP ereoup,"Buen, side, ieben, unsafe, oper, бу, eyes, ere, refix, prime","0.007112603168934584, 0.004628258757293224, 0.004230571445077658, 0.00418128352612257, 0.003689969889819622, 0.003590439213439822, 0.003281927201896906, 0.0032310455571860075, 0.003107266267761588, 0.002796236891299486"
img74.png,ereos Bueneme rel,"ere, ут, side, refix, shut, span, rio, edo, Opt, eye","0.007592859677970409, 0.0057538230903446674, 0.0042758784256875515, 0.003686037613078952, 0.0034898703452199697, 0.0031282994896173477, 0.00268624909222126, 0.002533374121412635, 0.0024458577390760183, 0.002370606642216444"
img75.png,ieben Buen Vor Wein Buen,"ieben, fun, рон, ron, Ny, disease, ут, core, sil, Sil","0.008089826442301273, 0.00479306373745203, 0.00400475412607193, 0.003346097655594349, 0.0032179104164242744, 0.0030466564930975437, 0.0027416942175477743, 0.002467257436364889, 0.002151980297639966, 0.002143590711057186"
img76.png,sideieder tre hopiras,"side, eye, hop, sil, Rena, silent, anni, Sil, racy, ere","0.010059637017548084, 0.006419321056455374, 0.0045519801788032055, 0.004292926285415888, 0.004226370714604855, 0.0040171085856854916, 0.003517497330904007, 0.00333029986359179, 0.0027075146790593863, 0.0026242132298648357"
img77.png,reality Kamricherih,"reality, side, appen, Ron, beat, etti, 作, Opt, span, ieben","0.023338111117482185, 0.005268820095807314, 0.003607085905969143, 0.003097379580140114, 0.003013832960277796, 0.002628711750730872, 0.0026184632442891598, 0.0025578069034963846, 0.002518151653930545, 0.0024888142943382263"
img78.png,ettioup Buentotypeorem,"etti, An, fun, ri, happy, Contents, del, an, reality, core","0.013419880531728268, 0.013263534754514694, 0.0042227525264024734, 0.004141077399253845, 0.0035282419994473457, 0.0032886832486838102, 0.0032886832486838102, 0.0031750742346048355, 0.0029250155203044415, 0.002591419732198119"
img79.png,An ere ere optimization Попис,"An, fun, ieben, compile, Comput, edo, rare, flu, anni, virus","0.005385351367294788, 0.0043953959830105305, 0.0033832567278295755, 0.003317818744108081, 0.0030925471801310778, 0.0028378809802234173, 0.002815796295180917, 0.002729163272306323, 0.002697367686778307, 0.002563811605796218"
img80.png,iebenella unscompleachi,"ieben, ettings, ere, fun, 영, Side, sil, An, abei, бу","0.009433405473828316, 0.004597474820911884, 0.004073136951774359, 0.0033635846339166164, 0.002723913872614503, 0.0024898587726056576, 0.0024417005479335785, 0.0023208034690469503, 0.0023208034690469503, 0.00229376507923007"
