img81.png,silcher vol joup,"sil, бу, instructions, side, ieben, Sil, Kol, ere, beat, Comput","0.007803684566169977, 0.0037883848417550325, 0.0037296514492481947, 0.003104091389104724, 0.0029388945549726486, 0.0027716418262571096, 0.0027286710683256388, 0.0026968815363943577, 0.0025039692409336567, 0.0024651489220559597"
img82.png,erepon nervövattan,"ere, fun, dorf, ettings, ieben, ker, side, бу, cause, compile","0.011243958957493305, 0.004318031948059797, 0.004152610898017883, 0.004040601197630167, 0.003916285000741482, 0.0033760485239326954, 0.0030500057619065046, 0.0029793528374284506, 0.002766235265880823, 0.0026498909574002028"
img83.png,ere empty administrator sightires,"ere, course, ari, hop, hands, side, DS, beat, igny, eye","0.007859512232244015, 0.00767744705080986, 0.006364827509969473, 0.005256055388599634, 0.005015363451093435, 0.0042731426656246185, 0.003998596221208572, 0.0037563336081802845, 0.0035425599198788404, 0.0032763322815299034"
img84.png,Boot luckUploadrefixanni,"Boot, ут, reality, boot, ieben, hop, fun, Ron, sections, hands","0.009725048206746578, 0.004986508749425411, 0.0035359645262360573, 0.003048192011192441, 0.002637990051880479, 0.0024878617841750383, 0.00236467900685966, 0.0023371297866106033, 0.002300895983353257, 0.0022475956939160824"
img85.png,ereVP ere eyes alive,"ere, aden, eyes, reality, Opt, hands, side, ader, Sil, sil","0.0147358737885952, 0.006799488794058561, 0.004060159903019667, 0.0026836020406335592, 0.0026523370761424303, 0.0026316966395825148, 0.002433921443298459, 0.002414980437606573, 0.002368270419538021, 0.0022422331385314465"
img86.png,foreverachi stack EbTAC,"forever, eye, Ny, eyes, etti, An, atti, compile, hop, disease","0.01168501004576683, 0.010392863303422928, 0.007087317295372486, 0.005784499458968639, 0.005124782677739859, 0.004558076150715351, 0.003853307804092765, 0.0028859940357506275, 0.002743098419159651, 0.0022476143203675747"
img87.png,ere Vice COVIDthes tran,"ere, influen, sections, ieben, ete, fun, etti, surprise, mas, An","0.008736669085919857, 0.007985961623489857, 0.004585952032357454, 0.003922572825103998, 0.0037283527199178934, 0.003613643581047654, 0.0034347197506576777, 0.003355154301971197, 0.003189029172062874, 0.002926417626440525"
img88.png,edo funoup Beau Buen,"edo, dorf, An, sd, pointers, so, alive, ieben, Dur, n","0.013877796940505505, 0.0063537186942994595, 0.004833653569221497, 0.004134443122893572, 0.004102268721908331, 0.00391441211104393, 0.0037644533440470695, 0.0037497770972549915, 0.003400900401175022, 0.003157628932967782"
img89.png,upload Buen hopjen Koch,"upload, ere, estaven, бу, etti, ieben, Sil, reality, rio, fun","0.0053260368295013905, 0.00512199942022562, 0.0038966117426753044, 0.0035897272173315287, 0.003155572572723031, 0.0031066499650478363, 0.0027739261277019978, 0.002565462375059724, 0.0024479811545461416, 0.0024100288283079863"
img90.png,ieben erequiniringTP,"ieben, eyes, sil, An, Andrew, eden, format, reality, Ron, hands","0.010519783943891525, 0.0059706238098442554, 0.00470473850145936, 0.003915630746632814, 0.0038398955948650837, 0.0035099489614367485, 0.00341527396813035, 0.0033231524284929037, 0.003208352718502283, 0.00276577309705317"
img91.png,ere Chineorb Optorf,"ere, surprise, com, expos, cope, ieben, aden, compile, Channel, sil","0.006743027828633785, 0.00431974558159709, 0.0037824956234544516, 0.0036234089639037848, 0.0030039118137210608, 0.002934326184913516, 0.0027138080913573503, 0.002650942886248231, 0.002385590225458145, 0.0022763460874557495"
img92.png,eremac Neg ere Adolf,"ere, span, DS, side, hands, eye, viation, expos, Brun, cope","0.009674480184912682, 0.007161433808505535, 0.0065974220633506775, 0.006270761135965586, 0.0037153030280023813, 0.0034495422150939703, 0.002676032017916441, 0.0024749254807829857, 0.002361590275540948, 0.002306884154677391"
img93.png,rio glaetta vac impossible,"rio, ere, ieben, compile, refix, bu, Ari, ceil, compose, Complex","0.004027503542602062, 0.003980581648647785, 0.0039342064410448074, 0.003418097971007228, 0.0032361899502575397, 0.0030047004111111164, 0.0024523651227355003, 0.002358416561037302, 0.0022592246532440186, 0.0021306518465280533"
img94.png,dest Frei‹ destppy,"dest, reality, compile, eman, бу, appen, side, hands, rare, animate","0.004077599849551916, 0.003815616713836789, 0.003114215563982725, 0.002824470866471529, 0.002824470866471529, 0.002813459374010563, 0.002791564678773284, 0.0024731892626732588, 0.0023877518251538277, 0.0022695260122418404"
img95.png,sideurst destnamespace Roc,"side, disease, record, Side, viol, prepared, deg, fun, reality, хо","0.0052481526508927345, 0.003455293597653508, 0.0034418224822729826, 0.0033099681604653597, 0.003037397749722004, 0.002722705714404583, 0.0026804942172020674, 0.002384080784395337, 0.0023379684425890446, 0.002222207607701421"
img96.png,side ma Rod BuenEP,"side, eyes, ere, ieben, legend, refix, Side, symbols, fun, ron","0.010386141017079353, 0.008510098792612553, 0.00691866222769022, 0.0034518481697887182, 0.00339833227917552, 0.002709386870265007, 0.002615789882838726, 0.00256519578397274, 0.002535310573875904, 0.002505773212760687"
img97.png,ieben rustrost Halaterra,"ieben, span, rac, eden, race, etime, breaks, fun, idae, wide","0.01904965192079544, 0.0037510984111577272, 0.0030496218241751194, 0.0029213586822152138, 0.002820438938215375, 0.0027767124120146036, 0.0027551036328077316, 0.0026495573110878468, 0.0024890287313610315, 0.002293000463396311"
img98.png,An eyeaterraidentifierbec,"An, sil, ieben, eyes, surprise, span, ere, an, fun, rac","0.012832210399210453, 0.007368918973952532, 0.004504529759287834, 0.0037784059531986713, 0.003577322931960225, 0.0034537427127361298, 0.003036034759134054, 0.0028298955876380205, 0.0027108737267553806, 0.0026584407314658165"
img99.png,ere Vice Wein exposende,"ere, ieben, ettings, span, œ, reality, side, heart, const, letin","0.012525050900876522, 0.006809751968830824, 0.003925817087292671, 0.003344837576150894, 0.003069395897909999, 0.0030574293341487646, 0.003010028274729848, 0.0028834303375333548, 0.0024954008404165506, 0.00246632844209671"
img100.png,fun Buen tre hop impossible,"fun, silent, side, etti, Buen, An, Lat, line, edo, ron","0.004783729091286659, 0.004139972385019064, 0.004044069908559322, 0.0037990522105246782, 0.003667812328785658, 0.003541105892509222, 0.0033789467997848988, 0.003186650574207306, 0.0031128316186368465, 0.0026418259367346764"
img101.png,ere Riemannходи Büpel,"ere, fun, ma, Buen, Opt, sil, An, gre, Sil, n","0.007691836450248957, 0.006682783365249634, 0.006426770240068436, 0.005967054050415754, 0.004889228381216526, 0.00453949486836791, 0.00397491455078125, 0.003734086873009801, 0.0035215795505791903, 0.003334164386615157"
img102.png,sectionsihema ere eyes,"sections, ceil, void, side, section, section, silent, Lu, mid, Sv","0.003745646681636572, 0.0037164976820349693, 0.0034506514202803373, 0.003021491225808859, 0.002894411562010646, 0.0027403736021369696, 0.0025643063709139824, 0.002427836647257209, 0.0022366277407854795, 0.0022366277407854795"
img103.png,Ari Buen ere Wein Buen,"Ari, An, ere, ieben, cope, ny, Kan, hands, Buen, Channel","0.013395593501627445, 0.003549479180946946, 0.0034537380561232567, 0.003440272994339466, 0.0028298913966864347, 0.0027860181871801615, 0.002700301120057702, 0.0023460625670850277, 0.002265016781166196, 0.002247390104457736"
img104.png,ere best surface stem rap,"ere, ут, ieben, side, sd, Ny, etti, compile, ker, estaven","0.009555899538099766, 0.005508969072252512, 0.004392132628709078, 0.003289555199444294, 0.0031023460905998945, 0.0026639632415026426, 0.002571935299783945, 0.002483086660504341, 0.002454157918691635, 0.0021998928859829903"
img105.png,VerdurstPIsexih,"Verd, fun, An, Ron, <0xB1>, edo, ieben, silent, anni, hop","0.008304651826620102, 0.006442454643547535, 0.006028530653566122, 0.004393371753394604, 0.004359182436019182, 0.004325259011238813, 0.0039228396490216255, 0.003516410943120718, 0.003316291142255068, 0.002825515577569604"
img106.png,handsSS legendedoupload,"hands, ere, ettings, sil, atori, eyes, Framework, sections, Andrew, unsafe","0.009472666308283806, 0.0068496097810566425, 0.005503815598785877, 0.004707662854343653, 0.004106096923351288, 0.0037975190207362175, 0.00248076394200325, 0.00241384981200099, 0.0023671616800129414, 0.002348740119487047"
img107.png,sideorem Hall Sresen,"side, atti, Sil, hands, ere, JAX, vec, span, appen, hop","0.007290564477443695, 0.004856563173234463, 0.0038568940944969654, 0.0027780167292803526, 0.002745651872828603, 0.0025592290330678225, 0.0025492513086646795, 0.0023393244482576847, 0.0021635214798152447, 0.0021051643416285515"
img108.png,span Buen Buen� et,"span, side, Ron, hop, An, Channel, expos, sides, hands, sil","0.007528659887611866, 0.0067223371006548405, 0.006217144895344973, 0.00614471361041069, 0.006120757665485144, 0.00467465166002512, 0.0035286119673401117, 0.0035286119673401117, 0.00348750245757401, 0.0032003119122236967"
img109.png,hands else Opt Optrecht,"hands, Doug, nucle, -, bed, Cart, Py, ру, shut, iet","0.008601466193795204, 0.0042248978279531, 0.003543850500136614, 0.002903727116063237, 0.0028924066573381424, 0.0027924871537834406, 0.002532675862312317, 0.002297037048265338, 0.0021327268332242966, 0.0020752004347741604"
img110.png,realityss CupedoAv,"reality, bord, Opt, ieben, anni, bek, ceil, An, impossible, span","0.008673619478940964, 0.0052608163096010685, 0.004588565323501825, 0.0038942652754485607, 0.0037597359623759985, 0.0030926745384931564, 0.0024369684979319572, 0.0024085771292448044, 0.0023163058795034885, 0.0022982805967330933"
img111.png,iebenategory Kanapedhardt,"ieben, reality, Ron, flower, ere, anni, side, hop, Andrew, Ari","0.00873622577637434, 0.007186223287135363, 0.005095795262604952, 0.004410042893141508, 0.004142852034419775, 0.0034078171011060476, 0.0033681148197501898, 0.0027489750646054745, 0.0027063563466072083, 0.002685295417904854"
img112.png,fun Buen Vorema Vor,"fun, ere, Lu, cause, surprise, sil, platform, -, Dom, eye","0.006922122556716204, 0.006426973268389702, 0.004757500719279051, 0.004486750811338425, 0.004281287081539631, 0.00394410640001297, 0.003071673447266221, 0.0027642068453133106, 0.0024015845265239477, 0.0023922217078506947"
img113.png,eyesPCuno oddcope,"eye, eyes, reality, hands, Ron, span, An, ere, friend, expos","0.006920119281858206, 0.006920119281858206, 0.0066810608841478825, 0.005003883503377438, 0.004887968301773071, 0.004132191650569439, 0.003604161785915494, 0.0030588125810027122, 0.0025161104276776314, 0.0025161104276776314"
img114.png,BuenSSedoneuroup,"Buen, ere, beat, ired, etti, fun, ice, edo, refix, Behavior","0.0191180519759655, 0.0098411301150918, 0.0074867368675768375, 0.0051055108197033405, 0.004332990851253271, 0.0029896737542003393, 0.0029780182521790266, 0.0025974735617637634, 0.0025672120973467827, 0.0025373033713549376"
img115.png,sil chemical impossibleConstructoruster,"sil, An, administrator, compile, span, eyes, sections, Andrew, Opt, side","0.0036560306325554848, 0.0035022625233978033, 0.0032138570677489042, 0.0030309557914733887, 0.0028031759429723024, 0.0025925138033926487, 0.0025623103138059378, 0.002552320482209325, 0.002483476186171174, 0.002425946295261383"
img116.png,An hallellt shockcha,"An, eyes, Ron, eye, Nur, side, rare, administrator, surprise, shock","0.008604316040873528, 0.006173294503241777, 0.005731710232794285, 0.003878269111737609, 0.003788428846746683, 0.003572828834876418, 0.0035588997416198254, 0.0034092171117663383, 0.003382686525583267, 0.002707467880100012"
img117.png,side Felix Hav eden,"side, appen, ere, surprise, span, Sil, Lu, ieben, eye, Ron","0.008092036470770836, 0.0061320960521698, 0.0035768200177699327, 0.003320964751765132, 0.003282274818047881, 0.0030713905580341816, 0.002874055877327919, 0.002763952361419797, 0.0026373816654086113, 0.0024296697229146957"
img118.png,ere bestântes dest,"ere, surprise, sil, fun, ieben, etti, Channel, so, core, anni","0.009305206127464771, 0.00448216125369072, 0.003970974590629339, 0.0031907674856483936, 0.003165937028825283, 0.0030685316305607557, 0.003044651821255684, 0.0029974491335451603, 0.002761379349976778, 0.00271856808103621"
img119.png,DS erepplyecisser,"DS, Buen, fun, ieben, sil, legend, eyes, reality, Admin, Admin","0.009475265629589558, 0.007379344664514065, 0.005232738330960274, 0.005192017648369074, 0.0029353005811572075, 0.0025303869042545557, 0.0024621342308819294, 0.002423962578177452, 0.0023039437364786863, 0.0022860143799334764"
img120.png,urable bere grarioih,"urable, fun, ieben, ceil, side, upload, ere, refix, An, Admin","0.004481467884033918, 0.0038182581774890423, 0.0035175441298633814, 0.003449508920311928, 0.0033173603005707264, 0.0031531064305454493, 0.003068056656047702, 0.002870936179533601, 0.002718147588893771, 0.002543508308008313"
img121.png,ereVPatti eyeetti,"ere, ieben, side, hands, legend, anni, reality, eyes, Admin, eye","0.01036367192864418, 0.007348943501710892, 0.0049146125093102455, 0.004138518590480089, 0.004122383892536163, 0.004026889335364103, 0.0032995145302265882, 0.002778469817712903, 0.0027247294783592224, 0.0026616111863404512"
img122.png,ma BuenSubmit Optorf,"ma, hands, An, expos, ieben, eye, acon, ут, ny, n","0.0030371714383363724, 0.0028199180960655212, 0.0026698450092226267, 0.0023377942852675915, 0.0023015502374619246, 0.0022658677771687508, 0.0022658677771687508, 0.002257034182548523, 0.0021961545571684837, 0.0021285859402269125"
img123.png,ere ere temptoupachi,"ere, ут, compile, reality, An, igny, legend, hands, ieben, creature","0.009174172766506672, 0.005414326209574938, 0.0040551433339715, 0.0034415554255247116, 0.003309711581096053, 0.003121355315670371, 0.0028309463523328304, 0.0025475758593529463, 0.002337787067517638, 0.002265861025080085"
img124.png,ereaterra Vereinoup expos,"ere, sil, aterra, rio, vi, ice, etti, Sil, horizon, n","0.004867266397923231, 0.0039880950935184956, 0.003384652314707637, 0.0032933573238551617, 0.002998635871335864, 0.002574907848611474, 0.0022546646650880575, 0.0022024353966116905, 0.002005340065807104, 0.002005340065807104"
img125.png,eyes fulchacher bil,"eyes, side, inc, ro, alive, Kan, eye, an, ed, composition","0.007952012121677399, 0.004174079280346632, 0.0038755012210458517, 0.0035286841448396444, 0.0033670938573777676, 0.003077773144468665, 0.0029368314426392317, 0.0029368314426392317, 0.002824323484674096, 0.0027805359568446875"
img126.png,side fun Hur gal et,"side, side, ere, ma, compile, Side, okal, ieben, бу, Channel","0.009446552954614162, 0.005196543410420418, 0.004919988103210926, 0.0036705350503325462, 0.003151862882077694, 0.002803324954584241, 0.0024642806965857744, 0.002388462657108903, 0.002351433038711548, 0.0023331339471042156"
img127.png,iebenches‹ Juanivan,"ieben, Contents, An, sil, Buen, sections, legend, ere, warn, anni","0.006451883353292942, 0.005760883446782827, 0.005627433303743601, 0.004149409011006355, 0.003218964207917452, 0.0030004046857357025, 0.0028186191339045763, 0.0027749205473810434, 0.0026895450428128242, 0.0025265938602387905"
img128.png,reality erePageschtangle,"reality, ere, sides, Buen, ieben, prepared, side, ben, fun, administrator","0.01179442647844553, 0.00704277353361249, 0.005357859656214714, 0.004955210257321596, 0.0044418214820325375, 0.004390073008835316, 0.004012851510196924, 0.003611175576224923, 0.003611175576224923, 0.003076760098338127"
img129.png,ere Paz doubleenberg�,"ere, etti, eye, бу, boot, iform, cope, side, decode, reality","0.006886372808367014, 0.004016785882413387, 0.0036573249381035566, 0.0029158738907426596, 0.0027072972152382135, 0.0025632174219936132, 0.0024554121773689985, 0.0022096314933151007, 0.002108445158228278, 0.002019766718149185"
img130.png,ereupload destaterra Buen,"ere, -, happy, fun, core, roc, An, sil, Channel, administrator","0.01638990081846714, 0.006494035478681326, 0.004394084215164185, 0.004032238386571407, 0.0038325884379446507, 0.0035032695159316063, 0.003462455002591014, 0.003278186544775963, 0.002474504988640547, 0.0024648578837513924"
img131.png,Ron Buen del span Buen,"Ron, ere, compile, Nur, side, ought, n, cause, impossible, An","0.006468427833169699, 0.005843737628310919, 0.004901735577732325, 0.004079585894942284, 0.003395332954823971, 0.0032146363519132137, 0.0030674277804791927, 0.0025035615544766188, 0.0023982650600373745, 0.0023427093401551247"
img132.png,span Buen aptocker wide,"span, reality, etti, Lat, ired, aden, Opt, princip, core, side","0.006530949845910072, 0.00556443864479661, 0.0051462650299072266, 0.0032968209125101566, 0.0029552513733506203, 0.002943729981780052, 0.0028199204243719578, 0.0027331605087965727, 0.0025475858710706234, 0.002430923515930772"
img133.png,Buen Buen tempt- pon,"Buen, span, Ron, ere, ieben, sil, hands, Channel, Sil, side","0.007400367874652147, 0.005521010607481003, 0.004759408999234438, 0.004685621242970228, 0.004612977150827646, 0.003992198966443539, 0.0035925901029258966, 0.0035507353022694588, 0.003170449985191226, 0.0028530959971249104"
img134.png,hands ere◦ bul Buen,"hands, ere, ieben, Ron, Comput, An, atti, span, ettings, urable","0.008212395943701267, 0.006031833589076996, 0.005892105866223574, 0.00464286794885993, 0.004500021692365408, 0.0032922865357249975, 0.0030567843932658434, 0.003009393345564604, 0.002882822183892131, 0.0027400837279856205"
img135.png,ere‍seguairoEMA,"ere, anni, ieben, Unis, Browser, putation, Nash, ceil, Elli, refix","0.009285653941333294, 0.007698077708482742, 0.0070091793313622475, 0.004950874950736761, 0.003234204603359103, 0.00265001249499619, 0.0026191389188170433, 0.0025089813861995935, 0.002179840812459588, 0.0021127741783857346"
img136.png,sideaus blank comb Opt,"side, refix, An, isan, бу, etti, ere, Channel, span, igny","0.008154169656336308, 0.004148505162447691, 0.0041323318146169186, 0.0033464643638581038, 0.0029997515957802534, 0.002976407064124942, 0.002555820159614086, 0.0025260436814278364, 0.0022643308620899916, 0.0021606399677693844"
img137.png,ere volrefix impossible per,"ere, side, compile, Buen, anni, Sil, span, side, putation, aden","0.006995229981839657, 0.00532169034704566, 0.00496036047115922, 0.004096250981092453, 0.004017022904008627, 0.0034764432348310947, 0.002961966907605529, 0.0027500931173563004, 0.0027286915574222803, 0.0025236273650079966"
img138.png,ieben Buen Voruda hands,"ieben, Buen, anni, reality, ere, 영, ут, <0x91>, expos, side","0.025414245203137398, 0.019258761778473854, 0.005896579008549452, 0.004888435825705528, 0.004433618392795324, 0.004247146658599377, 0.004214094951748848, 0.0030352987814694643, 0.0029649860225617886, 0.002873763209208846"
img139.png,ereInfl Opteca appointment,"ere, ieben, Opt, mac, hands, edo, Opt, refix, An, silence","0.008042268455028534, 0.007014591246843338, 0.0057251425459980965, 0.005505815148353577, 0.005484350025653839, 0.0051119765266776085, 0.0043384782038629055, 0.003554821712896228, 0.0034860651940107346, 0.0029934600461274385"
img140.png,ereedgeete HollywoodVisibility,"ere, compile, ут, ieben, breaks, An, Cec, side, acon, happy","0.009852326475083828, 0.00779383210465312, 0.004204456694424152, 0.003186112269759178, 0.0029351837001740932, 0.002600428881123662, 0.0024238661862909794, 0.002331009367480874, 0.0023219215217977762, 0.0021727397106587887"
img141.png,Anendeaylorouppio,"An, fun, mac, legend, span, рон, ma, appen, ere, bord","0.0037578188348561525, 0.0033816711511462927, 0.002995994407683611, 0.0029495456255972385, 0.0025130445137619972, 0.0024262303486466408, 0.0022971087601035833, 0.0022438960149884224, 0.0021919163409620523, 0.0020271912217140198"
img142.png,sil eyeDLquer faithful,"sil, reality, ieben, 영, anni, ere, eye, surprise, aden, happy","0.006386246997863054, 0.004510872066020966, 0.0041718753054738045, 0.003873454639688134, 0.0038433114532381296, 0.0031002741307020187, 0.0029352805577218533, 0.002889773342758417, 0.002768233185634017, 0.002672603353857994"
img143.png,рон empty legendoupobi,"рон, fun, ieben, ron, 鉄, Ron, sections, eyes, člán, expos","0.008467016741633415, 0.006243187002837658, 0.004549805540591478, 0.0035433920565992594, 0.0031638932414352894, 0.0030665502417832613, 0.0030190078541636467, 0.002814024453982711, 0.0026851610746234655, 0.002342039020732045"
img144.png,spanodoeman cha ere,"span, aden, ere, compile, disease, Channel, Ron, legend, eye, An","0.008135673590004444, 0.005012243054807186, 0.003798247780650854, 0.0035820885095745325, 0.002703902078792453, 0.0026619823183864355, 0.0025500229094177485, 0.002520314184948802, 0.0024812400806695223, 0.002376882592216134"
img145.png,iebenellaodaoremigu,"ieben, anni, refix, side, itten, sections, An, viol, fun, Comput","0.007342813536524773, 0.0048722983337938786, 0.004007844254374504, 0.003750342410057783, 0.003564649960026145, 0.003001736244186759, 0.0029783768113702536, 0.0027979258447885513, 0.0025575109757483006, 0.0025080444756895304"
img146.png,ere ere ere ere gla,"ere, ieben, Buen, side, cope, overcome, Sil, се, eben, side","0.012158939614892006, 0.011422267183661461, 0.006533684208989143, 0.004761509131640196, 0.003932040650397539, 0.003483594860881567, 0.00262955529615283, 0.002489612903445959, 0.0024319409858435392, 0.0023756050504744053"
img147.png,fun Buen Buen Opt Buen,"fun, Channel, side, An, an, hard, mas, anni, List, friend","0.018551727756857872, 0.005398860201239586, 0.005131544079631567, 0.0038433491718024015, 0.003261808305978775, 0.0030882179271429777, 0.0029238658025860786, 0.0029124668799340725, 0.0028673133347183466, 0.0027790952008217573"
img148.png,iebenrome dest tallieben,"ieben, hop, anni, An, edo, so, surprise, compile, sil, ceil","0.008399122394621372, 0.0070451959036290646, 0.004620352294296026, 0.003712557489052415, 0.003514978801831603, 0.0030898647382855415, 0.0030778185464441776, 0.002971493639051914, 0.002948369365185499, 0.002857657615095377"
img149.png,rare Tod ere Pac Buen,"rare, Contents, Buen, ieben, Koch, anni, ere, appen, cause, sil","0.005159331951290369, 0.005000595934689045, 0.004942337051033974, 0.003644250798970461, 0.003033014480024576, 0.0027294177561998367, 0.002687102183699608, 0.0023621143773198128, 0.0023164269514381886, 0.002253945218399167"
img150.png,ere Vice Vor Vor Vor,"ere, etti, bed, sil, core, бу, prime, enten, instructions, oon","0.015967627987265587, 0.010110072791576385, 0.005649126600474119, 0.004297628998756409, 0.0037192879244685173, 0.0036759567447006702, 0.0036189663223922253, 0.0025662314146757126, 0.0025165958795696497, 0.0023183966986835003"
img151.png,ieben Buen‹ fun Vor,"ieben, appen, igny, eh, reality, animate, expos, Comput, anni, ru","0.006430577952414751, 0.003946318756788969, 0.0038249033968895674, 0.0028424267657101154, 0.0027657572645694017, 0.002722878009080887, 0.002384231658652425, 0.0023290009703487158, 0.002248544478788972, 0.00223977817222476"
img152.png,ere Viceoup KamPages,"ere, Engineering, etti, ired, reality, Cet, Oper, бу, n, side","0.011411015875637531, 0.010846017859876156, 0.007002715487033129, 0.004574588965624571, 0.003562693251296878, 0.0034801631700247526, 0.0030592598486691713, 0.0029651361983269453, 0.002668333938345313, 0.002657931065186858"
img153.png,Ron gla Vice Calfen,"Ron, side, reality, hop, Dra, Opt, Kan, ader, Library, Opt","0.00429069809615612, 0.0034611665178090334, 0.0033678074833005667, 0.0033546776976436377, 0.002937454031780362, 0.00261262571439147, 0.0024543344043195248, 0.002351108705624938, 0.002341942861676216, 0.00227877264842391"
img154.png,ieben trerangleome ere,"ieben, Contents, eyes, reality, Opt, eye, hop, Sil, animate, span","0.005245804786682129, 0.005044841207563877, 0.0043150815181434155, 0.004117479082196951, 0.0033737418707460165, 0.0029889692086726427, 0.002942629624158144, 0.002931157359853387, 0.0028188666328787804, 0.0027751640882343054"
img155.png,span Buenaluста vol,"span, eye, Cec, ieben, ri, ere, Opt, hands, loved, roc","0.004853491205722094, 0.00450631370767951, 0.004233290441334248, 0.0038095484487712383, 0.0029668796341866255, 0.002478920854628086, 0.002459629438817501, 0.0024404884316027164, 0.0024309740401804447, 0.0023839545901864767"
img156.png,eyeschor VI name Opt,"eyes, ron, instructions, refix, eben, мец, ieben, An, hands, sil","0.0064992280676960945, 0.00413116067647934, 0.0039113047532737255, 0.0037909664679318666, 0.0037614647299051285, 0.003746800357475877, 0.0036173651460558176, 0.003575221635401249, 0.0034248526208102703, 0.003217351157218218"
img157.png,Contents cup fetch YorkSM,"Contents, expos, span, side, An, Harrison, Buen, side, expose, ieben","0.011042358353734016, 0.008173991926014423, 0.004191206768155098, 0.004094117321074009, 0.003861120203509927, 0.0029488818254321814, 0.002925934037193656, 0.0029145267326384783, 0.0029031638987362385, 0.002891845302656293"
img158.png,fun Buenping Buen Jack,"fun, An, eyes, eye, etti, Andrew, an, expos, hop, reality","0.006313191261142492, 0.004746868275105953, 0.0046915654093027115, 0.0044767227955162525, 0.004156496841460466, 0.0040443819016218185, 0.0038441307842731476, 0.003113072132691741, 0.0030528600327670574, 0.00302910222671926"
img159.png,disableathedraledoajo Integr,"disable, atter, odo, racy, rio, eyes, Ari, člán, edo, Opt","0.0042667998932302, 0.003900171024724841, 0.0033753167372196913, 0.0030852893833070993, 0.002680545672774315, 0.002618450904265046, 0.0025778557173907757, 0.0024311491288244724, 0.002393457805737853, 0.002374831819906831"
img160.png,An hall Verdelltuteur,"An, ird, ieben, span, odo, anni, Ron, reality, n, Andrew","0.004979276098310947, 0.004063967149704695, 0.003685857867822051, 0.003628714010119438, 0.003462543012574315, 0.003342927899211645, 0.0031898440793156624, 0.002881784224882722, 0.0024267055559903383, 0.0022443358320742846"
