img79.png,Gon industrysing Gef Hend,"Gon, Behavior, dece, Listener, reen, Multiple, re, inek, Division, division","0.007357956375926733, 0.006442842073738575, 0.004901455715298653, 0.003671020735055208, 0.003277852665632963, 0.003227034118026495, 0.002926792949438095, 0.0028478477615863085, 0.0027927651535719633, 0.0027494675014168024"
img80.png,Behavioraelicker hesteck,"Behavior, Gon, reen, word, dece, ór, re, quote, Stutt, rico","0.007279312703758478, 0.005409525707364082, 0.005182008258998394, 0.004537518136203289, 0.0033457560930401087, 0.002941108075901866, 0.002884221961721778, 0.0025552790611982346, 0.002545316703617573, 0.002438264200463891"
img81.png,Gon biggestossa Wiener Schl,"Gon, Behavior, dece, ór, reen, Division, mist, worse, chat, height","0.009979653172194958, 0.008209039457142353, 0.006005861796438694, 0.005730832926928997, 0.005137085448950529, 0.003877675626426935, 0.003558355150744319, 0.003189689014106989, 0.0029156114906072617, 0.002562986919656396"
img82.png,Behavior Wureen reperson,"Behavior, Gon, re, dece, height, Read, istic, san, Listener, Multiple","0.0072472356259822845, 0.0068347943015396595, 0.00502001354470849, 0.004942185245454311, 0.004327522125095129, 0.0035182505380362272, 0.003190914634615183, 0.0031291968189179897, 0.0031169974245131016, 0.0022626975551247597"
img83.png,Behaviorestonialeąovi,"Behavior, Gon, ór, dece, Listener, re, mist, acher, Multiple, pause","0.009043003432452679, 0.005703350529074669, 0.0037696848157793283, 0.0033137656282633543, 0.00313740991987288, 0.0029820662457495928, 0.0029588595498353243, 0.002823363523930311, 0.00266268546693027, 0.002491609426215291"
img84.png,Behaviorottobioviicker,"Behavior, Gon, Listener, dece, mist, re, opp, cat, Division, fool","0.009715363383293152, 0.0047907037660479546, 0.0038796300068497658, 0.0038344310596585274, 0.003129571443423629, 0.0029399602208286524, 0.0029284984339028597, 0.0027726462576538324, 0.002236603759229183, 0.0021933438256382942"
img85.png,deceovi Pul delegatecyk,"dece, Behavior, re, mist, Listener, reen, fool, Gon, cat, division","0.008902094326913357, 0.007014682050794363, 0.004618345759809017, 0.004600340034812689, 0.004600340034812689, 0.003076481632888317, 0.0026833550073206425, 0.0024527849163860083, 0.0024336972273886204, 0.002313196426257491"
img86.png,reen dinnerallesesiovi,"reen, Behavior, worse, mist, Gon, Listener, accommod, recent, dece, re","0.006170906126499176, 0.006146848667412996, 0.004142950288951397, 0.00403120182454586, 0.003861654782667756, 0.0033946121111512184, 0.0031150709837675095, 0.0029263384640216827, 0.002869738033041358, 0.0023977558594197035"
img87.png,Gon Reading planinererson,"Gon, dece, reen, ór, re, mist, talk, ho, Division, word","0.009096809662878513, 0.007934379391372204, 0.005063137039542198, 0.004682636354118586, 0.0043646967969834805, 0.003777330508455634, 0.0035071326419711113, 0.003412533551454544, 0.00260627968236804, 0.0025961187202483416"
img88.png,Gonersonreen sp Gef,"Gon, Behavior, dece, Multiple, ór, Listener, rys, pause, re, reen","0.009493483230471611, 0.007364708464592695, 0.006972765550017357, 0.004067178349941969, 0.003942043986171484, 0.0034383118618279696, 0.0031799187418073416, 0.002850460587069392, 0.0025651368778198957, 0.002168516395613551"
img89.png,Behavioreston concerniviovi,"Behavior, Gon, mist, dece, reen, re, istica, istic, Multiple, Division","0.006487514823675156, 0.005336484406143427, 0.0052537498995661736, 0.004618342500180006, 0.0030764793045818806, 0.0030525377951562405, 0.0023773189168423414, 0.002268453361466527, 0.00223328429274261, 0.0022159048821777105"
img90.png,Behaviorestonabakap cat,"Behavior, Gon, reen, ór, Division, dece, height, , recent, division","0.01554297748953104, 0.009575750678777695, 0.0056073470041155815, 0.005498890765011311, 0.004987277090549469, 0.004740340169519186, 0.004666847642511129, 0.004282540641725063, 0.004086428787559271, 0.003691780846565962"
img91.png,Gon industry finiteBehaviorury,"Gon, dece, instant, mist, Europe, Behavior, eros, re, defin, Division","0.010179569944739342, 0.004961126018315554, 0.004049153067171574, 0.0040176426991820335, 0.0037742257118225098, 0.003504249732941389, 0.003228266490623355, 0.0027291125152260065, 0.0027291125152260065, 0.002707874635234475"
img92.png,Gon industryLMio Herbert,"Gon, mist, Behavior, dece, worse, re, wind, Division, storm, reen","0.010638882406055927, 0.003991019446402788, 0.003749215742573142, 0.0035083312541246414, 0.0031943717040121555, 0.0027861804701387882, 0.00245879590511322, 0.0023924740962684155, 0.002346199471503496, 0.0022829147055745125"
img93.png,Gon almost Harrersonnab,"Gon, Behavior, re, dece, reen, Wor, Las, istic, Listener, defin","0.012982135638594627, 0.009761226363480091, 0.007169415708631277, 0.006451775785535574, 0.00326960114762187, 0.0029423225205391645, 0.0027532801032066345, 0.00274254591204226, 0.002606753259897232, 0.002606753259897232"
img94.png,Behavior iorin betreraf,"Behavior, Gon, dece, re, Division, reen, disappoint, defin, lg, word","0.010061895474791527, 0.004865614697337151, 0.004642801824957132, 0.0042604743503034115, 0.003241198370233178, 0.003241198370233178, 0.002827022923156619, 0.0026765717193484306, 0.0024370462633669376, 0.0023436846677213907"
img95.png,Behaviorott eyes modrin,"Behavior, Gon, reen, dece, ór, mist, height, word, Europe, recent","0.01253362838178873, 0.008251925930380821, 0.006604758556932211, 0.005605385173112154, 0.0054541900753974915, 0.0036332737654447556, 0.0027640489861369133, 0.0026581597048789263, 0.002616948913782835, 0.0022825433406978846"
img96.png,Gon newsveisdotsiner,"Gon, Behavior, re, ór, Listener, dece, eros, Division, Multiple, pause","0.01245056837797165, 0.00977256242185831, 0.004971877671778202, 0.003723764093592763, 0.00333796045742929, 0.003324946854263544, 0.003003839636221528, 0.002968843560665846, 0.002650878857821226, 0.0025593030732125044"
img97.png,Behavior Wu minimum *abel,"Behavior, reen, Gon, height, chat, Division, dece, re, ór, word","0.008880263194441795, 0.004885027650743723, 0.004465276841074228, 0.0041947392746806145, 0.004049830138683319, 0.0037308784667402506, 0.003518553450703621, 0.0032668665517121553, 0.002816214691847563, 0.0027189275715500116"
img98.png,Gon liaquetraf,"Gon, Division, Listener, dece, eros, re, worse, recent, pause, os","0.00529026985168457, 0.004136191681027412, 0.0040089343674480915, 0.003621770301833749, 0.0034966550301760435, 0.0032087108120322227, 0.003146649105474353, 0.002887527458369732, 0.0027660818304866552, 0.002702005673199892"
img99.png,Behavioreston ram取 Gent,"Behavior, dece, cat, Gon, mist, bur, defin, talk, recent, re","0.028531571850180626, 0.007800097577273846, 0.0035433538723737, 0.0027703677769750357, 0.0025822666939347982, 0.002483341144397855, 0.0022967152763158083, 0.0022877613082528114, 0.0019954207818955183, 0.0019644845742732286"
img100.png,Behavior pivotuchaOS trade,"Behavior, reen, Gon, dece, defin, ór, behaviour, storm, re, height","0.010291822254657745, 0.005617467686533928, 0.004861513152718544, 0.0046570440754294395, 0.0034608214627951384, 0.003126591444015503, 0.0030781179666519165, 0.002995091024786234, 0.0028356951661407948, 0.0028136277105659246"
img101.png,Behavior ####iemovie mist,"Behavior, dece, Gon, Listener, height, re, ór, Multiple, myth, Stutt","0.01703765243291855, 0.0063416846096515656, 0.005466873291879892, 0.0031027868390083313, 0.0028584212996065617, 0.0028251195326447487, 0.002532420912757516, 0.0023697144351899624, 0.0019492738647386432, 0.0018311733147129416"
img102.png,Behavioreston concernreen stri,"Behavior, Gon, Division, Listener, dece, re, word, height, storm, reen","0.0049402713775634766, 0.004515773616731167, 0.0036712978035211563, 0.0031157899647951126, 0.0029270141385495663, 0.002803907496854663, 0.0027929763309657574, 0.0023796455934643745, 0.002370367990806699, 0.002306431531906128"
img103.png,Gon industry Platform GefBehavior,"Gon, reen, Behavior, ór, tor, storm, Listener, dece, Storm, Division","0.014614485204219818, 0.008102473802864552, 0.007406260352581739, 0.004652859177440405, 0.0044224802404642105, 0.0038573560304939747, 0.0036095231771469116, 0.003197860438376665, 0.0030041118152439594, 0.0027892233338207006"
img104.png,Behavioreston gro povHR,"Behavior, dece, reen, worse, rys, mist, re, Gon, Division, ho","0.015285225585103035, 0.006943626794964075, 0.003987389616668224, 0.0037021655589342117, 0.003166629932820797, 0.0030932752415537834, 0.0029864164534956217, 0.002905863104388118, 0.0025148149579763412, 0.00214264914393425"
img105.png,Behaviorestonreenleid pup,"Behavior, Gon, reen, Listener, defin, recent, dece, ór, os, Division","0.011314761824905872, 0.0049237823113799095, 0.004679989069700241, 0.004328282084316015, 0.003069211496040225, 0.0028164670802652836, 0.0026561813428997993, 0.0025345459580421448, 0.002514821942895651, 0.002390304347500205"
img106.png,Behavior ioSFrzerson,"Behavior, dece, Listener, Gon, re, reen, ór, recent, mist, very","0.007806550711393356, 0.00603243475779891, 0.006008916534483433, 0.005644855089485645, 0.005514091812074184, 0.005365358665585518, 0.003305501537397504, 0.0030810663010925055, 0.002838411135599017, 0.0026251012459397316"
img107.png,Behavior Gentsing Gefuf,"Behavior, Gon, dece, Division, division, mist, reen, re, last, word","0.013263759203255177, 0.013160538859665394, 0.005443435627967119, 0.005338150076568127, 0.0043398854322731495, 0.003755857702344656, 0.003514546435326338, 0.0030534907709807158, 0.0024439829867333174, 0.0023780609481036663"
img108.png,Behavioraeloviodsata,"Behavior, Gon, division, dece, Division, mist, reen, cas, ho, Listener","0.007545631844550371, 0.006843590643256903, 0.005563800223171711, 0.005125612951815128, 0.004796295426785946, 0.004435847979038954, 0.004023139365017414, 0.0034277578815817833, 0.00302498578093946, 0.0024401575792580843"
img109.png,Behaviorav eyeiono ucz,"Behavior, ór, dece, tau, reen, ig, instant, talk, re, acher","0.011689181439578533, 0.0064806449227035046, 0.006017075385898352, 0.004283444955945015, 0.004283444955945015, 0.003930710256099701, 0.0034553154837340117, 0.003322944510728121, 0.00278729060664773, 0.0027655998710542917"
img110.png,Gon industry finiteulsubre,"Gon, Division, dece, reen, mist, Behavior, height, re, quote, disappoint","0.008907233364880085, 0.006749847438186407, 0.006169860251247883, 0.005683941300958395, 0.004957621917128563, 0.004531633108854294, 0.0043410384096205235, 0.0038160178810358047, 0.0035154803190380335, 0.003151256125420332"
img111.png,Behaviorottobiterrd,"Behavior, mist, Gon, dece, reen, Division, very, recent, cat, worse","0.006793789099901915, 0.005229366011917591, 0.004989896435290575, 0.004970442038029432, 0.00454335194081068, 0.004525639582425356, 0.0037081760820001364, 0.0032724537886679173, 0.0031104234512895346, 0.0026708990335464478"
img112.png,Gon industrysinglatLR,"Gon, reen, Behavior, dece, re, Division, division, mist, Multiple, Listener","0.01218597125262022, 0.007596055511385202, 0.006497250869870186, 0.0061755492351949215, 0.006127491127699614, 0.004244388546794653, 0.0037310575135052204, 0.0037310575135052204, 0.003423810238018632, 0.0026354012079536915"
img113.png,Behavior Wu employeeovi sob,"Behavior, Gon, os, aszt, dece, reen, Division, registered, nica, lat","0.0139347855001688, 0.006531102582812309, 0.00543566606938839, 0.004266503266990185, 0.004200357012450695, 0.003992382902652025, 0.003809558227658272, 0.0030971490778028965, 0.002450046595185995, 0.002430979860946536"
img114.png,Behaviorestonickerolf Stop,"Behavior, Gon, dece, reen, defin, re, FE, word, cola, Listener","0.012745541520416737, 0.007177583873271942, 0.005835334304720163, 0.004762661177664995, 0.003247852437198162, 0.00318503356538713, 0.0024230454582720995, 0.0023854796309024096, 0.0023854796309024096, 0.0021299938671290874"
img115.png,Gon industry Platform GefBehavior,"Gon, Behavior, reen, ór, dece, word, Division, division, mist, Las","0.01214598584920168, 0.008250551298260689, 0.00485024880617857, 0.004450839012861252, 0.004132463596761227, 0.003943224437534809, 0.0027744050603359938, 0.002763588447123766, 0.0025759476702660322, 0.0025759476702660322"
img116.png,dece markerucci Verlcx,"dece, Behavior, Gon, recent, ór, Division, fool, disappoint, height, re","0.006550265941768885, 0.006225939840078354, 0.004811033606529236, 0.004212682135403156, 0.003732228884473443, 0.003492435673251748, 0.003192344680428505, 0.0031798987183719873, 0.002906662877649069, 0.002895331010222435"
img117.png,dece newskillédéFE,"dece, Division, Gon, division, mist, cas, re, Listener, registered, cat","0.009297299198806286, 0.007921397686004639, 0.006440050899982452, 0.006340207066386938, 0.005215311888605356, 0.003698209999129176, 0.0032892560120671988, 0.0029027583077549934, 0.002868940122425556, 0.0027375617064535618"
img118.png,deceumbickeriri Der,"dece, Behavior, reen, Gon, mist, fool, division, os, inek, Division","0.01779954507946968, 0.009343133307993412, 0.008880523033440113, 0.008245285600423813, 0.0034776623360812664, 0.003266961546614766, 0.0025343927554786205, 0.0021010853815823793, 0.0020285025238990784, 0.002020594198256731"
img119.png,Behaviorestonabacola gro,"Behavior, dece, re, Gon, word, , is, reen, talk, -","0.005488907918334007, 0.005217133089900017, 0.004939482547342777, 0.0038169361650943756, 0.003408140502870083, 0.003408140502870083, 0.0029610435012727976, 0.0029380007181316614, 0.002892451360821724, 0.002696060808375478"
img120.png,reerson Laufersonabel,"re, Gon, dece, Behavior, happened, istic, last, word, Division, pet","0.009299088269472122, 0.006750414613634348, 0.006292078644037247, 0.005175722297281027, 0.003698921762406826, 0.003434332786127925, 0.0032898890785872936, 0.0031148043926805258, 0.002869492396712303, 0.002759563969448209"
img121.png,Behaviorestonlia choerson,"Behavior, Gon, dece, ór, Division, Listener, mist, rys, inek, Europe","0.023299776017665863, 0.010963126085698605, 0.007189793512225151, 0.004808180034160614, 0.003672187216579914, 0.002893613651394844, 0.0026866295374929905, 0.0025938188191503286, 0.002533733146265149, 0.0025238548405468464"
img122.png,mistnica Stonectp,"mist, Behavior, reen, worse, dece, Gon, cat, registered, fool, ","0.0063972268253564835, 0.005021240562200546, 0.004448572639375925, 0.004448572639375925, 0.0036450298503041267, 0.003532883943989873, 0.003478111932054162, 0.0031545106321573257, 0.0031545106321573257, 0.003081436501815915"
img123.png,Behavior Gentsingznaobi,"Behavior, dece, mist, ho, Gon, Listener, fool, division, word, reen","0.009576117619872093, 0.008032461628317833, 0.0046488321386277676, 0.004183495882898569, 0.0038091165479272604, 0.003013259032741189, 0.0026800481136888266, 0.002638497855514288, 0.0024497625418007374, 0.0024497625418007374"
img124.png,Behavior Pazersonickersing,"Behavior, disappoint, re, dece, recent, last, Gon, cat, wind, tags","0.010681895539164543, 0.006403415929526091, 0.004795937333256006, 0.004540701862424612, 0.004215898923575878, 0.0037060126196593046, 0.003400828456506133, 0.003120775567367673, 0.002459112089127302, 0.0024399752728641033"
img125.png,Behavior iorinieriodel,"Behavior, Gon, height, re, worse, dece, reen, division, ór, erson","0.012450875714421272, 0.008794572204351425, 0.003444003639742732, 0.003325029043480754, 0.003248005174100399, 0.0029458128847181797, 0.0025000786408782005, 0.00242315954528749, 0.0022323192097246647, 0.0020088697783648968"
img126.png,Gon industry finiteBehaviorior,"Gon, re, Behavior, reen, height, Division, dece, worse, disappoint, division","0.007552106399089098, 0.005904606077820063, 0.005700628738850355, 0.004991637542843819, 0.004509568680077791, 0.003753195982426405, 0.003135912586003542, 0.002934432355687022, 0.0029115963261574507, 0.0028000548481941223"
img127.png,Gon industry Platform Gef virtual,"Gon, dece, Behavior, Stutt, mist, Listener, Multiple, reen, lat, ór","0.00782966148108244, 0.0073840743862092495, 0.004602820612490177, 0.004174577072262764, 0.004125942010432482, 0.003341289469972253, 0.0032766631338745356, 0.0032766631338745356, 0.002602198626846075, 0.0025718824472278357"
img128.png,Gon newsempreisis Gol,"Gon, Behavior, dece, ór, Multiple, reen, myth, multiple, height, chat","0.022640040144324303, 0.014334781095385551, 0.008526317775249481, 0.006486480124294758, 0.004059135913848877, 0.003458427032455802, 0.0026724650524556637, 0.0026724650524556637, 0.0026620461139827967, 0.002620775019749999"
img129.png,reen possiblereenidoenson,"reen, Gon, cas, Behavior, height, word, happened, Europe, re, defin","0.010808484628796577, 0.0067902496084570885, 0.004948485177010298, 0.004367022775113583, 0.003929894883185625, 0.003387781558558345, 0.00314544839784503, 0.0030367872677743435, 0.0029204499442130327, 0.0025772880762815475"
img130.png,dececxerson repruta,"dece, mist, Gon, Multiple, ór, Listener, Behavior, , cat, talk","0.01012340560555458, 0.005397542845457792, 0.005293145310133696, 0.005293145310133696, 0.0037534020375460386, 0.003539794823154807, 0.003390916157513857, 0.00337769603356719, 0.0032230201177299023, 0.002923152409493923"
img131.png,Behaviorael everwidcertain,"Behavior, dece, mist, Gon, Division, ór, division, re, recent, istica","0.012471472844481468, 0.007331600412726402, 0.005198883358389139, 0.004193770233541727, 0.0034903651103377342, 0.0033046116586774588, 0.003202939173206687, 0.0030206593219190836, 0.0029049396980553865, 0.002826583804562688"
img132.png,reen possibleédéóbiani,"reen, dece, height, Behavior, Listener, Gon, Division, ho, re, division","0.007195585872977972, 0.006733274087309837, 0.005264402832835913, 0.004906963091343641, 0.004020621534436941, 0.003465992631390691, 0.003307273145765066, 0.002699317643418908, 0.0026471083983778954, 0.002299847546964884"
img133.png,Gon industry finiteBehavioricker,"Gon, Behavior, reen, dece, Division, mist, Green, Europe, Multiple, ór","0.009903917089104652, 0.008504425175487995, 0.007161444518715143, 0.004960587248206139, 0.003422702429816127, 0.0033565014600753784, 0.002916178898885846, 0.002760982606559992, 0.002455668756738305, 0.0023708364460617304"
img134.png,Behaviorestonickerądiali,"Behavior, dece, Listener, defin, reen, disappoint, defin, cat, inher, FE","0.010005864314734936, 0.006164434365928173, 0.004320311825722456, 0.0035677009727805853, 0.0034043239429593086, 0.0034043239429593086, 0.002559700282290578, 0.0023306335788220167, 0.0023306335788220167, 0.0022855550050735474"
img135.png,BehaviorestonreenstenEY,"Behavior, reen, height, dece, Division, mist, Gon, re, division, worse","0.01020688097923994, 0.009113718755543232, 0.008461802266538143, 0.004993906244635582, 0.0043728104792535305, 0.0032623151782900095, 0.0032623151782900095, 0.0032623151782900095, 0.0032117373775690794, 0.0027257660403847694"
img136.png,Gon lia onderwerppic,"Gon, Division, reen, ór, division, Behavior, dece, defin, mist, lat","0.010222425684332848, 0.007807249203324318, 0.00667789438739419, 0.006372090429067612, 0.005824562162160873, 0.005801854655146599, 0.004465846810489893, 0.0036735055036842823, 0.003154413541778922, 0.0028275977820158005"
img137.png,reen etersonerson Lauf,"reen, Behavior, Gon, dece, mist, re, Division, cas, ór, worse","0.013521757908165455, 0.009931448847055435, 0.006667659152299166, 0.006023728288710117, 0.004728077910840511, 0.004172514658421278, 0.003813986899331212, 0.0036251433193683624, 0.0034322163555771112, 0.0031867052894085646"
img138.png,Behavioreston umoseomini,"Behavior, Gon, dece, re, ór, , height, reen, Division, cat","0.01115270983427763, 0.00506634684279561, 0.004987800493836403, 0.004559218417853117, 0.0034414788242429495, 0.0031212856993079185, 0.002853086218237877, 0.0027545250486582518, 0.0027545250486582518, 0.0025876369327306747"
img139.png,Gon industry finiteiaitol,"Gon, Behavior, word, mist, Division, dece, re, worse, wind, Multiple","0.01132245920598507, 0.009646855294704437, 0.005518125835806131, 0.005083536263555288, 0.004592592362314463, 0.0045746867544949055, 0.002576210303232074, 0.002318338491022587, 0.0022646342404186726, 0.002255805302411318"
img140.png,Gon orreader humasz,"Gon, mist, reen, Division, dece, height, Behavior, re, worse, registered","0.009232934564352036, 0.007714405655860901, 0.007247012574225664, 0.0057105086743831635, 0.005449005402624607, 0.0038942289538681507, 0.003774415934458375, 0.0034366450272500515, 0.0030805885326117277, 0.002893945202231407"
img141.png,Behavioreston concernzakтт,"Behavior, dece, Listener, defin, height, plain, Gon, acher, recent, ór","0.01899016462266445, 0.0054834457114338875, 0.004406072665005922, 0.0033129111398011446, 0.0032361680641770363, 0.0032109839376062155, 0.0030639423057436943, 0.00296967476606369, 0.002672417787835002, 0.002641283441334963"
img142.png,Behaviorowe protestickeresi,"Behavior, Gon, reen, height, dece, mist, re, lat, cat, rys","0.007781776133924723, 0.006301874294877052, 0.0056489636190235615, 0.0035075212363153696, 0.0029306437354534864, 0.002742351731285453, 0.0025661576073616743, 0.0024969393853098154, 0.0023183298762887716, 0.002291320590302348"
img143.png,Gon veryreenisis circum,"Gon, Behavior, mist, dece, worse, acher, reen, distinct, re, cat","0.0065245963633060455, 0.006423442158848047, 0.004773496184498072, 0.00448428513482213, 0.0038206586614251137, 0.0035335314460098743, 0.0025351850781589746, 0.0025351850781589746, 0.0024096593260765076, 0.002219882095232606"
img144.png,Gon industry finiteBehaviorBehavior,"Gon, reen, dece, mist, Behavior, istica, nag, Division, re, height","0.008810427971184254, 0.00860633421689272, 0.005938192363828421, 0.005688439588993788, 0.005644171964377165, 0.00342336343601346, 0.0032159520778805017, 0.0032159520778805017, 0.0032034143805503845, 0.002805003197863698"
img145.png,reenerson panel news betre,"reen, Behavior, Gon, re, dece, cat, cas, Division, Listener, registered","0.008167533203959465, 0.006262265611439943, 0.005724173970520496, 0.005356399342417717, 0.004915308672934771, 0.004320832900702953, 0.0027788635343313217, 0.00257002841681242, 0.002423767698928714, 0.002423767698928714"
img146.png,Behavior pivotianiioraret,"Behavior, Gon, mist, dece, reen, storm, Listener, Division, word, division","0.021448805928230286, 0.010869725607335567, 0.007470645476132631, 0.004918545018881559, 0.003528883447870612, 0.0026951401960104704, 0.0026637406554073095, 0.0025121469516307116, 0.0024731995072215796, 0.0024635575246065855"
img147.png,Behavioreston Tokerson Bür,"Behavior, dece, Gon, word, re, -, reen, cas, Division, Multiple","0.009578748606145382, 0.008486300706863403, 0.007090569473803043, 0.006532138679176569, 0.0054365284740924835, 0.004873272497206926, 0.004437165334820747, 0.004008644726127386, 0.003442195476964116, 0.0028873186092823744"
img148.png,deceumbiem�erson,"dece, Gon, Behavior, re, Listener, Multiple, acher, os, last, bur","0.007834061980247498, 0.00654560374096036, 0.006221508141607046, 0.005058050621300936, 0.004048412200063467, 0.0036007326561957598, 0.0029273752588778734, 0.0028042534831911325, 0.002624081913381815, 0.0024363775737583637"
img149.png,Gon industry finiteulsubre,"Gon, Behavior, dece, Multiple, empre, mist, Listener, pause, division, reen","0.01342863030731678, 0.008049985393881798, 0.006220546551048756, 0.005489612929522991, 0.003787719178944826, 0.003743591019883752, 0.0035167778842151165, 0.003303707344457507, 0.0028815448749810457, 0.002803819952532649"
img150.png,Behavioraelovisingerson,"Behavior, mist, Multiple, Gon, dece, istic, wind, reen, istica, word","0.005506245885044336, 0.004859244916588068, 0.004691380076110363, 0.004673090297728777, 0.0034457207657396793, 0.0031008131336420774, 0.003017173847183585, 0.002879007486626506, 0.0028123154770582914, 0.0024721838999539614"
img151.png,Behaviorottobi cho alone,"Behavior, ór, Gon, dece, pause, talk, word, worse, inek, mist","0.011592325754463673, 0.005454478319734335, 0.005084133241325617, 0.004757480695843697, 0.00416578957810998, 0.0032697655260562897, 0.00267914985306561, 0.0026687048375606537, 0.002606884576380253, 0.002596721053123474"
img152.png,Behaviorottfellia white,"Behavior, Gon, height, Division, re, dece, ór, acher, ho, reen","0.012309907004237175, 0.006311892531812191, 0.005253223702311516, 0.004510906990617514, 0.0040120831690728664, 0.0038433405570685863, 0.0034721686970442533, 0.0027899660635739565, 0.002651825314387679, 0.002560216700658202"
img153.png,Gon veryodi perterson,"Gon, re, Behavior, dece, mist, reen, -, registered, cas, Division","0.009532845579087734, 0.006375098135322332, 0.005714600905776024, 0.004984363913536072, 0.003973881248384714, 0.0031931032426655293, 0.0028289328329265118, 0.002688862383365631, 0.0025161048397421837, 0.0024770961608737707"
img154.png,Gon industry Platform GefBehavior,"Gon, Behavior, Listener, re, mist, dece, registered, ór, Multiple, reen","0.018214698880910873, 0.005555169191211462, 0.005321526434272528, 0.005239023827016354, 0.0036007247399538755, 0.00339580699801445, 0.002985105849802494, 0.0028152228333055973, 0.0026653993409126997, 0.0026446569245308638"
img155.png,Gonersoniredersonace,"Gon, reen, Behavior, Division, re, height, division, dece, word, eros","0.016074486076831818, 0.006779830437153578, 0.005620676092803478, 0.005384278483688831, 0.004960229620337486, 0.004080173093825579, 0.003304225392639637, 0.003116181120276451, 0.0029273813124746084, 0.002859568689018488"
img156.png,deceslantuni everédé,"dece, reen, Gon, Behavior, Division, division, cas, ór, mist, talk","0.010532773099839687, 0.006853805854916573, 0.0063635436818003654, 0.005379614420235157, 0.0046921828761696815, 0.003920465707778931, 0.003640029113739729, 0.0035835958551615477, 0.0035557078663259745, 0.0030532616656273603"
