img158.png,travel Gentlez秀 Fr,"travel, amen, Revolution, revolution, mile, trav, vr, eff, costs, FI","0.017610976472496986, 0.009426476433873177, 0.004739929921925068, 0.004739929921925068, 0.00470304349437356, 0.004522873088717461, 0.004418100696057081, 0.004400876350700855, 0.004366627894341946, 0.004215781111270189"
img159.png,Stuart Ludramlick bere,"Stuart, Miami, uv, eton, Vitt, Revolution, ris, oug, inson, Nicola","0.012539142742753029, 0.007516769226640463, 0.006951875519007444, 0.006329754367470741, 0.005542518105357885, 0.0053719934076070786, 0.00457699503749609, 0.0040391841903328896, 0.004023436456918716, 0.0037502553313970566"
img160.png,Stuart magn qu Adam pill,"Stuart, FI, imp, tim, lement, selector, vr, el, Golden, Vitt","0.015817072242498398, 0.004191107116639614, 0.003830981906503439, 0.0033545198384672403, 0.0033154385164380074, 0.0029952488839626312, 0.002858086721971631, 0.0027059821877628565, 0.002695432398468256, 0.002444651210680604"
img161.png,revolution gentriv Según Dar,"revolution, Stuart, Ped, Revolution, Nicola, out, travel, trav, amen, costs","0.012042890302836895, 0.010101594030857086, 0.007867129519581795, 0.007304382510483265, 0.0060319374315440655, 0.005869235843420029, 0.005846353713423014, 0.005220206454396248, 0.004161911550909281, 0.003940418362617493"
img162.png,revolutionag Nicola Revolution Nicola,"revolution, riel, Stuart, Ped, Revolution, risk, iza, FI, <0xA1>, out","0.0075681814923882484, 0.006298799533396959, 0.0056241946294903755, 0.00477319210767746, 0.004626336507499218, 0.004501549061387777, 0.004312219563871622, 0.004245365038514137, 0.0036312530282884836, 0.003411246696487069"
img163.png,Revolutionpp Lomblez Lau,"Revolution, revolution, Stuart, travel, trav, GT, fah, vr, adin, шта","0.010437102057039738, 0.009103403426706791, 0.007546985987573862, 0.004577478393912315, 0.004316973499953747, 0.0033884309232234955, 0.0031460518948733807, 0.0030373698100447655, 0.002921010134741664, 0.0027333367615938187"
img164.png,trav Pil Hedioni Hud,"trav, amen, travel, Revolution, 宿, uv, adin, revolution, Stuart, storm","0.005606376565992832, 0.004540182184427977, 0.004198981914669275, 0.004006696864962578, 0.0039445785805583, 0.003913881257176399, 0.0035358970053493977, 0.003400439163669944, 0.003144891932606697, 0.002852293197065592"
img165.png,traveloutci quarteraggi,"travel, trav, Stuart, adin, amen, _, vr, out, imp, selector","0.01431640051305294, 0.007968276739120483, 0.007312102243304253, 0.0067625888623297215, 0.004504855256527662, 0.00424848310649395, 0.003975520841777325, 0.0036911461502313614, 0.0034810821525752544, 0.0034539925400167704"
img166.png,travel Stern Wahl coh tid,"travel, Revolution, Stuart, _, revolution, out, vr, imp, trav, tim","0.007957842200994492, 0.00783446803689003, 0.0068067037500441074, 0.00654594274237752, 0.0063198101706802845, 0.006246181670576334, 0.0058907107450068, 0.005599041469395161, 0.005078109912574291, 0.004160854499787092"
img167.png,vr Reg Readett Taylor,"vr, Stuart, Revolution, out, rile, costs, revolution, шта, Ped, <0xB4>","0.013705294579267502, 0.005222303327172995, 0.005201943218708038, 0.004699563607573509, 0.004035483114421368, 0.0037762057036161423, 0.0036457551177591085, 0.0032936653587967157, 0.0030820495449006557, 0.0028172212187200785"
img168.png,channels augachim bere Según,"channels, tim, imp, eff, costs, imp, revolution, ett, _, values","0.0059424894861876965, 0.005560688208788633, 0.00414852611720562, 0.0035902501549571753, 0.0035762533079832792, 0.002884846879169345, 0.0027851886115968227, 0.002774330321699381, 0.0024292846210300922, 0.0022910337429493666"
img169.png,Stuartunineh sooner Raw,"Stuart, revolution, vr, Revolution, travel, _, trav, iss, adin, Lud","0.015241279266774654, 0.013715667650103569, 0.008752331137657166, 0.007574510294944048, 0.0074862646870315075, 0.006736909504979849, 0.005585094448179007, 0.004758559633046389, 0.004070211201906204, 0.0033480648417025805"
img170.png,Stuart hom Margiani Hud,"Stuart, Nicola, Revolution, trav, vr, ril, 宿, revolution, travel, rile","0.013612670823931694, 0.006183834746479988, 0.005741496104747057, 0.0049494788981974125, 0.004559673834592104, 0.004559673834592104, 0.0044193873181939125, 0.004384995903819799, 0.004250083584338427, 0.0036638008896261454"
img171.png,vr bere Read el otherwise,"vr, _, amen, travel, *, Revolution, co, revolution, Grande, imp","0.021012963727116585, 0.006956460885703564, 0.005903871264308691, 0.0050696139223873615, 0.004057667218148708, 0.0035808791872113943, 0.0032988605089485645, 0.003184899687767029, 0.0030869105830788612, 0.003027204656973481"
img172.png,Stuart Giov Gia sooner Lud,"Stuart, lach, Ped, Vitt, tail, Revolution, revolution, FI, riel, vr","0.04027131199836731, 0.010796619579195976, 0.006127744913101196, 0.0058700209483504295, 0.005080079659819603, 0.0043452223762869835, 0.004211533814668655, 0.004211533814668655, 0.0033973073586821556, 0.0030692112632095814"
img173.png,imp Nathan berasso Mit,"imp, vr, _, Revolution, ing, Stuart, amen, lement, cation, mile","0.010023288428783417, 0.007333194371312857, 0.006729317829012871, 0.005557050928473473, 0.004771800711750984, 0.004294156096875668, 0.004129649139940739, 0.0037895790301263332, 0.0037895790301263332, 0.003254085313528776"
img174.png,Stuart Giov cig Adam slow,"Stuart, Nicola, revolution, vr, Revolution, ril, GT, rile, travel, imp","0.016749653965234756, 0.010688397102057934, 0.005437816027551889, 0.004473025444895029, 0.0043523735366761684, 0.003962881397455931, 0.0037227824795991182, 0.0036365443374961615, 0.003594177309423685, 0.0031967272516340017"
img175.png,Stuartnem cond contraumen,"Stuart, Ped, <0xA1>, revolution, Revolution, lement, inson, dist, ril, props","0.024093111976981163, 0.007011495064944029, 0.006163500249385834, 0.005927379708737135, 0.00485672103241086, 0.004186754580587149, 0.004121845588088036, 0.003917758818715811, 0.003872115630656481, 0.003857019590213895"
img176.png,Stuart slot neitherossggi,"Stuart, vr, Ped, riel, inson, revolution, travel, Revolution, Nicola, lide","0.031931083649396896, 0.008232676424086094, 0.006563662085682154, 0.006118005607277155, 0.004155851900577545, 0.003431890159845352, 0.0027792290784418583, 0.0027576014399528503, 0.0025703669525682926, 0.0022244672290980816"
img177.png,Stuartlung🌍bie Adam,"Stuart, vr, out, amen, tim, eff, Revolution, uv, ude, el","0.00631714379414916, 0.005796936806291342, 0.005774336867034435, 0.005553125403821468, 0.004307917784899473, 0.004031136631965637, 0.0037427840288728476, 0.0037427840288728476, 0.0033813235349953175, 0.002949242712929845"
img178.png,amen otherwise Revolution recon quarter,"amen, Stuart, ment, attributes, Revolution, revolution, rile, lement, Vitt, _","0.010276565328240395, 0.006481348071247339, 0.006184546276926994, 0.006041280925273895, 0.004668340086936951, 0.004267208278179169, 0.0040559242479503155, 0.0039005442522466183, 0.0037219254299998283, 0.0034556908067315817"
img179.png,FIarg Lomb Adam bere,"FI, Vitt, _, oug, travel, vr, revolution, imp, iza, Gia","0.012783954851329327, 0.007227392867207527, 0.0049673100002110004, 0.004315673373639584, 0.0040700677782297134, 0.003991345409303904, 0.003720342880114913, 0.00341397849842906, 0.0031206291168928146, 0.0030842728447169065"
img180.png,Revolutionital Rib Marg Lomb,"Revolution, revolution, Stuart, Ped, mile, travel, <0xB4>, amen, riel, imp","0.01578228734433651, 0.01371188834309578, 0.007085900753736496, 0.006376620382070541, 0.00549698993563652, 0.004297815728932619, 0.003928522113710642, 0.003269605804234743, 0.0030956005211919546, 0.0030003588180989027"
img181.png,riel Cotiterumnagar,"riel, travel, Stuart, bro, tim, amen, Ped, revolution, lach, FI","0.021046055480837822, 0.007652209140360355, 0.006077088415622711, 0.0056203873828053474, 0.005077597219496965, 0.0046777017414569855, 0.004463494289666414, 0.004343098495155573, 0.004111963324248791, 0.00393901951611042"
img182.png,Stuart Stuartân etoku,"Stuart, travel, vr, trav, Revolution, cost, Adam, press, ing, costs","0.015314299613237381, 0.011880291625857353, 0.010732948780059814, 0.005439193919301033, 0.004913901444524527, 0.003185071051120758, 0.0031726534944027662, 0.0030991591047495604, 0.0030750411096960306, 0.003015564288944006"
img183.png,travellickeros Ful Pil,"travel, vr, imp, riel, amen, Ped, Revolution, ound, Stuart, _","0.010157766751945019, 0.009961297735571861, 0.0050678979605436325, 0.005008854903280735, 0.004969875793904066, 0.004632433410733938, 0.0042014350183308125, 0.004056294448673725, 0.00391616765409708, 0.003537962678819895"
img184.png,Stuarttel otherwiseloyd Voll,"Stuart, vr, eff, Vitt, travel, Revolution, 街, channels, revolution, trav","0.019145295023918152, 0.00977846048772335, 0.005571598187088966, 0.0040287780575454235, 0.0040287780575454235, 0.00392010947689414, 0.0033530471846461296, 0.00284569407813251, 0.0025310125201940536, 0.0024435778614133596"
img185.png,Stuart Nicola Gia sooner Raw,"Stuart, Nicola, rile, vr, <0xB4>, Revolution, Vitt, trav, travel, riel","0.017745373770594597, 0.009572910144925117, 0.007722156122326851, 0.005124010145664215, 0.004593132995069027, 0.004469241015613079, 0.0036619645543396473, 0.0035492978058755398, 0.003295411355793476, 0.0032316725701093674"
