Image File,Inference Result,Top 10 Words,Top 10 Probabilities
img1.png,StuartChannel Rib relative Revolution,"Stuart, FI, amen, Revolution, imp, revolution, riel, travel, tim, trav","0.014516768045723438, 0.009784242138266563, 0.007649799343198538, 0.006830501835793257, 0.004676228854805231, 0.004550095647573471, 0.004241154994815588, 0.0036276523023843765, 0.003290137741714716, 0.00293776229955256"
img2.png,amenital�lettedu,"amen, travel, riel, revolution, ing, cost, Revolution, costs, trav, vr","0.008105212822556496, 0.007265465334057808, 0.006667166016995907, 0.006538210902363062, 0.006411751266568899, 0.0063123456202447414, 0.005294805392622948, 0.003965625539422035, 0.003624875098466873, 0.0035826442763209343"
img3.png,riel Gil Revolutionau Pitt,"riel, trav, vr, travel, Vitt, ing, Stuart, tim, Generation, FI","0.008810083381831646, 0.008084586821496487, 0.007218723651021719, 0.006942179054021835, 0.005470305681228638, 0.005448978394269943, 0.005281331017613411, 0.005260740872472525, 0.004942008759826422, 0.004865389782935381"
img4.png,Stuart Leon counter Marganel,"Stuart, riel, FI, trav, revolution, Ped, Lud, travel, Revolution, 원","0.020659634843468666, 0.010676290839910507, 0.010029448196291924, 0.00841271597892046, 0.006974386051297188, 0.0058960081078112125, 0.005410481244325638, 0.00496493699029088, 0.004926299676299095, 0.003689628094434738"
img5.png,travel Nicola Según hol Según,"travel, trav, Revolution, _, vr, amen, revolution, Generation, *, Ped","0.008327482268214226, 0.007731804624199867, 0.006510832812637091, 0.006261406932026148, 0.005440004635602236, 0.005397669970989227, 0.00511041097342968, 0.004138536751270294, 0.003857540898025036, 0.0038425016682595015"
img6.png,storm v relativeahrysz,"storm, Stuart, vr, Revolution, amen, Storm, out, uv, attra, trav","0.008902406319975853, 0.007856345735490322, 0.0065642232075333595, 0.005907160695642233, 0.005192727781832218, 0.004746537189930677, 0.004424259066581726, 0.004172474145889282, 0.0037842695601284504, 0.003392197424545884"
img7.png,amen Segúnlett Rome bere,"amen, travel, _, FI, Stuart, tim, cation, uv, ing, el","0.015292913652956486, 0.008990239351987839, 0.00455603189766407, 0.004538269713521004, 0.00445049162954092, 0.004296747036278248, 0.004084000363945961, 0.003119103843346238, 0.0029415953904390335, 0.0029415953904390335"
img8.png,Stuart complementexec Rome bere,"Stuart, riel, FI, Revolution, revolution, tim, travel, Salt, amen, *","0.019847873598337173, 0.010337241925299168, 0.009787104092538357, 0.008670893497765064, 0.007216557860374451, 0.006752898916602135, 0.006196808535605669, 0.005844146944582462, 0.00564225809648633, 0.004844967741519213"
img9.png,Revolution slouta mie Marg,"Revolution, revolution, out, Stuart, uv, ing, travel, trav, lide, tim","0.01580539532005787, 0.006666334345936775, 0.006666334345936775, 0.006311558187007904, 0.00583723746240139, 0.005569930654019117, 0.004458116367459297, 0.004406177904456854, 0.004123083781450987, 0.0038884382229298353"
img10.png,Stuart whreetnie Según,"Stuart, riel, Revolution, Vitt, uv, Generation, revolution, imp, vr, out","0.018234992399811745, 0.006734534166753292, 0.006131863221526146, 0.005390253383666277, 0.005285996478050947, 0.0036188450176268816, 0.0035212324000895023, 0.003307892242446542, 0.0032061191741377115, 0.0028404640033841133"
img11.png,vr bere otherwisetei Pitt,"vr, Revolution, uv, travel, Stuart, revolution, adin, storm, out, accommod","0.012237266637384892, 0.010673534125089645, 0.008848669938743114, 0.008443459868431091, 0.006837721914052963, 0.0050221639685332775, 0.003547363681718707, 0.003398166038095951, 0.0032299114391207695, 0.0032299114391207695"
img12.png,vr bere GibangenExec,"vr, Stuart, amen, Revolution, imp, <0xB4>, trav, accommod, Nicola, costs","0.017057690769433975, 0.0135995764285326, 0.00549472589045763, 0.004099315032362938, 0.003732469165697694, 0.0034926601219922304, 0.0033984514884650707, 0.0032050451263785362, 0.003106436226516962, 0.003010861109942198"
img13.png,Stuart Hud ring Giamys,"Stuart, revolution, riel, _, lement, ril, Coupe, Revolution, FI, cock","0.030609874054789543, 0.012175766751170158, 0.012081014923751354, 0.007213902659714222, 0.00619452865794301, 0.005155543796718121, 0.004675875883549452, 0.004062470979988575, 0.004030856769531965, 0.0035433501470834017"
img14.png,vrammen fare Cooper Marg,"vr, amen, travel, Stuart, props, costs, Revolution, revolution, Nicola, bro","0.010629582218825817, 0.007868438959121704, 0.005601396784186363, 0.004962562117725611, 0.004294739570468664, 0.003834770992398262, 0.003229200839996338, 0.003229200839996338, 0.0031791366636753082, 0.003081324975937605"
img15.png,StuartChannel coh Raw Smith,"Stuart, Revolution, vr, Storm, tim, za, imp, lide, el, ment","0.012795713730156422, 0.0055033680982887745, 0.004353522788733244, 0.004105762578547001, 0.0034171186853200197, 0.002799886977300048, 0.002767267171293497, 0.0027137433644384146, 0.002630250295624137, 0.002630250295624137"
img16.png,travel Nicolaseh Tor nem,"travel, Stuart, tim, vr, Pac, Salt, costs, cost, trav, revolution","0.011873860843479633, 0.007062564603984356, 0.0063308412209153175, 0.005674929823726416, 0.005106884054839611, 0.004723095800727606, 0.004559934139251709, 0.003930909093469381, 0.0032715925481170416, 0.00320831430144608"
img17.png,Stuart Nicola ber sooner pill,"Stuart, revolution, travel, riel, tim, ..., oug, *, GT, -","0.006085455417633057, 0.005694468971341848, 0.005412516184151173, 0.004504695534706116, 0.00440034456551075, 0.0038380485493689775, 0.0036480138078331947, 0.0034945833031088114, 0.0032828571274876595, 0.0032700584270060062"
img18.png,Revolutionammen bere mit coh,"Revolution, vr, _, el, amen, mile, rile, travel, Stuart, revolution","0.008112832903862, 0.007711139041930437, 0.007651130203157663, 0.007103834301233292, 0.006699553225189447, 0.005597686395049095, 0.005383241921663284, 0.0035442342050373554, 0.003043409204110503, 0.002996225608512759"
img19.png,riel dictolt Telitter,"riel, Revolution, out, Stuart, шта, amen, Adam, _, traffic, achim","0.007894669659435749, 0.005935977213084698, 0.005821164697408676, 0.004445841535925865, 0.0037731362972408533, 0.0033954554237425327, 0.0028816855046898127, 0.002859259955585003, 0.002749723382294178, 0.00260338606312871"
img20.png,milelett whebb Adam,"mile, riel, uv, Stuart, FI, Ped, Salt, amen, vr, salt","0.008859120309352875, 0.006557872053235769, 0.005479306913912296, 0.005228391382843256, 0.004650227725505829, 0.004267288837581873, 0.003171179909259081, 0.003158816834911704, 0.003014163812622428, 0.002932861912995577"
img21.png,Stuart Stern Smith Tor ced,"Stuart, tim, Generation, vr, Ped, trav, Revolution, risk, travel, ayer","0.013283825479447842, 0.0067582628689706326, 0.006398595403879881, 0.005494429264217615, 0.004590767435729504, 0.004555041436105967, 0.004262383095920086, 0.0038357300218194723, 0.0036600788589566946, 0.0035752933472394943"
img22.png,Stuart magniani fidirs,"Stuart, out, Revolution, FI, uv, Grande, tim, vr, GT, trav","0.011573280207812786, 0.009822115302085876, 0.007861522026360035, 0.006671987473964691, 0.005684603936970234, 0.004358537029474974, 0.00429096445441246, 0.00425757234916091, 0.0038313998375087976, 0.003757293801754713"
img23.png,selector Ya Deanysz Captain,"selector, mile, FI, Storm, amen, Revolution, uv, Golden, vr, eff","0.006777643226087093, 0.005911565851420164, 0.0051160333678126335, 0.005017080344259739, 0.004241340793669224, 0.0037429698277264833, 0.0035024862736463547, 0.0033947264309972525, 0.003329066326841712, 0.0030549231451004744"
img24.png,Stuart Adamnab otherwisetei,"Stuart, vr, Revolution, riel, atten, _, amen, selector, uv, pp","0.012712739408016205, 0.010295090265572071, 0.007020640652626753, 0.006699142977595329, 0.0050964392721652985, 0.004325291607528925, 0.003938222769647837, 0.003922868985682726, 0.0036280606873333454, 0.0034349788911640644"
img25.png,Stuart dup Marg Según Pit,"Stuart, _, mile, travel, trav, revolution, Revolution, tim, riel, cock","0.03240543603897095, 0.007258929777890444, 0.00709077762439847, 0.0065323300659656525, 0.006356131285429001, 0.0055007729679346085, 0.004911637399345636, 0.0047605219297111034, 0.004368500784039497, 0.004250667989253998"
img26.png,vr Read Según hol Giov,"vr, Stuart, Vitt, revolution, Revolution, travel, Ped, FI, trav, 街","0.007409066427499056, 0.007380181457847357, 0.0057927705347537994, 0.005484485067427158, 0.00521292956545949, 0.004858984611928463, 0.004321670159697533, 0.003889082232490182, 0.0038287872448563576, 0.0031249653548002243"
img27.png,vriani Hamb Según Read,"vr, Revolution, revolution, Vitt, FI, travel, GT, uv, ing, Stuart","0.005535916890949011, 0.004847411066293716, 0.004661709535866976, 0.004448234103620052, 0.004277824889868498, 0.004178729373961687, 0.004178729373961687, 0.0037899427115917206, 0.003673338331282139, 0.003344612894579768"
img28.png,Stuartnem tor urs sooner,"Stuart, vr, revolution, Revolution, FI, Ferd, ris, adin, costs, ammen","0.01420524436980486, 0.007170801516622305, 0.005164934787899256, 0.005124741233885288, 0.004870996810495853, 0.00386835727840662, 0.0038532759062945843, 0.0032321333419531584, 0.003060122486203909, 0.0030481924768537283"
img29.png,Stuart dupianiiani Admir,"Stuart, Nicola, Vitt, Revolution, travel, revolution, Grande, 宿, out, Lud","0.020363904535770416, 0.009107301943004131, 0.008896331302821636, 0.007520782761275768, 0.007232666481286287, 0.0064580440521240234, 0.004743298515677452, 0.004669760353863239, 0.004561585374176502, 0.003978685475885868"
img30.png,vr prime gent Nemadin,"vr, Gia, Ped, travel, Vitt, <0xA1>, amen, riel, channels, rile","0.012924508191645145, 0.005120971240103245, 0.004484072327613831, 0.004295477643609047, 0.0037612461019307375, 0.0034380576107650995, 0.003384754993021488, 0.0033715595491230488, 0.003358414862304926, 0.0033063478767871857"
img31.png,travel� Pit accommod Según,"travel, Stuart, costs, Revolution, ing, revolution, amen, contin, imp, cost","0.011273042298853397, 0.007900654338300228, 0.00742197735235095, 0.00708210002630949, 0.005121010355651379, 0.005121010355651379, 0.005041616037487984, 0.004572547972202301, 0.003603080753237009, 0.0032297808211296797"
img32.png,amenattenﬁ Captain Leb,"amen, vr, selector, Stuart, FI, Revolution, _, Vitt, lement, Eb","0.010952619835734367, 0.009368273429572582, 0.006119910161942244, 0.006096051074564457, 0.004692298360168934, 0.0035977098159492016, 0.0033403602428734303, 0.0033403602428734303, 0.002758459886536002, 0.0024920606520026922"
img33.png,Stuartlickmystel aer,"Stuart, Revolution, revolution, rile, mile, vr, Ped, FI, ajo, rig","0.008858505636453629, 0.00835436675697565, 0.005608856678009033, 0.004873058758676052, 0.004595732316374779, 0.00445433659479022, 0.004200839437544346, 0.004135711584240198, 0.004008468706160784, 0.003809995949268341"
img34.png,StuartChannelmysmys Raw,"Stuart, vr, Revolution, _, FI, revolution, amen, Ped, riel, *","0.012785852886736393, 0.012636893428862095, 0.01003573089838028, 0.006790515035390854, 0.006429130677133799, 0.0053299362771213055, 0.004266027826815844, 0.0030250668060034513, 0.0030015252996236086, 0.0028086791280657053"
img35.png,vr Vitt vis Smith cu,"vr, Stuart, amen, storm, FI, viz, travel, Vitt, Revolution, rile","0.008077332749962807, 0.007156120613217354, 0.006364785600453615, 0.003771010786294937, 0.003460474079474807, 0.0032004150561988354, 0.0029368659015744925, 0.0028913342393934727, 0.0026121027767658234, 0.0025615801569074392"
img36.png,travel Gib accommoditel Fichier,"travel, iss, Stuart, <0xB4>, vr, Picker, riel, ani, 원, GT","0.005464502144604921, 0.004917520098388195, 0.004898347891867161, 0.0042391675524413586, 0.0041897795163095, 0.0036118156276643276, 0.003406266449019313, 0.00318741612136364, 0.0025018316227942705, 0.0024823620915412903"
img37.png,vr Ya Voll Voll Hed,"vr, lement, riel, <0xB4>, rile, ajo, Ped, Revolution, travel, Stuart","0.018060287460684776, 0.007528648246079683, 0.007183886598795652, 0.007017472293227911, 0.005727493669837713, 0.005682921502739191, 0.00559481605887413, 0.005551277194172144, 0.005317797884345055, 0.004995608236640692"
img38.png,Stuart knock dict prime Tag,"Stuart, vr, costs, Nicola, travel, Revolution, revolution, ing, cost, _","0.01323955599218607, 0.009028592146933079, 0.008514774963259697, 0.00790569931268692, 0.005898011848330498, 0.005370201077312231, 0.0051043033599853516, 0.004575468134135008, 0.0040220944210886955, 0.003734388155862689"
img39.png,StuartChannelument recon Según,"Stuart, amen, vr, travel, _, storm, channels, accommod, Vitt, Ped","0.033074259757995605, 0.012801171280443668, 0.006190241314470768, 0.004935290664434433, 0.004690927919000387, 0.0043214852921664715, 0.004237900022417307, 0.003798828925937414, 0.003300479846075177, 0.0031005139462649822"
img40.png,Revolution Revolution magn Marg Ya,"Revolution, revolution, oug, Stuart, travel, riel, tim, vr, ris, Street","0.010480069555342197, 0.009212572127580643, 0.0073736500926315784, 0.006185028236359358, 0.005833037197589874, 0.005311040673404932, 0.005208315793424845, 0.0045427740551531315, 0.003900848561897874, 0.003736784216016531"
img41.png,Nicola otherwise Revolution Commonsasso,"Nicola, agar, vr, zig, amen, Revolution, FI, selector, Stuart, Grande","0.007008861284703016, 0.006307292729616165, 0.004507618956267834, 0.004472540225833654, 0.004437734838575125, 0.004072294104844332, 0.004056417848914862, 0.0035242768935859203, 0.003510537091642618, 0.0031715058721601963"
img42.png,Stuart magn revolutionCS otherwise,"Stuart, uv, Vitt, channels, tail, attributes, out, ing, vr, imp","0.011009623296558857, 0.006151761393994093, 0.005471489857882261, 0.005261880811303854, 0.0031914920546114445, 0.0031790495850145817, 0.0031054068822413683, 0.003033470129594207, 0.003033470129594207, 0.0028608348220586777"
img43.png,achim coh ring Margadin,"achim, adin, Nicola, imp, trav, revolution, Stuart, ris, uv, Gia","0.005235428921878338, 0.004374364856630564, 0.004157774616032839, 0.004014142788946629, 0.0038906403351575136, 0.0034334780648350716, 0.0033408659510314465, 0.0032128794118762016, 0.0028687783051282167, 0.002737407572567463"
img44.png,Stuartlicketttorрок,"Stuart, Revolution, ris, ment, lement, revolution, el, hero, rile, Hero","0.016010891646146774, 0.012420682236552238, 0.006832609884440899, 0.005913130939006805, 0.005018409341573715, 0.0042757377959787846, 0.003177458653226495, 0.0029272118117660284, 0.0029044323600828648, 0.002696674084290862"
img45.png,Revolution ital Bud Revolution recon,"Revolution, revolution, amen, imp, Stuart, cost, iza, <0xA1>, _, war","0.007002592086791992, 0.0061077699065208435, 0.005561187397688627, 0.005496397148817778, 0.00524469930678606, 0.0038221448194235563, 0.003690107027068734, 0.0033994854893535376, 0.003320736810564995, 0.002731563523411751"
img46.png,Revolution Revolution honour pride Pero,"Revolution, deep, <0xB4>, revolution, vr, Stuart, FI, uv, riel, travel","0.010636581107974052, 0.006376251112669706, 0.005004776641726494, 0.004738427698612213, 0.004701552912592888, 0.004664964973926544, 0.0044339862652122974, 0.004264123737812042, 0.003943669144064188, 0.003928294405341148"
img47.png,Stuartabs solit Cooper medium,"Stuart, travel, Revolution, vr, uv, accommod, trav, amen, revolution, lement","0.014941238798201084, 0.010189039632678032, 0.008187123574316502, 0.006708289030939341, 0.005286003928631544, 0.005163554102182388, 0.004197939299046993, 0.0035488554276525974, 0.003493835451081395, 0.0027103936299681664"
img48.png,Nicolaitoowy Adam Rab,"Nicola, revolution, travel, Stuart, _, costs, amen, eff, mile, FI","0.01066635176539421, 0.005913573782891035, 0.005280226934701204, 0.005259641446173191, 0.004463799763470888, 0.0043774619698524475, 0.004209764301776886, 0.0038330338429659605, 0.0035588513128459454, 0.003317213850095868"
img49.png,Stuart Ber Adam Horn Revolution,"Stuart, mile, values, riel, revolution, FI, _, out, Revolution, ing","0.017628252506256104, 0.005418479908257723, 0.005011274944990873, 0.004744579549878836, 0.004422434605658054, 0.004074137657880783, 0.003964244853705168, 0.0036236129235476255, 0.003609485924243927, 0.003581396536901593"
img50.png,RevolutionentionстиRemote Mys,"Revolution, Vitt, Stuart, revolution, 宿, imp, Nicola, Circle, oug, lement","0.013428258709609509, 0.012037013657391071, 0.008337795734405518, 0.005958753637969494, 0.0056196399964392185, 0.004291929304599762, 0.004047675058245659, 0.0038926110137254, 0.0038322615437209606, 0.003019749652594328"
img51.png,Stuartuttonnettód Gia,"Stuart, Revolution, revolution, FI, vr, Españ, rile, cost, imp, uv","0.008374998345971107, 0.006497027352452278, 0.004866048227995634, 0.004571229685097933, 0.004396108444780111, 0.004065735265612602, 0.003760190913453698, 0.0035186009481549263, 0.0033574725966900587, 0.002951407339423895"
img52.png,Stuart regln ringosz,"Stuart, Revolution, revolution, _, contin, travel, *, Vitt, Nicola, Grande","0.03337473422288895, 0.01704614795744419, 0.008307628333568573, 0.004808086436241865, 0.0036721155047416687, 0.0036151844542473555, 0.0035730660893023014, 0.0034094436559826136, 0.0032533137127757072, 0.003140926593914628"
img53.png,Stuartuniachim Nicola Revolution,"Stuart, rile, vr, Vitt, Nicola, amen, <0xB4>, _, Ped, revolution","0.03714564070105553, 0.009138558059930801, 0.008892061188817024, 0.006712079979479313, 0.005786174908280373, 0.00514633022248745, 0.0035094923805445433, 0.0034958100877702236, 0.0033097665291279554, 0.00306103378534317"
img54.png,Stuartaraniare Nicola Marcel,"Stuart, amen, Gia, viz, nem, <0xA1>, _, rile, ocz, props","0.013445918448269367, 0.011682016775012016, 0.006228554993867874, 0.005475251004099846, 0.004592648707330227, 0.00342632457613945, 0.003412966150790453, 0.002988493535667658, 0.002896547084674239, 0.002753129228949547"
img55.png,amenberolickmys bere,"amen, travel, Stuart, revolution, Salt, values, vr, Revolution, war, inson","0.010078984312713146, 0.006089380010962486, 0.005879019852727652, 0.003707851516082883, 0.003664653282612562, 0.003579762065783143, 0.003565805498510599, 0.0034696238581091166, 0.0032721671741455793, 0.0030027092434465885"
img56.png,tim Adam otherwise recon duty,"tim, ril, imp, travel, waves, riel, vr, FI, rig, bro","0.0068432642146945, 0.004540824331343174, 0.0040703690610826015, 0.003991641104221344, 0.003749799681827426, 0.003481570864096284, 0.003219926729798317, 0.0031700064428150654, 0.0031208600848913193, 0.0028750712517648935"
img57.png,Stuartód Gia Revolution Tir,"Stuart, Revolution, ment, vr, travel, Ped, rile, out, uv, Gia","0.019769974052906036, 0.006294228136539459, 0.005598202347755432, 0.004498281981796026, 0.004325956106185913, 0.004309090785682201, 0.0030675616580992937, 0.0030318237841129303, 0.002771311206743121, 0.002771311206743121"
img58.png,vrachimtel Margawa,"vr, Stuart, Ped, riel, Revolution, out, sent, iar, trav, travel","0.008716128766536713, 0.007397283334285021, 0.006376856006681919, 0.006376856006681919, 0.006204851903021336, 0.005044508725404739, 0.004665407817810774, 0.004557333886623383, 0.004182044416666031, 0.003974976949393749"
img59.png,Stuart Stuart commit Rib Marg,"Stuart, Revolution, _, vr, rile, fah, out, imp, <0xB4>, attributes","0.008501669391989708, 0.005597352981567383, 0.005403989460319281, 0.004359222482889891, 0.0035440227948129177, 0.0033033927902579308, 0.0032649070490151644, 0.003115396248176694, 0.0031032501719892025, 0.0028477024752646685"
img60.png,amen Gust Revolution gent Gia,"amen, Stuart, FI, Revolution, _, revolution, tim, riel, travel, ai","0.010492760688066483, 0.007676667533814907, 0.006025485694408417, 0.006001994013786316, 0.005235032644122839, 0.00425605196505785, 0.0037559522315859795, 0.003654641564935446, 0.0033406128641217947, 0.0033146159257739782"
img61.png,Stuart Berl Adam pill Wahl,"Stuart, dispos, riel, amen, Vitt, uv, storm, rig, GT, <0xA1>","0.03551167994737625, 0.0055100866593420506, 0.004291260149329901, 0.004175510257482529, 0.00404704362154007, 0.0035715035628527403, 0.003329007187858224, 0.003042958676815033, 0.0029149760957807302, 0.0028585954569280148"
img62.png,Stuart bereamytor tor,"Stuart, rile, steller, Revolution, ill, Generation, vr, rig, storm, _","0.010612504556775093, 0.009256391786038876, 0.00723709911108017, 0.004877775441855192, 0.004839816130697727, 0.0037988154217600822, 0.0037399199791252613, 0.0037108156830072403, 0.003405235707759857, 0.0030405335128307343"
img63.png,vrutzbes Allenuto,"vr, Ped, out, FI, revolution, imp, trav, Revolution, amen, dimensions","0.012664982117712498, 0.009302164427936077, 0.007562606129795313, 0.006269620731472969, 0.005279549863189459, 0.005218041129410267, 0.004622928332537413, 0.0043428391218185425, 0.003600340336561203, 0.0032653668895363808"
img64.png,rile Milanmyserorir,"rile, Stuart, FI, 宿, _, ment, amen, props, leben, ing","0.008682831190526485, 0.004851637873798609, 0.0045576924458146095, 0.004469538573175669, 0.004037891980260611, 0.003467309521511197, 0.003453791607171297, 0.0030598898883908987, 0.002526847878471017, 0.0025071839336305857"
img65.png,Revolution bere dupole dispos,"Revolution, imp, Stuart, vr, revolution, costs, FI, travel, Vitt, Nicola","0.01696518249809742, 0.010289903730154037, 0.006881382316350937, 0.0051138089038431644, 0.004340033046901226, 0.003800259670242667, 0.002813102910295129, 0.0026947876904159784, 0.00240617454983294, 0.002378141740337014"
img66.png,Stuartenson Gia sooner Lomb,"Stuart, riel, Ped, revolution, Revolution, lement, GT, Street, out, Gi","0.016886988654732704, 0.015496372245252132, 0.013410991989076138, 0.007464341353625059, 0.007319967728108168, 0.006310206837952137, 0.004286409821361303, 0.003512158989906311, 0.00336444191634655, 0.003123778849840164"
img67.png,vrosa transfercn Cob,"vr, Revolution, travel, eff, tim, шта, revolution, FI, Ring, ment","0.005690498277544975, 0.005580434110015631, 0.005140936933457851, 0.004924715496599674, 0.0042786672711372375, 0.003911018371582031, 0.003746526315808296, 0.003519535530358553, 0.0034246023278683424, 0.00333222933113575"
img68.png,riel Process Margmys Marg,"riel, amen, rile, lide, ril, Revolution, Miami, Vitt, Stuart, nem","0.008223663084208965, 0.006979332771152258, 0.005586187355220318, 0.005478140898048878, 0.005066452082246542, 0.004649237729609013, 0.00421667518094182, 0.003915050532668829, 0.0036922446452081203, 0.003564694197848439"
img69.png,Stuart Stuartocz Mys Hed,"Stuart, reg, FI, waves, wave, riel, Revolution, tim, ai, Ring","0.008152808994054794, 0.006449403706938028, 0.006106172222644091, 0.0060115051455795765, 0.0038361004553735256, 0.0036747592967003584, 0.0034386583138257265, 0.0033853468485176563, 0.003268398577347398, 0.0029412403237074614"
img70.png,Stuart dup ere revolution Revolution,"Stuart, Street, risk, riel, tim, Revolution, FI, ing, uv, lide","0.030249882489442825, 0.004426535684615374, 0.004392088390886784, 0.004340919200330973, 0.004240361507982016, 0.004174620844423771, 0.003967920783907175, 0.003433949314057827, 0.003420562017709017, 0.0026535505894571543"
img71.png,Stuart Stern Smith Quint Cooper,"Stuart, Gia, rile, ment, Revolution, cross, amen, channels, inson, ril","0.014769652858376503, 0.0052457512356340885, 0.004348880145698786, 0.004264765419065952, 0.0038528942968696356, 0.0038229108322411776, 0.0037052922416478395, 0.0036764575634151697, 0.003194161457940936, 0.003120168810710311"
img72.png,vr bere Marco Monday Der,"vr, uv, Ped, Stuart, Revolution, adin, riel, iss, othe, GT","0.009020659141242504, 0.006916379556059837, 0.0067298212088644505, 0.006103683728724718, 0.005492720287293196, 0.005220757331699133, 0.004589339718222618, 0.004178641363978386, 0.0038949220906943083, 0.0036163129843771458"
img73.png,Vittutzeros Hend Raw,"Vitt, Stuart, amen, lide, Revolution, riel, rig, dimensions, ril, ADD","0.011275420896708965, 0.005202752072364092, 0.0045379213988780975, 0.003973536193370819, 0.0039580450393259525, 0.0034254025667905807, 0.0032053226605057716, 0.0031067051459103823, 0.0025755492970347404, 0.0024384809657931328"
img74.png,Stuart peerett Marg Gia,"Stuart, rile, ril, riel, lide, storm, Nicola, travel, trav, oug","0.01050902996212244, 0.010265587829053402, 0.004609024152159691, 0.0043808151967823505, 0.004067449364811182, 0.004004389513283968, 0.003942307084798813, 0.0038210151251405478, 0.003533861367031932, 0.0030943523161113262"
img75.png,StuartChannel Según SE Voll,"Stuart, Revolution, war, revolution, costs, travel, attra, Ped, riel, amen","0.010189895518124104, 0.00615638867020607, 0.004966158419847488, 0.004281096160411835, 0.004264405462890863, 0.004069124348461628, 0.0037780541460961103, 0.0037633248139172792, 0.003633319167420268, 0.0035769897513091564"
img76.png,vrachimero LudIterator,"vr, revolution, Revolution, Stuart, igli, FI, Ped, costs, travel, Street","0.011746322736144066, 0.010570546612143517, 0.00807312224060297, 0.007554429583251476, 0.0056139747612178326, 0.005548570305109024, 0.005356892012059689, 0.004564129281789064, 0.003783796215429902, 0.002923891181126237"
img77.png,Stuart Grundiani Revolution Raw,"Stuart, FI, Gia, Revolution, tim, _, Nicola, adin, revolution, cation","0.028540486469864845, 0.022054379805922508, 0.020718172192573547, 0.007681568153202534, 0.0067789601162076, 0.004143895115703344, 0.0037000817246735096, 0.0036427173763513565, 0.0035168780013918877, 0.0033167318906635046"
img78.png,Stuart Allen Ring Smith Wahl,"Stuart, tim, trav, Ped, risk, travel, out, _, Revolution, imp","0.022240707650780678, 0.007961207069456577, 0.00532406335696578, 0.004716858733445406, 0.00453615840524435, 0.004130219575017691, 0.004082100931555033, 0.004050333984196186, 0.0039719934575259686, 0.0038497878704220057"
