img79.png,Stuart Stuartisonguer aid,"Stuart, revolution, storm, riel, rile, mile, amen, Revolution, transport, lach","0.014701527543365955, 0.007930879481136799, 0.007306267973035574, 0.006057109218090773, 0.004867024254053831, 0.004345763009041548, 0.004212058149278164, 0.004130589310079813, 0.004003504756838083, 0.003910763654857874"
img80.png,FIanga compl Sil Gia,"FI, Stuart, amen, riel, tim, _, Revolution, out, revolution, tail","0.012151175178587437, 0.010515964590013027, 0.007876094430685043, 0.006842869333922863, 0.00464823842048645, 0.004594084806740284, 0.003440810600295663, 0.0032960947137326, 0.0029201782308518887, 0.0028861570172011852"
img81.png,rielarga settlement Marg Mart,"riel, Stuart, out, travel, Ped, uv, revolution, values, Revolution, _","0.012399105355143547, 0.008826694451272488, 0.00684743607416749, 0.005566926673054695, 0.005523604340851307, 0.0052912887185812, 0.0052296435460448265, 0.004687821958214045, 0.004202136769890785, 0.004153180401772261"
img82.png,revolutioninnital Nicolaosz,"revolution, Revolution, travel, trav, Ped, out, risk, vr, Stuart, riel","0.015301174484193325, 0.012586402706801891, 0.011238393373787403, 0.0077542574144899845, 0.007115707267075777, 0.006255107466131449, 0.005226337816566229, 0.0044703236781060696, 0.004401017911732197, 0.00403860118240118"
img83.png,Stuartenson Nicolalez�,"Stuart, FI, amen, Revolution, Nicola, travel, revolution, Vitt, imp, trav","0.016889728605747223, 0.011883407831192017, 0.009111324325203896, 0.007123679853975773, 0.006410617846995592, 0.006045788526535034, 0.004973129834979773, 0.004388771485537291, 0.004320730455219746, 0.004220640752464533"
img84.png,vrachimdit Cobrome,"vr, amen, Stuart, tim, za, achim, _, ajo, imp, ayer","0.011179326102137566, 0.004226651042699814, 0.004064730368554592, 0.0039550913497805595, 0.003657861612737179, 0.0035731273237615824, 0.003531498834490776, 0.0034362429287284613, 0.003240685909986496, 0.003228051820769906"
img85.png,Stuartrokadinumnicos,"Stuart, riel, viz, rile, zten, succ, amen, mile, sail, inson","0.045128583908081055, 0.005347896367311478, 0.004646332934498787, 0.004610174801200628, 0.0035904080141335726, 0.003333580680191517, 0.003320584539324045, 0.002941875020042062, 0.0025659489911049604, 0.002467649057507515"
img86.png,Stuart draftates Captainья,"Stuart, amen, Revolution, uv, _, vr, traffic, revolution, ayer, Generation","0.018571067601442337, 0.007244181353598833, 0.006858653388917446, 0.006493641994893551, 0.0056197792291641235, 0.005425641313195229, 0.0035030574072152376, 0.0032524787820875645, 0.003227167297154665, 0.0030673795845359564"
img87.png,FIutznestor cond,"FI, tim, Stuart, week, mile, travel, Revolution, Salt, ing, dist","0.005618941504508257, 0.004063012078404427, 0.003984425682574511, 0.0039534191600978374, 0.0034482332412153482, 0.003264721715822816, 0.0030789258889853954, 0.00293793180026114, 0.0029264776967465878, 0.002881106687709689"
img88.png,Stuart iter Row sooner Raw,"Stuart, Vitt, lement, inson, revolution, dist, lach, uv, riel, out","0.035835083574056625, 0.012050229124724865, 0.011817156337201595, 0.007933663204312325, 0.005223387852311134, 0.004793250001966953, 0.004609622992575169, 0.004132039379328489, 0.0035620408598333597, 0.0033462275750935078"
img89.png,StuartlickPtr ursagg,"Stuart, inson, Nicola, Ped, lement, amen, storm, travel, ril, vr","0.015038035809993744, 0.008669416420161724, 0.006268785800784826, 0.005382962990552187, 0.004920426290482283, 0.0038022107910364866, 0.0037579138297587633, 0.003461952554062009, 0.0033034179359674454, 0.003043251344934106"
img90.png,Stuartatu Arn duty Hend,"Stuart, uv, Nicola, Gia, vr, 宿, rile, imp, amen, Revolution","0.020163273438811302, 0.019542913883924484, 0.00747583108022809, 0.00670129107311368, 0.004960561636835337, 0.004641849081963301, 0.00451664300635457, 0.0038784099742770195, 0.0030087328050285578, 0.002973679918795824"
img91.png,Stuart Revolution rival env applicable,"Stuart, trav, Revolution, uv, cost, eff, vr, ing, revolution, tim","0.014739388599991798, 0.011125873774290085, 0.006617662496864796, 0.0054223183542490005, 0.004898655693978071, 0.004822709131985903, 0.004803907126188278, 0.003998166415840387, 0.0038300089072436094, 0.003528369590640068"
img92.png,amen iterram otherwiselett,"amen, Stuart, Revolution, FI, vr, selector, storm, revolution, travel, Ped","0.008817066438496113, 0.007112440187484026, 0.003958669491112232, 0.003792172996327281, 0.002896224381402135, 0.0028513227589428425, 0.0027744127437472343, 0.002720750868320465, 0.0026890530716627836, 0.002565912436693907"
img93.png,vr Fr Hat Torкло,"vr, Stuart, Revolution, lement, revolution, amen, Fur, ajo, rile, riel","0.016323084011673927, 0.01175707671791315, 0.011574799194931984, 0.005196831189095974, 0.004258131142705679, 0.0033422454725950956, 0.0031643740367144346, 0.002961065387353301, 0.002926567802205682, 0.0028254680801182985"
img94.png,travellick otherwise Smithiak,"travel, Ped, uv, Stuart, revolution, riel, Revolution, vr, *, rile","0.010989884845912457, 0.010445738211274147, 0.009400147013366222, 0.007823496125638485, 0.007823496125638485, 0.006877294275909662, 0.006335660349577665, 0.006261846981942654, 0.005070998799055815, 0.004027191083878279"
img95.png,rile coh mockowy Según,"rile, Vitt, revolution, Stuart, Revolution, vr, lement, inson, magn, igli","0.019941290840506554, 0.013077817857265472, 0.007278901524841785, 0.005061680916696787, 0.004886823706328869, 0.0047736200504004955, 0.004380520433187485, 0.0037322496064007282, 0.003660061629489064, 0.00350612448528409"
img96.png,vr Reg link Dres Según,"vr, Vitt, amen, travel, FI, Stuart, riel, imp, _, Revolution","0.006152505055069923, 0.005366310942918062, 0.004518886562436819, 0.004501268733292818, 0.0042951409704983234, 0.004228550940752029, 0.004019181244075298, 0.003880336182191968, 0.003673828672617674, 0.003306088037788868"
img97.png,Stuart Adam Madonna🌍pis,"Stuart, uv, Revolution, adin, FI, vr, contin, rile, <0xA1>, amen","0.026862971484661102, 0.008721129968762398, 0.005652822554111481, 0.005457543767988682, 0.004854039754718542, 0.0037803298328071833, 0.0036783621180802584, 0.0028313363436609507, 0.0028202978428453207, 0.0027765731792896986"
img98.png,Stuart magnexec ben Fame,"Stuart, uv, Revolution, revolution, out, FI, Gia, vr, ment, amen","0.016223695129156113, 0.011869508773088455, 0.008189715445041656, 0.00742774922400713, 0.0071992212906479836, 0.005308372899889946, 0.004739843308925629, 0.004315676633268595, 0.0040069702081382275, 0.0037495249416679144"
img99.png,Stuart Stuart travrah Fame,"Stuart, lement, vr, iss, travel, imp, out, <0xA1>, Ped, mile","0.009276765398681164, 0.008956296369433403, 0.005496302153915167, 0.005411089863628149, 0.004793959204107523, 0.004314097110182047, 0.0040211803279817104, 0.0034664743579924107, 0.0032311088871210814, 0.003035346046090126"
img100.png,rile aeraki et Tok,"rile, ipes, ment, Stuart, props, props, selector, lement, out, 宿","0.013276645913720131, 0.004464525263756514, 0.00400197459384799, 0.003909268416464329, 0.0037012211978435516, 0.0032156766392290592, 0.002997340401634574, 0.002997340401634574, 0.00298565486446023, 0.002939366502687335"
img101.png,Stuartnem tor Revolutionlicht,"Stuart, costs, vr, riel, Revolution, revolution, FI, travel, trav, out","0.015287450514733791, 0.0090929651632905, 0.00891709141433239, 0.00673097325488925, 0.005580172874033451, 0.00455440441146493, 0.004019247833639383, 0.00394150847569108, 0.0033582071773707867, 0.003191930940374732"
img102.png,Stuart Giovasso respect Pil,"Stuart, vr, riel, Ferd, pri, Cross, peer, ssl, lide, Ped","0.008839872665703297, 0.005934809800237417, 0.005467402748763561, 0.005257950164377689, 0.0048438506200909615, 0.0044798292219638824, 0.004325071815401316, 0.0038921430241316557, 0.0037284449208527803, 0.0035856107715517282"
img103.png,Revolutionlousel otherwise trade,"Revolution, lide, travel, mile, FI, revolution, co, Stuart, <0xA1>, trav","0.007959202863276005, 0.006126416847109795, 0.005800375249236822, 0.005385466385632753, 0.0049613239243626595, 0.0044126929715275764, 0.0043104724027216434, 0.004161565564572811, 0.003686942858621478, 0.0035595756489783525"
img104.png,Stuart Nemamyerer sooner,"Stuart, 宿, Revolution, Vitt, oug, revolution, travel, lement, Nicola, uv","0.05204934999346733, 0.009895063936710358, 0.006265163887292147, 0.0060251494869589806, 0.004373789764940739, 0.004108794964849949, 0.004060926381498575, 0.003966854885220528, 0.003890128806233406, 0.0036118626594543457"
img105.png,Stuart Según Dar otherwise Pit,"Stuart, FI, ril, <0xB4>, dist, rile, Revolution, amen, revolution, ment","0.008333188481628895, 0.0054864282719790936, 0.00505433464422822, 0.00499544944614172, 0.0040612719021737576, 0.003860184457153082, 0.0036834136117249727, 0.003366912482306361, 0.003212730400264263, 0.0031260724645107985"
img106.png,Stuartmys Storm Margmys,"Stuart, vr, Revolution, revolution, ude, inson, _, za, riel, Vitt","0.010162638500332832, 0.00813407450914383, 0.007791965268552303, 0.0058359126560389996, 0.0049528745003044605, 0.0044571044854819775, 0.0037826956249773502, 0.003652020823210478, 0.003652020823210478, 0.0032228969503194094"
img107.png,Revolution Julian mentmyszm,"Revolution, imp, Gia, revolution, dimensions, Generation, Stuart, tim, FI, _","0.007071572355926037, 0.0059548611752688885, 0.004425277002155781, 0.004289125557988882, 0.004108730237931013, 0.004060862585902214, 0.0036543800961226225, 0.0032629945781081915, 0.003237601835280657, 0.002936377190053463"
img108.png,vr bere mieˌ Según,"vr, Revolution, rile, amen, <0xB4>, dimensions, costs, adin, bro, revolution","0.02749869041144848, 0.007817195728421211, 0.006088037975132465, 0.005289379507303238, 0.005207374691963196, 0.004595492500811815, 0.004250135738402605, 0.004184243269264698, 0.004071380477398634, 0.003930733073502779"
img109.png,штаuv Pon bias Bed,"шта, steller, Horn, Ring, lach, ring, ring, avi, selector, lement","0.009379292838275433, 0.00789815653115511, 0.006703078746795654, 0.005666650366038084, 0.00450023403391242, 0.004310959950089455, 0.003601941978558898, 0.002962876344099641, 0.0028717187233269215, 0.00266630039550364"
img110.png,Stuart Revolutionau Wahlasso,"Stuart, _, vr, tim, шта, Vitt, imp, amen, FI, travel","0.006383584812283516, 0.00572220841422677, 0.005354559980332851, 0.0036945354659110308, 0.003651492530480027, 0.0035808663815259933, 0.0035116062499582767, 0.00331176002509892, 0.0032731767278164625, 0.003222431056201458"
img111.png,travel Stern Cape Nicola opposition,"travel, adin, trav, Revolution, revolution, amen, oug, vr, Stuart, Gia","0.009366798214614391, 0.007674878928810358, 0.006142896134406328, 0.005681250244379044, 0.0051526702009141445, 0.004221946932375431, 0.003966151736676693, 0.003432418452575803, 0.0034057069569826126, 0.003352906322106719"
img112.png,Stuart complitto Revolution bere,"Stuart, vr, revolution, Ped, Revolution, amen, rile, za, storm, iss","0.033085670322179794, 0.010012035258114338, 0.007736701052635908, 0.004477658774703741, 0.0042063710279762745, 0.003966985736042261, 0.0035838729236274958, 0.0034872039686888456, 0.0034736087545752525, 0.0033016183879226446"
img113.png,Stuart slot Fon prime duty,"Stuart, Vitt, Revolution, oug, Nicola, Salt, <0xA1>, vr, revolution, travel","0.034630704671144485, 0.009033959358930588, 0.006406036205589771, 0.005901516880840063, 0.0058100223541259766, 0.005522348452359438, 0.005087425000965595, 0.004989026114344597, 0.004760561976581812, 0.003993166144937277"
img114.png,Stuart Hudavel ( sooner,"Stuart, contin, vr, imp, Revolution, cock, tim, travel, revolution, ock","0.02230187878012657, 0.009781102649867535, 0.008108818903565407, 0.00741205969825387, 0.006962986197322607, 0.005750013515353203, 0.0056168148294091225, 0.004548634868115187, 0.0036549309734255075, 0.003065761411562562"
img115.png,vr bere Según Dres Read,"vr, travel, Stuart, Revolution, revolution, ing, costs, imp, Ho, adin","0.011931312270462513, 0.006238431204110384, 0.006189883220940828, 0.006070159841328859, 0.005294487811625004, 0.005171841010451317, 0.0025702675338834524, 0.002560246968641877, 0.0024911887012422085, 0.002312990138307214"
img116.png,Stuart Rowuzram peer,"Stuart, revolution, Revolution, Gia, fah, uv, achim, travel, rile, contin","0.02004585601389408, 0.0067936694249510765, 0.0067671830765903, 0.006636294070631266, 0.006357180420309305, 0.004561053588986397, 0.0037371935322880745, 0.002979550277814269, 0.002865405520424247, 0.002809983678162098"
img117.png,Stuartmys Deutschland draftmys,"Stuart, ril, rile, stri, Ped, revolution, lement, amen, storm, Revolution","0.019017795100808144, 0.008308259770274162, 0.006834188010543585, 0.006807543803006411, 0.005914495792239904, 0.00536421500146389, 0.005019568372517824, 0.00455255014821887, 0.004412483423948288, 0.004344074055552483"
img118.png,Stuart Revolution xx accommodadora,"Stuart, FI, Ped, Vitt, lement, travel, _, Salt, revolution, amen","0.0076314774341881275, 0.006734755355864763, 0.006253008730709553, 0.005649122409522533, 0.005369415041059256, 0.005369415041059256, 0.004869848024100065, 0.004399541299790144, 0.004314446356147528, 0.004132986068725586"
img119.png,vroaiwloyd ut,"vr, Revolution, rile, Stuart, FI, Vitt, _, MT, via, Ind","0.014286478981375694, 0.007072319742292166, 0.006592127028852701, 0.00636439910158515, 0.006216967944055796, 0.004340142942965031, 0.003175316611304879, 0.0025916178710758686, 0.0025815139524638653, 0.002472938969731331"
img120.png,Vittebbibaassoava,"Vitt, Stuart, Revolution, vr, trav, Gia, FI, Nicola, Ferd, out","0.0071128299459815025, 0.005432334262877703, 0.004794018343091011, 0.004628406371921301, 0.004297330044209957, 0.0042472644709050655, 0.004132702015340328, 0.0040845549665391445, 0.0033994680270552635, 0.003294877242296934"
img121.png,rielcot Allenaran Hem,"riel, trav, Stuart, Revolution, revolution, FI, Generation, igli, Ped, uv","0.012977274134755135, 0.0073080831207334995, 0.00657656230032444, 0.005669351201504469, 0.0044673411175608635, 0.004164019599556923, 0.0040517025627195835, 0.00395784480497241, 0.003942414652556181, 0.003806222230195999"
img122.png,Stuart magnья Fon Gall,"Stuart, Revolution, _, imp, revolution, dist, Shared, riel, lach, Lud","0.017000751569867134, 0.0058523970656096935, 0.004540081601589918, 0.0036338360514491796, 0.0034003641922026873, 0.0032700984738767147, 0.00312034972012043, 0.0030361837707459927, 0.0030125556513667107, 0.0029542874544858932"
img123.png,Stuart ber sel whPA,"Stuart, amen, _, Nicola, risk, storm, FI, incon, imp, uv","0.007078730501234531, 0.005868474021553993, 0.00496109202504158, 0.004412486217916012, 0.0038336345460265875, 0.003545532701537013, 0.0035179408732801676, 0.0031045719515532255, 0.0029973231721669436, 0.0029739979654550552"
img124.png,Ped messons Marg Según,"Ped, Stuart, rile, loss, ril, vr, isses, alog, ssl, <0xB4>","0.009535648860037327, 0.008750403299927711, 0.008448116481304169, 0.007197885308414698, 0.005967256613075733, 0.0059439921751618385, 0.00510406494140625, 0.005064344499260187, 0.004665493033826351, 0.004053450655192137"
img125.png,Stuart Gilring Quart knock,"Stuart, revolution, Revolution, mile, lement, ment, Gia, storm, jam, amen","0.015688685700297356, 0.010329161770641804, 0.009478570893406868, 0.006774029228836298, 0.005400727037340403, 0.004710597451776266, 0.004494884051382542, 0.004029187839478254, 0.003668617457151413, 0.003528075059875846"
img126.png,revolution otherwise Ya otherwise Marg,"revolution, Stuart, Revolution, costs, ril, FI, travel, Salt, trav, Meteor","0.010308765806257725, 0.006867119111120701, 0.006252582650631666, 0.004468519240617752, 0.003943454474210739, 0.0037628705613315105, 0.0037628705613315105, 0.002941996091976762, 0.0026578721590340137, 0.0026578721590340137"
img127.png,Stuarttortidtei canton,"Stuart, Generation, vr, Revolution, Vitt, revolution, Street, ril, FI, <0xA1>","0.013904763385653496, 0.006723904516547918, 0.0063909804448485374, 0.005216166377067566, 0.004805357661098242, 0.004046516492962837, 0.0037570635322481394, 0.003742416389286518, 0.0035850154235959053, 0.0035710386000573635"
img128.png,vrora magnDeleg pill,"vr, FI, _, Stuart, Ferd, Revolution, travel, ris, Ped, storm","0.015950342640280724, 0.012422138825058937, 0.01157870702445507, 0.009231350384652615, 0.005687269847840071, 0.005363606382161379, 0.004587735515087843, 0.0028485897928476334, 0.0027609479147940874, 0.002750184154137969"
img129.png,Stuart prime Ludanel Según,"Stuart, revolution, Revolution, Gia, lement, _, FI, <0xB4>, contin, GT","0.008321259170770645, 0.0050274222157895565, 0.004930183291435242, 0.00421700906008482, 0.004071330651640892, 0.00333592901006341, 0.0030973050743341446, 0.0027872726786881685, 0.0027227054815739393, 0.002649265341460705"
img130.png,Stuart totadin mist uns,"Stuart, mile, travel, Ped, trav, revolution, FI, vr, Revolution, lement","0.05797845125198364, 0.014375711791217327, 0.007694764994084835, 0.0056516434997320175, 0.0045235189609229565, 0.003648975398391485, 0.0034278950188308954, 0.0032202096190303564, 0.003133349819108844, 0.002966596046462655"
img131.png,Stuart solramaasso mist,"Stuart, Ped, Revolution, vr, _, eff, amen, out, imp, travel","0.008222377859055996, 0.007574809715151787, 0.007457373198121786, 0.007032973226159811, 0.005477285012602806, 0.0050656599923968315, 0.004487926606088877, 0.004383963532745838, 0.0040072668343782425, 0.003691667690873146"
img132.png,PedlickSOURтан Iter,"Ped, travel, uv, amen, Stuart, Gia, Tag, FI, GT, vr","0.011824282817542553, 0.011460487730801105, 0.010113845579326153, 0.005165646784007549, 0.004796141292899847, 0.0044530658051371574, 0.003400973044335842, 0.0033351921010762453, 0.0032834848389029503, 0.003096620785072446"
img133.png,Vitt Nicola Revolutioniec Según,"Vitt, Stuart, 宿, out, travel, lement, tim, rile, inson, channels","0.010436518117785454, 0.006379715632647276, 0.005718740168958902, 0.005066522862762213, 0.00491064228117466, 0.0035094779450446367, 0.0033618740271776915, 0.0027654021978378296, 0.002733183791860938, 0.0026594609953463078"
img134.png,tim Adamadin Según Dar,"tim, Stuart, Revolution, FI, revolution, riel, Gia, idor, travel, igli","0.012760907411575317, 0.008500597439706326, 0.008401562459766865, 0.007619885727763176, 0.0064922235906124115, 0.00309076183475554, 0.002748980652540922, 0.0027063614688813686, 0.0026958102826029062, 0.0024932168889790773"
img135.png,Stuart Rowramloyd mie,"Stuart, FI, vr, _, travel, adin, tim, amen, GT, Revolution","0.012577757239341736, 0.00834592618048191, 0.005941311828792095, 0.005243189167231321, 0.004699964541941881, 0.004484737757593393, 0.004467253107577562, 0.004296115133911371, 0.002720130840316415, 0.0026364410296082497"
img136.png,Stuart slot subtamil Según,"Stuart, 선, Revolution, Vitt, vr, Ped, ayer, zig, FI, lement","0.012504289858043194, 0.005131749901920557, 0.005091814789921045, 0.004654295276850462, 0.004582137335091829, 0.004221262410283089, 0.0040279570966959, 0.0037987250834703445, 0.0037544684018939734, 0.0034995493479073048"
img137.png,StuartChannel otherwiseanel Lomb,"Stuart, tim, vr, travel, Ped, _, Num, FI, Vitt, Tim","0.010866851545870304, 0.005379481706768274, 0.005296080373227596, 0.005113125313073397, 0.004917244426906109, 0.004390604794025421, 0.003639939473941922, 0.0030651362612843513, 0.002845882438123226, 0.0026115288492292166"
img138.png,Stuart Adam tel Hend submission,"Stuart, travel, adin, Revolution, <0xB4>, Ped, selector, revolution, izin, Ferd","0.01497723814100027, 0.010094597935676575, 0.0063915010541677475, 0.005403249058872461, 0.00449698232114315, 0.0043586245737969875, 0.003801659680902958, 0.0037573694717139006, 0.003302939934656024, 0.0032900627702474594"
img139.png,FIutz nem Stuart Giov,"FI, travel, Stuart, riel, amen, Revolution, vr, trav, ajo, rile","0.008851578459143639, 0.007781036663800478, 0.007002175319939852, 0.006655473727732897, 0.006131309550255537, 0.006083595100790262, 0.005919500719755888, 0.0037921746261417866, 0.0037333823274821043, 0.0035209148190915585"
img140.png,Stuartperlокlett Lud,"Stuart, uv, adin, amen, Nicola, costs, Revolution, accommod, vr, travel","0.02738928236067295, 0.01076777745038271, 0.004949142225086689, 0.004333613906055689, 0.003809490939602256, 0.003750429954379797, 0.003706736257299781, 0.003578685689717531, 0.003220468293875456, 0.003097094129770994"
img141.png,Stuart Nem bere sooneriframe,"Stuart, Vitt, travel, tim, imp, Revolution, trav, FI, ment, amen","0.010293048806488514, 0.007953851483762264, 0.005115371197462082, 0.00471250107511878, 0.004015101119875908, 0.0032388512045145035, 0.00305452779866755, 0.002983769867569208, 0.002643473446369171, 0.0024930329527705908"
img142.png,Stuart Row ber Read Smith,"Stuart, uv, Revolution, FI, tim, Generation, dist, imp, revolution, *","0.01819170080125332, 0.0076728202402591705, 0.0069589451886713505, 0.006692353170365095, 0.005171449389308691, 0.005031957756727934, 0.005031957756727934, 0.0050123403780162334, 0.0045106178149580956, 0.004171640146523714"
img143.png,Revolution Revolution tor mediuminn,"Revolution, Stuart, amen, revolution, FI, vr, riel, trav, Nicola, travel","0.01426859200000763, 0.013829593546688557, 0.00594803411513567, 0.005394632462412119, 0.004779379814863205, 0.004614274017512798, 0.004184964578598738, 0.0036501912400126457, 0.003297672839835286, 0.0028650679159909487"
img144.png,Stuart nemini sooner Fon,"Stuart, Revolution, riel, revolution, travel, Salt, storm, lach, tim, za","0.008326934650540352, 0.007883783429861069, 0.00767113221809268, 0.005723013076931238, 0.005634286440908909, 0.004857058171182871, 0.004544995725154877, 0.003767933463677764, 0.0030873341020196676, 0.002945954678580165"
img145.png,Stuartnemamy sooner Raw,"Stuart, riel, storm, dist, amen, revolution, ajo, za, rile, duty","0.023185202851891518, 0.009258531965315342, 0.006313770078122616, 0.0056375619024038315, 0.005073257256299257, 0.00407647667452693, 0.00407647667452693, 0.003799694124609232, 0.0034732013009488583, 0.0030531398952007294"
img146.png,Stuartensoniareero urs,"Stuart, lement, ris, FI, tc, Tel, revolution, oug, amen, riel","0.01659461297094822, 0.009272443130612373, 0.0041307262144982815, 0.004019306506961584, 0.003437895094975829, 0.003242243779823184, 0.0031795334070920944, 0.0029636509716510773, 0.0028390036895871162, 0.002625649329274893"
img147.png,�ett Raw Adam Según,"<0xB4>, Ped, vr, Vitt, zig, eff, rile, amen, 선, transport","0.015189167112112045, 0.007063618861138821, 0.00545834144577384, 0.0045428345911204815, 0.003962330985814333, 0.0035379633773118258, 0.003483112435787916, 0.0028989033307880163, 0.0027987591456621885, 0.0025284686125814915"
img148.png,Stuart basicassoarga Hend,"Stuart, Revolution, revolution, peer, _, FI, adi, dist, Salt, properties","0.007355752866715193, 0.006802959367632866, 0.006316334009170532, 0.004639214836061001, 0.004478951450437307, 0.003937250934541225, 0.003126811934635043, 0.002983625279739499, 0.0028693240601569414, 0.00278104399330914"
img149.png,Stuart besAA recon Según,"Stuart, Revolution, revolution, riel, trav, ing, travel, vr, out, Ped","0.008815323002636433, 0.008411640301346779, 0.007055696099996567, 0.00625099940225482, 0.005101917311549187, 0.004830398131161928, 0.004591228440403938, 0.003988928627222776, 0.003973377402871847, 0.0030584174674004316"
img150.png,StuartChannel Raw Fur Tir,"Stuart, Nicola, lement, Salt, dist, <0xA1>, Ped, ril, Vitt, revolution","0.043250590562820435, 0.009956851601600647, 0.007399303838610649, 0.004332867916673422, 0.003976062871515751, 0.003838708158582449, 0.0037939860485494137, 0.003522596787661314, 0.0033091732766479254, 0.0028194510377943516"
img151.png,tim recon Giov Segúniframe,"tim, Stuart, FI, Ped, amen, ing, achim, revolution, ymen, yar","0.010059015825390816, 0.006344141438603401, 0.005280063021928072, 0.0047701396979391575, 0.004605352878570557, 0.004144369158893824, 0.003773490898311138, 0.0037005054764449596, 0.0033300940413028, 0.0032912972383201122"
img152.png,vr bereaneleli tor,"vr, FI, Stuart, Generation, tim, Revolution, _, шта, imp, riel","0.01549724955111742, 0.009362911805510521, 0.009110362268984318, 0.007235097698867321, 0.004440036602318287, 0.003842531004920602, 0.0030755233019590378, 0.0027785038109868765, 0.0026720610912889242, 0.0025999867357313633"
img153.png,StuartCA subsianiotr,"Stuart, uv, Revolution, riel, Generation, revolution, travel, storm, ring, _","0.008793354034423828, 0.0077298544347286224, 0.006043578498065472, 0.004837219137698412, 0.004762224853038788, 0.004169943742454052, 0.003948023542761803, 0.003457004902884364, 0.0034435270354151726, 0.002922483254224062"
img154.png,Stuart bereiani Fon Según,"Stuart, Ped, Vitt, tim, vr, imp, amen, dimensions, revolution, Revolution","0.009159717708826065, 0.006173612549901009, 0.00540579529479146, 0.005019111558794975, 0.00486468942835927, 0.003908887971192598, 0.0037298868410289288, 0.0029853638261556625, 0.0029853638261556625, 0.0029621317517012358"
img155.png,bro bere Bescot counter,"bro, riel, vr, revolution, amen, capit, Stuart, Revolution, hor, <0xA1>","0.0073042986914515495, 0.007024475373327732, 0.006676669232547283, 0.004923067521303892, 0.004734467715024948, 0.004570913501083851, 0.003490977454930544, 0.0033181272447109222, 0.002951203379780054, 0.0026661900337785482"
img156.png,travel gent s Gia Marg,"travel, revolution, Revolution, trav, vr, Ped, Stuart, riel, Street, waves","0.015768257901072502, 0.01516418531537056, 0.012184765189886093, 0.006446050480008125, 0.006223369389772415, 0.005800818558782339, 0.00448252446949482, 0.00422742310911417, 0.0040496233850717545, 0.004033835604786873"
img157.png,vrutz express Según SE,"vr, _, Stuart, amen, Grande, el, Ped, <0xB4>, *, storm","0.015066170133650303, 0.011328204534947872, 0.010476876050233841, 0.007257120218127966, 0.004453551024198532, 0.003145728725939989, 0.0031090795528143644, 0.002955138450488448, 0.002909323200583458, 0.0028088195249438286"
