img157.png,Behavioreston concernzakerson,"Behavior, Gon, reen, mist, dece, Listener, ór, defin, height, Stutt","0.010094140656292439, 0.007709273137152195, 0.0038163666613399982, 0.003801488084718585, 0.0036132633686065674, 0.0034612941090017557, 0.0027812281623482704, 0.0027595844585448503, 0.002269972348585725, 0.002226067241281271"
img158.png,Gon industry Lauf katolistra,"Gon, Behavior, Listener, reen, Division, dece, division, aszt, mist, istica","0.012011537328362465, 0.010851520113646984, 0.0059229605831205845, 0.004183633252978325, 0.004023361019790173, 0.0033616439905017614, 0.0033095264807343483, 0.0028529902920126915, 0.002830788027495146, 0.0027117289137095213"
img159.png,Behaviorestonabahodumed,"Behavior, dece, Division, acher, Gon, reen, disappoint, ór, Listener, eros","0.010250174440443516, 0.007617282215505838, 0.0039517940022051334, 0.00300636631436646, 0.0027054371312260628, 0.002472969703376293, 0.002472969703376293, 0.002332232426851988, 0.002234142040833831, 0.0021401767153292894"
img160.png,Behaviorestonaba directistra,"Behavior, mist, height, reen, Gon, worse, re, dece, rys, ór","0.01112355850636959, 0.005213506985455751, 0.004044453613460064, 0.004028685856610537, 0.003844199003651738, 0.0035553027410060167, 0.003486537141725421, 0.003392493352293968, 0.0032371398992836475, 0.0024626862723380327"
img161.png,Behaviorott Goldenersonovi,"Behavior, Gon, dece, Multiple, ór, Stutt, reen, mist, Listener, istic","0.015338398516178131, 0.013378390111029148, 0.00386303523555398, 0.003586706705391407, 0.0035173334181308746, 0.0033431784249842167, 0.0031161848455667496, 0.0030678727198392153, 0.0028932795394212008, 0.0023706683423370123"
img162.png,Behavior Wu alone Somsing,"Behavior, dece, Gon, Division, division, height, reen, Listener, re, talk","0.010851830244064331, 0.010559121146798134, 0.00819139089435339, 0.005923130549490452, 0.005854123272001743, 0.003764970460906625, 0.0031952890567481518, 0.0029899936635047197, 0.002978336764499545, 0.0028754489030689"
img163.png,Gon industryodelcertain sir,"Gon, Behavior, lat, dece, mist, disappoint, Multiple, division, multiple, ór","0.012116475030779839, 0.00929002370685339, 0.004187341779470444, 0.004011227749288082, 0.003903031814843416, 0.0033646232914179564, 0.003273868467658758, 0.0027461256831884384, 0.002682511694729328, 0.002672053873538971"
img164.png,Behaviorael~asztior,"Behavior, reen, ór, Gon, Listener, worse, dece, registered, pause, fool","0.013778355903923512, 0.0055452557280659676, 0.005416800267994404, 0.004932052455842495, 0.003947565332055092, 0.0031227809377014637, 0.002910751849412918, 0.002876840764656663, 0.002876840764656663, 0.002713118912652135"
img165.png,dece markerinekerson uniqu,"dece, mist, Behavior, fool, reen, Gon, FC, ór, Multiple, Listener","0.006327581126242876, 0.005897954571992159, 0.005286892410367727, 0.004647476598620415, 0.004117435310035944, 0.0036194578278809786, 0.0033605529461055994, 0.002988938009366393, 0.002919699065387249, 0.002700280165299773"
img166.png,Behaviorottob divisiontek,"Behavior, height, Listener, dece, Gon, pause, reen, ór, defin, recent","0.01605410873889923, 0.004617581609636545, 0.003624381497502327, 0.0035404227674007416, 0.0034719447139650583, 0.0028448093216866255, 0.002540129004046321, 0.0024428179021924734, 0.0022769568022340536, 0.0022329166531562805"
img167.png,Gon industrysing Comicsiali,"Gon, division, Behavior, Division, re, dece, cat, Listener, -, san","0.006399328354746103, 0.005603439174592495, 0.00520261749625206, 0.004849372431635857, 0.0041967821307480335, 0.0037766946479678154, 0.003438719781115651, 0.0029528047889471054, 0.0026572367642074823, 0.0024575423449277878"
img168.png,Gon industry finiteBehaviorBehavior,"Gon, dece, Behavior, mist, Listener, recent, ór, Division, last, acher","0.014548265375196934, 0.007848200388252735, 0.007606737315654755, 0.006136107258498669, 0.003375469008460641, 0.003158597508445382, 0.003073399420827627, 0.0027442369610071182, 0.0026185689494013786, 0.0021624064538627863"
img169.png,Gon orwidrdalet,"Gon, dece, istic, , recent, Listener, Behavior, Multiple, mist, fool","0.007773905526846647, 0.006495341658592224, 0.004696729592978954, 0.004412169102579355, 0.004001663997769356, 0.0039550429210066795, 0.0036293515004217625, 0.003409460186958313, 0.003291678847745061, 0.0030562204774469137"
img170.png,Listenersing Goldencir други,"Listener, dece, Division, Gon, Behavior, division, re, storm, bur, word","0.006164417136460543, 0.00614038435742259, 0.004492401145398617, 0.004457441158592701, 0.004026962444186211, 0.00391834182664752, 0.0033778217621147633, 0.003160798689350486, 0.0027568978257477283, 0.0025697113014757633"
img171.png,Gon industry Pegrafreading,"Gon, reen, division, Division, re, dece, mist, height, disappoint, cas","0.013669684529304504, 0.007788750808686018, 0.0071753342635929585, 0.004705698695033789, 0.004650875926017761, 0.0045609199441969395, 0.004472703672945499, 0.0044552660547196865, 0.003349900245666504, 0.0030981511808931828"
img172.png,Behaviorestoniale Leisticina,"Behavior, mist, reen, Gon, quote, cat, rys, wind, istic, re","0.016105109825730324, 0.007667182013392448, 0.005675551947206259, 0.0044897315092384815, 0.003551670117303729, 0.0027877376414835453, 0.0025185111444443464, 0.0024505783803761005, 0.0024505783803761005, 0.0024505783803761005"
img173.png,Behavioravig folgsingiani,"Behavior, dece, fool, division, cat, wind, Listener, san, recent, word","0.013804477639496326, 0.011670033447444439, 0.005427069496363401, 0.005158356856554747, 0.004360772669315338, 0.0036435623187571764, 0.0032406512182205915, 0.002950646448880434, 0.0025937845930457115, 0.002533699618652463"
img174.png,Behavioreston umreen colored,"Behavior, dece, Listener, mist, Gon, worse, reen, cat, Ron, defin","0.008809355087578297, 0.005937469191849232, 0.004033216740936041, 0.004033216740936041, 0.0035732323303818703, 0.0032661985605955124, 0.0029392605647444725, 0.002604040317237377, 0.0025437180884182453, 0.0024367321748286486"
img175.png,Gon industryanel rivalreen,"Gon, Behavior, reen, height, mist, dece, Division, ór, cas, os","0.017308417707681656, 0.00930078886449337, 0.00492035411298275, 0.004359192214906216, 0.004359192214906216, 0.0034484046045690775, 0.00342156901024282, 0.003316298360005021, 0.0030911301728338003, 0.0027600685134530067"
img176.png,Gon pastickerarcaerson,"Gon, dece, Behavior, Listener, re, istica, cat, mist, Division, division","0.007828804664313793, 0.006801783572882414, 0.006439799442887306, 0.005727675743401051, 0.003460467327386141, 0.003354000160470605, 0.003354000160470605, 0.0033409239258617163, 0.0033409239258617163, 0.0026636167895048857"
img177.png,Behaviorott concern alone Schmidt,"Behavior, Gon, height, dece, recent, Division, Wor, istica, ór, acher","0.011161441914737225, 0.010567440651357174, 0.007581767626106739, 0.004991705529391766, 0.003160550957545638, 0.002811052370816469, 0.002519811037927866, 0.0023857092019170523, 0.0023579145781695843, 0.0023304440546780825"
img178.png,Behavioreston ramcoschi,"Behavior, Gon, dece, ór, mist, reen, Division, acher, lat, Listener","0.009123379364609718, 0.006779919378459454, 0.0067271580919623375, 0.006597043015062809, 0.004080227576196194, 0.0034091579727828503, 0.0032785548828542233, 0.0031529555562883615, 0.003055949229747057, 0.0027608200907707214"
img179.png,Gon industryLMreen riv,"Gon, Behavior, mist, dece, Division, division, reen, talk, Las, last","0.012756387703120708, 0.007646999787539244, 0.0049565983936190605, 0.004937274381518364, 0.004674517549574375, 0.00293668732047081, 0.0027695600874722004, 0.0025414908304810524, 0.002131806453689933, 0.0021234953310340643"
img180.png,Gon industry finiteBehaviorBehavior,"Gon, Behavior, dece, reen, ór, Listener, height, Division, lat, mist","0.01144316978752613, 0.00833936221897602, 0.005405371077358723, 0.004714647773653269, 0.004481209442019463, 0.004377402365207672, 0.0040801879949867725, 0.004001269582659006, 0.0035588028840720654, 0.003265741281211376"
img181.png,Gonersonickeróranter,"Gon, Behavior, re, dece, reen, ór, registered, division, height, Division","0.01771555468440056, 0.008079150691628456, 0.006316675804555416, 0.004843162838369608, 0.00430759834125638, 0.004224281758069992, 0.003876419272273779, 0.003641558578237891, 0.0035157594829797745, 0.003502052742987871"
img182.png,Behavior nagidougin gro,"Behavior, dece, Multiple, recent, Listener, Gon, ór, instant, re, reen","0.01273249089717865, 0.005164526402950287, 0.003535684896633029, 0.003071856452152133, 0.003071856452152133, 0.0030124413315206766, 0.0028857418801635504, 0.0028521220665425062, 0.0025566257536411285, 0.0025566257536411285"
img183.png,Behavior Wu lipovi Zob,"Behavior, ór, re, reen, Green, Gon, dece, mist, instant, height","0.013415781781077385, 0.006745878607034683, 0.006118246354162693, 0.0038137740921229124, 0.0031865276396274567, 0.002662443555891514, 0.0023587942123413086, 0.0023495981004089117, 0.0021144093479961157, 0.0019176860805600882"
img184.png,Gon orreaderareclud,"Gon, Behavior, Division, dece, division, defin, Multiple, reen, re, wind","0.013087485916912556, 0.00892489030957222, 0.006710595916956663, 0.005853085778653622, 0.004871370270848274, 0.003563970560207963, 0.003481411375105381, 0.003454318968579173, 0.0031947228126227856, 0.0031329309567809105"
img185.png,Behavioreston umoseaug,"Behavior, ór, Gon, dece, Listener, Multiple, Division, reen, multiple, defin","0.03007764182984829, 0.007116214372217655, 0.006581422407180071, 0.004852836485952139, 0.0043670800514519215, 0.003509047208353877, 0.0033878255635499954, 0.0033878255635499954, 0.0031332264188677073, 0.0029897456988692284"
