Image File,Inference Result,Top 10 Words,Top 10 Probabilities
img1.png,next--one comedy,"next, Finn, subsequent, Brook, district, /, farther, anc, anth, ire","0.004377789329737425, 0.003939583897590637, 0.003573047462850809, 0.0032532967161387205, 0.003044274402782321, 0.0027718436904251575, 0.002446143189445138, 0.0023524330463260412, 0.002297939034178853, 0.0022272388450801373"
img2.png,further Act MilTS,"further, subsequent, aring, district, parent, farther, next, -, ready, anc","0.004779171664267778, 0.0038102876860648394, 0.003722022520378232, 0.0037075120490044355, 0.0028761562425643206, 0.0028426479548215866, 0.0027018985711038113, 0.0026913650799542665, 0.0025184466503560543, 0.00246973498724401"
img3.png,Brook OPancoped anc,"Brook, farther, next, Father, NI, district, ether, handed, good, further","0.005580129101872444, 0.0045189266093075275, 0.004163029603660107, 0.003179461695253849, 0.0025748065672814846, 0.002515161409974098, 0.0024955880362540483, 0.002381306840106845, 0.002245786366984248, 0.002210968639701605"
img4.png,Brook OPomeopedleich,"Brook, district, <0x0A>, aring, anth, ether, avia, imp, farther, further","0.007687145844101906, 0.005387496668845415, 0.0038203068543225527, 0.0034784292802214622, 0.002740936353802681, 0.0026774422731250525, 0.002544873161241412, 0.0023906868882477283, 0.0023444469552487135, 0.0023080995306372643"
img5.png,nextanc artificialired pole,"next, Brook, district, Father, ether, imp, subsequent, anth, <0x0A>, aring","0.009201292879879475, 0.00864381529390812, 0.004699561279267073, 0.004662988241761923, 0.004519523587077856, 0.0043294383212924, 0.004179875832051039, 0.0037909827660769224, 0.003703164868056774, 0.0032680316362529993"
img6.png,"Fatherarel introdu
 gre","Father, next, imp, district, aring, subsequent, desc, то, farther, Brook","0.006508078426122665, 0.006185841280966997, 0.005610314197838306, 0.004561153706163168, 0.003483523614704609, 0.003469942370429635, 0.003456414444372058, 0.0032091722823679447, 0.0030029849149286747, 0.002921984763815999"
img7.png,nextatureiventugel,"next, district, Father, imp, aring, farther, again, Brook, <0x0A>, anth","0.006387094035744667, 0.004993742797523737, 0.004304875154048204, 0.004028289578855038, 0.0032877945341169834, 0.0031618408393114805, 0.003076555673032999, 0.002970274770632386, 0.0028901565819978714, 0.002812199527397752"
img8.png,"next th ear
-","next, Brook, farther, district, subsequent, again, further, aring, imp, anc","0.006625127512961626, 0.0042111873626708984, 0.003971527796238661, 0.003745507448911667, 0.003745507448911667, 0.0031051349360495806, 0.0030569941736757755, 0.0029056319035589695, 0.0027083465829491615, 0.002574247308075428"
img9.png,Brook Blo generallyput briefly,"Brook, next, imp, desc, Father, avia, subsequent, anth, district, anc","0.005887628998607397, 0.004957880824804306, 0.003906715661287308, 0.0038162171840667725, 0.0034074983559548855, 0.003264183411374688, 0.0032387813553214073, 0.003201048355549574, 0.0031761375721544027, 0.0027273274026811123"
img10.png,"farther Hamburg
itziero","farther, district, Brook, further, next, ether, TS, subsequent, District, Father","0.005495033692568541, 0.004737015347927809, 0.003927123732864857, 0.0033199128229171038, 0.003094499232247472, 0.0029183903243392706, 0.0027956466656178236, 0.0026885473635047674, 0.0025855505373328924, 0.0025454654823988676"
img11.png,avia Herm initially,"avia, district, subsequent, next, Brook, imp, desc, again, parent, ether","0.010214963927865028, 0.008601862005889416, 0.0050174216739833355, 0.004768991842865944, 0.0043252878822386265, 0.004225092940032482, 0.0033817216753959656, 0.003342323238030076, 0.002749320352450013, 0.002166412305086851"
img12.png,"lityan AP,","<0x0A>, district, next, Brook, parent, discovery, ready, imp, aring, further","0.007789683528244495, 0.006432697176933289, 0.006210477091372013, 0.005523712374269962, 0.004817867651581764, 0.004153261426836252, 0.003580335294827819, 0.0033634137362241745, 0.0031596352346241474, 0.003014944726601243"
img13.png,Brook Blo artificial discovery Blo,"Brook, district, aring, next, subsequent, further, farther, discovery, anc, tested","0.00577955786138773, 0.005450642202049494, 0.004829001147300005, 0.0041791521944105625, 0.0034781992435455322, 0.0030575329437851906, 0.0028610883746296167, 0.0028388232458382845, 0.0025747010949999094, 0.0025052528362721205"
img14.png,district  Babyopedware,"district, Brook, discovery, next, Father, aring, <0x0A>, District, anth, handed","0.0078090182505548, 0.005472910590469837, 0.004905885085463524, 0.00422913720831275, 0.003519800491631031, 0.0031305754091590643, 0.002741223433986306, 0.0027198907919228077, 0.0025953378062695265, 0.0025953378062695265"
img15.png,next-- Jew Jersey,"next, district, again, discovery, further, aring, Brook, imp, ether, anc","0.005862984340637922, 0.004272728227078915, 0.004256070125848055, 0.003860088298097253, 0.0037122105713933706, 0.0035146502777934074, 0.003263242309913039, 0.003237847238779068, 0.003101667854934931, 0.003089575795456767"
img16.png,subsequent refer Trib SarFS,"subsequent, anc, district, kolej, aring, Brook, next, ether, again, imp","0.009042961522936821, 0.006513400934636593, 0.0063874199986457825, 0.006337712984532118, 0.006118773948401213, 0.004955133888870478, 0.0038893292658030987, 0.0032496564090251923, 0.0031743780709803104, 0.0024149392265826464"
img17.png,subsequent refer composornanc,"subsequent, next, further, Jersey, imp, Brook, district, tested, aring, to","0.006965081673115492, 0.00688393646851182, 0.004997201729565859, 0.004567812196910381, 0.004514595493674278, 0.004274332895874977, 0.003543546423316002, 0.003114977153018117, 0.0026026610285043716, 0.0023883357644081116"
img18.png,"next
cuaud","next, again, subsequent, ready, Brook, district, <0x0A>, -, Father, imp","0.006044723093509674, 0.004819273483008146, 0.004652789328247309, 0.004527288489043713, 0.004269639495760202, 0.004203444812446833, 0.003948771394789219, 0.0038723950274288654, 0.003842259757220745, 0.003260883502662182"
img19.png,"district Joning
it","district, imp, handed, impro, LOC, Brook, next, subsequent, avia, anc","0.0049528940580785275, 0.0033775800839066505, 0.0026407574769109488, 0.0026099919341504574, 0.002549531403928995, 0.0024044369347393513, 0.002367159817367792, 0.0022764753084629774, 0.002048606052994728, 0.00201684539206326"
img20.png,district des reciipoiller,"district, asso, ogo, pare, subsequent, Finn, Brook, anc, ody, quel","0.006053676828742027, 0.004605394788086414, 0.004242688417434692, 0.0038329497911036015, 0.003700538771227002, 0.0033171414397656918, 0.002837301464751363, 0.002760769799351692, 0.002686302876099944, 0.0025235479697585106"
img21.png,nextancometermk clean,"next, district, Brook, Father, subsequent, ether, то, again, imp, anc","0.010348140262067318, 0.006425307132303715, 0.0048311674036085606, 0.0036183767952024937, 0.003507051384076476, 0.003385898657143116, 0.0031314443331211805, 0.003023267025128007, 0.0027419845573604107, 0.002419792814180255"
img22.png,"district Joning
it","district, Father, Brook, next, ether, District, farther, то, again, further","0.00615014648064971, 0.004884208086878061, 0.00471548130735755, 0.003686793614178896, 0.003559431992471218, 0.00291649391874671, 0.0028489334508776665, 0.002707872772589326, 0.0025737967807799578, 0.0025141749065369368"
img23.png,Brook OP Kurz Hautщи,"Brook, district, next, aring, <0x0A>, /, Father, anth, ether, farther","0.006044687703251839, 0.005974264815449715, 0.005722994916141033, 0.004652761854231358, 0.0032736267894506454, 0.003197793383151293, 0.0025694991927593946, 0.0024044106248766184, 0.002321349224075675, 0.0021552997641265392"
img24.png,Brook Blo Blo strangerired,"Brook, aring, istrict, district, ugno, Father, ether, discovery, kolej, bisher","0.006045231129974127, 0.004286710638552904, 0.003666618140414357, 0.0032867351546883583, 0.0030397330410778522, 0.0030043190345168114, 0.002969317603856325, 0.002822296693921089, 0.0026101977564394474, 0.0025004164781421423"
img25.png,"furtherm
 whenanc","further, next, Brook, aring, district, Jersey, acle, r, Father, discovery","0.004474015906453133, 0.003841806435957551, 0.003752811113372445, 0.003709089709445834, 0.0034980045165866613, 0.0032099494710564613, 0.002968717599287629, 0.0023030261509120464, 0.0021133755799382925, 0.0020887539722025394"
img26.png,Fatherarel/ qualino,"Father, next, Brook, district, further, ether, discovery, farther, parent, Owner","0.006037335842847824, 0.005433014594018459, 0.004469075705856085, 0.004053275566548109, 0.003852583933621645, 0.003549166489392519, 0.003360283561050892, 0.002753317588940263, 0.002364254556596279, 0.002309486735612154"
img27.png,district Joning-,"district, aring, again, impro, anc, next, handed, ready, parent, Father","0.007169931661337614, 0.005124119110405445, 0.0033736317418515682, 0.0033604793716222048, 0.003083749208599329, 0.003083749208599329, 0.0030597513541579247, 0.0028631642926484346, 0.0027750739827752113, 0.002689693821594119"
img28.png,next-- Jew tur,"next, district, imp, iero, <0x0A>, subsequent, anth, handed, Father, Brook","0.005711449310183525, 0.004962192848324776, 0.004065875429660082, 0.003630417864769697, 0.0035741336178034544, 0.003383921692147851, 0.0032670223154127598, 0.0032163721043616533, 0.003178900107741356, 0.0030097223352640867"
img29.png,Brook OPancopedoped,"Brook, aring, next, district, LOC, ether, anc, parent, discovery, Father","0.006011292338371277, 0.004983536433428526, 0.0033327441196888685, 0.0032555409707129, 0.0028395336121320724, 0.0027737559285014868, 0.0026570954360067844, 0.002605702495202422, 0.0025156871415674686, 0.0023540558759123087"
img30.png,district Joning-,"district, Father, next, subsequent, Brook, anth, aring, iero, handed, <0x0A>","0.004180476069450378, 0.004020324442535639, 0.003973486367613077, 0.003762021427974105, 0.0033460110425949097, 0.003205282147973776, 0.0030704722739756107, 0.0027309346478432417, 0.0026572721544653177, 0.002585596637800336"
img31.png,next-- referred Liv,"next, district, imp, Father, Brook, impro, aring, anth, subsequent, farther","0.005809389986097813, 0.005719323642551899, 0.004266875796020031, 0.0042007239535450935, 0.0036926728207618, 0.0033622169867157936, 0.0029440554790198803, 0.002820232417434454, 0.002820232417434454, 0.002733462955802679"
img32.png,"next 
 Larrydy","next, district, Brook, farther, anth, Father, <0x0A>, further, aring, subsequent","0.006491856183856726, 0.005155580583959818, 0.004341434221714735, 0.0038916361518204212, 0.003201172687113285, 0.0030785377603024244, 0.0030665358062833548, 0.002759583294391632, 0.002695657778531313, 0.0025822818279266357"
img33.png,handedopedopedopedoped,"handed, district, <0x0A>, Finn, next, parent, Brook, pare, nek, ownership","0.006148182321339846, 0.00494020339101553, 0.0040478575974702835, 0.0031279416289180517, 0.0031279416289180517, 0.002675470430403948, 0.002361094346269965, 0.0022795293480157852, 0.0021164710633456707, 0.002091813599690795"
img34.png,next district Sarudiop,"next, district, subsequent, imp, (, Brook, allowed, ether, kolej, Father","0.008193154819309711, 0.005087245721369982, 0.004152088426053524, 0.004119777120649815, 0.0034827778581529856, 0.003428782569244504, 0.003284572856500745, 0.002990637207403779, 0.0026495580095797777, 0.0024987708311527967"
img35.png,district  archit fle,"district, next, subsequent, Brook, aring, handed, anth, impro, desc, ody","0.005741415079683065, 0.005086611956357956, 0.00413538608700037, 0.003839575918391347, 0.0034149896819144487, 0.0030972608365118504, 0.0030972608365118504, 0.0026595965027809143, 0.002508238423615694, 0.00244058296084404"
img36.png,district short Cuonoired,"district, iero, Brook, next, LOC, OF, discovery, aring, anth, Father","0.004217725712805986, 0.0033234884031116962, 0.003297624411061406, 0.0032847682014107704, 0.003026070538908243, 0.002787746721878648, 0.0024220363702625036, 0.0024031875655055046, 0.0022139204666018486, 0.002104301704093814"
img37.png,"district
 firstugno arch","district, Brook, aring, imp, IN, lak, discovery, District, subsequent, Meter","0.006534052547067404, 0.005438121035695076, 0.004799125250428915, 0.004369653295725584, 0.0031350727658718824, 0.0031350727658718824, 0.0031350727658718824, 0.0030985481571406126, 0.0030985481571406126, 0.002197199733927846"
img38.png,district Joning-,"district, Brook, ether, next, (, again, imp, farther, <0x0A>, Father","0.004956860560923815, 0.004729869309812784, 0.0034067970700562, 0.0032891074661165476, 0.00322549045085907, 0.00270554656162858, 0.00266360049135983, 0.0022694161161780357, 0.0021654919255524874, 0.0021486401092261076"
img39.png,"next
cutiin","next, Father, Brook, district, desc, imp, parent, <0x0A>, subsequent, again","0.01160880085080862, 0.005724368616938591, 0.00548360962420702, 0.004581727087497711, 0.004510694183409214, 0.004123108461499214, 0.0037688259035348892, 0.0036959301214665174, 0.0036528711207211018, 0.0031612967140972614"
img40.png,impmh shortp,"imp, district, Brook, handed, impro, next, <0x0A>, Father, subsequent, anth","0.006183117628097534, 0.004777942784130573, 0.004722278099507093, 0.004612886346876621, 0.00436739344149828, 0.004299683030694723, 0.004151148721575737, 0.004070858471095562, 0.0038391852285712957, 0.0038391852285712957"
img41.png,aring debutopedgyOC,"aring, next, district, Brook, discovery, ether, further, <0x0A>, parent, riers","0.009312241338193417, 0.006947354879230261, 0.005582356825470924, 0.003989530727267265, 0.003268904285505414, 0.0030828702729195356, 0.0028069852851331234, 0.002741961507126689, 0.002647239249199629, 0.002575834281742573"
img42.png,Brook Bloanc asér,"Brook, district, next, Father, aring, farther, anc, TS, anth, further","0.005919093731790781, 0.004700715187937021, 0.004682389087975025, 0.0043136184103786945, 0.0038667030166834593, 0.0032433958258479834, 0.002941632177680731, 0.002907361136749387, 0.0028960267081856728, 0.0027526344638317823"
img43.png,�ucci shoone,"<0x0A>, district, Brook, next, parent, ether, IN, anth, discovery, (","0.004087547771632671, 0.00405573844909668, 0.003839896060526371, 0.0037656256463378668, 0.002659817924723029, 0.0026391192805022, 0.002567933639511466, 0.002518265275284648, 0.002170880325138569, 0.00212889164686203"
img44.png,"farther Hamburg
anc him","farther, Meter, aring, iero, district, LOC, istrict, again, handed, anc","0.0028769043274223804, 0.002629703376442194, 0.002499497728422284, 0.0023664769250899553, 0.002357250778004527, 0.0022669462487101555, 0.0019618782680481672, 0.0019390217494219542, 0.001894104410894215, 0.0018073669634759426"
img45.png,imp SEUPopedoped,"imp, anth, Father, next, again, desc, district, Brook, impro, subsequent","0.006712018512189388, 0.005330425221472979, 0.0051664249040186405, 0.004759533330798149, 0.004316709935665131, 0.004055173601955175, 0.004055173601955175, 0.003854388138279319, 0.00356472609564662, 0.0032968325540423393"
img46.png,next district lawitzm,"next, Brook, imp, again, celle, subsequent, district, aring, parent, IN","0.008476130664348602, 0.007278394885361195, 0.004536946304142475, 0.004130936227738857, 0.0036885112058371305, 0.0035750276874750853, 0.0035610899794846773, 0.0033322921954095364, 0.0027625670190900564, 0.00274106883443892"
img47.png,"next-
ancec","next, again, imp, district, aring, Brook, anc, mil, further, Father","0.006304282229393721, 0.00589923607185483, 0.005006616469472647, 0.0037351637147367, 0.003634414169937372, 0.003036666428670287, 0.0029895873740315437, 0.0029547575395554304, 0.0027541369199752808, 0.0027008671313524246"
img48.png,district Joningmm,"district, Brook, imp, next, Father, impro, anth, discovery, again, avia","0.006738404743373394, 0.00633014552295208, 0.005946621298789978, 0.003976807929575443, 0.0037799023557454348, 0.0032584797590970993, 0.0031705875881016254, 0.0030850665643811226, 0.0030372370965778828, 0.0030136010609567165"
img49.png,nextaturekelungjou,"next, district, aring, Brook, parent, ody, -, Father, LOC, anth","0.006354718469083309, 0.006063714623451233, 0.004436308052390814, 0.0042663561180233955, 0.004007870331406593, 0.0030252996366471052, 0.0030135049019008875, 0.003001756500452757, 0.0027979444712400436, 0.0027979444712400436"
img50.png,district ittkino,"district, Brook, aring, <0x0A>, -, discovery, parent, iero, District, next","0.006639217492192984, 0.005110388156026602, 0.00437114667147398, 0.0036808745935559273, 0.003471395466476679, 0.003148418851196766, 0.0029925298877060413, 0.0028332702349871397, 0.0026616111863404512, 0.0026408983394503593"
img51.png,"district OFTC
it","district, Brook, next, Father, anth, aring, imp, <0x0A>, owner, OF","0.006372750271111727, 0.006152600981295109, 0.005712496116757393, 0.003790507558733225, 0.0035747888032346964, 0.0032804107759147882, 0.0031058304011821747, 0.0027516132686287165, 0.0026256076525896788, 0.0025448263622820377"
img52.png,Brook Blojouerst Jeff,"Brook, district, next, Father, aring, ody, discovery, subsequent, iero, avia","0.0058978283777832985, 0.005064424127340317, 0.004739038180559874, 0.0046655661426484585, 0.0029082540422677994, 0.0029082540422677994, 0.002764256438240409, 0.0025967785622924566, 0.002411027206107974, 0.002309622708708048"
img53.png,"district Jon "" OF.","district, anc, ana, pare, handed, parent, то, rating, impro, fish","0.006418627221137285, 0.0035171175841242075, 0.002826083218678832, 0.0027714218012988567, 0.0026861540973186493, 0.0026756818406283855, 0.00265485979616642, 0.0023798008915036917, 0.0023612813092768192, 0.0022975895553827286"
img54.png,next--one Season,"next, Brook, district, again, aring, -, iero, Father, handed, /","0.009119061753153801, 0.0052983639761805534, 0.004957947880029678, 0.0036273121368139982, 0.0034208809956908226, 0.0027273641899228096, 0.0027273641899228096, 0.0025027699302881956, 0.0024736118502914906, 0.0024639680050313473"
img55.png,district Joning-,"district, next, Brook, Father, -, subsequent, anc, imp, farther, avia","0.007018981035798788, 0.005864578299224377, 0.004062274470925331, 0.003501899540424347, 0.003251403570175171, 0.003188515780493617, 0.0030544111505150795, 0.0030070568900555372, 0.0029145393054932356, 0.002880583982914686"
img56.png,district Jon- proofcri,"district, aring, Brook, subsequent, ownership, avia, LOC, next, owner, District","0.00581559631973505, 0.004304935224354267, 0.003486242610961199, 0.0032495353370904922, 0.003211677074432373, 0.002867705188691616, 0.00267299497500062, 0.002611075295135379, 0.002481791889294982, 0.0024433154612779617"
img57.png,etheropedetoped rud,"ether, anc, district, again, further, uw, Brook, aring, TS, avia","0.008127407170832157, 0.0069246371276676655, 0.004685444291681051, 0.004401566926389933, 0.0028641545213758945, 0.002701154677197337, 0.002478718990460038, 0.002283502835780382, 0.0022746005561202765, 0.0021789337042719126"
img58.png,ownershipNF routinemaleucci,"ownership, district, Lake, handed, fish, aring, discovery, farther, pare, Ontario","0.0036936956457793713, 0.003594064386561513, 0.002921953797340393, 0.0028879118617624044, 0.0027556647546589375, 0.0027342201210558414, 0.0025485733058303595, 0.002088226145133376, 0.002000398002564907, 0.0019162640674039721"
img59.png,district Joning- pole,"district, Brook, farther, Father, LOC, next, further, again, descend, ease","0.003479879582300782, 0.003372814739122987, 0.0029075483325868845, 0.0028624709229916334, 0.0026370317209511995, 0.002467603888362646, 0.002448401181027293, 0.0023271723184734583, 0.0020537222735583782, 0.0020297958981245756"
img60.png,"district  clean,ed","district, next, again, Father, farther, aring, Brook, anth, imp, further","0.0048593273386359215, 0.004654950462281704, 0.0037403579335659742, 0.0036537128034979105, 0.0035000424832105637, 0.0034189638681709766, 0.003275166731327772, 0.002958866534754634, 0.002631670329719782, 0.0025407583452761173"
img61.png,odyoped Groupoc,"<0x0A>, next, district, Brook, aring, imp, ether, (, again, subsequent","0.008388296701014042, 0.007345038931816816, 0.007008684799075127, 0.005522710736840963, 0.004542857874184847, 0.0037368531338870525, 0.003323625773191452, 0.0032720977906137705, 0.0031962997745722532, 0.0028876159340143204"
img62.png,aringeancitten parent,"aring, district, Brook, lak, LOC, ether, farther, ownership, rib, next","0.0050015682354569435, 0.0044484869576990604, 0.004328496754169464, 0.0031544493976980448, 0.0027087039779871702, 0.0026356414891779423, 0.002409171313047409, 0.002325945533812046, 0.0023078445810824633, 0.0021765048149973154"
img63.png,Brook OP household-éro,"Brook, district, aring, discovery, parent, Father, imp, <0x0A>, TS, next","0.006750887259840965, 0.005509913899004459, 0.003728193696588278, 0.0034750590566545725, 0.0030787314753979445, 0.003066728822886944, 0.00303100049495697, 0.00283626071177423, 0.0026026989798992872, 0.002351342234760523"
img64.png,districtenewareario interview,"district, Brook, imp, <0x0A>, Lake, const, acle, ogo, r, owner","0.007374234963208437, 0.0062097287736833096, 0.0055230469442903996, 0.004185331519693136, 0.0035244026221334934, 0.0032979617826640606, 0.003196494420990348, 0.0029678447172045708, 0.002608902519568801, 0.002518777037039399"
img65.png,Brook Blo Bloingit,"Brook, aring, district, Father, next, discovery, imp, subsequent, avia, further","0.006072692573070526, 0.004495248198509216, 0.0039055394008755684, 0.00355603382922709, 0.0031381885055452585, 0.003101628040894866, 0.002802087226882577, 0.0027265059761703014, 0.002632317366078496, 0.0025314749218523502"
img66.png,farther Hamburg Hillerer,"farther, IN, next, further, anc, district, Brook, descend, aring, handed","0.004295726772397757, 0.004147328902035952, 0.0038206984754651785, 0.003645736025646329, 0.0036173646803945303, 0.003058048663660884, 0.0029180103447288275, 0.0028282327111810446, 0.002795282518491149, 0.00244763121008873"
img67.png,district Joning-,"district, next, subsequent, aring, imp, iero, Brook, Father, (, anc","0.005844899453222752, 0.005426805000752211, 0.0036863316781818867, 0.0033960079308599234, 0.003253176575526595, 0.0031163522507995367, 0.002837470965459943, 0.0027287693228572607, 0.002665557200089097, 0.0023068476002663374"
img68.png,�uccimino,"<0x0A>, district, next, Brook, subsequent, handed, good, acle, owner, /","0.005770240444689989, 0.005484535824507475, 0.00521297799423337, 0.004288078285753727, 0.0041077276691794395, 0.003459053346887231, 0.002590711461380124, 0.0025406023487448692, 0.002481749514117837, 0.0023960163816809654"
img69.png,Meteresselallerag prototype,"Meter, district, ogo, again, istrict, avia, subsequent, acle, ugno, kolej","0.004152481444180012, 0.0037077488377690315, 0.0033106468617916107, 0.002990920329466462, 0.002967644715681672, 0.0029445502441376448, 0.002865126123651862, 0.002766149118542671, 0.002608726965263486, 0.002403272083029151"
img70.png,district  lit-onen,"district, anc, ivi, const, further, aring, TS, avia, again, discovery","0.0054786065593361855, 0.004686100874096155, 0.0039001191034913063, 0.0033229428809136152, 0.0030020286794751883, 0.0029096659272909164, 0.00279819848947227, 0.002787289209663868, 0.002744076307862997, 0.002628664020448923"
img71.png,district Jon trans briefly birth,"district, imp, Brook, avia, impro, subsequent, anth, descend, desc, again","0.004828965291380882, 0.00398774491623044, 0.003588582156226039, 0.0033976014237850904, 0.003305956721305847, 0.003179307794198394, 0.0029750391840934753, 0.002838802058249712, 0.0026668075006455183, 0.002656410913914442"
img72.png,district Jon trans briefly birth,"district, Brook, aring, next, ready, avia, handed, то, <0x0A>, anc","0.006418222561478615, 0.006124310661107302, 0.005821074824780226, 0.0043597836047410965, 0.0036002963315695524, 0.0033427621237933636, 0.002892919583246112, 0.002760443137958646, 0.002707051346078515, 0.0026033460162580013"
img73.png,�maphiro,"<0x0A>, next, district, subsequent, const, imp, Brook, Father, r, handed","0.005678535904735327, 0.004405207000672817, 0.00430316012352705, 0.003390808589756489, 0.0031237592920660973, 0.0029003124218434095, 0.0025896874722093344, 0.0025595168117433786, 0.0025198350194841623, 0.0025100111961364746"
img74.png,Brook OPancoped anc,"Brook, aring, Lake, district, Jersey, again, handed, avia, next, discovery","0.0072268107905983925, 0.003823166713118553, 0.0031203776597976685, 0.0028411364182829857, 0.002669000532478094, 0.002669000532478094, 0.002449212595820427, 0.0024112409446388483, 0.0022213393822312355, 0.0021954600233584642"
img75.png,aringbg earicietti,"aring, Brook, district, subsequent, farther, avia, again, Father, next, imp","0.0038002287037670612, 0.003654644126072526, 0.003487285925075412, 0.003187637310475111, 0.002959621138870716, 0.002747915219515562, 0.002642644103616476, 0.0025513528380542994, 0.0024345179554075003, 0.002378122415393591"
img76.png,"district itt
vis","district, Brook, next, subsequent, Father, aring, handed, IN, ownership, owner","0.0072839814238250256, 0.005921835545450449, 0.00434946408495307, 0.0034812672529369593, 0.003207093570381403, 0.0029087078291922808, 0.0028636124916374683, 0.002732478082180023, 0.002527128905057907, 0.0024493776727467775"
img77.png,"district Joning
it","district, Brook, Father, subsequent, next, discovery, ether, allowed, const, istrict","0.005793663207441568, 0.00499444967135787, 0.003473094664514065, 0.0028792964294552803, 0.0028792964294552803, 0.002801632508635521, 0.002453191438689828, 0.002368444809690118, 0.0023226351477205753, 0.002304560039192438"
img78.png,Brook OPancoped anc,"Brook, ether, district, anc, next, anth, aring, imp, parent, <0x0A>","0.006415867246687412, 0.004996682517230511, 0.004567337688058615, 0.00374234258197248, 0.0036699585616588593, 0.0031025109346956015, 0.002948894863948226, 0.0027060580905526876, 0.0025520557537674904, 0.0020829271525144577"
