img155.png,braveeggiss Leopold vac,"brave, akte, pul, vide, tact, future, elij, caption, DL, ssl","0.0132044218480587, 0.006904092151671648, 0.0042534880340099335, 0.004138757009059191, 0.003980203997343779, 0.0038577455561608076, 0.003404448740184307, 0.0028780538123100996, 0.002414115471765399, 0.0023859902285039425"
img156.png,altogetheróżadr absoljd,"altogether, motion, animated, öll, elij, Label, animation, ald, south, anim","0.03517593443393707, 0.013455994427204132, 0.007666995283216238, 0.00514737656340003, 0.004560322966426611, 0.004437316209077835, 0.004368521738797426, 0.0030024382285773754, 0.002932886825874448, 0.002489108592271805"
img157.png,braveLabel otherwisekens symmet,"brave, Label, USA, ede, dear, motion, alphabet, Should, asym, amb","0.012404673732817173, 0.0076422980055212975, 0.0047637829557061195, 0.004726711194962263, 0.004599215928465128, 0.004122710321098566, 0.00381288374774158, 0.0037684624549001455, 0.0034581355284899473, 0.0032997759990394115"
img158.png,motionLoop strat Cin Mir,"motion, altogether, Label, asym, animated, otion, animate, pa, adr, NG","0.01952091045677662, 0.006799157243221998, 0.00648780120536685, 0.005336719565093517, 0.0042881746776402, 0.0038892056327313185, 0.0033658272586762905, 0.0029587517492473125, 0.0028677203226834536, 0.0027471077628433704"
img159.png,animatedetressenrenchPlatform,"animated, motion, absolutely, animation, altogether, absolute, alphabet, ab, anim, Rev","0.012286806479096413, 0.010225987061858177, 0.009681770578026772, 0.007658910471946001, 0.00571389589458704, 0.005062230862677097, 0.004363915883004665, 0.003465652698650956, 0.0034521413035690784, 0.003242986975237727"
img160.png,alphabet Vent Mironneurhorn,"alphabet, millions, motion, pul, ota, elij, adm, altogether, brave, animated","0.016105908900499344, 0.01585621014237404, 0.00996139831840992, 0.008355636149644852, 0.006584082264453173, 0.005437115672975779, 0.004578510764986277, 0.004525168798863888, 0.0038857317995280027, 0.00363607588224113"
img161.png,motion Wingampsichaodi,"motion, etr, altogether, brave, animated, ech, photograph, capt, ograph, itself","0.009923496283590794, 0.007973753847181797, 0.005948782432824373, 0.004234828520566225, 0.004201872739940882, 0.0033500250428915024, 0.0032852296717464924, 0.002843129448592663, 0.0026813261210918427, 0.0026294649578630924"
img162.png,motionRendererimir pray pray,"motion, animated, amb, anim, ätz, caption, animation, lean, militar, symmet","0.01310223713517189, 0.010527943260967731, 0.00685066357254982, 0.00472681550309062, 0.004253673367202282, 0.003391324309632182, 0.0029928332660347223, 0.002957965712994337, 0.0028781795408576727, 0.0026411658618599176"
img163.png,animatedsaHIzigjd,"animated, Anim, motion, horn, animation, anim, Native, elij, Pul, absolutely","0.00800294429063797, 0.0057418313808739185, 0.005415063351392746, 0.004686346277594566, 0.004317264538258314, 0.004250331316143274, 0.004024133086204529, 0.003946299199014902, 0.003310161642730236, 0.003183351131156087"
img164.png,motionquiaude Brig invol,"motion, altogether, alphabet, animated, et, anim, Label, animation, vertical, brave","0.008493294008076191, 0.007350333500653505, 0.00679794792085886, 0.0039343503303825855, 0.003236308228224516, 0.0028896979056298733, 0.0028560319915413857, 0.0027681610081344843, 0.0027359111700206995, 0.0023863038513809443"
img165.png,motion motionsslongs Horn,"motion, militar, pul, animated, elij, Anim, adm, Magn, anim, altogether","0.011614810675382614, 0.004495434463024139, 0.004323217086493969, 0.0041252425871789455, 0.0039827339351177216, 0.0035561814438551664, 0.0035561814438551664, 0.003542316844686866, 0.002748004160821438, 0.0026017578784376383"
img166.png,fertetr motionboaNR,"fert, motion, DL, millions, elte, ahren, elij, etta, animated, anim","0.010224084369838238, 0.009022722020745277, 0.008882838301360607, 0.004195955581963062, 0.003926368430256844, 0.0036030379123985767, 0.003384741023182869, 0.0033322651870548725, 0.0032423832453787327, 0.0031921148765832186"
img167.png,motion absolute LudLoopanga,"motion, brave, altogether, militar, oud, animated, photograph, Pul, DL, film","0.0189810823649168, 0.0056327576749026775, 0.0036653049755841494, 0.0030505377799272537, 0.003038644790649414, 0.003026798367500305, 0.0029566825833171606, 0.0029108435846865177, 0.0024226189125329256, 0.002385059604421258"
img168.png,altogether仁 Leopoldeggi Stanis,"altogether, fert, motion, animated, elij, Leopold, Marg, NG, ab, own","0.011735917069017887, 0.010196341201663017, 0.010156589560210705, 0.0051471092738211155, 0.0048731849528849125, 0.003664131974801421, 0.002659874502569437, 0.0025982586666941643, 0.002488979371264577, 0.002469609724357724"
img169.png,motion Cris symmettesbil,"motion, ätz, caption, ace, etr, icons, animate, му, ev, anc","0.02237037941813469, 0.01891147717833519, 0.011605599895119667, 0.0056121014058589935, 0.005355104338377714, 0.002877599559724331, 0.002810940146446228, 0.0026098694652318954, 0.0025295724626630545, 0.002442187163978815"
img170.png,braveeggisl Bil authorization,"brave, motion, rons, elij, amples, altogether, icha, Za, animated, ech","0.010721925646066666, 0.005562461446970701, 0.004434781149029732, 0.003898422699421644, 0.003763749962672591, 0.0031693950295448303, 0.0031080935150384903, 0.0027860768605023623, 0.002497423207387328, 0.0024111487437039614"
img171.png,DL Vict Mercur Freihelm,"DL, brave, caption, adm, altogether, animated, firm, motion, future, symmet","0.007669616490602493, 0.0072614471428096294, 0.005481228232383728, 0.0036087462212890387, 0.0030388690065592527, 0.0030270216520875692, 0.0030270216520875692, 0.0028325372841209173, 0.0026713369879871607, 0.002568999771028757"
img172.png,elijoud absolutearodell,"elij, motion, alphabet, animated, altogether, animation, dbo, absolutely, öll, éli","0.019008787348866463, 0.012272994965314865, 0.009977874346077442, 0.008435098454356194, 0.006725046318024397, 0.005156271625310183, 0.005076331086456776, 0.0037139232736080885, 0.0036850213073194027, 0.002903727348893881"
img173.png,Leopoldrench pray absolutestr,"Leopold, motion, animated, etr, animate, kmal, anim, Anim, future, animate","0.017225155606865883, 0.01650068908929825, 0.009401810355484486, 0.009401810355484486, 0.008901453576982021, 0.005702485796064138, 0.004935089964419603, 0.0048775942996144295, 0.003996557556092739, 0.0033786108251661062"
img174.png,Pulaugh distinction DNA respective,"Pul, etr, pul, motion, future, lem, altogether, animated, Job, ota","0.009046644903719425, 0.008204950951039791, 0.006440139841288328, 0.005465675611048937, 0.003967654891312122, 0.00387574452906847, 0.0033673050347715616, 0.0031021065078675747, 0.003006664803251624, 0.0027057055849581957"
img175.png,"motion animated tact...""�","motion, animated, alphabet, Label, Anim, absolutely, 黄, ún, USA, animation","0.01058034785091877, 0.006804554257541895, 0.006543874740600586, 0.006492950022220612, 0.005320132710039616, 0.005017363466322422, 0.004658463876694441, 0.00415954040363431, 0.0037578316405415535, 0.0035857479088008404"
img176.png,ätz dearhornjdicons,"ätz, elij, animated, caption, ̃, brave, motion, anim, Label, pul","0.03004087135195732, 0.004697780124843121, 0.004049739334732294, 0.004002558998763561, 0.0038492227904498577, 0.003730794647708535, 0.0034504211507737637, 0.0027082667220383883, 0.00268719089217484, 0.0026767144445329905"
img177.png,altogetherichaiconsanchrix,"altogether, animated, animate, fert, anim, ätz, anim, Anim, animation, animate","0.02315465919673443, 0.01164289377629757, 0.010315032675862312, 0.00885744672268629, 0.008223861455917358, 0.00778619572520256, 0.007458718493580818, 0.007089411839842796, 0.006817820481956005, 0.005831590853631496"
img178.png,motionrevjd beskre intermediate,"motion, altogether, anim, brave, militar, Anim, anim, Label, animate, caption","0.009051179513335228, 0.0077721853740513325, 0.005279506556689739, 0.004807045217603445, 0.0038776875007897615, 0.003729135263711214, 0.0032399289775639772, 0.0028039247263222933, 0.002771258121356368, 0.0027070618234574795"
img179.png,braverag praỹ̃,"brave, elij, etr, motion, ulla, Vert, jd, future, rust, verte","0.005306347273290157, 0.005183425731956959, 0.004100427497178316, 0.003507281420752406, 0.003372919512912631, 0.0026474350597709417, 0.002555978251621127, 0.002264471026137471, 0.002220672322437167, 0.0021948006469756365"
img180.png,animated póź Abr Capital Horn,"animated, altogether, motion, icha, Anim, afterwards, animation, anim, perpet, itself","0.006504714954644442, 0.005585553590208292, 0.005498957820236683, 0.004777577705681324, 0.004666904918849468, 0.004418536555022001, 0.004350033588707447, 0.003945309203118086, 0.003869000356644392, 0.0037207806017249823"
img181.png,braveanimessoedia coll,"brave, altogether, adm, motion, caption, animated, alphabet, perpet, éli, anim","0.0054765259847044945, 0.005205364897847176, 0.004684321116656065, 0.004383356776088476, 0.004383356776088476, 0.003944593947380781, 0.003705603303387761, 0.003413761267438531, 0.003244734602048993, 0.0031695703510195017"
img182.png,animated foreveróżourn bo,"animated, elij, motion, ätz, sow, ota, animate, animation, DL, му","0.013686011545360088, 0.012316077947616577, 0.009296663105487823, 0.008366091176867485, 0.007470079232007265, 0.004995621275156736, 0.004711319226771593, 0.004173997323960066, 0.004093265160918236, 0.0037269603926688433"
img183.png,motionelij Vittfal Vict,"motion, ätz, altogether, MDb, öll, elij, otion, reno, anim, キ","0.020968496799468994, 0.009600077755749226, 0.007683806121349335, 0.006470412947237492, 0.005406232550740242, 0.004903240129351616, 0.0038485971745103598, 0.0036437781527638435, 0.0030564069747924805, 0.0029508215375244617"
img184.png,altogetherRIG Liv accompourn,"altogether, animated, animation, Label, anim, Rev, icha, animate, icons, brave","0.013323517516255379, 0.011132216081023216, 0.005797921679913998, 0.005775317549705505, 0.004275118932127953, 0.003628246486186981, 0.003421762492507696, 0.002870179247111082, 0.002749463077634573, 0.0026648712810128927"
img185.png,motionwnucheboa ob,"motion, elij, animated, altogether, Label, Mask, ätz, absolutely, án, adm","0.01882457733154297, 0.005478263832628727, 0.004200330935418606, 0.004023670684546232, 0.003992358222603798, 0.0028643766418099403, 0.002787115052342415, 0.002527803648263216, 0.0025179488584399223, 0.002204789547249675"
