img78.png,motionuo motionantineDL,"motion, altogether, anim, Anim, ätz, animated, reno, elij, ota, MDb","0.01413359772413969, 0.008983860723674297, 0.0051994603127241135, 0.004865397699177265, 0.004865397699177265, 0.004808714613318443, 0.0047712926752865314, 0.0036298080813139677, 0.003215831471607089, 0.003092635190114379"
img79.png,animatedjdッFormsscript,"animated, anim, ätz, anim, animation, Anim, fas, motion, ̃, het","0.013174106366932392, 0.011137128807604313, 0.006834635976701975, 0.0066243563778698444, 0.0065728058107197285, 0.00639551505446434, 0.006031545344740152, 0.005534857511520386, 0.0047900197096168995, 0.004129255190491676"
img80.png,ätz●otaljd intermediate,"ätz, motion, elij, icons, anim, adm, animation, öll, caption, Animation","0.009982393123209476, 0.0097511513158679, 0.007389363832771778, 0.007106281816959381, 0.0063204579055309296, 0.003863618476316333, 0.0034633250907063484, 0.003190564690157771, 0.003020765958353877, 0.003020765958353877"
img81.png,icon absol perpet Lomb Zar,"icon, elij, icons, motion, ̃, pul, asym, ätz, ppa, Magn","0.010168730281293392, 0.007766239810734987, 0.00726726371794939, 0.0070436736568808556, 0.004459775984287262, 0.003982131835073233, 0.0037702068220824003, 0.0030058708507567644, 0.002868221839889884, 0.002747588325291872"
img82.png,Anim museongs Gamhein,"Anim, motion, anim, anim, elij, photograph, altogether, intro, lean, adm","0.009859281592071056, 0.009593344293534756, 0.00721320416778326, 0.0057959724217653275, 0.004880698397755623, 0.004357973113656044, 0.004174682777374983, 0.004030466079711914, 0.00315121584571898, 0.0030304945539683104"
img83.png,motionng motionademkund,"motion, elij, altogether, fert, afterwards, pul, otion, animated, Sierra, Horn","0.02333688735961914, 0.017478520050644875, 0.007458917330950499, 0.0049687097780406475, 0.004039532504975796, 0.0038395216688513756, 0.003649413585662842, 0.003309874562546611, 0.002853289945051074, 0.0026595587842166424"
img84.png,AllianceMDbzá Mall candidates,"Alliance, motion, candidates, alphabet, Magn, Label, brave, lean, Sierra, altogether","0.01225542277097702, 0.006534280255436897, 0.002589023904874921, 0.0024995850399136543, 0.002348142908886075, 0.0022318782284855843, 0.002188710030168295, 0.0021380081307142973, 0.0020884815603494644, 0.0019773344974964857"
img85.png,etrimer Till mirror布,"etr, jd, dbo, ätz, öll, motion, fas, elij, Vert, MDb","0.01846347376704216, 0.01642175391316414, 0.007315630093216896, 0.006660957355052233, 0.004930704366415739, 0.003323274664580822, 0.003121927846223116, 0.0029673504177480936, 0.0024600198958069086, 0.0022486401721835136"
img86.png,animated Naghewjd Vict,"animated, animation, altogether, motion, Rev, anim, anim, shoulder, Anim, capt","0.013932342641055584, 0.009840994141995907, 0.008890597149729729, 0.008351943455636501, 0.0061343275010585785, 0.005455983802676201, 0.0054135252721607685, 0.004852652084082365, 0.004777418915182352, 0.004594399593770504"
img87.png,animated motion absoluteitz怪,"animated, ssl, нец, ally, akte, Sierra, ̃, olg, amb, motion","0.004363073967397213, 0.0032423613592982292, 0.0031059919856488705, 0.002817012369632721, 0.0026775323785841465, 0.0026257443241775036, 0.0025951536372303963, 0.002428416395559907, 0.0023721621837466955, 0.002290214877575636"
img88.png,Animjdboa AltDL,"Anim, motion, animated, anim, anim, animation, ätz, fert, altogether, capt","0.012467666529119015, 0.007711168844252825, 0.0072439732030034065, 0.007048579398542643, 0.006171942222863436, 0.00471374299377203, 0.003530430607497692, 0.003489299677312374, 0.0032019615173339844, 0.0031400301959365606"
img89.png,ätz famoussect motion Eastern,"ätz, anim, motion, animated, altogether, brave, anim, animation, elij, Label","0.010138679295778275, 0.009636678732931614, 0.007189399562776089, 0.007105641067028046, 0.00540568633005023, 0.0032278827857226133, 0.003177839331328869, 0.002739468589425087, 0.00269699702039361, 0.0026140192057937384"
img90.png,elijblemongs Deanrust,"elij, motion, afterwards, anim, animation, olg, fool, anim, Label, ota","0.0086532486602664, 0.007459566462785006, 0.006686712149530649, 0.006088320631533861, 0.005924098193645477, 0.005289624910801649, 0.004816257860511541, 0.004668077453970909, 0.0036640160251408815, 0.003579139243811369"
img91.png,motionetreltereenurus,"motion, MDb, Label, animated, anim, brave, icha, ppel, alphabet, inks","0.009650152176618576, 0.008417013101279736, 0.0063534947112202644, 0.005045699421316385, 0.0042323400266468525, 0.0041504791006445885, 0.003361159935593605, 0.003060371382161975, 0.0026588966138660908, 0.0024978022556751966"
img92.png,motion rörankaixa Pul,"motion, vertical, icons, capt, beyond, Anim, altogether, Verb, lean, pul","0.004814808256924152, 0.00436684163287282, 0.003945112694054842, 0.003914411645382643, 0.00389915076084435, 0.0038537245709449053, 0.0036486329045146704, 0.0029547528829425573, 0.002797503722831607, 0.0026589895132929087"
img93.png,animądsa prayЁ,"anim, elij, anim, ätz, animated, Anim, pul, animation, zoom, altogether","0.011225969530642033, 0.008950123563408852, 0.008915230631828308, 0.007685408927500248, 0.005846750922501087, 0.005711311008781195, 0.005282098893076181, 0.004589167423546314, 0.004211256746202707, 0.0038493999745696783"
img94.png,motion motion motion blind episode,"motion, brave, afterwards, unknown, animated, future, alphabet, caption, elij, amb","0.015566856600344181, 0.0045836144126951694, 0.0044599794782698154, 0.003966787364333868, 0.0038900631479918957, 0.003785134991630912, 0.0036259375046938658, 0.003583693876862526, 0.0032757611479610205, 0.003077293047681451"
img95.png,caption Vin Cin Allianceotal,"caption, elij, motion, altogether, magn, Magn, ssl, horn, ätz, brave","0.00982688833028078, 0.004941269755363464, 0.0037591196596622467, 0.0036577240098267794, 0.0034227173309773207, 0.0032787625677883625, 0.0031164197716861963, 0.003080112626776099, 0.0029737085569649935, 0.0029505668208003044"
img96.png,motionussenoba DMzeg,"motion, militar, elij, alphabet, anim, ätz, jd, odon, horn, enz","0.005672294646501541, 0.005084611941128969, 0.004038001876324415, 0.0034136471804231405, 0.0032068246509879827, 0.0026898891665041447, 0.0026794022414833307, 0.00241120089776814, 0.0024018005933612585, 0.002364563988521695"
img97.png,otaprocVMzesplex,"ota, anch, animated, akte, fro, vertical, motion, integrated, Sid, caption","0.007425755728036165, 0.006787690334022045, 0.005783184431493282, 0.0055183530785143375, 0.003928413614630699, 0.0034398341085761786, 0.0033470503985881805, 0.0031076311133801937, 0.002885337918996811, 0.002796565182507038"
img98.png,motion animated futurerasteFS,"motion, Mes, fert, otherwise, het, Rost, alphabet, icon, DL, Anim","0.0076443590223789215, 0.0060946145094931126, 0.0057253604754805565, 0.00401258934289217, 0.0039196377620100975, 0.0034726066514849663, 0.0034455826971679926, 0.003249493893235922, 0.00310068903490901, 0.0029242278542369604"
img99.png,iconszegracTrace Leopold,"icons, motion, brave, Leopold, Ron, elij, ätz, ota, pul, vier","0.010056404396891594, 0.004750309512019157, 0.004127140156924725, 0.0038922640960663557, 0.0037872768007218838, 0.003585721831768751, 0.0033422596752643585, 0.003329229773953557, 0.0031892068218439817, 0.002602954860776663"
img100.png,otaroukinsjdemberg,"ota, militar, motion, elij, otion, ätz, subsequ, icha, zoom, animated","0.006164391525089741, 0.0059514399617910385, 0.005790909752249718, 0.004563127178698778, 0.0038726755883544683, 0.0037535259034484625, 0.0036809260491281748, 0.0033254397567361593, 0.0033254397567361593, 0.003173156874254346"
img101.png,ali motion�➜ motion,"ali, <0xA6>, militar, caption, elij, adr, Ing, ounds, Magn, azzo","0.007550518494099379, 0.004473534412682056, 0.003978843800723553, 0.0028324653394520283, 0.0028214226476848125, 0.002539005596190691, 0.0024322185199707747, 0.002403882099315524, 0.0023851748555898666, 0.0021632597781717777"
img102.png,motionowskiadin Leopoldeggi,"motion, Verb, vertical, ätz, asym, caption, apro, Conserv, mn, altogether","0.009175669401884079, 0.006634853780269623, 0.005269143730401993, 0.0038399584591388702, 0.0034691132605075836, 0.003362380200996995, 0.002820369089022279, 0.0025780259165912867, 0.0025084882508963346, 0.002479263348504901"
img103.png,altogether júylvanshadowpark,"altogether, motion, animation, Animation, Rev, vertical, alphabet, subsequ, candidates, elij","0.015538908541202545, 0.0060851238667964935, 0.004851484205573797, 0.0037343206349760294, 0.003400137647986412, 0.003400137647986412, 0.0033868819009512663, 0.003219185397028923, 0.002988912630826235, 0.002977259922772646"
img104.png,motion Middleburgowskisa,"motion, altogether, anim, animated, ey, Anim, brave, anim, animation, elij","0.011953456327319145, 0.006348432507365942, 0.004397431388497353, 0.004346199333667755, 0.0029870960861444473, 0.0029293205589056015, 0.002861462766304612, 0.0028281258419156075, 0.0027626121882349253, 0.002564998809248209"
img105.png,ahrenoure Leopold Wein Out,"ahren, het, motion, DL, jd, fas, otion, zoom, Sierra, lean","0.010979036800563335, 0.0060869306325912476, 0.00447072321549058, 0.003550475463271141, 0.003522844985127449, 0.003309407038614154, 0.003296504495665431, 0.0026384892407804728, 0.002628202550113201, 0.002577368635684252"
img106.png,motion absolute coll Rev simultaneously,"motion, alphabet, caption, animated, animation, DL, öll, ätz, fert, ograph","0.02591969631612301, 0.006579174194484949, 0.005005171988159418, 0.004133256617933512, 0.003943980671465397, 0.0033472131472080946, 0.0033341634552925825, 0.0031567225232720375, 0.002977072959765792, 0.0028076472226530313"
img107.png,motion LeopoldVO motionoss,"motion, brave, animation, Rev, future, ätz, Label, Schl, Sierra, Animation","0.020470384508371353, 0.004675877280533314, 0.004603384528309107, 0.004461753182113171, 0.004240836016833782, 0.003188671078532934, 0.003102662041783333, 0.003054559463635087, 0.0029033180326223373, 0.0026331949047744274"
img108.png,ätzDL‭ CrisHD,"ätz, altogether, completion, elij, Animation, Alliance, tact, MDb, Mant, DL","0.018366090953350067, 0.013489510864019394, 0.005100079346448183, 0.004345322027802467, 0.004228114616125822, 0.004082052502781153, 0.004066138062626123, 0.0039103664457798, 0.0036164976190775633, 0.003574364585801959"
img109.png,futureetrinaire numeric intermediate,"future, elij, fas, póź, intermediate, Erd, later, absolute, trade, zeich","0.004994272254407406, 0.004288547206670046, 0.004255172796547413, 0.0034594314638525248, 0.0032753238920122385, 0.0026215361431241035, 0.0023591273929923773, 0.0023499298840761185, 0.0023134974762797356, 0.0022335767280310392"
img110.png,motionanchademBDongs,"motion, altogether, animation, elij, owski, animated, rons, sch, cinemat, Label","0.016572870314121246, 0.014398759230971336, 0.01013079285621643, 0.009819100610911846, 0.00764712318778038, 0.006669939495623112, 0.003150656120851636, 0.0031261376570910215, 0.0024633370339870453, 0.0023505326826125383"
img111.png,ilon PullàSErrorvec,"ilon, Horn, horn, brave, het, ätz, pul, future, ayer, elij","0.006583608221262693, 0.0053524356335401535, 0.005248910281807184, 0.004201174713671207, 0.0038854512386024, 0.0038103002589195967, 0.0035654904786497355, 0.0030497258994728327, 0.0029443716630339622, 0.0028205355629324913"
img112.png,motion accompwrpus Gay,"motion, animated, reno, Anim, amb, anim, anim, zig, <0xA6>, caption","0.013608860783278942, 0.004282217938452959, 0.004150467924773693, 0.003991466015577316, 0.0032961408142000437, 0.0031329377088695765, 0.0025670372415333986, 0.002468695631250739, 0.002468695631250739, 0.0024021065328270197"
img113.png,altogether vesseggijd rör,"altogether, öll, Rost, future, icha, subsequ, motion, pul, absolutely, alphabet","0.009816475212574005, 0.008106416091322899, 0.003814271418377757, 0.0034729333128780127, 0.0034190902952104807, 0.0029017445631325245, 0.002879162784665823, 0.0026420685462653637, 0.002631767885759473, 0.002377604367211461"
img114.png,animated późidan Rivoven,"animated, etr, animate, animation, anim, motion, Mira, Anim, Animation, dbo","0.013243955560028553, 0.012937159277498722, 0.012886722572147846, 0.005227085202932358, 0.00436739344149828, 0.004023430868983269, 0.0038844395894557238, 0.0034013292752206326, 0.003060864983126521, 0.0030489317141473293"
img115.png,DL fet Wingúrive,"DL, brave, adm, rons, vertical, altogether, pul, motion, entonces, Anim","0.004471324384212494, 0.004419231787323952, 0.003899958683177829, 0.0038847539108246565, 0.0033619743771851063, 0.003170643700286746, 0.003170643700286746, 0.002798083471134305, 0.0026388438418507576, 0.002547683659940958"
img116.png,animatedzeg Pflzáiers,"animated, altogether, animation, animate, anim, Anim, Animation, brave, multiplication, fert","0.01954616978764534, 0.019093383103609085, 0.013225601054728031, 0.010544367134571075, 0.005823152605444193, 0.004049366805702448, 0.003774424782022834, 0.003730451688170433, 0.0032284369226545095, 0.0031291083432734013"
img117.png,motion asym MiddleDLDL,"motion, altogether, ätz, elij, caption, itself, animation, animated, DL, vertical","0.01872924156486988, 0.005623538047075272, 0.004328591749072075, 0.004228320438414812, 0.003746083937585354, 0.003216736251488328, 0.003191703464835882, 0.002554607344791293, 0.002353414660319686, 0.002219481160864234"
img118.png,neaConstraintsDL symmetнва,"nea, zoom, animated, brave, forsch, Anim, ätz, het, DL, éli","0.006744273938238621, 0.004972916096448898, 0.004819915629923344, 0.0028334823437035084, 0.0026205426547676325, 0.0024236056488007307, 0.0023953700438141823, 0.0023860312066972256, 0.0023674629628658295, 0.0023036047350615263"
img119.png,imir targetsique Militicons,"imir, fas, fas, icons, dark, altogether, geg, alphabet, otherwise, zeich","0.00600449787452817, 0.005237216595560312, 0.005196459591388702, 0.004900728352367878, 0.0048436326906085014, 0.004658076446503401, 0.0036277135368436575, 0.0032139760442078114, 0.0026129442267119884, 0.0025926099624484777"
img120.png,motionplaceholder operjd Wein,"motion, animated, vertical, <0xA6>, MDb, middle, Pur, anim, altogether, brave","0.017023662105202675, 0.005131436046212912, 0.0035544417332857847, 0.003124554641544819, 0.0030881527345627546, 0.0026935345958918333, 0.00265177502296865, 0.002540244720876217, 0.002530341502279043, 0.002471726154908538"
img121.png,altogether Ung Leopold beskre Kenneth,"altogether, brave, motion, ún, elij, LD, fert, animated, MDb, absolutely","0.0198613703250885, 0.005387540906667709, 0.004397183191031218, 0.004345954395830631, 0.0036029228940606117, 0.003464896697551012, 0.003154824720695615, 0.0030817429069429636, 0.0028279663529247046, 0.00279501941986382"
img122.png,altogether sze造plotlibéric,"altogether, ätz, capt, het, Label, unknown, elij, future, brave, öll","0.008354144170880318, 0.007229909300804138, 0.005227890331298113, 0.004930369555950165, 0.003388590645045042, 0.0032082530669867992, 0.0028871153481304646, 0.002820235211402178, 0.002809240249916911, 0.0027121936436742544"
img123.png,ätzicons future Vinrench,"ätz, elij, adm, ilon, vertical, altogether, alphabet, motion, ota, rons","0.013491771183907986, 0.006944968830794096, 0.004312228877097368, 0.003972611390054226, 0.0037465293426066637, 0.0037028808146715164, 0.0031425943598151207, 0.00306979613378644, 0.002839097287505865, 0.002515300875529647"
img124.png,Wingoudjd才 Vin,"Wing, elij, ätz, Leopold, Zar, militar, ei, Horn, brave, imer","0.011031294241547585, 0.00645968085154891, 0.006068308837711811, 0.0036806154530495405, 0.003457618411630392, 0.0034040126483887434, 0.0034040126483887434, 0.0032992821652442217, 0.0032228543423116207, 0.003160518826916814"
img125.png,braverustangerfalzá,"brave, anim, beg, motion, elte, öll, dbo, olph, izada, dm","0.01636369712650776, 0.0062596723437309265, 0.0061626252718269825, 0.00578925060108304, 0.005589258391410112, 0.004561819601804018, 0.003978889435529709, 0.0032729452941566706, 0.0032348143868148327, 0.0030866817105561495"
img126.png,altogether Abd motionitt animated,"altogether, vertical, caption, animated, Vert, dear, Anim, symmet, Verb, brave","0.009114162065088749, 0.007918520830571651, 0.004390138201415539, 0.0035971503239125013, 0.003445858834311366, 0.003352913074195385, 0.003300930606201291, 0.003237085184082389, 0.0030768057331442833, 0.002913061063736677"
img127.png,motion motion asym Mirrev,"motion, animated, animation, anim, anim, alphabet, Anim, otion, brave, etr","0.014579949900507927, 0.007331259083002806, 0.005599156953394413, 0.003954917658120394, 0.0037738089449703693, 0.0037590961437672377, 0.0035729706287384033, 0.00330445752479136, 0.0029505484271794558, 0.0029275871347635984"
img128.png,braveΞanjeinsonVF,"brave, elij, afterwards, beyond, ätz, Rena, motion, alphabet, dark, etr","0.01013600267469883, 0.007076069712638855, 0.0054254112765192986, 0.00509670190513134, 0.0037142897490411997, 0.0036853847559541464, 0.003139986889436841, 0.0029497446957975626, 0.0029267899226397276, 0.002904013264924288"
img129.png,animationulla prepared Leopold Leopold,"animation, ätz, animate, animated, Animation, anim, motion, USA, icons, oles","0.007277530152350664, 0.006971446797251701, 0.0058705466799438, 0.005140422377735376, 0.004625879228115082, 0.003519183723255992, 0.003318906296044588, 0.0027839033864438534, 0.0026982517447322607, 0.00241869711317122"
img130.png,motionnrboa AwDL,"motion, ätz, reno, Verb, icons, olg, ayer, animated, ̃, altogether","0.017816884443163872, 0.0053495983593165874, 0.005005890037864447, 0.0041338494047522545, 0.0030961099546402693, 0.0028411506209522486, 0.002556758699938655, 0.0024877944961190224, 0.002478095469996333, 0.0024112530518323183"
img131.png,motionrostrost nearly motion,"motion, adm, ätz, ech, caption, Anim, mil, otion, anim, amp","0.01193821057677269, 0.010955117642879486, 0.008976302109658718, 0.005465711001306772, 0.0035845006350427866, 0.0030066845938563347, 0.0029600700363516808, 0.0029370347037911415, 0.0029141786508262157, 0.002891500247642398"
img132.png,motion Leopoldeggi ambjd,"motion, brave, photograph, öll, Label, asym, pul, altogether, absolutely, absolute","0.008208354003727436, 0.006595598068088293, 0.004497807007282972, 0.0044628046452999115, 0.003817239310592413, 0.0037727670278400183, 0.0034892389085143805, 0.0034756360109895468, 0.003176988335326314, 0.003127733711153269"
img133.png,animated motion reven Republican Horn,"animated, motion, animation, Anim, ayer, Gay, absolutely, animate, anim, Mold","0.012112065218389034, 0.011333873495459557, 0.008861375972628593, 0.006508495658636093, 0.005879935808479786, 0.004951402544975281, 0.004285081755369902, 0.0039941356517374516, 0.0038261469453573227, 0.003722943365573883"
img134.png,elteicons future capital Horn,"elte, brave, Pul, pul, etr, anson, vertical, enz, dbo, elij","0.006030138581991196, 0.0058218250051140785, 0.0046779680997133255, 0.004144449718296528, 0.004048443865031004, 0.003503635758534074, 0.003435869235545397, 0.003032144159078598, 0.0028595842886716127, 0.002848435891792178"
img135.png,motionaurrote motionrite,"motion, altogether, elij, Career, tact, rons, future, adem, alphabet, brave","0.02789459191262722, 0.020170358940958977, 0.0052823456935584545, 0.004345139488577843, 0.003658974077552557, 0.003141935681924224, 0.0029058153741061687, 0.002849611919373274, 0.002604756038635969, 0.002524616429582238"
img136.png,motionɐ Alliance Brig candidates,"motion, ätz, pedig, animated, elij, alphabet, photograph, Label, animation, öll","0.012970325537025928, 0.011312919668853283, 0.009233335964381695, 0.006370809860527515, 0.004697540774941444, 0.00464281253516674, 0.004588722251355648, 0.004129402805119753, 0.003559767734259367, 0.0035320655442774296"
img137.png,elijayerwryrussky,"elij, altogether, motion, ätz, photograph, animated, reno, öll, pul, hein","0.024373186752200127, 0.009214951656758785, 0.008390308357775211, 0.005209661554545164, 0.004651703871786594, 0.00416976073756814, 0.003222141182050109, 0.0030987027566879988, 0.0027885306626558304, 0.0027133149560540915"
img138.png,elijblemiconsrastealph,"elij, brave, altogether, Label, absolutely, póź, entr, motion, ab, sun","0.005484671797603369, 0.005315926391631365, 0.005152372643351555, 0.004802539478987455, 0.004156251437962055, 0.003981444984674454, 0.0037991213612258434, 0.0033136524725705385, 0.0032368917018175125, 0.002768660197034478"
img139.png,braveongsinaloud bud,"brave, motion, Label, elij, het, ätz, pul, му, caption, Trust","0.008459457196295261, 0.004320668056607246, 0.0031364685855805874, 0.0030399695970118046, 0.0029928390868008137, 0.0029579713009297848, 0.002878185361623764, 0.0024331610184162855, 0.0023583006113767624, 0.0023217382840812206"
img140.png,animated LipLoopongsongs,"animated, fert, animation, anim, motion, ätz, Anim, otion, altogether, Animation","0.0110543891787529, 0.009755464270710945, 0.008150995709002018, 0.00708170747384429, 0.007026596926152706, 0.006104812957346439, 0.004905355162918568, 0.003371397964656353, 0.0030937688425183296, 0.0029636488761752844"
img141.png,animatedaa rör Geneodore,"animated, motion, altogether, pul, fert, sch, anim, elij, photograph, animation","0.011761492118239403, 0.00738896057009697, 0.005983762443065643, 0.005799661856144667, 0.00422658072784543, 0.0036721171345561743, 0.003476690500974655, 0.003463136265054345, 0.003436185885220766, 0.0033829128369688988"
img142.png,elij Republic Leopold rör Mir,"elij, anim, symmet, motion, animate, asym, animated, Anim, ̃, ätz","0.012790514156222343, 0.012445512227714062, 0.009468046016991138, 0.009321258403360844, 0.006661602761596441, 0.005188061855733395, 0.005167834926396608, 0.004989309702068567, 0.004931182600557804, 0.004525107331573963"
img143.png,altogetherutton Leopoldrite motion,"altogether, motion, capt, Career, career, future, Anim, adm, Rev, alphabet","0.024384034797549248, 0.006336156278848648, 0.004690274596214294, 0.004237309563905001, 0.0036243631038814783, 0.0036102330777794123, 0.003431477816775441, 0.003365107113495469, 0.003248858265578747, 0.003161225700750947"
img144.png,Labelimirallenude Leopold,"Label, elte, motion, brave, anim, ulla, Anim, animated, animation, animate","0.011111806146800518, 0.006041384302079678, 0.005675355438143015, 0.005147323943674564, 0.004489575512707233, 0.0044027394615113735, 0.004040180705487728, 0.004040180705487728, 0.003780601778998971, 0.003442276967689395"
img145.png,ätzicons Native motionjd,"ätz, MDb, elij, animated, Anim, motion, anim, animation, anim, icha","0.025328805670142174, 0.013987894169986248, 0.01076686754822731, 0.009209389798343182, 0.006897514220327139, 0.00679057789966464, 0.006555994972586632, 0.005673740524798632, 0.004418713040649891, 0.004266066942363977"
img146.png,motionhd PL fratkins,"motion, elij, animated, ätz, afterwards, animation, alphabet, Icon, icons, caption","0.017157016322016716, 0.010778607800602913, 0.005441037006676197, 0.005111380945891142, 0.004337972961366177, 0.0035129976458847523, 0.0031490307301282883, 0.0029931110329926014, 0.0029698186554014683, 0.0028227728325873613"
img147.png,motion motionakte genomyrus,"motion, brave, elij, zoom, anim, Anim, Ward, Magn, apro, simultane","0.01404252927750349, 0.009137647226452827, 0.007371043786406517, 0.004007566720247269, 0.0033747097477316856, 0.002711655106395483, 0.002617980120703578, 0.0026077735237777233, 0.002468990394845605, 0.0022656728979200125"
img148.png,motion absolute пуógimer,"motion, ätz, elij, anim, animated, anim, animation, Verb, zes, olly","0.010229246690869331, 0.009572024457156658, 0.007085592020303011, 0.006253013387322426, 0.006013463716953993, 0.00496590044349432, 0.004314449615776539, 0.0037926442455500364, 0.0035489690490067005, 0.002840558998286724"
img149.png,otachsoceunden intermediate,"ota, elij, animation, brave, motion, animated, ätz, anim, altogether, Wing","0.012039978988468647, 0.009413444437086582, 0.005983549170196056, 0.004534297622740269, 0.00409639673307538, 0.004048672039061785, 0.004017164930701256, 0.003240516409277916, 0.002962071681395173, 0.002927562454715371"
img150.png,motion motionppenprecTP,"motion, äft, Hein, alphabet, absolute, across, vertical, animated, Harold, brave","0.004990427754819393, 0.0041534025222063065, 0.0038412692956626415, 0.0037085709627717733, 0.0037085709627717733, 0.0036941126454621553, 0.0033373527694493532, 0.003260043216869235, 0.0028769781347364187, 0.0025991329457610846"
img151.png,elij motionrevquaDL,"elij, ech, altogether, motion, alphabet, ätz, Career, brave, enz, beg","0.02174565941095352, 0.009352692402899265, 0.00799978245049715, 0.0066580092534422874, 0.005606605671346188, 0.003960178699344397, 0.0038084671832621098, 0.0034541296772658825, 0.0032959533855319023, 0.002587023423984647"
img152.png,animated röridanongs Anim,"animated, animation, animate, anim, motion, brave, elte, amps, Label, igen","0.01090780645608902, 0.010009566321969032, 0.008074391633272171, 0.007614876143634319, 0.005213218741118908, 0.004372855648398399, 0.004188938997685909, 0.0035412462893873453, 0.003352784551680088, 0.0033008046448230743"
img153.png,altogether Giovoxhein帝,"altogether, motion, absolutely, caption, animated, zoom, etr, pray, absolute, elij","0.0126150231808424, 0.009485195390880108, 0.007021318189799786, 0.00467720627784729, 0.004063627682626247, 0.0038927162531763315, 0.0038323653861880302, 0.0036142647732049227, 0.003489407943561673, 0.0033688650000840425"
img154.png,Anim animate trust Miréric,"Anim, anim, motion, icons, brave, photograph, Anim, rons, Rev, altogether","0.018041763454675674, 0.011028709821403027, 0.007881863042712212, 0.007092909421771765, 0.00597282825037837, 0.005312343593686819, 0.0043698144145309925, 0.003978761378675699, 0.003608579747378826, 0.003497555386275053"
