Image File,Inference Result,Top 10 Words,Top 10 Probabilities
img1.png,mor blankanh Bent lay,"mor, vac, relev, conduct, fra, hip, konn, assemble, riction, yw","0.016047928482294083, 0.009582655504345894, 0.008006609044969082, 0.00628445902839303, 0.004818461835384369, 0.004597808700054884, 0.004438974894583225, 0.004235699772834778, 0.004137579817324877, 0.003594791516661644"
img2.png,csậ campries Dest,"cs, konn, goals, mor, elen, sg, lais, FS, hip, eli","0.005615500267595053, 0.005093037616461515, 0.0035833995789289474, 0.0035140905529260635, 0.003301182296127081, 0.0029246853664517403, 0.002913283184170723, 0.002704892074689269, 0.0025810259394347668, 0.0024724712129682302"
img3.png,vac stack stackourdpen,"vac, expect, motion, lais, atern, utes, conduct, fra, jon, SBN","0.006204277276992798, 0.005063783843070269, 0.003733800258487463, 0.0037047432269901037, 0.003604814177379012, 0.003412969410419464, 0.003307963255792856, 0.0032822205685079098, 0.0030833608470857143, 0.0028405252378433943"
img4.png,stackConstraintserenctorivel,"stack, andom, Indep, expect, experiment, drag, Ze, atern, Constraints, assemble","0.007486836519092321, 0.006015842314809561, 0.005651360377669334, 0.005006827879697084, 0.004871777258813381, 0.004183361306786537, 0.0038841194473206997, 0.003749941010028124, 0.0037062526680529118, 0.003361425595358014"
img5.png,ywConstraints Amerivotх,"yw, Ze, Ze, sex, mor, motion, Sex, assembly, Indep, cs","0.00787372887134552, 0.00775165855884552, 0.003897778457030654, 0.003373246407136321, 0.0032313719857484102, 0.0031319530680775642, 0.0030237582977861166, 0.0026999120600521564, 0.0026684575714170933, 0.0026476914063096046"
img6.png,virtualolan rörlais Sr,"virtual, Ze, ray, motion, riction, andom, ray, assembly, fe, lais","0.008178017102181911, 0.0065712216310203075, 0.005321537144482136, 0.005218609236180782, 0.004999121651053429, 0.003369387472048402, 0.0032785041257739067, 0.0032657224219292402, 0.002950334455817938, 0.002904593711718917"
img7.png,expectpn Alternans gen,"expect, experimental, experiment, hip, cs, Vel, Free, Unity, stack, sBy","0.010453501716256142, 0.007354957051575184, 0.005573541857302189, 0.0032006159890443087, 0.0031757084652781487, 0.0028915151488035917, 0.002737631555646658, 0.0025617408100515604, 0.002444430021569133, 0.0023878049105405807"
img8.png,cs constraints🌍gtger,"cs, expect, lay, FS, ether, Free, mor, eli, yw, n","0.005169360898435116, 0.004153698217123747, 0.0035528463777154684, 0.0034977649338543415, 0.0033506532199680805, 0.00333759025670588, 0.0030988475773483515, 0.0029917967040091753, 0.0027669596020132303, 0.0027454267255961895"
img9.png,assembleutesraz assembleward,"assemble, assembly, Ze, expect, lay, ions, con, ames, assembly, lais","0.00919957086443901, 0.0067305495031178, 0.005514814984053373, 0.003925894852727652, 0.003437628736719489, 0.0027838763780891895, 0.0026563936844468117, 0.0026357213500887156, 0.0024186738301068544, 0.002409243956208229"
img10.png,stack indep legal ambTD,"stack, cs, mor, experiment, assemble, andom, eli, cs, model, lais","0.00811967346817255, 0.003957212902605534, 0.0035058963112533092, 0.0034786134492605925, 0.003306375117972493, 0.0032171912025660276, 0.003167313290759921, 0.0031060518231242895, 0.0028280923143029213, 0.002719749929383397"
img11.png,assembleech Felchev forces,"assemble, mor, riction, assembly, cs, expect, sever, hip, conduct, vez","0.006753088906407356, 0.004807399585843086, 0.004605206660926342, 0.0038029660936444998, 0.003369241254404187, 0.003265580628067255, 0.0027498945128172636, 0.002739173825830221, 0.0026967066805809736, 0.0026445474941283464"
img12.png,severmanslais Sraf,"sever, cs, pressure, hip, fe, lave, yw, stack, assemble, FS","0.008991328999400139, 0.004297267645597458, 0.003928021062165499, 0.003897452726960182, 0.003777540987357497, 0.003632825333625078, 0.003480033716186881, 0.003386165713891387, 0.0032185050658881664, 0.002999976510182023"
img13.png,expect indep mor Hatunt,"expect, STR, yw, Indep, cs, stack, Unity, hip, elen, iana","0.007361701223999262, 0.005344022065401077, 0.004378735087811947, 0.004310848657041788, 0.004210987593978643, 0.0032286765053868294, 0.0030330608133226633, 0.0029168662149459124, 0.0028381887823343277, 0.0027401421684771776"
img14.png,FS fe Kill stacksBy,"FS, vac, VD, fe, mor, Indep, ond, eli, reet, comun","0.00967262964695692, 0.009015882387757301, 0.00860301498323679, 0.007272819057106972, 0.0065961601212620735, 0.005383628886193037, 0.005137094762176275, 0.0037583790253847837, 0.003572288667783141, 0.0033297387417405844"
img15.png,expect link Conventionolatenl,"expect, fra, fe, ën, assemble, cs, riction, quet, model, ieg","0.005654095206409693, 0.00391647731885314, 0.003524448024109006, 0.0033499407581984997, 0.003336880123242736, 0.003134709084406495, 0.002702288096770644, 0.0024413138162344694, 0.0024223155342042446, 0.0023940945975482464"
img16.png,fraandomnach hoe,"fra, atern, mor, ond, sever, konn, katol, andom, rias, yw","0.007169631775468588, 0.006894967518746853, 0.005224965047091246, 0.0047019594348967075, 0.004521830007433891, 0.004006119444966316, 0.003882864024490118, 0.0038376275915652514, 0.0036051173228770494, 0.003386694472283125"
img17.png,Zevez destinnesoci,"Ze, expect, fra, cs, lay, assemble, Ze, ray, VD, fe","0.014388682320713997, 0.009889187291264534, 0.006409929133951664, 0.006360046565532684, 0.005482702981680632, 0.005110441241413355, 0.004440027754753828, 0.004440027754753828, 0.004236704204231501, 0.003872661152854562"
img18.png,rictionhtouvellesiezци,"riction, conduct, expect, conducted, mor, sever, hip, vac, VD, fra","0.0054367827251553535, 0.0051474422216415405, 0.005008598789572716, 0.004632196389138699, 0.0041360859759151936, 0.0036216783337295055, 0.003593493951484561, 0.00348293362185359, 0.003323438810184598, 0.0027444856241345406"
img19.png,assemble forcesmath individually Ali,"assemble, virtual, mor, experimental, fra, assembly, riction, bb, surrounding, iments","0.006060180254280567, 0.005942965857684612, 0.005648708902299404, 0.004701273050159216, 0.004433722235262394, 0.0041977642104029655, 0.0038370671682059765, 0.0038072066381573677, 0.003452986478805542, 0.0030711498111486435"
img20.png,expect forces associ stackenst,"expect, VD, lais, Ze, Constraints, FS, goals, konn, vez, eli","0.007707518991082907, 0.004674846772104502, 0.004014258272945881, 0.0033935746178030968, 0.003327936865389347, 0.0033020388800650835, 0.003212971845641732, 0.0031879686284810305, 0.0031508272513747215, 0.002591799944639206"
img21.png,morCLC amb forceslais,"assemble, mor, <0xA3>, sever, assembly, ames, programming, zie, Sr, conduct","0.005477462895214558, 0.005477462895214558, 0.003606267739087343, 0.0032074807677417994, 0.002931874943897128, 0.002711540786549449, 0.0025274341460317373, 0.002478549024090171, 0.0024116942659020424, 0.0023374943993985653"
img22.png,csaholaisQue,"cs, cs, mor, vac, sever, yw, riction, expect, ola, programming","0.0194424856454134, 0.015440468676388264, 0.007794342935085297, 0.006411451380699873, 0.005614054389297962, 0.004746010527014732, 0.004493432585150003, 0.004155745729804039, 0.003161524422466755, 0.002725404454395175"
img23.png,Assembly Rechtsnlolastern,"Assembly, assembly, yw, experiment, VD, mor, fra, expect, же, stack","0.005076148081570864, 0.005056358408182859, 0.0036848883610218763, 0.003448136616498232, 0.0032646304462105036, 0.002949347486719489, 0.002836359664797783, 0.0028253018390387297, 0.0026959218084812164, 0.002674942137673497"
img24.png,ywaho Sabivelnes,"yw, cs, ister, andom, cs, expect, rå, eli, ivel, Indep","0.006761293392628431, 0.004053154494613409, 0.0036474440712481737, 0.003426456591114402, 0.0033601829782128334, 0.002774829277768731, 0.002742501674219966, 0.0025763418525457382, 0.002382726641371846, 0.0021442219149321318"
img25.png,assemble attachunnsBy cic,"assemble, ola, cs, eli, fra, lais, Free, fe, vac, assembly","0.003713317448273301, 0.003543272614479065, 0.003529458539560437, 0.0035019919741898775, 0.003434257348999381, 0.003302693134173751, 0.0031886000651866198, 0.003030721563845873, 0.002891934709623456, 0.0027487450279295444"
img26.png,Indepnl BraTD parliament,"Indep, Ze, atern, ray, cs, assemble, Free, expect, yw, ray","0.0058279018849134445, 0.004485896322876215, 0.004364897031337023, 0.004230603110045195, 0.003218472935259342, 0.0030234758742153645, 0.0028963121585547924, 0.002873773220926523, 0.002606398891657591, 0.002565990434959531"
img27.png,konn layech Indepahr,"konn, FD, anh, inkel, model, mor, FS, vac, fra, Ze","0.008587627671658993, 0.006018594838678837, 0.005009119398891926, 0.003737030550837517, 0.0032722533214837313, 0.0029562341514974833, 0.0028318993281573057, 0.0027447708416730165, 0.002598696621134877, 0.0024317321367561817"
img28.png,assembleices assemblearianoret,"assemble, yw, assembly, Assembly, expect, assembly, sg, Ze, stack, rias","0.011180278845131397, 0.008809848688542843, 0.008373642340302467, 0.004752556327730417, 0.0037890684325248003, 0.003044601995497942, 0.0030209084507077932, 0.0026763766072690487, 0.0022537352051585913, 0.002192944521084428"
img29.png,yw Killivelsero Raymond,"yw, eli, fe, cs, andom, Free, mor, ango, anh, Indep","0.009107157588005066, 0.007010029163211584, 0.004761787597090006, 0.004490793216973543, 0.003871305612847209, 0.0034974333830177784, 0.003483798122033477, 0.002956660930067301, 0.0026607068721204996, 0.00252896617166698"
img30.png,VDolasMPywvier,"VD, Ze, `', fra, sg, mor, expect, sb, ray, konn","0.0069032213650643826, 0.005292883608490229, 0.004972204100340605, 0.003857258940115571, 0.0037679062224924564, 0.003651979612186551, 0.003197780344635248, 0.003087311517447233, 0.0030040366109460592, 0.002934447955340147"
img31.png,assembleouvellesacoannelolas,"assemble, expect, sever, lay, ray, fra, con, riction, FS, yw","0.013418160378932953, 0.010739761404693127, 0.007070873863995075, 0.004936265759170055, 0.004840789828449488, 0.004784392658621073, 0.004459543619304895, 0.003199566388502717, 0.003053047461435199, 0.003029288724064827"
img32.png,Zevier debrimht,"Ze, atern, Ze, Indep, VD, konn, yw, sex, eli, cs","0.009366166777908802, 0.005884137470275164, 0.0051927329041063786, 0.005052668042480946, 0.004974333569407463, 0.0037548241671174765, 0.0034862360917031765, 0.003300701966509223, 0.002812233055010438, 0.0027578396257013083"
img33.png,VD ambinusaryTT,"VD, mor, vac, stack, goals, assembly, Assembly, goal, elen, vez","0.013048598542809486, 0.008457782678306103, 0.004689112305641174, 0.0034575348254293203, 0.0033642735797911882, 0.003338092705234885, 0.002922931220382452, 0.002778206951916218, 0.0027458397671580315, 0.0026406485121697187"
img34.png,expectds﻿citoicher,"expect, assembly, assemble, con, Assembly, drag, andom, Ze, ray, destruction","0.006953963078558445, 0.006661488674581051, 0.004931098315864801, 0.0038553739432245493, 0.0038104576524347067, 0.0035795937292277813, 0.003442461369559169, 0.002766095567494631, 0.0027445696759968996, 0.0027445696759968996"
img35.png,vac staryolenbahn,"vac, VD, Indep, 光, experiment, expect, katol, Ze, FD, anel","0.004338992293924093, 0.003653798019513488, 0.0036112298257648945, 0.0033660365734249353, 0.003237085184082389, 0.0031374909449368715, 0.002901704516261816, 0.002812428632751107, 0.0027688259724527597, 0.002652372932061553"
img36.png,mor Braoamilolis,"mor, stack, Constraints, experiment, assemble, VD, fra, directly, programming, Free","0.008761630393564701, 0.006140544079244137, 0.004527752753347158, 0.004236848093569279, 0.003471548669040203, 0.0032996605150401592, 0.0029809949919581413, 0.002800385467708111, 0.002800385467708111, 0.002735514659434557"
img37.png,stack laylst destinwn,"stack, mor, ighth, konn, utes, drag, elen, cs, andom, Ze","0.007980993948876858, 0.005659372080117464, 0.005593438632786274, 0.005485251545906067, 0.00437322398647666, 0.00414048507809639, 0.0037995229940861464, 0.0034192006569355726, 0.003041099989786744, 0.002812557388097048"
img38.png,FSUEacksBy S,"FS, lais, cs, fra, fe, Constraints, Ze, experiment, city, lay","0.006713154725730419, 0.00616033747792244, 0.0056090508587658405, 0.005067354999482632, 0.004911448806524277, 0.0033493174705654383, 0.0033102966845035553, 0.0032717303838580847, 0.003025856101885438, 0.003025856101885438"
img39.png,andomcent ho duringieve,"andom, isko, assemble, lais, FS, Ze, expect, vac, peace, Free","0.006476211827248335, 0.0056707607582211494, 0.005539397709071636, 0.0048694428987801075, 0.003912707325071096, 0.0032691892702132463, 0.0024870680645108223, 0.002419983735308051, 0.002410548971965909, 0.002410548971965909"
img40.png,VD civillaislaiszn,"VD, ray, experiment, expect, vac, FD, eli, experimental, bbe, ray","0.013198898173868656, 0.008131605572998524, 0.007698849309235811, 0.006210410967469215, 0.00514861149713397, 0.004932068288326263, 0.00408882787451148, 0.0035110481549054384, 0.0028768498450517654, 0.0027666392270475626"
img41.png,aternmainl motion attach,"atern, konn, riction, yw, Unity, assembly, STR, assembly, anel, mor","0.004258172586560249, 0.0040631769225001335, 0.0036564632318913937, 0.003543965518474579, 0.0029610940255224705, 0.0029038211796432734, 0.002858801744878292, 0.002847656374797225, 0.0027066590264439583, 0.0026336514856666327"
img42.png,ywwardoloippppa,"yw, riction, cs, VD, assemble, expect, lais, aho, ola, Constraints","0.006072781514376402, 0.005235064774751663, 0.005194325465708971, 0.004157485440373421, 0.00359800411388278, 0.003018010873347521, 0.0029828499536961317, 0.0029366053640842438, 0.0028910774271935225, 0.0024922643788158894"
img43.png,assemblymaiieg individually convention,"assembly, agan, riction, andom, Assembly, Raymond, sever, iana, assemble, mor","0.012018365785479546, 0.00537494570016861, 0.004836927633732557, 0.004268574062734842, 0.004186011850833893, 0.004186011850833893, 0.004121113568544388, 0.004089043475687504, 0.003841300727799535, 0.0034839084837585688"
img44.png,morieganz rörlais,"mor, jon, expect, oda, riction, hours, konn, NL, Prim, Sever","0.0057223946787416935, 0.005460347514599562, 0.005375692155212164, 0.00499116163700819, 0.004952319897711277, 0.004799952730536461, 0.003841834142804146, 0.003738207509741187, 0.0033904067240655422, 0.003003733931109309"
img45.png,Ze lay directly convention convent,"Ze, ifa, riction, assemble, cs, ember, SR, andom, sever, ond","0.003994923084974289, 0.0038569169119000435, 0.003709160489961505, 0.00323518761433661, 0.0031234263442456722, 0.0030273287557065487, 0.002569260774180293, 0.0025195663329213858, 0.002499959198758006, 0.0024420476984232664"
img46.png,laisせivelchiaanse,"lais, Ze, ola, ames, sever, ivel, atern, assembly, ën, breakfast","0.020539971068501472, 0.0067733642645180225, 0.004222137853503227, 0.003597306553274393, 0.003583281533792615, 0.0035415354650467634, 0.0034460085444152355, 0.003275384893640876, 0.002823558170348406, 0.0026732911355793476"
img47.png,expect yetadtadt recent,"expect, yw, mor, assemble, cs, lay, vac, Free, Ra, drag","0.008547578006982803, 0.006868171971291304, 0.004149516113102436, 0.003944059368222952, 0.003763447515666485, 0.0032825374510139227, 0.0030358510557562113, 0.002953964052721858, 0.0029081671964377165, 0.0028519181068986654"
img48.png,sever routnach�ns,"sever, assemble, virtual, ifa, expect, cs, Sever, ary, bibli, fe","0.00921908300369978, 0.007702832575887442, 0.0038131787441670895, 0.0035266135819256306, 0.0033389306627213955, 0.002912266878411174, 0.002889603842049837, 0.0027897809632122517, 0.0026310139801353216, 0.0026105393189936876"
img49.png,vac legal vr Cir Bent,"vac, ray, yw, VD, experiment, assemble, expect, Indep, terms, stack","0.00496021518483758, 0.004864276386797428, 0.0046234289184212685, 0.004292708355933428, 0.004242697264999151, 0.003558780299499631, 0.0035449061542749405, 0.003517318982630968, 0.0032785022631287575, 0.0031283684074878693"
img50.png,VD Copaward Bangcola,"VD, FS, Ze, konn, yw, expect, eli, fra, ën, ether","0.020221175625920296, 0.015323484316468239, 0.0059308516792953014, 0.005033448804169893, 0.004092164803296328, 0.004013014957308769, 0.0034325136803090572, 0.003149851690977812, 0.0026628226041793823, 0.0026317995507270098"
img51.png,rictionlaisyo equivalentlais,"riction, assembly, konn, ipp, stack, assemble, Stack, cs, vectors, assembly","0.0077483453787863255, 0.0075099533423781395, 0.006653450429439545, 0.00506167858839035, 0.00422919075936079, 0.003942038863897324, 0.003645789809525013, 0.002975607058033347, 0.002625964116305113, 0.0025451716501265764"
img52.png,expectjondestadtiet,"expect, anel, stack, Indep, FS, ola, ka, cs, N, assemble","0.00799456238746643, 0.007688296027481556, 0.00578080490231514, 0.005691181868314743, 0.005451817996799946, 0.004019918851554394, 0.0034925658255815506, 0.003358767833560705, 0.0032681706361472607, 0.003130715573206544"
img53.png,Zeywlaisolas sens,"Ze, Hav, assembly, cs, yw, assemble, pressure, VD, stack, cop","0.004448928404599428, 0.0037317676469683647, 0.0034783899318426847, 0.0032549055758863688, 0.003167110262438655, 0.0029176785610616207, 0.0029176785610616207, 0.0028612457681447268, 0.0026878914795815945, 0.0026359029579907656"
img54.png,vac stackadt relevlay,"vac, mor, comun, VD, assemble, egy, virtual, riction, experiment, assembly","0.00543303182348609, 0.0048133996315300465, 0.003882812801748514, 0.003676173510029912, 0.003563069272786379, 0.0030835794750601053, 0.0030835794750601053, 0.0029770557302981615, 0.0029194741509854794, 0.0028186198323965073"
img55.png,vac blankolaech Sing,"vac, yw, expect, cs, andom, experiment, stack, Ze, jon, assemble","0.006377968471497297, 0.005584736354649067, 0.005328992381691933, 0.0033347983844578266, 0.003308846615254879, 0.003084184369072318, 0.0028191725723445415, 0.0027863280847668648, 0.0026277576107531786, 0.0025568786077201366"
img56.png,konnwodywierzfp,"konn, assembly, eli, assemble, yw, stack, Ze, VD, sg, Assembly","0.00828500371426344, 0.007573106791824102, 0.005829228553920984, 0.005605914629995823, 0.004611298907548189, 0.004315026104450226, 0.004264754708856344, 0.004085384774953127, 0.0037931513506919146, 0.003400158602744341"
img57.png,assembleivelourdomp intern,"assemble, andom, assembly, drag, ray, yw, Assembly, fra, mor, ray","0.014768674038350582, 0.006084774155169725, 0.004946886096149683, 0.004331638105213642, 0.003822657512500882, 0.003778122365474701, 0.003734105732291937, 0.003661881433799863, 0.0033211824484169483, 0.003181497799232602"
img58.png,moriegitooteo,"mor, vac, VD, assemble, Free, motion, elen, sg, <0xA3>, Free","0.009917882271111012, 0.005922237411141396, 0.00578504940494895, 0.004299083724617958, 0.0037939278408885, 0.0035780149046331644, 0.0027865604497492313, 0.0027865604497492313, 0.0026382626965641975, 0.002547122770920396"
img59.png,assemblyansenivellaisivel,"assembly, Assembly, lais, cs, mor, konn, stack, andom, Constraints, assembly","0.006658595521003008, 0.005563464947044849, 0.005392294842749834, 0.005329473409801722, 0.004401063080877066, 0.004134416114538908, 0.004086248576641083, 0.003976028878241777, 0.0037205712869763374, 0.0033350989688187838"
img60.png,conduct indirectlais Cuarga,"conduct, yw, vac, fra, Constraints, lais, conducted, eli, mor, andom","0.008393595926463604, 0.006140885874629021, 0.005031661596149206, 0.00474530877545476, 0.004653526470065117, 0.004617312457412481, 0.004545727279037237, 0.0040588779374957085, 0.0037980973720550537, 0.0032234035898"
img61.png,konnnlpplaisivel,"konn, Constraints, atern, andom, motion, VD, yw, katol, vac, FS","0.007624324411153793, 0.007218565326184034, 0.006650054361671209, 0.004482108633965254, 0.004293597768992186, 0.004293597768992186, 0.003955447115004063, 0.0037013122346252203, 0.003490670118480921, 0.0034231545869261026"
img62.png,ywConstraintsasilaisnl,"yw, konn, pper, FS, cs, arp, vac, assemble, mor, ether","0.010236455127596855, 0.006872430443763733, 0.004334387835115194, 0.0034827785566449165, 0.0032974286004900932, 0.0029327934607863426, 0.0023109856992959976, 0.0022662871051579714, 0.002137312199920416, 0.002071554074063897"
img63.png,stack BrahthtConstraints,"stack, anel, cs, Indep, ether, mor, ango, yw, laid, ivel","0.00991307944059372, 0.0066035352647304535, 0.004646167159080505, 0.004181097727268934, 0.003927777986973524, 0.0034527378156781197, 0.0034392771776765585, 0.0026785116642713547, 0.0025359641294926405, 0.002457940485328436"
img64.png,ywansen¨MPward,"yw, Ze, cs, lais, Ze, vac, cs, konn, mor, rural","0.0064368825405836105, 0.005357249174267054, 0.004287888295948505, 0.0030524686444550753, 0.00286752893589437, 0.0027684688102453947, 0.002757675712928176, 0.002190039027482271, 0.002139306627213955, 0.002065403386950493"
img65.png,ywConstraintsNLieg◄,"yw, ola, vac, expect, Ze, atern, Ra, fra, assembly, mor","0.005306735634803772, 0.00445129768922925, 0.0037191985175013542, 0.003604770638048649, 0.003059329465031624, 0.002851608209311962, 0.002829416887834668, 0.002606580965220928, 0.0025762133300304413, 0.0022646368015557528"
img66.png,VD Copa uneeica,"VD, expect, stack, cs, mor, aho, Constraints, fra, ray, anh","0.004450085107237101, 0.004246301017701626, 0.0033199654426425695, 0.0032812869176268578, 0.003167933551594615, 0.0031066597439348698, 0.0030584956984966993, 0.002941326703876257, 0.002861989429220557, 0.002850831486284733"
img67.png,andom layijouwif,"andom, cs, Indep, virtual, experimental, riction, ki, Ξ, Sele, forces","0.004641348961740732, 0.00460522947832942, 0.004048256669193506, 0.0035171862691640854, 0.0029966800939291716, 0.0028818792197853327, 0.00260356068611145, 0.002407900057733059, 0.00229763425886631, 0.0022444098722189665"
img68.png,andom layConstraints amb Micro,"andom, assemble, Ze, VD, cs, ú, expect, cs, Ze, ray","0.006907558999955654, 0.005885313730686903, 0.005885313730686903, 0.004955931566655636, 0.0048222532495856285, 0.0042060441337525845, 0.004157042596489191, 0.0036973501555621624, 0.003366475459188223, 0.0029362919740378857"
img69.png,laisanneadt Sver先,"lais, angles, konn, Unity, vac, mor, cop, lay, ries, assemble","0.0057481457479298115, 0.005506386049091816, 0.0051325163803994656, 0.005072720814496279, 0.003445808542892337, 0.003339792136102915, 0.003275194438174367, 0.003162051783874631, 0.003162051783874631, 0.0031374446116387844"
img70.png,vacary somehowadtadt,"vac, andom, mor, ivel, cs, expect, ën, eli, ola, yw","0.009626571089029312, 0.004746919497847557, 0.0045829350128769875, 0.004441932775080204, 0.003445893991738558, 0.0034324596635997295, 0.0031745063606649637, 0.003125289920717478, 0.003040990326553583, 0.0028791518416255713"
img71.png,assemblyternolisech necess,"assembly, assemble, cs, Assembly, Ze, ray, assembly, VD, konn, cs","0.011567508801817894, 0.009150653146207333, 0.005550151225179434, 0.004373413976281881, 0.0039050192572176456, 0.0037701185792684555, 0.0035141371190547943, 0.00341934897005558, 0.0033271180000156164, 0.003101214999333024"
img72.png,Ze causejonmansdest,"Ze, VD, Ze, expect, stack, experiment, FS, assembly, oda, assemble","0.017828671261668205, 0.011288411915302277, 0.009769306518137455, 0.008825832046568394, 0.008226580917835236, 0.004301367327570915, 0.003931768238544464, 0.003825715510174632, 0.0031840428709983826, 0.00313467881642282"
img73.png,VDivel Headadtts,"VD, konn, yw, cs, experiment, cs, Ze, goals, motion, lais","0.0061165220104157925, 0.00590522401034832, 0.005011698231101036, 0.004953310359269381, 0.003964579664170742, 0.0032611743081361055, 0.003160838270559907, 0.0030278977937996387, 0.0027354778721928596, 0.002569743664935231"
img74.png,andomsgansenuntilly,"andom, assemble, yw, atern, Ze, motion, 光, Beat, eli, expect","0.008160707540810108, 0.006557312794029713, 0.004368112422525883, 0.0038850794080644846, 0.00376554811373353, 0.003013906767591834, 0.0029904525727033615, 0.002820265246555209, 0.002787408186122775, 0.0026701733004301786"
img75.png,FSuntrie forcesanza,"FS, hav, fra, experiment, assemble, Unity, experimental, vac, Indep, expect","0.011479186825454235, 0.0055945091880857944, 0.005054217763245106, 0.004656163975596428, 0.0041900938376784325, 0.003982627764344215, 0.0035700041335076094, 0.003528412664309144, 0.003380012232810259, 0.003018011339008808"
img76.png,yw Hav forcesolenConstraints,"yw, assembly, ivel, stack, riction, asm, assemble, assembly, pressure, 法","0.006779202260077, 0.006172534078359604, 0.0056421528570353985, 0.004714195150882006, 0.004394113086163998, 0.004325988702476025, 0.003908205311745405, 0.003202268620952964, 0.002728366991505027, 0.0025630632881075144"
img77.png,riction microadt indepinos,"riction, andom, yw, mor, stack, Constraints, assemble, experiment, assembly, bbe","0.007614918518811464, 0.006933462340384722, 0.006239440757781267, 0.0047652944922447205, 0.00427158223465085, 0.0035970329772681, 0.003186794463545084, 0.0028454873245209455, 0.0026730878744274378, 0.002641945378854871"
img78.png,yw exped Kentivel mid,"yw, VD, mor, konn, assemble, fra, corresponding, Indep, Constraints, aar","0.009806791320443153, 0.005479664076119661, 0.004334771540015936, 0.004088078625500202, 0.003825422376394272, 0.003707726253196597, 0.0036788727156817913, 0.003636012552306056, 0.003455981146544218, 0.0032593002542853355"
img79.png,csctoryenMP amb,"cs, cs, expect, vac, assemble, stack, hip, mor, Free, fe","0.00793591607362032, 0.0044690691865980625, 0.004365542903542519, 0.004069133196026087, 0.0039439392276108265, 0.0035491613671183586, 0.0030003907158970833, 0.0026581990532577038, 0.0024393005296587944, 0.002410881919786334"
img80.png,laisnl leg Microick,"lais, FM, alloc, FS, Ze, 🌍, mor, hip, yw, konn","0.010031528770923615, 0.00705806165933609, 0.005874240305274725, 0.004486376885324717, 0.004165459889918566, 0.004133044276386499, 0.0040689678862690926, 0.003943778574466705, 0.002774794353172183, 0.002721125027164817"
