img81.png,konn forcesandom morats,"konn, Ze, mor, cs, Constraints, oda, yw, assemble, FS, Ze","0.02444489300251007, 0.0044343904592096806, 0.004117191769182682, 0.003822683123871684, 0.0033082563895732164, 0.0026170462369918823, 0.0025664279237389565, 0.0024777697399258614, 0.002468109829351306, 0.002364304382354021"
img82.png,eliivelilly grat Tod,"eli, iana, Constraints, cs, mor, yw, VD, FS, expect, konn","0.00560169480741024, 0.003925919067114592, 0.0032802282366901636, 0.003166911192238331, 0.003045588731765747, 0.0029518860392272472, 0.00279478938318789, 0.002456777496263385, 0.0024281551595777273, 0.002399866469204426"
img83.png,konnerenieveivelnl,"konn, assembly, STR, cs, assemble, utes, lais, FS, fe, rias","0.005208014510571957, 0.004578138701617718, 0.004419984761625528, 0.004317596089094877, 0.0037954100407660007, 0.0037511924747377634, 0.003635779954493046, 0.0033104154281318188, 0.0030736166518181562, 0.002876138547435403"
img84.png,assembly conventionega hours mission,"assembly, stack, expect, assemble, cs, konn, vac, Assembly, experimental, lais","0.008997744880616665, 0.008128785528242588, 0.006818436551839113, 0.004217158071696758, 0.0033491034992039204, 0.0032082449179142714, 0.002842347137629986, 0.002798280445858836, 0.002670138143002987, 0.002618492813780904"
img85.png,assemble worolisadelbia,"assemble, VD, yw, assembly, expect, stack, iri, mor, motion, rias","0.011093865148723125, 0.005099020898342133, 0.004752810578793287, 0.004679124802350998, 0.00350450212135911, 0.0031784456223249435, 0.0029742324259132147, 0.0027080695144832134, 0.002371265087276697, 0.002362020080909133"
img86.png,expectolasternivelFM,"expect, lay, assembly, assemble, yw, cs, riction, hip, Ze, fe","0.007913998328149319, 0.006875800900161266, 0.005503321532160044, 0.00480008265003562, 0.00456241425126791, 0.00447416864335537, 0.004203092772513628, 0.0036803511902689934, 0.003273372072726488, 0.002877478487789631"
img87.png,morivelillymemlais,"mor, iana, vac, katol, ivel, eli, FS, Constraints, experiment, atern","0.009435576386749744, 0.006796190980821848, 0.0042529478669166565, 0.004010911565274, 0.0037094869185239077, 0.00358134089037776, 0.003484740387648344, 0.0034576221369206905, 0.003351242281496525, 0.0031977775506675243"
img88.png,laisConstraintsvier conanh,"lais, Ze, cs, cs, andom, konn, Ra, lay, virtual, assemble","0.025462845340371132, 0.0049555180594325066, 0.004784327000379562, 0.004013100638985634, 0.0038896307814866304, 0.0037115116138011217, 0.003224616637453437, 0.0031746237073093653, 0.0031746237073093653, 0.002936047036200762"
img89.png,assemble� among layandom,"assemble, mor, cs, expect, stack, assembly, fra, vac, lay, Ze","0.0075285607017576694, 0.0073254904709756374, 0.005235292017459869, 0.005194550845772028, 0.004029748495668173, 0.003770839422941208, 0.0037123779766261578, 0.0033933883532881737, 0.0033407786395400763, 0.0030776693020015955"
img90.png,andom lay Indep layansen,"andom, Beat, cs, assemble, Ze, yw, experiment, cs, sever, assembly","0.009053605608642101, 0.008147363550961018, 0.007106256205588579, 0.007106256205588579, 0.0048271529376506805, 0.0032789986580610275, 0.0029278164729475975, 0.0027504288591444492, 0.002707787323743105, 0.002697230549529195"
img91.png,Ze laykb dev complet,"Ze, sever, cs, konn, assembly, assemble, lais, fe, cs, expect","0.005400203168392181, 0.004936185199767351, 0.0046734861098229885, 0.004424767568707466, 0.004013089928776026, 0.0035554009955376387, 0.0033661858178675175, 0.003275388851761818, 0.0028125534299761057, 0.0026318486779928207"
img92.png,konnnlren recently v,"konn, yw, assembly, lais, ames, ën, Indep, riction, assembly, atern","0.011725368909537792, 0.010929245501756668, 0.00605932530015707, 0.005918961483985186, 0.004398598801344633, 0.0038365258369594812, 0.003660838818177581, 0.003439039457589388, 0.0032306788489222527, 0.0029762403573840857"
img93.png,stack indirect amb laid Serial,"stack, ether, fra, assemble, konn, Beat, Free, cs, riction, more","0.006071603856980801, 0.005234049633145332, 0.004108252935111523, 0.0037552467547357082, 0.003668256802484393, 0.003301073797047138, 0.003224604530259967, 0.002834609244018793, 0.002611364470794797, 0.0020258037839084864"
img94.png,yw Kill Same vaczew,"yw, assembly, VD, Ze, assemble, Ze, anel, konn, vac, fra","0.00782851129770279, 0.0077071413397789, 0.00741188507527113, 0.006515464745461941, 0.0049373796209692955, 0.004460550844669342, 0.004256287589669228, 0.003501126542687416, 0.0031753843650221825, 0.0027266801334917545"
img95.png,Ze layiltcuша,"Ze, lais, konn, Ze, VD, Indep, Constraints, Sele, FD, programming","0.008698633871972561, 0.007353653199970722, 0.007296426687389612, 0.00471092713996768, 0.004108943976461887, 0.003569912165403366, 0.0034600775688886642, 0.0027586144860833883, 0.0027264757081866264, 0.002443996723741293"
img96.png,FS Alternlaisetzlais,"FS, expect, ola, isko, stack, experiment, atern, VD, ister, drag","0.0188935324549675, 0.010556991212069988, 0.008820697665214539, 0.004814499989151955, 0.0047584096901118755, 0.004298864398151636, 0.0029545635916292667, 0.0027112599927932024, 0.002607393078505993, 0.0025271722115576267"
img97.png,expectcs contrib attachadt,"expect, mor, assembly, andom, sever, cs, Sever, assemble, Ze, vac","0.0072673046961426735, 0.006048387382179499, 0.005464262794703245, 0.005014289170503616, 0.004975267685949802, 0.00444241426885128, 0.004407843109220266, 0.003770228009670973, 0.003770228009670973, 0.0026734923012554646"
img98.png,assemblyell spare spareandom,"assembly, assemble, konn, andom, lais, assembly, vac, con, cs, ola","0.007032948080450296, 0.005899247247725725, 0.005026221740990877, 0.004540812689810991, 0.00423250300809741, 0.004216001834720373, 0.004216001834720373, 0.004199564922600985, 0.00405448954552412, 0.003899164265021682"
img99.png,konnechnes tomTAG,"konn, stack, NL, mor, Stack, fra, utes, programming, hrer, Stack","0.024311330169439316, 0.011848396621644497, 0.006803961470723152, 0.0063668107613921165, 0.005056275054812431, 0.004291204735636711, 0.004224675707519054, 0.003641898278146982, 0.0036135567352175713, 0.002914938610047102"
img100.png,stack Indepadeci loop,"stack, yw, mor, elen, vac, aho, atern, Stack, motion, aff","0.006630891468375921, 0.004794745240360498, 0.004182050935924053, 0.003913356456905603, 0.003734151367098093, 0.00348061160184443, 0.0033999832812696695, 0.002497216686606407, 0.002497216686606407, 0.002062194049358368"
img101.png,assembly péri stack independ citizens,"assembly, NL, jon, assemble, Ze, vac, riction, assembly, rural, lad","0.00560123473405838, 0.004500718787312508, 0.004483172670006752, 0.0037899853195995092, 0.0036023303400725126, 0.0035326543729752302, 0.003331610932946205, 0.002940136007964611, 0.002666587708517909, 0.002456575632095337"
img102.png,ether Indepaliclude indep,"ether, ivel, sg, konn, VD, experiment, hours, reen, anh, mor","0.008008124306797981, 0.004819374065846205, 0.0034442513715475798, 0.003248238703235984, 0.0031729929614812136, 0.003075370332226157, 0.003039540955796838, 0.0029345389921218157, 0.0022943660151213408, 0.0022237757220864296"
img103.png,expectmanaffrimci,"expect, yw, assemble, model, Ze, fe, assembly, cs, Ze, lais","0.011144575662910938, 0.005781729705631733, 0.0038214896339923143, 0.003806591499596834, 0.003479506354779005, 0.0033593052066862583, 0.0033593052066862583, 0.0032814869191497564, 0.0032180172856897116, 0.00315577513538301"
img104.png,ywCFaehtivel,"yw, rias, assemble, Constraints, cs, mor, Ze, rout, vac, ango","0.007249169517308474, 0.004905033856630325, 0.004589888267219067, 0.0033449421171098948, 0.002883520442992449, 0.0025746941100806, 0.0025248946622014046, 0.0024954788386821747, 0.002485749777406454, 0.0024376714136451483"
img105.png,mornl unexpected mpjon,"mor, vac, Beat, lay, FS, iana, stack, VD, virtual, lais","0.010525534860789776, 0.009180535562336445, 0.0058127520605921745, 0.004598265513777733, 0.00437058974057436, 0.004203155171126127, 0.004026375710964203, 0.003948498517274857, 0.003235283773392439, 0.0026926423888653517"
img106.png,Zeward Micro units ot,"Ze, vac, assembly, assemble, experiment, experimental, cs, stack, Assembly, mor","0.006397227291017771, 0.006372287403792143, 0.006080478895455599, 0.0050016650930047035, 0.004114258103072643, 0.00384991941973567, 0.0031299623660743237, 0.003045537043362856, 0.0030100552830845118, 0.002986630890518427"
img107.png,vacnl cab vertadt,"vac, FS, yw, riction, vez, sBy, konn, Ze, Beat, cs","0.005415096879005432, 0.00516712199896574, 0.004471770953387022, 0.0038549078162759542, 0.003183371154591441, 0.0031217995565384626, 0.003002205165103078, 0.0029212257359176874, 0.0026185698807239532, 0.0025479383766651154"
img108.png,expectotailly Kill stack,"expect, VD, assembly, vac, experiment, sever, assemble, stack, ray, fra","0.013373779132962227, 0.007414609659463167, 0.004308042582124472, 0.003999881446361542, 0.003968754317611456, 0.003953281790018082, 0.003728299867361784, 0.003421280300244689, 0.003355106571689248, 0.0031273034401237965"
img109.png,laisafansen af forces,"lais, mor, konn, expect, vac, fra, Unity, cs, e, ny","0.020667873322963715, 0.009388805367052555, 0.0055844541639089584, 0.005124583374708891, 0.002874630969017744, 0.0025768023915588856, 0.002546781674027443, 0.0025368526112288237, 0.0024684255477041006, 0.002458802191540599"
img110.png,Constraints assembly gens forcesraf,"Constraints, ivel, experimental, sBy, experiment, aho, expect, rew, cs, Ze","0.012052730657160282, 0.004756936337798834, 0.004433952271938324, 0.0037630461156368256, 0.003453165292739868, 0.003346922341734171, 0.0033079294953495264, 0.0030833296477794647, 0.0026998533867299557, 0.0026167877949774265"
img111.png,hip ebenwodhmnl,"hip, assembly, vac, assemble, Constraints, mor, Indep, Assembly, Asian, fra","0.006086483132094145, 0.005165531300008297, 0.004505456425249577, 0.004282375797629356, 0.00415062066167593, 0.003735154401510954, 0.0036486296448856592, 0.0034275706857442856, 0.002966315019875765, 0.0025372235104441643"
img112.png,VDolaivellais Micro,"VD, lay, Ze, ray, anel, Constraints, konn, eli, ions, STR","0.005647799000144005, 0.004984165076166391, 0.004737382289022207, 0.004004889167845249, 0.003320169635117054, 0.0032180186826735735, 0.0031190107110887766, 0.0030348808504641056, 0.0029761812184005976, 0.0028733673971146345"
img113.png,atern Micro impact ci lay,"atern, fra, jon, Free, Constraints, Ze, expect, hav, yw, ango","0.005980698857456446, 0.005216458346694708, 0.004207947291433811, 0.0038917146157473326, 0.003846375271677971, 0.0037280344404280186, 0.003713500453159213, 0.003354867920279503, 0.003328760154545307, 0.0031639416702091694"
img114.png,andom morandommutCO,"andom, STR, konn, yw, stack, Ze, fra, Stack, cs, legal","0.008474321104586124, 0.006127714179456234, 0.004809698089957237, 0.0044482434168457985, 0.004311385098844767, 0.003702156711369753, 0.003702156711369753, 0.00350513169541955, 0.0033315804321318865, 0.002740483498200774"
img115.png,raylayunt indep convent,"ray, riction, Ze, expect, yw, atern, oda, Ze, NL, ango","0.009212139062583447, 0.007818241603672504, 0.005810022819787264, 0.005436732899397612, 0.005373393651098013, 0.004437332507222891, 0.003931258339434862, 0.0034022205509245396, 0.0032211574725806713, 0.0031465396750718355"
img116.png,morandomiouw Geb,"mor, yw, andom, sever, cs, quet, vac, Ze, Ra, virtual","0.0064021931029856205, 0.005370168946683407, 0.005328378174453974, 0.0051443069241940975, 0.004947231616824865, 0.004776326939463615, 0.004647493828088045, 0.003633638145402074, 0.003480812069028616, 0.0030958985444158316"
img117.png,aterniza fully indep new,"atern, bbe, vac, fra, assembly, assemble, experiment, Free, Ze, sever","0.005215541925281286, 0.0049961828626692295, 0.004223674535751343, 0.00369837274774909, 0.0030901064164936543, 0.0030780588276684284, 0.002737682545557618, 0.0025319422129541636, 0.0024926881305873394, 0.002415996277704835"
img118.png,vac stack indirectanhmans,"vac, atern, yw, ond, cs, expect, cs, Beat, fra, assemble","0.009131775237619877, 0.005692239850759506, 0.004945503547787666, 0.004099966958165169, 0.0038666368927806616, 0.003762340871617198, 0.0034795966930687428, 0.003205554559826851, 0.003106930060312152, 0.003106930060312152"
img119.png,utes viohtnl Rh,"utes, though, mor, core, Constraints, riction, stack, Howard, Unity, virtual","0.009164092130959034, 0.003805268555879593, 0.0035747189540416002, 0.003105769632384181, 0.003033824497833848, 0.0028611691668629646, 0.002773140324279666, 0.0026773407589644194, 0.0025848508812487125, 0.00248582661151886"
img120.png,stackadtadtadtire,"stack, yw, lais, FS, conditions, expect, drag, terms, atern, konn","0.010813639499247074, 0.00723162991926074, 0.005168213043361902, 0.0039164405316114426, 0.0031965055968612432, 0.002899104729294777, 0.0027663451619446278, 0.002460438059642911, 0.0024412909988313913, 0.002249022712931037"
img121.png,cs modalelijhipenst,"cs, yw, Ze, andom, cs, lais, ola, experimental, anh, ango","0.006553510203957558, 0.004832255654036999, 0.004504157230257988, 0.004365579225122929, 0.0037050186656415462, 0.003480542916804552, 0.003295311937108636, 0.003218976082280278, 0.0030956591945141554, 0.0030004156287759542"
img122.png,konnnlren facht,"konn, lais, mor, cs, atern, andom, vac, though, yw, Raz","0.005159344989806414, 0.0045709265395998955, 0.004033828154206276, 0.004002436995506287, 0.00386417075060308, 0.0036585230845957994, 0.0033703898079693317, 0.003266693791374564, 0.002827087650075555, 0.0027401072438806295"
img123.png,assemble Elisabeth autorlaislais,"assemble, hip, mor, expect, recom, ola, andom, yw, Ra, bbe","0.005104904528707266, 0.0049478430300951, 0.0040541174821555614, 0.0037788529880344868, 0.0037494460120797157, 0.003720267442986369, 0.003549903864040971, 0.0034272707998752594, 0.0032196228858083487, 0.0030482776928693056"
img124.png,VDtern Bentyw forces,"VD, LD, konn, cs, anel, mor, Constraints, hours, ute, utes","0.006390905939042568, 0.0061460742726922035, 0.004191258456557989, 0.003831120440736413, 0.0034208055585622787, 0.003380951937288046, 0.00325142964720726, 0.003238753415644169, 0.0032135494984686375, 0.003163727931678295"
img125.png,laisternuntMP Kate,"lais, yw, expect, elen, riction, sever, atern, odb, hours, Wort","0.012940612621605396, 0.005609340500086546, 0.004184823017567396, 0.0037806725595146418, 0.003751251148059964, 0.0035794684663414955, 0.003109896555542946, 0.0030736650805920362, 0.0027986038476228714, 0.002608585637062788"
img126.png,morandomTTouw laid,"mor, experiment, katol, andom, adt, ola, ray, hip, ën, anh","0.005528237670660019, 0.00529572693631053, 0.00442474614828825, 0.003935450222343206, 0.003920107148587704, 0.0033793440088629723, 0.003313981229439378, 0.0031622229143977165, 0.002936024684458971, 0.002879236824810505"
img127.png,laisolasierzivellais,"lais, fra, yw, ango, konn, assemble, Ze, ray, lay, stack","0.005816794466227293, 0.003514309413731098, 0.0034195168409496546, 0.0034061854239553213, 0.0031873402185738087, 0.003137925174087286, 0.003005947917699814, 0.0029134650249034166, 0.002801851835101843, 0.0027800474781543016"
img128.png,assemblyelen¨igenwood,"assembly, agan, cs, virtual, fra, hav, vac, assemble, ifa, ray","0.0052395472303032875, 0.004412141162902117, 0.0036151788663119078, 0.0031779459677636623, 0.0029391194693744183, 0.0025435960851609707, 0.002446152502670884, 0.0024366159923374653, 0.0023801715578883886, 0.002315970603376627"
img129.png,stack spareht rör Neder,"stack, mor, Stack, hip, assemble, angol, Stack, FS, hips, elen","0.008764793165028095, 0.00866268016397953, 0.005527885165065527, 0.005316115915775299, 0.004582778550684452, 0.003844040911644697, 0.0034728015307337046, 0.003076731925830245, 0.0029473286122083664, 0.0027795955538749695"
img130.png,bbeesselNLClais,"bbe, riction, VD, eli, elen, STR, Constraints, konn, adt, lais","0.005517874378710985, 0.005265193060040474, 0.004036962985992432, 0.003282028017565608, 0.003269232576712966, 0.0031317328102886677, 0.002438995987176895, 0.0023182330187410116, 0.0023091949988156557, 0.002246908377856016"
img131.png,yw exped Bishopctor stretch,"yw, expect, ames, Ra, ether, jon, ango, atern, andom, Ze","0.012922368943691254, 0.006151970010250807, 0.005001516081392765, 0.004772480111569166, 0.00387999857775867, 0.003659187350422144, 0.003560486948117614, 0.0033710014540702105, 0.0032166321761906147, 0.0031544168014079332"
img132.png,ywourdoth staffahr,"yw, Indep, expect, Free, Constraints, Ra, forces, konn, Ze, assemble","0.006743663921952248, 0.004933769814670086, 0.00409023929387331, 0.0040742927230894566, 0.0037681045942008495, 0.003512259805575013, 0.0033514215610921383, 0.0031238687224686146, 0.00295761926099658, 0.00295761926099658"
img133.png,yw expedternmai rör,"yw, Constraints, konn, assemble, assembly, stack, Ze, riction, programming, expect","0.011002933606505394, 0.008240817114710808, 0.006076396908611059, 0.004111496265977621, 0.0035443315282464027, 0.0032907999120652676, 0.002938353456556797, 0.002717532915994525, 0.0026754012797027826, 0.0025729085318744183"
img134.png,mornl¨ehip,"mor, Constraints, Unity, lais, cs, cs, yw, andom, Indep, conducted","0.006148216780275106, 0.005177317652851343, 0.004225603770464659, 0.003628496080636978, 0.0034353910014033318, 0.003303783480077982, 0.0029614923987537622, 0.0029614923987537622, 0.00291557889431715, 0.0025830597151070833"
img135.png,assemble mem Cir Beat mem,"assemble, assembly, experiment, Indep, force, vac, cs, stack, forces, programming","0.0179909635335207, 0.008768094703555107, 0.007768101524561644, 0.004674925934523344, 0.0044608451426029205, 0.00440887501463294, 0.004306743387132883, 0.004289953038096428, 0.0041742390021681786, 0.0026845838874578476"
img136.png,atern  Sitnlnn,"atern, konn, lais, FS, elen, ante, Constraints, utes, stack, cano","0.008326776325702667, 0.007122269365936518, 0.005678367801010609, 0.005090056452900171, 0.004652687814086676, 0.003498341189697385, 0.0030513075180351734, 0.0027245106175541878, 0.002671813825145364, 0.002620136132463813"
img137.png,vacnlarrsBy Amb,"vac, assembly, Ze, atern, ën, FS, fra, Ze, anel, Ra","0.009857002645730972, 0.004374018404632807, 0.004222916439175606, 0.004125092178583145, 0.003741296473890543, 0.003101643407717347, 0.0030179822351783514, 0.0028351317159831524, 0.0027265192475169897, 0.002601663349196315"
img138.png,experimentMPiqueieve attached,"experiment, vac, Indep, Bishop, fra, pressure, ond, Beat, ray, Ze","0.004539531655609608, 0.004021801985800266, 0.003882867284119129, 0.0037929206155240536, 0.003321191994473338, 0.0031691037584096193, 0.003071600804105401, 0.0030121903400868177, 0.0027319383807480335, 0.0026686526834964752"
img139.png,cs Veljonjon Brazil,"cs, stack, fra, FS, mor, ford, vac, expect, con, riction","0.008267521858215332, 0.004289133939892054, 0.0036401404067873955, 0.0036259491462260485, 0.003597731702029705, 0.0034329795744270086, 0.003237607888877392, 0.0029709963127970695, 0.00286836177110672, 0.0024438747204840183"
img140.png,aternacoho goalsLayer,"atern, sever, expect, vac, Beat, cs, hip, fra, konn, Ra","0.010700291953980923, 0.007354196161031723, 0.005338574294000864, 0.0038302394095808268, 0.003126150229945779, 0.0030897296965122223, 0.002492384286597371, 0.002482667565345764, 0.002341378480195999, 0.0023231578525155783"
img141.png,assemblyivel  Indepilt,"assembly, ray, assemble, stack, fe, cs, sever, Ze, experiment, drag","0.011748594231903553, 0.0075264316983520985, 0.005907563958317041, 0.0052542961202561855, 0.00521340686827898, 0.004511827602982521, 0.004238469991832972, 0.003859170712530613, 0.0036968588829040527, 0.0035831185523420572"
img142.png,assembleicesadtirasoup,"assemble, yw, cs, expect, aho, whole, mor, vac, cs, hip","0.008505982346832752, 0.0078055281192064285, 0.005600192584097385, 0.004570744000375271, 0.004210766404867172, 0.003573631402105093, 0.003383446019142866, 0.0032411429565399885, 0.0028269747272133827, 0.0026660915464162827"
img143.png,experimentivelConstraints factor LIN,"experiment, assemble, motion, expect, VD, jon, yw, cs, goals, mor","0.00986665952950716, 0.007565030362457037, 0.005385405849665403, 0.0046789213083684444, 0.003615590510889888, 0.003304916899651289, 0.0028713615611195564, 0.002849016571417451, 0.002729190280660987, 0.0026246369816362858"
img144.png,franl MicroshaMP,"fra, virtual, ond, expect, hav, ray, riction, lay, city, Ze","0.008910784497857094, 0.007925416342914104, 0.004498160444200039, 0.003969612997025251, 0.003817539429292083, 0.0035583379212766886, 0.003435413585975766, 0.003252584021538496, 0.0031402220483869314, 0.00294996565207839"
img145.png,vac ambConstraints forces Dest,"vac, assemble, expect, FS, Beat, cs, fe, fra, Ze, Unity","0.006222276017069817, 0.004144929815083742, 0.004017403349280357, 0.003939700312912464, 0.0035592219792306423, 0.003449716605246067, 0.0028823460452258587, 0.002826596377417445, 0.002804599702358246, 0.0026657343842089176"
img146.png,ahoudanlpp leg,"aho, mor, lais, riction, vac, rias, cs, assemble, core, Ze","0.010040754452347755, 0.005995608400553465, 0.005523413419723511, 0.0041692908853292465, 0.004120717290788889, 0.0037373285740613937, 0.003552280366420746, 0.003456463571637869, 0.002509123645722866, 0.002509123645722866"
img147.png,assemble stretch NederlandNLodb,"assemble, VD, ray, vac, assembly, Ze, pressure, ory, FS, Ze","0.008483797311782837, 0.00684360321611166, 0.006816923152655363, 0.005145683418959379, 0.0038993677590042353, 0.0035922660026699305, 0.0032200864516198635, 0.0030131980311125517, 0.002966482425108552, 0.002841716166585684"
img148.png,expectjon sing externandom,"expect, cs, ola, andom, STR, assemble, stack, lay, Free, lave","0.010834231041371822, 0.007388303522020578, 0.0058218431659042835, 0.004826477728784084, 0.004516379442065954, 0.0041283052414655685, 0.003330169478431344, 0.003116208128631115, 0.0031040592584758997, 0.003020332660526037"
img149.png,Constraints ambloadmansiana,"Constraints, Ze, mor, fra, andom, experiment, fe, konn, vac, VD","0.005191149190068245, 0.00509074330329895, 0.004203920718282461, 0.003351657884195447, 0.003274016547948122, 0.0032612525392323732, 0.0029694039840251207, 0.002724878489971161, 0.0027142553590238094, 0.0026410426944494247"
img150.png,stack Indep if laid individually,"stack, fe, vac, FS, mor, terms, expect, yw, eli, Free","0.006159590091556311, 0.004613319877535105, 0.0033489109482616186, 0.0033358547370880842, 0.003183094784617424, 0.0028200659435242414, 0.002787211211398244, 0.0027547390200197697, 0.002701457589864731, 0.002701457589864731"
img151.png,stacknlolis rör Corpor,"stack, ola, atern, FS, expect, aho, konn, af, mor, ën","0.00810358114540577, 0.007407273165881634, 0.007013064809143543, 0.0055046179331839085, 0.0047638495452702045, 0.0034045700449496508, 0.002969518769532442, 0.0025699040852487087, 0.002549904864281416, 0.0024522198364138603"
img152.png,lais Zeolailly Tod,"lais, Ze, cs, motion, aho, stack, н, goals, conditions, Ze","0.012357210740447044, 0.004027500748634338, 0.0038430679123848677, 0.0031366203911602497, 0.003124392358586192, 0.002912253839895129, 0.002757266629487276, 0.00270393630489707, 0.0026105274446308613, 0.002540112938731909"
img153.png,rictionlais Ze floatingzew,"riction, cs, lais, konn, VD, lay, '"", vac, fra, mor","0.006057740654796362, 0.00560249388217926, 0.004829652141779661, 0.004662809427827597, 0.003384836483746767, 0.003332359716296196, 0.003204698907211423, 0.0030819287057965994, 0.0030105358455330133, 0.0029179116245359182"
img154.png,experiment🌍gtigenine,"experiment, expect, assembly, assemble, mor, drag, FS, ister, model, konn","0.007002413272857666, 0.006301490124315023, 0.005539365112781525, 0.005432224366813898, 0.0048315199092030525, 0.0035210344940423965, 0.002807213691994548, 0.0025760442949831486, 0.002546032192185521, 0.002526218770071864"
img155.png,ary Bent Civil destinries,"ary, ray, assemble, experiment, andom, VD, hav, ivel, expect, uch","0.006961269304156303, 0.006313596852123737, 0.006024476140737534, 0.005421441979706287, 0.004028873518109322, 0.004028873518109322, 0.0035973789636045694, 0.0035833544097840786, 0.0031746758613735437, 0.0031254575587809086"
img156.png,layConstraints Routivelhr,"lay, FS, konn, VD, andom, fra, Ze, hav, assemble, yw","0.0069260564632713795, 0.006184272468090057, 0.004988651257008314, 0.00450687063857913, 0.004368208814412355, 0.0037803701125085354, 0.0035374837461858988, 0.0030975239351391792, 0.0027657777536660433, 0.00271228258498013"
img157.png,experimental IndeplaisNLnt,"experimental, expect, cs, vac, experiment, Ze, Constraints, assemble, UE, VD","0.008866054937243462, 0.0064360653050243855, 0.00482039013877511, 0.004599648527801037, 0.004188027698546648, 0.004011884797364473, 0.003582209814339876, 0.0035266729537397623, 0.0028559870552271605, 0.002844852162525058"
img158.png,expectjonansolas destin,"expect, assemble, assembly, Ze, bbe, VD, cs, fra, WCF, Indep","0.011140814051032066, 0.007249465677887201, 0.005667986813932657, 0.004791604820638895, 0.004735780414193869, 0.0036027920432388783, 0.0032675901893526316, 0.0031058008316904306, 0.00306961708702147, 0.002784021897241473"
img159.png,expectaff SP forcesolen,"expect, cs, assemble, mor, assembly, virtual, ra, Ze, yw, FS","0.007142198737710714, 0.005921090953052044, 0.005349259357899427, 0.005307631101459265, 0.004264801274985075, 0.0037636742927134037, 0.00348082953132689, 0.003231840906664729, 0.0029773113783448935, 0.0029657038394361734"
img160.png,forcesivel balance FB Ze,"forces, force, ions, assemble, experiment, expect, N, mor, con, lais","0.00821737851947546, 0.006602848879992962, 0.005495378747582436, 0.005023182835429907, 0.00427980488166213, 0.003821436082944274, 0.0032305666245520115, 0.0028845712076872587, 0.002636711345985532, 0.0024673042353242636"
