img161.png,fertFEua mil Kant,"fert, essel, Olymp, Tir, accident, nam, DataSet, Nam, Atlantic, uur","0.007186021655797958, 0.0069107296876609325, 0.005488233640789986, 0.003968497738242149, 0.0038314044941216707, 0.003641698509454727, 0.0032263663597404957, 0.00315162749029696, 0.0029376395978033543, 0.002903415123000741"
img162.png,fert parallel assassole ing,"fert, essel, threshold, DataSet, Olymp, Nam, nete, oria, Jung, MAP","0.01766698807477951, 0.011677167378365993, 0.0049251471646130085, 0.004699608311057091, 0.004380516242235899, 0.003865792416036129, 0.0038507210556417704, 0.0038207543548196554, 0.0036887647584080696, 0.0036174175329506397"
img163.png,Zam Daw Gelether Gel,"Zam, Nam, essel, asse, asa, fert, Atlantic, iste, Hou, arch","0.015105132013559341, 0.013226496055722237, 0.0069971526972949505, 0.004923111759126186, 0.0038793187122792006, 0.0036585459019988775, 0.003518389305099845, 0.003191040363162756, 0.0030568295624107122, 0.002816083375364542"
img164.png,ectorsellijnnesassen,"ectors, med, Olymp, aval, ned, Tit, essel, rend, uth, reform","0.00513737928122282, 0.0041766599752008915, 0.004016654100269079, 0.0037003157194703817, 0.0035585586447268724, 0.003462572582066059, 0.002881808439269662, 0.0028482344932854176, 0.002739120274782181, 0.0024078411515802145"
img165.png,esselbgassenorumnes,"essel, Nam, asse, DataSet, Olymp, ib, olymp, Tit, fert, iste","0.021666303277015686, 0.012059113942086697, 0.010559312999248505, 0.008996646851301193, 0.0037357392720878124, 0.003374959109351039, 0.0033486951142549515, 0.0031828891951590776, 0.0031704804860055447, 0.002754561137408018"
img166.png,Olymp loc Camb subscri Earl,"Olymp, asa, assen, asse, DataSet, olymp, pray, essel, ectors, threshold","0.013506493531167507, 0.009103321470320225, 0.00660830270498991, 0.006016928236931562, 0.0051065003499388695, 0.004350793082267046, 0.004216933157294989, 0.004087192006409168, 0.0040395744144916534, 0.003220629645511508"
img167.png,Namosz mil Clement Bou,"Nam, asse, fert, assen, aver, zel, ster, med, DataSet, Camb","0.010966519825160503, 0.005985730327665806, 0.005801567807793617, 0.004362180363386869, 0.003971810452640057, 0.003971810452640057, 0.0038196523673832417, 0.0037751521449536085, 0.0032671219669282436, 0.00230770418420434"
img168.png,esselentr sou MamAuth,"essel, asse, Nam, fert, ody, med, DataSet, aval, ennis, aver","0.017112553119659424, 0.01678156666457653, 0.015399632044136524, 0.014523236081004143, 0.0035590720362961292, 0.003436122089624405, 0.00237085297703743, 0.0022272104397416115, 0.0021926804911345243, 0.0021926804911345243"
img169.png,fertausassenassen gh,"fert, Nam, essel, assen, asse, onde, Nich, Timer, Jung, sc","0.011048782616853714, 0.01009940542280674, 0.004864713177084923, 0.004080528859049082, 0.003700878703966737, 0.0031779189594089985, 0.0030561743769794703, 0.0027076208498328924, 0.002573557198047638, 0.0024365950375795364"
img170.png,assen Mamunosomassen,"assen, accident, Nam, DataSet, pray, ams, Olymp, shot, asse, Ti","0.007584563456475735, 0.0061903405003249645, 0.004028131254017353, 0.0037254125345498323, 0.003710888558998704, 0.00365335657261312, 0.0028120889328420162, 0.0026624323800206184, 0.0026417127810418606, 0.0023772846907377243"
img171.png,essel Gregoryungene Storm,"essel, ib, asse, h, parallel, DataSet, fert, arch, is, Jung","0.011925112456083298, 0.007261255290359259, 0.005811835639178753, 0.005744125694036484, 0.004651734605431557, 0.004089136607944965, 0.003994412254542112, 0.0038564237765967846, 0.003538853256031871, 0.003337456379085779"
img172.png,essel mentenfivesassen,"essel, uur, oria, Ál, DataSet, Nam, bare, Desktop, ق, nete","0.003938046284019947, 0.0035577283706516027, 0.0033032388892024755, 0.0031152511946856976, 0.0030910077039152384, 0.0026750443503260612, 0.002397894160822034, 0.002333215204998851, 0.002324118744581938, 0.002243831055238843"
img173.png,ize magn Hou Hou sor,"ize, fert, asse, Nam, Olymp, correspond, Cong, bourg, ectors, uche","0.00937788188457489, 0.008983460254967213, 0.005281104240566492, 0.0042269425466656685, 0.0034097370225936174, 0.0032409094274044037, 0.0031658336520195007, 0.003153491299599409, 0.0029279175214469433, 0.0025043804198503494"
img174.png,Frontassenengenzakdl,"Front, Nam, essel, fert, mil, nam, ster, trib, outer, asa","0.008445476181805134, 0.007810788694769144, 0.004737482871860266, 0.004664034582674503, 0.003896947018802166, 0.003646570723503828, 0.00359003571793437, 0.0031805955804884434, 0.003058748785406351, 0.0027311553712934256"
img175.png,esselentr reci Mamua,"essel, med, fert, trib, olymp, Jung, oria, ectors, generate, assen","0.015107601881027222, 0.010302489623427391, 0.007776727434247732, 0.0042446814477443695, 0.004003116395324469, 0.00398750975728035, 0.0036878434475511312, 0.003560445038601756, 0.0031176297925412655, 0.002838634420186281"
img176.png,fert Pearebbentrangel,"fert, essel, Olymp, asse, ody, nete, aval, PN, iste, ]]","0.005467584822326899, 0.004095031414180994, 0.004015826620161533, 0.003892272710800171, 0.003743161913007498, 0.003613852895796299, 0.003252115799114108, 0.0031397698912769556, 0.002938041463494301, 0.0027172439731657505"
img177.png,esselentrDelegpenjava,"essel, asse, iem, nov, Nam, Part, icus, ectors, lan, situ","0.015320828184485435, 0.0080106807872653, 0.007495999801903963, 0.0049934121780097485, 0.004727667663246393, 0.0038285821210592985, 0.0037398929707705975, 0.0035408595576882362, 0.0030643583741039038, 0.002958498662337661"
img178.png,Namassensterichício,"Nam, pray, essel, asse, ectors, ster, awa, Atlantic, prayer, ory","0.027412710711359978, 0.022373603656888008, 0.018260803073644638, 0.008969404734671116, 0.0060690026730299, 0.005191092845052481, 0.004286789335310459, 0.003918442875146866, 0.00261024571955204, 0.0021304201800376177"
img179.png,essel Marcusenerilder Kob,"essel, asse, Commonwealth, asser, assen, Nam, ster, outer, â, Tit","0.00806491356343031, 0.00787808932363987, 0.004316837061196566, 0.004039483144879341, 0.003961352165788412, 0.0032840764615684748, 0.0032840764615684748, 0.0031706267036497593, 0.0031093009747564793, 0.002638829406350851"
img180.png,asse GregoryDeleg Ly Catalogue,"asse, lement, iste, med, basis, Jung, aine, Nam, ugen, fert","0.008861429058015347, 0.00485566258430481, 0.004579325672239065, 0.0033503063023090363, 0.0033372449688613415, 0.0031968848779797554, 0.0030267497058957815, 0.0028656693175435066, 0.0025687692686915398, 0.002499480964615941"
img181.png,essel Gregory Jerusalemose Clement,"essel, DataSet, fert, Zam, fert, ib, Nam, Pennsylvania, arch, zy","0.010385087691247463, 0.004449157509952784, 0.004195954650640488, 0.00370291736908257, 0.0036312961019575596, 0.0029870227444916964, 0.0029637773986905813, 0.002688029548153281, 0.002677550073713064, 0.0026257613208144903"
img182.png,Namdlmineassen ster,"Nam, Pennsylvania, asse, med, h, Nor, pray, iste, assign, Nich","0.006334387697279453, 0.005271945148706436, 0.0035532694309949875, 0.003390553640201688, 0.0028887875378131866, 0.0027781198732554913, 0.0026200166903436184, 0.002442124066874385, 0.0023031423334032297, 0.0022852192632853985"
img183.png,assen pray Republic revolAnchor,"assen, essel, <0x83>, DataSet, Zam, awa, ectors, asse, DB, Atlantic","0.009347828105092049, 0.00920290406793356, 0.004663804545998573, 0.004502691328525543, 0.0041969697922468185, 0.0035066993441432714, 0.003307132516056299, 0.003192886244505644, 0.003143385285511613, 0.0028845323249697685"
img184.png,asse Gregory Pavessel nam,"asse, Nam, essel, ams, fert, assen, Olymp, med, Tar, Nor","0.008530231192708015, 0.005616157781332731, 0.005338082555681467, 0.005153676029294729, 0.004803754389286041, 0.004495115950703621, 0.0033798632211983204, 0.0031380970031023026, 0.003077400615438819, 0.002879679435864091"
img185.png,Namszenones bare,"Nam, essel, med, assen, agre, ib, oria, uth, Pennsylvania, Tar","0.006741741206496954, 0.005996228661388159, 0.0040099830366671085, 0.003947813995182514, 0.0033899603877216578, 0.0031721575651317835, 0.002723909681662917, 0.002568891504779458, 0.0023027395363897085, 0.002146389102563262"
