Image File,Inference Result,Top 10 Words,Top 10 Probabilities
img1.png,medentr Wass egraste,"med, essel, assign, assen, Olymp, Pennsylvania, lan, DataSet, Ти, ectors","0.006108781788498163, 0.005164243280887604, 0.003867839928716421, 0.003822778118774295, 0.0033473363146185875, 0.003295440459623933, 0.003047784324735403, 0.0030122767202556133, 0.002732016146183014, 0.0026171114295721054"
img2.png,essel Hou Gelbbe ster,"essel, Nam, asse, DataSet, ib, fert, coordinate, asa, ectors, Jung","0.005896318703889847, 0.005223848856985569, 0.004520864225924015, 0.0036468340549618006, 0.003604347351938486, 0.0035208524204790592, 0.002988108666613698, 0.002626716159284115, 0.002585992682725191, 0.002526088384911418"
img3.png,NamdlPNassen bare,"Nam, asse, coordinate, Olymp, outer, situ, ZE, essel, Tar, fert","0.0055130464024841785, 0.004194104578346014, 0.003909335471689701, 0.0036439013201743364, 0.0034634792245924473, 0.0033438317477703094, 0.00329199037514627, 0.00329199037514627, 0.0029857056215405464, 0.0026868442073464394"
img4.png,esselentr reci Mam Wass,"essel, Nam, nam, ody, ory, PP, DataSet, assen, ength, fert","0.024108629673719406, 0.011343711987137794, 0.004124500323086977, 0.004092402756214142, 0.003224736312404275, 0.002611470641568303, 0.0022956300526857376, 0.002207685960456729, 0.0020497669465839863, 0.00199447781778872"
img5.png,asseassen inj Wass Maurice,"asse, Nam, <0x83>, essel, Atlantic, med, coordinate, assen, dispos, ster","0.00858516339212656, 0.006844689138233662, 0.005248005501925945, 0.004797064699232578, 0.004283297341316938, 0.004184074699878693, 0.0032205970492213964, 0.0030611346010118723, 0.0029323871713131666, 0.002733285306021571"
img6.png,essel Gregoryeg descentorum,"essel, Olymp, coordinate, Tit, asse, uur, med, ned, ib, uth","0.014423836953938007, 0.005965958349406719, 0.005432066507637501, 0.0049847448244690895, 0.00477509293705225, 0.004100339021533728, 0.004005354829132557, 0.003807036206126213, 0.0036185365170240402, 0.0036044293083250523"
img7.png,asseassen pir republicicode,"asse, Olymp, essel, Tit, arch, olymp, med, asa, coordinate, pray","0.015898656100034714, 0.013180448673665524, 0.01109904982149601, 0.0044321767054498196, 0.004346450325101614, 0.004035542253404856, 0.003424920840188861, 0.0030700787901878357, 0.003022481920197606, 0.0028504719957709312"
img8.png,Olymp Leist aver civil Wass,"Olymp, med, asse, assen, types, essel, accident, ib, Pennsylvania, ize","0.01008440088480711, 0.00855852011591196, 0.006587728392332792, 0.00368097354657948, 0.0028555686585605145, 0.0027248025871813297, 0.002569733653217554, 0.002569733653217554, 0.002471288898959756, 0.0022855685092508793"
img9.png,asse Gregory Hou Camb Luci,"asse, coordinate, Nam, Republic, Commonwealth, ster, fert, olymp, Tit, Jung","0.0073923650197684765, 0.005201178602874279, 0.005060885567218065, 0.004066535737365484, 0.0037904279306530952, 0.003659486072137952, 0.0034377691335976124, 0.0032168948091566563, 0.003204353153705597, 0.0031670215539634228"
img10.png,asse Maredj sensacci,"asse, ectors, DataSet, Nam, med, assen, oria, ib, coordinate, essel","0.01272125355899334, 0.008149540983140469, 0.006756206508725882, 0.005689296405762434, 0.005079970229417086, 0.004866313189268112, 0.0039717694744467735, 0.0030811575707048178, 0.00296312035061419, 0.0028164060786366463"
img11.png,med mil Republic abroadante,"med, asse, nam, essel, Olymp, asser, assen, ams, aval, gel","0.020621664822101593, 0.018630120903253555, 0.00435643782839179, 0.004013338591903448, 0.0038295541889965534, 0.003250100649893284, 0.0031134055461734533, 0.002845883136615157, 0.002561017405241728, 0.00252131256274879"
img12.png,fertFErenoulimo,"fert, DataSet, asse, essel, Olymp, arch, ectors, â, assen, trib","0.016529254615306854, 0.007686817552894354, 0.0074794781394302845, 0.006128464825451374, 0.0044314442202448845, 0.0035192810464650393, 0.0034918938763439655, 0.002951978472992778, 0.002929005539044738, 0.0029175865929573774"
img13.png,Tit ster MamAnchorAnchor,"Tit, assen, Vietnam, Nam, essel, fert, DataSet, asse, Cong, Ti","0.006884866859763861, 0.006725378800183535, 0.005597357638180256, 0.005553797818720341, 0.004825223702937365, 0.004586310125887394, 0.004159602802246809, 0.0038320054300129414, 0.0029727339278906584, 0.002738610841333866"
img14.png,fertaus Wass Wright Jerry,"fert, assen, Tir, Olymp, Marine, lement, ody, Ál, uur, pray","0.009574763476848602, 0.0033479544799774885, 0.003108470467850566, 0.003048347309231758, 0.0030010873451828957, 0.00259722420014441, 0.0025569580029696226, 0.002527168719097972, 0.002507501980289817, 0.002420879201963544"
img15.png,esselentr Hou Kobesc,"essel, Hou, arch, aval, IE, bare, independence, asse, cou, Olymp","0.014643197879195213, 0.004066269379109144, 0.003910492639988661, 0.003790179966017604, 0.0032292737159878016, 0.002805641619488597, 0.002805641619488597, 0.0027406488079577684, 0.0025346858892589808, 0.0024375836364924908"
img16.png,esselentrengenentrutt,"essel, asse, outer, arch, dispos, med, asa, Tar, assen, Tit","0.007268513552844524, 0.006096839439123869, 0.005840414669364691, 0.004374268930405378, 0.003669142723083496, 0.0034334028605371714, 0.0033934025559574366, 0.0030418261885643005, 0.0028022616170346737, 0.0027054562233388424"
img17.png,essel Gregory internalallednes,"essel, ams, iste, DataSet, ire, olymp, Ál, awa, Olymp, Nam","0.031903959810733795, 0.00421771127730608, 0.0038553006015717983, 0.003810384776443243, 0.003810384776443243, 0.003810384776443243, 0.0037807319313287735, 0.002990805311128497, 0.002876229351386428, 0.002639376325532794"
img18.png,essel YeoulDeleg Ly,"essel, med, oria, ib, trib, ody, assen, aines, asse, Nam","0.027893543243408203, 0.009306741878390312, 0.006127398461103439, 0.004328036680817604, 0.0031541145872324705, 0.00310521456412971, 0.002729658270254731, 0.002427808241918683, 0.0023623225279152393, 0.0022807149216532707"
img19.png,esselentrire求 kal,"essel, Olymp, â, iste, assen, Tit, ue, med, bare, que","0.004923436790704727, 0.004018391948193312, 0.003940669819712639, 0.0029862152878195047, 0.0029629766941070557, 0.0029399183113127947, 0.0029399183113127947, 0.0028383578173816204, 0.002751030260697007, 0.0027403051499277353"
img20.png,Nam Hou recienen republic,"Nam, nam, nete, essel, Ti, asse, Olymp, fert, aval, assen","0.008690763264894485, 0.006333509925752878, 0.006259722635149956, 0.005611178930848837, 0.004633694421499968, 0.0042854673229157925, 0.003737851046025753, 0.002832520753145218, 0.0027240088675171137, 0.002660907106474042"
img21.png,bourgitzenWFlosterung,"bourg, med, aine, Tit, Olymp, essel, mann, assen, accident, lac","0.009333579801023006, 0.006936127319931984, 0.004190573003143072, 0.004077538847923279, 0.0038756460417062044, 0.003830493427813053, 0.0029599759727716446, 0.002914085751399398, 0.002880135551095009, 0.0026741153560578823"
img22.png,asse Gregoryoud Clement radial,"asse, ectors, med, Tit, essel, asa, Marine, ody, pray, coordinate","0.013634905219078064, 0.009593353606760502, 0.006991283968091011, 0.004957563243806362, 0.004861675202846527, 0.0035568776074796915, 0.003407279960811138, 0.00306622008793056, 0.0030069141648709774, 0.0027918252162635326"
img23.png,esseletheraval Bornles,"essel, Nam, Ti, ectors, Cong, istry, ib, ugen, Tit, Zam","0.008666906505823135, 0.005706142634153366, 0.00480505358427763, 0.0044266232289373875, 0.004240445327013731, 0.0036985818296670914, 0.0035154528450220823, 0.0035017470363527536, 0.003474496304988861, 0.0032385867089033127"
img24.png,outerimo röralle tab,"ectors, outer, strength, Nam, DataSet, essel, ennis, Republic, ising, asse","0.006335040554404259, 0.006335040554404259, 0.0037387539632618427, 0.00360959698446095, 0.00332531682215631, 0.002934581832960248, 0.0028666022699326277, 0.0028332052752375603, 0.0027784062549471855, 0.002724667079746723"
img25.png,essel reci reciassedru,"essel, ib, asse, DataSet, Ti, med, ectors, Tit, oria, threshold","0.015397273004055023, 0.006269853562116623, 0.005844146013259888, 0.004844966810196638, 0.0038177419919520617, 0.0037293042987585068, 0.003614565823227167, 0.00357245490886271, 0.0034222020767629147, 0.002749816747382283"
img26.png,essel inj Clement Ly mil,"essel, Nam, asse, olymp, ectors, nam, med, coordinate, fert, assign","0.013684561476111412, 0.013578066602349281, 0.008397945202887058, 0.006565924268215895, 0.004619704559445381, 0.004189890343695879, 0.004124931991100311, 0.0036119113210588694, 0.003263089805841446, 0.0032376963645219803"
img27.png,asse begessel reciumeric,"asse, essel, DB, iste, ody, ster, Ál, DB, as, IE","0.007936048321425915, 0.005874577909708023, 0.004281177185475826, 0.004133281763643026, 0.0037050500977784395, 0.003321185242384672, 0.003047690959647298, 0.0027319323271512985, 0.0026790921110659838, 0.002596665173768997"
img28.png,esselentr Wagnerrama pag,"essel, med, fert, uur, Olymp, nom, asse, assen, coordinate, Zam","0.00839028600603342, 0.0060432967729866505, 0.0058802892453968525, 0.005375018808990717, 0.004990536719560623, 0.004874930717051029, 0.00463355565443635, 0.004057277459651232, 0.00322213233448565, 0.00322213233448565"
img29.png,Namener dwellitchenyle,"Nam, med, ster, trib, ib, nam, essel, DataSet, fert, neg","0.00595500972121954, 0.004076857585459948, 0.004013651981949806, 0.003314462024718523, 0.0031999624334275723, 0.0029594814404845238, 0.0028684278950095177, 0.0025116794276982546, 0.0023411426227539778, 0.0022079076152294874"
img30.png,ire increWMante ster,"ire, essel, Olymp, Ti, asse, Tar, outer, chim, Hou, advers","0.004893329460173845, 0.004761340096592903, 0.004284742753952742, 0.004025143105536699, 0.0034563622903078794, 0.003389510326087475, 0.0032342933118343353, 0.0031966129317879677, 0.003062167437747121, 0.0026294616982340813"
img31.png,essel Nazensenooped,"essel, ire, bare, ogle, cou, Hou, Pennsylvania, outer, bare, asser","0.01722736470401287, 0.00696048466488719, 0.005072545725852251, 0.004746637772768736, 0.004188893362879753, 0.003186742076650262, 0.002970370464026928, 0.0027471433859318495, 0.0026111227925866842, 0.002424345351755619"
img32.png,asse Gregory Jungcssentr,"asse, essel, fert, Olymp, Nam, neg, arch, ib, advers, h","0.016522815451025963, 0.01042080856859684, 0.007447416894137859, 0.00557785714045167, 0.0055344500578939915, 0.004361041821539402, 0.0036723653320223093, 0.0036580481100827456, 0.0035593784414231777, 0.003369951620697975"
img33.png,essel Alle Commonwealthrib quar,"essel, correspond, Nam, Cong, ectors, oria, asse, Ti, ster, correlate","0.008685469627380371, 0.006556136067956686, 0.006454492453485727, 0.004505962133407593, 0.004316447302699089, 0.004134903196245432, 0.0038995854556560516, 0.0035092467442154884, 0.003401278518140316, 0.003374809864908457"
img34.png,olympither Machral track,"olymp, Nam, Part, ennis, Olymp, outer, pray, Olympic, asse, lu","0.00629151426255703, 0.004861705470830202, 0.0035568997263908386, 0.0033676051534712315, 0.0027701163198798895, 0.0026022836100310087, 0.00256193894892931, 0.002542001660913229, 0.0024637924507260323, 0.002341801766306162"
img35.png,essel Marcuslvesselassen,"essel, Hou, Nam, asse, med, independence, Cong, neg, Ti, fert","0.018008196726441383, 0.010711263865232468, 0.006573290564119816, 0.00414572237059474, 0.003909789025783539, 0.003644323907792568, 0.003518428886309266, 0.0034235252533107996, 0.0034235252533107996, 0.0032413287553936243"
img36.png,fertentrassen h Wass,"fert, olymp, essel, ZE, Olymp, zel, DataSet, sect, iste, assen","0.00863424688577652, 0.007589990273118019, 0.006750676780939102, 0.00415897136554122, 0.004062628839164972, 0.00392228364944458, 0.0038464199751615524, 0.003529673209413886, 0.0031393563840538263, 0.002949152374640107"
img37.png,Namdl steramd hid,"Nam, onde, rey, essel, enburg, lymp, fert, ying, enk, DataSet","0.012981505133211613, 0.003974631428718567, 0.0038977544754743576, 0.0037484343629330397, 0.0037484343629330397, 0.0030954459216445684, 0.0027317211497575045, 0.0026580379344522953, 0.0026168287731707096, 0.0022735402453690767"
img38.png,asse Gregorynam indirectessel,"asse, Olymp, DataSet, pray, essel, Nam, assign, ectors, PP, coordinate","0.008103487081825733, 0.006877340376377106, 0.006562403868883848, 0.004838813096284866, 0.004337484482675791, 0.003842798061668873, 0.003798027988523245, 0.003136400366201997, 0.0027678636834025383, 0.0024714237079024315"
img39.png,esseloszoul Mamassen,"essel, trib, uur, zy, med, Olymp, DataSet, â, coordinate, Tit","0.013048962689936161, 0.007945572957396507, 0.00428631529211998, 0.0037826597690582275, 0.003390754107385874, 0.0033122070599347353, 0.0030394524801522493, 0.0028889586683362722, 0.002789158374071121, 0.0027459163684397936"
img40.png,Namener magnEC ster,"Nam, essel, fert, pray, ib, ster, Commonwealth, Atlantic, nete, arch","0.012517335824668407, 0.007621862459927797, 0.005982468370348215, 0.004225666634738445, 0.003586276900023222, 0.0035306764766573906, 0.0034354424569755793, 0.003422049107030034, 0.00323993107303977, 0.0029499907977879047"
img41.png,assennative hint Houstadt,"assen, DataSet, essel, Commonwealth, ectors, aine, ib, jl, fert, ying","0.0076370686292648315, 0.006872618105262518, 0.005087384954094887, 0.0046140574850142, 0.004184768535196781, 0.003915899433195591, 0.003765883855521679, 0.0030736250337213278, 0.0028315559029579163, 0.0028205167036503553"
img42.png,asse Gregory Houesti catalog,"asse, Olymp, med, Jung, Nam, DataSet, ectors, Atlantic, ennis, essel","0.010903243906795979, 0.010322983376681805, 0.004744704347103834, 0.0043201022781431675, 0.00399544183164835, 0.003709641983732581, 0.003004159312695265, 0.0027460241690278053, 0.0026929110754281282, 0.0026408254634588957"
img43.png,assenFEVS steræ,"assen, essel, ster, Nam, asse, ectors, nete, oria, DB, ennis","0.007141649257391691, 0.006253437139093876, 0.006037408951669931, 0.0046836077235639095, 0.004021781496703625, 0.003974926192313433, 0.003619211493059993, 0.003549209563061595, 0.0033866798039525747, 0.0029539146926254034"
img44.png,nomaneorn Gregory ster,"nom, fert, essel, Nam, pray, uur, Pennsylvania, ipart, control, oria","0.004381162114441395, 0.0038663619197905064, 0.003776797791942954, 0.00367492507211864, 0.003307074774056673, 0.0031679836101830006, 0.0031067091040313244, 0.00304661993868649, 0.00304661993868649, 0.0028844820335507393"
img45.png,esselentr Одна correspondessel,"essel, ib, trib, PN, iste, DB, uur, arch, correspond, Ind","0.018496664240956306, 0.00626863818615675, 0.003571762004867196, 0.00325212674215436, 0.0030670473352074623, 0.003031315514817834, 0.002825496718287468, 0.0026751263067126274, 0.0024357305373996496, 0.0023515867069363594"
img46.png,Namlv Gregory Maineassen,"Nam, med, asse, ectors, assen, ising, iste, ib, ia, ish","0.009074210189282894, 0.007671157829463482, 0.005881681106984615, 0.0056563569232821465, 0.004122145939618349, 0.0034576619509607553, 0.0031482367776334286, 0.0030753081664443016, 0.003039479721337557, 0.002934479620307684"
img47.png,uthassen ster Mam Mam,"uth, fert, med, assen, ster, accident, asse, DataSet, Nam, Tar","0.006476882845163345, 0.005851375870406628, 0.0055183726362884045, 0.004720114637166262, 0.004574891645461321, 0.004331420641392469, 0.004053129814565182, 0.004021588247269392, 0.0035490388981997967, 0.0034668256994336843"
img48.png,essel Gregoryral magnregex,"essel, Olymp, Cong, ib, Tit, ody, situ, oria, ibil, PP","0.008888493292033672, 0.005328334867954254, 0.004182257689535618, 0.0037931432016193867, 0.0034268193412572145, 0.0032698940485715866, 0.0032444472890347242, 0.003156934166327119, 0.003047875827178359, 0.0028632148168981075"
img49.png,essel republic Mam cantua,"essel, assen, zy, nete, Ál, asse, bare, Nam, Tar, Zam","0.009025132283568382, 0.008954898454248905, 0.004502805881202221, 0.0042966073378920555, 0.004004878457635641, 0.00382148171775043, 0.003465933259576559, 0.0031929672695696354, 0.0031312096398323774, 0.003070646896958351"
img50.png,ectorsassenbare ster nov,"ectors, Nam, gel, oria, med, aine, asse, DataSet, ster, Front","0.00961613841354847, 0.006557636894285679, 0.006064822431653738, 0.004816447384655476, 0.004233928397297859, 0.0037073518615216017, 0.0036928982008248568, 0.0036498745903372765, 0.003310292260721326, 0.00277667841874063"
img51.png,zel Ster ster magnloster,"zel, essel, fert, Nam, asse, oten, ster, MAP, aver, bare","0.009435943327844143, 0.00684976065531373, 0.006044892128556967, 0.005211022682487965, 0.005090309306979179, 0.004353972617536783, 0.004220014903694391, 0.00409017875790596, 0.0037533589638769627, 0.0027567637152969837"
img52.png,asse Gregoryobe Lyener,"asse, ube, Olymp, Jug, enburg, Tit, med, ster, Pennsylvania, trib","0.009260340593755245, 0.005422649905085564, 0.0052149114198982716, 0.005074248183518648, 0.004478008486330509, 0.004157689865678549, 0.0036264013033360243, 0.0035011256113648415, 0.003289003623649478, 0.0032506855204701424"
img53.png,assenosz Gregory HouStudio,"assen, essel, Nam, Ti, asse, asa, awa, Tit, Olymp, DataSet","0.010910099372267723, 0.010699079371988773, 0.007616476621478796, 0.004975533578544855, 0.004339737817645073, 0.003966841381043196, 0.003741087391972542, 0.0032886271364986897, 0.00325031322427094, 0.0031136092729866505"
img54.png,essel ye reciminipage Mam,"essel, Olymp, fert, coordinate, zel, olymp, asse, Nam, ster, pray","0.014567958191037178, 0.01037066150456667, 0.005380228161811829, 0.004109081346541643, 0.003875232767313719, 0.003175252117216587, 0.002982873236760497, 0.0027803436387330294, 0.0027372383046895266, 0.0026634058449417353"
img55.png,essel Gregoryung Beg Pear,"essel, Olymp, olymp, ire, asse, ib, Commonwealth, outer, med, fert","0.020257126539945602, 0.006011431571096182, 0.005494893062859774, 0.005182178225368261, 0.004229570273309946, 0.0036036388482898474, 0.0033589606173336506, 0.003205142915248871, 0.003143149660900235, 0.0029069383163005114"
img56.png,DataSet Clementich delegobe,"DataSet, essel, man, ank, oria, correspond, ether, asse, Olymp, ugen","0.0028966108802706003, 0.0027424560394138098, 0.002477602567523718, 0.002477602567523718, 0.002448737621307373, 0.0024296813644468784, 0.0024107734207063913, 0.0023274922277778387, 0.002300376072525978, 0.0021109438966959715"
img57.png,med proc ster ster Wass,"med, essel, ib, con, assign, asse, assen, ody, fert, DataSet","0.01050159614533186, 0.006623273715376854, 0.004412051755934954, 0.004276307299733162, 0.0037885981146246195, 0.0036720349453389645, 0.0034361090511083603, 0.003317407099530101, 0.0032787583768367767, 0.0029276018030941486"
img58.png,fert Marine Republicstadt Thom,"fert, ectors, bare, Vincent, Nam, ody, emy, asse, Ti, Maurice","0.008247748017311096, 0.0061772773042321205, 0.005871419329196215, 0.004484222736209631, 0.004329313058406115, 0.004114954266697168, 0.003761372296139598, 0.003575134091079235, 0.003384868847206235, 0.0032807274255901575"
img59.png,asseassenwernes ster,"asse, essel, med, assen, oria, Tit, Tar, correspond, Ti, <0x83>","0.0265271607786417, 0.01553371548652649, 0.010347685776650906, 0.0037040214519947767, 0.0033725497778505087, 0.0033594013657420874, 0.003180617466568947, 0.0026061045937240124, 0.0026061045937240124, 0.002194560132920742"
img60.png,esselosz Va Houilar,"essel, Tar, Nam, Front, med, ither, nam, Vietnam, enth, â","0.012202327139675617, 0.006844884715974331, 0.006405105348676443, 0.004834827501326799, 0.004741313401609659, 0.003794899210333824, 0.0030373993795365095, 0.002712092362344265, 0.002638938371092081, 0.002628650050610304"
img61.png,Nam Hou Campbelligue Bey,"Nam, essel, asse, nam, oria, fert, med, IE, ster, ectors","0.027248049154877663, 0.02600027061998844, 0.008675046265125275, 0.006782575976103544, 0.005733855068683624, 0.004885306116193533, 0.0037020554300397635, 0.003191371215507388, 0.003021529410034418, 0.002998015843331814"
img62.png,namobe ster ster Mam,"nam, ster, Nam, asser, ody, ib, trib, MAP, enth, lymp","0.010562730953097343, 0.007259652018547058, 0.006185300648212433, 0.003751574782654643, 0.003026273101568222, 0.003014474641531706, 0.00285404734313488, 0.0027233511209487915, 0.0027021579444408417, 0.002660264726728201"
img63.png,asse Gregoryobeasseanc,"asse, essel, Tir, DataSet, ectors, uth, Nam, gel, Vietnam, enden","0.011625862680375576, 0.004606419708579779, 0.004429950844496489, 0.004429950844496489, 0.0033701288048177958, 0.0031783338636159897, 0.0031413051765412092, 0.0028826238121837378, 0.002837932901456952, 0.00260423356667161"
img64.png,Namassen anywhereoudassen,"Nam, asse, essel, Tar, nam, asser, outer, Cong, DataSet, Olymp","0.03076186776161194, 0.008779062889516354, 0.008409827016294003, 0.0057350038550794125, 0.004848259035497904, 0.004431667737662792, 0.004003677982836962, 0.0038653691299259663, 0.003492069896310568, 0.003293335437774658"
img65.png,asse Gregory Jungholdspen,"asse, essel, med, ib, fert, DataSet, Front, Nam, ectors, assen","0.01758701168000698, 0.014694497920572758, 0.005301245953887701, 0.004826839081943035, 0.004733480047434568, 0.004446692764759064, 0.003759146435186267, 0.0036010416224598885, 0.0034227417781949043, 0.0033434538636356592"
img66.png,enk Wassonouer reci,"enk, essel, assen, fert, Nam, Cong, asse, ody, med, gel","0.006886408198624849, 0.005983015522360802, 0.00515768164768815, 0.004998996388167143, 0.004979507531970739, 0.004696122370660305, 0.003356167348101735, 0.0032912532333284616, 0.0029967203736305237, 0.0027285448741167784"
img67.png,Nam Hou Краoul Republic,"Nam, DataSet, ising, Olymp, aines, nam, <0x83>, is, Ti, Jung","0.010450489819049835, 0.008903928101062775, 0.005550213158130646, 0.005133108235895634, 0.004784583114087582, 0.004390580579638481, 0.003997668623924255, 0.0036541647277772427, 0.003611592808738351, 0.0034327704925090075"
img68.png,asseassenaccititnes,"asse, essel, Nam, ectors, DataSet, assen, outer, ib, Gregory, ster","0.011979533359408379, 0.011565694585442543, 0.01099303737282753, 0.009476590901613235, 0.008363061584532261, 0.004654745105654001, 0.004546917974948883, 0.004546917974948883, 0.0039658923633396626, 0.0038740227464586496"
img69.png,Nam Dawoud Census Nar,"Nam, assen, nete, Olymp, oria, nam, strength, PN, trib, fert","0.01990848034620285, 0.005014027934521437, 0.004784419201314449, 0.004255350213497877, 0.0038594347424805164, 0.003814471187070012, 0.003726108931005001, 0.003625603625550866, 0.003212106879800558, 0.0031995840836316347"
img70.png,asse Gregoryzak Kobassen,"asse, Nam, fert, accident, essel, DataSet, nam, dispos, control, awa","0.026815252378582954, 0.009194985032081604, 0.008671698160469532, 0.008372129872441292, 0.005300902295857668, 0.0049217212945222855, 0.002837368519976735, 0.0023067642468959093, 0.002184000564739108, 0.002051678718999028"
img71.png,Nam Hou conditional ster ment,"Nam, asse, fert, Olymp, nam, ster, ib, ams, assen, med","0.013655387796461582, 0.006325587164610624, 0.005782055202871561, 0.0053266785107553005, 0.004719175864011049, 0.004520693328231573, 0.004148421343415976, 0.003155952552333474, 0.003035050118342042, 0.0025758135598152876"
img72.png,essel Houassencente Mach,"essel, outer, uur, Olymp, ing, ire, shot, assen, ish, advers","0.008663052693009377, 0.007153923157602549, 0.005316344555467367, 0.003966234624385834, 0.003740515559911728, 0.0036254320293664932, 0.003432490164414048, 0.003076864406466484, 0.002970572328194976, 0.002768878126516938"
img73.png,asse Gregoryanka republic Republic,"asse, essel, ib, Nam, ster, oria, Cong, ectors, pray, DataSet","0.011751044541597366, 0.007296390365809202, 0.006514942739158869, 0.005749417003244162, 0.004108922556042671, 0.004061052575707436, 0.003920761402696371, 0.0038150055333971977, 0.0037558595649898052, 0.0036688551772385836"
img74.png,esselosz Mamunoitzen,"essel, Nam, ectors, Commonwealth, asse, Zam, oria, awa, correspond, fert","0.015847541391849518, 0.007255533244460821, 0.006303716450929642, 0.005541321821510792, 0.0046299477107822895, 0.0034812428057193756, 0.0030962813179939985, 0.0025971655268222094, 0.002546931616961956, 0.0025370020885020494"
img75.png,asse Gregoryobe Kob Fle,"asse, essel, Olymp, med, ib, ire, correspond, Ti, ish, <0x83>","0.02083323523402214, 0.010313198901712894, 0.00635377736762166, 0.0056071896106004715, 0.005288082640618086, 0.003853761125355959, 0.0035921004600822926, 0.003468009876087308, 0.0031700171530246735, 0.002722072182223201"
img76.png,assenassenamdnes ster,"assen, essel, oria, nam, ib, asse, ectors, Nam, asa, DataSet","0.006974860560148954, 0.003974155522882938, 0.0034393451642245054, 0.003294690977782011, 0.002988154999911785, 0.0029418279882520437, 0.002807111945003271, 0.0026267566718161106, 0.002382364822551608, 0.002382364822551608"
img77.png,asseassenorumnes Daw,"asse, Olymp, assign, Tit, fert, ennis, essel, ish, DataSet, trib","0.01585911028087139, 0.006432739552110434, 0.005270796827971935, 0.0044907755218446255, 0.003871290711686015, 0.00366526423022151, 0.003636741079390049, 0.003524850122630596, 0.003416402032598853, 0.0030624426435679197"
img78.png,ectors Pirebb sterege,"ectors, essel, asse, Nam, assen, DataSet, Mam, fert, nam, Commonwealth","0.017522331327199936, 0.014640456065535545, 0.013487420044839382, 0.006942729000002146, 0.0049039386212825775, 0.003573810448870063, 0.0031662206165492535, 0.002997717587277293, 0.00297438888810575, 0.00297438888810575"
img79.png,asse Gregory Commonwealthapsedalse,"asse, essel, ectors, Nam, Cong, Ti, assen, â, med, outer","0.012540129013359547, 0.006898317951709032, 0.006256502587348223, 0.005652279127389193, 0.0037505500949919224, 0.0037505500949919224, 0.003388339653611183, 0.003220571670681238, 0.003208015812560916, 0.0030851184856146574"
img80.png,Zamlich quar Kob Mam,"Zam, essel, Jug, Ti, DB, med, DataSet, coordinate, asse, DB","0.005635779816657305, 0.005570121109485626, 0.005091503262519836, 0.004764377139508724, 0.004354993347078562, 0.0031367840711027384, 0.0030521743465214968, 0.002867252565920353, 0.0028338481206446886, 0.002560168504714966"
