img81.png,esselosz magnassen Lav,"essel, fert, Atlantic, ib, asse, DB, assen, DB, uur, Commonwealth","0.025860803201794624, 0.005747829098254442, 0.005192730575799942, 0.004878119099885225, 0.004338688682764769, 0.004059930797666311, 0.0038288794457912445, 0.0034188043791800737, 0.003287831787019968, 0.003064596327021718"
img82.png,med Mamassenрем Thom,"med, DataSet, Nam, ectors, correspond, essel, Pennsylvania, Olymp, fert, asse","0.006237634923309088, 0.0053353323601186275, 0.005151020362973213, 0.004510384518653154, 0.004423145204782486, 0.003485354594886303, 0.00341794197447598, 0.002866974798962474, 0.002600233070552349, 0.0023861080408096313"
img83.png,Namener magnassen Rosen,"Nam, assen, asse, essel, ectors, Ti, Tit, fert, DataSet, nam","0.01575220748782158, 0.0039983694441616535, 0.003936381079256535, 0.0038602445274591446, 0.003612226340919733, 0.0035701424349099398, 0.003138356376439333, 0.003138356376439333, 0.002971336245536804, 0.0028352688532322645"
img84.png,essel Marcusbb aleassen,"essel, Olymp, asse, asa, independence, arch, olymp, advers, ster, aver","0.01217725221067667, 0.01130619551986456, 0.005640870425850153, 0.003907316364347935, 0.0037576297763735056, 0.003502496285364032, 0.0031642415560781956, 0.0031396173872053623, 0.0030430215410888195, 0.0030311578884720802"
img85.png,Namdl ster Chapraph,"Nam, essel, oria, ody, fert, med, bare, outer, ams, asser","0.017771150916814804, 0.007208297029137611, 0.00643628416582942, 0.004440902732312679, 0.004270774312317371, 0.003965279553085566, 0.003934421576559544, 0.0037542511709034443, 0.0035683654714375734, 0.003499346785247326"
img86.png,ectorsurznes Mach Bou,"ectors, enden, correspond, Desktop, outer, asse, assen, ody, strength, bourg","0.011998085305094719, 0.007961287163197994, 0.004483357071876526, 0.00392575841397047, 0.003849827218800783, 0.0037901410833001137, 0.0027513476088643074, 0.0027513476088643074, 0.0026666976045817137, 0.0025247782468795776"
img87.png,fertFEuaopedelo,"fert, Nam, asse, essel, gel, awa, med, enth, Tit, accident","0.055077556520700455, 0.012004779651761055, 0.006227997597306967, 0.005004336591809988, 0.004738010466098785, 0.0042471252381801605, 0.004230567254126072, 0.0034126609098166227, 0.0026063767727464437, 0.002212003106251359"
img88.png,esselentr Hou Mamaum,"essel, asse, assen, Cong, ish, fert, med, strength, trib, ody","0.009454493410885334, 0.006971306633204222, 0.005986212752759457, 0.004698631819337606, 0.003491726703941822, 0.003410841105505824, 0.003331828862428665, 0.00326738553121686, 0.0032293193507939577, 0.003033664543181658"
img89.png,assen bareiz anchor loan,"assen, ectors, asse, DataSet, correspond, med, essel, fert, assign, aines","0.012895357795059681, 0.009251967072486877, 0.005089501850306988, 0.004894525744020939, 0.003979220986366272, 0.003796999342739582, 0.0034169298596680164, 0.0028886047657579184, 0.0027563259936869144, 0.0025893286801874638"
img90.png,asse Gregory Houangel reci,"asse, essel, DataSet, ody, assen, outer, med, Atlantic, icus, threshold","0.010318649001419544, 0.006234177388250828, 0.004437996074557304, 0.0034970566630363464, 0.0032469069119542837, 0.0028430866077542305, 0.0028320024721324444, 0.002681286074221134, 0.0025987918488681316, 0.002431820845231414"
img91.png,esselugelorumoba ster,"essel, outer, ib, med, DataSet, ectors, Nam, coordinate, Tit, cou","0.011414602398872375, 0.00673656165599823, 0.004315603524446487, 0.004215633030980825, 0.004166519269347191, 0.004150275606662035, 0.004150275606662035, 0.0032959883101284504, 0.0027218172326684, 0.0026380757335573435"
img92.png,essel Marcusankaoudán,"essel, Nam, Olymp, asse, DataSet, fert, ster, Atlantic, olymp, nam","0.007406388409435749, 0.00729156332090497, 0.006044918205589056, 0.004838292021304369, 0.003390891943126917, 0.0032994283828884363, 0.0031116574537009, 0.002969164401292801, 0.002877812599763274, 0.00270345457829535"
img93.png,asseasseneldassenocal,"asse, essel, assen, ectors, DataSet, ether, Nam, Tar, fert, accident","0.0073830666951835155, 0.006265927571803331, 0.005660793744027615, 0.005551304202526808, 0.004548575729131699, 0.004513178486377001, 0.004478056449443102, 0.00398286571726203, 0.0033934442326426506, 0.002994704293087125"
img94.png,Olymp hidlocaineober,"Olymp, assign, Atlantic, Nam, med, Tar, assen, h, ising, con","0.006698969751596451, 0.005176562815904617, 0.004958843346685171, 0.004497475456446409, 0.004479941446334124, 0.003969008568674326, 0.0036138230934739113, 0.0033948724158108234, 0.003355321241542697, 0.0030312801245599985"
img95.png,assenmundether Hannober,"assen, essel, ish, ster, Nam, med, ectors, fert, Gaussian, Marine","0.014271463267505169, 0.008227488026022911, 0.007176142185926437, 0.005676795728504658, 0.00393220130354166, 0.0033112457022070885, 0.0030985004268586636, 0.0028656444046646357, 0.0028322585858404636, 0.002568746916949749"
img96.png,Nam Hou reci Hera,"Nam, nam, essel, ster, ib, DataSet, assen, fert, Marine, Olymp","0.02091842144727707, 0.00961463525891304, 0.008551433682441711, 0.004523926414549351, 0.004023663233965635, 0.003606788581237197, 0.00353702693246305, 0.003401525318622589, 0.0033882642164826393, 0.0032204994931817055"
img97.png,essel Marcusps Machung,"essel, enden, PN, Olymp, Zam, WN, nete, Vincent, Halle, щи","0.006804640870541334, 0.004622270818799734, 0.0042250980623066425, 0.003922870382666588, 0.003685195464640856, 0.003019541036337614, 0.0027926189359277487, 0.0024935281835496426, 0.0022971457801759243, 0.002270383294671774"
img98.png,asse Gregorybare Houæ,"asse, Nam, ectors, essel, aines, DataSet, aval, Gregory, fert, enden","0.02125552110373974, 0.011421789415180683, 0.008004902862012386, 0.006507940124720335, 0.002578587271273136, 0.002568534342572093, 0.002509034238755703, 0.002422358375042677, 0.002422358375042677, 0.0022755952086299658"
img99.png,asse Gregoryile Ven Mam,"asse, Olymp, assen, Nam, asp, nete, arch, awa, ]], Jen","0.011041758581995964, 0.008803257718682289, 0.006991206202656031, 0.0054874601773917675, 0.0039834692142903805, 0.003669743426144123, 0.0035707587376236916, 0.0035429704003036022, 0.003238537348806858, 0.003225911408662796"
img100.png,essel Republicizzak Pav,"essel, Nam, oria, trib, assen, nam, ster, iste, ectors, fert","0.016690693795681, 0.007792273070663214, 0.005836142227053642, 0.003918200731277466, 0.003918200731277466, 0.0038877089973539114, 0.0035259989090263844, 0.0033514148090034723, 0.0031483627390116453, 0.00281117158010602"
img101.png,assen Mam Clementassenassen,"assen, Nam, Gam, uur, fert, cono, Jug, DataSet, ectors, arch","0.005702159833163023, 0.004371997434645891, 0.003949770703911781, 0.0037249887827783823, 0.003710465971380472, 0.0036815910134464502, 0.0033260404597967863, 0.003161356784403324, 0.0026725486386567354, 0.002641412429511547"
img102.png,fert Hermegeno○,"fert, Nam, zym, med, advers, essel, pray, emy, correspond, Marine","0.011375575326383114, 0.005310839042067528, 0.004705142695456743, 0.004472175147384405, 0.0037659488152712584, 0.0036500825081020594, 0.0035102502442896366, 0.003171246964484453, 0.003109909361228347, 0.0030616947915405035"
img103.png,esselentr Gregory civilral,"essel, ody, bare, DataSet, <0x83>, Nam, outer, asse, bare, con","0.012953264638781548, 0.005571130197495222, 0.005072571337223053, 0.004494049120694399, 0.004107893444597721, 0.0038140499964356422, 0.0037696147337555885, 0.002970385132357478, 0.002757909009233117, 0.0025506489910185337"
img104.png,esselbell reci Pavano,"essel, Nam, oria, med, DataSet, Jung, Tit, asse, Jug, Zam","0.035816490650177, 0.009830007329583168, 0.0064719077199697495, 0.004589269869029522, 0.004146059975028038, 0.0037165042012929916, 0.003630411345511675, 0.002997982781380415, 0.002905744593590498, 0.0025844229385256767"
img105.png,fertuno Campbelluche Republic,"fert, DataSet, Vincent, Olymp, assign, Nam, nete, uur, bare, essel","0.006899431347846985, 0.0064059048891067505, 0.005008450243622065, 0.004542467184364796, 0.003962010145187378, 0.0038251406513154507, 0.0034557266626507044, 0.003375674830749631, 0.003349405014887452, 0.003085616510361433"
img106.png,Namdlassen Ostile,"Nam, asse, essel, Atlantic, DataSet, Commonwealth, Front, med, aines, pray","0.018909288570284843, 0.012794665060937405, 0.007010897621512413, 0.004688543267548084, 0.003856690600514412, 0.0030868565663695335, 0.003050893545150757, 0.002877266379073262, 0.002854875521734357, 0.0028216149657964706"
img107.png,esselentr Hou blindentr,"essel, Tit, fert, Nam, DataSet, assen, asse, MAP, icus, Olymp","0.015009932219982147, 0.006765507161617279, 0.00635560555383563, 0.0041681076399981976, 0.003809958463534713, 0.0037508911918848753, 0.003692738711833954, 0.002831321209669113, 0.0025880371686071157, 0.0025379799772053957"
img108.png,essel Marcusbare Beyproc,"essel, ib, asse, Tar, Olymp, DataSet, assign, Tit, Marine, bare","0.010237082839012146, 0.00620910432189703, 0.005947957746684551, 0.004334653727710247, 0.004267450887709856, 0.0039932699874043465, 0.0037660126108676195, 0.0031466209329664707, 0.0028316520620137453, 0.002712557092308998"
img109.png,Nam clothzá Gentosz,"Nam, essel, Zam, oria, itzer, aine, Mam, isher, fault, nam","0.021691380068659782, 0.00852771382778883, 0.007014705799520016, 0.004727883264422417, 0.00469108996912837, 0.004304786212742329, 0.004107655491679907, 0.002801177790388465, 0.00250117015093565, 0.0024432307109236717"
img110.png,esselenden quick Republic↑,"essel, Olymp, asse, olymp, Zam, med, icus, ib, zy, uur","0.016875579953193665, 0.011024128645658493, 0.007488492876291275, 0.007459298241883516, 0.005066967569291592, 0.004350970033556223, 0.0036638842429965734, 0.0032082039397209883, 0.003170827403664589, 0.003146151779219508"
img111.png,ectors Ostittel ster ster,"ectors, asse, essel, aine, Marine, mil, aines, Camb, arch, enk","0.00856040045619011, 0.007293551694601774, 0.006262922193855047, 0.005505462177097797, 0.0051116482354700565, 0.004254290834069252, 0.003100371453911066, 0.002736068330705166, 0.002683148020878434, 0.0026415495667606592"
img112.png,DataSet salt Fle Fleuno,"DataSet, med, ib, Cong, ish, asse, Nam, essel, DB, Front","0.006758793722838163, 0.005872141569852829, 0.005494860466569662, 0.004774017259478569, 0.0041966307908296585, 0.0040675136260688305, 0.0039269994013011456, 0.00366036593914032, 0.0036036171950399876, 0.0033852853812277317"
img113.png,assen Wass Kobdlicle,"assen, essel, med, Ind, asse, Pennsylvania, PN, parallel, Atlantic, dispos","0.01431646291166544, 0.006303453352302313, 0.004721068777143955, 0.00336084165610373, 0.0033087364863604307, 0.003024430014193058, 0.0027430388145148754, 0.0025668004527688026, 0.002383193699643016, 0.0023462455719709396"
img114.png,Tiibenigan correspondasse,"Ti, Nam, asse, onde, oby, aval, assen, essel, Olymp, Nieder","0.011263503693044186, 0.005037350580096245, 0.005037350580096245, 0.00336873228661716, 0.0032778664026409388, 0.003201934974640608, 0.003177017206326127, 0.0031277621164917946, 0.0028367573395371437, 0.002771043684333563"
img115.png,ibogle Hou theno,"ib, essel, fert, arch, ire, asse, med, DataSet, trib, ams","0.010700699873268604, 0.00718411011621356, 0.006908891256898642, 0.005750089418143034, 0.005174520891159773, 0.004729894921183586, 0.0034335351083427668, 0.0033409215975552797, 0.0031879295129328966, 0.0027805615682154894"
img116.png,medizing ster ster Wass,"med, Olymp, nam, ennis, asse, assen, essel, Nam, Jung, correspond","0.006117651704698801, 0.0050322432070970535, 0.00407523475587368, 0.0033653168939054012, 0.0033653168939054012, 0.0029352812562137842, 0.0029010844882577658, 0.0028228326700627804, 0.0026005152612924576, 0.0025903768837451935"
img117.png,esselVSloster Lybourg,"essel, ectors, zy, ody, asse, trib, DB, arch, â, assen","0.011571329087018967, 0.011041440069675446, 0.005683646071702242, 0.003742014989256859, 0.003556734649464488, 0.0035428686533123255, 0.003367448691278696, 0.0031510924454778433, 0.003054143628105521, 0.002835676306858659"
img118.png,asseankaenízassen,"asse, DataSet, ib, essel, fert, assen, Olymp, ectors, ize, Front","0.025288086384534836, 0.011177772656083107, 0.005342244636267424, 0.00446361256763339, 0.004326281603425741, 0.0036288914270699024, 0.0035866135731339455, 0.0033300581853836775, 0.0027285516262054443, 0.002696763025596738"
img119.png,Nam Herm Bes marg mil,"Nam, ster, zel, essel, Zam, correspond, fert, itzer, trib, <0x83>","0.016927719116210938, 0.007659783586859703, 0.003562130033969879, 0.0029762713238596916, 0.0027099258732050657, 0.002477072412148118, 0.0022998841013759375, 0.0019518862245604396, 0.0018771105678752065, 0.001812265021726489"
img120.png,esselawa rör Kob Kob,"essel, DataSet, fert, Nam, uche, rys, Olymp, asse, assen, nam","0.018924910575151443, 0.006025182548910379, 0.005885608959943056, 0.005053931847214699, 0.004803693853318691, 0.004548046737909317, 0.004173522349447012, 0.003697535488754511, 0.0036687611136585474, 0.0034196614287793636"
img121.png,esselentr Hermitulán,"essel, fert, asse, Nam, oria, Jung, Tit, enk, assen, ib","0.022408580407500267, 0.008572045713663101, 0.007990025915205479, 0.005019599571824074, 0.004395308438688517, 0.004361104220151901, 0.0031658217776566744, 0.0025637606158852577, 0.002371090929955244, 0.0022449039388448"
img122.png,ectorsassenæ Mamassen,"ectors, essel, zy, Mam, assen, asse, DB, Atlantic, ing, WN","0.0072798533365130424, 0.006106351502239704, 0.0036320537328720093, 0.0036320537328720093, 0.0035203073639422655, 0.003411998739466071, 0.003319965675473213, 0.002646907465532422, 0.002626309171319008, 0.002535581821575761"
img123.png,esselosz ster Mamassen,"essel, assen, Nam, Tit, ugen, Olymp, Ál, fert, Gregory, istry","0.0057639447040855885, 0.004071313887834549, 0.0036637859884649515, 0.003428390482440591, 0.003170742653310299, 0.0030852174386382103, 0.003037385642528534, 0.0028645272832363844, 0.0028091222047805786, 0.0023288442753255367"
img124.png,essel Republicoud Storm Lind,"essel, fert, Nam, enk, onde, ody, Gam, ams, advers, Leip","0.006048780865967274, 0.005660150665789843, 0.005400953348726034, 0.003800045233219862, 0.0035837842151522636, 0.0032124831341207027, 0.0031015065032988787, 0.0025813027750700712, 0.0024921305011957884, 0.002387315034866333"
img125.png,asseassen Gregoryebb ster,"asse, Olymp, essel, ams, ster, nam, am, accident, man, rather","0.012056469917297363, 0.005991744808852673, 0.005308391992002726, 0.004967330954968929, 0.004721381235867739, 0.0037203591782599688, 0.0035223651211708784, 0.00344076962210238, 0.0032197022810578346, 0.002775557106360793"
img126.png,esselendenalseassenlied,"essel, Olymp, Nam, assen, asse, assign, Tir, nam, med, ectors","0.01699589379131794, 0.006036447361111641, 0.005496247671544552, 0.003897423157468438, 0.0037189472932368517, 0.003521028207615018, 0.0032819590996950865, 0.003256418975070119, 0.002976607996970415, 0.002941929269582033"
img127.png,medsom Republic Foot desar,"med, asse, Olymp, coordinate, Tit, essel, aines, ster, ib, correspond","0.005751422606408596, 0.005195977631956339, 0.005155541934072971, 0.004603381268680096, 0.004427027888596058, 0.004062469117343426, 0.003394319908693433, 0.0032898876816034317, 0.0032011487055569887, 0.003054557368159294"
img128.png,itheruccivere Lombebb,"ither, assen, Nam, essel, izing, asse, as, ize, uro, Tit","0.00416373647749424, 0.003942146431654692, 0.003465368878096342, 0.0032681541051715612, 0.0031307002063840628, 0.0029873347375541925, 0.0028954241424798965, 0.0028954241424798965, 0.0028283516876399517, 0.002646631794050336"
img129.png,Jugentrucci Olympæ,"Jug, fert, essel, assen, h, itzer, Nam, arch, ing, med","0.00868138950318098, 0.008348810486495495, 0.007513116113841534, 0.0060605863109230995, 0.004664999898523092, 0.0037047623191028833, 0.0030833769124001265, 0.0028074467554688454, 0.0027965016197413206, 0.0026580370031297207"
img130.png,Namszein tan Werner,"Nam, fert, DataSet, asse, Olymp, accident, Atlantic, nam, ster, Front","0.015558081679046154, 0.015437006950378418, 0.007263497915118933, 0.007178875617682934, 0.005397772882133722, 0.004337232559919357, 0.004171075765043497, 0.003768252907320857, 0.0035677102860063314, 0.0028222911059856415"
img131.png,asse Gregoryib ::assen,"asse, ib, assen, ectors, essel, threshold, Desktop, Nam, outer, Ti","0.010353206656873226, 0.007969147525727749, 0.0057624271139502525, 0.003960454370826483, 0.0037350645288825035, 0.0033350372686982155, 0.0030012086499482393, 0.002920255996286869, 0.0028975303284823895, 0.0027974338736385107"
img132.png,asse Gregoryucci Kob ster,"asse, essel, DataSet, advers, asa, fert, assign, pray, ib, Olymp","0.017897291108965874, 0.016747402027249336, 0.00522879371419549, 0.005127659998834133, 0.0048928470350801945, 0.004650585353374481, 0.003993425518274307, 0.003825467312708497, 0.003551826113834977, 0.0033759630750864744"
img133.png,essel Gregoryoud indirecteno,"essel, DataSet, Olymp, asse, Tit, oria, fert, Nam, assign, olymp","0.006769588682800531, 0.005546801723539829, 0.005170188378542662, 0.004972121212631464, 0.004725934471935034, 0.004236300475895405, 0.004105962812900543, 0.0033774732146412134, 0.0033251100685447454, 0.0027351609896868467"
img134.png,fertausassen h Mam,"fert, Nam, Front, zy, trib, ectors, MAP, correspond, ib, DB","0.007835584692656994, 0.005343404598534107, 0.004161447752267122, 0.0036155283451080322, 0.003370043123140931, 0.0031167801935225725, 0.0030564963817596436, 0.002761314157396555, 0.0027185040526092052, 0.0026451770681887865"
img135.png,zy pray SelosofDeleg,"zy, assen, oria, Olymp, ens, yan, Ti, Atlantic, WN, ish","0.007686195429414511, 0.007305625826120377, 0.006889861077070236, 0.00680959178134799, 0.0038049425929784775, 0.0036024474538862705, 0.0031176586635410786, 0.0029865338001400232, 0.0026981085538864136, 0.002615096513181925"
img136.png,essel ment calraph Marine,"essel, asse, fert, DataSet, Zam, DB, zel, ib, iste, Jug","0.026420220732688904, 0.010346307419240475, 0.007394172251224518, 0.006153976544737816, 0.004944858606904745, 0.003973306156694889, 0.0038964550476521254, 0.003703528083860874, 0.0035339314490556717, 0.0035064301919192076"
img137.png,oria Sto Wegunst Blo,"oria, essel, med, Ál, fert, ory, assen, assign, Jug, DataSet","0.0070683276280760765, 0.0064357854425907135, 0.0049344878643751144, 0.0037539603654295206, 0.003695760853588581, 0.0032234997488558292, 0.0032234997488558292, 0.002569998148828745, 0.002559978747740388, 0.002559978747740388"
img138.png,assenoul Mamngangel,"assen, ib, Nam, essel, ster, fert, Olymp, ish, Tar, arch","0.007852763868868351, 0.006334569305181503, 0.0058129276148974895, 0.005149968434125185, 0.0036093287635594606, 0.0035395182203501463, 0.0034306186717003584, 0.003135839244350791, 0.0029229235369712114, 0.0027565795462578535"
img139.png,Nam Houzie Clementebb,"Nam, essel, asse, ster, ectors, DataSet, Olymp, uur, fert, pray","0.011628842912614346, 0.007362924981862307, 0.006151953712105751, 0.005667445249855518, 0.005344910081475973, 0.00500150304287672, 0.0038347856607288122, 0.003760614199563861, 0.003424077993258834, 0.0033709926065057516"
img140.png,OlympAnchoricus MamDeleg,"Olymp, assen, essel, enburg, Ti, asse, â, Maurice, con, dispos","0.011421848088502884, 0.008895344100892544, 0.0075199487619102, 0.0039627342484891415, 0.003781267674639821, 0.0029219372663646936, 0.002887895330786705, 0.0028654218185693026, 0.0026813203003257513, 0.002650081878527999"
img141.png,medizingire ster Mam,"med, Olymp, Nam, ody, PN, Wass, Tar, ams, arch, essel","0.00757822347804904, 0.007008710876107216, 0.006819663569331169, 0.005067943129688501, 0.004104145336896181, 0.003916202578693628, 0.003469563787803054, 0.002865155227482319, 0.002744650701060891, 0.0026087535079568624"
img142.png,essel Gregory Jerusalem Verloul,"essel, med, nam, asse, Nam, nitt, outer, IE, ish, correspond","0.011619321070611477, 0.010415492579340935, 0.009822744876146317, 0.007075057830661535, 0.004621846601366997, 0.0033030849881470203, 0.0031889781821519136, 0.0031395377591252327, 0.0028810016810894012, 0.002803291892632842"
img143.png,asse Gregory Lyessel curs,"asse, Olymp, Hou, essel, ire, med, ising, am, outer, ectors","0.008356187492609024, 0.006636160425841808, 0.0063570523634552956, 0.005311515647917986, 0.005028842482715845, 0.004779846407473087, 0.004120485857129097, 0.004040788393467665, 0.003285137703642249, 0.0031469690147787333"
img144.png,esselentr Mach Festival reci,"essel, assen, Hou, PN, Zam, ams, oria, Vietnam, Nam, Ál","0.007404670584946871, 0.0038565276190638542, 0.003337546717375517, 0.0031353349331766367, 0.0029338914901018143, 0.0028104959055781364, 0.0027346876449882984, 0.00270282756537199, 0.0026609241031110287, 0.0025390712544322014"
img145.png,asseaines Gregoryassenassen,"asse, ectors, Front, Cong, essel, correspond, sect, Tit, Nam, usual","0.010572834871709347, 0.006143036298453808, 0.005463729612529278, 0.0044768201187253, 0.003874365007504821, 0.003313919994980097, 0.0030768702272325754, 0.0030291678849607706, 0.002631786745041609, 0.0025408705696463585"
img146.png,Nam Hou CSVesselire,"Nam, Tit, essel, ogle, oria, fert, â, DataSet, Gregory, Ti","0.00751891266554594, 0.0051475209183990955, 0.004489747807383537, 0.003722131485119462, 0.003537836018949747, 0.0032847695983946323, 0.0032592073548585176, 0.0031961684580892324, 0.0028096125461161137, 0.0025681937113404274"
img147.png,Nam Hou Campbellouriagin,"Nam, essel, ib, fert, ster, Tar, Cong, correspond, oria, sit","0.01234048418700695, 0.006352337077260017, 0.005627858452498913, 0.005605917889624834, 0.004986006300896406, 0.004069460090249777, 0.003807999659329653, 0.003577284747734666, 0.003521823789924383, 0.0030598135199397802"
img148.png,asse Gregoryanka ster ster,"asse, med, DataSet, essel, Nam, Tit, assen, Olymp, ectors, ib","0.023885414004325867, 0.01177803985774517, 0.00793834961950779, 0.0075158788822591305, 0.005807821173220873, 0.004054512362927198, 0.003960589878261089, 0.0031576575711369514, 0.002954780124127865, 0.002863871166482568"
img149.png,OlympAnchor Cort Mam anchor,"Olymp, med, asse, oria, aine, essel, Cong, ize, Zam, assen","0.003999670036137104, 0.0037135679740458727, 0.0036846690345555544, 0.003447931259870529, 0.003226403845474124, 0.003188815200701356, 0.0029839356429874897, 0.002926221117377281, 0.002869623014703393, 0.0027813338674604893"
img150.png,Nam Hou++) vs M,"Nam, asse, Tit, essel, ster, oria, fert, correspond, Atlantic, iste","0.021304139867424965, 0.014814703725278378, 0.0038646466564387083, 0.0036589736118912697, 0.0032290329691022635, 0.0031174845062196255, 0.0030333956237882376, 0.0030333956237882376, 0.0030097896233201027, 0.002998055424541235"
img151.png,esselisz rörDeleg ster,"essel, Nam, asse, med, ire, DataSet, ster, ish, fert, loc","0.015244312584400177, 0.006379646714776754, 0.0050270408391952515, 0.004796835593879223, 0.004685717169195414, 0.004577172454446554, 0.004086954984813929, 0.003824370913207531, 0.0036067254841327667, 0.0033618377055972815"
img152.png,Olymp kne Jakobsvn Wass,"Olymp, Hou, med, pray, aines, situ, enden, endes, con, assen","0.00867803767323494, 0.0042128488421440125, 0.003957605455070734, 0.003942176233977079, 0.0035614592488855124, 0.003142976900562644, 0.0028954460285604, 0.002795421751216054, 0.002447752747684717, 0.00232655624859035"
img153.png,Nam Houjar Castro ster,"Nam, essel, ster, ectors, asse, mil, outer, Zam, nitt, Tar","0.021000543609261513, 0.015244760550558567, 0.01239390205591917, 0.011965748853981495, 0.004367697052657604, 0.0042665195651352406, 0.0037068163510411978, 0.0028532384894788265, 0.002537722699344158, 0.002430989407002926"
img154.png,essel ye silanges Wass,"essel, correspond, Gregory, Ál, asse, ory, assen, bare, med, Maurice","0.01911122165620327, 0.005245165899395943, 0.004592821002006531, 0.00453931326046586, 0.003549056826159358, 0.003295188071206212, 0.0032567977905273438, 0.0028966558165848255, 0.002840629545971751, 0.00280753499828279"
img155.png,esselizeraumDelegoud,"essel, trib, DataSet, assen, ib, fert, Pennsylvania, parallel, Camb, asse","0.011348430998623371, 0.007648796308785677, 0.0062671988271176815, 0.00598020339384675, 0.004861871246248484, 0.00480522820726037, 0.004307378549128771, 0.0034341418650001287, 0.0032135003712028265, 0.0028693329077214003"
img156.png,esselentr Hou Mamdl,"essel, Nam, ams, oria, Zam, assen, ory, Cong, â, threshold","0.016711654141545296, 0.006966453976929188, 0.004000497981905937, 0.0035860235802829266, 0.0031770404893904924, 0.003031553467735648, 0.0026963194832205772, 0.0026649064384400845, 0.0025829158257693052, 0.002351771341636777"
img157.png,essel Gregory Republicralwed,"essel, Nam, Tit, DataSet, ib, zy, bare, asse, arch, ectors","0.012187561020255089, 0.005366110242903233, 0.004625876434147358, 0.00429498078301549, 0.004130442626774311, 0.003491794690489769, 0.003410907229408622, 0.003204250941053033, 0.003045597579330206, 0.002861074171960354"
img158.png,esselentr Jon Wassober,"essel, asse, assen, med, Nam, Zam, nam, iste, assign, correspond","0.007197980303317308, 0.005806376691907644, 0.005627733189612627, 0.0040535046719014645, 0.00400627963244915, 0.0032191360369324684, 0.0027968338690698147, 0.0026171391364187002, 0.002586648566648364, 0.002355170203372836"
img159.png,esselentr reci MamDeleg,"essel, Ti, asse, med, Nam, Olymp, Tit, aman, assen, iste","0.0068116625770926476, 0.006324414163827896, 0.004147652070969343, 0.004067429341375828, 0.004067429341375828, 0.0038811680860817432, 0.0036460203118622303, 0.003631805768236518, 0.0035200666170567274, 0.0035063435789197683"
img160.png,asseassenassenassenouri,"asse, ectors, aines, assen, med, aver, Nam, aver, zym, aine","0.015463222749531269, 0.007867050357162952, 0.005622327793389559, 0.005428101867437363, 0.005364862270653248, 0.005159338004887104, 0.0043616024777293205, 0.0037016437854617834, 0.0034503114875406027, 0.0032539532985538244"
