Image File,Inference Result
img1.png,"without your cannot., which usually means  this one of a in any many, and not take"
img2.png,"andph a,
.,ies. And of any. one, one person in a certain"
img3.png,"What charge ( my of can be the cou, tpt Alcomer,Uft, D"
img4.png,"and a, he will, can, and a., Not be!, There be n/t"
img5.png,and.
img6.png,"a L in a really, but Couse,.
words
er, M.,,"
img7.png,"to, because is g. (e."
img8.png,"or, andx, do, use of that sentence, and from T T, where up the"
img9.png,"as a, in some, to avoid, c to,, come from,., to."
img10.png,"or your, since the current moment, andh to get this. here that the end. for"
img11.png,"n, in your., andro. With. and the answer, the get to, Two."
img12.png,"your' day: on you. Please, no, what the h. There go in the pre"
img13.png,"it that.
here only."
img14.png,"without today with it..""interke1,"" you could'"
img15.png,"some.. all of the
and one comment, the of any one the one point, but"
img16.png,"you' because.à,  às,c to s,"
img17.png,do not.
img18.png,"T., for all it? equals, the3 for your a down Ver
Pe, but mean"
img19.png,"here are and, n and, and= ( the 11, or, for all,"
img20.png,I am going.
img21.png,"theps, of course, as meanph for, and t to, or a specific question the"
img22.png,"or point..,
the usually a and on have that of or not be with: Is"
img23.png,"the point that, the rech to I= at, for Know, it can',"
img24.png,"the up, and keep no. please stop."
img25.png,"the the the ?.? That don’ = Son and do Not Me,! of"
img26.png,"a Less”Fac("", such  one"
img27.png,"� of. = une, p, and, and.  [ sou, a letter of"
img28.png,"as the, allment limit?. No. D notice! D an."
img29.png,"do too


C the search from here over the costs. the from the price; of"
img30.png,"you can, I will search, to some accept of, but, dan or. The,"
img31.png,you out. ja?C?) not be on. D not of one could have one of
img32.png,"and, once."
img33.png,No Lass.
img34.png,"you ' by?5', when know and and is a, are it not, not not"
img35.png,"here.
the the number,"
img36.png,a is out of. I have mean.! when does not know.
img37.png,Not.
img38.png,"n, and all other conditions, to behere: ish, Money, Not all!"
img39.png,and the? much alone.
img40.png,to.
img41.png,No not.
img42.png,which you might and go out to you without ask? with end up the andget of be and
img43.png,"until.!, to avoid Rness of reader,, has the the.
 not:"
img44.png,And you?
img45.png,"03 and, or which the question, and, orid, poth,.h"
img46.png,"with., and. I' is. Aso= Ef for set the find! This"
img47.png,"No; the appearings between "" and."
img48.png,end the?
img49.png,"No, and which one, and, not, as see,,, one way. to see"
img50.png,all these and once. that'. Answer. This is a chance for itbut there all.
img51.png,"how to this rule, not? Too often or how do which"
img52.png,"I mean,
course of whicheh, sochone? you have one, the all"
img53.png,you.
img54.png,and n ( and that will never to...! from end up!
img55.png,"and, we shall go of, we do, one, we of, and from one, it"
img56.png,and one.
img57.png,"or. No, you Can’, find a. That finds. ( not be, but live"
img58.png,G
img59.png,"as a, which he found, no. A can who did he have Pitter to, and"
img60.png,the the one. which.
img61.png,"and your! comment., let next."
img62.png,And Paythu. This is a person has to.
img63.png,"I might, there. If No
to equal, and have it that there  not. read"
img64.png,"(. as you go. However to each search, but to the the tro shop.
g"
img65.png,"No you can only! please send, the the the a, we seem Every Your New Women."
img66.png,"Person of one, which we is no., at all beten!, like Not. there seem"
img67.png,"One Dettaction t. The. To. 200, but can she fear"
img68.png,"How the the, point here, and too see,: Go into an 9/ S"
img69.png,"and, . (, it does, weather, at find out!"
img70.png,I Can. It does Ar.
img71.png,"No! learn the or a,10/75,7:7?=neke"
img72.png,"you should continue. That. Just make it is interesting to her: in him without-- much,"
img73.png,"None. you could lead, where many, and now, without some work:'be, and"
img74.png,"which one
, (, not all, avoid one, he', er, not."
img75.png,and.
img76.png,"by the with,  reasons, you can be. However,"
img77.png,"n"", which can'th is.. to say we have of a woman to T of"
img78.png,"dear, which they can'2, because, one., and two, or no, it"
img79.png,"and a one, what +. S. 0.2., and with, and one"
img80.png,"but, is. ? know this ( manth. He does'int, and you does"
img81.png,"to note your, here the., so you'ę. (nessone, not, do"
img82.png,Not exist
img83.png,"and not, if like all answers. How have of that a does equal., No t."
img84.png,with no. and1. One incomer. What search a the two. Your answer.
img85.png,"and to for a D( P D, do not, you searchte = two
L,"
img86.png,"and an, which it isies that, and not t. andy, and to see not"
img87.png,"No, until 2, that the c {."
img88.png,"that it's here. the the only no one one people, which is means... exist."
img89.png,"there that No one has you. No phrase,  make the. Any the to the Through."
img90.png,"2 people ( and no
this is Possible, and Not to be( Bey see for the"
img91.png,"and the, it can'N  their, is ...., because There Is and Enjo"
img92.png,"he is none, or. To C to is to exist, C"
img93.png,and said. c of. If. A'raary knowing The his only to hear the
img94.png,"that is. In , no be can word"
img95.png,"as much, there have them, the, at, take, the, (, To, Not"
img96.png,"D: below, in!,
a go), n to, Not to, unly"
img97.png,"the it on to less, and."
img98.png,in to.
img99.png,"orphage as in this is., then.
that I doner, he had put"
img100.png,"it to point., all  comment. for which do they want, of all the train,"
img101.png,you is'? Accept Scpp is available.
img102.png,"No. some and work. But. I’ and all Without one, all 2 Be,"
img103.png,"for the get one, it, that it. They is. Please does to go are with one"
img104.png,with which he is. no to.
img105.png,"without., one point. All of these is to one, which it simple. One answer."
img106.png,"in a.
'., and  equal answers, some of not, to help him out"
img107.png,"15, do side, to the review page, from [+1,2).,"
img108.png,But.... onepe.
img109.png,"you make she is out!
to yourself while she does not in Any.) enter into $"
img110.png,"as he, after allito, I never., to hope for and see a cl is in"
img111.png,"( of. 1 and use, I have all zero the answer. All the Really."
img112.png,yet c!p
img113.png,"as the,, no points. The, Not To, Without Book, and C Test.,"
img114.png,"and  as in, and, or on some, has, and or! I, you can"
img115.png,"but, myh;.h people of a priest' Con But not Be Not, you Must"
img116.png,there! Let this. No invoice ( which they is I we. They’ A.e
img117.png,to continue.
img118.png,"how, and, and to, than you No, have to To learn without and T = of"
img119.png,"and, it is 
- on, but which is a man will always out"
img120.png,and my age
img121.png,do ' there get.
img122.png,"is out! and with no one from one people, who pays not in, who areever,"
img123.png,"Buteran to see. You didn. We can't.  love,"
img124.png,"Here What the T  Tee,   deer has there at  State2,."
img125.png,is.
img126.png,"and a condition, here are the cpp, you'= 'n, and, T-"
img127.png,and to help to the entire the rest. of a man' while the customer. A is any
img128.png,"he are, and does, no, you just, are Not see, and? one, and"
img129.png,"you' that you',  sentence."
img130.png,"which, I can' k the, there are, the, Only, and Period, pay'"
img131.png,"0, at least, the, where, no. 0. 
data:9"
img132.png,"Too Bad he would. He didn'.Mpodot) sure, and, one of"
img133.png,"you' at all...- for the this on, for the love, can be. Ine"
img134.png,"andh ch. With the main, well, somek of, and its, andly,"
img135.png,"The. A:0110., Parallel, Not Not, and One?"
img136.png,"C in the middle, a, but
know which, in an, this Week and One?"
img137.png,until you are.
img138.png,the you Chpeish
img139.png,"the a, has0., v-l, is, T, to do, does,"
img140.png,and.
img141.png,"I am ntuous, the be the, you not begin all."
img142.png,"and, he came ahem… he one of, and who has been. It then to des"
img143.png,what up
img144.png,"but, can know  and: and which  answer,?. Mean  has to mean, if"
img145.png,"it'  But wait to this your,"
img146.png,"as the, or not! And come. One of one person... is do more andm to"
img147.png,"this does.... of his wantifyon ne u, they only begin'0 of"
img148.png,"you the to, but he' as . It don  Z, and, let, and"
img149.png,"what which thing the question. of the.4: question, and the? one of the time"
img150.png,and the sentence.
img151.png,"and,  moral, who, not at about . , not, any., or"
img152.png,"you needset this!. with go can work see as, this course to have to read a"
img153.png,"deity: a of the terms and two Test,  on a normal Condoreen, which"
img154.png,"But. and in addition. And, One Track! ( type at. In a sentence, not"
img155.png,"Star is The do star, Star? No, in the town, the 0, butTo"
img156.png,"D ( to go. to. Once, it does. One doll, one. Two class:"
img157.png,80 and -.
img158.png,"and jo.
. All, however one word.  The of one Cuth. Less One"
img159.png,"as one
. and? and, a number. He will havex?, one, is"
img160.png,the the the all the No Review.? No 21 people have Not. Asja...
img161.png,"the the, and, No., and No( sign,,,)., by a, on"
img162.png,and to Be.
img163.png,"Endure, the the which,.nde., to, all, Nothing, meaning that."
img164.png,"10 and in . , 0,11,."
img165.png,"or here but they may, She, is to givex, one person, the order to spot"
img166.png,"to find out with, but for, royal, you- court, that be. C type."
img167.png,and which you are.
img168.png,"and you have does  number. They can'2, and on a Maxionand Rren"
img169.png,and the a.
img170.png,"and, too mention a and'end, you never find?* need? be? use"
img171.png,"Andberic and,"
img172.png,"and, at least one letter' and r?"
img173.png,"and your and the people, judge."
img174.png,"No. your Days, who you is for a. In those a, you not for (.,"
img175.png,"and to make. I'th that all the some of which,
not test on a,"
img176.png,on the.
img177.png,but a. The order is c. The comes. And? Do his be. do conion
img178.png,which ( all but nice.! and avoid you. But: Oneh
img179.png,is a.
img180.png,"he has, and. On or use, has, do:"
img181.png,"by me and be
. meaning of two. A likeness over the record, he may know"
img182.png,"and the an their page, let', and the P Re  in Con P (, which"
img183.png,"n./, and, 4, is =, mean to be (.0,"
img184.png,"what you are not yet... people = . thisone (, of a head more"
img185.png,"and the itch. S (it, not!
at all sentence, and ."
