img82.png,LS君oka rend ir,"LS, Fellow, konn, Mari, anal, kou, Geg, trag, beskre, Tru","0.025432176887989044, 0.0046678693033754826, 0.004385057371109724, 0.0036353401374071836, 0.003195669036358595, 0.003049328690394759, 0.0029670780058950186, 0.002909689676016569, 0.002722743898630142, 0.0022396682761609554"
img83.png,LSskog Mari Marian induct,"LS, Fellow, konn, Cad, anal, ikal, lab, kou, nja, beskre","0.023194340988993645, 0.010413751006126404, 0.006619382183998823, 0.004786422476172447, 0.004062184598296881, 0.0033940819557756186, 0.003126774914562702, 0.002925881650298834, 0.0029144748114049435, 0.002705998020246625"
img84.png,Jamzakolo partiellement craft,"Jam, tables, Fellow, Ces, domin, LS, Person, 음, wich, ikal","0.008160709403455257, 0.00345546193420887, 0.0033360912930220366, 0.003037545830011368, 0.002639065496623516, 0.002577931387349963, 0.0025379641447216272, 0.0024028962943702936, 0.002374901669099927, 0.002347233472391963"
img85.png,Jamolo executed actuomething,"Jam, konn, Cad, LS, Magazine, ikal, nja, Mari, domin, tables","0.011192445643246174, 0.010391833260655403, 0.008124844171106815, 0.005875010509043932, 0.005476112011820078, 0.005476112011820078, 0.0037053225096315145, 0.0033737346529960632, 0.00291972397826612, 0.0026377507019788027"
img86.png,Fellow lodociermanniter,"Fellow, konn, Mari, SOUR, lés, cí, ikal, Person, zik, LS","0.007685345597565174, 0.007107782643288374, 0.0054710558615624905, 0.003971560392528772, 0.003804521868005395, 0.0029514131601899862, 0.002475649816915393, 0.002343897707760334, 0.002343897707760334, 0.0021341433748602867"
img87.png,Fellow sino Schwe marioken,"Fellow, LS, Mari, Marian, Magazine, anal, Gal, pom, fellow, accum","0.010998116806149483, 0.009011534042656422, 0.006415145006030798, 0.0048803845420479774, 0.003474255558103323, 0.0033022332936525345, 0.0032131613697856665, 0.0031881562899798155, 0.0028578448109328747, 0.00275911926291883"
img88.png,LSogne functioniana compens,"LS, anal, Cad, lab, konn, Fellow, Jam, Release, SOUR, Mari","0.02048978954553604, 0.005645530764013529, 0.005493252072483301, 0.0038349078968167305, 0.003673617262393236, 0.0028834547847509384, 0.002872213488444686, 0.002838751068338752, 0.0027300002984702587, 0.002656363183632493"
img89.png,LS compensﬁ gam tax,"LS, Sv, Fellow, cian, Sak, anal, konn, ikal, Cad, native","0.007782104890793562, 0.005783169064670801, 0.005286244675517082, 0.00510362908244133, 0.003792695002630353, 0.0034803724847733974, 0.003193769371137023, 0.0031565611716359854, 0.002942238003015518, 0.002807503566145897"
img90.png,konnissent dupdebughnen,"konn, Fellow, ikal, rikt, anal, ading, alin, kou, SOUR, reiche","0.01310546975582838, 0.008428540080785751, 0.007069870829582214, 0.003740141401067376, 0.0036821558605879545, 0.002935670781880617, 0.0027578072622418404, 0.0024242682848125696, 0.0024148167576640844, 0.0023681099992245436"
img91.png,konn MarianRORoken sí,"konn, SOUR, rikt, cí, Fellow, Geg, Jar, anal, Cad, Mari","0.0060346401296556, 0.005202184896916151, 0.00431276299059391, 0.004115267191082239, 0.003761658677831292, 0.0031924780923873186, 0.0024960357695817947, 0.002457338385283947, 0.0023724485654383898, 0.002254980383440852"
img92.png,konnнівenf GL Mari,"konn, LS, kou, lés, functions, anal, SOUR, ikal, ECT, dp","0.015324857085943222, 0.005316857248544693, 0.004189582541584969, 0.003982142079621553, 0.003814658848568797, 0.003654218977317214, 0.003327204380184412, 0.00316246272996068, 0.0031501336488872766, 0.003005878534168005"
img93.png,LSogleanse cum Prop,"LS, Cad, konn, ikal, Fellow, rikt, rails, Rost, comput, berga","0.008691281080245972, 0.00731879286468029, 0.005069579463452101, 0.004615904297679663, 0.003948192577809095, 0.0036945233587175608, 0.0027348326984792948, 0.0027348326984792948, 0.0024998397566378117, 0.0023853634484112263"
img94.png,konn galtextonomolare,"konn, ikal, kou, Fellow, ikai, comput, zik, LS, lab, rikt","0.020302342250943184, 0.008800414390861988, 0.006853769067674875, 0.005234479904174805, 0.0036973310634493828, 0.0031256505753844976, 0.002879484323784709, 0.002715612528845668, 0.0026630875654518604, 0.0025312290526926517"
img95.png,LSskog Mariulp money,"LS, beskre, konn, Geg, tables, dispon, dp, anson, pom, ikai","0.03490098565816879, 0.009247841313481331, 0.0037510893307626247, 0.0034827685449272394, 0.0032084768172353506, 0.0029673560056835413, 0.002921351231634617, 0.002744355471804738, 0.0023936694487929344, 0.0023291041143238544"
img96.png,Fellowenden師forschpersistence,"Fellow, ikal, eno, rikt, LS, anal, Gal, dp, Jam, konn","0.005911583546549082, 0.005707365460693836, 0.00515617523342371, 0.004015633370727301, 0.0037138534244149923, 0.003543783677741885, 0.0033815018832683563, 0.00332907703705132, 0.0032015417236834764, 0.0031030408572405577"
img97.png,LS Dir Gordon reverse luc,"LS, beskre, ikal, Cad, Fellow, anal, anal, Tru, DF, Mari","0.005000669043511152, 0.003864217782393098, 0.003615944180637598, 0.0035046935081481934, 0.0034774194937199354, 0.003068811958655715, 0.0029743947088718414, 0.0028716428205370903, 0.0022716564126312733, 0.002176113659515977"
img98.png,SOURmys mari based sculpt,"SOUR, functions, konn, eno, cí, ikal, ahlen, Cad, Release, LS","0.007773267570883036, 0.005280241835862398, 0.004999232944101095, 0.004292805679142475, 0.004259399138391018, 0.0034628671128302813, 0.0034628671128302813, 0.0033694622106850147, 0.003227747045457363, 0.003202628344297409"
img99.png,Fellow propfür ton cho,"Fellow, anal, LS, Í, Prop, Mari, fellow, accum, ikal, Marian","0.02286257967352867, 0.011860949918627739, 0.008883441798388958, 0.006627450697124004, 0.00473642535507679, 0.004484357312321663, 0.004051279276609421, 0.003506090259179473, 0.0033982188906520605, 0.0030106552876532078"
img100.png,Cad beskresonorę cert,"Cad, konn, eno, Geg, Ej, Pic, Sv, uli, anal, ikal","0.00708023039624095, 0.005579087883234024, 0.005079817026853561, 0.00458923215046525, 0.004146025516092777, 0.0037456220015883446, 0.003383887466043234, 0.0032797763124108315, 0.0032038004137575626, 0.0032038004137575626"
img101.png,konnissent Dup reversemans,"konn, rikt, anal, ikai, LS, ikal, beskre, kou, cot, rinn","0.017260627821087837, 0.014534907415509224, 0.008281739428639412, 0.006325075402855873, 0.00520286476239562, 0.0034794199746102095, 0.0030586060602217913, 0.0027957926504313946, 0.0026573631912469864, 0.0025655634235590696"
img102.png,LS justiceInjectokenogne,"LS, konn, beskre, nja, Release, ikai, kou, tables, lab, onian","0.019845392554998398, 0.0071595036424696445, 0.005197241902351379, 0.00424186559394002, 0.003953853156417608, 0.003907789010554552, 0.0036710286512970924, 0.0027387540321797132, 0.0023981332778930664, 0.0023701940663158894"
img103.png,ikal chemin Mariimon gam,"ikal, Fellow, lab, ilia, LS, Mari, Í, lau, ník, cí","0.008140644058585167, 0.007325786631554365, 0.0059094736352562904, 0.004513286054134369, 0.004077414516359568, 0.003327888436615467, 0.00311407377012074, 0.003065794473513961, 0.0029714698903262615, 0.00294834584929049"
img104.png,konn fidependencies Jag gam,"konn, SOUR, LS, Sar, ikal, anal, uli, lab, rikt, Fellow","0.010512381792068481, 0.0044686440378427505, 0.004331158008426428, 0.004132820293307304, 0.0037777035031467676, 0.0035349885001778603, 0.0030001054983586073, 0.00264758407138288, 0.0024295595940202475, 0.0024200875777751207"
img105.png,konn LIMITsono Audiodanal,"konn, LS, ikal, Cad, tables, anal, pom, lab, beskre, accum","0.007732306607067585, 0.005591169465333223, 0.005419147666543722, 0.005070970393717289, 0.0031609605066478252, 0.0030998224392533302, 0.003028014674782753, 0.0028668667655438185, 0.0027895381208509207, 0.0022856653667986393"
img106.png,konn Prop fi Zach extra,"konn, Fellow, LS, Cad, anal, Mari, ikal, Wagner, Rost, lab","0.008247382007539272, 0.0052219172939658165, 0.004829483572393656, 0.004147043917328119, 0.00349216116592288, 0.0032550522591918707, 0.002872573211789131, 0.002688012318685651, 0.0026257445570081472, 0.0025951536372303963"
img107.png,kouDatosnatsьult,"kou, LS, Mari, tables, wich, Marse, konn, orr, Jam, nja","0.006374510005116463, 0.004450125154107809, 0.004020352847874165, 0.002806658623740077, 0.002667691558599472, 0.002575534861534834, 0.002565493807196617, 0.0023634436074644327, 0.0021943829488009214, 0.002160362433642149"
img108.png,Fellowstoffociánkie,"Fellow, ikal, LS, accum, ading, tables, lod, Geg, fellow, чник","0.012043332681059837, 0.0054071927443146706, 0.00502040795981884, 0.004049800336360931, 0.003518527140840888, 0.003178724553436041, 0.003153986996039748, 0.0030213347636163235, 0.0029055895283818245, 0.00272954860702157"
img109.png,rival Gamrunner Barblose,"rival, Compat, Jam, NI, wie, Pon, anal, ador, LS, question","0.003752634394913912, 0.003651413368061185, 0.0031354434322565794, 0.003111043246462941, 0.0026714312843978405, 0.0026506418362259865, 0.0025095774326473475, 0.0023119309917092323, 0.002223362447693944, 0.002080512698739767"
img110.png,riktancesiani revers心,"rikt, lau, cian, Fellow, Male, rival, Fon, anal, lod, ikal","0.01040512416511774, 0.005951864644885063, 0.0044577415101230145, 0.004204050172120333, 0.003540165489539504, 0.0032359727192670107, 0.0031120048370212317, 0.003063757671043277, 0.0028114619199186563, 0.002651461400091648"
img111.png,FellowumerateulpazaFX,"Fellow, ikal, comput, Mari, tables, konn, LS, lava, accum, calculations","0.00756637891754508, 0.00697047496214509, 0.0030810704920440912, 0.003045174991711974, 0.0029170988127589226, 0.0028163264505565166, 0.002761853625997901, 0.0026046759448945522, 0.00254433904774487, 0.002280730754137039"
img112.png,LS wealth fle dichisse,"LS, konn, Fellow, once, 음, ikai, beskre, Mari, Magazine, pom","0.011069857515394688, 0.005971740465611219, 0.005311375949531794, 0.004989576060324907, 0.002702209400013089, 0.0026396126486361027, 0.002284394111484289, 0.00225778017193079, 0.002104482613503933, 0.002079964615404606"
img113.png,LSaterraideo Santo Han,"LS, ikal, Fellow, anal, konn, lés, rikt, SOUR, olid, lab","0.011112752370536327, 0.009654926136136055, 0.009105462580919266, 0.005720354616641998, 0.0044376482255756855, 0.003650309983640909, 0.003496782388538122, 0.0034425698686391115, 0.0025884571950882673, 0.0024892950896173716"
img114.png,anal GLaniazin Gam,"anal, LS, Fellow, konn, accum, ikai, Jam, ikal, Release, Cad","0.011921166442334652, 0.009069145657122135, 0.004542474169284105, 0.004368454683572054, 0.004168407991528511, 0.004008719231933355, 0.003946569748222828, 0.003388892160728574, 0.0028426076751202345, 0.002744408557191491"
img115.png,Fellow Proppenasusk partiellement,"Fellow, anal, LS, Mari, tables, ikal, lab, once, tables, cian","0.009398410096764565, 0.0076707592234015465, 0.005109827034175396, 0.004026447422802448, 0.003651828970760107, 0.002599669387564063, 0.0025794387329369783, 0.002367026172578335, 0.00224982644431293, 0.002163636963814497"
img116.png,konn currIter spiritualja,"konn, LS, Mari, Fellow, anal, Release, functions, ikal, rikt, Prop","0.015842005610466003, 0.011233663186430931, 0.006400748621672392, 0.004036901518702507, 0.0037189682479947805, 0.003548664040863514, 0.0034800267312675714, 0.0033861591946333647, 0.0028737960383296013, 0.002336379373446107"
img117.png,LS compensianiishiegen,"LS, Fellow, konn, Mari, Rub, Cad, cí, rikt, anal, rival","0.01397682074457407, 0.005803690757602453, 0.004213028121739626, 0.004020099062472582, 0.003866091137751937, 0.0036318569909781218, 0.0035477245692163706, 0.0030703002121299505, 0.0029758368618786335, 0.002873035380616784"
img118.png,Fellow rubňakanode,"Fellow, LS, rikt, konn, ikal, Cad, cot, SOUR, tables, functions","0.009395032189786434, 0.00737424474209547, 0.007175337988883257, 0.004578772932291031, 0.0036079862620681524, 0.0034833468962460756, 0.003122451715171337, 0.002991125686094165, 0.0028430249076336622, 0.002489435952156782"
img119.png,konn Mariangravityecania,"konn, ikal, lab, LS, native, Fellow, Rub, Prop, cher, gouvern","0.014429880306124687, 0.008416875265538692, 0.005695142317563295, 0.004630117677152157, 0.003283245023339987, 0.0027647698298096657, 0.002411475172266364, 0.0024020737037062645, 0.0023556132800877094, 0.002265371149405837"
img120.png,Marijorzo [(eno,"Mari, LS, beskre, ikal, SOUR, Cad, Fellow, konn, Sv, Story","0.0071014282293617725, 0.006242556031793356, 0.004938268102705479, 0.004461353644728661, 0.004443960729986429, 0.0038760914467275143, 0.0033153966069221497, 0.0032767709344625473, 0.0022171740420162678, 0.002208529971539974"
img121.png,ikal Gall️ FB故,"ikal, LS, nja, Mari, Fellow, konn, anal, Tru, accum, Sv","0.00527787022292614, 0.005175787024199963, 0.004191480111330748, 0.0039221798069775105, 0.0034343753941357136, 0.003341739298775792, 0.0032771043479442596, 0.002706222701817751, 0.0026127351447939873, 0.002602549269795418"
img122.png,konn LIMITcolonmat mari,"konn, LS, Fellow, anal, berga, kou, functions, Magazine, SOUR, lés","0.004828063305467367, 0.004294168204069138, 0.0037454403936862946, 0.0034639660734683275, 0.003279617056250572, 0.0026977392844855785, 0.002687221858650446, 0.0022365045733749866, 0.0021092246752232313, 0.0020846514962613583"
img123.png,ikalymequitrollo Commander,"ikal, ECT, Mari, konn, beskre, Marian, LS, Naj, lab, Rost","0.004998929798603058, 0.0047700125724077225, 0.004641348961740732, 0.0044115399941802025, 0.0030557846184819937, 0.003008409170433879, 0.0028818794526159763, 0.002333817072212696, 0.0021416309755295515, 0.00212496449239552"
img124.png,LSanelboy回ड,"LS, Sta, anal, fir, orr, accum, anim, dem, reputation, tables","0.008813144639134407, 0.005262569058686495, 0.0036310635041445494, 0.0030220390763133764, 0.0030220390763133764, 0.002940524835139513, 0.002751598134636879, 0.0026878572534769773, 0.0026051606982946396, 0.002564771333709359"
img125.png,Cad repe Mari internet based,"Cad, LS, Mari, Fellow, Í, SOUR, Jam, anal, ikal, Go","0.01202628668397665, 0.006142426747828722, 0.005527585279196501, 0.0049163359217345715, 0.004802449606359005, 0.003784238826483488, 0.0031866489443928003, 0.002715058857575059, 0.0025907272938638926, 0.002215966349467635"
img126.png,LS compensumerateulpuche,"LS, Fellow, ikal, Mari, konn, beskre, Release, narr, чник, ník","0.010925838723778725, 0.006890839897096157, 0.0068105594255030155, 0.0050611780025064945, 0.004736000671982765, 0.004519123584032059, 0.0028279952239245176, 0.002719656564295292, 0.002437884220853448, 0.0023721265606582165"
img127.png,LS compenszinagraphiani,"LS, Fellow, Mari, beskre, lab, anal, lés, ikal, gouvern, ento","0.00845331884920597, 0.007787561975419521, 0.004300700034946203, 0.0032846056856215, 0.0030023728031665087, 0.002842589281499386, 0.002723034005612135, 0.002649584785103798, 0.0025282511487603188, 0.0023843678645789623"
img128.png,LS Lam perce rule mari,"LS, Cad, Fellow, Jam, rub, beskre, functions, alin, Rub, align","0.007634535897523165, 0.004910009913146496, 0.003960744943469763, 0.003929922357201576, 0.003207509173080325, 0.00310882437042892, 0.002732831984758377, 0.002732831984758377, 0.002690463326871395, 0.0026591182686388493"
img129.png,LS defectfi mari Mari,"LS, beskre, Jon, cian, konn, anal, kou, Male, rikt, lab","0.01025553047657013, 0.004863330163061619, 0.0041761077009141445, 0.0041761077009141445, 0.0037580905482172966, 0.0037143072113394737, 0.0032270457595586777, 0.003189449431374669, 0.003103419905528426, 0.0029962107073515654"
img130.png,Fellow rubsko comiska,"Fellow, LS, Mari, beskre, once, Rick, rikt, gal, trag, dz","0.007993997074663639, 0.006299118045717478, 0.004590566270053387, 0.004003962967544794, 0.0037908758968114853, 0.0033194017596542835, 0.003046054393053055, 0.002975492738187313, 0.002806156873703003, 0.0027952163945883512"
img131.png,LS fiiwдного Fore,"LS, accum, Fellow, Mari, beskre, Ces, konn, SOUR, narr, uli","0.005106037948280573, 0.003735656850039959, 0.0032967058941721916, 0.0032838534098118544, 0.0029899822548031807, 0.0027437619864940643, 0.0026593452785164118, 0.002498223911970854, 0.0024403524585068226, 0.002196079585701227"
img132.png,konnilar fi fiiod,"konn, rikt, Fellow, anal, Jon, beskre, lés, ikal, Mari, LS","0.009894633665680885, 0.0052549997344613075, 0.0048411330208182335, 0.003654278814792633, 0.0031625148840248585, 0.0028795022517442703, 0.0025811693631112576, 0.002492001745849848, 0.002492001745849848, 0.002482286188751459"
img133.png,Fellowlauxe resta fi,"Fellow, anal, SOUR, beskre, LS, konn, nja, Person, eno, lod","0.007893058471381664, 0.005865623243153095, 0.004241385497152805, 0.0036849796306341887, 0.0033031944185495377, 0.003277488751336932, 0.002972553251311183, 0.0026645795442163944, 0.0024451555218547583, 0.002407246734946966"
img134.png,ikal texterson cum compt,"ikal, ikai, konn, rikt, ECT, LS, SOUR, lab, anal, 음","0.010189589112997055, 0.006604642607271671, 0.005063954740762711, 0.0037339264526963234, 0.0036190457176417112, 0.0033997786231338978, 0.0032567884773015976, 0.002953778952360153, 0.002616903046146035, 0.002336631529033184"
img135.png,Fellowlauuche partiellementalin,"Fellow, ikal, lava, LS, fellow, Cad, lab, gal, Person, Í","0.022696563974022865, 0.00587467709556222, 0.003837686963379383, 0.0038078217767179012, 0.003647669916972518, 0.0034942536149173975, 0.0024585144128650427, 0.0024203986395150423, 0.0023643302265554667, 0.002282653469592333"
img136.png,LS fiightships rank,"LS, Mari, Fellow, konn, Marian, cian, tables, Cad, beskre, eno","0.03784559667110443, 0.009950046427547932, 0.004983691964298487, 0.004868244286626577, 0.004681744612753391, 0.004067570436745882, 0.003942424431443214, 0.00386617099866271, 0.0035477979108691216, 0.0032303070183843374"
img137.png,Cad estimated botoken Male,"Cad, LS, lod, Fellow, ilia, Person, eno, konn, calculations, lés","0.006169863976538181, 0.004996508359909058, 0.004977028351277113, 0.004174739122390747, 0.0032640150748193264, 0.002983551472425461, 0.002971919719129801, 0.002914437558501959, 0.002425610087811947, 0.0023786944802850485"
img138.png,LS compensuche furlus,"LS, Fellow, Rub, dem, Person, rub, fallen, tick, Нов, isse","0.005331031046807766, 0.0041680606082081795, 0.0029325971845537424, 0.0028984311502426863, 0.0028202510438859463, 0.0027334808837622404, 0.0025478843599557877, 0.0023656305857002735, 0.0022928479593247175, 0.0022485002409666777"
img139.png,Fellow ruborogal chef,"Fellow, functions, konn, Cad, Mari, Gal, fellow, lod, nja, Jam","0.006677547469735146, 0.0053238049149513245, 0.00526178115978837, 0.0037166147958487272, 0.0032799008768051863, 0.0032039221841841936, 0.002827451564371586, 0.0026874546892941, 0.0026874546892941, 0.002466147067025304"
img140.png,anal driinuruntimeoka,"anal, rival, lau, rikt, Fellow, cí, Cad, LS, ikal, Mari","0.0044932374730706215, 0.003418274689465761, 0.003016616916283965, 0.002867253730073571, 0.002672574482858181, 0.0025903480127453804, 0.0025106510147452354, 0.002500863280147314, 0.002405056729912758, 0.0021474738605320454"
img141.png,nja fi fi cum Mari,"nja, konn, ASE, uli, beskre, LS, Mari, permut, SOUR, cí","0.005886754486709833, 0.00451353145763278, 0.0039676483720541, 0.003515141550451517, 0.0034741887357085943, 0.0029716312419623137, 0.002632719464600086, 0.0025219907984137535, 0.0024443971924483776, 0.0023877730127424"
img142.png,Fellowlau️️ capit,"Fellow, konn, LS, Mari, anal, SOUR, lab, gal, buch, functions","0.009461206384003162, 0.004629070870578289, 0.0034132630098611116, 0.0031815110705792904, 0.0026582516729831696, 0.002586549846455455, 0.002264858689159155, 0.002229745499789715, 0.0019754450768232346, 0.0019600719679147005"
img143.png,LS fur tonights reverse,"LS, Fellow, konn, anal, buch, Sar, IGN, rikt, ikal, lab","0.014492307789623737, 0.008354805409908295, 0.0043344153091311455, 0.003961976617574692, 0.0033233119174838066, 0.0026808076072484255, 0.0025580443907529116, 0.002460047136992216, 0.0023110006004571915, 0.002128993161022663"
img144.png,Fellowoci Mariociermann,"Fellow, Mari, konn, anal, Cad, LS, Marian, Wagner, Prop, SOUR","0.011642182245850563, 0.011109048500657082, 0.005696154199540615, 0.0048531838692724705, 0.004401646554470062, 0.0039610532112419605, 0.0034548919647932053, 0.0032077585346996784, 0.00298995990306139, 0.0024787636939436197"
img145.png,LS compensrache TRUE text,"LS, Mari, Fellow, ikal, Marian, gal, fellow, Jam, turno, once","0.00987159926444292, 0.005263286177068949, 0.004245721735060215, 0.0037176781333982944, 0.003118393709883094, 0.003094126470386982, 0.0030700473580509424, 0.0029989301692694426, 0.002719911513850093, 0.0024959309957921505"
img146.png,konn curr Mari Maria chance,"konn, lab, ikal, beskre, Mari, eken, gor, SOUR, eno, Cad","0.012514070607721806, 0.006341821979731321, 0.0038165757432579994, 0.003627604339271784, 0.0031517173629254103, 0.0029377234168350697, 0.0028473390266299248, 0.0027597357984632254, 0.0027169501408934593, 0.0026026787236332893"
img147.png,ikaloken стIALrunner,"ikal, konn, LS, tables, Geg, anal, ading, fellow, Marian, ník","0.011278660967946053, 0.008922155015170574, 0.007751702796667814, 0.00494656665250659, 0.0043313587084412575, 0.004165426827967167, 0.004037270322442055, 0.003231390379369259, 0.0031937435269355774, 0.002942214487120509"
img148.png,Fellowедеkiemolo Commission,"Fellow, anal, ikal, Person, Military, LS, Sv, sail, Hockey, Mari","0.006567670032382011, 0.006003336515277624, 0.0038308880757540464, 0.003354437882080674, 0.0032133543863892555, 0.002869202522560954, 0.0027700846549123526, 0.0026226635091006756, 0.002369379159063101, 0.002332645235583186"
img149.png,Fellowoci Marieno zach,"Fellow, ikal, LS, nja, anal, opport, lés, konn, ikai, reiche","0.009504321962594986, 0.009211904369294643, 0.004760441370308399, 0.00441992050036788, 0.0041683814488351345, 0.0037219456862658262, 0.0031587742269039154, 0.002921388717368245, 0.0027443908620625734, 0.002670365385711193"
img150.png,Cad reverse gamzahlﬁ,"Cad, Fellow, LS, nja, eno, cí, Sta, kou, fellow, values","0.01142493449151516, 0.009324760176241398, 0.007093903608620167, 0.006769049912691116, 0.0047812615521252155, 0.004491579718887806, 0.0039176251739263535, 0.0039023521821945906, 0.003222550731152296, 0.002945649903267622"
img151.png,LS compens síimonolin,"LS, konn, Fellow, anal, SOUR, Person, domin, beskre, ECT, dp","0.020205900073051453, 0.006585570052266121, 0.004669868852943182, 0.004153467249125242, 0.003062574425712228, 0.002956776414066553, 0.002854633145034313, 0.0027885057497769594, 0.0027239101473242044, 0.0026816800236701965"
img152.png,Fellow Cad Buch Vin ton,"Fellow, LS, Cad, konn, Mari, Release, SOUR, accum, ikal, Ces","0.010824368335306644, 0.008202641271054745, 0.004955757409334183, 0.0038145824801176786, 0.003625709330663085, 0.0034461880568414927, 0.002736828988417983, 0.002541059860959649, 0.002443713368847966, 0.0023964475840330124"
img153.png,konn curragas mari Mari,"konn, beskre, ikal, Fellow, LS, ậ, anal, gal, Point, once","0.016464171931147575, 0.008182255551218987, 0.004924168344587088, 0.003267415100708604, 0.0032293484546244144, 0.0026357173919677734, 0.0025150193832814693, 0.002495446940883994, 0.002362641738727689, 0.0020768954418599606"
img154.png,LSskogoci fifd,"LS, anal, Person, ikal, kou, konn, berga, Cad, Anal, squ","0.012224139645695686, 0.0036991392262279987, 0.002983975224196911, 0.0029262597672641277, 0.0029148515313863754, 0.00266439002007246, 0.0025925226509571075, 0.0025225935969501734, 0.0024932045489549637, 0.0024932045489549637"
img155.png,Fellowlauuche partiellementzan,"Fellow, LS, NI, marqu, anal, Bevölker, Mari, Compat, function, ikal","0.004449689760804176, 0.004380703903734684, 0.00364594510756433, 0.003411695593968034, 0.003155302256345749, 0.0025552420411258936, 0.0025058190803974867, 0.002486318349838257, 0.002447771839797497, 0.0023448218125849962"
img156.png,anal HDrun hal Mari,"anal, LS, Fellow, Person, functions, accum, once, konn, narr, buch","0.007386006414890289, 0.0067513566464185715, 0.0038618631660938263, 0.003670648904517293, 0.0036420838441699743, 0.002759949304163456, 0.0027171603869646788, 0.002542584203183651, 0.0021832992788404226, 0.0021747874561697245"
img157.png,Fellowlau reputationoremaza,"Fellow, Mari, konn, ikal, LS, once, Person, Jar, rikt, SOUR","0.013459454290568829, 0.012351089157164097, 0.006585287861526012, 0.00527079775929451, 0.003209413029253483, 0.0024800419341772795, 0.0024800419341772795, 0.0021047843620181084, 0.0020884047262370586, 0.0020560272969305515"
img158.png,Fellowlauazakensberger,"Fellow, Cad, LS, anal, Jam, fellow, lab, Professional, calcul, 음","0.0094223041087389, 0.006839859299361706, 0.006301173474639654, 0.00512281758710742, 0.0036611128598451614, 0.0035903004463762045, 0.0030115493573248386, 0.0027313565369695425, 0.0024869285989552736, 0.0022821337915956974"
img159.png,Fellow [(omerеде fi,"Fellow, rikt, anal, ikal, LS, lab, SOUR, 智, nja, cí","0.014133318327367306, 0.004378297831863165, 0.0035180612467229366, 0.0034770744387060404, 0.0031535697635263205, 0.0029279901646077633, 0.0028938783798366785, 0.002624633489176631, 0.002573868492618203, 0.002484953263774514"
img160.png,ikalкло‹ partiellement Mari,"ikal, konn, Mari, LS, SOUR, nja, Fellow, lab, anal, lod","0.01209277380257845, 0.01136010978370905, 0.010713604278862476, 0.0071647316217422485, 0.00460786372423172, 0.004244963172823191, 0.0035054776817560196, 0.0022721649147570133, 0.0022633064072579145, 0.002176600508391857"
img161.png,konnoroShared estimatedania,"konn, LS, Fellow, beskre, ikal, rikt, uli, MC, lab, ommes","0.012171761132776737, 0.00788943748921156, 0.007155409082770348, 0.005550912581384182, 0.005443548317998648, 0.003967058379203081, 0.003936186898499727, 0.0031259667593985796, 0.003006212878972292, 0.002780292648822069"
