Image File,Inference Result,Top 10 Words,Top 10 Probabilities
img1.png,LSovi mari fifi,"LS, ikal, lab, konn, Fellow, Cad, Mari, SOUR, Sv, Glo","0.011230258271098137, 0.007718435954302549, 0.004051472991704941, 0.004035677760839462, 0.00350625766441226, 0.0033067157492041588, 0.003242758335545659, 0.0032301158644258976, 0.002496040193364024, 0.002381738042458892"
img2.png,LSellig Fixmanlide,"LS, Fellow, konn, lab, beskre, Person, accum, once, pom, Mari","0.01243947260081768, 0.009316734038293362, 0.006279441062361002, 0.00613397778943181, 0.005185543559491634, 0.0032832820434123278, 0.0030484239105135202, 0.002841443754732609, 0.002669289242476225, 0.002256564563140273"
img3.png,Fellowoci Marinog partiellement,"Fellow, LS, rikt, konn, Cad, Mari, accum, Wagner, Person, Marian","0.012708245776593685, 0.011799206957221031, 0.007441666908562183, 0.006340379361063242, 0.005318319424986839, 0.0039061943534761667, 0.0029600905254483223, 0.002612270647659898, 0.002591941738501191, 0.002415955299511552"
img4.png,Fellowilis cum figresql,"Fellow, konn, ikal, LS, Tru, anal, lab, Mari, beskre, Cad","0.0057794335298240185, 0.005241718143224716, 0.00457190815359354, 0.004413969814777374, 0.004179062321782112, 0.003451057244092226, 0.0026563736610114574, 0.0026049946900457144, 0.002544649876654148, 0.0024567439686506987"
img5.png,konn Marianinjectitenisz,"konn, Fellow, rikt, kou, anal, LS, cí, ikal, Wagner, SOUR","0.009121108800172806, 0.00804935023188591, 0.005641345866024494, 0.005258312914520502, 0.00444527342915535, 0.003938294015824795, 0.003922940231859684, 0.0034350412897765636, 0.0034083097707480192, 0.0029960963875055313"
img6.png,Fellowlauoci complementila,"Fellow, anal, konn, rikt, LS, nja, Anal, rival, Mari, Sv","0.013835041783750057, 0.013305029831826687, 0.007319089025259018, 0.005524738691747189, 0.0037528560496866703, 0.003273299429565668, 0.0031479010358452797, 0.0027349437586963177, 0.0025893927086144686, 0.0025294094812124968"
img7.png,Fellow Lamzanеде zoom,"Fellow, Mari, LS, Person, Ep, ikal, accum, rikt, Prop, Mind","0.009804331697523594, 0.004167663399130106, 0.0039304811507463455, 0.003335756016895175, 0.003145917085930705, 0.0027654387522488832, 0.0026908456347882748, 0.00257767247967422, 0.002459632232785225, 0.0024026548489928246"
img8.png,Fellow Cad nahodb [(,"Fellow, Cad, beskre, LS, anal, accum, narr, Mari, ikal, Glo","0.009392650797963142, 0.0075177839025855064, 0.006232460495084524, 0.006135836243629456, 0.00516689196228981, 0.004930282477289438, 0.004217094276100397, 0.003930763807147741, 0.003085292177274823, 0.0030138210859149694"
img9.png,FellowlauociDone gam,"Fellow, LS, anal, Cad, narr, rival, Jon, Mari, lab, fellow","0.012148959562182426, 0.007031278684735298, 0.005716388579457998, 0.0035632781218737364, 0.0032066036947071552, 0.002648003865033388, 0.0025967867113649845, 0.002487569348886609, 0.002022379543632269, 0.001983263064175844"
img10.png,LS fili texticker,"LS, Fellow, anal, rikt, Mari, konn, SOUR, Marian, ECT, functions","0.006797412410378456, 0.006410570349544287, 0.004599359352141619, 0.00420415448024869, 0.004043096210807562, 0.0033127942588180304, 0.0030045739840716124, 0.0027896524406969547, 0.002672323491424322, 0.002349122893065214"
img11.png,LS compensﬁ gam extr,"LS, rikt, Cad, ikal, Mari, konn, lab, Fellow, IGN, Jam","0.006797523703426123, 0.006718330550938845, 0.006692138034850359, 0.006069505587220192, 0.006069505587220192, 0.005724089220166206, 0.003624267177656293, 0.0035960630048066378, 0.0033650181721895933, 0.0032870678696781397"
img12.png,Schwezanonian kraján,"Schwe, orr, ikal, konn, gal, Person, Geg, ník, Fellow, Marian","0.006006408017128706, 0.005959665402770042, 0.004343186039477587, 0.004001130349934101, 0.0035865898244082928, 0.0034626899287104607, 0.003152814693748951, 0.003055812790989876, 0.003020211588591337, 0.002950248308479786"
img13.png,ikaloloază Facebookene,"ikal, LS, rikt, turno, permut, Fellow, kou, Marian, nja, rival","0.006741697899997234, 0.0038714315742254257, 0.003594502341002226, 0.003376722801476717, 0.0030268747359514236, 0.002799401292577386, 0.002734553534537554, 0.002681662328541279, 0.002681662328541279, 0.0024995841085910797"
img14.png,Fellowoci Marimansischer,"Fellow, tables, Mari, once, konn, LS, accum, fellow, narr, lab","0.010896310210227966, 0.009960033930838108, 0.00558707257732749, 0.005147052928805351, 0.004892204888164997, 0.004668174311518669, 0.004506910219788551, 0.0031586445402354, 0.0028647661674767733, 0.0027335789054632187"
img15.png,Fellowoci Mariociiod,"Fellow, LS, Cad, Mind, anal, lau, rival, lab, Mari, cí","0.019996102899312973, 0.011618150398135185, 0.009898788295686245, 0.005684395786374807, 0.00531917717307806, 0.0037866239435970783, 0.0033678931649774313, 0.003302752273157239, 0.0024736470077186823, 0.002464003162458539"
img16.png,Mariiot voisręride,"Mari, ikal, LS, Fellow, nja, ník, Jam, anal, SOUR, cí","0.01789538934826851, 0.008289684541523457, 0.008193106390535831, 0.007817916572093964, 0.005127115175127983, 0.004650091286748648, 0.004419849254190922, 0.0038701496087014675, 0.0032717478461563587, 0.00251835398375988"
img17.png,Fellowoci Mariręeln,"Fellow, LS, Mari, accum, Cad, functions, lau, lab, konn, cí","0.01079163420945406, 0.010137801989912987, 0.0075044031254947186, 0.004940770100802183, 0.004659589845687151, 0.004533905535936356, 0.004242605064064264, 0.00416054530069232, 0.00371494865976274, 0.0027607157826423645"
img18.png,once vac Mari certiani,"once, beskre, Fellow, narr, konn, twice, eno, gouvern, designated, Cov","0.0084191570058465, 0.006256586406379938, 0.004266621079295874, 0.004103169310837984, 0.0039152721874415874, 0.00265957391820848, 0.0024215697776526213, 0.0023840267676860094, 0.0023288007359951735, 0.002310677897185087"
img19.png,FellowriteClassLoader criminalIAL,"Fellow, Mari, anal, Jon, lés, ikal, konn, lau, fellow, opport","0.013337377458810806, 0.008249079808592796, 0.005409879609942436, 0.0033854153007268906, 0.003294099820777774, 0.0027847669553011656, 0.0024006192106753588, 0.0023267597425729036, 0.002194343600422144, 0.0021603235509246588"
img20.png,ikalirst totalité mari opt,"ikal, LS, kou, Fellow, konn, reiche, ikai, lava, nja, anal","0.01447764877229929, 0.013814669102430344, 0.00518236868083477, 0.004213235806673765, 0.004051829222589731, 0.003776720492169261, 0.00353406835347414, 0.0025654584169387817, 0.002525684656575322, 0.002391270361840725"
img21.png,LSskog mariundenangu,"LS, Fellow, lab, anal, Sv, Cad, Glo, Mari, SOUR, konn","0.026485148817300797, 0.01342201977968216, 0.010453080758452415, 0.006828571204096079, 0.005174649879336357, 0.004674906376749277, 0.0036408209707587957, 0.0035150472540408373, 0.003367208642885089, 0.003327979939058423"
img22.png,anal complедеazanitz,"anal, konn, gal, ník, Mari, SOUR, LS, Fellow, lab, rikt","0.00517761567607522, 0.004463383462280035, 0.00424238620325923, 0.0033298872876912355, 0.0032782622147351503, 0.0029616625979542732, 0.0027605732902884483, 0.0027284116949886084, 0.002484247088432312, 0.0023704851046204567"
img23.png,functions krajbegoka Para,"functions, anal, Release, Fellow, LS, Release, zh, жу, accum, lava","0.01057341881096363, 0.005093037616461515, 0.004673634190112352, 0.004373356234282255, 0.00407641613855958, 0.0034596093464642763, 0.003340095281600952, 0.0028236506041139364, 0.002482148353010416, 0.002207668498158455"
img24.png,konn pecliplip totalité,"konn, reputation, ikal, tables, Male, Ces, gouvern, gal, lab, Fellow","0.006354041863232851, 0.003945314325392246, 0.0034411640372127295, 0.0031950129196047783, 0.002597527112811804, 0.002537355525419116, 0.0024785776622593403, 0.0024497013073414564, 0.0024401508271694183, 0.002365075284615159"
img25.png,Fellowusalem cal cert Mari,"Fellow, konn, Mari, LS, eno, ikal, anal, cot, Jam, narr","0.009304025210440159, 0.006546199321746826, 0.0061017288826406, 0.005239512305706739, 0.004534419625997543, 0.0032660202123224735, 0.003116458188742399, 0.002262305933982134, 0.0022272320929914713, 0.002201284281909466"
img26.png,LSskogoci fi Mari,"LS, rikt, konn, lés, ECT, turno, SOUR, beskre, Cad, squ","0.02339545078575611, 0.013382499106228352, 0.013382499106228352, 0.004327723756432533, 0.003745332593098283, 0.003504697233438492, 0.0028941684868186712, 0.002805124269798398, 0.00276163499802351, 0.002740143798291683"
img27.png,LS compensberger num cert,"LS, Fellow, Jon, rikt, ikal, konn, ls, Wagner, olid, pent","0.010479788295924664, 0.008290194906294346, 0.004300896544009447, 0.003635892877355218, 0.003455867525190115, 0.0032591931521892548, 0.003037902293726802, 0.002733816159889102, 0.0023566968739032745, 0.0023201596923172474"
img28.png,ikalpowrollo ст FM,"ikal, Fellow, Jam, LS, konn, anal, Person, reiche, lab, Cad","0.008126167580485344, 0.005762315820902586, 0.0043666479177773, 0.0043496242724359035, 0.004215800203382969, 0.0033480252604931593, 0.003207211848348379, 0.002897474681958556, 0.00257706712000072, 0.002478341106325388"
img29.png,konnlauazaaza‹,"konn, ikai, anal, kou, ikal, turno, LS, rikt, beskre, comput","0.017834315076470375, 0.0045981574803590775, 0.004302728921175003, 0.003963859751820564, 0.0030750217847526073, 0.002799839014187455, 0.002640499733388424, 0.0025393436662852764, 0.00249022850766778, 0.0023120988626033068"
img30.png,LS compensolanloatsono,"LS, Fellow, ikal, uli, ník, dispon, gouvern, konn, anal, ikai","0.012149287387728691, 0.009388241916894913, 0.006554048508405685, 0.003071820829063654, 0.002786020515486598, 0.002753562293946743, 0.00264807534404099, 0.0025867323856800795, 0.0025169597938656807, 0.0024876364041119814"
img31.png,LS compens Sv partiellement ort,"LS, Fellow, konn, anal, functions, lau, rival, ikal, udi, Cad","0.010131959803402424, 0.009333998896181583, 0.0069093964993953705, 0.0068022762425243855, 0.004996129777282476, 0.0036983333993703127, 0.003528974251821637, 0.003433786565437913, 0.002824555616825819, 0.0025818527210503817"
img32.png,LS Fore partiellementuga ст,"LS, konn, ikal, ECT, eno, Prop, ikai, kou, cí, Fellow","0.018532417714595795, 0.007517080754041672, 0.005521138198673725, 0.003620850620791316, 0.003578666364774108, 0.003245709929615259, 0.0030135393608361483, 0.0029900879599153996, 0.002765379147604108, 0.002319604391232133"
img33.png,LS Dirila correct accident,"LS, Cad, nja, zal, ilia, orr, konn, rival, sin, sin","0.027047395706176758, 0.006628249306231737, 0.00429626926779747, 0.004115573130548, 0.0036747935228049755, 0.0035617323592305183, 0.0032684290781617165, 0.0029412677977234125, 0.0027847362216562033, 0.0026676140259951353"
img34.png,anal driinu hur�,"anal, LS, Glo, Fellow, lab, Prop, Marian, IGN, Mari, konn","0.00951460748910904, 0.009257967583835125, 0.006933897268027067, 0.004424703773111105, 0.0037698945961892605, 0.003137584775686264, 0.0031131678260862827, 0.002747361082583666, 0.0027153531555086374, 0.002591008087620139"
img35.png,konn Mariangravitysonoitle,"konn, Fellow, ikal, LS, opport, beskre, lab, 流, gal, nja","0.015417858958244324, 0.008581330999732018, 0.006895293015986681, 0.00520484009757638, 0.0034943644423037767, 0.0032698537688702345, 0.0030123302713036537, 0.0026897082570940256, 0.0024110390804708004, 0.0022561312653124332"
img36.png,LS compensocitatussen,"LS, Rub, tables, lava, ikal, accum, Glo, eno, Tables, onian","0.02348862960934639, 0.007595912553369999, 0.005778664723038673, 0.00443065632134676, 0.004260920453816652, 0.0031912820413708687, 0.003178840270265937, 0.0031541024800390005, 0.002974601462483406, 0.0027084057219326496"
img37.png,Mariulpermannempor Gru,"Mari, ikal, anal, Release, Person, LS, def, Rub, narr, Prop","0.0070092384703457355, 0.005188516341149807, 0.004025067202746868, 0.003429400036111474, 0.0034160299692302942, 0.003098204731941223, 0.0029448021668940783, 0.002921885112300515, 0.0027772127650678158, 0.002528680954128504"
img38.png,Fellowlauucheyo suggested,"Fellow, konn, LS, anal, ikal, Mari, beskre, lés, kou, narr","0.010957957245409489, 0.007186403963714838, 0.006751001812517643, 0.004410154651850462, 0.004031207878142595, 0.0037869689986109734, 0.0033681998029351234, 0.0027276515029370785, 0.0026958731468766928, 0.002464227844029665"
img39.png,konn Marian gravity Mariraum,"konn, Fellow, anal, beskre, rikt, Cad, ento, Wagner, 음, rival","0.010134761221706867, 0.006147043779492378, 0.0051160235889256, 0.004257932770997286, 0.0024451252538710833, 0.002351453760638833, 0.002333154669031501, 0.0023149980697780848, 0.0022437728475779295, 0.0021326758433133364"
img40.png,konnndernogoviixon,"konn, LS, rikt, ikal, functions, ikai, Fellow, rival, calculations, eken","0.005531412083655596, 0.005095775704830885, 0.005036408081650734, 0.004805774427950382, 0.00422454671934247, 0.003277253359556198, 0.003277253359556198, 0.0028141546063125134, 0.002664388157427311, 0.002664388157427311"
img41.png,LSrettoazaputationaza,"LS, Cad, Fellow, Mari, Marian, functions, cad, gal, fellow, uli","0.022267820313572884, 0.011642999947071075, 0.007314519956707954, 0.004384793806821108, 0.004350671079009771, 0.00426652142778039, 0.003455134341493249, 0.003220539540052414, 0.002966900123283267, 0.002669920912012458"
img42.png,LSaterraolousqunder,"LS, konn, lau, Fellow, anal, Person, ikal, SOUR, lod, nja","0.01618996076285839, 0.006775394082069397, 0.005529915913939476, 0.0045487843453884125, 0.004443411715328693, 0.0038605034351348877, 0.0033671909477561712, 0.002971535548567772, 0.0029599503614008427, 0.002769775688648224"
img43.png,LS fiightsgraph konn,"LS, konn, beskre, Mari, nja, ikal, Jam, zik, once, dp","0.006677608005702496, 0.00511989975348115, 0.0041787405498325825, 0.003804786130785942, 0.0031175303738564253, 0.003093269420787692, 0.0029401108622550964, 0.0028496533632278442, 0.0028164538089185953, 0.0025544126983731985"
img44.png,lavaigos complement Canal Fiche,"lava, Fellow, ikai, ikal, LS, Jah, lau, Cad, lés, accum","0.01081936527043581, 0.007012847810983658, 0.0053769368678331375, 0.003980222623795271, 0.0036524569150060415, 0.003485199064016342, 0.003391191828995943, 0.0032612772192806005, 0.0031241122633218765, 0.0028113964945077896"
img45.png,LSaterraegr Yu Jap,"LS, anal, Fellow, cí, rikt, konn, ikal, functions, Prop, rival","0.01347421482205391, 0.006644215434789658, 0.006144894286990166, 0.0037270665634423494, 0.003556392388418317, 0.003460464533418417, 0.003263528924435377, 0.0032381319906562567, 0.0031879295129328966, 0.003089847043156624"
img46.png,LS compensiani complement Zob,"LS, Fellow, anal, Person, SOUR, Mari, alin, konn, rikt, Jam","0.009314415976405144, 0.008414873853325844, 0.0039749047718942165, 0.0037633643951267004, 0.0033211575355380774, 0.003083590418100357, 0.002764112548902631, 0.002606806345283985, 0.0022825959604233503, 0.002161118434742093"
img47.png,LS compensﬁ mariories,"LS, Fellow, edo, Jam, turno, Magazine, functions, Cad, anal, Mari","0.017491867765784264, 0.0093627218157053, 0.00432018656283617, 0.004011157434433699, 0.0038424532394856215, 0.003210489870980382, 0.003075461136177182, 0.0030159763991832733, 0.0029346253722906113, 0.0027247073594480753"
img48.png,Fellowrę cum amor partiellement,"Fellow, ikal, Í, Mari, functions, Wagner, anal, ico, LS, Cad","0.004614133387804031, 0.0041685220785439014, 0.0034289327450096607, 0.0033626114018261433, 0.0032847165130078793, 0.0029907685238868, 0.0029214874375611544, 0.002910097362473607, 0.0028426852077245712, 0.0025581398513168097"
img49.png,LSébenarksytusk,"LS, zik, Cad, konn, Fellow, rikt, Person, cian, ník, nja","0.012239105068147182, 0.00594160845503211, 0.00594160845503211, 0.005367795936763287, 0.003911852836608887, 0.0035340648610144854, 0.002795675303786993, 0.002476830966770649, 0.002476830966770649, 0.002202939009293914"
img50.png,ikal somehowride Father Mari,"ikal, similarity, wich, anson, erson, comput, clin, narr, zh, Sak","0.004551755730062723, 0.003954634070396423, 0.0038781443145126104, 0.003671753453090787, 0.003531091148033738, 0.0032913386821746826, 0.003202560357749462, 0.0028262496925890446, 0.0027933227829635143, 0.0027715847827494144"
img51.png,LS asi comerrizoken,"LS, domin, ikal, accum, tables, once, Fellow, konn, Í, Correct","0.013525888323783875, 0.004785272758454084, 0.004374093841761351, 0.0039056260138750076, 0.0036689958069473505, 0.003640443552285433, 0.0033800373785197735, 0.003288866486400366, 0.002453644061461091, 0.002234068466350436"
img52.png,labanson️enooci,"lab, Fellow, functions, konn, Mari, LS, Tru, ECT, Wagner, Graph","0.008349708281457424, 0.007086305879056454, 0.005064354278147221, 0.0050053526647388935, 0.004593169782310724, 0.004575262777507305, 0.004231425933539867, 0.0036907156463712454, 0.0031078942120075226, 0.002988832537084818"
img53.png,LSskogoci fifd,"LS, Fellow, ikai, konn, lab, beskre, ikal, narr, anal, edo","0.019789356738328934, 0.006628604140132666, 0.004485137760639191, 0.004083764273673296, 0.003618014743551612, 0.0035619225818663836, 0.003548036329448223, 0.0033988102804869413, 0.002839812310412526, 0.002646996406838298"
img54.png,Fellowlau narrnde gam,"Fellow, konn, LS, ikal, once, eno, Geg, Person, Cad, tables","0.007939033210277557, 0.006379192229360342, 0.005808320362120867, 0.005651651415973902, 0.002638548379763961, 0.0024883884470909834, 0.0024118286091834307, 0.0021874336525797844, 0.0021789055317640305, 0.0021704109385609627"
img55.png,LSaterra coll nichhnen,"LS, Fellow, konn, rikt, lab, Cad, Mari, rival, anal, eken","0.011223029345273972, 0.008912894874811172, 0.007389049977064133, 0.006222203839570284, 0.00417739013209939, 0.003615229856222868, 0.003382953582331538, 0.0032029158901423216, 0.0029049187432974577, 0.002859882079064846"
img56.png,Fellow rub valor partiellement compens,"Fellow, Mari, anal, LS, Person, fellow, Í, berga, konn, ikal","0.009850889444351196, 0.005813704803586006, 0.004122533835470676, 0.0033125493209809065, 0.0033125493209809065, 0.002969349967315793, 0.0029462422244250774, 0.0026617080438882113, 0.0026409944985061884, 0.002423512749373913"
img57.png,LSskog Mari Marian complement,"LS, rikt, konn, anal, Fellow, Cad, Í, lava, ettings, SOUR","0.008666129782795906, 0.005886747036129236, 0.0058409362100064754, 0.004478400573134422, 0.0043236929923295975, 0.003584467340260744, 0.003487782320007682, 0.003006656188517809, 0.0027483063749969006, 0.002415916183963418"
img58.png,LSwad TRUE￼ balance,"LS, konn, onian, ikal, ikai, kou, tables, Geg, 里, Cad","0.02317120134830475, 0.010004814714193344, 0.005439523607492447, 0.004819150548428297, 0.004562679678201675, 0.0037239508237689734, 0.003609376959502697, 0.003609376959502697, 0.003039400093257427, 0.002911567222326994"
img59.png,Fellow Cad Гор outsidesono,"Fellow, LS, anal, Rub, ikal, kou, accum, rikt, Person, fellow","0.011612769216299057, 0.009515161626040936, 0.005977741442620754, 0.003379508387297392, 0.0028236848302185535, 0.0026629886124283075, 0.0024058097042143345, 0.002377781318500638, 0.002377781318500638, 0.00225123786367476"
img60.png,LS Dir Mari ride Symbol,"LS, konn, Fellow, Cad, beskre, cí, lab, ikai, once, Mari","0.022137785330414772, 0.014071631245315075, 0.007561481557786465, 0.0059119355864822865, 0.004047369118779898, 0.004000215791165829, 0.003892317181453109, 0.003530178451910615, 0.003408226417377591, 0.002685618121176958"
img61.png,LS Schwelemьcolon,"LS, Jam, ilia, Fellow, nja, narr, Mari, konn, zal, Gal","0.013476054184138775, 0.0057284533977508545, 0.005236230790615082, 0.005114933475852013, 0.004077980760484934, 0.003488081507384777, 0.0033939967397600412, 0.0033153744880110025, 0.003114506136626005, 0.0029602963477373123"
img62.png,Cadadoroci Pom mari,"Cad, opport, Fellow, Jam, anal, ikal, cí, Master, Sv, LS","0.005926710553467274, 0.005438655149191618, 0.004951952025294304, 0.004491225350648165, 0.00431916955858469, 0.003856583731248975, 0.0034301169216632843, 0.0033637722954154015, 0.0031476521398872137, 0.0030389148741960526"
img63.png,beskreIMA resistoud imper,"beskre, LS, Mari, SOUR, anal, kou, Release, yan, konn, Fellow","0.007587232161313295, 0.006695708725601435, 0.003597981994971633, 0.0034601453226059675, 0.003175207879394293, 0.002994506387040019, 0.0029365874361246824, 0.002726529026404023, 0.0026323397178202868, 0.0024155706632882357"
img64.png,Mari botationalixonanha,"Mari, Fellow, Jam, LS, kou, lod, Sv, konn, Marian, anal","0.012547438964247704, 0.006902338936924934, 0.0052922070026397705, 0.003994767088443041, 0.003723532659932971, 0.003651512786746025, 0.0035253693349659443, 0.002980278106406331, 0.0027887970209121704, 0.002640379825606942"
img65.png,LS Dirli Pon Vlad,"LS, Fellow, Cad, anal, Release, ECT, konn, zik, Release, Person","0.007689738180488348, 0.007337599527090788, 0.004213628824800253, 0.004068066831678152, 0.0038066962733864784, 0.0034796022810041904, 0.0033463009167462587, 0.002941587008535862, 0.002806881908327341, 0.0027633653953671455"
img66.png,FellowumerateembergisteFX,"Fellow, Cad, LS, konn, ikal, kou, lés, beskre, Person, rival","0.024732083082199097, 0.009387239813804626, 0.006426596082746983, 0.005307064391672611, 0.005286374129354954, 0.004966088570654392, 0.0047386749647557735, 0.004005982540547848, 0.003119862172752619, 0.002988644875586033"
img67.png,Fellowocinats partiellementanson,"Fellow, ikal, LS, Í, lau, functions, Mari, beskre, Male, gal","0.007651919964700937, 0.004445924423635006, 0.0036428601015359163, 0.002973215887323022, 0.0028930180706083775, 0.002493937499821186, 0.002484214724972844, 0.002417206997051835, 0.0021837647072970867, 0.002133177826181054"
img68.png,Jamikai rokelnimon,"Jam, ikal, LS, Fellow, konn, SOUR, Mari, narr, functions, Britann","0.014130441471934319, 0.006833035498857498, 0.004733105190098286, 0.003558806609362364, 0.0034899727907031775, 0.00336941028945148, 0.003008544445037842, 0.002644680207595229, 0.0025235717184841633, 0.0022270441986620426"
img69.png,LS先esteraguischer,"LS, anal, Fellow, Cad, Í, Maria, ader, lab, berga, dz","0.006391454953700304, 0.0038766134530305862, 0.003515935968607664, 0.0031149464193731546, 0.0027275383472442627, 0.002602635184302926, 0.0024449494667351246, 0.0023148315958678722, 0.0021325228735804558, 0.002115927403792739"
img70.png,LSaterrakensarget Mari,"LS, cian, turno, Sv, ikal, zik, beskre, Fellow, rikt, accum","0.01901467703282833, 0.0042097307741642, 0.0041769701056182384, 0.0038031747099012136, 0.003531128168106079, 0.003489989321678877, 0.0033694258891046047, 0.0029388656839728355, 0.0024651247076690197, 0.002436405047774315"
img71.png,LSaterraegrulprę,"LS, Fellow, konn, anal, nja, tables, ikal, Person, ník, lab","0.00927593745291233, 0.005850260145962238, 0.004164692480117083, 0.003675328101962805, 0.003493349999189377, 0.003425782546401024, 0.003294543130323291, 0.002785141346976161, 0.0027100169099867344, 0.0022118515335023403"
img72.png,Fellowociextract Foreizo,"Fellow, ikal, konn, rikt, LS, tables, fellow, beskre, Mari, reiche","0.016971716657280922, 0.006938023958355188, 0.005911269690841436, 0.005075966473668814, 0.0046398090198636055, 0.004126731306314468, 0.004015420563519001, 0.0027382788248360157, 0.002416522242128849, 0.002305861795321107"
img73.png,LSextractпі radiodriver,"LS, Jam, nja, native, Fellow, <0xC5>, kou, turno, accum, orr","0.009369872510433197, 0.007325824815779924, 0.003250814974308014, 0.0031262782867997885, 0.0028354113455861807, 0.0026325900107622147, 0.002571606310084462, 0.002492486499249935, 0.0024442775174975395, 0.0024158006999641657"
img74.png,LS先ús fiensk,"LS, konn, Fellow, nja, Pic, Jam, Mari, Í, ikal, dimen","0.016025248914957047, 0.009494646452367306, 0.006973619572818279, 0.005647408775985241, 0.005559853743761778, 0.005284566897898912, 0.004484953358769417, 0.003689222037792206, 0.0035065561532974243, 0.003319940296933055"
img75.png,Fellowociociermann Mari,"Fellow, LS, anal, ECT, rikt, Cad, konn, ikal, uli, Naz","0.009171308018267155, 0.008383253589272499, 0.00426505459472537, 0.0037055432330816984, 0.003494660370051861, 0.0032446819823235273, 0.0031325931195169687, 0.003084026975557208, 0.0026585974264889956, 0.0024018422700464725"
img76.png,LSaterra correctlaus Mari,"LS, Fellow, erson, ikal, alin, kou, konn, Mari, Marse, lab","0.005080229137092829, 0.004228142090141773, 0.00377530581317842, 0.0035189720802009106, 0.0030693020671606064, 0.0028609042055904865, 0.002604882698506117, 0.0025247388985008, 0.0020525981672108173, 0.0020445960108190775"
img77.png,Fellowlaurachequitmans,"Fellow, LS, Mari, Cad, lab, squ, tables, Jam, lés, squ","0.010636061429977417, 0.007338661700487137, 0.004756740760058165, 0.004433769732713699, 0.0030711828731000423, 0.002896401099860668, 0.0025164370890706778, 0.002410598797723651, 0.0023918396327644587, 0.00233643245883286"
img78.png,konneni mie capit�,"konn, LS, kou, Cad, nja, beskre, ikal, anal, once, IGN","0.008335812948644161, 0.006594171281903982, 0.004585525952279568, 0.003876513335853815, 0.003557288320735097, 0.0035021379590034485, 0.003474883735179901, 0.0033548425417393446, 0.003114866092801094, 0.003066574689000845"
img79.png,LSabenideosono ss,"LS, konn, gal, beskre, rails, mé, Sv, anal, ading, rival","0.006984907668083906, 0.004154618363827467, 0.0025998936034739017, 0.002432851819321513, 0.002404508413746953, 0.0023672301322221756, 0.002189330058172345, 0.002189330058172345, 0.0021553875412791967, 0.0021386141888797283"
img80.png,LS先esternog scale,"LS, pom, konn, kou, Fellow, ikal, squ, dz, lab, Geg","0.016803937032818794, 0.005308288149535656, 0.004814408719539642, 0.004795638844370842, 0.0038234167732298374, 0.003705783048644662, 0.0032575917430222034, 0.0022041969932615757, 0.002078755758702755, 0.0020147990435361862"
img81.png,LSelligox estefi,"LS, rikt, Fellow, ikal, konn, lab, cot, IGN, SOUR, olid","0.005837372969835997, 0.004155518487095833, 0.003458529245108366, 0.003352121450006962, 0.003211135510355234, 0.0030165824573487043, 0.002651746151968837, 0.002321946667507291, 0.002224288647994399, 0.0021812671329826117"
