Image File,Inference Result,Top 10 Words,Top 10 Probabilities
img1.png,mor blankanhokrat Lomb,"mor, hip, konn, relev, riction, vac, conduct, hip, tek, iana","0.008707210421562195, 0.007990185171365738, 0.007684085518121719, 0.007476820610463619, 0.005078870803117752, 0.0043103815987706184, 0.00380389834754169, 0.003573431633412838, 0.0033832574263215065, 0.0032032039016485214"
img2.png,konn sop Us microlais,"konn, sg, ipp, goals, cs, elen, lais, Dragon, goal, realiz","0.008669756352901459, 0.006858342327177525, 0.005037308670580387, 0.004410814959555864, 0.0036000022664666176, 0.0028589824214577675, 0.002803684677928686, 0.0026857652701437473, 0.0025728056207299232, 0.0025428314693272114"
img3.png,jon Indep destineggi MP,"jon, SBN, atern, vac, motion, expect, andom, STR, experiment, Ze","0.004852178506553173, 0.003944793716073036, 0.003691342892125249, 0.0034812679514288902, 0.0034407097846269608, 0.0034139342606067657, 0.0031328019686043262, 0.0028082255739718676, 0.0027863718569278717, 0.0027431731577962637"
img4.png,stackConstraintserenech ti,"stack, andom, Ze, experiment, Assembly, Indep, Ze, idd, equilib, atern","0.006910501979291439, 0.006776840891689062, 0.00609849626198411, 0.005729007534682751, 0.005319203250110149, 0.004639491438865662, 0.0036845041904598475, 0.0033943243324756622, 0.0030905676539987326, 0.0029954807832837105"
img5.png,Zevierlaishtadel,"Ze, yw, Ze, experimental, assembly, motion, Sex, Assembly, Indep, ola","0.01447737030684948, 0.014252919703722, 0.007510760799050331, 0.005141940899193287, 0.003957892768085003, 0.0032940504606813192, 0.0032940504606813192, 0.0030824097339063883, 0.0026885257102549076, 0.0026262463070452213"
img6.png,motion feedlaisolisieve,"motion, Ze, virtual, riction, odb, konn, andom, Assembly, ray, SBN","0.009278567507863045, 0.007998624816536903, 0.005266156978905201, 0.005064414348453283, 0.004281355533748865, 0.003748880000784993, 0.0034401656594127417, 0.003386830911040306, 0.0033343229442834854, 0.0029888679273426533"
img7.png,experimental Indep seg Ze Ende,"experimental, experiment, expect, hip, cs, FS, Ze, Free, ierz, Constraints","0.014082483947277069, 0.00840903539210558, 0.007420947775244713, 0.006372316274791956, 0.003451061202213168, 0.0029174587689340115, 0.0028947549872100353, 0.0027730052825063467, 0.0026254288386553526, 0.0024760153610259295"
img8.png,Ze unitsola Killadt,"Ze, ango, yw, FS, cs, ether, Beat, konn, expect, mor","0.004420668352395296, 0.004120516125112772, 0.0036792068276554346, 0.003389444202184677, 0.002991174114868045, 0.002979512559249997, 0.0027023006696254015, 0.002608948154374957, 0.002394105540588498, 0.002329528797417879"
img9.png,Ze Killaga lay Kill,"Ze, assembly, assemble, bbe, ipp, Sele, expect, icher, STR, Assembly","0.0068311505019664764, 0.005553686060011387, 0.0031275285873562098, 0.003055079374462366, 0.002881214488297701, 0.002522875554859638, 0.002388610504567623, 0.0023792979773133993, 0.0023060948587954044, 0.002297104336321354"
img10.png,stackadtolas CirTD,"stack, experiment, andom, iana, Dragon, experimental, lais, mor, ola, eli","0.0048546018078923225, 0.00425083190202713, 0.004217751324176788, 0.0034830067306756973, 0.002967558801174164, 0.0029559892136603594, 0.0029101609252393246, 0.002853873185813427, 0.002744543133303523, 0.0027231848798692226"
img11.png,rictionlaisola rör Assembly,"riction, assemble, vez, assembly, ango, konn, mor, Bishop, hip, bb","0.005636814050376415, 0.0049550775438547134, 0.0048782555386424065, 0.003997099585831165, 0.0034727402962744236, 0.003405571449548006, 0.003392294514924288, 0.003262337762862444, 0.003224330022931099, 0.0032117594964802265"
img12.png,severigiivel Assemblyolas,"sever, hip, konn, VD, ames, cs, FS, lave, yw, assemble","0.008795162662863731, 0.005251831375062466, 0.004253063350915909, 0.003724106354638934, 0.0034308074973523617, 0.0033776178024709225, 0.00335133308544755, 0.0033382673282176256, 0.0030873927753418684, 0.002969116438180208"
img13.png,STRandomky Sing nick,"STR, yw, iana, expect, cs, Indep, hip, whole, stack, ola","0.007167649455368519, 0.006733383983373642, 0.0040206871926784515, 0.003989398013800383, 0.003806710010394454, 0.0037476925645023584, 0.0035621311981230974, 0.0033725581597536802, 0.002496501198038459, 0.0024386700242757797"
img14.png,VDolasMP Ze leg,"VD, vac, lean, ond, FS, mor, height, Ze, reet, fe","0.0076798624359071255, 0.005819753743708134, 0.005361407995223999, 0.005016941577196121, 0.004939161241054535, 0.004658072255551815, 0.004142974968999624, 0.003922490403056145, 0.0037137391045689583, 0.003599479328840971"
img15.png,andom Killandom光 Sea,"andom, quet, expect, experimental, ën, ante, riction, ieg, VD, konn","0.005199983716011047, 0.004809198901057243, 0.003687340533360839, 0.003587881103157997, 0.0033705022651702166, 0.002928343368694186, 0.002928343368694186, 0.0025943682994693518, 0.002494979416951537, 0.0024371834006160498"
img16.png,andom Kill stretchyj Assembly,"andom, sever, Bishop, atern, katol, ond, konn, Sele, mor, experimental","0.007144453469663858, 0.005166097544133663, 0.004470884799957275, 0.004200007300823927, 0.004134892486035824, 0.0035367608070373535, 0.0033616437576711178, 0.0032582166604697704, 0.0030968913342803717, 0.0030133582185953856"
img17.png,Zevezlaishtolas,"Ze, VD, expect, Ze, lay, cs, hav, isko, stack, fra","0.019416941329836845, 0.007753754500299692, 0.004739775322377682, 0.004540426656603813, 0.004505092743784189, 0.0044179558753967285, 0.004038339015096426, 0.00391409220173955, 0.0028636108618229628, 0.002669178880751133"
img18.png,rictionhtzec severiada,"riction, conduct, hip, sever, VD, conducted, expect, SB, Indep, sb","0.0065220315009355545, 0.00534396106377244, 0.004145655315369368, 0.004129493143409491, 0.004129493143409491, 0.0038944827392697334, 0.0037746622692793608, 0.003129304852336645, 0.0030687786638736725, 0.0030330263543874025"
img19.png,experimental Indep🌍 morcommon,"experimental, riction, virtual, bb, konn, aniu, andom, mor, assembly, hip","0.006827637553215027, 0.006591774057596922, 0.004898590501397848, 0.0048604691401124, 0.004222848452627659, 0.0039361282251775265, 0.0039054963272064924, 0.003237770637497306, 0.003237770637497306, 0.0030895022209733725"
img20.png,konnnek extern péritern,"konn, VD, goals, andom, expect, Ze, Constraints, lais, experiment, aar","0.006023169029504061, 0.005592322908341885, 0.004935207776725292, 0.004654344171285629, 0.0037692030891776085, 0.0037545079831033945, 0.0035825769882649183, 0.0033655192237347364, 0.002912614494562149, 0.002856279257684946"
img21.png,�cennek Indep rör,"<0xA3>, sever, Zw, ames, mor, zie, assemble, assembly, Sever, odn","0.004561419598758221, 0.004561419598758221, 0.00402543880045414, 0.003350267419591546, 0.0030984908808022738, 0.0030984908808022738, 0.002865635557100177, 0.002650279551744461, 0.0025787928607314825, 0.0025787928607314825"
img22.png,csahoavelolasht,"cs, cs, ola, yw, mor, riction, sever, Ze, expect, vac","0.021040545776486397, 0.014348405413329601, 0.007620381191372871, 0.006804234813898802, 0.006467333063483238, 0.005036764312535524, 0.0044973245821893215, 0.003571600653231144, 0.003488864516839385, 0.0031766474712640047"
img23.png,yw layieveopendorf,"yw, Assembly, experiment, experimental, Ze, assembly, ola, ipes, Assembly, VD","0.0063260942697525024, 0.006276863627135754, 0.005873579066246748, 0.004132579546421766, 0.004100419580936432, 0.0038519874215126038, 0.0033076750114560127, 0.003168558469042182, 0.0031316436361521482, 0.003047172911465168"
img24.png,yw Kill exped Babyari,"yw, andom, experimental, odb, cs, inkel, experiment, Indep, oda, rå","0.007878286764025688, 0.006765030324459076, 0.0034687628503888845, 0.003414984792470932, 0.003375199157744646, 0.003001964185386896, 0.0028533264994621277, 0.002722663339227438, 0.0025677159428596497, 0.0024887153413146734"
img25.png,laisせamen individually Micro,"lais, ola, Assembly, lay, experimental, eli, yw, andom, experiment, Ze","0.004254424478858709, 0.00407548900693655, 0.0035686176270246506, 0.003485950641334057, 0.003088381141424179, 0.0030405002180486917, 0.0030286465771496296, 0.0029354647267609835, 0.002845149952918291, 0.0027901199646294117"
img26.png,experimental Indep Sund Reinlea,"experimental, Ze, andom, yw, minus, Indep, atern, cs, atom, VD","0.005616581998765469, 0.005401414353400469, 0.004443082492798567, 0.004408505745232105, 0.003353814361616969, 0.0024441371206194162, 0.0024441371206194162, 0.0024441371206194162, 0.0023050406016409397, 0.002156943315640092"
img27.png,konn une personally stretch tut,"konn, FD, inkel, anh, vide, 法, odb, бург, andom, ragen","0.01223509106785059, 0.005734472069889307, 0.004885831382125616, 0.0032167471945285797, 0.0031422313768416643, 0.0029518534429371357, 0.0026876928750425577, 0.002584728877991438, 0.0025646144058555365, 0.0025646144058555365"
img28.png,Assemblyarian Assemblyadtzę,"Assembly, yw, assembly, sg, assemble, Assembly, assembly, alloc, Ze, rias","0.014569566585123539, 0.013580328784883022, 0.012173328548669815, 0.00715633062645793, 0.0064652059227228165, 0.004273239988833666, 0.003967569209635258, 0.003250909736379981, 0.0031632219906896353, 0.002622402971610427"
img29.png,ywirtual loads Killht,"yw, eli, andom, ango, 光, konn, Free, experiment, FS, Indep","0.010488881729543209, 0.006190228275954723, 0.00418851850554347, 0.003934748936444521, 0.0036248606629669666, 0.0033787416759878397, 0.002924057189375162, 0.0024623030330985785, 0.001851397566497326, 0.0018226942047476768"
img30.png,sgadtouwConstraints amb,"sg, VD, konn, Ze, sb, rias, `', tek, Zw, 光","0.007956349290907383, 0.007562403567135334, 0.00624500960111618, 0.005157111212611198, 0.0038776148576289415, 0.0033821158576756716, 0.003355796216055751, 0.00282586389221251, 0.0027176064904779196, 0.002407666062936187"
img31.png,assembleouvellesacoannelolas,"assemble, sever, hip, riction, expect, assembly, FS, ën, ray, lay","0.012613512575626373, 0.0056631905026733875, 0.004881975241005421, 0.004768884275108576, 0.003907483536750078, 0.0038770753890275955, 0.0031520400661975145, 0.0030670189298689365, 0.002926570363342762, 0.002814454957842827"
img32.png,Zevier unexpectedolanopp,"Ze, Indep, Ze, yw, atern, konn, sex, VD, ether, eli","0.010991234332323074, 0.005837400443851948, 0.005212212447077036, 0.00515148788690567, 0.004764347802847624, 0.004727271385490894, 0.004458241630345583, 0.0043379878625273705, 0.003186161397024989, 0.003028403501957655"
img33.png,VD externaff afivel,"VD, Assembly, mor, goals, goal, rias, assembly, vac, iana, yw","0.008113584481179714, 0.0062696924433112144, 0.005753392819315195, 0.004863804671913385, 0.004095734562724829, 0.003985258750617504, 0.0036713925655931234, 0.003202245570719242, 0.0023611877113580704, 0.0023611877113580704"
img34.png,Assembly teat ambnek som,"Assembly, andom, assembly, expect, destruction, `', aniu, Ze, validation, equilib","0.0058335368521511555, 0.005048505030572414, 0.004836171865463257, 0.0037371038924902678, 0.003389406017959118, 0.003349918406456709, 0.003026399062946439, 0.003026399062946439, 0.0028209141455590725, 0.0026603753212839365"
img35.png,Sele Press宿法 recom,"Sele, 光, Ze, Indep, Ze, katol, DAT, experiment, vac, experimental","0.00470865098759532, 0.004155369475483894, 0.0036243777722120285, 0.0030639772303402424, 0.0029581310227513313, 0.0027789068408310413, 0.0027680727653205395, 0.0026829082053154707, 0.0025700689293444157, 0.002550068311393261"
img36.png,experimentMP spir Reinuest,"experiment, stack, Constraints, mor, eri, Dragon, VD, experimental, konn, assemble","0.006002331618219614, 0.00480420608073473, 0.0036979292053729296, 0.003598183859139681, 0.002835300751030445, 0.002632487565279007, 0.0025415471754968166, 0.002463351935148239, 0.002434653230011463, 0.002287144772708416"
img37.png,konn宿 provin conflictta,"konn, ighth, stack, utes, Ze, elen, mor, drag, andom, height","0.011552263982594013, 0.010395913384854794, 0.006016692612320185, 0.00375047093257308, 0.0036779302172362804, 0.0033619003370404243, 0.003207947826012969, 0.0031582131050527096, 0.0029668668285012245, 0.0029553002677857876"
img38.png,lais reinolisNLierz,"lais, experiment, FS, Ze, yw, cs, Bishop, Constraints, hip, inho","0.006552834529429674, 0.005539637058973312, 0.004628540016710758, 0.004468644969165325, 0.00433115940541029, 0.003792489878833294, 0.003439638763666153, 0.0025862534530460835, 0.0024012550711631775, 0.0023732795380055904"
img39.png,iskoierz ho duringieve,"isko, andom, lais, Ze, konn, FS, assemble, alloc, peace, ola","0.012324469164013863, 0.01104758307337761, 0.005218508653342724, 0.004751506261527538, 0.002985054161399603, 0.0027392397169023752, 0.0024268317501991987, 0.0023247625213116407, 0.0023156991228461266, 0.0021839120890945196"
img40.png,VDsha destin forces нап,"VD, experiment, experimental, eli, ray, FD, expect, yw, 光, benchmark","0.018678372725844383, 0.008961981162428856, 0.006871390156447887, 0.005166574846953154, 0.004200396127998829, 0.003245814237743616, 0.0032331603579223156, 0.003145951312035322, 0.0030372729524970055, 0.0029785269871354103"
img41.png,konneren Kopinhoetten,"konn, riction, atern, assembly, aar, andom, assembly, yw, atabase, ether","0.005233408883213997, 0.004355629440397024, 0.004075782839208841, 0.003950383979827166, 0.003904360579326749, 0.0033789428416639566, 0.0033789428416639566, 0.0033265568781644106, 0.0030526204500347376, 0.00291283056139946"
img42.png,ywNLlaishtivel,"yw, andom, ola, tek, cs, riction, Kan, VD, SBN, assembly","0.007257096469402313, 0.004667266737669706, 0.004401651676744223, 0.004200085531920195, 0.003961057867854834, 0.00394561467692256, 0.003121238434687257, 0.0029093141201883554, 0.002864209236577153, 0.0028530429117381573"
img43.png,assemblymaiieg individually convention,"assembly, Assembly, iana, andom, nick, riction, agan, Raymond, sever, assembly","0.014819489791989326, 0.009988275356590748, 0.007000231649726629, 0.006891703233122826, 0.00642377370968461, 0.005871804431080818, 0.005042077507823706, 0.0038208558689802885, 0.0029756855219602585, 0.00292955175973475"
img44.png,NLzw rawreenorie,"NL, oda, Sever, jon, riction, konn, hours, lay, beskre, ën","0.011729885824024677, 0.010351588018238544, 0.008548310957849026, 0.006895644124597311, 0.005991039797663689, 0.00549768703058362, 0.003913701977580786, 0.003690972225740552, 0.003047994105145335, 0.0028970774728804827"
img45.png,ifauntdestolaraz,"ifa, Beat, SR, riction, ember, Ze, konn, andom, yw, ond","0.007970066741108894, 0.004948727320879698, 0.004316356033086777, 0.00399197731167078, 0.003960911184549332, 0.00382407964207232, 0.0034412993118166924, 0.0034145191311836243, 0.002943499246612191, 0.002577414270490408"
img46.png,laisせivelchiaech,"lais, Ze, odb, ën, ola, konn, yw, sg, assembly, elen","0.0202321819961071, 0.007830729708075523, 0.005751507356762886, 0.004427093546837568, 0.00392218679189682, 0.003831329755485058, 0.0036416274961084127, 0.003557269461452961, 0.003557269461452961, 0.0033679550979286432"
img47.png,ywivellaisMPlais,"yw, assembly, expect, lais, ola, andom, assemble, Beat, hours, experimental","0.008913475088775158, 0.0036724000237882137, 0.003383173607289791, 0.003383173607289791, 0.0032031245063990355, 0.0030924708116799593, 0.0029973257333040237, 0.0029740002937614918, 0.00295085646212101, 0.002772072795778513"
img48.png,sever routolasnacholas,"sever, assemble, Sever, andom, ifa, Indep, virtual, bibli, Beat, sg","0.007138598244637251, 0.0059412685222923756, 0.004519878886640072, 0.0034790749195963144, 0.003255546558648348, 0.0031925784423947334, 0.0031553839799016714, 0.002918252954259515, 0.0028395382687449455, 0.0027521748561412096"
img49.png,yw personallyansenMPMP,"yw, VD, ray, vac, experiment, stack, Indep, Constraints, terms, assemble","0.008283048868179321, 0.006578076630830765, 0.0033466543536633253, 0.0031809499487280846, 0.0031809499487280846, 0.0029076237697154284, 0.002862545195966959, 0.002862545195966959, 0.002555964980274439, 0.0024967563804239035"
img50.png,VDotaivelieveota,"VD, FS, Ze, konn, yw, andom, ën, eli, STR, Ze","0.03187597915530205, 0.011102442629635334, 0.006707718595862389, 0.006350740324705839, 0.005474680569022894, 0.003071017563343048, 0.002953368704766035, 0.002873706631362438, 0.002689072862267494, 0.0026785891968756914"
img51.png,ipp¨ctor Amb una,"ipp, konn, riction, Stack, assembly, Ze, ën, stack, Assembly, cs","0.015236777253448963, 0.01084678154438734, 0.007661532610654831, 0.005103681236505508, 0.004451509565114975, 0.0035077054053545, 0.003071449464187026, 0.003035665722563863, 0.0028966525569558144, 0.0025363939348608255"
img52.png,anelikai'' legal rein,"anel, stack, yw, ola, aar, experimental, assembly, FS, Indep, konn","0.009205314330756664, 0.005183923523873091, 0.00434828270226717, 0.004297623410820961, 0.004198069218546152, 0.004037243779748678, 0.0038373456336557865, 0.0038223853334784508, 0.003675952320918441, 0.0033600921742618084"
img53.png,experimentalolas Kill Load spare,"experimental, Ze, yw, Assembly, assembly, sg, VD, Ze, virtual, andom","0.005191786680370569, 0.004915484692901373, 0.004320987965911627, 0.004320987965911627, 0.003472011536359787, 0.0031613025348633528, 0.002714588539674878, 0.002682962454855442, 0.0025204101111739874, 0.002442865166813135"
img54.png,Beatnl MPoda Dest,"Beat, comun, experiment, mor, konn, VD, vac, riction, Ze, odb","0.004585699178278446, 0.0041753267869353294, 0.003999718464910984, 0.003461467567831278, 0.0031028396915644407, 0.003078692825511098, 0.003030962310731411, 0.003007375169545412, 0.0029034840408712626, 0.0028473257552832365"
img55.png,ywansenhtolisitas,"yw, Kan, vac, andom, Ze, experiment, expect, jon, cs, experimental","0.0053428709506988525, 0.004144810140132904, 0.00395500473678112, 0.003924226853996515, 0.0036010730545967817, 0.003409427357837558, 0.002782693598419428, 0.002614098833873868, 0.0025041531771421432, 0.0024846657179296017"
img56.png,assembly�irmMPaty,"assembly, sg, konn, Assembly, aar, yw, Assembly, eli, assemble, assembly","0.013587194494903088, 0.011486345902085304, 0.009979510679841042, 0.009338333271443844, 0.005057369824498892, 0.00490177096799016, 0.004732436500489712, 0.004393919371068478, 0.004376789089292288, 0.003938683774322271"
img57.png,assemble forcesivelMPadt,"assemble, Assembly, andom, assembly, yw, konn, cause, Raymond, Ze, Asian","0.009220246225595474, 0.008168685249984264, 0.0073510208167135715, 0.005860744509845972, 0.004043792374432087, 0.00297008128836751, 0.0028340709395706654, 0.00280105322599411, 0.0027361668180674314, 0.002714873757213354"
img58.png,moriegoteutes Micro,"mor, sg, VD, andom, vac, odb, brave, yw, iana, Beat","0.0060387225821614265, 0.004909447394311428, 0.004540496505796909, 0.004470102023333311, 0.003749528434127569, 0.003508623456582427, 0.003494944656267762, 0.0029661208391189575, 0.002852490870282054, 0.0027325188275426626"
img59.png,Assemblyansenivellaisivel,"Assembly, andom, konn, assembly, Assembly, assembly, lais, yw, cs, Constraints","0.00919419527053833, 0.00808221660554409, 0.006648249924182892, 0.0065196603536605835, 0.005077516660094261, 0.004480892792344093, 0.004144148901104927, 0.0036715122405439615, 0.0033823559060692787, 0.00311597203835845"
img60.png,conduct indirectnl rörten,"conduct, lais, yw, andom, vac, ango, eli, Ze, ola, 光","0.006024484988301992, 0.005748603958636522, 0.005112914368510246, 0.005112914368510246, 0.00505334697663784, 0.004601124674081802, 0.004547520074993372, 0.004060478415340185, 0.003697107546031475, 0.003446082817390561"
img61.png,konnerenadtlaisreet,"konn, andom, yw, VD, motion, katol, Constraints, Ze, experimental, atern","0.0176506619900465, 0.008535303175449371, 0.006269001867622137, 0.003953809384256601, 0.003758042585104704, 0.0036853556521236897, 0.003670987905934453, 0.003316461108624935, 0.003277823096141219, 0.00326504441909492"
img62.png,ywConstraintsasilaisnl,"yw, konn, ether, pper, Rh, lais, arp, odb, motion, ford","0.008018885739147663, 0.006912711076438427, 0.0026135400403290987, 0.0025932015851140022, 0.0025730207562446594, 0.002543044276535511, 0.0025331296492367983, 0.002455193782225251, 0.002417129697278142, 0.002398319076746702"
img63.png,anel Indep🌍 U lod,"anel, stack, ether, ango, Indep, mor, Ze, VD, yw, konn","0.008702782914042473, 0.006965620443224907, 0.004622012842446566, 0.004376033786684275, 0.003355221590027213, 0.0031642753165215254, 0.0031519390176981688, 0.0029379301704466343, 0.0026438510976731777, 0.0025725376326590776"
img64.png,ywansen singing Microivel,"yw, Ze, lais, andom, Ze, cs, ieg, experimental, vac, Beat","0.009751326404511929, 0.005845572799444199, 0.0034633874893188477, 0.0030326431151479483, 0.002973986556753516, 0.0026762981433421373, 0.002455909503623843, 0.0023434453178197145, 0.002244882984086871, 0.0021420822013169527"
img65.png,olaarr BindNLlais,"ola, yw, Ze, vac, experiment, q, hip, Ze, ipp, goals","0.006102118641138077, 0.005239847116172314, 0.003178127808496356, 0.002905044239014387, 0.0025437416043132544, 0.0023710280656814575, 0.0021757776848971844, 0.0019888216629624367, 0.0019888216629624367, 0.0019503544317558408"
img66.png,ywivellaisolasiana,"yw, Constraints, VD, inho, andom, zyk, STR, Stack, mor, lay","0.006382111459970474, 0.003870946355164051, 0.0034834749531000853, 0.0034698937088251114, 0.0032980870455503464, 0.0031470570247620344, 0.002956386422738433, 0.002320494269952178, 0.00229345983825624, 0.0021128342486917973"
img67.png,andom Killolo sing Assembly,"andom, riction, Sele, Indep, experimental, virtual, cs, ki, Ξ, sans","0.00937573704868555, 0.004641326609998941, 0.004569369368255138, 0.004343124106526375, 0.00420950073748827, 0.004032454453408718, 0.003476192941889167, 0.002996665658429265, 0.0029044677503407, 0.002455379581078887"
img68.png,andomeren Bent KillNAME,"andom, konn, Ze, VD, assemble, experimental, Ze, ute, ppy, assembly","0.016810359433293343, 0.006845269352197647, 0.005086972378194332, 0.0045777796767652035, 0.0038099661469459534, 0.0033754429314285517, 0.002864701207727194, 0.002608340000733733, 0.002588041825219989, 0.002275034785270691"
img69.png,konnzo MPloads Ho,"konn, angles, Unity, assemble, void, sBy, atabase, mor, angle, lais","0.007270211819559336, 0.005445136688649654, 0.004014992155134678, 0.003937335219234228, 0.0036987841594964266, 0.003584984689950943, 0.0029836888425052166, 0.0026955383364111185, 0.002592273987829685, 0.0025721006095409393"
img70.png,andom Kill stretch lay Kop,"andom, vac, ën, ivel, ola, eli, yw, LD, Constraints, experiment","0.01325782760977745, 0.00791660975664854, 0.004270691424608231, 0.004204479977488518, 0.0036529155913740396, 0.003300134325399995, 0.0031001893803477287, 0.0028338024858385324, 0.002580206608399749, 0.002471686340868473"
img71.png,assemblyternolisech Mem,"assembly, Assembly, konn, aar, VD, Ze, cs, assemble, sg, inho","0.009393973276019096, 0.00751884188503027, 0.006065204739570618, 0.004705171100795269, 0.00450727716088295, 0.004420098848640919, 0.0036931310314685106, 0.0036501046270132065, 0.0029675138648599386, 0.0028874704148620367"
img72.png,Ze cause citizens Microatt,"Ze, Ze, VD, Assembly, expect, experiment, assembly, stack, Sever, 光","0.017827698960900307, 0.010645405389368534, 0.007008752319961786, 0.006740250624716282, 0.004437665455043316, 0.004368865862488747, 0.004251022823154926, 0.004152548033744097, 0.003593730740249157, 0.0034695840440690517"
img73.png,konn shortcut宿rv exit,"konn, experiment, yw, VD, goals, motion, andom, cs, Ze, experimental","0.010946549475193024, 0.007178922183811665, 0.0058364225551486015, 0.005504270549863577, 0.0044749402441084385, 0.004405563231557608, 0.00345796556212008, 0.0034444844350218773, 0.003124011680483818, 0.0028667543083429337"
img74.png,andomsegechhtlais,"andom, yw, 光, Beat, Ze, Ze, eli, equilib, assemble, expect","0.015357526019215584, 0.006037632469087839, 0.005245585925877094, 0.005124072078615427, 0.004149599466472864, 0.003591179382055998, 0.0034267273731529713, 0.0029888448771089315, 0.00296558509580791, 0.002637646161019802"
img75.png,FS Ze stackreenlais,"FS, ierz, experimental, experiment, riction, Ze, konn, Ze, hav, Assembly","0.008863050490617752, 0.0061874063685536385, 0.005417874548584223, 0.004725554026663303, 0.004387528169900179, 0.004057800397276878, 0.0039793155156075954, 0.0038268703501671553, 0.003665917320176959, 0.0035117336083203554"
img76.png,iana Assembly AmsterdamivelNL,"assembly, iana, stack, ivel, yw, asm, reet, ola, Assembly, anel","0.006752713117748499, 0.006752713117748499, 0.005959248635917902, 0.00544719398021698, 0.00475112721323967, 0.004551301244646311, 0.003877757117152214, 0.0034087670501321554, 0.0029156729578971863, 0.0025831430684775114"
img77.png,andomadtadtadtlay,"andom, riction, yw, Constraints, NL, experiment, hip, iana, ogle, sg","0.017285173758864403, 0.011160147376358509, 0.009144296869635582, 0.006235869135707617, 0.003723607398569584, 0.0035254403483122587, 0.003457252401858568, 0.0033903829753398895, 0.0033771649468690157, 0.0032860718201845884"
img78.png,yw exped mor recom Micro,"yw, VD, konn, aar, Constraints, mor, eli, Vector, corresponding, assemble","0.010078299790620804, 0.006558074615895748, 0.005107433535158634, 0.0050086467526853085, 0.003707599826157093, 0.003635887987911701, 0.00362171302549541, 0.003389020450413227, 0.003061724593862891, 0.0028095964808017015"
img79.png,csctoryen lay stretch,"cs, experimental, andom, Beat, Ze, experiment, stack, cs, assemble, ola","0.005281904246658087, 0.005040028598159552, 0.004771803040057421, 0.004679508041590452, 0.004482694435864687, 0.003518507117405534, 0.0032540869433432817, 0.0029861179646104574, 0.0027942617889493704, 0.002750940853729844"
img80.png,laisnl equivalhtæ,"lais, FM, 🌍, hip, FS, alloc, yw, Ze, mor, Beat","0.012145432643592358, 0.01177175622433424, 0.005203320644795895, 0.0043816352263092995, 0.004180985037237406, 0.00354835600592196, 0.0029302220791578293, 0.002896083751693368, 0.0027100122533738613, 0.0026994470972567797"
