img81.png,konnywTP amb alternative,"konn, andom, oda, ragen, Ze, Sele, yw, Constraints, cs, Ze","0.052502792328596115, 0.004481370095163584, 0.004242876544594765, 0.004112336318939924, 0.0037884621415287256, 0.0031407452188432217, 0.0029389543924480677, 0.0029160832054913044, 0.0023800376802682877, 0.0023068117443472147"
img82.png,eliivel indeplayConstraints,"eli, iana, konn, brave, yw, VD, andom, Constraints, stack, conditions","0.006549526005983353, 0.005221737548708916, 0.004261857829988003, 0.003972488455474377, 0.0034784269519150257, 0.0033191381953656673, 0.002773243933916092, 0.002625654684379697, 0.0022901364136487246, 0.002211022889241576"
img83.png,konnerenieveivellais,"konn, Assembly, assembly, lais, STR, rias, isko, FS, assembly, utes","0.009105050936341286, 0.006635427009314299, 0.0055875894613564014, 0.0044029150158166885, 0.0035516880452632904, 0.0035378416068851948, 0.00341562507674098, 0.0032847747206687927, 0.0030857601668685675, 0.003037919756025076"
img84.png,assemblyせivelivellais,"assembly, Assembly, konn, stack, experimental, cs, expect, ango, experiment, riction","0.010363894514739513, 0.005211293697357178, 0.005170739255845547, 0.005110498052090406, 0.004303470719605684, 0.0030516176484525204, 0.00284442026168108, 0.002811281941831112, 0.0026720857713371515, 0.0023673370014876127"
img85.png,assemble worolis Milüss,"assemble, assembly, odb, iri, aar, yw, VD, Beat, Assembly, rias","0.0069954912178218365, 0.006173499394208193, 0.005533889401704073, 0.005301141180098057, 0.005078182090073824, 0.0047705103643238544, 0.00416091363877058, 0.0036150638479739428, 0.0032659382559359074, 0.0031042303889989853"
img86.png,assemblyelen Bentulo Force,"assembly, hip, Ze, yw, riction, expect, lay, Assembly, konn, Ze","0.0060554565861821175, 0.005733191035687923, 0.005406913813203573, 0.004884739406406879, 0.004884739406406879, 0.004465013742446899, 0.004097327124327421, 0.00364423799328506, 0.0033181163016706705, 0.0032034905161708593"
img87.png,ianarim morvieramil,"iana, andom, yw, ipes, experiment, mor, ether, Constraints, eli, katol","0.00900942087173462, 0.005443186033517122, 0.005073607433587313, 0.004565752111375332, 0.003982319962233305, 0.003890069667249918, 0.003785141743719578, 0.0034870358649641275, 0.0034464106429368258, 0.00339297903701663"
img88.png,laisivellaiscengat,"lais, Ze, andom, konn, Beat, yw, DAT, virtual, Ze, cs","0.025143219158053398, 0.01081396359950304, 0.007288567256182432, 0.00676720542833209, 0.004335234872996807, 0.0035521637182682753, 0.003098252462223172, 0.00289919157512486, 0.0026813140138983727, 0.00258868676610291"
img89.png,assemble�ota Brarv,"assemble, Assembly, assembly, mor, Ze, experiment, experimental, ola, yw, cs","0.008168469183146954, 0.006165883969515562, 0.005792311858385801, 0.0057697296142578125, 0.004528712946921587, 0.0038887744303792715, 0.003326245117932558, 0.003161551197990775, 0.003149225376546383, 0.003040434094145894"
img90.png,andom lay Indep layansen,"andom, Beat, Ze, yw, cs, assemble, experiment, bibli, Ze, Free","0.02139265462756157, 0.01794418878853321, 0.006448379717767239, 0.00508120097219944, 0.004792028572410345, 0.004035292658954859, 0.0030819042585790157, 0.0029407734982669353, 0.00276260101236403, 0.002554988255724311"
img91.png,konnlaveht Bent cant,"konn, Ze, Assembly, assembly, lais, Ze, yw, cs, sever, eli","0.01099203061312437, 0.008073417469859123, 0.004654319025576115, 0.004271042998880148, 0.0036247873213142157, 0.003513264236971736, 0.0034587958361953497, 0.0033523798920214176, 0.0031004445627331734, 0.0029239978175610304"
img92.png,konn MPlaishtice,"konn, yw, assembly, lais, ën, oda, Indep, Assembly, OP, VD","0.02329128049314022, 0.01515592448413372, 0.00683131068944931, 0.006569607648998499, 0.004769023973494768, 0.004427888430655003, 0.0042916564270854, 0.004241657443344593, 0.0031768546905368567, 0.0031032629776746035"
img93.png,konniveleren feedLayer,"konn, Beat, stack, beat, ether, Free, riction, assemble, DAT, cs","0.0055820392444729805, 0.005062690004706383, 0.00367511878721416, 0.00367511878721416, 0.0030230700504034758, 0.0028733876533806324, 0.002709862543269992, 0.002616249257698655, 0.0025062134955078363, 0.0023543694987893105"
img94.png,yw vacnl Cantht,"yw, assembly, Assembly, konn, assemble, Ze, VD, sBy, anel, Ze","0.015626106411218643, 0.014910535886883736, 0.008429652079939842, 0.006513930391520262, 0.00641294103115797, 0.006338228937238455, 0.005793609656393528, 0.0048030707985162735, 0.0039201523177325726, 0.003844329621642828"
img95.png,Ze layзя ст lay,"Ze, konn, 光, Ze, lais, Sele, yw, nl, DAT, VD","0.011586454696953297, 0.007568959146738052, 0.0071382075548172, 0.006373702082782984, 0.005430462304502726, 0.004925215151160955, 0.003896166104823351, 0.0031799578573554754, 0.0029180936980992556, 0.002773608546704054"
img96.png,FS Alternlaisetzlais,"FS, isko, ola, experiment, expect, stack, atern, VD, alloc, experimental","0.015368382446467876, 0.010645367205142975, 0.008756639435887337, 0.006258088629692793, 0.004798243287950754, 0.004687091335654259, 0.0029909575823694468, 0.0027021050918847322, 0.0026395106688141823, 0.002311232965439558"
img97.png,andom aheadandomjonleg,"andom, Sever, Ze, expect, tero, assembly, sever, mor, cs, Assembly","0.009479012340307236, 0.006413821130990982, 0.006096250843256712, 0.004917646758258343, 0.0046377829276025295, 0.004565880633890629, 0.004124929662793875, 0.0035282389726489782, 0.003514483803883195, 0.002611742587760091"
img98.png,konnond unders Killht,"konn, ola, andom, assembly, Ze, experimental, assemble, jon, Assembly, stack","0.008400469087064266, 0.007442403119057417, 0.0061699687503278255, 0.0060743121430277824, 0.0042240209877491, 0.004142321180552244, 0.003968100529164076, 0.003698676126077771, 0.0035155420191586018, 0.0031636455096304417"
img99.png,konnNLHP amb independently,"konn, NL, stack, hrer, mor, Stack, utes, wod, programming, 🌍","0.029667077586054802, 0.011304425075650215, 0.007101815193891525, 0.005175542552024126, 0.0049578663893043995, 0.0038013276644051075, 0.0029953743796795607, 0.0029145791195333004, 0.002891897689551115, 0.002847063122317195"
img100.png,ywieg sop Brad Bent,"yw, stack, iana, motion, elen, aho, vac, ray, datasets, mor","0.005224904511123896, 0.004486589226871729, 0.0035910210572183132, 0.0035770207177847624, 0.003466967260465026, 0.0031199329532682896, 0.0029309059027582407, 0.0028186244890093803, 0.0027000769041478634, 0.002373520052060485"
img101.png,NLtern dot lay indep,"NL, jon, Ze, assembly, riction, SBN, vac, Ze, Beat, andom","0.008763578720390797, 0.006023113615810871, 0.004672518000006676, 0.004441165365278721, 0.003352367551997304, 0.003016804112121463, 0.002993327332660556, 0.0027468318585306406, 0.0024815555661916733, 0.00240520597435534"
img102.png,ether Indep Ali destin destin,"ether, sg, ivel, reen, konn, aar, VD, experiment, odb, vectors","0.009757974185049534, 0.00923866406083107, 0.004180490970611572, 0.004004664719104767, 0.0038212775252759457, 0.003118836088106036, 0.003118836088106036, 0.003094565123319626, 0.0028844517655670643, 0.002135185757651925"
img103.png,Ze laws layamenjon,"Ze, yw, Ze, expect, VD, cs, rias, icas, lais, hip","0.005829175002872944, 0.005716429091989994, 0.005476003512740135, 0.004165923688560724, 0.0037052491679787636, 0.003181671956554055, 0.0030006023589521646, 0.002807815559208393, 0.0027535075787454844, 0.0027427724562585354"
img104.png,rias Assemblyanne Tobht,"rias, yw, ola, Ze, cs, Sever, lais, Constraints, assemble, ango","0.0064589655958116055, 0.005546269007027149, 0.0038118911907076836, 0.0037527934182435274, 0.002934117568656802, 0.002756348345428705, 0.002713615307584405, 0.0026507542934268713, 0.0025096838362514973, 0.0021975524723529816"
img105.png,Beatoupumbleky Kauf,"Beat, vac, FS, mor, iana, virtual, Sele, konn, VD, Ze","0.008629968389868736, 0.006313819903880358, 0.005681823473423719, 0.005133099853992462, 0.004601280204951763, 0.00396655173972249, 0.0033271494321525097, 0.0032374050933867693, 0.002959227655082941, 0.002531161531805992"
img106.png,assemblylaisModejonaret,"assembly, Ze, sg, experimental, Assembly, experiment, vac, Sele, goals, Sing","0.006376334931701422, 0.0062774792313575745, 0.005143581423908472, 0.005103554576635361, 0.004503870382905006, 0.004503870382905006, 0.004434044472873211, 0.0036903396248817444, 0.0035628548357635736, 0.002647689078003168"
img107.png,konn Eg af lay Ze,"konn, Beat, FS, vac, Ze, yw, ën, Ze, vez, katol","0.007081806659698486, 0.006249672267585993, 0.005100834183394909, 0.004295332822948694, 0.004130781162530184, 0.0036311892326921225, 0.0032677168492227793, 0.0027302796952426434, 0.002646277891471982, 0.0025849768426269293"
img108.png,VDaucoupigesrvTAG,"VD, expect, assembly, experiment, konn, assemble, andom, stack, Virtual, FS","0.008698001503944397, 0.00544307054951787, 0.005173565819859505, 0.004530125297605991, 0.003889987012371421, 0.003419518005102873, 0.0029942297842353582, 0.0029478089418262243, 0.002715648850426078, 0.002642398700118065"
img109.png,lais Cultural assemblyELivel,"lais, mor, konn, expect, hip, open, ango, agan, vac, ny","0.022893773391842842, 0.005588487721979618, 0.004780086688697338, 0.004352318588644266, 0.003781359875574708, 0.0030742238741368055, 0.002384873805567622, 0.0022491500712931156, 0.0022491500712931156, 0.00208826526068151"
img110.png,Constraintsellettolascong Sing,"Constraints, sBy, experimental, ivel, experiment, Sele, hop, riction, .—, Ze","0.008697589859366417, 0.004637334030121565, 0.00437342282384634, 0.004092433024197817, 0.0033401467371731997, 0.0031996648758649826, 0.0031012212857604027, 0.0029824150260537863, 0.002801720052957535, 0.0026734196580946445"
img111.png,assemblyerasNLPNoth,"assembly, hip, Assembly, vac, 光, experiment, cess, andom, mor, VD","0.00872108619660139, 0.007117943372577429, 0.006040920037776232, 0.0037071933038532734, 0.0036213162820786238, 0.003523637540638447, 0.0031095994636416435, 0.00309747620485723, 0.0029098093509674072, 0.0028871651738882065"
img112.png,VDolaivellais Micro,"Ze, VD, konn, anel, 光, ango, riction, andom, STR, yw","0.007428932469338179, 0.007428932469338179, 0.005785658489912748, 0.00424944469705224, 0.0038995102513581514, 0.003495498327538371, 0.003048827638849616, 0.002711683511734009, 0.002607800764963031, 0.0025976335164159536"
img113.png,konnivel Ho Honl,"konn, Ze, ango, Constraints, Free, rias, hav, jon, yw, isko","0.004712240770459175, 0.00440948223695159, 0.004174814093858004, 0.004030593205243349, 0.004014878999441862, 0.003906584810465574, 0.0035569858737289906, 0.0035431187134236097, 0.0032134689390659332, 0.0030305900145322084"
img114.png,andom morandomechrim,"andom, konn, Ze, yw, Stack, STR, isko, stack, ango, tek","0.010833141393959522, 0.006053150165826082, 0.005077391397207975, 0.004882879555225372, 0.004309126175940037, 0.004209305625408888, 0.004016546998172998, 0.00342214060947299, 0.00342214060947299, 0.0029848443809896708"
img115.png,ywlayolas layolas,"yw, riction, isko, Ze, oda, ray, Beat, NL, konn, aar","0.009219993837177753, 0.006798397749662399, 0.005792306736111641, 0.005462666042149067, 0.005212512332946062, 0.004801990929991007, 0.004564228001981974, 0.003965470474213362, 0.0039346106350421906, 0.0037838779389858246"
img116.png,andomegy Kill forcesrw,"andom, quet, yw, Ze, Ze, mor, sever, WCF, vac, Assembly","0.01369884330779314, 0.008341288194060326, 0.007106866221874952, 0.006345717702060938, 0.00448224414139986, 0.0035319237504154444, 0.0033833757042884827, 0.0030092366505414248, 0.0027399410028010607, 0.002298266626894474"
img117.png,bbelaisolareenlais,"bbe, andom, Ze, sb, NL, atern, experimental, VD, experiment, assembly","0.0062233079224824905, 0.004715985152870417, 0.004018069710582495, 0.0037161067593842745, 0.0036871880292892456, 0.003292288165539503, 0.0032160221599042416, 0.003178554819896817, 0.003178554819896817, 0.0028941070195287466"
img118.png,yw expedzn individuallyicana,"yw, atern, vac, Ze, Beat, andom, Free, konn, attan, experiment","0.008391248993575573, 0.007177416235208511, 0.0050302548334002495, 0.004837549291551113, 0.004634087439626455, 0.004439184442162514, 0.003337808419018984, 0.003003702498972416, 0.002922682324424386, 0.0027349020820111036"
img119.png,kwiegemberglaisnl,"kw, utes, stack, though, core, array, riction, Rh, mor, Unity","0.010109529830515385, 0.004701368510723114, 0.003346817335113883, 0.00332077220082283, 0.0032565428409725428, 0.002699768403545022, 0.002678758930414915, 0.0026065038982778788, 0.002345599699765444, 0.002212111372500658"
img120.png,ywiegivelConstraints stack,"yw, stack, lais, sg, conditions, konn, Ze, Assembly, Beat, assembly","0.007531117182224989, 0.005934378132224083, 0.005911241285502911, 0.0049777645617723465, 0.0037281732074916363, 0.0033288842532783747, 0.003164059715345502, 0.002814172999933362, 0.00263336393982172, 0.0025226082652807236"
img121.png,experimental teatetten rör physics,"experimental, yw, Ze, andom, ola, ën, cs, ango, lais, experiment","0.008420302532613277, 0.00816123653203249, 0.005924422759562731, 0.005187597591429949, 0.004334400407969952, 0.004168351646512747, 0.0039619626477360725, 0.0039465161971747875, 0.0032974376808851957, 0.0026084878481924534"
img122.png,konnnlren facht,"konn, lais, andom, cs, assembly, Assembly, experimental, vac, riction, Ze","0.009717247448861599, 0.005408462602645159, 0.004518939647823572, 0.003411074634641409, 0.003045746823772788, 0.0028500594198703766, 0.002751602791249752, 0.002574814250692725, 0.002485866192728281, 0.0024761746171861887"
img123.png,hipcola tower authenticmai,"hip, andom, ola, yw, lais, experiment, Free, ether, expect, recom","0.008435012772679329, 0.005888587795197964, 0.005096148233860731, 0.004410348832607269, 0.0038921190425753593, 0.0038769450038671494, 0.0034888731315732002, 0.0034482262562960386, 0.003151934128254652, 0.0030549592338502407"
img124.png,LDadtreen involieve,"LD, VD, hours, konn, Constraints, assemble, Raymond, cs, stack, days","0.011348706670105457, 0.005055668298155069, 0.0046032387763261795, 0.0041749561205506325, 0.003474706783890724, 0.0033285648096352816, 0.003114706603810191, 0.0030904680024832487, 0.00288063264451921, 0.002674577059224248"
img125.png,ywieg﻿TAGieve,"yw, lais, odb, ote, riction, expect, sever, irc, brave, Sever","0.008906180039048195, 0.008836871944367886, 0.004693227354437113, 0.004357513971626759, 0.003936686087399721, 0.0036408391315490007, 0.003433638485148549, 0.003006594255566597, 0.002846586285158992, 0.00265331007540226"
img126.png,experimentivellay Ze先,"experiment, ola, experimental, katol, andom, konn, hip, ën, mor, adt","0.010017531923949718, 0.0074153742752969265, 0.004939704667776823, 0.004480117466300726, 0.004427922423928976, 0.003757928963750601, 0.0034484693314880133, 0.0033685858361423016, 0.003226907690986991, 0.0030313991010189056"
img127.png,laisolasierzivellais,"lais, konn, Ze, Bishop, yw, riction, layers, uel, ango, andom","0.007467387244105339, 0.006118557881563902, 0.0041400231420993805, 0.00308864563703537, 0.0030646093655377626, 0.002812243765220046, 0.002768644131720066, 0.002621299587190151, 0.002501261420547962, 0.0024243055377155542"
img128.png,assemblyelenreenota amb,"assembly, agan, virtual, cs, iform, DAT, Assembly, experimental, ifa, Virtual","0.005992338061332703, 0.0038992883637547493, 0.0035227134358137846, 0.003036768874153495, 0.0028195446357131004, 0.0028195446357131004, 0.002690428402274847, 0.002527423668652773, 0.0025175700429826975, 0.002283336827531457"
img129.png,hipanguack Micro reward,"hip, Stack, stack, mor, Stack, hips, sg, angol, yw, zie","0.011270292103290558, 0.00986859854310751, 0.0074783628806471825, 0.006103662308305502, 0.0039408206939697266, 0.0038645979948341846, 0.0031541932839900255, 0.0031418963335454464, 0.0031174453906714916, 0.002408975502476096"
img130.png,VDolasipo globono,"VD, andom, bbe, riction, STR, konn, datasets, annel, eli, Constraints","0.00798408966511488, 0.005795827601104975, 0.005552062764763832, 0.004567001946270466, 0.004142091143876314, 0.003921653144061565, 0.003487990703433752, 0.003151136916130781, 0.002791752340272069, 0.002791752340272069"
img131.png,yw exped Bishop destinmai,"yw, Ze, andom, ether, expect, ango, ames, riction, jon, Ra","0.018886663019657135, 0.007781407795846462, 0.005896704271435738, 0.004433712922036648, 0.0043479567393660545, 0.0043141208589077, 0.0038822884671390057, 0.003675677115097642, 0.0035905297845602036, 0.0035765315406024456"
img132.png,konn lay destin modelay,"konn, Indep, yw, Constraints, forces, Ze, Free, Ze, anel, expect","0.008043134585022926, 0.006215252447873354, 0.006215252447873354, 0.00509259570389986, 0.004390092100948095, 0.004355927463620901, 0.003199337748810649, 0.0029821107164025307, 0.0027046571485698223, 0.002386851469054818"
img133.png,konn� Cantaff af,"konn, yw, Constraints, assembly, isko, bbe, riction, assemble, Ze, andom","0.018987104296684265, 0.010818525217473507, 0.0072916424833238125, 0.004042587708681822, 0.0038725617341697216, 0.0035955519415438175, 0.003526007756590843, 0.0034443282056599855, 0.0032737876754254103, 0.003123869886621833"
img134.png,Constraints Dest<<mvhmen,"Constraints, konn, andom, lais, yw, experimental, mor, cs, Unity, anh","0.006844505202025175, 0.0064298175275325775, 0.006256384309381247, 0.0040552350692451, 0.003271226305514574, 0.00300184590741992, 0.0028868471272289753, 0.002690837485715747, 0.002577664330601692, 0.002567614894360304"
img135.png,assemblyierzicanaPP motion,"assembly, assemble, Assembly, experiment, forces, force, cs, Indep, stack, assembly","0.017352139577269554, 0.017016520723700523, 0.007149175740778446, 0.0065861293114721775, 0.005481462925672531, 0.004579934291541576, 0.003932757303118706, 0.0037526634987443686, 0.003209823276847601, 0.003086856799200177"
img136.png,konnerenenst destinreen,"konn, lais, atern, FS, elen, ante, experiment, cano, Constraints, ether","0.012931202538311481, 0.007782135158777237, 0.005044189281761646, 0.004738577641546726, 0.004521581809967756, 0.0038374168798327446, 0.0034398382995277643, 0.0029307787772268057, 0.0027532116509974003, 0.002742478158324957"
img137.png,vacnlConstraints Microadt,"vac, assembly, Ze, Assembly, Ze, Assembly, assembly, eli, ën, anel","0.013306946493685246, 0.006691153161227703, 0.006409732159227133, 0.004876267164945602, 0.003979892935603857, 0.0036521549336612225, 0.0031730474438518286, 0.002992468886077404, 0.002934589283540845, 0.002385804196819663"
img138.png,Assemblyalion Assemblyelendest,"Assembly, Bishop, vac, Beat, experiment, yw, assembly, Indep, riction, Ze","0.006022101733833551, 0.005613216198980808, 0.003995944745838642, 0.003666885197162628, 0.003581942291930318, 0.0035402108915150166, 0.0030399546958506107, 0.002969534369185567, 0.002746370155364275, 0.0025900739710778"
img139.png,csWIDhtnl渡,"cs, stack, FS, andom, vac, idd, lay, though, mor, experimental","0.006153535097837448, 0.003973021171987057, 0.003820817219093442, 0.003617476671934128, 0.0025752149522304535, 0.002565175062045455, 0.0024765601847320795, 0.002466904930770397, 0.002419190714135766, 0.0023539368994534016"
img140.png,aternacoho goalsLayer,"atern, konn, sever, Beat, yw, expect, rias, aho, Ze, ifa","0.00769845861941576, 0.006533597130328417, 0.004218407440930605, 0.003171806689351797, 0.0031348541378974915, 0.0031104583758860826, 0.002910613315179944, 0.0028210636228322983, 0.0028210636228322983, 0.002755713416263461"
img141.png,assemblyolanech CIvier,"assembly, Ze, Assembly, experiment, sever, assemble, experimental, forces, ray, stack","0.011338605545461178, 0.006613750476390123, 0.006385275162756443, 0.005836613941937685, 0.003235899843275547, 0.0030161903705447912, 0.0026205116882920265, 0.0025498277973383665, 0.0025201214011758566, 0.0024521455634385347"
img142.png,ywnlywлів sop,"yw, konn, cs, hip, Ze, assemble, ames, hip, riction, Free","0.010358648374676704, 0.007147252559661865, 0.004543070215731859, 0.004351994954049587, 0.004152702633291483, 0.003901102812960744, 0.0035106127616018057, 0.003134624334052205, 0.003110230201855302, 0.0030027860775589943"
img143.png,experimentivellaisech Fel,"experiment, konn, isko, motion, experimental, yw, goals, andom, VD, ierz","0.010752934031188488, 0.005984909366816282, 0.005600382573902607, 0.005020150914788246, 0.004361582919955254, 0.004129463341087103, 0.003924999386072159, 0.003104930277913809, 0.003092824947088957, 0.0029396885074675083"
img144.png,virtualivel cant Killolis,"virtual, andom, fra, Ze, bbe, Beat, ond, riction, ieg, VD","0.0069036101922392845, 0.00595128396525979, 0.0047262790612876415, 0.004492264706641436, 0.004388201516121626, 0.0039489539340138435, 0.0034985793754458427, 0.003377719549462199, 0.0030995698180049658, 0.0025101080536842346"
img145.png,vac LIN destin Sing prim,"vac, Beat, experiment, Sele, FS, Ze, conditions, andom, iana, 光","0.006885494105517864, 0.005341522395610809, 0.004192608408629894, 0.003277986543253064, 0.003115682164207101, 0.0030793834012001753, 0.002717546420171857, 0.0025429457891732454, 0.0025133194867521524, 0.002435992704704404"
img146.png,lais Bra stackirtualTA,"lais, aho, vac, mor, Ze, riction, arda, rias, iri, yw","0.010381129570305347, 0.008053313009440899, 0.0038640215061604977, 0.0033966926857829094, 0.0032921875827014446, 0.0031908974051475525, 0.00317845749668777, 0.0030210809782147408, 0.002939592581242323, 0.002614527940750122"
img147.png,assemble stretch NederlandNLodb,"assemble, VD, aar, assembly, Ze, isko, vac, Ze, ~/, ray","0.006592370569705963, 0.006073176395148039, 0.006002421490848064, 0.005660822615027428, 0.004860909190028906, 0.004391465801745653, 0.004239760804921389, 0.004223231226205826, 0.0040456075221300125, 0.0034067428205162287"
img148.png,olaConstraints amb Kill landing,"ola, expect, andom, STR, cs, yw, ether, konn, lave, anel","0.009029131382703781, 0.004966920241713524, 0.004889914765954018, 0.004739467985928059, 0.004366202745586634, 0.0042985109612345695, 0.004265059716999531, 0.004150017164647579, 0.0036197095178067684, 0.0033607862424105406"
img149.png,experiment LIN batolalais,"experiment, Constraints, andom, Ze, ola, experimental, konn, Assembly, aar, assembly","0.006103674881160259, 0.005667069926857948, 0.005492713302373886, 0.004661605227738619, 0.0037898581940680742, 0.0037165554240345955, 0.003423851216211915, 0.0032289992086589336, 0.003057155292481184, 0.002761909505352378"
img150.png,stackhtolaolaatti,"stack, Ze, andom, yw, eli, Assembly, vac, mor, Ze, FS","0.005867348983883858, 0.004309445153921843, 0.003744110930711031, 0.003686063690111041, 0.003558726981282234, 0.003343114396557212, 0.0029045483097434044, 0.002848369302228093, 0.0025632549077272415, 0.0024941153824329376"
img151.png,olanlbolNL Kill,"ola, stack, ierz, VD, FS, atern, konn, aho, lais, sg","0.012291121296584606, 0.0043654488399624825, 0.00399034284055233, 0.003882709890604019, 0.0037632519379258156, 0.003733965801075101, 0.0036049741320312023, 0.0034131209831684828, 0.0033081104047596455, 0.0031689757015556097"
img152.png,lais Zeola afct,"lais, Ze, konn, motion, goals, ola, bb, alloc, Ze, cs","0.011656787246465683, 0.004840327426791191, 0.0036679706536233425, 0.003300816286355257, 0.003236972726881504, 0.0031867881771177053, 0.0030647043604403734, 0.0030054275412112474, 0.002958832308650017, 0.002924361266195774"
img153.png,rictionlais Ze floatingzew,"riction, cs, konn, '"", VD, Sz, mor, ligen, lais, Kan","0.006335410755127668, 0.005231763701885939, 0.003812717739492655, 0.0035957349464297295, 0.0034851059317588806, 0.00329963187687099, 0.003111849306151271, 0.002911915071308613, 0.002789443591609597, 0.002620439976453781"
img154.png,experiment🌍gt Killivel,"experiment, assembly, Assembly, konn, experimental, assemble, expect, isko, FS, mor","0.010289011523127556, 0.007016495801508427, 0.004860185086727142, 0.00445995619520545, 0.004092685878276825, 0.0038447228725999594, 0.00377035909332335, 0.0033403527922928333, 0.0032629736233502626, 0.003137970808893442"
img155.png,andom Killht Conventionivel,"andom, experiment, VD, assemble, iana, ray, hav, experimental, yw, motion","0.012285030446946621, 0.005848551634699106, 0.005366932600736618, 0.004082946572452784, 0.003988365177065134, 0.0030223592184484005, 0.0025450815446674824, 0.002495855325832963, 0.002457160735502839, 0.002428533975034952"
img156.png,andom Killandomlaistern,"andom, experimental, konn, Ze, VD, lay, FS, hav, reet, oster","0.012703313492238522, 0.004821633920073509, 0.004821633920073509, 0.0042055039666593075, 0.0038291551172733307, 0.0036538050044327974, 0.003405720693990588, 0.0032119005918502808, 0.0030768124852329493, 0.0029938204679638147"
img157.png,experimental IndeplaisNLnt,"experimental, andom, Indep, VD, Constraints, Ze, vac, yw, cs, experiment","0.011287405155599117, 0.005415755789726973, 0.004056213889271021, 0.0040246485732495785, 0.00399332819506526, 0.0036788261495530605, 0.003246552776545286, 0.0031100071500986814, 0.0030858046375215054, 0.0030858046375215054"
img158.png,Ze nu gratsgierz,"Ze, assembly, VD, bbe, konn, SBN, expect, sb, WCF, assemble","0.006803406868129969, 0.0065427725203335285, 0.0060274843126535416, 0.005488086957484484, 0.0052367690950632095, 0.004496777430176735, 0.004427060950547457, 0.0043584262020885944, 0.004158839583396912, 0.003684527240693569"
img159.png,cs Kill aficitytern,"cs, Ze, assembly, hip, mor, expect, assemble, Assembly, yw, FS","0.005735620390623808, 0.004555007442831993, 0.0039113531820476055, 0.00385071337223053, 0.003835700685158372, 0.0036600511521101, 0.0034115430898964405, 0.0032299840822815895, 0.0031428607180714607, 0.002918047131970525"
img160.png,forcesivel balance Bra balance,"forces, force, experiment, lais, FS, experimental, Ze, yw, Asian, othe","0.011108968406915665, 0.0058084591291844845, 0.005542470142245293, 0.0032077357172966003, 0.0029435837641358376, 0.0027330247685313225, 0.002638611476868391, 0.0024884475860744715, 0.0023468295112252235, 0.002230630023404956"
