img84.png,image object the image object,"image, the, object, , machine, paper, it, black, picture, that","0.08112164586782455, 0.05036957934498787, 0.04768895357847214, 0.03984561562538147, 0.03802095353603363, 0.022881411015987396, 0.017004020512104034, 0.015361852012574673, 0.015361852012574673, 0.014658382162451744"
img85.png,tent camp camp camp camp,"tent, camp, the, black, t, image, it, picture, drawing, object","0.2134743481874466, 0.13891039788722992, 0.045807793736457825, 0.04269755631685257, 0.040110643953084946, 0.039488784968853, 0.019396239891648293, 0.018653180450201035, 0.016983915120363235, 0.01252315379679203"
img86.png,object object the image object,"object, , the, image, t, picture, item, bott, 1, sh","0.06959784030914307, 0.062387097626924515, 0.043214283883571625, 0.042877983301877975, 0.02089705877006054, 0.019026989117264748, 0.01759708859026432, 0.01602233201265335, 0.014934456907212734, 0.01010515820235014"
img87.png,cam cam cam cam1,"cam, animal, image, the, that, , horse, it, picture, cart","0.4015944302082062, 0.09317740052938461, 0.05876624584197998, 0.029549526050686836, 0.018491622060537338, 0.014289217069745064, 0.009082779288291931, 0.009082779288291931, 0.00866684876382351, 0.008269964717328548"
img88.png,animal animal animal animal animal,"animal, go, image, ram, sheep, that, the, picture, black, she","0.19500625133514404, 0.14155936241149902, 0.09429886937141418, 0.07459653913974762, 0.07007696479558945, 0.05167151615023613, 0.014688929542899132, 0.014461198821663857, 0.014236998744308949, 0.012761962600052357"
img89.png,fish fish fish fish fish,"fish, image, that, drawing, picture, sh, the, black, , illustr","0.41775354743003845, 0.05833146348595619, 0.04798215255141258, 0.02755383402109146, 0.02112625539302826, 0.01821197010576725, 0.01751428283751011, 0.016198061406612396, 0.011132754385471344, 0.006493678316473961"
img90.png,image object object object the,"image, object, the, , picture, cart, drawing, t, c, painting","0.07717864960432053, 0.05430196225643158, 0.03142756596207619, 0.031182993203401566, 0.03022359311580658, 0.03022359311580658, 0.025252757593989372, 0.013837370090186596, 0.009812163189053535, 0.008864551782608032"
img91.png,sh11 shing,"sh, sho, s, the, image, foot, boot, , black, bo","0.6230741143226624, 0.05617183446884155, 0.038606297224760056, 0.025517206639051437, 0.025121599435806274, 0.017675252631306648, 0.015476967208087444, 0.014202464371919632, 0.008219755254685879, 0.006867862772196531"
img92.png,sand sand sand sand sand,"sand, the, image, bread, that, it, b, food, slice, ing","0.2846754491329193, 0.0645199716091156, 0.05348893254995346, 0.05307267978787422, 0.023185737431049347, 0.02212398126721382, 0.01532483659684658, 0.014853340573608875, 0.013210834003984928, 0.012218023650348186"
img93.png,sping sping sp,"sp, black, image, that, animal, it, the, by, picture, ","0.13380733132362366, 0.1286812573671341, 0.06781025230884552, 0.06781025230884552, 0.037156954407691956, 0.029624106362462044, 0.025537576526403427, 0.02052002027630806, 0.018830226734280586, 0.014325281605124474"
img94.png,bel bel bel1 bel,"bel, the, image, it, that, , object, st, b, sh","0.315106064081192, 0.047203678637742996, 0.03453494980931282, 0.021780919283628464, 0.021611418575048447, 0.01863020658493042, 0.01508720126003027, 0.010288577526807785, 0.010208511725068092, 0.00989442877471447"
img95.png,to image to image to,"to, image, the, object, drawing, black, picture, bath, it, cart","0.18433645367622375, 0.08308695256710052, 0.05364496633410454, 0.04624485224485397, 0.03924749419093132, 0.03436625748872757, 0.02167452499270439, 0.015490085817873478, 0.013994126580655575, 0.013043958693742752"
img96.png,cart the cart the cart,"cart, the, image, wheel, object, car, , t, whe, b","0.25685012340545654, 0.09302495419979095, 0.037002772092819214, 0.03342921659350395, 0.0309169702231884, 0.02315574139356613, 0.02297554351389408, 0.01554603036493063, 0.013612558133900166, 0.013193744234740734"
img97.png,111,", the, image, column, s, paper, picture, 1, t, table","0.21007049083709717, 0.053114138543605804, 0.046508293598890305, 0.021293049678206444, 0.021293049678206444, 0.01984730362892151, 0.019539598375558853, 0.017930544912815094, 0.013118267059326172, 0.010960722342133522"
img98.png,image the image the image,"image, the, car, vehicle, , machine, tra, t, motor, cart","0.10087861120700836, 0.09402921050786972, 0.08298049122095108, 0.06118597462773323, 0.06070982292294502, 0.03981447219848633, 0.03379010409116745, 0.02550610713660717, 0.02033524215221405, 0.0179457888007164"
img99.png,woman that woman that is,"woman, that, image, it, picture, person, the, man, black, character","0.1563313603401184, 0.1189306378364563, 0.11437446624040604, 0.04014921560883522, 0.029373792931437492, 0.028918396681547165, 0.026125594973564148, 0.022876331582665443, 0.02050621248781681, 0.02018829435110092"
img100.png,train train train train train,"train, image, two, car, drawing, black, picture, the, passenger, cart","0.24516329169273376, 0.09378331154584885, 0.06702391058206558, 0.0422714538872242, 0.04194249212741852, 0.04161609336733818, 0.02210213989019394, 0.017898859456181526, 0.015550797805190086, 0.015190564095973969"
img101.png,church building building building building,"church, building, image, the, house, <0x0A>, picture, drawing, by, Church","0.24726207554340363, 0.22690042853355408, 0.05692296102643013, 0.03218132629990578, 0.01656552590429783, 0.015083082020282745, 0.014169245027005672, 0.012901244685053825, 0.010863937437534332, 0.010779392905533314"
img102.png,image image image image object,"image, ship, drawing, boat, the, black, it, object, , symbol","0.08124023675918579, 0.0632699579000473, 0.051237571984529495, 0.050050657242536545, 0.03308146446943283, 0.028518006205558777, 0.02616959437727928, 0.025763871148228645, 0.02497119829058647, 0.023275718092918396"
img103.png,object object object the object,"object, image, the, , picture, t, that, wh, item, ball","0.11628303676843643, 0.0647212564945221, 0.06371784955263138, 0.05492822080850601, 0.025147970765829086, 0.012645193375647068, 0.011072501540184021, 0.010731836780905724, 0.00977144856005907, 0.009470812045037746"
img104.png,corn corn corn corn corn,"corn, image, veget, the, black, picture, , b, food, ing","0.18049103021621704, 0.09736760705709457, 0.02992834523320198, 0.02579984813928604, 0.022591102868318558, 0.022240858525037766, 0.018875570967793465, 0.01829483173787594, 0.01815246045589447, 0.017052657902240753"
img105.png,image image image image image,"image, drawing, picture, the, building, , that, object, sketch, symbol","0.13436634838581085, 0.1096666157245636, 0.038496602326631546, 0.03370875120162964, 0.03292788937687874, 0.02093023993074894, 0.01776326261460781, 0.016557181254029274, 0.015432991087436676, 0.01383404340595007"
img106.png,image image image image image,"image, object, the, paper, machine, black, picture, drawing, t, that","0.20169182121753693, 0.04904206097126007, 0.04607075825333595, 0.03423687815666199, 0.028383366763591766, 0.024853307753801346, 0.024853307753801346, 0.012693827971816063, 0.011290124617516994, 0.01120226364582777"
img107.png,rot111,"ro, black, the, image, , kn, it, object, cord, string","0.2071785032749176, 0.03628459572792053, 0.03355776518583298, 0.031035859137773514, 0.02961462363600731, 0.015851564705371857, 0.015728207305073738, 0.014320696704089642, 0.013988958671689034, 0.01177988387644291"
img108.png,basket basket basket basket basket,"basket, bag, , image, the, object, b, box, paper, w","0.176132932305336, 0.04216335713863373, 0.03468262776732445, 0.03036912903189659, 0.02808685228228569, 0.02087237313389778, 0.02038886770606041, 0.017853088676929474, 0.015033808536827564, 0.014685550704598427"
img109.png,letter letter letter letter letter,"letter, the, that, , document, letters, image, it, paper, <0x0A>","0.27571913599967957, 0.0644737258553505, 0.039105288684368134, 0.03344852477312088, 0.03241942450404167, 0.02906058169901371, 0.027947289869189262, 0.014162996783852577, 0.012209266424179077, 0.008523441851139069"
img110.png,1111,", sm, the, 1, image, picture, and, t, object, that","0.1369612216949463, 0.08912236243486404, 0.08504116535186768, 0.04242860525846481, 0.030322358012199402, 0.01648597978055477, 0.01098203007131815, 0.010727631859481335, 0.009767619892954826, 0.008354688063263893"
img111.png,image image image image image,"image, building, picture, brick, , drawing, the, t, stack, b","0.0895548015832901, 0.06759950518608093, 0.03791989013552666, 0.037331994622945786, 0.035070162266492844, 0.019367583096027374, 0.019067315384745598, 0.012602725997567177, 0.011747032403945923, 0.009006762877106667"
img112.png,horse horse horse horse horse,"horse, image, picture, that, animal, the, p, hor, black, by","0.2783429026603699, 0.13355039060115814, 0.041696466505527496, 0.031229207292199135, 0.023026974871754646, 0.022318508476018906, 0.01521990168839693, 0.01498393900692463, 0.014867331832647324, 0.014636836014688015"
img113.png,111,", image, the, key, symbol, black, object, icon, picture, car","0.1456051468849182, 0.08762672543525696, 0.08296330273151398, 0.04801548272371292, 0.026934243738651276, 0.026516666635870934, 0.025302376598119736, 0.01739005371928215, 0.014991163276135921, 0.013543386943638325"
img114.png,man man man person man,"man, person, image, picture, the, that, drawing, character, boy, woman","0.30935314297676086, 0.08523575216531754, 0.08326127380132675, 0.032351844012737274, 0.017866384238004684, 0.015045004896819592, 0.014811753295361996, 0.013806072063744068, 0.013698631897568703, 0.0083738062530756"
img115.png,111,", symbol, the, image, cross, object, that, picture, symbols, Christian","0.12242928892374039, 0.06553167849779129, 0.06013524532318115, 0.05920293927192688, 0.0385240837931633, 0.019523056223988533, 0.018055874854326248, 0.013736184686422348, 0.012803533114492893, 0.011934204027056694"
img116.png,111 cr,", cr, the, image, object, picture, two, objects, pill, b","0.10150400549173355, 0.07426191866397858, 0.05605583265423775, 0.04647192358970642, 0.030004527419805527, 0.02908138558268547, 0.020946534350514412, 0.01763875037431717, 0.012704717926681042, 0.012410411611199379"
img117.png,b that bit that,"b, image, that, ske, drawing, sk, the, sketch, object, picture","0.2622871398925781, 0.07753193378448486, 0.050846680998802185, 0.04022303596138954, 0.03577511012554169, 0.028971565887331963, 0.02852240391075611, 0.02256307750940323, 0.019756890833377838, 0.017165085300803185"
img118.png,cat cat cat cat cat,"cat, that, animal, image, the, , picture, black, dog, k","0.7480390071868896, 0.024615900591015816, 0.017730167135596275, 0.016786586493253708, 0.011537240818142891, 0.010261434130370617, 0.007929421961307526, 0.007107887417078018, 0.00678239343687892, 0.006421441212296486"
img119.png,the image the image that,"the, , image, st, that, kitchen, object, food, ing, <0x0A>","0.10475484281778336, 0.08094827085733414, 0.06504376977682114, 0.05607122927904129, 0.0416685976088047, 0.024305079132318497, 0.02178693190217018, 0.020627450197935104, 0.01820366084575653, 0.017781974747776985"
img120.png,drag image drag image drag,"drag, image, that, black, picture, it, by, the, drawing, in","0.23639936745166779, 0.12852810323238373, 0.04955200105905533, 0.047653693705797195, 0.022334836423397064, 0.020177843049168587, 0.019865015521645546, 0.018087301403284073, 0.015837769955396652, 0.012528707273304462"
img121.png,horse horse horse horse horse,"horse, image, picture, animal, that, cart, the, s, , black","0.2300398349761963, 0.05637368932366371, 0.02621619775891304, 0.022599775344133377, 0.020577332004904747, 0.020577332004904747, 0.019330613315105438, 0.019330613315105438, 0.017877893522381783, 0.01615133136510849"
img122.png,pas the image pas the,"pas, pie, image, the, food, ing, picture, dess, b, bread","0.11162630468606949, 0.09622789174318314, 0.09254146367311478, 0.06310779601335526, 0.05272853747010231, 0.019549883902072906, 0.019097009673714638, 0.01780037023127079, 0.016985230147838593, 0.016081295907497406"
img123.png,image image image that the,"image, cart, sl, the, drawing, picture, that, sn, animal, t","0.08054409921169281, 0.06782493740320206, 0.05892731994390488, 0.04345028102397919, 0.042443759739398956, 0.0414605513215065, 0.03630407154560089, 0.028053609654307365, 0.024373400956392288, 0.01755550317466259"
img124.png,man man that is man,"man, image, person, character, that, it, drawing, picture, kn, the","0.2901804745197296, 0.0787135660648346, 0.060825131833553314, 0.05713991820812225, 0.042132336646318436, 0.026365743950009346, 0.024575574323534966, 0.023450179025530815, 0.01974702998995781, 0.01562118623405695"
img125.png,1111,", clock, image, black, time, that, the, picture, it, by","0.14512228965759277, 0.1193743422627449, 0.05863470211625099, 0.05297204107046127, 0.05015292391180992, 0.04157823324203491, 0.03998539224267006, 0.015905091539025307, 0.010678173042833805, 0.010269097983837128"
img126.png,image veget the pit,"image, p, veget, the, ing, object, food, , color, picture","0.09452499449253082, 0.07419351488351822, 0.05869190767407417, 0.04865730181336403, 0.048278648406267166, 0.04129491373896599, 0.027294272556900978, 0.022984080016613007, 0.013940549455583096, 0.01299402117729187"
img127.png,so1 so1 so,"so, image, sh, the, , object, picture, t, foot, item","0.2884137034416199, 0.05504472181200981, 0.04934176802635193, 0.048198770731687546, 0.04708224534988403, 0.026001283898949623, 0.01732059009373188, 0.01481508556753397, 0.011811615899205208, 0.009198896586894989"
img128.png,the door the door the,"the, image, door, picture, , cart, that, drawing, object, clothes","0.10328713804483414, 0.09779030084609985, 0.08834617584943771, 0.030294019728899002, 0.02114863693714142, 0.020180167630314827, 0.018809985369443893, 0.01608903333544731, 0.015963828191161156, 0.012827294878661633"
img129.png,hair hair that the hair,"hair, image, woman, the, that, 1, person, picture, it, ","0.1550477296113968, 0.06167372688651085, 0.04619148373603821, 0.042387690395116806, 0.041405778378248215, 0.02531084604561329, 0.021313868463039398, 0.020179565995931625, 0.019406501203775406, 0.015839122235774994"
img130.png,baby child child child that,"baby, child, that, image, the, boy, young, picture, infant, person","0.12634634971618652, 0.08221513777971268, 0.07087387889623642, 0.056948766112327576, 0.03883568197488785, 0.03321792185306549, 0.030721552670001984, 0.02300938032567501, 0.021114595234394073, 0.020950278267264366"
img131.png,bat bat bat image bat,"bat, image, bird, picture, the, b, animal, that, drawing, by","0.3517897427082062, 0.08756739646196365, 0.022489165887236595, 0.02096220850944519, 0.02031726762652397, 0.018070552498102188, 0.01779039390385151, 0.016975712031126022, 0.015699967741966248, 0.013015732169151306"
img132.png,image leaf leaf leaf leaf,"image, leaf, tree, the, leaves, black, picture, object, drawing, ","0.0971720740199089, 0.0971720740199089, 0.06730913370847702, 0.028724011033773422, 0.026773720979690552, 0.021345872431993484, 0.019741704687476158, 0.018837664276361465, 0.01869107037782669, 0.014330940321087837"
img133.png,shing sho the image,"sh, sand, the, sho, , image, foot, picture, feet, object","0.11471451073884964, 0.07122786343097687, 0.05768207833170891, 0.05418730154633522, 0.053347207605838776, 0.040268585085868835, 0.025397075340151787, 0.01872663013637066, 0.017592040821909904, 0.0134882852435112"
img134.png,mountain mountain mountain mountain mountain,"mountain, image, drawing, hill, the, it, that, picture, sketch, peak","0.2297753244638443, 0.12203274667263031, 0.05087082087993622, 0.03900400921702385, 0.034153051674366, 0.028985321521759033, 0.0272291861474514, 0.026807036250829697, 0.01551472395658493, 0.01446131244301796"
img135.png,image image image image image,"image, sun, it, black, the, that, picture, drawing, symbol, ","0.10522480309009552, 0.07758790999650955, 0.04251466318964958, 0.03608172386884689, 0.03234345093369484, 0.022579368203878403, 0.016911165788769722, 0.016519417986273766, 0.015277964062988758, 0.009787430986762047"
img136.png,it image image it image,"it, 1, , image, drawing, the, black, sketch, that, man","0.17925842106342316, 0.09084374457597733, 0.05819668993353844, 0.052167173475027084, 0.02685336023569107, 0.022436823695898056, 0.018456026911735535, 0.017473815008997917, 0.014040605165064335, 0.013715353794395924"
img137.png,ear that ear11,"ear, image, the, that, , picture, ears, it, drawing, by","0.2626972198486328, 0.07181742042303085, 0.04746841639280319, 0.04709901660680771, 0.045649927109479904, 0.026627369225025177, 0.02156350016593933, 0.018588898703455925, 0.017599616199731827, 0.01470502931624651"
img138.png,door door door door door,"door, image, the, drawing, that, picture, object, do, , doors","0.38251441717147827, 0.1271291971206665, 0.03670879825949669, 0.036139678210020065, 0.02836635895073414, 0.026030434295535088, 0.014601749368011951, 0.013717074878513813, 0.012200219556689262, 0.009651167318224907"
img139.png,house house house house house,"house, building, image, the, picture, , by, drawing, <0x0A>, object","0.20160561800003052, 0.11047076433897018, 0.08738956600427628, 0.06343802064657211, 0.022619521245360374, 0.01904754899442196, 0.01566808484494686, 0.015425173565745354, 0.011552922427654266, 0.011463016271591187"
img140.png,object object object object the,"object, , the, tool, image, kn, sh, t, p, b","0.08150502294301987, 0.04295013099908829, 0.04261589050292969, 0.04034791141748428, 0.01905900612473488, 0.01748952642083168, 0.017353421077132225, 0.016819510608911514, 0.016688622534275055, 0.016688622534275055"
img141.png,1111,", the, image, bin, picture, object, t, and, that, b","0.11640553921461105, 0.06279607862234116, 0.0489056371152401, 0.028750140219926834, 0.01885480247437954, 0.01841803267598152, 0.013060338795185089, 0.011171101592481136, 0.010827401652932167, 0.010013709776103497"
img142.png,veget ing ing ing the,"veget, ing, food, image, the, object, item, picture, le, ","0.13285937905311584, 0.10347098857164383, 0.06178535521030426, 0.039273157715797424, 0.03520423546433449, 0.021021408960223198, 0.014003274962306023, 0.013786176219582558, 0.012552455067634583, 0.008831755258142948"
img143.png,bott the image botting,"bott, object, jar, image, v, , the, container, picture, drawing","0.13540050387382507, 0.0649658665060997, 0.061029788106679916, 0.05644332617521286, 0.04260565713047981, 0.025841638445854187, 0.024851659312844276, 0.024087054654955864, 0.019813470542430878, 0.0180403720587492"
img144.png,pelling pit p,"p, pen, black, , object, image, the, that, paper, picture","0.2884257137775421, 0.07292544096708298, 0.06385564804077148, 0.03444753959774971, 0.03312787413597107, 0.031364843249320984, 0.026411844417452812, 0.022768432274460793, 0.014586005359888077, 0.012872104533016682"
img145.png,ele ele ele that ele,"ele, image, animal, that, the, picture, by, drawing, cart, black","0.41114741563796997, 0.09465151280164719, 0.08418480306863785, 0.04577048122882843, 0.02527686022222042, 0.020630372688174248, 0.016319967806339264, 0.011393173597753048, 0.010619605891406536, 0.010212774388492107"
img146.png,image that the image that,"image, drawing, that, the, object, picture, it, black, t, cart","0.04099616780877113, 0.028619937598705292, 0.022817805409431458, 0.022289229556918144, 0.021103020757436752, 0.02029457502067089, 0.019979937002062798, 0.018916625529527664, 0.01605433039367199, 0.012405825778841972"
img147.png,ben ben ben1 ben,"ben, image, it, the, black, picture, object, , drawing, that","0.18741053342819214, 0.06630326062440872, 0.04775644838809967, 0.04521489888429642, 0.03466746583580971, 0.028965750709176064, 0.023641157895326614, 0.014339085668325424, 0.014339085668325424, 0.01032805535942316"
img148.png,zing animal zing,"z, animal, black, image, that, the, , picture, horse, by","0.30145636200904846, 0.1758379489183426, 0.12275466322898865, 0.04659241810441017, 0.02235528454184532, 0.02019631676375866, 0.015126342885196209, 0.014321332797408104, 0.013453647494316101, 0.012154358439147472"
img149.png,man man man man person,"man, person, image, sh, picture, the, , that, male, woman","0.45879456400871277, 0.10157424956560135, 0.05394567549228668, 0.02508706972002983, 0.022664278745651245, 0.021796023473143578, 0.018069537356495857, 0.013428140431642532, 0.010457846336066723, 0.009229016490280628"
img150.png,animal animal animal animal animal,"animal, image, se, sea, by, drawing, cart, that, picture, dog","0.11843638122081757, 0.10533949732780457, 0.07646827399730682, 0.05909010395407677, 0.03366852551698685, 0.032378703355789185, 0.030895976349711418, 0.02948114648461342, 0.026842888444662094, 0.021908527240157127"
img151.png,image image image the image,"image, the, black, picture, head, that, cup, object, hair, ing","0.09685029089450836, 0.04720105975866318, 0.027105288580060005, 0.025068296119570732, 0.020142940804362297, 0.017095090821385384, 0.01683005504310131, 0.016185307875275612, 0.015565258450806141, 0.014968962408602238"
img152.png,1111,", image, the, heart, j, neck, that, 1, black, symbol","0.07735464721918106, 0.06880065053701401, 0.058848313987255096, 0.04512057080864906, 0.03859366849064827, 0.022865990176796913, 0.020337434485554695, 0.01880905032157898, 0.01739552989602089, 0.01646975427865982"
img153.png,the image the image the,"the, , image, object, table, it, picture, drawing, item, t","0.12534399330615997, 0.07662125676870346, 0.06352124363183975, 0.03194049000740051, 0.026896590366959572, 0.023551439866423607, 0.020302610471844673, 0.01581168919801712, 0.011212166398763657, 0.010129348374903202"
img154.png,bell bell bell bell bell,"bell, the, ball, image, object, , b, that, silver, picture","0.3901733160018921, 0.047704633325338364, 0.042762160301208496, 0.032786883413791656, 0.018248651176691055, 0.013991725631058216, 0.013455710373818874, 0.010644343681633472, 0.009104589931666851, 0.008034772239625454"
img155.png,star star star11,"star, image, black, , the, stars, that, picture, symbol, paper","0.5066543817520142, 0.046034522354602814, 0.03698977828025818, 0.0334174782037735, 0.026435401290655136, 0.025028536096215248, 0.015180572867393494, 0.013292553834617138, 0.007753478363156319, 0.00599142350256443"
img156.png,ham the image object the,"ham, image, , object, tool, the, instrument, drawing, t, picture","0.12568232417106628, 0.0694083645939827, 0.06674937903881073, 0.05936812981963158, 0.05405529588460922, 0.04770363122224808, 0.01988583244383335, 0.011154940351843834, 0.010316633619368076, 0.010156690143048763"
img157.png,pill pill pill pill pill,"pill, image, the, black, drawing, blank, object, picture, paper, sketch","0.10515332221984863, 0.08318313211202621, 0.048142701387405396, 0.04739631712436676, 0.028081385418772697, 0.024397533386945724, 0.023462878540158272, 0.021869808435440063, 0.01771070994436741, 0.014797850511968136"
img158.png,sphe sping sp,"sp, black, spo, , the, image, ing, object, soup, food","0.4297120273113251, 0.03873971477150917, 0.031866420060396194, 0.03161843493580818, 0.02704467996954918, 0.01994149573147297, 0.018442867323756218, 0.01773633435368538, 0.013705577701330185, 0.013077951967716217"
img159.png,1111,", the, object, image, t, item, 1, picture, bott, sh","0.12740996479988098, 0.07091432809829712, 0.04301171377301216, 0.02469954825937748, 0.02031729556620121, 0.015577809885144234, 0.012419712729752064, 0.011576445773243904, 0.01045844703912735, 0.00974834430962801"
img160.png,image image image image the,"image, object, the, picture, , food, drawing, t, cart, that","0.11634311079978943, 0.04116058722138405, 0.04116058722138405, 0.02896009013056755, 0.02400875650346279, 0.020859170705080032, 0.016630379483103752, 0.013679777272045612, 0.009184167720377445, 0.008763594552874565"
img161.png,flower flower flower flower flower,"flower, it, the, , plant, image, that, color, and, stem","0.1738554686307907, 0.06346013396978378, 0.04865656793117523, 0.04395754635334015, 0.034502673894166946, 0.034234169870615005, 0.03141504153609276, 0.028603723272681236, 0.014049677178263664, 0.0128927081823349"
img162.png,kit that is,"k, , it, that, the, image, black, picture, drawing, diagram","0.07419975101947784, 0.06916177272796631, 0.037309978157281876, 0.03616206720471382, 0.03318417817354202, 0.027726421132683754, 0.021425317972898483, 0.019970592111349106, 0.013097033835947514, 0.012400022707879543"
img163.png,suit suit suit that suit,"suit, sh, jack, image, the, bla, black, man, that, picture","0.22708635032176971, 0.09540613740682602, 0.06818368285894394, 0.04722946137189865, 0.04233621433377266, 0.03271489217877388, 0.019688168540596962, 0.01864038221538067, 0.017648357897996902, 0.01619504578411579"
img164.png,cit cit that,"c, sand, bread, food, dess, the, image, , lo, ing","0.13961316645145416, 0.06857568025588989, 0.0591159351170063, 0.05819942429661751, 0.05424783378839493, 0.047131333500146866, 0.03557659685611725, 0.02770708128809929, 0.02582583948969841, 0.02445141412317753"
img165.png,hat hat image image image,"hat, image, the, picture, it, black, that, cart, object, drawing","0.26290416717529297, 0.07532330602407455, 0.04533036798238754, 0.01949634775519371, 0.01904471591114998, 0.01831512339413166, 0.016289807856082916, 0.014152830466628075, 0.014152830466628075, 0.013295352458953857"
img166.png,crown image image image image,"crown, image, that, black, symbol, the, picture, king, it, drawing","0.18046848475933075, 0.12211108952760696, 0.028778215870261192, 0.027246665209531784, 0.0244237519800663, 0.020090432837605476, 0.019778957590460777, 0.019021237269043922, 0.017591768875718117, 0.016786182299256325"
