img167.png,piano instrument piano the piano,"piano, instrument, image, the, black, that, , it, sheet, musical","0.09328073263168335, 0.0842721238732338, 0.06878090649843216, 0.05746859312057495, 0.023219412192702293, 0.023219412192702293, 0.016855483874678612, 0.01583426259458065, 0.0149915786460042, 0.014083283953368664"
img168.png,heart the heart the heart,"heart, , the, black, object, image, t, st, it, o","0.07403245568275452, 0.06900583952665329, 0.05249686911702156, 0.04632832854986191, 0.0333690419793129, 0.020081842318177223, 0.015762418508529663, 0.014240159653127193, 0.01306750439107418, 0.012665459886193275"
img169.png,woman it that is image,"woman, it, image, that, girl, picture, the, lady, person, dress","0.16254054009914398, 0.13687285780906677, 0.0963020846247673, 0.08700168132781982, 0.03983227536082268, 0.034070346504449844, 0.020503897219896317, 0.016734791919589043, 0.015356709249317646, 0.013873630203306675"
img170.png,but but but but but,"but, image, that, the, black, it, , by, picture, in","0.40645384788513184, 0.060413967818021774, 0.05167480185627937, 0.031835924834012985, 0.030856436118483543, 0.022575050592422485, 0.013480179011821747, 0.011711781844496727, 0.010416674427688122, 0.010017618536949158"
img171.png,heart image image 1,"heart, image, , the, symbol, picture, black, that, it, paper","0.1349043995141983, 0.09491710364818573, 0.06944283843040466, 0.04311803728342056, 0.03987766429781914, 0.032547201961278915, 0.020688259974122047, 0.01675386168062687, 0.01649411767721176, 0.012548062950372696"
img172.png,sking sking sk,"sk, ski, snow, image, that, the, sketch, picture, drawing, ","0.28719276189804077, 0.12644925713539124, 0.0755062997341156, 0.04875053092837334, 0.029110273346304893, 0.024322541430592537, 0.020481634885072708, 0.01807498000562191, 0.015102210454642773, 0.012230142951011658"
img173.png,cit cit man,"c, man, it, that, person, image, character, the, picture, m","0.2698160409927368, 0.07149413973093033, 0.057897720485925674, 0.0423588752746582, 0.0307492446154356, 0.029571259394288063, 0.026924937963485718, 0.02096916176378727, 0.020324010401964188, 0.015221980400383472"
img174.png,image vol vol image vol,"image, vol, cloud, the, mountain, clouds, it, that, picture, drawing","0.12483927607536316, 0.11190520226955414, 0.09062359482049942, 0.03777753561735153, 0.03719184547662735, 0.03466661274433136, 0.025561559945344925, 0.0238259918987751, 0.017984803766012192, 0.015996014699339867"
img175.png,p the image pit,"p, fruit, the, image, food, ing, object, , picture, that","0.11069513857364655, 0.06507431715726852, 0.062094345688819885, 0.059715550392866135, 0.04301149770617485, 0.030499717220664024, 0.022140420973300934, 0.02196812443435192, 0.017378216609358788, 0.016582408919930458"
img176.png,image image image that image,"image, black, that, animal, oct, drawing, picture, the, cart, illustr","0.14605790376663208, 0.11375001072883606, 0.06532113254070282, 0.043174635618925095, 0.039930008351802826, 0.033362772315740585, 0.026186741888523102, 0.01828129217028618, 0.017173683270812035, 0.015155723318457603"
img177.png,kning tool object the,"kn, object, tool, the, image, , bla, instrument, picture, black","0.06976941227912903, 0.04795176908373833, 0.04575589671730995, 0.042317286133766174, 0.03705425560474396, 0.02931232936680317, 0.026689177379012108, 0.015812814235687256, 0.015088694170117378, 0.012705953791737556"
img178.png,image image image that image,"image, camera, , the, object, that, picture, photograph, cam, by","0.14595173299312592, 0.12880195677280426, 0.08715175837278366, 0.06376159191131592, 0.04416636377573013, 0.03990098088979721, 0.02965189330279827, 0.018847890198230743, 0.01689513958990574, 0.014678752049803734"
img179.png,bed bed image bed image,"bed, image, the, , picture, it, object, drawing, b, pill","0.131100133061409, 0.10051796585321426, 0.058175332844257355, 0.044604577124118805, 0.03138323873281479, 0.02601761929690838, 0.020262543112039566, 0.01963912881910801, 0.018739787861704826, 0.015780482441186905"
img180.png,instrument instrument instrument instrument instrument,"instrument, image, guitar, the, , object, it, musical, t, that","0.11570294946432114, 0.052151404321193695, 0.04426031932234764, 0.0372709296643734, 0.029714975506067276, 0.02425265498459339, 0.020582960918545723, 0.017882786691188812, 0.01459550578147173, 0.01381874643266201"
img181.png,bro1111,"bro, br, object, the, , image, b, stick, black, picture","0.1614285111427307, 0.05892408266663551, 0.04413209855556488, 0.038643356412649155, 0.037454426288604736, 0.031539786607027054, 0.02456321008503437, 0.017417926341295242, 0.01573578454554081, 0.014898342080414295"
img182.png,woman woman woman woman woman,"woman, girl, image, person, the, that, picture, it, lady, character","0.2541967034339905, 0.09648218750953674, 0.07572973519563675, 0.049278274178504944, 0.031568847596645355, 0.030837558209896088, 0.02273819036781788, 0.020542243495583534, 0.020382380113005638, 0.015998315066099167"
img183.png,image image image image the,"image, the, drawing, eye, that, picture, , by, person, eyes","0.15934057533740997, 0.05726023390889168, 0.039663005620241165, 0.03814353793859482, 0.03555368632078171, 0.03262589871883392, 0.019634610041975975, 0.013814674690365791, 0.012876693159341812, 0.012776484712958336"
img184.png,man man man man person,"man, person, image, cart, character, picture, drawing, illustr, figure, boy","0.39539170265197754, 0.08223363757133484, 0.06556236743927002, 0.02978304959833622, 0.02527654357254505, 0.018931258469820023, 0.012222939170897007, 0.008667361922562122, 0.008599910885095596, 0.008400694467127323"
img185.png,mon moning moning,"mon, image, animal, that, by, picture, the, drawing, , creature","0.2959561049938202, 0.10718820244073868, 0.10389037430286407, 0.06301268935203552, 0.02506471611559391, 0.02410450391471386, 0.011839735321700573, 0.008798543363809586, 0.006906056310981512, 0.006746077444404364"
