img159.png,Wik Germesse Ring Uncle,"Wik, dou, Dou, ami, yme, Pent, rate, ями, ahr, baby","0.014708666130900383, 0.00416500773280859, 0.0039742779918015, 0.0035904610995203257, 0.003320633666589856, 0.0031316557433456182, 0.0029882469680160284, 0.0029882469680160284, 0.0029649920761585236, 0.0026474399492144585"
img160.png,ymeidia﻿ exchange Tak,"yme, Abr, mb, left, expectation, kw, br, jih, dou, baby","0.005728899035602808, 0.00406239740550518, 0.003983824048191309, 0.0038312061224132776, 0.0031637984793633223, 0.0026126555167138577, 0.002351135481148958, 0.002314684446901083, 0.0021323873661458492, 0.0020993277430534363"
img161.png,kunGL Secreteval Dou,"kun, sense, reserve, doub, cry, dump, Luci, mb, external, ead","0.005947624333202839, 0.005107183940708637, 0.004524714313447475, 0.003931140061467886, 0.0033103516325354576, 0.0029328090604394674, 0.002691296860575676, 0.0026289529632776976, 0.002421905053779483, 0.002403057413175702"
img162.png,Doucleémedor ba,"Dou, dou, dup, tis, chio, bott, simulate, possib, manual, ountry","0.008726047351956367, 0.006795852445065975, 0.004856776911765337, 0.00428609037771821, 0.002529524266719818, 0.002232297556474805, 0.002155181486159563, 0.0019623152911663055, 0.0019470443949103355, 0.0018871400970965624"
img163.png,commercial doubeles Schlesacco,"commercial, iczn, spiritual, jump, ap, CAA, baby, inch, disco, auf","0.00896955095231533, 0.004371410235762596, 0.004253499209880829, 0.0035818051546812057, 0.002911987015977502, 0.0026931476313620806, 0.00263076089322567, 0.0025102896615862846, 0.0022678577806800604, 0.002223993418738246"
img164.png,cryardavilRAM Fot,"cry, manual, icz, Son, Sob, abor, cr, obil, ↓, instinct","0.00913133006542921, 0.007749659940600395, 0.005062536336481571, 0.004627532791346312, 0.004591521341353655, 0.004591521341353655, 0.004246463067829609, 0.0039736307226121426, 0.0033723763190209866, 0.003192901611328125"
img165.png,ymeestroせcidдина,"yme, demi, comb, кра, Site, Vog, discovery, formed, Head, intent","0.011218009516596794, 0.006467174738645554, 0.004676362033933401, 0.004497213754802942, 0.004208270460367203, 0.004015559796243906, 0.0036705187521874905, 0.0032902315724641085, 0.0028363571036607027, 0.0027923835441470146"
img166.png,intentobil Dou confidence experiment,"intent, catalog, doub, Site, expect, Baby, baby, purs, Per, bases","0.008479230105876923, 0.0049266088753938675, 0.004148620646446943, 0.004084302578121424, 0.0035623919684439898, 0.003412562422454357, 0.0032690344378352165, 0.0031315432861447334, 0.003047075355425477, 0.003011575900018215"
img167.png,Site tideadrama lan,"Site, equivalence, perfect, bag, fat, catalog, demi, bag, rollo, üd","0.004452878143638372, 0.004401000682264566, 0.003132991027086973, 0.0030604153871536255, 0.002754075685516, 0.002700807061046362, 0.0024784000124782324, 0.0021786533761769533, 0.00207888544537127, 0.0020307281520217657"
img168.png,migrЉ Dou Douapa,"migr, ú, dou, сви, doub, ecz, forg, ountry, TAC, legs","0.006782230921089649, 0.005892504472285509, 0.0047905719839036465, 0.004018339328467846, 0.0038643984589725733, 0.003774879965931177, 0.0037601632066071033, 0.003546171821653843, 0.0030450732447206974, 0.002997863572090864"
img169.png,Spiritсей reserve◄imat,"Spirit, concerns, ird, undle, spirit, scr, jan, Conc, sé, unk","0.006192456465214491, 0.006049008574336767, 0.004766503814607859, 0.0035979459062218666, 0.0035839190240949392, 0.0032504734117537737, 0.003065488301217556, 0.003017962211742997, 0.0026842313818633556, 0.002581399865448475"
img170.png,bottuby mobium baby,"bott, cry, moral, sense, double, Vog, commercial, industry, pain, concerns","0.008953037671744823, 0.006010784767568111, 0.004466836340725422, 0.003688700031489134, 0.0033717446494847536, 0.0032173413783311844, 0.003118353895843029, 0.002677708864212036, 0.00243808189406991, 0.0023723188787698746"
img171.png,ånrfrolaswap Mitchell,"ån, baby, illi, tiny, disco, dou, aug, catalog, ition, Intel","0.0036294336896389723, 0.0035040532238781452, 0.0033698149491101503, 0.0029163318686187267, 0.002227311721071601, 0.002227311721071601, 0.002227311721071601, 0.00221862830221653, 0.00221862830221653, 0.0022099786438047886"
img172.png,bertumps mobinyVA,"bert, iny, ing, ROOT, iner, beg, 将, TAC, merc, endre","0.006437643896788359, 0.005052964203059673, 0.004840443842113018, 0.0038440926000475883, 0.0036253249272704124, 0.0035971119068562984, 0.0031620643567293882, 0.0029589037876576185, 0.0028903610073029995, 0.002801433904096484"
img173.png,Phill flusharderilaje,"Phill, intent, intellectual, catalog, Nin, ami, Reserve, Kre, intent, ツ","0.004486843477934599, 0.004469350911676884, 0.004101306665688753, 0.0031568885315209627, 0.003059761133044958, 0.002829816425219178, 0.0026376789901405573, 0.002617152640596032, 0.002606949070468545, 0.002516890875995159"
img174.png,avialyn rol pólung,"avia, intent, discover, discovered, intention, con, catalog, constants, cle, storage","0.0064436146058142185, 0.005057650618255138, 0.003969796001911163, 0.0036858303938061, 0.0034896740689873695, 0.003462517401203513, 0.003329870291054249, 0.0029501018580049276, 0.0027177610900253057, 0.002707165665924549"
img175.png,сви sense attacks Culture cam,"сви, orr, elabor, Cit, Sang, Salvador, bott, ird, ера, rollers","0.008714385330677032, 0.004888326860964298, 0.004812540020793676, 0.004682730417698622, 0.004068426787853241, 0.002742102835327387, 0.0025559207424521446, 0.00248697935603559, 0.00248697935603559, 0.002448422135785222"
img176.png,pron tackém civilCES,"pron, inaug, automatic, catalog, inch, expect, unn, BUG, iczn, Stevens","0.0054696653969585896, 0.0035314816050231457, 0.003304586047306657, 0.0032154503278434277, 0.0027827403973788023, 0.0026346456725150347, 0.0025041953194886446, 0.0022359946742653847, 0.002209944650530815, 0.0020841762889176607"
img177.png,douiba Christoph@@ Reserve,"dou, bott, legs, sure, doub, doubt, scr, sudden, purs, Stock","0.006648439913988113, 0.0052799335680902, 0.004770022351294756, 0.004696069750934839, 0.004569401498883963, 0.004193118307739496, 0.003862881800159812, 0.0033170299138873816, 0.0029966868460178375, 0.0026653085369616747"
img178.png,purs Schleselesiezodel,"purs, obil, sure, anga, ifa, bases, parliament, intent, lade, dou","0.006798808462917805, 0.005860939156264067, 0.003996813204139471, 0.0038137859664857388, 0.0035134239587932825, 0.00318653741851449, 0.0030051912181079388, 0.002867573406547308, 0.0027043791487812996, 0.0026314333081245422"
img179.png,Intentemodalattanillaume,"Intent, Fitz, erni, Ill, iez, baby, medi, Fritz, expl, manus","0.003525347914546728, 0.0034436832647770643, 0.0033902940340340137, 0.0027670771814882755, 0.0024610895197838545, 0.0024229339323937893, 0.002064365427941084, 0.002000851556658745, 0.0019698310643434525, 0.001962151611223817"
img180.png,iezTACscrladeln,"iez, spare, accept, jur, rol, dal, Western, Sho, Son, sym","0.012694405391812325, 0.0053961873054504395, 0.004041557665914297, 0.003110897960141301, 0.0027777194045484066, 0.0024899314157664776, 0.002357419580221176, 0.002339073922485113, 0.0023299548774957657, 0.0022848895750939846"
img181.png,iba reservedorrECropol,"iba, ienst, Vill, baby, rollo, periodic, conf, disco, accom, elabor","0.0078051225282251835, 0.006781207863241434, 0.004980655387043953, 0.00398646667599678, 0.003970924764871597, 0.003240974387153983, 0.003104663221165538, 0.003068492980673909, 0.0025839300360530615, 0.0025638218503445387"
img182.png,expect acc Césrut weapon,"expect, intent, sure, bag, Site, above, liqu, conf, baby, formed","0.005614854395389557, 0.005172646138817072, 0.004271555691957474, 0.004205331206321716, 0.003249628469347954, 0.003149647731333971, 0.003125136950984597, 0.0030408415477722883, 0.002823326038196683, 0.0027795543428510427"
img183.png,BacesperFAULTrobhez,"Bac, IMA, CLC, prize, amil, Baden, unicí, aden, baby, external","0.004021296743303537, 0.0038823792710900307, 0.0034395975526422262, 0.003023599972948432, 0.0026372307911515236, 0.0026269492227584124, 0.0025560916401445866, 0.002439039759337902, 0.0022823328617960215, 0.0021273682359606028"
img184.png,estr Douukiadelingham,"estr, dal, Dup, pl, lah, ser, certainly, above, baby, purs","0.005575297866016626, 0.003892185166478157, 0.003802022896707058, 0.003772435709834099, 0.0036137718707323074, 0.0034214502666145563, 0.002792506478726864, 0.0025625478010624647, 0.0025426058564335108, 0.0024072909727692604"
img185.png,confopuscle tid lit,"conf, expect, Wik, intent, forg, pl, medi, sharp, iny, ep","0.00900288112461567, 0.007376696448773146, 0.006716558244079351, 0.0058582862839102745, 0.004781393799930811, 0.003963914699852467, 0.0039177341386675835, 0.003087099874392152, 0.003003830788657069, 0.0029804548248648643"
