img80.png,babytidurmém baby,"baby, Reserve, reserve, amil, formed, intent, üd, ium, induced, Intent","0.013128320686519146, 0.009419109672307968, 0.005304321181029081, 0.0035334397107362747, 0.003242466365918517, 0.002585119567811489, 0.00256500206887722, 0.002495815511792898, 0.0024475420359522104, 0.002437999937683344"
img81.png,intent fed postalhedscher,"intent, baby, ium, CLC, forg, intent, abc, Intent, scr, Site","0.010467574931681156, 0.00864409189671278, 0.0057582068257033825, 0.0041963704861700535, 0.004131311550736427, 0.004115205258131027, 0.003732329001650214, 0.0032809276599437, 0.0031552372965961695, 0.00283940602093935"
img82.png,iez Ferdarchar Alb escaped,"iez, obil, cry, elabor, IMA, baby, ovie, catalog, Diet, сле","0.014998974278569221, 0.009721968322992325, 0.0067342109978199005, 0.00587368244305253, 0.005737619008868933, 0.005063430871814489, 0.0037044852506369352, 0.003647052450105548, 0.0034664743579924107, 0.0033206790685653687"
img83.png,ibaковиlagÚicol,"iba, reserve, mic, cry, conf, Reserve, bag, above, cle, fat","0.025745168328285217, 0.008793636225163937, 0.007121302653104067, 0.005502916872501373, 0.005375441629439592, 0.005375441629439592, 0.004473838955163956, 0.003135467180982232, 0.0027135207783430815, 0.002293956931680441"
img84.png,demiirasколouwen Stockholm,"demi, dou, Site, baby, fat, entitled, ilt, jin, authors, cha","0.006527115125209093, 0.005474953446537256, 0.004756722133606672, 0.004468526691198349, 0.004451105371117592, 0.0033077807165682316, 0.0027209061663597822, 0.0025560548529028893, 0.002526276046410203, 0.0023825052194297314"
img85.png,foss tired Stageinyede,"foss, Vog, Dou, ulle, astro, せ, kun, ester, industry, iez","0.004352962132543325, 0.004186202771961689, 0.0031109219416975975, 0.0030626915395259857, 0.002810483565554023, 0.002579044783487916, 0.0025390605442225933, 0.002329972805455327, 0.0023118406534194946, 0.0022671257611364126"
img86.png,douoch Wing dou dou,"dou, double, emor, tid, Vog, party, wi, Site, disco, doub","0.007554492447525263, 0.0064616999588906765, 0.004441056866198778, 0.00425427220761776, 0.0040912930853664875, 0.0035824563819915056, 0.0031987736001610756, 0.0030522907618433237, 0.0027575150597840548, 0.002540342044085264"
img87.png,baby DouTACattering,"baby, migr, yme, intent, @, tring, dump, abandon, intent, obil","0.008311478421092033, 0.004772880580276251, 0.0037609394639730453, 0.003105772892013192, 0.0029867924749851227, 0.002783996518701315, 0.002719505224376917, 0.0025747758336365223, 0.0024955582339316607, 0.0024377487134188414"
img88.png,daliumINCT Reserve excess,"dal, intent, above, intent, expect, anx, mb, Vog, c, mic","0.011273181065917015, 0.009604869410395622, 0.0042289672419428825, 0.0039111552760005, 0.003880718257278204, 0.003617227077484131, 0.003603125223889947, 0.0035611470229923725, 0.003451582510024309, 0.003384822513908148"
img89.png,babyemenedorbundle tro,"baby, dou, Vog, intent, br, Ryan, reb, oups, Baby, 将","0.00935983844101429, 0.005788997747004032, 0.003752287244424224, 0.0035249474458396435, 0.0030986275523900986, 0.0027884626761078835, 0.00262977066449821, 0.002599133178591728, 0.002538924338296056, 0.0024898170959204435"
img90.png,authority ilSG креead,"authority, milit, Ost, disco, forg, stages, arrang, catalog, ej, 将","0.006525574717670679, 0.003143259324133396, 0.003011058084666729, 0.0026676494162529707, 0.002525679999962449, 0.0022728657349944115, 0.0022376282140612602, 0.0020694679114967585, 0.0020453580655157566, 0.001974700018763542"
img91.png,forg mobmanualesseahlen,"forg, opacity, intent, intent, ////////////////, dash, Dou, Intent, left, perfect","0.018123073503375053, 0.004654390271753073, 0.004476083442568779, 0.0032366204541176558, 0.0027901409193873405, 0.0027042971923947334, 0.0026210949290543795, 0.002491315593943, 0.002377229742705822, 0.0023587301839143038"
img92.png,cataloghausen Gladoggle fed,"catalog, scratch, ера, cry, scr, intention, sure, comb, discovered, rollers","0.006462897174060345, 0.00476544164121151, 0.0033268143888562918, 0.0030648051761090755, 0.002845575101673603, 0.0027688208501785994, 0.002683633007109165, 0.0026317269075661898, 0.0025408125948160887, 0.002396214520558715"
img93.png,ymeoweevallegugen,"yme, explained, conf, commercial, zero, catalog, expect, tid, caught, ymi","0.007410026621073484, 0.004747041035443544, 0.004459432791918516, 0.004140442702919245, 0.003889586078003049, 0.00316221104003489, 0.0029018078930675983, 0.0020819453056901693, 0.002025788417086005, 0.001994381658732891"
img94.png,demi experiments demonoshiavia,"demi, baby, Man, yours, manual, reserve, jet, explanation, pron, manual","0.006762819830328226, 0.005266889464110136, 0.005065117962658405, 0.0037788080517202616, 0.0037640761584043503, 0.003577703842893243, 0.0033740962389856577, 0.0032702863682061434, 0.003182075684890151, 0.0031573127489537"
img95.png,Vogitschlynë Reserve,"Vog, fat, commercial, Site, fl, Kim, zy, Taylor, aller, entitled","0.008983029052615166, 0.007927495054900646, 0.006007407791912556, 0.004161209799349308, 0.003878674004226923, 0.0029049927834421396, 0.0027289879508316517, 0.002718348754569888, 0.002718348754569888, 0.002697194227948785"
img96.png,babyanzaedorém Swiss,"baby, cry, td, rol, demi, Baby, purs, perfect, Chal, concerns","0.006198207847774029, 0.005280938930809498, 0.0035732623655349016, 0.0029623382724821568, 0.0027937511913478374, 0.0027183943893760443, 0.0026554230134934187, 0.002543739276006818, 0.0024272529408335686, 0.0023989747278392315"
img97.png,duplicateuri infant否oux,"duplicate, forg, double, wi, Vill, formed, ountry, baby, surname, Dup","0.014111004769802094, 0.007123229559510946, 0.005905364640057087, 0.005252340342849493, 0.003827712731435895, 0.0035262545570731163, 0.003248537890613079, 0.003223257604986429, 0.0027894966769963503, 0.002746249781921506"
img98.png,Intent Sitebrow Bacecz,"Intent, Kin, €, intent, intent, compact, iez, kin, kim, parliament","0.007495170924812555, 0.0045283278450369835, 0.004354849923402071, 0.003798367688432336, 0.0035129161551594734, 0.003458453342318535, 0.003458453342318535, 0.0031001376919448376, 0.003016516799107194, 0.0026003997772932053"
img99.png,catalogBOchenvil Secret,"catalog, Longrightarrow, conf, ird, medi, timing, TAC, ◄, iczn, discovered","0.015086925588548183, 0.008800126612186432, 0.005421600770205259, 0.003920316230505705, 0.003514148760586977, 0.0027908007614314556, 0.0027049370110034943, 0.002434179652482271, 0.0023136551026254892, 0.0019789738580584526"
img100.png,obiléal ehemCAAej,"obil, conf, blanc, Bapt, Bod, aggio, cla, Site, undle, dou","0.005112978629767895, 0.004390479065477848, 0.004305559676140547, 0.0037700741086155176, 0.0032754968851804733, 0.0027367803268134594, 0.0024057840928435326, 0.0022866653744131327, 0.00213974853977561, 0.0019105805549770594"
img101.png,dou Dou pamistoryich,"dou, baby, String, Head, doubt, Station, expla, raint, estr, estro","0.006005473434925079, 0.003862308571115136, 0.003572051413357258, 0.0034084750805050135, 0.003214498283341527, 0.0029154231306165457, 0.0026441740337759256, 0.002603180008009076, 0.0025829218793660402, 0.002542877569794655"
img102.png,discoveredolin attachölril,"discovered, discovery, Dou, discover, disco, baby, uso, dou, Disc, Diet","0.01590661332011223, 0.012781322933733463, 0.010975232347846031, 0.007339695934206247, 0.004399885889142752, 0.003480596700683236, 0.0030239943880587816, 0.002885516034439206, 0.0027533783577382565, 0.0026686659548431635"
img103.png,краcki hemirasнок,"кра, catalog, dou, ingham, Site, perfect, earth, demi, discovery, ilt","0.008150375448167324, 0.007868817076086998, 0.00596294179558754, 0.004772678948938847, 0.004050519783049822, 0.0038349551614373922, 0.00364507338963449, 0.0035885616671293974, 0.002515024971216917, 0.0023442611563950777"
img104.png,legsoweARN Sieucha,"legs, olin, Zur, wi, announ, rou, 将, expect, WID, кре","0.00701669417321682, 0.004141045734286308, 0.0038448311388492584, 0.003433047793805599, 0.0032886583358049393, 0.002791048027575016, 0.0027477769181132317, 0.0023138602264225483, 0.00209857989102602, 0.001963747665286064"
img105.png,bottodbiezARNril,"bott, ev, discovered, equivalence, intent, manual, accompan, ovie, yme, abor","0.008541055954992771, 0.006200141739100218, 0.004500820301473141, 0.003987506031990051, 0.003864823142066598, 0.0036448752507567406, 0.0035052422899752855, 0.0034915765281766653, 0.0033186967484652996, 0.0031298291869461536"
img106.png,discodru mobilintonium,"disco, discovered, catalog, hy, Arr, ket, baby, ued, bach, Sim","0.009001756086945534, 0.007065559271723032, 0.005417352542281151, 0.0034434786066412926, 0.0033505968749523163, 0.002911049174144864, 0.002320890547707677, 0.002223276998847723, 0.00213810452260077, 0.002129768952727318"
img107.png,spiritualnehTAC comb taken,"spiritual, Fischer, bases, ﻿, ilib, cre, timing, baby, cler, iny","0.004056393168866634, 0.0035380495246499777, 0.0034025085624307394, 0.0032466966658830643, 0.0031714867800474167, 0.0030144555494189262, 0.0028429024387151003, 0.0025088523980230093, 0.0024507350753992796, 0.002366073429584503"
img108.png,将 targetsпу Jewish鬼,"将, intent, disco, rollo, comb, intent, 串, onym, baby, Intent","0.005679314024746418, 0.005591264460235834, 0.004838835913687944, 0.004726744256913662, 0.0037832390516996384, 0.00332568003796041, 0.002500568050891161, 0.00245220260694623, 0.002414184855297208, 0.0021981403697282076"
img109.png,douirasornohelm Dou,"dou, doub, lib, formed, anz, iez, javascript, together, ps, pitt","0.01167366560548544, 0.006756199523806572, 0.005139845423400402, 0.003658961271867156, 0.002708508400246501, 0.0026149414479732513, 0.0024089969228953123, 0.0023902500979602337, 0.0023716490250080824, 0.0022807924542576075"
img110.png,свиymicomb forgäch,"сви, prize, beck, IMA, purs, aden, Künstler, expect, pdf, ple","0.003941292874515057, 0.003424254711717367, 0.003166917944326997, 0.00309355603531003, 0.0029634456150233746, 0.0026152310892939568, 0.0026152310892939568, 0.002584763104096055, 0.0025746861938387156, 0.0025347694754600525"
img111.png,disco◄TACeadaje,"disco, discovery, Außer, parliament, Bürger, discovered, commercial, oser, concerns, Sel","0.005423320457339287, 0.004880460444837809, 0.0032257873099297285, 0.003200683742761612, 0.0028467471711337566, 0.0028356488328427076, 0.0024065838661044836, 0.0022785079199820757, 0.0020504349377006292, 0.0018596637528389692"
img112.png,expect Fightenk ShangTAC,"expect, emot, reserve, above, Reserve, ester, undle, inv, extraordinary, Simon","0.011488892138004303, 0.00551243033260107, 0.00519871711730957, 0.0032405906822532415, 0.003116445615887642, 0.002697058953344822, 0.0026552448980510235, 0.0026448932476341724, 0.0025635184720158577, 0.002253476995974779"
img113.png,babyера Secret Hashatos,"baby, effort, olin, cry, forg, @, Site, disco, prize, Hi","0.00882098451256752, 0.004758564289659262, 0.004684789571911097, 0.004594177473336458, 0.0038536028005182743, 0.003194748889654875, 0.003108575940132141, 0.0029202369041740894, 0.002819356042891741, 0.0027007777243852615"
img114.png,expectation cargovil mine established,"expectation, expect, estr, 将, above, dou, Weg, intent, amil, intention","0.004808082710951567, 0.004064658191055059, 0.0036010874900966883, 0.00300882151350379, 0.00300882151350379, 0.0028045300859957933, 0.0027182435151189566, 0.002306943293660879, 0.0021671727299690247, 0.0021335738711059093"
img115.png,tid Soph babyゼede,"tid, yme, clim, invol, idea, bases, ovie, demi, lacht, reset","0.003259835531935096, 0.0031105568632483482, 0.0030503931920975447, 0.002723694546148181, 0.002660600235685706, 0.0025190056767314672, 0.0024994027335196733, 0.00232061673887074, 0.0021295177284628153, 0.0020801874343305826"
img116.png,forg jet FrederestroSession,"forg, bott, hydro, сви, ера, legs, doub, dou, Wik, rate","0.007305136416107416, 0.0041138487868011, 0.00351876113563776, 0.0034642077516764402, 0.0034642077516764402, 0.0033055702224373817, 0.0028163809329271317, 0.002635430311784148, 0.0025643440894782543, 0.0024184067733585835"
img117.png,cryirasaviaochastic jel,"cry, Site, bases, purs, commercial, baby, paper, expect, hill, manual","0.006606311071664095, 0.006157759111374617, 0.006133751943707466, 0.004776971414685249, 0.004739796277135611, 0.004022612702101469, 0.0031573849264532328, 0.002830261830240488, 0.002669190987944603, 0.0024782598484307528"
img118.png,Reserveós DresdenTAC Holz,"Reserve, clou, Sel, reserve, mb, dou, ril, yme, kun, scr","0.008165067993104458, 0.006187439430505037, 0.004818782210350037, 0.004336434882134199, 0.0041540502570569515, 0.0038268903736025095, 0.0035531476605683565, 0.0033509370405226946, 0.0031726036686450243, 0.003160234773531556"
img119.png,douitchaviibaoi,"dou, double, td, double, iny, igg, bund, Site, fat, сви","0.005784792825579643, 0.005695108324289322, 0.004232244566082954, 0.003960325848311186, 0.00392950652167201, 0.0030483717564493418, 0.002556978724896908, 0.0025470098480582237, 0.0023833659943193197, 0.002310037612915039"
img120.png,ymeclouentes Cam Dou,"yme, zett, odor, ovie, iez, slight, Site, Ill, ienst, ountry","0.005346124991774559, 0.004590680357068777, 0.004519508220255375, 0.0034517175517976284, 0.0029989040922373533, 0.0029066374991089106, 0.0028953056316822767, 0.002817210042849183, 0.0027627197559922934, 0.002646523527801037"
img121.png,@olin experiment Cesvik,"@, demon, apart, dal, assoc, bert, jan, accept, counting, cle","0.004902573302388191, 0.004144538659602404, 0.003449391108006239, 0.003253085305914283, 0.003079959424212575, 0.002760858042165637, 0.0023707295767962933, 0.0023614868987351656, 0.0023431095760315657, 0.0022184117697179317"
img122.png,iezkovingoanzaarda,"iez, ulle, yme, cour, discovery, cry, Site, bott, Fu, manual","0.00921582244336605, 0.007700107991695404, 0.006163089070469141, 0.005312914960086346, 0.004743899218738079, 0.004597944673150778, 0.004252403508871794, 0.004235825035721064, 0.0038718576543033123, 0.003470710711553693"
img123.png,ouwenardaviarialiny,"ouwen, intent, intent, rol, demi, industry, ú, dal, olin, timing","0.009898990392684937, 0.005055909976363182, 0.004375525284558535, 0.0034884726628661156, 0.0032516142819076777, 0.0032012027222663164, 0.0031887225341051817, 0.002792138373479247, 0.002633237512782216, 0.0025422710459679365"
img124.png,spiritual mobilelesllesieux,"spiritual, inch, reserve, assim, pl, perfect, cre, dou, fect, baby","0.0051088095642626286, 0.0034165207762271166, 0.003285636194050312, 0.003050609491765499, 0.002979942597448826, 0.0028657824732363224, 0.0027026901952922344, 0.0026712031103670597, 0.002499579917639494, 0.002489835023880005"
img125.png,baby kun Leb Tag access,"baby, oux, cry, purs, sel, Sel, left, formation, cha, Baby","0.007820767350494862, 0.004913266282528639, 0.004456138703972101, 0.004121255129575729, 0.0035946224816143513, 0.003403320210054517, 0.002519272966310382, 0.0024513197131454945, 0.0023851993028074503, 0.002375900512561202"
img126.png,kun否zkjih sooner,"kun, cle, Wang, disco, Cle, aden, ugno, baby, rut, distint","0.008442441001534462, 0.005870796274393797, 0.00538734532892704, 0.0035608180332928896, 0.0033845098223537207, 0.003280379343777895, 0.0026878463104367256, 0.002456890419125557, 0.0024473119992762804, 0.0021597454324364662"
img127.png,cry◄ attach opporttd,"cry, bott, eerst, Site, ril, ouwen, disco, forg, bases, baby","0.008566909469664097, 0.006671915762126446, 0.0038463545497506857, 0.003381162416189909, 0.0029261521995067596, 0.0027921537403017282, 0.0027921537403017282, 0.0027488654013723135, 0.002727473620325327, 0.0024258652701973915"
img128.png,ymeissonoweissonaci,"yme, snapshot, iny, double, asp, agem, burgh, sdk, cry, cr","0.005701146554201841, 0.00456314068287611, 0.0041224537417292595, 0.0036665864754468203, 0.003623869037255645, 0.0023034713231027126, 0.002147071296349168, 0.0020169869530946016, 0.0019473092397674918, 0.0017319726757705212"
img129.png,Reserve cha Dou Bern left,"Reserve, reserve, illery, excess, elij, kmal, mier, equivalence, icz, Ehr","0.02739987149834633, 0.01701296865940094, 0.007147683762013912, 0.005108219105750322, 0.0042847818695008755, 0.0037081693299114704, 0.0035522086545825005, 0.0033763267565518618, 0.003209153190255165, 0.0031348131597042084"
img130.png,babyorisohlintoniez,"baby, icz, dou, cry, Zur, Baby, Alfred, undle, abor, ses","0.01878444477915764, 0.0055744037963449955, 0.004514290019869804, 0.004392524715512991, 0.003226217348128557, 0.002532287035137415, 0.002483308082446456, 0.0024543767794966698, 0.0024448081385344267, 0.002226022770628333"
img131.png,baby demselbentidrf Freder,"baby, yme, reserve, Reserve, Künstler, iez, Baby, excess, 将, coll","0.011381124146282673, 0.0050110407173633575, 0.004404987674206495, 0.004370707552880049, 0.004286170471459627, 0.003995150327682495, 0.0036093175876885653, 0.0027458241675049067, 0.002509886398911476, 0.0020645763725042343"
img132.png,collWikariat double baby,"coll, manif, commercial, mobil, double, obil, cry, organ, induced, un","0.010008592158555984, 0.00823284313082695, 0.005747450981289148, 0.005315523128956556, 0.0045112259685993195, 0.003828627523034811, 0.003198938211426139, 0.0029355105943977833, 0.0027792854234576225, 0.0027255292516201735"
img133.png,obil alco Toniras pity,"obil, oups, baby, intent, dou, tank, dal, astro, snap, ART","0.005872553214430809, 0.003058564616367221, 0.002999406773597002, 0.002709737978875637, 0.00265732710249722, 0.0026366475503891706, 0.002616128884255886, 0.0025755695533007383, 0.002410090761259198, 0.002194412983953953"
img134.png,babysuiteнадheimimat,"baby, iba, bomb, Baby, pron, gro, ev, Bomb, left, bases","0.012805033475160599, 0.006721471436321735, 0.005337931681424379, 0.003997926600277424, 0.003874923102557659, 0.0030296046752482653, 0.002726348815485835, 0.002304801484569907, 0.002242633607238531, 0.0022251808550208807"
img135.png,doubleantin무jackotal,"double, dou, comb, entrepr, doubt, conf, mobil, bott, Entre, formation","0.008851268328726292, 0.00868006981909275, 0.0075708916410803795, 0.006920354440808296, 0.006501072086393833, 0.0064504798501729965, 0.006107191555202007, 0.005965718999505043, 0.0056262086145579815, 0.005285333842039108"
img136.png,dou fed Freder FC否,"dou, formation, audi, ISO, ishi, Arr, Wik, bott, cle, mier","0.005039536394178867, 0.004260324407368898, 0.004017868544906378, 0.0036015943624079227, 0.00326650426723063, 0.0028490955010056496, 0.0026556490920484066, 0.002427459694445133, 0.002210227306932211, 0.002210227306932211"
img137.png,baby tirediebzkaci,"baby, assoc, purs, bott, pron, ON, exhaust, hel, explos, anx","0.0052040652371943, 0.0037483477499336004, 0.003256620839238167, 0.0030833068303763866, 0.0024872031062841415, 0.0023733058478683233, 0.002291318727657199, 0.0022035399451851845, 0.002110862173140049, 0.0020539250690490007"
img138.png,bott pó甲 Hunter dav,"bott, recovered, baby, paper, tis, formed, sense, sure, disco, obser","0.006953363306820393, 0.005479118786752224, 0.005457757040858269, 0.0024987435899674892, 0.0024124232586473227, 0.0023750222753733397, 0.002338201040402055, 0.0022574265021830797, 0.0020314641296863556, 0.0020156551618129015"
img139.png,ade Baden Chor Museumém,"ade, discovery, discovered, demi, scr, <0x86>, astro, double, abor, кра","0.008069346658885479, 0.006383378989994526, 0.00420270673930645, 0.00420270673930645, 0.003994616214185953, 0.002956973621621728, 0.002821563510224223, 0.002609519986435771, 0.002284971997141838, 0.002240776550024748"
img140.png,mobiloris Christophilloowe,"mobil, obil, formed, pseud, bott, forg, dou, catalog, surname, disco","0.010493973270058632, 0.008632106706500053, 0.00699049374088645, 0.003042014315724373, 0.0029948519077152014, 0.002925476524978876, 0.0028244145214557648, 0.0028244145214557648, 0.002653291914612055, 0.0026429479476064444"
img141.png,bottuby Reserve≫ sod,"bott, dou, intention, thy, ém, ass, intent, doubt, forg, eu","0.014841083437204361, 0.01024003978818655, 0.009695075452327728, 0.005502550862729549, 0.005481098312884569, 0.005417241714894772, 0.004473542328923941, 0.0030506907496601343, 0.003015149151906371, 0.0027453245129436255"
img142.png,forg dou douoph minute,"forg, baby, Baby, formation, ba, infant, Vog, kun, bin, 将","0.0364169143140316, 0.01541989203542471, 0.0031327407341450453, 0.0029544560238718987, 0.002597133396193385, 0.00256687612272799, 0.0024879013653844595, 0.002468540333211422, 0.002430269028991461, 0.0023189792409539223"
img143.png,mbyldern douéal,"mb, iny, ера, astro, itsch, reserve, Wik, borg, purs, Intel","0.010291213169693947, 0.008666071109473705, 0.005979408510029316, 0.004899352323263884, 0.003570467932149768, 0.0034877583384513855, 0.003433685516938567, 0.0029141311533749104, 0.002880180487409234, 0.002857766579836607"
img144.png,babyorno Fish cacheountry,"baby, Dou, clip, dou, equivalence, clip, AC, Vog, bases, sein","0.013412071391940117, 0.0063851033337414265, 0.006021725945174694, 0.005314154550433159, 0.004972723312675953, 0.0049147894605994225, 0.00437130406498909, 0.0035538452211767435, 0.0031485322397202253, 0.002992637688294053"
img145.png,SiteERYdalohliny,"Site, medi, charts, expect, yme, manual, above, intent, baby, estro","0.0063766310922801495, 0.005715975072234869, 0.005496999714523554, 0.004946764558553696, 0.003959340509027243, 0.003882759716361761, 0.0037780292332172394, 0.00373401353135705, 0.003661791328340769, 0.002616964280605316"
img146.png,catalogauf ál Reserveocity,"catalog, intent, coff, ijo, CAA, Amy, ツ, hydro, measurement, disco","0.004599368665367365, 0.003903433680534363, 0.0036242154892534018, 0.003364969976246357, 0.0026619103737175465, 0.002321759471669793, 0.0023127077147364616, 0.002285763854160905, 0.0022679760586470366, 0.0021896278485655785"
img147.png,baby Douirasobil Spark,"baby, sudden, rollers, Ryan, Cle, 史, ril, Baby, noc, 박","0.008205258287489414, 0.006193654146045446, 0.005215579643845558, 0.0048995837569236755, 0.003354302840307355, 0.003315224079415202, 0.003114365041255951, 0.0027377023361623287, 0.002727028913795948, 0.002727028913795948"
img148.png,свиudi babyzettestro,"сви, clos, intent, ouwen, cha, ead, intent, Wik, intention, attempt","0.0068095107562839985, 0.006600004155188799, 0.006009372416883707, 0.0044137584045529366, 0.004228121601045132, 0.0029401970095932484, 0.0028608902357518673, 0.0027946175541728735, 0.0027946175541728735, 0.0026048701256513596"
img149.png,excess lunDBiezlint,"excess, conf, ей, kun, Pent, ril, Künstler, ера, obil, Site","0.005220088642090559, 0.004049560055136681, 0.003909665625542402, 0.00378937809728086, 0.003153800265863538, 0.0028050479013472795, 0.0027400690596550703, 0.002485134871676564, 0.002142320154234767, 0.002092693466693163"
img150.png,otteholm excess Generneh,"otte, Wik, aga, obil, dou, Intel, apart, undle, Dal, javascript","0.005595188122242689, 0.005094476509839296, 0.00430676992982626, 0.004174264147877693, 0.003800711128860712, 0.003138615982607007, 0.0029369620606303215, 0.002653324045240879, 0.002571689896285534, 0.0023052478209137917"
img151.png,Gangead Sonevaliez,"Gang, yll, discovery, Reserve, reserve, baby, coff, Ryan, mier, jur","0.008525359444320202, 0.007494271267205477, 0.005110648926347494, 0.005011799745261669, 0.004953410942107439, 0.0036667115055024624, 0.0031732742208987474, 0.0031118975020945072, 0.003099765395745635, 0.0028223684057593346"
img152.png,conf Rh Gangchusiny,"conf, olin, unk, otte, excess, Swiss, forg, bott, external, expectation","0.004195875953882933, 0.0035057857166975737, 0.003242321778088808, 0.003130313940346241, 0.00281697791069746, 0.002751722699031234, 0.002595121506601572, 0.0023721333127468824, 0.002118076663464308, 0.0020529101602733135"
img153.png,babyrzlagчин cargo,"baby, double, cry, Stack, iez, clip, my, dou, legs, ev","0.008252453990280628, 0.0049470518715679646, 0.004611159209161997, 0.0045043425634503365, 0.0042980732396245, 0.003913440275937319, 0.00307169440202415, 0.0030597189906984568, 0.0028187453281134367, 0.002458553295582533"
img154.png,burghubyincrement Apache Jet,"burgh, ird, hel, iczn, involve, ◄, dal, Swiss, dn, formation","0.006882742512971163, 0.0053602852858603, 0.003556798445060849, 0.0032895011827349663, 0.0032766766380518675, 0.0032766766380518675, 0.002960230689495802, 0.0028916571754962206, 0.0023235115222632885, 0.0021998565644025803"
img155.png,rolerni militingham dou,"rol, Soph, atomic, manif, forg, industry, doub, blanc, baby, evol","0.004201904870569706, 0.003483501495793462, 0.003159398678690195, 0.002899227198213339, 0.0027342315297573805, 0.002609022194519639, 0.0024798403028398752, 0.0024605421349406242, 0.0024035435635596514, 0.0023755417205393314"
img156.png,fullobil assim➜idor,"full, perfect, Künstler, dou, empty, baby, Dou, dal, rollo, kun","0.008731062524020672, 0.008462436497211456, 0.004974809475243092, 0.004511956125497818, 0.003064891556277871, 0.0030529422219842672, 0.00284565519541502, 0.00270475703291595, 0.0025112819857895374, 0.0024245285894721746"
img157.png,oux Reserveвля ba experiment,"oux, мар, comb, baby, tring, ountry, agem, external, cas, prov","0.006889198906719685, 0.0041785105131566525, 0.002928487490862608, 0.002666418207809329, 0.0026456681080162525, 0.002524514216929674, 0.0024089079815894365, 0.002399516524747014, 0.0022278758697211742, 0.0021847847383469343"
img158.png,inchrouладexternalWT,"inch, Cit, iez, apps, inaug, obil, Stack, fant, BUG, mobil","0.010666843503713608, 0.008471193723380566, 0.006369463168084621, 0.004128530155867338, 0.0036576748825609684, 0.0036292108707129955, 0.003572945250198245, 0.0029390244744718075, 0.0027935029938817024, 0.002553468570113182"
