img79.png,etti lifetime Lars principle expos,"etti, impossible, emann, nerv, Mais, urm, et, immense, alive, ++)","0.033272191882133484, 0.006919956766068935, 0.006374962627887726, 0.004004963207989931, 0.002410229528322816, 0.0022998570930212736, 0.0021945389453321695, 0.002177460817620158, 0.002160515869036317, 0.0021353450138121843"
img80.png,thread Claudecha seracci,"thread, Thread, Oxford, Crist, etti, aining, Isaac, emann, Ż, threads","0.006507065147161484, 0.006018051411956549, 0.0056977770291268826, 0.005500944331288338, 0.005500944331288338, 0.005107454024255276, 0.0032464955002069473, 0.003146611386910081, 0.0030142690520733595, 0.0029791516717523336"
img81.png,Cristisserovis alive Eu,"Crist, ijn, Ellen, meta, oup, urm, ter, Mari, ан, <0xB8>","0.0054910918697714806, 0.004826979245990515, 0.004499239381402731, 0.0042932042852044106, 0.0038035681936889887, 0.003773968666791916, 0.00339620397426188, 0.003044337732717395, 0.0030206465162336826, 0.0029506732244044542"
img82.png,nerv zoo boat Nathan Hil,"nerv, impossible, et, Oxford, Mais, etti, OM, Isaac, Else, adj","0.012906731106340885, 0.006748441141098738, 0.006617913953959942, 0.004602036904543638, 0.0033669222611933947, 0.0031260813120752573, 0.003065617522224784, 0.0029597142711281776, 0.002948175650089979, 0.002694850554689765"
img83.png,nervracaus1Constants,"nerv, et, OM, adj, ting, XIX, aining, impossible, urable, Eisen","0.0067684766836464405, 0.006067223381251097, 0.004743652418255806, 0.0030034934170544147, 0.0030034934170544147, 0.002968501765280962, 0.002968501765280962, 0.0027777771465480328, 0.002766947727650404, 0.002311871387064457"
img84.png,emann lifetime Cupovisobi,"emann, nerv, Crist, Loading, impossible, Oxford, Eisen, <0x84>, ere, Thread","0.008383061736822128, 0.007170412689447403, 0.005967746954411268, 0.0054763127118349075, 0.0054125115275382996, 0.003387063043192029, 0.0033476026728749275, 0.003144781570881605, 0.0030480269342660904, 0.0029427316039800644"
img85.png,Nathanjer erelek wings,"Nathan, Mare, flows, ivan, impossible, etti, Mais, zan, ere, Oxford","0.009192662313580513, 0.008112495765089989, 0.0061958166770637035, 0.005489189177751541, 0.005362032447010279, 0.00429171696305275, 0.004063315689563751, 0.0032395576126873493, 0.002892599208280444, 0.0028813225217163563"
img86.png,meta Claude Hed expos Ress,"meta, worse, ter, et, Else, Oxford, <0x88>, Nathan, impossible, threads","0.005671320017427206, 0.005004922393709421, 0.00438245665282011, 0.0038224465679377317, 0.003733899910002947, 0.0035214030649513006, 0.00349399889819324, 0.0032823083456605673, 0.0030594477429986, 0.0027965616900473833"
img87.png,ijnrefs expos alive Vern,"ijn, ere, threads, flows, dt, NaN, flow, Nathan, nerv, Mais","0.006178001407533884, 0.005430812016129494, 0.00455537298694253, 0.004484748467803001, 0.004147714003920555, 0.0033327818382531404, 0.0030464092269539833, 0.002987486543133855, 0.002987486543133855, 0.0029642374720424414"
img88.png,ijn aliveange bron alive,"ijn, etti, SS, int, urm, omm, oup, Mari, Nathan, impossible","0.014846175909042358, 0.007792884483933449, 0.004405697342008352, 0.004090551286935806, 0.004027133341878653, 0.0035262759774923325, 0.002969421911984682, 0.002767805475741625, 0.0027570149395614862, 0.002682649064809084"
img89.png,OMemes Mauricedt pil,"OM, ijn, meta, etti, emann, XIX, impossible, Crist, aining, Oxford","0.010590313002467155, 0.009530249983072281, 0.004067011643201113, 0.003645645221695304, 0.003533480688929558, 0.003465136978775263, 0.003398115048184991, 0.0032425043173134327, 0.0031304904259741306, 0.0028503439389169216"
img90.png,XIX ere ere liquid Paz,"XIX, <0x88>, OM, etti, Eisen, meta, aining, emann, et, Nathan","0.007335081696510315, 0.004554456099867821, 0.004163109697401524, 0.003805390326306224, 0.003451339202001691, 0.0032932909671217203, 0.0032295926939696074, 0.0031795226968824863, 0.002940577920526266, 0.002917693927884102"
img91.png,Eisenovis wetetti Lars,"Eisen, ter, meta, Nathan, nerv, et, Oxford, Ż, ijn, XIX","0.0056770844385027885, 0.005567279644310474, 0.005010009277611971, 0.003978755325078964, 0.00372312287800014, 0.0031474544666707516, 0.0031351835932582617, 0.0030150767415761948, 0.00281036039814353, 0.0027560030575841665"
img92.png,threads Lord principle Forumoup,"threads, hed, Else, et, etti, meta, nerv, emann, adj, ios","0.005488756578415632, 0.0035996143706142902, 0.003303192090243101, 0.0030311790760606527, 0.0028923714999109507, 0.0028586741536855698, 0.002562499139457941, 0.0025425576604902744, 0.0024072451051324606, 0.002388511784374714"
img93.png,nerv pil​ ну ere,"nerv, impossible, Loading, Oxford, XIX, Mais, et, emann, Crist, LO","0.008551016449928284, 0.00751682510599494, 0.006685602478682995, 0.004299720749258995, 0.003992155659943819, 0.003482020227238536, 0.0029551521874964237, 0.0026489810552448034, 0.0025775295216590166, 0.0023014748003333807"
img94.png,XIX etannelмиinci,"XIX, nerv, impossible, ijn, emann, meta, urm, Oxford, airo, etti","0.009595952928066254, 0.009558542631566525, 0.006442418321967125, 0.004920315463095903, 0.003201710758730769, 0.0031892280094325542, 0.0031644096598029137, 0.0029380549676716328, 0.0028144840616732836, 0.002654311014339328"
img95.png,impossibleaterraangeiebenyter,"impossible, etti, Oxford, nerv, emann, Crist, et, alive, adj, Mais","0.006312756799161434, 0.005032968707382679, 0.004783769138157368, 0.0041238670237362385, 0.003996988758444786, 0.0036678428295999765, 0.003378975437954068, 0.0031250412575900555, 0.0029471947345882654, 0.0027578393928706646"
img96.png,OMSS BBC Medicinebbi,"OM, impossible, simplicity, Oxford, Nathan, nerv, XIX, SS, complexity, transmission","0.004302086774259806, 0.0034703535493463278, 0.0033635818399488926, 0.0032856648322194815, 0.003003340680152178, 0.0029683506581932306, 0.0029109378810971975, 0.002788507379591465, 0.002660812344402075, 0.0025192066095769405"
img97.png,impossible expos PMID Eu pilot,"impossible, stack, Else, <0xB8>, transmission, distinguished, adj, —, et, Ż","0.009246026165783405, 0.0043335254304111, 0.0041838218457996845, 0.0036778151988983154, 0.0031704746652394533, 0.002557518659159541, 0.0024214100558310747, 0.0024025666061788797, 0.002328647533431649, 0.0022307077888399363"
img98.png,ettioup Herbert​ alive,"etti, cope, Crist, aining, meta, ijn, impossible, OM, ке, <0x88>","0.0064131417311728, 0.005442763213068247, 0.004840893670916557, 0.003829461755231023, 0.0035694511607289314, 0.0033401160035282373, 0.003237351542338729, 0.002936150413006544, 0.0027582580223679543, 0.002631948096677661"
img99.png,ijn ere poster Johindo,"ijn, nerv, emann, etti, urm, ios, aban, Mais, íp, ERROR","0.006920158863067627, 0.0060594938695430756, 0.003912303131073713, 0.003791934112086892, 0.0037771512288600206, 0.0037331455387175083, 0.003412371501326561, 0.0024292042944580317, 0.002372931456193328, 0.0020941048860549927"
img100.png,OMSS Bis principle Kle,"OM, emann, nerv, Oxford, etti, meta, Eisen, et, impossible, Nathan","0.0064670369029045105, 0.006391693837940693, 0.006268066819757223, 0.004805893637239933, 0.004787157289683819, 0.004046968184411526, 0.003801774699240923, 0.0032014152966439724, 0.002803253009915352, 0.0027814379427582026"
img101.png,ettioupaterraangeannel,"etti, impossible, Isaac, OM, Oxford, ere, SS, Poss, adj, emann","0.026189541444182396, 0.007076407317072153, 0.004920869134366512, 0.00432572141289711, 0.0028815516270697117, 0.002738876035436988, 0.0025133341550827026, 0.002279494656249881, 0.002209362341091037, 0.002158182440325618"
img102.png,etti堂 bott Claudeisser,"etti, nerv, threads, OM, Oxford, Crist, Mais, emann, Loading, lug","0.007351423613727093, 0.004954829346388578, 0.004582467954605818, 0.004091683309525251, 0.004059841390699148, 0.003889090148732066, 0.0035549162421375513, 0.0029586637392640114, 0.00289012654684484, 0.002878858707845211"
img103.png,impossible expos destuper obvious,"impossible, etti, emann, transmission, et, urm, keit, Crist, igger, Mare","0.00873262993991375, 0.008013512007892132, 0.005153740756213665, 0.0038150036707520485, 0.003770557465031743, 0.0028573055751621723, 0.002705242484807968, 0.0026737255975604057, 0.0026633015368133783, 0.0025813605170696974"
img104.png,impossible aliveoup hel sess,"impossible, mania, ijn, etti, et, XIX, alive, nerv, Crist, emann","0.02987104281783104, 0.005482587032020092, 0.004509852733463049, 0.004405382089316845, 0.003948959056288004, 0.003652190091088414, 0.0033909438643604517, 0.0033645553048700094, 0.003123883856460452, 0.0030754522886127234"
img105.png,Maissup drink Isaac ere,"Mais, Crist, impossible, Oxford, meta, etti, emann, Christopher, nerv, Mc","0.01332763396203518, 0.00877468567341566, 0.006394668482244015, 0.004960757214576006, 0.004845841322094202, 0.004696750547736883, 0.003955060616135597, 0.0027936238329857588, 0.0026971169281750917, 0.002361674327403307"
img106.png,emann Zoiebzan et,"emann, impossible, Oxford, etti, Crist, nerv, XIX, Isaac, iez, adj","0.009502599015831947, 0.004299920983612537, 0.0038998587988317013, 0.0035508619621396065, 0.0034416134003549814, 0.003361888462677598, 0.003133624792098999, 0.00284207402728498, 0.0027980117592960596, 0.0027762374375015497"
img107.png,XIX exposPU principle Summer,"XIX, Crist, Mais, urm, ijn, impossible, alive, meta, <0x88>, ни","0.00916732382029295, 0.004718933720141649, 0.004591648932546377, 0.004263201728463173, 0.004213533829897642, 0.00402058195322752, 0.0037475943099707365, 0.0032687101047486067, 0.0025958826299756765, 0.002477008616551757"
img108.png,ettioup Herbertaud Claude,"etti, nerv, impossible, ☆, XIX, Oxford, et, Loading, aterra, Mais","0.012645261362195015, 0.007790519390255213, 0.007261562626808882, 0.00597319845110178, 0.0036513430532068014, 0.00268183508887887, 0.00261971028521657, 0.0025391103699803352, 0.002499745227396488, 0.002460990333929658"
img109.png,ere ComplexPU principle mart,"ere, etti, pul, Nathan, simp, ison, <0xB8>, OM, sense, igger","0.004629028495401144, 0.0043998295441269875, 0.0041819787584245205, 0.003913288936018944, 0.0034132315777242184, 0.002965466817840934, 0.002965466817840934, 0.002700088545680046, 0.0025966493412852287, 0.0025663976557552814"
img110.png,Mais Claude ereisse world,"Mais, impossible, Oxford, meta, adj, nerv, ais, ни, et, adj","0.007187804207205772, 0.006752317305654287, 0.00546819344162941, 0.00482566375285387, 0.0045510344207286835, 0.004242029972374439, 0.003572147572413087, 0.003329607890918851, 0.003239797428250313, 0.002984641119837761"
img111.png,impossible Lord Hed nucle poster,"impossible, etti, ijn, OM, meta, nerv, mania, urm, Crist, urable","0.011871454305946827, 0.010893858969211578, 0.00514589436352253, 0.004401516634970903, 0.003779551712796092, 0.0032709294464439154, 0.0028753315564244986, 0.0027760020457208157, 0.002488391939550638, 0.0022924139630049467"
img112.png,etti lifetime tall dest​,"etti, Nathan, Oxford, Isaac, <0xB8>, Mari, aining, threads, Mais, Else","0.009517188183963299, 0.007354313042014837, 0.004478074610233307, 0.004425903782248497, 0.004273009020835161, 0.004109312314540148, 0.004014120437204838, 0.0029253435786813498, 0.002521804068237543, 0.0024827069137245417"
img113.png,ainingTSbounded nucle nucle,"aining, adj, Oxford, Mais, meta, OM, Crist, XIX, etti, impossible","0.005387180484831333, 0.0053661782294511795, 0.004847938194870949, 0.004717173054814339, 0.003972257953137159, 0.0035192256327718496, 0.0034918386954814196, 0.003216832410544157, 0.0031423147302120924, 0.002646094188094139"
img114.png,impossibleufferieben​ela,"impossible, etti, et, XIX, MC, Crist, ison, flow, ung, <0xB8>","0.02067914418876171, 0.004184843972325325, 0.004071964882314205, 0.004071964882314205, 0.003122083842754364, 0.0028426898643374443, 0.0026290579698979855, 0.002384452149271965, 0.0022663900163024664, 0.0022399856243282557"
img115.png,etti controllersAXIorer​,"etti, ijn, aining, nerv, aban, ++), airo, urm, Mais, ж","0.008228296414017677, 0.004670063965022564, 0.004438832867890596, 0.004010151606053114, 0.0034840800799429417, 0.0029800916090607643, 0.0028436232823878527, 0.0027561341412365437, 0.002660922473296523, 0.002640214515849948"
img116.png,impossible expos ereorem wet,"impossible, XIX, etti, Loading, aterra, Poss, Conne, Crist, nerv, metal","0.005825480446219444, 0.004519201349467039, 0.00360302091576159, 0.0033452920615673065, 0.002906440058723092, 0.002817018423229456, 0.0026670992374420166, 0.0025549244601279497, 0.002515314146876335, 0.002476317808032036"
img117.png,impossible aliveiebenrefixieben,"impossible, nerv, Oxford, Else, LO, Crist, Doug, Loading, XIX, aterra","0.008891250006854534, 0.006737735588103533, 0.005309207830578089, 0.004023285582661629, 0.003258156357333064, 0.003108954057097435, 0.00269057578407228, 0.0026180020067840815, 0.002577413571998477, 0.0025078922044485807"
img118.png,ettioupaterraalusoup,"etti, impossible, Mais, mania, Oxford, Ż, nerv, Thread, XIX, <0xB8>","0.009154604747891426, 0.007074130233377218, 0.004977271892130375, 0.003139125881716609, 0.0030544535256922245, 0.0029145798180252314, 0.0027060958091169596, 0.002633103635162115, 0.002463928423821926, 0.0024352227337658405"
img119.png,emann expos Lordaring et,"emann, thread, Thread, thread, threads, urm, etti, Crist, Mais, impossible","0.016902826726436615, 0.00870082899928093, 0.007185118738561869, 0.005956672597676516, 0.0054236119613051414, 0.004786320962011814, 0.004409365821629763, 0.00395252974703908, 0.0035017472691833973, 0.0029258194845169783"
img120.png,ettialler zooqqieben,"etti, nerv, Crist, impossible, Mais, XIX, OM, flow, Oxford, flows","0.014051367528736591, 0.010320436209440231, 0.005250612739473581, 0.004799448419362307, 0.004025784321129322, 0.004010089207440615, 0.0032096351496875286, 0.00255894404835999, 0.0024322420358657837, 0.0023299450986087322"
img121.png,etti coloup scheme alive,"etti, impossible, Oxford, Crist, Christopher, Mais, XIX, enen, urable, flow","0.009287223219871521, 0.0073181563057005405, 0.005611024796962738, 0.005209659691900015, 0.002899612532928586, 0.0027452977374196053, 0.002529087010771036, 0.0024321989621967077, 0.002403863240033388, 0.002329904120415449"
img122.png,alive alive ereaci principle,"alive, XIX, impossible, OM, threads, ter, ijn, Nathan, ios, NaN","0.00798834953457117, 0.0061010015197098255, 0.005533367861062288, 0.004446186125278473, 0.004411585163325071, 0.004292590543627739, 0.0036716472823172808, 0.003422351786866784, 0.0034090091940015554, 0.002961798571050167"
img123.png,impossible Lord Nathan nucleanter,"impossible, adj, nerv, Else, etti, aining, Mais, et, Nathan, keit","0.011982749216258526, 0.0052553643472492695, 0.005194137804210186, 0.004495151340961456, 0.004460169933736324, 0.0032759013120085, 0.0032125397119671106, 0.0031875395216047764, 0.0031627342104911804, 0.003053475869819522"
img124.png,impossibleUTCqqiebenUTC,"impossible, Thread, Mais, Oxford, etti, Crist, ere, urm, XIX, thread","0.009700264781713486, 0.00487759942188859, 0.004355206154286861, 0.004321313463151455, 0.004254317842423916, 0.003681805217638612, 0.0034051132388412952, 0.003249181667342782, 0.0030883033759891987, 0.0029932863544672728"
img125.png,etti∑​ impossible Hamilton,"etti, OM, ios, impossible, zar, emann, flow, nerv, Crist, cost","0.02834351733326912, 0.011677682399749756, 0.0036459502298384905, 0.003180054249241948, 0.0030344289261847734, 0.0024192577693611383, 0.002372465096414089, 0.002335683675482869, 0.0020855306647717953, 0.0020693009719252586"
img126.png,nerv Bible Euowosero,"nerv, alive, emann, etti, impossible, et, flow, Else, ijn, flows","0.008177684620022774, 0.0049989186227321625, 0.004128091968595982, 0.0038178609684109688, 0.003544763894751668, 0.003422308247536421, 0.003202427178621292, 0.002749902196228504, 0.002717864466831088, 0.0026342449709773064"
img127.png,Oxford Claude borerows​,"Oxford, nerv, XIX, impossible, Eisen, meta, Ż, ни, stack, emann","0.010662110522389412, 0.008271288126707077, 0.005684766918420792, 0.00544567359611392, 0.004843482282012701, 0.0044100405648350716, 0.0036276006139814854, 0.0029492180328816175, 0.0027922634035348892, 0.002738256473094225"
img128.png,ettiurmiebeniebenagent,"etti, impossible, airo, Nathan, cost, Loading, igger, Crist, Mais, XIX","0.012258734554052353, 0.010044447146356106, 0.005547070875763893, 0.005418573040515184, 0.004838241264224052, 0.004474641289561987, 0.004286443814635277, 0.003979828674346209, 0.0037975788582116365, 0.0037680258974432945"
img129.png,impossible Socнинаettiaval,"impossible, nerv, Oxford, Crist, Poss, thread, XIX, flow, emann, mania","0.008830581791698933, 0.008659783750772476, 0.007884821854531765, 0.004801103845238686, 0.0047082421369850636, 0.004510220140218735, 0.004171271808445454, 0.003609934588894248, 0.0035678776912391186, 0.0033517109695822"
img130.png,nerv pil boat schemes pilot,"nerv, OM, adj, Loading, emann, ston, ни, et, Ż, <0xB7>","0.008973127231001854, 0.007266659755259752, 0.004974826239049435, 0.0034729887265712023, 0.0031253511551767588, 0.0029131476767361164, 0.0027259800117462873, 0.0026942212134599686, 0.0026011483278125525, 0.0024150845129042864"
img131.png,impossible alive Eu et Claude,"impossible, XIX, nerv, Oxford, Mais, OM, <0xB7>, et, Crist, adj","0.00991709902882576, 0.00961198192089796, 0.005124864634126425, 0.004684505984187126, 0.004150242079049349, 0.0039140512235462666, 0.0034272579941898584, 0.0033741232473403215, 0.002690085442736745, 0.002669151173904538"
img132.png,nerv Channeloup Jew Otto,"nerv, OM, impossible, etti, Crist, <0xB7>, ijn, urm, emann, adj","0.0067297243513166904, 0.00482834130525589, 0.004448076244443655, 0.003630413906648755, 0.0035601952113211155, 0.0034913350827991962, 0.0029630574863404036, 0.0028944185469299555, 0.002883134176954627, 0.002729696687310934"
img133.png,nerv piloup​Alg,"nerv, impossible, et, ijn, etti, Oxford, XIX, Crist, meta, Else","0.009190671145915985, 0.0074719637632369995, 0.00424079829826951, 0.003488385584205389, 0.003461238695308566, 0.0033027371391654015, 0.0032136510126292706, 0.003176211379468441, 0.0030784893315285444, 0.0030189461540430784"
img134.png,nerv Bible� bott alive,"nerv, etti, OM, ijn, impossible, Ż, XIX, <0xB7>, Ellen, Else","0.0117641631513834, 0.0067820316180586815, 0.004697775933891535, 0.004447764251381159, 0.0044304244220256805, 0.003849219297990203, 0.0037747686728835106, 0.003644367679953575, 0.0028382367454469204, 0.0026455274783074856"
img135.png,ijn expos amoraterra nucle,"ijn, nerv, impossible, threads, et, adj, Thread, Mais, surrounded, ке","0.00874311849474907, 0.006862551439553499, 0.005514215212315321, 0.005119775887578726, 0.005040401127189398, 0.004571445286273956, 0.00453586969524622, 0.004050076007843018, 0.003819585544988513, 0.0038046943955123425"
img136.png,OMSSoup​ Ned,"OM, impossible, igger, Mais, nerv, XIX, Jewish, urable, flow, cost","0.006918963976204395, 0.006153854075819254, 0.005581303033977747, 0.004051591735333204, 0.003896377980709076, 0.0033852318301796913, 0.0031801308505237103, 0.003155382815748453, 0.0028064558282494545, 0.0026467395946383476"
img137.png,Elseetaletti amoranel,"Else, et, XIX, impossible, nerv, aining, Oxford, Ellen, OM, Mais","0.0065061235800385475, 0.005372737534344196, 0.004233615007251501, 0.003900189185515046, 0.0036070854403078556, 0.0035097904037684202, 0.0034151198342442513, 0.0029787204694002867, 0.002557806670665741, 0.0024791110772639513"
img138.png,ere mehrereretti Werneruffer,"ere, impossible, et, etti, nerv, emann, Crist, igger, Oxford, Thread","0.0098384665325284, 0.00828482024371624, 0.007874610833823681, 0.0070312353782355785, 0.005164295434951782, 0.0044519007205963135, 0.0036620337050408125, 0.0036052593495696783, 0.0031692262273281813, 0.0030597434379160404"
img139.png,emann expos dest tall accus,"emann, impossible, etti, urm, mania, anter, Crist, OM, iet, nerv","0.015581396408379078, 0.010501797311007977, 0.009674709290266037, 0.005280635319650173, 0.003970492631196976, 0.0038785163778811693, 0.003818385535851121, 0.00329165393486619, 0.003278820775449276, 0.002718237927183509"
img140.png,ijnrefsTP Ress principle,"ijn, Mais, meta, Nathan, impossible, Claud, aining, nerv, Oxford, Lou","0.00846543163061142, 0.007240867707878351, 0.006490672007203102, 0.0037127479445189238, 0.0033280858770012856, 0.0030779761727899313, 0.0026533815544098616, 0.002387784654274583, 0.002323378110304475, 0.0022518953774124384"
img141.png,impossible friendshipoup hel‹,"impossible, nerv, Eisen, aterra, Seg, threads, Crist, poss, Loading, íp","0.009088082239031792, 0.004999348893761635, 0.0047148349694907665, 0.004128447268158197, 0.003449446987360716, 0.0030322582460939884, 0.002893401077017188, 0.002760902512818575, 0.0026655257679522038, 0.0026037790812551975"
img142.png,impossibleurm Lord Hyperannel,"impossible, XIX, etti, urm, nerv, OM, Thread, Nathan, adj, Mais","0.01861264556646347, 0.008554842323064804, 0.006113870069384575, 0.0048176138661801815, 0.004687666893005371, 0.0038110462483018637, 0.0036507584154605865, 0.0031718341633677483, 0.0027024364098906517, 0.002681405982002616"
img143.png,impossible aliveoupTSacci,"impossible, nerv, íp, Oxford, OM, Else, XIX, distinguished, meta, urm","0.013507611118257046, 0.01043787319213152, 0.004778806585818529, 0.003401944413781166, 0.003297277493402362, 0.0032588632311671972, 0.002909837057814002, 0.0025380051229149103, 0.0023381197825074196, 0.0023381197825074196"
img144.png,Mais Herbert Zo VittGG,"Mais, iez, impossible, Oxford, nerv, Claud, etti, imgur, Lou, segment","0.006112680304795504, 0.004184800665825605, 0.0041684857569634914, 0.003870308166369796, 0.003795449621975422, 0.003678675973787904, 0.0036216434091329575, 0.003415534505620599, 0.0030497293919324875, 0.002853786339983344"
img145.png,impossible bisforum​단,"impossible, etti, adj, meta, emann, nerv, Crist, et, OM, Ellen","0.015346968546509743, 0.006652418524026871, 0.0056238239631056786, 0.004662313498556614, 0.004572135861963034, 0.004554310813546181, 0.003987887874245644, 0.003926061559468508, 0.0038351144175976515, 0.003117925953119993"
img146.png,impossible friendshipoup heludo,"impossible, etti, nerv, transmission, <0x84>, stack, Oxford, meta, ijn, urm","0.01059130672365427, 0.004004334099590778, 0.003957682754844427, 0.0035338124725967646, 0.003479026025161147, 0.0034654622431844473, 0.002964167157188058, 0.0028174009639769793, 0.002741406438872218, 0.0025955114979296923"
img147.png,Oxford exposweltardi Peter,"Oxford, Mc, transmission, aining, impossible, segment, emann, aterra, Crist, mania","0.004521694965660572, 0.0041170502081513405, 0.003928516525775194, 0.0035352823324501514, 0.0031566517427563667, 0.003083528019487858, 0.002965399995446205, 0.0027640569023787975, 0.0025265521835535765, 0.0023550058249384165"
img148.png,impossible friendship pilot Nathaneh,"impossible, etti, ijn, nerv, ля, Mais, <0x84>, Ellen, Mari, adj","0.006124409846961498, 0.005686321761459112, 0.004979110322892666, 0.0037146424874663353, 0.003489583497866988, 0.0033690345007926226, 0.0031158472411334515, 0.003103699767962098, 0.0028481152839958668, 0.002814933657646179"
img149.png,Mais​ Eu bag et,"Mais, Oxford, ais, aining, et, etti, urm, nerv, <0xB8>, Kevin","0.007117311004549265, 0.006712263450026512, 0.004453899804502726, 0.003915228880941868, 0.003915228880941868, 0.0034417069982737303, 0.0034417069982737303, 0.0033619797322899103, 0.0032840995118021965, 0.0027439678087830544"
img150.png,impossible friendshipiebenieben​,"impossible, etti, nerv, Nathan, Oxford, emann, et, sense, Else, liquid","0.012673409655690193, 0.005893683061003685, 0.00518087949603796, 0.004754242021590471, 0.004212024621665478, 0.002656491007655859, 0.002584836445748806, 0.0024377331137657166, 0.00215971190482378, 0.0020608112681657076"
img151.png,et� Lord Wo influence,"et, impossible, nerv, threads, col, Ellen, airo, adj, meta, flow","0.006489151157438755, 0.0050537558272480965, 0.004547888413071632, 0.003785088425502181, 0.0036400838289409876, 0.0032502291724085808, 0.0032375578302890062, 0.0031749375630170107, 0.0030892991926521063, 0.0030059705022722483"
img152.png,impossibleaterra suic lengthaterra,"impossible, nerv, XIX, aterra, Oxford, igger, ijn, meta, Loading, OM","0.01517153438180685, 0.005473344121128321, 0.0045910486951470375, 0.004163899924606085, 0.0038811820559203625, 0.003732495941221714, 0.0034117777831852436, 0.00335888285189867, 0.0032050684094429016, 0.002698938362300396"
img153.png,etacci mateetti Maurice,"et, etti, <0x88>, <0xB7>, Loading, OM, stack, threads, <0x84>, ERROR","0.006020914297550917, 0.004875884857028723, 0.004800291266292334, 0.0037973427679389715, 0.0034710527397692204, 0.0032353766728192568, 0.003210198599845171, 0.0026927192229777575, 0.0026822215877473354, 0.002559393411502242"
img154.png,ettioup exposqq​,"etti, impossible, nerv, OM, iez, <0x88>, ijn, Nathan, Else, Ellen","0.010828585363924503, 0.006291633006185293, 0.006145887542515993, 0.004478897899389267, 0.004409458953887224, 0.004409458953887224, 0.003742258995771408, 0.0036842406261712313, 0.003264056518673897, 0.003163631772622466"
img155.png,Maisangebecattanannel,"Mais, nerv, emes, Ellen, Oxford, ania, Isaac, impossible, meta, Else","0.00809932965785265, 0.004455436486750841, 0.0038861006032675505, 0.0031103959772735834, 0.0030741586815565825, 0.003050235565751791, 0.0029333827551454306, 0.0026813289150595665, 0.0024701557122170925, 0.002403527731075883"
img156.png,thread throughout Lorduni sense,"thread, Oxford, emann, ке, Mais, impossible, nerv, igger, XIX, et","0.006396461743861437, 0.00610354682430625, 0.005323607940226793, 0.005302853416651487, 0.0048852176405489445, 0.004413425922393799, 0.004018470179289579, 0.003477696096524596, 0.0033971352968364954, 0.0033838909585028887"
