Image File,Inference Result,Top 10 Words,Top 10 Probabilities
img1.png,metaurmiras etorem,"meta, nerv, ijn, Eisen, Else, Ellen, ter, alive, Oxford, ings","0.007920414209365845, 0.007411532569676638, 0.005932115949690342, 0.003755982033908367, 0.0034873110707849264, 0.003460172563791275, 0.003460172563791275, 0.0028021330945193768, 0.0025814459659159184, 0.0024061722215265036"
img2.png,impossible friendship dest bore nucle,"impossible, etti, nerv, OM, et, Nathan, urity, MC, alive, vos","0.02225329726934433, 0.011410356499254704, 0.003974242135882378, 0.0039587477222085, 0.003320602932944894, 0.0032436817418783903, 0.0029882194940000772, 0.0029304223135113716, 0.0025760061107575893, 0.0025360689032822847"
img3.png,ettioup exposoup�,"etti, impossible, OM, XIX, Oxford, Loading, Mais, nerv, prest, LO","0.01022408064454794, 0.008917602710425854, 0.006731359288096428, 0.005917244125157595, 0.004082775674760342, 0.002929248381406069, 0.00278421095572412, 0.00278421095572412, 0.0026567126624286175, 0.0025549358688294888"
img4.png,Nathan expos Eu etava,"Nathan, Crist, et, impossible, etti, OM, emann, ке, aining, Oxford","0.005474986974149942, 0.005306539125740528, 0.005103249102830887, 0.004610401578247547, 0.004416493698954582, 0.00261668604798615, 0.002536179032176733, 0.0024774286430329084, 0.0024774286430329084, 0.0023825198877602816"
img5.png,nervurm et boatissa,"nerv, impossible, OM, etti, Mais, et, XIX, urm, aining, Loading","0.007240742910653353, 0.006049867253750563, 0.005215311888605356, 0.004207022022455931, 0.00399871775880456, 0.0036551242228597403, 0.0030183906201273203, 0.002925524488091469, 0.002502333838492632, 0.002397089032456279"
img6.png,adjiggeraterra lifetimeoup,"adj, emann, <0x84>, nerv, Lou, adj, Mais, impossible, et, Oxford","0.006554153747856617, 0.00582938501611352, 0.004702375270426273, 0.004539929796010256, 0.004264868795871735, 0.003883207915350795, 0.003883207915350795, 0.0031693819910287857, 0.0029197712428867817, 0.0027643840294331312"
img7.png,nerv expos Andrew Andrew ere,"nerv, et, impossible, flow, meta, aining, Else, fright, threads, <0x84>","0.010775788687169552, 0.004457060247659683, 0.004187020473182201, 0.004154436755925417, 0.003623564261943102, 0.003286429913714528, 0.0031977843027561903, 0.0030632896814495325, 0.002969041932374239, 0.002900264225900173"
img8.png,ijnrefs emptyijnivan,"ijn, impossible, adj, mania, meta, Else, Crist, Ellen, et, ни","0.009338355623185635, 0.005383555311709642, 0.0048069735057652, 0.004640914034098387, 0.004428391810506582, 0.0035444400273263454, 0.0031648287549614906, 0.003079463029280305, 0.0028703748248517513, 0.002474418142810464"
img9.png,impossibleaterra Claudeicosoped,"impossible, XIX, distinguished, distinction, Eisen, etti, urm, Mais, meta, OM","0.006604028400033712, 0.006476295180618763, 0.005224216729402542, 0.004399231635034084, 0.003989929798990488, 0.003426124807447195, 0.0031073603313416243, 0.0026787123642861843, 0.0026371823623776436, 0.002448541112244129"
img10.png,impossible Claudeieben expos expos,"impossible, nerv, ting, Oxford, OM, distinction, etti, keit, Nathan, adj","0.009674331173300743, 0.0038783650379627943, 0.0038632445503026247, 0.003773752599954605, 0.0033695814199745655, 0.0032786931842565536, 0.0028044148348271847, 0.002728770487010479, 0.002675991039723158, 0.002655166434124112"
img11.png,impossible deckwelt‹ Eu,"impossible, etti, OM, et, emann, urm, nerv, <0x84>, terror, Mais","0.01678173802793026, 0.007534632924944162, 0.004678359720855951, 0.0041447971016168594, 0.003986012656241655, 0.0036864588037133217, 0.0031655365601181984, 0.0030088000930845737, 0.002380156656727195, 0.0022185498382896185"
img12.png,nerv threads Euuper poster,"nerv, impossible, emann, thread, Nathan, Loading, XX, flow, flows, Thread","0.015568126924335957, 0.008835868909955025, 0.008235935121774673, 0.005704866256564856, 0.00519433943554759, 0.003741342341527343, 0.0031016815919429064, 0.0028131031431257725, 0.002791211474686861, 0.002642665756866336"
img13.png,impossible aliveiebeniae lifetime,"impossible, meta, mania, Else, ijn, Oxford, Crist, nerv, ð, ere","0.010945232585072517, 0.008692280389368534, 0.005745246075093746, 0.004286214709281921, 0.004219763446599245, 0.0036519006825983524, 0.003003971418365836, 0.002579489490017295, 0.002155244117602706, 0.0021301349624991417"
img14.png,nerv pil friendship caughtATH,"nerv, ijn, Nathan, Thread, emann, etti, Isaac, Oxford, OM, thread","0.009393968619406223, 0.006184827536344528, 0.0061366967856884, 0.005479453597217798, 0.004507275298237801, 0.003931315150111914, 0.0035655482206493616, 0.003482952481135726, 0.0034558482002466917, 0.0027768516447395086"
img15.png,impossible friendship dest Glas profess,"impossible, Oxford, nerv, adj, etti, XIX, iez, Else, et, Lou","0.010246722027659416, 0.007125476375222206, 0.00646252604201436, 0.004172520712018013, 0.00401267409324646, 0.003275049151852727, 0.003088665660470724, 0.00276866159401834, 0.002550611039623618, 0.002386735752224922"
img16.png,nerv Bible Eu heliddle,"nerv, Loading, Eisen, XIX, impossible, Nathan, aining, <0x88>, <0xB7>, meta","0.01872439868748188, 0.006547256838530302, 0.005513343028724194, 0.005000384524464607, 0.0042272270657122135, 0.0029395746532827616, 0.002849133452400565, 0.0027940261643379927, 0.002563942689448595, 0.0024947847705334425"
img17.png,impossible exposirc Eu principle,"impossible, nerv, Mais, aining, Loading, Eisen, etti, Oxford, OM, <0xB8>","0.004637875594198704, 0.0036403099074959755, 0.0028573120944201946, 0.0028130137361586094, 0.0026529242750257254, 0.0025215691421180964, 0.002492191968485713, 0.002482475945726037, 0.0022427302319556475, 0.002106849802657962"
img18.png,nervsupzan Vill influenced,"nerv, impossible, LO, et, meta, Oxford, ни, Crist, terror, igger","0.00810194481164217, 0.006187758408486843, 0.004972003400325775, 0.0037530651316046715, 0.003471018048003316, 0.003222730942070484, 0.0031480765901505947, 0.003111400408670306, 0.002922890242189169, 0.0026717379223555326"
img19.png,impossible expos destazu wet,"impossible, Crist, terror, et, emann, Else, nerv, flow, adj, aterra","0.014257309958338737, 0.0068407319486141205, 0.006426273379474878, 0.005004786886274815, 0.004664973821491003, 0.004503820091485977, 0.004132938105612993, 0.0033209091052412987, 0.0028965482488274574, 0.0026476592756807804"
img20.png,emannettiiaeieben Cup,"emann, OM, omm, thread, cope, ijn, etti, threads, urable, nerv","0.0056487699039280415, 0.005004533100873232, 0.0045212190598249435, 0.0041651418432593346, 0.003618737915530801, 0.003507401095703244, 0.0033467854373157024, 0.0033077942207455635, 0.0031935248989611864, 0.0030117807909846306"
img21.png,OMaining epodor lifetime,"OM, ijn, impossible, Mais, aining, nerv, Else, zar, Oxford, XIX","0.00798852276057005, 0.006700784433633089, 0.006125012878328562, 0.003985621966421604, 0.003729548305273056, 0.003700524801388383, 0.0034763214644044638, 0.0032529698219150305, 0.0031776148825883865, 0.00315288663841784"
img22.png,ettioup​ziunic,"etti, impossible, OM, XIX, Mais, ijn, nerv, urm, threads, visibility","0.015359533950686455, 0.01106305792927742, 0.003244784427806735, 0.003182024694979191, 0.0030244714580476284, 0.002721729688346386, 0.002711118897423148, 0.0025568287819623947, 0.0022301054559648037, 0.0020464600529521704"
img23.png,Maisalem Therтивetti,"Mais, nerv, OM, emann, XIX, etti, Else, alive, Oxford, Nathan","0.005496441852301359, 0.00530656473711133, 0.004664769861847162, 0.004416515119373798, 0.0040056053549051285, 0.003974433522671461, 0.0034530474804341793, 0.003083224408328533, 0.0028293258510529995, 0.0027530095539987087"
img24.png,teroup alive wet Douglas,"ter, nerv, impossible, meta, ijn, OM, Else, LO, et, threads","0.005243072286248207, 0.004773871507495642, 0.003988719079643488, 0.003835913259536028, 0.0038209587801247835, 0.0035894582979381084, 0.0034519487526267767, 0.0029410969000309706, 0.002861766144633293, 0.0027307160198688507"
img25.png,ettiDT alive sta alive,"etti, impossible, keit, nerv, XIX, Mais, urm, Ż, ijn, Nathan","0.009557251818478107, 0.008238865993916988, 0.005115628242492676, 0.004031018353998661, 0.0036133809480816126, 0.0033418310340493917, 0.0027813187334686518, 0.0027596745640039444, 0.002738198498263955, 0.002685236744582653"
img26.png,impossible Lord faint Paporem,"impossible, et, nerv, Eisen, XIX, ijn, Nathan, alive, <0xB7>, <0x88>","0.007471260614693165, 0.005617616698145866, 0.0041746580973267555, 0.00364120164886117, 0.0035568533930927515, 0.0031023425981402397, 0.0029834937304258347, 0.0029372391290962696, 0.0029143812134861946, 0.002653574338182807"
img27.png,impossibleamarieben� expos,"impossible, et, ни, urm, Maurice, ting, meta, Loading, adj, nerv","0.00957450084388256, 0.004101887345314026, 0.0033741204533725977, 0.002576942089945078, 0.0025369904469698668, 0.0025369904469698668, 0.002283044159412384, 0.0022564458195120096, 0.0020625584293156862, 0.0020465075504034758"
img28.png,impossible aliveoupTSoped,"impossible, nerv, ке, terror, Crist, alive, et, Oxford, adj, adj","0.008517524227499962, 0.0038541750982403755, 0.00372103089466691, 0.0035645291209220886, 0.003207729198038578, 0.00303701707161963, 0.0029666642658412457, 0.0026697092689573765, 0.002587570808827877, 0.002488442463800311"
img29.png,impossible Lord timezoneopeduper,"impossible, Christopher, adj, 津, nerv, XIX, hed, igger, Nathan, Lou","0.009262965992093086, 0.0046577113680541515, 0.0046577113680541515, 0.0036132873501628637, 0.003139278618618846, 0.003066557226702571, 0.002926129149273038, 0.002643537474796176, 0.0024353410117328167, 0.002406968269497156"
img30.png,impossible Claude​urm nucle,"impossible, etti, nerv, íp, emann, adj, et, Oxford, XIX, Else","0.019292008131742477, 0.012262745760381222, 0.00539921410381794, 0.004618192091584206, 0.003965609706938267, 0.003858644049614668, 0.0036107285413891077, 0.0033655690494924784, 0.003016876755282283, 0.002946991240605712"
img31.png,impossible et sessedad recom,"impossible, nerv, adj, meta, ни, et, aterra, threads, aining, Martín","0.00474530179053545, 0.004405863117426634, 0.004237077664583921, 0.003995944745838642, 0.003248679917305708, 0.0030637970194220543, 0.003028102684766054, 0.002757118782028556, 0.002641158178448677, 0.002500598318874836"
img32.png,impossibleaterraContentViewangeargent,"impossible, íp, etti, nerv, igger, aterra, Loading, Crist, Ż, emann","0.01046578586101532, 0.008344052359461784, 0.0064983549527823925, 0.006225042976438999, 0.005387325305491686, 0.004717299714684486, 0.004228559788316488, 0.004179295618087053, 0.004146772436797619, 0.0031179445795714855"
img33.png,ettiDTbbi​ Lord,"etti, emann, impossible, <0xB8>, threads, ios, nerv, Isaac, thread, Crist","0.007531137205660343, 0.007214387413114309, 0.006194944493472576, 0.004159088712185621, 0.004015411250293255, 0.0038766972720623016, 0.0036276220344007015, 0.0031888841185718775, 0.0031888841185718775, 0.003066719975322485"
img34.png,impossible expos ere Andrewocc,"impossible, adj, Eisen, nerv, etti, Loading, XIX, ☆, Pul, íp","0.02756262570619583, 0.007447414565831423, 0.0031781664583832026, 0.0029623769223690033, 0.0028156994376331568, 0.0027828956954181194, 0.0025141367223113775, 0.0024945714976638556, 0.0024083952885121107, 0.0023434332106262445"
img35.png,nervSSaccioup​,"nerv, impossible, Loading, Nathan, Oxford, atti, et, XIX, vos, mania","0.009174634702503681, 0.0064551616087555885, 0.0063303071074187756, 0.003884784644469619, 0.0035928383003920317, 0.003061136696487665, 0.0030254735611379147, 0.0029669555369764566, 0.0027226312085986137, 0.002649193163961172"
img36.png,nerv expos cirisazew,"nerv, Crist, OM, impossible, <0x84>, thread, Oxford, aro, Isaac, ere","0.011306286789476871, 0.005278490949422121, 0.0047131613828241825, 0.0037723672576248646, 0.0037430105730891228, 0.0034080499317497015, 0.0034080499317497015, 0.003342132084071636, 0.0030075933318585157, 0.002869865158572793"
img37.png,ettioup​ Threadarod,"etti, ijn, Crist, urm, emann, flows, vos, <0x84>, else, Mais","0.01671583019196987, 0.006444526836276054, 0.0063943746499717236, 0.005960213020443916, 0.004429254215210676, 0.0034360582940280437, 0.0030800625681877136, 0.002859741449356079, 0.0028264245484024286, 0.0028044290374964476"
img38.png,OxfordMC amor​ Zo,"Oxford, impossible, igger, meta, adj, ijn, Mais, nerv, Eisen, emann","0.009537436999380589, 0.006896445527672768, 0.0044701071456074715, 0.0037203531246632338, 0.003270399756729603, 0.003182186745107174, 0.002852493664249778, 0.00281926104798913, 0.002797321416437626, 0.002420879667624831"
img39.png,impossible alive​단annel,"impossible, XIX, LO, Else, Eisen, Crist, Ellen, meta, Loading, et","0.006055993959307671, 0.004482887219637632, 0.004145992919802666, 0.0038796153385192156, 0.0038194674998521805, 0.003745592199265957, 0.003266963642090559, 0.0032542271073907614, 0.0032037748023867607, 0.0030332733877003193"
img40.png,et hop Innoupete,"et, Nathan, Oxford, adj, impossible, nerv, ais, Mais, Loading, XIX","0.007868715561926365, 0.006836458574980497, 0.006080471910536289, 0.00520090339705348, 0.004589781165122986, 0.003790227696299553, 0.0034781084395945072, 0.0033710983116179705, 0.002986627398058772, 0.0029174424707889557"
img41.png,impossible aliveoup​ expos,"impossible, nerv, Doug, Crist, ater, flow, thread, Lind, et, Eisen","0.009952705353498459, 0.006921019870787859, 0.004468546714633703, 0.0038072490133345127, 0.0035626357421278954, 0.0031686737202107906, 0.003000040305778384, 0.0027422585990279913, 0.002731567481532693, 0.002477424219250679"
img42.png,nerv expos professcaughtoup,"nerv, impossible, XIX, Crist, Mais, Ellen, OM, etti, Eisen, eye","0.008888602256774902, 0.007142192218452692, 0.005519059021025896, 0.005204967688769102, 0.004248171113431454, 0.0037784012965857983, 0.0034402739256620407, 0.003373732790350914, 0.0029773088172078133, 0.0027321320958435535"
img43.png,☆ ere schemes schemeoup,"☆, XIX, impossible, emann, cost, nerv, enen, pul, Pul, etti","0.0063201989978551865, 0.005599386058747768, 0.0051583959721028805, 0.00326609262265265, 0.003104377305135131, 0.002962217666208744, 0.002634650794789195, 0.002408265834674239, 0.0023250714875757694, 0.0021756868809461594"
img44.png,ere hel Claude Threadzan,"ere, Thread, Wo, SS, thread, фо, threads, etti, standing, thread","0.007050160318613052, 0.006940857972949743, 0.004921805113554001, 0.004883503541350365, 0.004160796757787466, 0.0034900824539363384, 0.0034494218416512012, 0.0033302600495517254, 0.0032152144704014063, 0.0031041435431689024"
img45.png,impossible Claudearium Beth보,"impossible, XIX, Oxford, etti, Mais, et, Poss, nerv, aining, adj","0.01730881817638874, 0.007832230068743229, 0.007650797255337238, 0.004127295222133398, 0.003802242688834667, 0.003699683817103505, 0.0033686005044728518, 0.0028477483429014683, 0.002696193754673004, 0.0025527048856019974"
img46.png,nerv expos amor dreamici,"nerv, impossible, Crist, Loading, Mais, etti, emann, OM, Oxford, urm","0.007713021244853735, 0.005776785779744387, 0.004498965572565794, 0.004446551203727722, 0.004242928698658943, 0.0038331663236021996, 0.003436028491705656, 0.0034226325806230307, 0.003369569545611739, 0.00326589890755713"
img47.png,et secret玉orem profess,"et, oped, ings, wings, ijn, impossible, mare, omm, urm, nerv","0.003749873023480177, 0.0035226799082010984, 0.0032325927168130875, 0.0032325927168130875, 0.003145399037748575, 0.0024592268746346235, 0.0021533709950745106, 0.0020387705881148577, 0.0020387705881148577, 0.002022904809564352"
img48.png,impossible LordTS dest Claude,"impossible, et, Martín, Nathan, adj, Lou, ijn, <0x88>, XIX, alive","0.013223983347415924, 0.005799741949886084, 0.005599386990070343, 0.00482697319239378, 0.004377874545753002, 0.004226639401167631, 0.004193746950477362, 0.004161111079156399, 0.004064719192683697, 0.003615235909819603"
img49.png,alive alive ereorum infl,"alive, impossible, nerv, adj, emann, et, XIX, Oxford, Ellen, etti","0.006777208764106035, 0.005424410104751587, 0.005298753269016743, 0.005095761269330978, 0.004900545813143253, 0.0047683618031442165, 0.003447964321821928, 0.003407794516533613, 0.0029839645139873028, 0.002926249522715807"
img50.png,etti lifetimeeting​ieben,"etti, nerv, impossible, XIX, Loading, igger, adj, aro, Mais, emann","0.007593768648803234, 0.006394594442099333, 0.005448262672871351, 0.004394936375319958, 0.003970494028180838, 0.003848334541544318, 0.003266039304435253, 0.003128673881292343, 0.002513960236683488, 0.0024271144066005945"
img51.png,Maisurable​itis Claude,"Mais, etti, Thread, thread, ere, threads, emann, mania, et, Oxford","0.0088115269318223, 0.005282196216285229, 0.004981585778295994, 0.004923548083752394, 0.0042113340459764, 0.0040977406315505505, 0.003956182394176722, 0.0036303969100117683, 0.0030690657440572977, 0.0027944163884967566"
img52.png,impossible alive expos Eu eye,"impossible, et, alive, surrounded, nerv, Oxford, etti, Mais, XIX, ijn","0.016957256942987442, 0.006640557199716568, 0.0039190612733364105, 0.003858301555737853, 0.003725015092641115, 0.0036529668141156435, 0.003300180658698082, 0.002969841007143259, 0.0029237980488687754, 0.002683027880266309"
img53.png,impossible Lord WoiggerPU,"impossible, nerv, et, etti, alive, OM, XIX, Crist, meta, segment","0.009352291002869606, 0.005370568949729204, 0.0041500539518892765, 0.003991067875176668, 0.0030008708126842976, 0.0029543465934693813, 0.0028972045984119177, 0.002556774066761136, 0.0024684492964297533, 0.002430179389193654"
img54.png,emann expos shock driverskele,"emann, nerv, XIX, impossible, threads, iez, ELSE, aterra, atti, OM","0.008831229992210865, 0.008040926419198513, 0.005314728245139122, 0.0052323308773338795, 0.004187905229628086, 0.003873178968206048, 0.003338888753205538, 0.0032743089832365513, 0.0031121866777539253, 0.0030759284272789955"
img55.png,ettiaterra Broadway Andrew popul,"etti, nerv, et, OM, Else, Nathan, urable, impossible, <0xB8>, ijn","0.011428209021687508, 0.005791534204035997, 0.0034854065161198378, 0.003458283143118024, 0.003431370249018073, 0.003404667368158698, 0.0032742368057370186, 0.002969603519886732, 0.0028336155228316784, 0.002725061494857073"
img56.png,XIX shockclockMCcaught,"XIX, thread, threads, impossible, nerv, alive, Thread, OM, Oxford, et","0.0066827875562012196, 0.005967057775706053, 0.005806106608361006, 0.0057609230279922485, 0.005475679878145456, 0.0054330681450665, 0.005369770806282759, 0.0042312778532505035, 0.0036618656013160944, 0.003218986326828599"
img57.png,impossible aliveimentforumbbi,"impossible, et, Crist, adj, adj, Lind, Else, emann, transmission, etti","0.014932310208678246, 0.0049434262327849865, 0.004345549736171961, 0.003129982389509678, 0.003093516919761896, 0.0029983394779264927, 0.0028947603423148394, 0.0027621998451650143, 0.002677215961739421, 0.002646025037392974"
img58.png,nerv Lord Werner ThreadCOM,"nerv, etti, Crist, transmission, SS, impossible, Christopher, emann, Mais, OM","0.007457943633198738, 0.006354247219860554, 0.005329952109605074, 0.005046297330409288, 0.004023258574306965, 0.0039608837105333805, 0.00329654011875391, 0.0026179845444858074, 0.0024497807025909424, 0.002393031259998679"
img59.png,emann aliveoinNNorum,"emann, nerv, zar, impossible, et, Mais, Loading, ☆, ais, etti","0.00811699777841568, 0.00589230889454484, 0.005428249016404152, 0.005407086573541164, 0.003730777418240905, 0.0033182220067828894, 0.002783329226076603, 0.0027616694569587708, 0.0027294952888041735, 0.0026352033019065857"
img60.png,impossible friendship dest lifetime principle,"impossible, etti, meta, Mais, Nathan, nerv, emann, et, XIX, Eug","0.00914075504988432, 0.007460467051714659, 0.007287645246833563, 0.0061849444173276424, 0.0048356917686760426, 0.003962223883718252, 0.0028988250996917486, 0.0028988250996917486, 0.002887523267418146, 0.002876266138628125"
img61.png,Crist ere ereaci tall,"Crist, nerv, etti, iez, impossible, emann, metal, thread, et, flow","0.011147486977279186, 0.008123880252242088, 0.00714134844020009, 0.00714134844020009, 0.006656468380242586, 0.0031938087195158005, 0.0029308036901056767, 0.002536399057134986, 0.0025265105068683624, 0.0023641837760806084"
img62.png,metaoup​ Revaci,"meta, nerv, Mais, Nathan, urable, Claud, oup, thread, ке, фо","0.007083553820848465, 0.00402035191655159, 0.004004678223282099, 0.003747380105778575, 0.0036038202233612537, 0.0033722773659974337, 0.0033070517238229513, 0.0032304436899721622, 0.003205304266884923, 0.002873216522857547"
img63.png,impossible friendship dest hel dest,"impossible, etti, Mais, nerv, OM, Crist, urm, Oxford, XIX, aining","0.011363891884684563, 0.010067850351333618, 0.00844492670148611, 0.006058938801288605, 0.005042696371674538, 0.004774329252541065, 0.004099683370441198, 0.003942626528441906, 0.003821325022727251, 0.002918488811701536"
img64.png,impossible aliveuper​단,"impossible, etti, et, Crist, Ż, flow, emann, flows, ti, Mais","0.011948198080062866, 0.00982832070440054, 0.006395410280674696, 0.006345640402287245, 0.0055564288049936295, 0.005179160740226507, 0.003940097987651825, 0.003601541044190526, 0.003396576503291726, 0.003190788207575679"
img65.png,impossible alive ereaci Pic,"impossible, alive, etti, nerv, et, OM, LO, Oxford, XIX, Loading","0.01785123534500599, 0.008565115742385387, 0.007100731134414673, 0.004767204634845257, 0.0038156232330948114, 0.003683810355141759, 0.003640892682597041, 0.0033410710748285055, 0.0030184064526110888, 0.002802495379000902"
img66.png,metaurm Ted ere Testament,"meta, Else, dag, et, <0xB8>, Oxford, urm, nerv, Mare, sense","0.004666425753384829, 0.0044701616279780865, 0.0037937774322927, 0.0037349604535847902, 0.003481365507468581, 0.003387461882084608, 0.0031328899785876274, 0.0026278728619217873, 0.0025569903664290905, 0.0025075336452573538"
img67.png,impossible lifetime�qq Mate,"impossible, XIX, emann, Nathan, ☆, mania, urm, et, <0x88>, transmission","0.012782786972820759, 0.010351816192269325, 0.0038380883634090424, 0.0035914937034249306, 0.0032068430446088314, 0.002775291446596384, 0.002607144881039858, 0.0023924505803734064, 0.002327918540686369, 0.002169858431443572"
img68.png,ettioupange dest principle,"etti, impossible, Oxford, emann, uru, ке, oped, Jack, igger, ter","0.027058754116296768, 0.010270345024764538, 0.004927765112370253, 0.0030837166123092175, 0.0030597192235291004, 0.0029888406861573458, 0.00243942067027092, 0.0022211179602891207, 0.0022124582901597023, 0.0021527812350541353"
img69.png,ijn expos prophNNacci,"ijn, Cec, Thread, emann, Mais, threads, thread, thread, ere, Crist","0.009303251281380653, 0.006101221311837435, 0.005776520352810621, 0.0056207082234323025, 0.005239076446741819, 0.005178038962185383, 0.004128292668610811, 0.003343193558976054, 0.0032025829423218966, 0.0031776605173945427"
img70.png,etti lifetime Magn Bureaueu,"etti, urm, impossible, OM, Crist, simplicity, nerv, XIX, Else, ijn","0.01291094720363617, 0.010496526025235653, 0.00929940678179264, 0.0040467712096869946, 0.0033944377209991217, 0.00298390188254416, 0.002858402905985713, 0.00266432436183095, 0.00266432436183095, 0.0024737415369600058"
img71.png,ettiaterraisser​ expos,"etti, impossible, nerv, emann, Crist, XIX, ijn, Else, mania, urable","0.027820631861686707, 0.004167600534856319, 0.0038998345844447613, 0.003854400245472789, 0.0035786894150078297, 0.0034550619311630726, 0.0032079163938760757, 0.003195410128682852, 0.0030610153917223215, 0.002966837724670768"
img72.png,mania COVIDannelannelaug,"mania, etti, urm, nerv, impossible, Seg, iez, segment, Nathan, aterra","0.009199107997119427, 0.009127520024776459, 0.008950977586209774, 0.00834322813898325, 0.006809544749557972, 0.005689587444067001, 0.004962546285241842, 0.00397197250276804, 0.003292880719527602, 0.0032040607184171677"
img73.png,ettioup Herbert Werneroup,"etti, impossible, emann, ☆, aining, XIX, Pam, Crist, Oxford, Mais","0.01750621199607849, 0.00908210314810276, 0.0044959671795368195, 0.003860655939206481, 0.003030263353139162, 0.002551737707108259, 0.0024732286110520363, 0.0024348848965018988, 0.002425392158329487, 0.002425392158329487"
img74.png,ettiaterraqqInterface nucle,"etti, nerv, impossible, Loading, Crist, aining, ке, keit, Mais, adj","0.005470854230225086, 0.004884923342615366, 0.004865878727287054, 0.004395955242216587, 0.00431092968210578, 0.003925146069377661, 0.003450424410402775, 0.003241374157369137, 0.0032161492854356766, 0.0030095139518380165"
img75.png,impossible Zoacci Eu Claude,"impossible, nerv, etti, et, flow, Else, aro, Oxford, emann, mania","0.01052293460816145, 0.005588688421994448, 0.005209230352193117, 0.004780258517712355, 0.004579207394272089, 0.004301766864955425, 0.003871171735227108, 0.0034029779490083456, 0.0027992131654173136, 0.002713090507313609"
img76.png,emannaterrairas단 amor,"emann, nerv, thread, impossible, Isaac, Mais, Crist, threads, XIX, OM","0.009643929079174995, 0.005182226654142141, 0.0045377095229923725, 0.004313031677156687, 0.00388130871579051, 0.003821134567260742, 0.0036461518611758947, 0.0035064700059592724, 0.0032177178654819727, 0.003034596797078848"
img77.png,nerv ereuperoup flow,"nerv, ijn, impossible, et, alive, emann, LO, etti, Mais, íp","0.013275470584630966, 0.012867026962339878, 0.005937157664448023, 0.005138182081282139, 0.003643516218289733, 0.0034766674507409334, 0.0029621580615639687, 0.00290486472658813, 0.002573567209765315, 0.00255353981629014"
img78.png,nerv Channel Mate beyond et,"nerv, etti, Mais, Loading, impossible, emann, et, Oxford, OM, keit","0.016017215326428413, 0.0057111140340566635, 0.004113561008125544, 0.004018270410597324, 0.003587911603972316, 0.00321618327870965, 0.0024277023039758205, 0.0022190995514392853, 0.0021761783864349127, 0.002159243216738105"
