img157.png,Elsedag Bibleaug wet,"Else, WF, Loading, meta, <0xB8>, Nathan, nerv, et, impossible, etti","0.0076079475693404675, 0.004368877038359642, 0.004234460648149252, 0.004009106662124395, 0.0031222952529788017, 0.0029909759759902954, 0.002979314886033535, 0.002831798978149891, 0.0025986048858612776, 0.002393946750089526"
img158.png,nerv expos Andrew bottingers,"nerv, impossible, LO, Oxford, XIX, Mais, igger, XX, Crist, flow","0.010093160904943943, 0.007213257253170013, 0.004426633473485708, 0.0040304954163730145, 0.003891260363161564, 0.002914419397711754, 0.0025619384832680225, 0.0023973360657691956, 0.0023601686116307974, 0.0022345627658069134"
img159.png,et secret Herbertbibliéch,"et, impossible, nerv, Eisen, cura, urm, terror, segment, Mais, OM","0.00843694619834423, 0.007925777696073055, 0.004807226825505495, 0.004659323953092098, 0.0042093489319086075, 0.003847656073048711, 0.0035308077931404114, 0.0033823070116341114, 0.0027071640361100435, 0.0023984145373106003"
img160.png,ettioup LordNSorer,"etti, impossible, nerv, et, OM, An, sense, Ellen, Loading, segment","0.03795349970459938, 0.015155947767198086, 0.005619291216135025, 0.0032395171001553535, 0.0029496136121451855, 0.0027279469650238752, 0.0027173117268830538, 0.0026337087620049715, 0.002552678110077977, 0.002552678110077977"
img161.png,ettiaterra BBC boataterra,"etti, adj, Oxford, Else, impossible, OM, Nathan, meta, XIX, nerv","0.007376749534159899, 0.006020727567374706, 0.005292559042572975, 0.0048377905040979385, 0.004456781316548586, 0.004286044742912054, 0.0037383544258773327, 0.0034845296759158373, 0.0033119989093393087, 0.0031480102334171534"
img162.png,impossible friendship Jer bordoup,"impossible, et, Crist, aterra, XIX, Martín, metal, Oxford, nerv, vos","0.022010719403624535, 0.008160799741744995, 0.005457540974020958, 0.004317270126193762, 0.0041035073809325695, 0.004039888735860586, 0.003961749840527773, 0.003085413947701454, 0.003049467923119664, 0.0030257366597652435"
img163.png,Mais bottHH� Oxford,"Mais, urable, impossible, ijn, Crist, et, nerv, Claud, Isaac, Ellen","0.006286643445491791, 0.0043716742657125, 0.004204197786748409, 0.004122881218791008, 0.003681318601593375, 0.0036101157311350107, 0.003471813863143325, 0.002789681078866124, 0.0027250582352280617, 0.0024237169418483973"
img164.png,impossibleaterra Lorduffer arms,"impossible, threads, Thread, XIX, OM, Mare, etti, nerv, thread, simplicity","0.011067676357924938, 0.005331113468855619, 0.004317266866564751, 0.004233763553202152, 0.003961747046560049, 0.0036497325636446476, 0.0033491826616227627, 0.0027549625374376774, 0.002567907562479377, 0.002547923708334565"
img165.png,nerv Claude Claude ereorum,"nerv, impossible, OM, etti, Nathan, Crist, segment, ijn, íp, Seg","0.010493410751223564, 0.006241473834961653, 0.004711311776190996, 0.004495564848184586, 0.003314821282401681, 0.0032634297385811806, 0.002913914853706956, 0.00287996674887836, 0.0027804772835224867, 0.002705478575080633"
img166.png,impossibleaterraieben expos nucle,"impossible, nerv, mania, etti, Crist, ijn, Mais, emann, íp, Oxford","0.009682168252766132, 0.006058946717530489, 0.005581763107329607, 0.004036128520965576, 0.003333022817969322, 0.00275240046903491, 0.002626358764246106, 0.0024576166179031134, 0.0022376857232302427, 0.002168839331716299"
img167.png,impossibleaterraange expos sorrow,"impossible, emann, etti, Oxford, aining, XIX, nerv, transmission, Loading, igger","0.007402308750897646, 0.007174563594162464, 0.006481678690761328, 0.004596198443323374, 0.0039932457730174065, 0.003825295018032193, 0.003650122554972768, 0.003415604354813695, 0.0032212217338383198, 0.0032086633145809174"
img168.png,impossibleettiiebenException​,"impossible, et, íp, Crist, transmission, igger, nerv, vos, else, XIX","0.011307946406304836, 0.003758211387321353, 0.003503038315102458, 0.003127860836684704, 0.002870286349207163, 0.002728169085457921, 0.00262365466915071, 0.002474342007189989, 0.002306340029463172, 0.002306340029463172"
img169.png,ettioup​ Lord Werner,"etti, mare, ios, Mare, Oxford, vos, nerv, tt, threads, Loading","0.0050622872076928616, 0.0048493738286197186, 0.004811636172235012, 0.0035065438132733107, 0.0032052407041192055, 0.0028844040352851152, 0.0028619577642530203, 0.0028286147862672806, 0.002784761367365718, 0.002773904474452138"
img170.png,emannaterra alive boat Isaac,"emann, Crist, impossible, Thread, nerv, Ż, igger, Oxford, XIX, ELSE","0.0071725486777722836, 0.006530679762363434, 0.005763304885476828, 0.0042495946399867535, 0.004118848126381636, 0.003634870517998934, 0.003348599886521697, 0.0032077620271593332, 0.002886673668399453, 0.0028530426789075136"
img171.png,nervangebbioup​,"nerv, Else, Mais, Loading, adj, ijn, aining, adj, impossible, ELSE","0.012818362563848495, 0.007106678560376167, 0.005322656128555536, 0.003744956338778138, 0.0036725224927067757, 0.0033700959756970406, 0.003228354500606656, 0.003044628072530031, 0.00286016333848238, 0.0027939078863710165"
img172.png,impossible friendship fateiae lifetime,"impossible, Oxford, Crist, XIX, emann, XX, et, Poss, meta, aining","0.015282586216926575, 0.004517523571848869, 0.004033694975078106, 0.0036016840022057295, 0.0032034041360020638, 0.002849166514351964, 0.0027293346356600523, 0.0026247750502079725, 0.002408629050478339, 0.002245089039206505"
img173.png,ijniebenUTCussenoup,"ijn, meta, threads, nerv, flows, Nathan, Thread, ios, emann, Mais","0.009987120516598225, 0.006678895093500614, 0.004736045841127634, 0.004626335576176643, 0.0038805771619081497, 0.0037611841689795256, 0.0036740568466484547, 0.0034649651497602463, 0.0032297028228640556, 0.0032045687548816204"
img174.png,impossible friendship destye worse,"impossible, nerv, etti, surrounded, Crist, et, OM, ege, SS, Else","0.017891323193907738, 0.015727480873465538, 0.007313957903534174, 0.007257041055709124, 0.0066594346426427364, 0.005740791093558073, 0.0050662304274737835, 0.003634842811152339, 0.003133430378511548, 0.0027760653756558895"
img175.png,impossible aliveoupannelacci,"impossible, nerv, adj, et, Else, etti, emann, Ellen, ijn, ater","0.012540062889456749, 0.009539976716041565, 0.0055863987654447556, 0.004759671166539192, 0.004103092942386866, 0.003961349371820688, 0.0031214687041938305, 0.0029901836533099413, 0.002743947086855769, 0.002547668293118477"
img176.png,impossible friendship schemesizer단,"impossible, ijn, Thread, emann, Crist, etti, nerv, OM, thread, thread","0.007480614818632603, 0.007054891902953386, 0.006999990437179804, 0.00615338608622551, 0.005825908854603767, 0.0057355863973498344, 0.004329448100179434, 0.00424570869654417, 0.003688735654577613, 0.003280829405412078"
img177.png,threads lifetime lifetimeoupäst,"threads, ни, Crist, Thread, impossible, Martín, etti, Else, LO, Mais","0.006134490016847849, 0.004167049191892147, 0.004150803666561842, 0.003550370456650853, 0.0032707543577998877, 0.003258002921938896, 0.0026695120614022017, 0.002607672708109021, 0.002537335501983762, 0.002537335501983762"
img178.png,impossible aliveieben Eu Cup,"impossible, etti, Oxford, igger, emann, mania, XIX, zan, Christopher, enen","0.007595734670758247, 0.006079550366848707, 0.003191207768395543, 0.003178766230121255, 0.0031663733534514904, 0.002805251395329833, 0.002676789416000247, 0.0022018670570105314, 0.002142475452274084, 0.0020928450394421816"
img179.png,nerv тем bottiddle principle,"nerv, impossible, Oxford, OM, Nathan, <0xB7>, Crist, Loading, threads, XIX","0.00987104419618845, 0.006348378956317902, 0.006081373896449804, 0.0049441223964095116, 0.0041309683583676815, 0.004066923633217812, 0.0036885400768369436, 0.00357505539432168, 0.003358453745022416, 0.003267865162342787"
img180.png,Cristмиorer flows Inn,"Crist, nerv, impossible, XIX, OM, et, ijn, Eisen, metal, Mais","0.006831710692495108, 0.006725795101374388, 0.005797998048365116, 0.004533157683908939, 0.004047655034810305, 0.003802419640123844, 0.003265111241489649, 0.0031894752755761147, 0.0029962346889078617, 0.002664906205609441"
img181.png,alive alive ereorum​,"alive, impossible, Oxford, <0x84>, et, Martín, An, thread, XIX, ere","0.008647924289107323, 0.007197441533207893, 0.005327831953763962, 0.004557136446237564, 0.003928496968001127, 0.003507753135636449, 0.0034131372813135386, 0.0033340719528496265, 0.0032314935233443975, 0.0032188950572162867"
img182.png,adj hopalgurmesen,"adj, etti, nerv, et, impossible, meta, Oxford, OM, mare, Loading","0.007368910126388073, 0.0072830598801374435, 0.007086611818522215, 0.006205244921147823, 0.004298247396945953, 0.0038983409758657217, 0.0035494801122695208, 0.003521857550367713, 0.003413501428440213, 0.003071818733587861"
img183.png,OM worse Claude Medicineorum,"OM, Seg, ere, meta, ijn, LO, et, impossible, secret, Seg","0.005715171806514263, 0.0055827796459198, 0.004052663221955299, 0.0035072879400104284, 0.003386127296835184, 0.0032691515516489744, 0.0032564064022153616, 0.0032310651149600744, 0.0030831038020551205, 0.0029534325003623962"
img184.png,emannalleremesoup​,"emann, Crist, meta, Oxford, et, ijn, nerv, Nathan, ан, Else","0.005389689467847347, 0.004485697485506535, 0.004297035280615091, 0.004246973432600498, 0.003733328776434064, 0.003439303720369935, 0.0033204914070665836, 0.003095038468018174, 0.0028624425176531076, 0.0026890160515904427"
img185.png,nerv Bibleergymeued,"nerv, impossible, Oxford, ☆, XIX, Nathan, etti, et, Else, Mais","0.009417267516255379, 0.007776751648634672, 0.005623307079076767, 0.004536139313131571, 0.004413784481585026, 0.0028833455871790648, 0.002740581054240465, 0.0026253159157931805, 0.0026253159157931805, 0.002534623257815838"
