img159.png,essor strength banks rec',"essor, alone, esa, prim, erst, aty, territorial, UP, nez, urb","0.004649498965591192, 0.004453947301954031, 0.004008118528872728, 0.0027763426769524813, 0.0027547371573746204, 0.002701455494388938, 0.002659573219716549, 0.0021370272152125835, 0.0020632026717066765, 0.0019381995080038905"
img160.png,essor strength seoddova,"essor, territorial, alone, prim, antage, emen, esa, aty, Carlo, kem","0.006180977448821068, 0.003867957042530179, 0.002942586550489068, 0.002679255325347185, 0.0025565633550286293, 0.0025565633550286293, 0.002526778494939208, 0.002439489820972085, 0.002411068882793188, 0.0023552165366709232"
img161.png,italoteandelives,"ital, territorial, prim, kem, esa, essor, vill, urb, cgi, erst","0.0080577302724123, 0.003575596259906888, 0.003034569090232253, 0.002873072400689125, 0.0027738206554204226, 0.0025854851119220257, 0.002565364819020033, 0.002467087469995022, 0.0024193692952394485, 0.0019823601469397545"
img162.png,italTablHRs,"ital, bast, alone, essor, ande, ér, ower, urb, orn, vill","0.004987756256014109, 0.003692135214805603, 0.003482014872133732, 0.003195276716724038, 0.0031090895645320415, 0.0028308581095188856, 0.002690692665055394, 0.002618115860968828, 0.002587613882496953, 0.002517817309126258"
img163.png,essor' se curiosityes,"essor, oving, annon, ower, lied, ane, vill, rus, erst, Pad","0.005087754689157009, 0.002723278943449259, 0.0026706058997660875, 0.002578348619863391, 0.00250880210660398, 0.0024990211240947247, 0.0024602776393294334, 0.0024411312770098448, 0.002311216900125146, 0.0022488757967948914"
img164.png,territorial ADD CRiss friendly,"territorial, ital, essor, prim, erst, vill, emen, alone, opol, 女","0.0067381104454398155, 0.0065308003686368465, 0.004023509565740824, 0.0038845157250761986, 0.0025675080250948668, 0.0025475274305790663, 0.002440381795167923, 0.0024213907308876514, 0.002365299267694354, 0.0023105069994926453"
img165.png,essor Gorala la foot,"essor, territorial, kem, ital, alone, prim, esa, ane, ower, curity","0.006058202590793371, 0.003371897619217634, 0.003371897619217634, 0.002709395717829466, 0.0025155888870358467, 0.0024286869447678328, 0.002134952461346984, 0.001989994663745165, 0.0019363178871572018, 0.001862138626165688"
img166.png,"essorobre ""LR count","essor, urb, vill, ower, territorial, ital, alone, Coll, prim, annon","0.005781733896583319, 0.00346594350412488, 0.003333165543153882, 0.003268695902079344, 0.003180528525263071, 0.0027958638966083527, 0.0026162313297390938, 0.0024290888104587793, 0.002363567939028144, 0.002255332423374057"
img167.png,independent tower Brad vo Miller,"independent, kem, ital, prim, opol, bast, urb, essor, orn, erst","0.007892349734902382, 0.004241004586219788, 0.004175254143774509, 0.004015302285552025, 0.0035712840035557747, 0.003557360963895917, 0.002542331349104643, 0.002522546797990799, 0.002522546797990799, 0.0021241973154246807"
img168.png,gggemannliklah,"gg, Param, ladies, 女, younger, erst, rr, essor, antage, Param","0.00400088494643569, 0.0038027875125408173, 0.0031649607699364424, 0.00285930372774601, 0.002814974170178175, 0.0027930678334087133, 0.0027497655246406794, 0.0026755949947983027, 0.002417198847979307, 0.0022707481402903795"
img169.png,italoteandel count,"ital, gene, vill, Tab, territorial, ane, LI, ir, oco, illa","0.016702234745025635, 0.0036404416896402836, 0.00346019072458148, 0.003041702788323164, 0.0028241255786269903, 0.002791223581880331, 0.002726564649492502, 0.0027053465601056814, 0.00259156315587461, 0.0025713953655213118"
img170.png,vill a more facts,"vill, gene, urb, iko, oving, oco, nest, territorial, antage, alone","0.005992240272462368, 0.003706160932779312, 0.0032074153423309326, 0.003120900597423315, 0.0030013408977538347, 0.0030013408977538347, 0.0029089991003274918, 0.0028863612096756697, 0.0027220977935940027, 0.002468835562467575"
img171.png,essor strengthesiasarin,"essor, alone, annon, prim, opol, covering, urb, ower, ital, esa","0.005848580505698919, 0.005041791591793299, 0.0041961511597037315, 0.003398146713152528, 0.003306487575173378, 0.002438050927594304, 0.002419078256934881, 0.0021769346203655005, 0.001898756017908454, 0.0018766347784548998"
img172.png,italote office/ignon,"ital, essor, prim, cgi, territorial, esa, opol, atori, 女, erst","0.005000798963010311, 0.0042441231198608875, 0.0040339818224310875, 0.003894626162946224, 0.003601940581575036, 0.0031416681595146656, 0.0029169402550905943, 0.0024659237824380398, 0.0024276929907500744, 0.0020684204064309597"
img173.png,territorial los services classes,"territorial, ital, kem, essor, rr, alone, ane, uten, За, vill","0.006411665119230747, 0.005357146728783846, 0.003198898397386074, 0.003016848349943757, 0.0027792511973530054, 0.0025305370800197124, 0.0025305370800197124, 0.002106099622324109, 0.0020978886168450117, 0.001978497486561537"
img174.png,prim reasonignonignonignon,"prim, uten, urb, opol, Prim, Kin, oving, ala, Prim, partially","0.005667281337082386, 0.005344755481928587, 0.004923819564282894, 0.0040819901041686535, 0.0033316228073090315, 0.0029172664508223534, 0.0028720383998006582, 0.0025946705136448145, 0.0024758519139140844, 0.002298750914633274"
img175.png,italignon flyeséd,"ital, essor, Net, urb, prim, erst, territorial, neighbor, opol, aty","0.005828992463648319, 0.004575228318572044, 0.0029081925749778748, 0.002764197764918208, 0.002742686541751027, 0.002731994027271867, 0.0023922137916088104, 0.0023276880383491516, 0.0023276880383491516, 0.0022649026941508055"
img176.png,owerotepurloalle,"ower, vill, opol, erst, essor, readily, prim, urb, iko, kem","0.0036384915001690388, 0.0036384915001690388, 0.0028447506483644247, 0.002693355781957507, 0.0026207072660326958, 0.0026207072660326958, 0.002481235656887293, 0.0021473304368555546, 0.0021473304368555546, 0.0020251255482435226"
img177.png,äd veNetossenoll,"äd, erst, anny, alone, essor, Net, uten, nez, opol, коло","0.00550230173394084, 0.003234636038541794, 0.003234636038541794, 0.0032094642519950867, 0.0031969514675438404, 0.0026400331407785416, 0.0026194883976131678, 0.001992801669985056, 0.0019850325770676136, 0.0019314896780997515"
img178.png,essorouwenoseroux void,"essor, Carlo, territorial, ersion, UP, uten, cgi, esa, prim, erne","0.006407913751900196, 0.0045438907109200954, 0.003184562548995018, 0.0027667959220707417, 0.0023298757150769234, 0.0022581929806619883, 0.002240619622170925, 0.0021213761065155268, 0.001901589217595756, 0.0018867909675464034"
img179.png,essor automatisch� laterzy,"essor, ois, bast, ital, opol, kem, atori, erst, LENGTH, iko","0.009558466263115406, 0.006620956119149923, 0.0045862020924687386, 0.003743149107322097, 0.003543942468240857, 0.003381653456017375, 0.0030670263804495335, 0.002892481628805399, 0.0026029516011476517, 0.002426217310130596"
img180.png,essorobreowerali g,"essor, annon, esa, enne, alone, iko, urb, antage, erst, äd","0.004830625373870134, 0.003689329605549574, 0.0030466371681541204, 0.003034759545698762, 0.002372723538428545, 0.002290756907314062, 0.0022289676126092672, 0.0021688451524823904, 0.002160389441996813, 0.0021268955897539854"
img181.png,territorial autikorrat cell,"territorial, essor, prim, ower, urb, opol, ladies, 女, annon, ital","0.004402443300932646, 0.004351153504103422, 0.004151899833232164, 0.003579161362722516, 0.0031709610484540462, 0.0030734005849808455, 0.002765761222690344, 0.0025479388423264027, 0.0024695468600839376, 0.0020714595448225737"
img182.png,italestra okay puignon,"ital, territorial, esa, essor, erst, aty, vill, cgi, LENGTH, ane","0.0032346148509532213, 0.0028769259806722403, 0.0025587910786271095, 0.0025092996656894684, 0.0024607651866972446, 0.0023116751108318567, 0.002163151279091835, 0.0021463173907250166, 0.00211304216645658, 0.0020084180869162083"
img183.png,getInstances□archyroy,"getInstance, essor, cgi, alone, esa, curity, atori, ital, prim, 女","0.003756709862500429, 0.00374206411652267, 0.0033412869088351727, 0.003138848813250661, 0.003042276483029127, 0.002561853500083089, 0.0025025084614753723, 0.0023235001135617495, 0.002234488492831588, 0.00214050873182714"
img184.png,territorialiali compared Edit boot,"territorial, ane, essor, onen, vill, ower, alone, iko, pad, aty","0.009615425951778889, 0.004631589166820049, 0.0030374699272215366, 0.0028983743395656347, 0.00280920066870749, 0.002328909235075116, 0.0023107854649424553, 0.0022928027901798487, 0.002103994134813547, 0.0020957915112376213"
img185.png,italoteande belignon,"ital, essor, vill, erst, enne, prim, ower, uten, ér, urd","0.0081686582416296, 0.005906691774725914, 0.0036106882616877556, 0.002958491910248995, 0.0028010436799377203, 0.0027468667831271887, 0.0027148646768182516, 0.002520666690543294, 0.00228614523075521, 0.0022507018875330687"
