img80.png,enneouxobi box multi,"enne, 女, ois, onen, battery, erst, getInstance, essor, gender, ędz","0.007847479544579983, 0.0046676755882799625, 0.0031583071686327457, 0.002886926755309105, 0.0026595613453537226, 0.002557674888521433, 0.0024984264746308327, 0.002365462714806199, 0.0020956837106496096, 0.0020875134505331516"
img81.png,"essorobre "" space g","essor, prim, urb, esa, ande, kur, atori, emen, opol, ital","0.0054666404612362385, 0.004805485252290964, 0.0043076095171272755, 0.00272740819491446, 0.002378887729719281, 0.002026837784796953, 0.0020189357455819845, 0.0019798860885202885, 0.0018892205553129315, 0.0018672103760764003"
img82.png,essor taste crewESargo,"essor, erst, ital, esa, alone, prim, vill, atori, kem, 次","0.004851278383284807, 0.003521650331094861, 0.00276417494751513, 0.0026896160561591387, 0.0026375942397862673, 0.0025564441457390785, 0.00247779069468379, 0.0024393759667873383, 0.0023828677367419004, 0.0022210772149264812"
img83.png,"essorobre ""ignonities","essor, territorial, prim, alone, ital, ower, urb, cgi, esa, kem","0.00870870053768158, 0.005644766613841057, 0.0032669403590261936, 0.003069006372243166, 0.0027618068270385265, 0.002245333045721054, 0.00217625149525702, 0.002036428777500987, 0.0019970405846834183, 0.0019355982076376677"
img84.png,essor' se recognition Sur,"essor, territorial, prim, ital, alone, ower, urb, Tab, opol, pad","0.006388567388057709, 0.004060820210725069, 0.003874862100929022, 0.0026735742576420307, 0.0022779139690101147, 0.0022338549606502056, 0.0021992221008986235, 0.0021821078844368458, 0.002098512602970004, 0.0019713700748980045"
img85.png,esa gar dollichericher,"esa, alone, prim, eline, essor, kim, annon, atori, territorial, urb","0.0077218483202159405, 0.004832209553569555, 0.004683537874370813, 0.004647090565413237, 0.0037340421695262194, 0.0028967373073101044, 0.002885444089770317, 0.0026375092566013336, 0.00258649536408484, 0.0022471859119832516"
img86.png,essor automatischkinirutz,"essor, ital, ala, enne, prim, jel, uten, curity, territorial, Net","0.004690815228968859, 0.002530504949390888, 0.0025206394493579865, 0.002491273218765855, 0.0024622490163892508, 0.0024146249052137136, 0.0023312103003263474, 0.002322121988981962, 0.0022950684651732445, 0.002259486820548773"
img87.png,prim instructions саateilon,"prim, ane, ital, alone, iko, vill, essor, ower, esa, erst","0.004528002347797155, 0.004492764826864004, 0.0043545374646782875, 0.004220562055706978, 0.0032234014943242073, 0.0031858475413173437, 0.0031858475413173437, 0.0031364555470645428, 0.0026103900745511055, 0.0025499204639345407"
img88.png,essor Gust lifNETner,"essor, erst, ital, getInstance, esa, vill, äd, kem, urd, ower","0.006370075512677431, 0.0057548838667571545, 0.0049610198475420475, 0.004412422422319651, 0.004259993322193623, 0.00298559432849288, 0.0028600243385881186, 0.0027720306534320116, 0.002604081528261304, 0.0025737432297319174"
img89.png,essorugelande Miller most,"essor, ital, territorial, prim, vill, ower, esa, 次, ane, UP","0.007199428975582123, 0.006328704301267862, 0.006038891617208719, 0.002977813361212611, 0.0027648061513900757, 0.0026797419413924217, 0.002283168723806739, 0.002144838450476527, 0.0020707440562546253, 0.0019528975244611502"
img90.png,esa escutzerme str,"esa, essor, erst, aty, emen, anny, annon, alone, iko, 次","0.003290768014267087, 0.00325242942199111, 0.0028479222673922777, 0.0026649453211575747, 0.0025728833861649036, 0.002523119328543544, 0.0024840019177645445, 0.0024646713864058256, 0.002035318175330758, 0.001980419270694256"
img91.png,essor automatischlik tortignon,"essor, esa, Net, getInstance, alone, cgi, LR, atori, territorial, enne","0.007082019001245499, 0.003478570841252804, 0.0029753795824944973, 0.002741048112511635, 0.0025951722636818886, 0.0025153271853923798, 0.0024860226549208164, 0.002372179413214326, 0.0023354021832346916, 0.0020369738340377808"
img92.png,ital surv scholar h章,"ital, territorial, prim, essor, urb, opol, alone, vill, annon, ane","0.0055668237619102, 0.0038409929256886244, 0.0033371124882251024, 0.0029220732394605875, 0.002755777444690466, 0.0025989459827542305, 0.002403631806373596, 0.0023025383707135916, 0.0021129280794411898, 0.0019849122036248446"
img93.png,vill ahyignon lo,"vill, iko, bast, ane, opol, alone, bold, readily, prim, ower","0.006641524378210306, 0.004993740934878588, 0.004406960215419531, 0.004172426648437977, 0.0032368204556405544, 0.0030645602382719517, 0.002823204966261983, 0.0024720809888094664, 0.0023960231337696314, 0.0023313944693654776"
img94.png,essorvi flash pushing g,"essor, ital, prim, ér, territorial, annon, ower, erst, orn, kem","0.005065966863185167, 0.0037794411182403564, 0.003536614589393139, 0.003258082550019026, 0.003232727525755763, 0.0029897841159254313, 0.0026488022413104773, 0.0022480092011392117, 0.0020229893270879984, 0.002015102421864867"
img95.png,territorial breath sensrailsaters,"territorial, prim, essor, ital, urb, tal, esa, erst, younger, vill","0.005376776680350304, 0.005011707078665495, 0.005011707078665495, 0.004154851194471121, 0.0038879048079252243, 0.0027036131359636784, 0.002589902840554714, 0.002414054935798049, 0.002303507411852479, 0.0022066247183829546"
img96.png,primliesendorfs pol,"prim, kem, essor, ital, orn, opol, bast, independent, urb, erst","0.006136743351817131, 0.0050677042454481125, 0.004542660899460316, 0.004489737097173929, 0.0042342254891991615, 0.0036501309368759394, 0.0029791498091071844, 0.002691437490284443, 0.0022225810680538416, 0.0021042972803115845"
img97.png,teen kinalomovingignon,"teen, essor, alone, uten, LR, subst, ower, ress, territorial, opol","0.0049500009045004845, 0.0047418102622032166, 0.0046682958491146564, 0.004055885598063469, 0.0033103174064308405, 0.002842546673491597, 0.0028314641676843166, 0.0025183565448969603, 0.0024696472100913525, 0.0023750364780426025"
img98.png,essorouwenoseroux scra,"essor, territorial, prim, erst, Net, ouri, äd, UP, urb, Push","0.005645303521305323, 0.004178877454251051, 0.004034516401588917, 0.003093371167778969, 0.003081311471760273, 0.0030217133462429047, 0.0026048796717077494, 0.002505088225007057, 0.0022898362949490547, 0.002254335442557931"
img99.png,territorial space compared bush a,"territorial, enne, ital, oving, Charlot, essor, kem, presently, alone, bia","0.0026217408012598753, 0.0025610080920159817, 0.0025311715435236692, 0.00248221424408257, 0.0022600817028433084, 0.0021398025564849377, 0.0021066279150545597, 0.002065882086753845, 0.0020418136846274137, 0.0020023216493427753"
img100.png,territorial space race comnia,"territorial, essor, ital, erst, esa, oving, urb, iller, uchs, antage","0.0050163306295871735, 0.0040782480500638485, 0.004062348511070013, 0.003999367356300354, 0.0029489484149962664, 0.0026955571956932545, 0.0025521020870655775, 0.0024735822807997465, 0.0024735822807997465, 0.0024162819609045982"
img101.png,vill doubs draft rather,"vill, ital, bast, iko, prim, opol, territorial, TS, ane, 女","0.0049867406487464905, 0.0041341534815728664, 0.0038384313229471445, 0.0037058310117572546, 0.003296034410595894, 0.0031821713782846928, 0.002943027298897505, 0.002566954120993614, 0.002517304616048932, 0.002374044619500637"
img102.png,ital g likelyasteds,"ital, alone, kem, essor, territorial, erst, prim, esa, younger, urb","0.004763196222484112, 0.003235554089769721, 0.003172973170876503, 0.002833146136254072, 0.002579608466476202, 0.002519852016121149, 0.0024138703010976315, 0.0023671819362789392, 0.0021469409111887217, 0.0018149814568459988"
img103.png,iko gala Centurylik,"iko, annon, bast, getInstance, esa, bom, essor, aff, vill, territorial","0.004369999747723341, 0.0037378587294369936, 0.0035251362714916468, 0.003086712444201112, 0.003086712444201112, 0.003074678825214505, 0.002922440879046917, 0.0027346760034561157, 0.0026922787073999643, 0.0024513474199920893"
img104.png,italoteandealaives,"ital, territorial, esa, prim, alone, urb, essor, ower, ane, vill","0.005212127696722746, 0.0031613153405487537, 0.0031123035587370396, 0.0027681400533765554, 0.0027358902152627707, 0.0026208222843706608, 0.0025601109955459833, 0.0023769827093929052, 0.0021983496844768524, 0.002041098428890109"
img105.png,ital splaterenyanga,"ital, ilon, alone, essor, opol, orn, territorial, ois, 女, esa","0.006073338445276022, 0.004620352294296026, 0.003474027616903186, 0.003314940957352519, 0.003138522384688258, 0.0029140196274966, 0.0028354190289974213, 0.0024252624716609716, 0.002341480692848563, 0.0022694410290569067"
img106.png,essor strengthoveila death,"essor, territorial, esa, ower, urb, kim, atori, kem, antage, ersion","0.0071511720307171345, 0.005130715202540159, 0.004617143888026476, 0.0036099087446928024, 0.0035958350636065006, 0.0032612807117402554, 0.00311193591915071, 0.0029927194118499756, 0.0028556729666888714, 0.002386003965511918"
img107.png,urb lignonemannignon,"urb, kem, prim, ital, alone, essor, asted, oving, enne, orn","0.004606904461979866, 0.004482640884816647, 0.003894585883244872, 0.003559939796105027, 0.002827166114002466, 0.0026871836744248867, 0.002645522588863969, 0.00248523848131299, 0.002465898171067238, 0.0024371694307774305"
img108.png,essor towerolog longestalia,"essor, prim, alone, ower, territorial, urb, annon, antage, ital, kem","0.0066025168634951115, 0.0036462557036429644, 0.0033329478465020657, 0.003294117981567979, 0.0030465610325336456, 0.00255545973777771, 0.0023267725482583046, 0.0022728729527443647, 0.0022029441315680742, 0.0021102912724018097"
img109.png,ikoower Rossidosanka,"iko, urb, TS, ovo, rist, jel, annon, battery, territorial, oll","0.007206335663795471, 0.004090038128197193, 0.0036235731095075607, 0.0035396330058574677, 0.003004047553986311, 0.0029344588983803988, 0.0028777013067156076, 0.0024710618890821934, 0.0024614285212010145, 0.0024518321733921766"
img110.png,andevers signater extra,"ande, teen, essor, aty, ower, opol, erst, enne, antage, Carlo","0.005443337373435497, 0.004936892539262772, 0.004124928265810013, 0.003640236333012581, 0.0035978262312710285, 0.0035007812548428774, 0.003150362055748701, 0.0031258456874638796, 0.0026322260964661837, 0.0023595120292156935"
img111.png,essor escuffeningerst,"essor, territorial, erst, esa, 女, alone, ital, zak, kem, opol","0.0046307239681482315, 0.003387909848242998, 0.003145568072795868, 0.003072700696066022, 0.0030250633135437965, 0.0029549875762313604, 0.00265920115634799, 0.0026077674701809883, 0.002577386097982526, 0.0025673378258943558"
img112.png,italoteandeḷ,"ital, essor, ower, prim, vill, cgi, erst, kem, oving, battery","0.007749820593744516, 0.0038968543522059917, 0.0028958965558558702, 0.0026264640036970377, 0.002606024732813239, 0.002194492844864726, 0.0021186829544603825, 0.0019215620122849941, 0.001914070569910109, 0.0018051405204460025"
img113.png,essor flash Alabamaove pol,"essor, esa, alone, urb, vill, territorial, ane, prim, neighbor, younger","0.00472438195720315, 0.00449046166613698, 0.0030742138624191284, 0.0025887477677315474, 0.0023848661221563816, 0.0023114916402846575, 0.002214273437857628, 0.002080117119476199, 0.002031931420788169, 0.0019464710494503379"
img114.png,cgi gdimenimits,"cgi, ital, territorial, essor, atori, alone, enne, oving, esa, antage","0.0041696662083268166, 0.004025623202323914, 0.003856310620903969, 0.003324347548186779, 0.0028323796577751637, 0.002734533743932843, 0.00272387289442122, 0.0025588416028767824, 0.0024321447126567364, 0.002366541652008891"
img115.png,"alones, prim over","alone, iko, antage, prim, ladies, ân, oving, anned, bast, nest","0.004376884084194899, 0.00372915156185627, 0.0030436450615525246, 0.0028149117715656757, 0.002760465955361724, 0.002543060574680567, 0.002464819001033902, 0.002426605438813567, 0.0023611518554389477, 0.002333643613383174"
img116.png,essor strength bars nomes,"essor, alone, asted, cgi, territorial, opol, 女, erst, enne, antage","0.004839180503040552, 0.0037983160000294447, 0.003040133975446224, 0.0029813325963914394, 0.0027572817634791136, 0.0023309518583118916, 0.0020894515328109264, 0.002017270540818572, 0.0019628582522273064, 0.001909913495182991"
img117.png,primsutz comparison independent,"prim, alone, bast, vill, territorial, ital, erst, essor, urb, urban","0.0038499520160257816, 0.0036308506969362497, 0.003560623386874795, 0.0034242181573063135, 0.003344896249473095, 0.003191722324118018, 0.002940352540463209, 0.002894766628742218, 0.0025746584869921207, 0.002447178354486823"
img118.png,italoteaysignon flash,"ital, prim, vill, essor, ois, ande, territorial, kem, ower, esa","0.005767318420112133, 0.003680278779938817, 0.003457301761955023, 0.0032605461310595274, 0.002682052319869399, 0.002529416000470519, 0.0024708223063498735, 0.002249709330499172, 0.0020644492469727993, 0.0020564007572829723"
img119.png,italote port foot Hal,"ital, territorial, opol, 女, kem, tal, atori, essor, urb, oshi","0.0057482304982841015, 0.0047654504887759686, 0.003859179327264428, 0.003583126701414585, 0.0029821426142007113, 0.002683637896552682, 0.0025408174842596054, 0.002521044574677944, 0.002173276152461767, 0.00191043212544173"
img120.png,kemignon MP flashs,"kem, ital, vill, urb, gentleman, oving, 次, gminy, prim, annon","0.006867871154099703, 0.005204431246966124, 0.003928510472178459, 0.0031077079474925995, 0.0030357178766280413, 0.0025965869426727295, 0.0023920878302305937, 0.002291480079293251, 0.0022296712268143892, 0.0021526464261114597"
img121.png,enneoux speedoomegr,"enne, essor, alone, territorial, antage, getInstance, urb, voz, esa, ladies","0.0038294384721666574, 0.0037848243955522776, 0.0035278440918773413, 0.00315001024864614, 0.0028236510697752237, 0.002673378912732005, 0.002199061680585146, 0.002073912415653467, 0.002057773293927312, 0.002033799421042204"
img122.png,essor flash towerarchy nuclear,"essor, prim, territorial, emen, esa, ital, 女, urb, opol, Net","0.007332695182412863, 0.004922938533127308, 0.0040653483010828495, 0.0032793839927762747, 0.0032538638915866613, 0.002655726158991456, 0.002624786226078868, 0.0024948238860815763, 0.0024657584726810455, 0.002446569735184312"
img123.png,ital liilliouxalle,"ital, alone, essor, ower, prim, territorial, 郡, opol, UP, gemeinde","0.005795532371848822, 0.0050156149081885815, 0.004656841047108173, 0.00392145337536931, 0.0033541969023644924, 0.0032637231051921844, 0.00284666963852942, 0.002769885817542672, 0.0027590871322900057, 0.002482909709215164"
img124.png,essor aignon purignon,"essor, ital, gentleman, opol, ane, ower, lack, territorial, annon, ivi","0.006139020435512066, 0.005069584585726261, 0.0034571567084640265, 0.003123280592262745, 0.002991919405758381, 0.002968636341392994, 0.0027455396484583616, 0.0026506937574595213, 0.002490096725523472, 0.0023483845870941877"
img125.png,teenmann base scientzor,"teen, nest, opol, otrop, ital, kem, pad, essor, alone, nez","0.005638778675347567, 0.0034604070242494345, 0.0032762475311756134, 0.00282430206425488, 0.0026325390208512545, 0.002406335435807705, 0.0022961413487792015, 0.0022961413487792015, 0.002242951188236475, 0.0020663035102188587"
img126.png,essor strengthes®urk,"essor, esa, kem, urb, ital, urban, prim, neighbor, uchs, opol","0.005514952354133129, 0.004311859607696533, 0.003267501248046756, 0.003204301930963993, 0.003179366234689951, 0.003117871470749378, 0.003093607956543565, 0.002951941452920437, 0.002838854445144534, 0.002666856860741973"
img127.png,essorobre push ut compl,"essor, emen, esa, territorial, cgi, ital, Net, urb, alone, erst","0.005190687254071236, 0.003417459549382329, 0.00335135986097157, 0.0031238109804689884, 0.0030395512003451586, 0.0022854285780340433, 0.002172269392758608, 0.0020406583789736032, 0.0019701628480106592, 0.0019548307172954082"
img128.png,italotebblonignon,"ital, essor, ane, erst, territorial, oving, alone, uten, asted, tal","0.0043121324852108955, 0.0035194603260606527, 0.0034245287533849478, 0.0033451998606324196, 0.003267708234488964, 0.00292915478348732, 0.0026462706737220287, 0.0023536421358585358, 0.0023262209724634886, 0.002254650928080082"
img129.png,女SION smoothgebens,"女, ital, ∂, kem, emen, essor, ground, enne, gradient, territorial","0.005304618272930384, 0.004245763178914785, 0.0025551451835781336, 0.0024476791732013226, 0.002118289703503251, 0.0018118693260475993, 0.001783778890967369, 0.00170209351927042, 0.0016888477839529514, 0.0016626648139208555"
img130.png,italoteandelives,"ital, vill, kem, prim, alone, ér, ivi, erst, oval, ois","0.012688172981142998, 0.00352337840013206, 0.0027547497302293777, 0.0025180450174957514, 0.0022308644838631153, 0.0021537980064749718, 0.0019457944435998797, 0.001900720177218318, 0.001878576003946364, 0.0018639566842466593"
img131.png,esa gar bound preference道,"esa, essor, uten, prim, annon, opol, urb, erst, territorial, äd","0.004978683777153492, 0.004515470005571842, 0.003953877836465836, 0.003877402748912573, 0.003164643654599786, 0.002562806708738208, 0.002435913309454918, 0.0024075342807918787, 0.002333462005481124, 0.0023153030779212713"
img132.png,essor alle towerenzignon,"essor, ital, prim, urb, alone, erst, vill, ower, antage, emen","0.00425753416493535, 0.0038463615346699953, 0.003066586796194315, 0.002716845367103815, 0.0026539096143096685, 0.0024544652551412582, 0.0024353640619665384, 0.0021745357662439346, 0.0021745357662439346, 0.0020668667275458574"
img133.png,urb easysesote,"urb, asted, oving, alone, essor, ower, enne, females, 女, ois","0.00745075149461627, 0.0042122732847929, 0.0037173181772232056, 0.0028613219037652016, 0.002827986376360059, 0.002525107702240348, 0.0025054572615772486, 0.0024283721577376127, 0.0023721191100776196, 0.0023353430442512035"
img134.png,primsimit Kennedy Tib,"prim, urb, bast, opol, territorial, uten, vill, iko, pad, Prim","0.0046128081157803535, 0.004299609921872616, 0.003721002023667097, 0.0027760369703173637, 0.002722343197092414, 0.0025276103988289833, 0.0025276103988289833, 0.0025177563074976206, 0.0023468066938221455, 0.0022219119127839804"
img135.png,essor strengthes triendorf,"essor, esa, alone, prim, urb, ital, vill, teen, emen, younger","0.005594502668827772, 0.0050148796290159225, 0.0029712177347391844, 0.002769479528069496, 0.002747927326709032, 0.002434528898447752, 0.0023504269775003195, 0.002234049141407013, 0.00218229740858078, 0.002173789544031024"
img136.png,ital gazckeandes,"ital, vill, emen, 女, battery, essor, 男, urb, bia, ladies","0.004954363219439983, 0.0031615104526281357, 0.002303993096575141, 0.0022771505173295736, 0.0021559628657996655, 0.0021225379314273596, 0.0020492137409746647, 0.002009578514844179, 0.0019707095343619585, 0.0019477502210065722"
img137.png,"opol "" recognitionss","opol, prim, esa, emen, alone, erst, 女, essor, pad, kem","0.005370698869228363, 0.004117857664823532, 0.0037493519484996796, 0.002841236302629113, 0.002819125773385167, 0.002753820503130555, 0.0026072650216519833, 0.0025171958841383457, 0.0024781704414635897, 0.0023371372371912003"
img138.png,alonelonrres prim,"alone, erst, uten, iko, opol, enne, anus, teen, ân, essor","0.004308002069592476, 0.004224677570164204, 0.0024738775100558996, 0.002107769949361682, 0.0020995524246245623, 0.0020589435007423162, 0.0020429205615073442, 0.0019341984298080206, 0.0019042114727199078, 0.0018967875512316823"
img139.png,primignonzy util or,"prim, ital, erst, essor, territorial, alone, 女, emen, esa, uten","0.004265693482011557, 0.00405448442324996, 0.004038677085191011, 0.0037939862813800573, 0.003322125179693103, 0.003108680946752429, 0.002931765280663967, 0.0027975100092589855, 0.002690338995307684, 0.0021957908757030964"
img140.png,essorobreikor transitionring,"essor, territorial, ower, atori, enne, alone, UP, esa, vr, opol","0.005179130472242832, 0.003833797760307789, 0.0028158442582935095, 0.0026452410966157913, 0.0025142659433186054, 0.002108969958499074, 0.001927754608914256, 0.0019202390685677528, 0.0017898596124723554, 0.0017759306356310844"
img141.png,essorzy meathovhan,"essor, erst, esa, alone, 女, cgi, enne, ersion, aty, Carlo","0.0047280448488891125, 0.002947199856862426, 0.002947199856862426, 0.0026939588133245707, 0.002242111600935459, 0.0019786565098911524, 0.0019328208873048425, 0.0019177797948941588, 0.0019103029044345021, 0.0018733543111011386"
img142.png,primosediskasignon,"prim, essor, ital, esa, 女, enne, territorial, vill, cgi, erst","0.00525049539282918, 0.003311445703729987, 0.003003350691869855, 0.002745285164564848, 0.002723921090364456, 0.0023758462630212307, 0.002267048228532076, 0.002258209977298975, 0.002258209977298975, 0.0022319008130580187"
img143.png,essor⇒ampleikor Motor,"essor, territorial, alone, ower, antage, ital, erst, rus, annon, esa","0.006604411639273167, 0.004280818160623312, 0.003083357587456703, 0.0029768417589366436, 0.002576241735368967, 0.002536300802603364, 0.002448683138936758, 0.002318366663530469, 0.00226466148160398, 0.0021274529863148928"
img144.png,essor strengthogy ors,"essor, urb, territorial, esa, Carlo, enne, ower, urban, opol, cgi","0.007360745687037706, 0.004145164508372545, 0.0033048135228455067, 0.0026348268147557974, 0.0026041301898658276, 0.002253687009215355, 0.0020600364077836275, 0.0019052224233746529, 0.0018903957679867744, 0.0018903957679867744"
img145.png,utenTCendorfs statement,"uten, bast, vill, essor, esa, iko, prim, nest, territorial, erst","0.004882831126451492, 0.004641065839678049, 0.004622971639037132, 0.00398525083437562, 0.003700180212035775, 0.0030318191275000572, 0.0026965553406625986, 0.0025630397722125053, 0.002484183292835951, 0.0024266373366117477"
img146.png,"italote,ane tower","ital, essor, esa, urb, vill, enne, kem, alone, kim, TS","0.003806494176387787, 0.0035067067947238684, 0.003192892763763666, 0.002828746335580945, 0.002763218479231, 0.002647001063451171, 0.0024195548612624407, 0.002382043283432722, 0.0023542915005236864, 0.002308755414560437"
img147.png,erstsseoux vo,"erst, alone, essor, ital, ower, opol, prim, Prim, redund, vill","0.006012347526848316, 0.004682420752942562, 0.0031191648449748755, 0.0029996715020388365, 0.0029531659092754126, 0.0029187602922320366, 0.0026472005993127823, 0.0025358630809932947, 0.0024197374004870653, 0.002363684354349971"
img148.png,italegroundasa Polskis,"ital, essor, getInstance, prim, Carlo, iko, alone, ower, ilon, erst","0.004100000951439142, 0.003466059686616063, 0.003094842890277505, 0.0028069005347788334, 0.002741878852248192, 0.002575756749138236, 0.0024196994490921497, 0.0023361099883913994, 0.002327002352103591, 0.002327002352103591"
img149.png,alonees loizetres,"alone, essor, 選, oving, ital, annon, oster, vr, erst, ann","0.0038960229139775038, 0.0035060413647443056, 0.002741194562986493, 0.0026568567845970392, 0.0024958860594779253, 0.0023909122683107853, 0.0023264214396476746, 0.0020133499056100845, 0.0019898938480764627, 0.0017837294144555926"
img150.png,essor strength se pur collect,"essor, prim, vill, ital, kem, urb, esa, enne, annon, äd","0.006046758498996496, 0.005680403672158718, 0.004172137938439846, 0.003754517761990428, 0.0030643478967249393, 0.0025804396718740463, 0.0024431112688034773, 0.002322144340723753, 0.0020333377178758383, 0.0019862353801727295"
img151.png,italotejoualazy,"ital, kem, 女, essor, territorial, ladies, alone, esa, vill, erst","0.005453896708786488, 0.0035489178262650967, 0.003083353629335761, 0.0029421565122902393, 0.002862796885892749, 0.002699874574318528, 0.002668420085683465, 0.0023093251511454582, 0.002282420638948679, 0.0020781676284968853"
img152.png,essor random pla con Golden,"essor, esa, erst, alone, kem, getInstance, prim, urb, enne, anny","0.0053320396691560745, 0.004201546777039766, 0.0033760375808924437, 0.003110151505097747, 0.0027662257198244333, 0.002356854034587741, 0.002257727785035968, 0.0021126701030880213, 0.001961548114195466, 0.001931136823259294"
img153.png,essorzy o earlyage,"essor, ersion, antage, territorial, ois, alone, erst, prim, ane, urb","0.004019205924123526, 0.0038652324583381414, 0.0033581722527742386, 0.003345079952850938, 0.003242162521928549, 0.002917630597949028, 0.002906255889683962, 0.002719530835747719, 0.002399977296590805, 0.00238130078651011"
img154.png,essor strength g Rand more,"essor, kem, iko, annon, alone, anny, bast, esa, erst, prim","0.004584402311593294, 0.004426032304763794, 0.003982997965067625, 0.003584309946745634, 0.003263551741838455, 0.0032004285603761673, 0.003126290859654546, 0.0028576611075550318, 0.002748185768723488, 0.002612113719806075"
img155.png,ande golden pushaliaali,"ande, urb, essor, alone, bast, annon, orn, ower, neighbor, ital","0.005348420701920986, 0.0043652537278831005, 0.0037047427613288164, 0.003307962790131569, 0.00318123702891171, 0.002919267164543271, 0.0028184198308736086, 0.002689354820176959, 0.002516565378755331, 0.0024678907357156277"
img156.png,essor tower independent Volk Miller,"essor, territorial, prim, urb, esa, cgi, independent, LI, alone, ower","0.00645472900941968, 0.00514615885913372, 0.0035925977863371372, 0.0034014033153653145, 0.002567513845860958, 0.002346897730603814, 0.0019917860627174377, 0.001930505270138383, 0.001813541748560965, 0.0017994288355112076"
img157.png,essor observations death tong,"essor, territorial, erst, urb, cgi, alone, ital, prim, 女, vill","0.00529070571064949, 0.0030740099027752876, 0.003038196824491024, 0.0030028007458895445, 0.0023940415121614933, 0.0023661500308662653, 0.002248993841931224, 0.002248993841931224, 0.00218833121471107, 0.002096292795613408"
img158.png,essor strength gdenays,"essor, prim, territorial, ital, ower, 女, annon, urb, ér, erst","0.004781076684594154, 0.0038417030591517687, 0.0036945296451449394, 0.0035669002681970596, 0.0035116008948534727, 0.0024040762800723314, 0.0023668045178055763, 0.0023483859840780497, 0.0022584206890314817, 0.0022584206890314817"
