Image File,Inference Result,Top 10 Words,Top 10 Probabilities
img1.png,egenantin rörenza &=\,"egen, representation, RES, iba, uis, ibe, nost, пра, Herbert, naming","0.005643515381962061, 0.004017514642328024, 0.003848543157801032, 0.0033567592035979033, 0.0032281633466482162, 0.002848844276741147, 0.002583789639174938, 0.002504294738173485, 0.0022624419070780277, 0.0021253672894090414"
img2.png,VorSFetioso量,"Vor, authorities, express, Sta, moral, eded, presence, nan, Nicol, lera","0.0038412632420659065, 0.0036085329484194517, 0.0032856068573892117, 0.0031969828996807337, 0.0030032875947654247, 0.0030032875947654247, 0.0028434554114937782, 0.0027993719559162855, 0.0027132441755384207, 0.002519161906093359"
img3.png,einges Societyыхnan Lehr,"einges, Prize, reward, family, sent, Mean, rab, La, perpet, conversation","0.0032693608663976192, 0.003156419377774, 0.0027103954926133156, 0.002516516949981451, 0.002429582644253969, 0.0024201106280088425, 0.0021357403602451086, 0.0021357403602451086, 0.002037937520071864, 0.0020299924071878195"
img4.png,lean smaller hopeelesCopy,"lean, presence, rien, kit, ardi, Burg, framework, Raymond, functional, aret","0.005788376089185476, 0.005332502070814371, 0.003171768505126238, 0.002921969862654805, 0.002691844943910837, 0.002660484053194523, 0.0025685762520879507, 0.002441397402435541, 0.0024129541125148535, 0.002338715363293886"
img5.png,ICE plot Angelopynan,"ICE, iced, inner, пра, Arthur, Ritter, Gon, raste, izers, Db","0.00393909215927124, 0.0034089998807758093, 0.0033430641051381826, 0.003067767946049571, 0.0028706658631563187, 0.00246502086520195, 0.0022797714918851852, 0.0021584443747997284, 0.0019576239865273237, 0.0017754879081621766"
img6.png,telling surv dochiba tick,"telling, oned, Wall, uis, sub, ua, Burg, Bon, string, 千","0.007296772673726082, 0.006695894990116358, 0.006002161651849747, 0.004460427910089493, 0.003936313558369875, 0.003612164407968521, 0.003528488799929619, 0.0034602417144924402, 0.0032889132853597403, 0.0031138802878558636"
img7.png,Hospitalautcompatible Ele PDF,"Hospital, aret, cht, reference, пра, Observ, blood, Bar, erved, Pow","0.005679369904100895, 0.002912091324105859, 0.0026932444889098406, 0.002164082834497094, 0.002097500953823328, 0.002097500953823328, 0.0020409245043992996, 0.0018949341028928757, 0.001880187657661736, 0.001752527547068894"
img8.png,rör stim fi Krieg rör,"rör, iska, expression, Vor, izer, reference, ino, expression, Arthur, ris","0.008220070973038673, 0.007998348213732243, 0.007513752672821283, 0.006302546709775925, 0.005143988877534866, 0.004037562757730484, 0.0037929394748061895, 0.003321208758279681, 0.003269718261435628, 0.003169119590893388"
img9.png,confident relatednos conflict-,"confident, confidence, satellite, Hospital, ány, moral, Buffer, aret, Η, expression","0.00858934223651886, 0.003074611071497202, 0.002843550406396389, 0.0027239543851464987, 0.002329921582713723, 0.0023027772549539804, 0.0019696697127074003, 0.0019391329260542989, 0.0018648458644747734, 0.0017864129040390253"
img10.png,expressionieszanha catal Geme,"expression, iesz, ță, Gon, expression, aret, itto, syn, express, Page","0.00918653141707182, 0.005213920958340168, 0.0039050462655723095, 0.0037116939201951027, 0.0034732199274003506, 0.0031255597714334726, 0.0026217240374535322, 0.002531155478209257, 0.00250166654586792, 0.0022689129691570997"
img11.png,engineering Molnan coffeecza,"engineering, Engineering, hip, etwork, Arthur, itto, nan, cache, ance, covered","0.007958286441862583, 0.007593849673867226, 0.007505378685891628, 0.0056432695128023624, 0.005363852251321077, 0.0039860764518380165, 0.0037445721682161093, 0.003116509411484003, 0.0029276900459080935, 0.0024846980813890696"
img12.png,risk DNArootangen catt,"risk, victory, Arthur, credit, hausen, iba, <0xBE>, worker, rör, Quant","0.004797803703695536, 0.004560247994959354, 0.004317556042224169, 0.0042672548443078995, 0.004250618629157543, 0.004201097413897514, 0.004184718709439039, 0.0033888884354382753, 0.003362515941262245, 0.003183565801009536"
img13.png,ane melFiidiaotti,"ane, ardi, Arthur, titled, DNA, Bran, reward, Kon, skap, Bart","0.010289430618286133, 0.005443370435386896, 0.004860382992774248, 0.003920712973922491, 0.0037705127615481615, 0.003555932082235813, 0.003514504060149193, 0.0031503813806921244, 0.002857271581888199, 0.0027585658244788647"
img14.png,Nobotigger copensen,"Nob, ura, risk, Rab, kit, sz, escol, sub, dispute, agini","0.009879396297037601, 0.007574796210974455, 0.003536394564434886, 0.0029663327150046825, 0.002786611672490835, 0.0026798583567142487, 0.0025174939073622227, 0.002392844296991825, 0.0020789389964193106, 0.0019682999700307846"
img15.png,leichnan rå issu Ges,"leich, oned, Vater, Lehr, 百, Ritter, Arist, elm, hinaus, reference","0.0035535332281142473, 0.003135981969535351, 0.003135981969535351, 0.0028331237845122814, 0.0027892000507563353, 0.002724588382989168, 0.002258762950077653, 0.0021722314413636923, 0.0021219116169959307, 0.0020971903577446938"
img16.png,ECT MatrixottiȚ dét,"ECT, cht, -(, Temp, essage, anes, Burg, oned, unic, Cub","0.005581855773925781, 0.005495317280292511, 0.005243668332695961, 0.004364167805761099, 0.00391201488673687, 0.003333078231662512, 0.0025257866363972425, 0.002467276994138956, 0.00245765782892704, 0.0022907890379428864"
img17.png,relax moleplex tack Catherine,"relax, nan, Ba, dic, bill, meas, Level, OP, Nicol, Tier","0.007152380887418985, 0.0038134681526571512, 0.0032745986245572567, 0.002867334522306919, 0.002757488517090678, 0.002746738027781248, 0.0024239879567176104, 0.0023129854816943407, 0.0022771258372813463, 0.0022594048641622066"
img18.png,reference Dru population upserta,"reference, eld, consult, etz, wall, satellite, Wall, Mean, голо, Union","0.0057424441911280155, 0.0050875237211585045, 0.003607594408094883, 0.003271945985034108, 0.003085738979279995, 0.002887482289224863, 0.002865011803805828, 0.00228418642655015, 0.0022052782587707043, 0.002087915549054742"
img19.png,Aristesseraud leanplot,"Arist, ых, moral, uras, aves, rail, <0xBE>, frequent, Gon, Hospital","0.007998046465218067, 0.004889107774943113, 0.004504057113081217, 0.003974816296249628, 0.003095590276643634, 0.0029653937090188265, 0.0028075785376131535, 0.0026169507764279842, 0.0025068854447454214, 0.002336673904210329"
img20.png,db temperPDF Ward construct,"db, пра, uss, brand, iba, Hospital, Bart, titled, Fried, Medic","0.004779689945280552, 0.003693458391353488, 0.002991053741425276, 0.002734044101089239, 0.002538474276661873, 0.0023022962268441916, 0.002104469109326601, 0.002104469109326601, 0.0020718423184007406, 0.0020238482393324375"
img21.png,ion loading röriese子,"ion, cht, ionic, export, aps, elm, stark, certain, preferred, ionen","0.007433761842548847, 0.007010705303400755, 0.0035667577758431435, 0.0027886659372597933, 0.0027134462725371122, 0.002629962284117937, 0.002539109205827117, 0.0024323174729943275, 0.002403980353847146, 0.0023482919204980135"
img22.png,eken Cubieszangenantry,"eken, Sta, writer, eks, ria, einges, hi, spirits, representation, aret","0.005474868696182966, 0.004556589759886265, 0.003989883698523045, 0.0039743282832205296, 0.0038370336405932903, 0.0026371520943939686, 0.0025962668005377054, 0.002566019305959344, 0.0025460505858063698, 0.002477375091984868"
img23.png,ekenynymangelatura,"eken, famil, Hash, wall, Prize, té, nan, nement, Arthur, Peters","0.00879691168665886, 0.00859313178807497, 0.007436735555529594, 0.006537309847772121, 0.006435958202928305, 0.004337809514254332, 0.003949620760977268, 0.003724846988916397, 0.003112226026132703, 0.002946596359834075"
img24.png,referencecons contrast zoomimer,"reference, sent, Burg, ых, power, haus, совер, obb, Syn, egen","0.0034916112199425697, 0.003464439185336232, 0.002883362118154764, 0.002514913445338607, 0.002514913445338607, 0.002475922927260399, 0.002390391193330288, 0.0023078140802681446, 0.002210750710219145, 0.002151119289919734"
img25.png,aret comb Seven canton armed,"aret, expression, express, RES, Arthur, expression, Raymond, essel, Nicolas, ns","0.007475023623555899, 0.006077151745557785, 0.004095975309610367, 0.0035725729539990425, 0.0035034732427448034, 0.0026653020177036524, 0.0026445602998137474, 0.0024746491108089685, 0.0024553912226110697, 0.0021924173925071955"
img26.png,ibeaenexinkelDT,"ibe, iba, Krieg, nan, cht, rör, oven, lär, adesh, its","0.010961144231259823, 0.00747485039755702, 0.006029719021171331, 0.005362943280488253, 0.004921313375234604, 0.004863978363573551, 0.004826126154512167, 0.00401665922254324, 0.0034897334408015013, 0.0030557129066437483"
img27.png,Brandandid coffeeiczride,"Brand, Nich, Lehr, Lob, brand, remainder, Graham, worker, Gordon, presence","0.014728276990354061, 0.005460726097226143, 0.0035533623304218054, 0.0034039125312119722, 0.0032863228116184473, 0.00321019534021616, 0.0031358308624476194, 0.002470975508913398, 0.002138450974598527, 0.002105297287926078"
img28.png,moral量 prideklop,"moral, nombr, authorities, Nicholas, Peter, olin, ua, Mock, hd, Ritter","0.0049083903431892395, 0.0046471706591546535, 0.004611006006598473, 0.003219000995159149, 0.002497186651453376, 0.0024777536746114492, 0.0024584715720266104, 0.0023276342544704676, 0.002282613655552268, 0.0022648500744253397"
img29.png,Crownowerirtualexpressionot,"Crown, worker, crown, confident, lax, kit, acht, ane, eken, entrance","0.004595902748405933, 0.003692911472171545, 0.003171077463775873, 0.0029906106647104025, 0.0029673378448933363, 0.0029442457016557455, 0.002558005042374134, 0.002460009418427944, 0.002421870594844222, 0.002292980905622244"
img30.png,DNA pride rå量ienne,"DNA, ized, Boh, capacity, nab, ELD, moral, izes, cot, tail","0.005764573812484741, 0.004854258149862289, 0.004471952095627785, 0.004217452369630337, 0.004071758594363928, 0.003931097686290741, 0.00359331420622766, 0.0030140774324536324, 0.0029442564118653536, 0.0027229920960962772"
img31.png,depomananusikanenza,"dep, target, neighborhood, certain, Burg, nn, Gy, Priv, stars, sz","0.005585305858403444, 0.003883970435708761, 0.0036772694438695908, 0.0035363954957574606, 0.0029317745938897133, 0.002103445352986455, 0.0020071216858923435, 0.0018418384715914726, 0.0018346577417105436, 0.001827505067922175"
img32.png,RaymondottiingtattanLanguage,"Raymond, syn, ares, query, Grey, arms, telling, fee, law, express","0.010017304681241512, 0.0043762363493442535, 0.003329264698550105, 0.002984333783388138, 0.0027385784778743982, 0.0027279017958790064, 0.0025130610447376966, 0.002454846166074276, 0.0023332983255386353, 0.0021833854261785746"
img33.png,Honoriltriaibamic,"Honor, Hed, ěl, ares, RES, пра, ot, Ges, spirits, izer","0.005799348000437021, 0.005198501516133547, 0.004864501301199198, 0.004292907193303108, 0.003954811487346888, 0.003848136868327856, 0.003476502373814583, 0.0031777804251760244, 0.002553418278694153, 0.0025434636045247316"
img34.png,Burgerr門devangen,"Burg, moral, burg, Brand, ierungs, Honor, authorities, ren, Len, oned","0.008421246893703938, 0.0051478054374456406, 0.004912069998681545, 0.00418513547629118, 0.0039009754545986652, 0.0037223368417471647, 0.0030499733984470367, 0.002681098645552993, 0.002578387502580881, 0.0025088395923376083"
img35.png,RES Deput mic cot teach,"RES, world, Vor, iesz, 百, iba, ease, oned, pair, ̄","0.004360929597169161, 0.0038786910008639097, 0.0037446999922394753, 0.003383054630830884, 0.0028599672950804234, 0.002645037369802594, 0.0025636579375714064, 0.0025042712222784758, 0.002465446013957262, 0.002380276331678033"
img36.png,феiel://nanaye,"фе, Vor, sz, n, Else, nitt, toler, rix, wall, opol","0.008784808218479156, 0.0057387575507164, 0.004331841133534908, 0.004006297793239355, 0.0038079326041042805, 0.00304783065803349, 0.0028520096093416214, 0.002732057822868228, 0.002732057822868228, 0.002507077297195792"
img37.png,basnikDTwehr rör,"bas, raste, bigg, Nicholas, iano, пра, certain, etu, ăr, Cond","0.003691327292472124, 0.0031697170343250036, 0.0030721949879080057, 0.0028636008501052856, 0.0028302387800067663, 0.002819204702973366, 0.002808213699609041, 0.0027112027164548635, 0.002576961647719145, 0.0024019922129809856"
img38.png,Zuanja shadowroot tack,"Zu, expression, express, oo, tone, expression, Jap, ых, Baron, power","0.008518453687429428, 0.005564759019762278, 0.005393549334257841, 0.005351576022803783, 0.0038545955903828144, 0.003523385850712657, 0.003414982696995139, 0.0033751968294382095, 0.002577763982117176, 0.0024597197771072388"
img39.png,oned Episaca prod recall,"oned, expression, OP, Hyper, arms, express, skip, risk, expression, ис","0.008461803197860718, 0.00696048978716135, 0.006852577440440655, 0.0050725494511425495, 0.003459178376942873, 0.0034456923604011536, 0.0032623158767819405, 0.003249597270041704, 0.003040812909603119, 0.0029243212193250656"
img40.png,risk Cup Guyottipler,"risk, agini, voice, hurt, rass, iges, express, VO, imer, rå","0.012020633555948734, 0.005790136754512787, 0.004598301835358143, 0.0032226962503045797, 0.0029342984780669212, 0.0028551507275551558, 0.002206289442256093, 0.0020807289984077215, 0.0020167117472738028, 0.002008849522098899"
img41.png,Hinrazett Seg Jordan,"Hin, odor, ниш, nan, Pul, dog, CC, off, Hans, naire","0.00558876059949398, 0.0037374882958829403, 0.003416341030970216, 0.00328546273522079, 0.003003156278282404, 0.0028881069738417864, 0.002692011883482337, 0.0022580635268241167, 0.0022057555615901947, 0.0021630923729389906"
img42.png,iced Сеix verwIllustration,"iced, Ritter, ibe, oned, 百, confident, Grey, pros, Ges, titled","0.009231354109942913, 0.007022844161838293, 0.0041608973406255245, 0.0036434035282582045, 0.0034765598829835653, 0.0028934499714523554, 0.0022012204863131046, 0.0022012204863131046, 0.0020278594456613064, 0.0019199387170374393"
img43.png,nanölkerdexaturalá,"nan, Sta, Raymond, famil, sender, DNA, diam, Zu, conver, Diam","0.010784424841403961, 0.008940602652728558, 0.005134155973792076, 0.004976194351911545, 0.0036692158319056034, 0.0033670617267489433, 0.0021995638962835073, 0.0021402346901595592, 0.0019260027911514044, 0.0019184938864782453"
img44.png,expression communic mistвітupload,"expression, expression, ionic, Private, confident, ellen, arks, rene, oning, happiness","0.006382917053997517, 0.0037523231003433466, 0.0036797469947487116, 0.0035804917570203543, 0.0034839145373553038, 0.003026877297088504, 0.0029916130006313324, 0.002692160429432988, 0.002692160429432988, 0.002568877302110195"
img45.png,ince lev Brandrita►,"ince, aes, rör, quip, om, pow, ых, moral, ivid, aires","0.007162375375628471, 0.0046972003765404224, 0.0042768497951328754, 0.0035734418779611588, 0.0033308141864836216, 0.0032409708946943283, 0.0032157497480511665, 0.003203212283551693, 0.002985722152516246, 0.0028489960823208094"
img46.png,expression behaviornanemprenan,"expression, Hospital, deeply, Bill, MO, express, sz, nan, rör, iani","0.0035449296701699495, 0.003531109541654587, 0.0028707715682685375, 0.0027715994510799646, 0.002696840325370431, 0.0024844456929713488, 0.0021754533518105745, 0.001950063742697239, 0.001761735649779439, 0.0016745062312111259"
img47.png,expressionameseg cit rör,"expression, chten, ós, holder, Rum, eps, stars, expression, Arthur, Ost","0.006979518104344606, 0.0033097947016358376, 0.0030372384935617447, 0.002978492761030793, 0.00289815291762352, 0.0025377075653523207, 0.002527813892811537, 0.0024789217859506607, 0.002412057016044855, 0.002337845740839839"
img48.png,electric kleellenLanguageTV,"electric, Electric, iced, Arist, rade, entitled, ണ, Rena, Nicol, slice","0.006977682467550039, 0.004758365917950869, 0.0033218751195818186, 0.003207119181752205, 0.0025870788376778364, 0.0023190423380583525, 0.0022830890957266092, 0.002204218413680792, 0.002062598941847682, 0.0019758488051593304"
img49.png,Grahamovo horsux none,"Graham, titled, Gem, Ba, iba, Boh, risk, Eth, isk, apsed","0.011341945268213749, 0.006118520628660917, 0.0036678353790193796, 0.003541128244251013, 0.0033136126585304737, 0.003199142636731267, 0.0028676928486675024, 0.0028453762643039227, 0.002779463306069374, 0.00272570364177227"
img50.png,ArthurыхONGlaxscheid,"Arthur, wall, overflow, ECT, chten, aret, wall, Ges, risk, holder","0.007404550909996033, 0.006637396290898323, 0.00412125326693058, 0.00412125326693058, 0.003932527266442776, 0.0037818748969584703, 0.0026922468096017838, 0.002509450074285269, 0.002441762015223503, 0.0023118136450648308"
img51.png,armedoles bareangelog,"armed, ized, Jap, oned, akov, reference, erer, izer, expression, conversation","0.013067248277366161, 0.004641106352210045, 0.003908202983438969, 0.0033690817654132843, 0.002950066700577736, 0.0029156971722841263, 0.002686066087335348, 0.0025831644888967276, 0.0025431164540350437, 0.0025036889128386974"
img52.png,eken cubini Brand signature,"eken, rör, ane, expression, OP, db, oned, Balt, yr, eld","0.009887232445180416, 0.006956536788493395, 0.006211488042026758, 0.005722291301935911, 0.005149504169821739, 0.005049904342740774, 0.0048186518251895905, 0.00408953707665205, 0.0031725175213068724, 0.002671527676284313"
img53.png,express halху horsaton,"express, hurt, ones, raz, Hospital, voice, types, izer, rass, types","0.005943760741502047, 0.004348548129200935, 0.004348548129200935, 0.0034132148139178753, 0.003169062314555049, 0.0024584464263170958, 0.0023828078992664814, 0.0023185356985777617, 0.0021276078186929226, 0.00198314874432981"
img54.png,thermaloles intellect Thomaires,"thermal, expression, intro, etwork, Cer, syn, confidence, stack, design, practice","0.0041094389744102955, 0.0037563315127044916, 0.0035983454436063766, 0.0033803326077759266, 0.0032381603959947824, 0.0029026679694652557, 0.00271617341786623, 0.0024442917201668024, 0.0024158144369721413, 0.002323266351595521"
img55.png,Wallieszanes Sib fiction,"Wall, Nicol, ых, Graphics, ayer, Brand, Grey, ync, Occ, diag","0.003854429814964533, 0.0034686115104705095, 0.002787107601761818, 0.0026908256113529205, 0.002597870072349906, 0.0025476226583123207, 0.002469240454956889, 0.002421481069177389, 0.002393270144239068, 0.002374645322561264"
img56.png,ibaPower Murray tuttiidé,"iba, etz, Burg, ife, brand, nex, Turk, stars, -(, équip","0.003475022269412875, 0.002903489861637354, 0.0028808945789933205, 0.0028808945789933205, 0.002738251816481352, 0.002685289131477475, 0.002342150779440999, 0.002278975211083889, 0.0022700903937220573, 0.002157690469175577"
img57.png,onedantineottiwehrons,"oned, sure, rå, accuracy, offices, DNA, <0xBD>, Ψ, Tier, yna","0.015932206064462662, 0.008494648151099682, 0.005233400966972113, 0.0036535027902573347, 0.0032494922634214163, 0.0032368239481002092, 0.002867667004466057, 0.002725678961724043, 0.0024817590601742268, 0.0023405214305967093"
img58.png,engoладentin Supegr,"engo, nab, persu, majority, Fitz, sent, viol, Ci, , iced","0.00364490388892591, 0.003384178504347801, 0.003166747512295842, 0.002986527280882001, 0.002772896783426404, 0.002656272379681468, 0.00263560120947659, 0.002307809656485915, 0.002176471520215273, 0.0021012844517827034"
img59.png,subozensa root stops,"sub, skap, ris, stark, pr, syn, ट, Forum, ós, piano","0.005350811872631311, 0.002754362067207694, 0.0024212393909692764, 0.002239280380308628, 0.002128405962139368, 0.002079101512208581, 0.0020548792090266943, 0.00196845387108624, 0.0019607795402407646, 0.0019078908953815699"
img60.png,itten Ritteradelizersince,"itten, nan, Grey, Vor, ву, express, modern, confident, ány, itter","0.008331147022545338, 0.005053095985203981, 0.00489762844517827, 0.0045650918036699295, 0.0034865313209593296, 0.0031498183961957693, 0.002890435978770256, 0.002790584694594145, 0.002415049821138382, 0.0022335557732731104"
img61.png,ameselt rörattanтин,"ames, Stu, cht, aes, 発, Brand, reference, titled, anes, repeat","0.007032494060695171, 0.006923465523868799, 0.004739872179925442, 0.0034677644725888968, 0.0033219149336218834, 0.0033089639618992805, 0.002874877769500017, 0.0026796807069331408, 0.0025871102698147297, 0.0024879993870854378"
img62.png,nanuetlayer Mol rör,"nan, bru, Springer, iba, presence, Et, trigger, Rain, gold, uis","0.010028249584138393, 0.005691647995263338, 0.004067637957632542, 0.00363199133425951, 0.0028619403019547462, 0.00276307319290936, 0.0027415708173066378, 0.0025355385150760412, 0.002202914096415043, 0.0021434943191707134"
img63.png,ilarannesistory�ird,"ilar, iba, unic, Arthur, Baron, Zu, risk, fusion, Graham, ovo","0.0051745264790952206, 0.004239854868501425, 0.0041254921816289425, 0.003380307462066412, 0.003340925555676222, 0.0032381361816078424, 0.0032255116384476423, 0.003041947027668357, 0.002148654079064727, 0.002050260081887245"
img64.png,riskegyzecyryna,"risk, isk, neighbor, Ritter, aret, <0x9E>, expression, Brad, engen, fee","0.007639200892299414, 0.0036226261872798204, 0.003608503146097064, 0.0034567341208457947, 0.00331134838052094, 0.0031107240356504917, 0.0026921071112155914, 0.0024037810508161783, 0.0023480975069105625, 0.0023389433044940233"
img65.png,ărotciugovren,"ăr, eken, ых, TL, representing, пр, lär, Ged, sz, Lob","0.004681786522269249, 0.003617804264649749, 0.00328120612539351, 0.003180254017934203, 0.002784723648801446, 0.0027308620046824217, 0.0024288787972182035, 0.0022201749961823225, 0.0018550257664173841, 0.0018477936973795295"
img66.png,Gyieszansk Molengo,"Gy, iba, Nicholas, oce, ps, lap, RES, Engineering, dens, versch","0.007638038136065006, 0.005995164159685373, 0.0036935140378773212, 0.003538169665262103, 0.003310844535008073, 0.0031469131354242563, 0.0030263569205999374, 0.002887769602239132, 0.0027880105189979076, 0.002384711755439639"
img67.png,twice recently�itt Angel,"twice, eld, dic, vá, taught, Union, elm, <0x9E>, teach, ECT","0.008044947870075703, 0.0075871082954108715, 0.006168275140225887, 0.0032631747890263796, 0.0028350951615720987, 0.002791140927001834, 0.002304916037246585, 0.0022869789972901344, 0.0022166159469634295, 0.0021822506096214056"
img68.png,expression Flandellentextarea�,"expression, ниш, aret, rör, Arthur, expression, isk, cht, dep, ardi","0.013822662644088268, 0.008482694625854492, 0.0062303622253239155, 0.0060386741533875465, 0.004852211102843285, 0.004232173785567284, 0.003387389238923788, 0.0029201118741184473, 0.00239265407435596, 0.002309998730197549"
img69.png,Baron spirits esp starknab,"Baron, <0xA3>, isce, emark, egen, dod, uis, sent, wehr, diam","0.008761044591665268, 0.0072066388092935085, 0.0042865038849413395, 0.004220047499984503, 0.0034985423553735018, 0.002735331654548645, 0.0025100812781602144, 0.002404510509222746, 0.002172294305637479, 0.002163825323805213"
img70.png,iba currellers Cotable,"iba, Arthur, saying, Crown, Cic, , Stu, Diam, Allen, rap","0.0075408583506941795, 0.005003710277378559, 0.0031681524123996496, 0.0028846352361142635, 0.00257568946108222, 0.0021689480636268854, 0.0020216817501932383, 0.0019903385546058416, 0.0019594812765717506, 0.001884414697997272"
img71.png,uis inv daily Stadumer,"uis, onic, confident, reference, team, risk, Vor, arks, hip, where","0.014881167560815811, 0.01186430174857378, 0.008816800080239773, 0.004450717009603977, 0.0037920584436506033, 0.0034258393570780754, 0.003268958767876029, 0.0028290478512644768, 0.0022379611618816853, 0.002069775713607669"
img72.png,nan brief specmag subs,"nan, confident, ris, confidence, erer, iba, RES, reporting, fi, coverage","0.0050108772702515125, 0.0050108772702515125, 0.004474209621548653, 0.004026352893561125, 0.0038419729098677635, 0.0034574014134705067, 0.003147999756038189, 0.00258947373367846, 0.0025393888354301453, 0.0024805639404803514"
img73.png,chtkupistemsbru,"cht, oned, lax, kreis, uent, essage, ых, ELD, escol, arks","0.0065024979412555695, 0.004101073835045099, 0.0031939197797328234, 0.0027425969019532204, 0.002429806161671877, 0.0022736925166100264, 0.0021611140109598637, 0.0021193143911659718, 0.002094623865559697, 0.0019372102105990052"
img74.png,oce Galluberym root,"oce, Tsch, <0xBE>, Encoding, nex, escol, RES, kit, lé, Mean","0.0046813515946269035, 0.0037177479825913906, 0.003506170120090246, 0.003230035537853837, 0.0031429107766598463, 0.002784464741125703, 0.00252539967186749, 0.002457281341776252, 0.002419184660539031, 0.002202692674472928"
img75.png,easedaleotti boototti,"ease, Boh, sub, certain, cht, flesh, forg, ane, Wall, Allen","0.006570911500602961, 0.005279875826090574, 0.0029733339324593544, 0.002881854074075818, 0.0028150961734354496, 0.0027931886725127697, 0.002553181257098913, 0.002553181257098913, 0.0023891408927738667, 0.0023798265028744936"
img76.png,qqantineństwandaFalse,"qq, Arthur, mut, pros, aret, Ges, Lob, etz, Mut, Gy","0.022031020373106003, 0.01514168456196785, 0.00794799905270338, 0.0052738673985004425, 0.0052124252542853355, 0.004745967220515013, 0.0034452027175575495, 0.00291250622831285, 0.002672665985301137, 0.0025502757634967566"
img77.png,etzenschaft language certainones,"etz, RES, iqu, Ges, iba, Burg, iesz, itto, ride, ниш","0.004841115325689316, 0.0037555659655481577, 0.003262892132624984, 0.0026423707604408264, 0.002551088808104396, 0.0023871827870607376, 0.0023137368261814117, 0.002260139212012291, 0.002173554850742221, 0.002139856806024909"
img78.png,arethagenibaiste ups,"aret, Springer, Nicolas, annel, Unidos, UP, Burg, Gon, practices, Vor","0.0031983284279704094, 0.003173438599333167, 0.0029007578268647194, 0.0026411700528115034, 0.0025699289981275797, 0.0025103965308517218, 0.0024236738681793213, 0.002224088180810213, 0.002224088180810213, 0.0021139660384505987"
img79.png,ekenправanesaturaua,"eken, reference, essage, issu, express, aret, Boh, Sax, Grey, defense","0.023339293897151947, 0.004649952985346317, 0.003607268678024411, 0.0035932050086557865, 0.003509968752041459, 0.0025982181541621685, 0.002518279245123267, 0.002365704393014312, 0.0021289035212248564, 0.0019158058566972613"
