img80.png,riskinignesraduler,"ris, express, isk, confident, risk, nan, ós, usch, separately, cht","0.009636297821998596, 0.00551208620890975, 0.005490596871823072, 0.005137829575687647, 0.0051177991554141045, 0.004883437883108854, 0.0037442620377987623, 0.0036575261037796736, 0.0033958980347961187, 0.0029274472035467625"
img81.png,armedhui subsalfalet,"armed, iced, iche, writer, Toast, Brand, Wall, hurt, power, Tier","0.003997837658971548, 0.0037850765511393547, 0.0031502204947173595, 0.003017726121470332, 0.002521404530853033, 0.0022601725067943335, 0.0021992081310600042, 0.0021820939145982265, 0.0020418958738446236, 0.0019713575020432472"
img82.png,Unidosempre://ottiux,"Unidos, Arthur, Ве, oned, essage, ane, Grey, Raymond, ós, ͡","0.006075053475797176, 0.00484345480799675, 0.004015365149825811, 0.0032013284508138895, 0.003188847564160824, 0.0031394087709486485, 0.002914842450991273, 0.002602661494165659, 0.002493196865543723, 0.002379025099799037"
img83.png,sub teachynawers Cup,"sub, corpor, Lob, nex, far, staff, Hash, solid, syn, ved","0.00844561867415905, 0.006500824820250273, 0.004645930137485266, 0.004433177411556244, 0.004263345152139664, 0.004068112466484308, 0.0040207174606621265, 0.003493259893730283, 0.0032816140446811914, 0.002806912874802947"
img84.png,expressrazłow ratio force,"express, iced, nab, agini, nan, oben, Wall, teles, зд, Marc","0.005943759344518185, 0.005671575199812651, 0.0053279516287148, 0.005123841110616922, 0.003399906912818551, 0.0032442142255604267, 0.0031443999614566565, 0.002753328764811158, 0.0027319020591676235, 0.0024488612543791533"
img85.png,egenvnottiottiestra,"egen, expression, express, predicate, нец, ne, expression, family, fier, ELD","0.01991083100438118, 0.005422097165137529, 0.004255852662026882, 0.003459983505308628, 0.00343305803835392, 0.0030534251127392054, 0.0021067997440695763, 0.0020499725360423326, 0.0020499725360423326, 0.0020260896999388933"
img86.png,Nicolonom empannesoda,"Nicol, rå, stars, leich, rör, Raymond, reference, té, blood, Burg","0.005256164353340864, 0.005194928031414747, 0.005134405102580786, 0.004842205438762903, 0.003315021051093936, 0.0025516629684716463, 0.002541715046390891, 0.0025023093912750483, 0.0020663996692746878, 0.002042325446382165"
img87.png,unge Springer inquenzaauf,"unge, Vor, Nicol, Brand, confident, ță, violent, Sebastian, Lob, ns","0.01675686426460743, 0.008525202050805092, 0.007406824268400669, 0.005211350973695517, 0.00505101541057229, 0.004058604594320059, 0.00365234911441803, 0.0028555849567055702, 0.0027248181868344545, 0.0025597300846129656"
img88.png,Constitution Lehr Pozilli cot,"Constitution, iska, isk, subclass, essage, .@, titled, express, sub, confident","0.006273784674704075, 0.005408340599387884, 0.004114448558539152, 0.003659466514363885, 0.003306052414700389, 0.002986769424751401, 0.0028835900593549013, 0.002838884247466922, 0.0026255385018885136, 0.0024858100805431604"
img89.png,hipaturaczaыхazi,"hip, isme, eks, онов, risk, armed, authorities, они, raste, nes","0.004281436558812857, 0.003690828802064061, 0.003282691352069378, 0.0031079896725714207, 0.003059804905205965, 0.002965664491057396, 0.0028856706339865923, 0.002829856937751174, 0.0027427910827100277, 0.002700268058106303"
img90.png,onesunicensaaufync,"ones, aret, voice, Raymond, sat, voice, ika, Cond, naming, star","0.010017529129981995, 0.007215355988591909, 0.005116453859955072, 0.004192271735519171, 0.003728683805093169, 0.003381769172847271, 0.003264944301918149, 0.0031032857950776815, 0.002996081253513694, 0.0026132287457585335"
img91.png,ernewehr FIwehr Crown,"erne, ours, RES, ых, elm, 真, ps, certain, rict, iesz","0.02104061283171177, 0.0035025307442992926, 0.0034888754598796368, 0.003381534246727824, 0.0028364358004182577, 0.0027815739158540964, 0.002572535304352641, 0.0025625061243772507, 0.0025625061243772507, 0.0025129427667707205"
img92.png,Ritter Ritter Ritter onesogne,"Ritter, Wall, agini, skin, nan, iges, wall, нец, hex, Brand","0.009329872205853462, 0.008764604106545448, 0.0065900771878659725, 0.004188908264040947, 0.0040442002937197685, 0.003904491662979126, 0.003459187922999263, 0.003405558178201318, 0.0033790557645261288, 0.003137347288429737"
img93.png,authorities rig stimaze Tamb,"authorities, iges, nab, Ges, summ, fusion, worker, Raymond, Gemeins, Krieg","0.006761579308658838, 0.005184283014386892, 0.004247848875820637, 0.003928618039935827, 0.0031444267369806767, 0.0027858074754476547, 0.0025464340578764677, 0.002094639465212822, 0.00208647339604795, 0.002022279193624854"
img94.png,icedociauduer twice,"iced, mans, Hans, aret, nab, confident, chunk, target, iba, Raymond","0.005154537037014961, 0.004674961790442467, 0.0032636497635394335, 0.0029027501586824656, 0.0028689319733530283, 0.002780664013698697, 0.0026326801162213087, 0.0026224160101264715, 0.002314274199306965, 0.0022695118095725775"
img95.png,aginiikel Gall Hubisk,"agini, expression, confident, ниш, arms, Tai, etz, iba, dens, off","0.009004692547023296, 0.0030398506205528975, 0.0028893370181322098, 0.0028780726715922356, 0.002579887630417943, 0.0025598108768463135, 0.002250218065455556, 0.002164013683795929, 0.0020729980897158384, 0.002048846799880266"
img96.png,MieGS ansikercop,"Mie, metros, mans, Cic, etwork, rör, gold, <0xA3>, agua, Hin","0.004379523918032646, 0.0037901620380580425, 0.002974932547658682, 0.0027837948873639107, 0.002485648961737752, 0.002485648961737752, 0.00241860281676054, 0.0023904256522655487, 0.0022632090840488672, 0.0021765069104731083"
img97.png,neighborhoodhausen freelyboy Harr,"neighborhood, Honor, gent, hip, Wall, repeat, dic, internal, gent, kl","0.005606414284557104, 0.0031695791985839605, 0.003024433506652713, 0.002819082234054804, 0.002775376196950674, 0.0027005153242498636, 0.002607224974781275, 0.002607224974781275, 0.0025073434226214886, 0.0023462483659386635"
img98.png,ura conversation motionktux,"ura, onic, certificate, oles, weather, certain, electric, Einwo, pret, ниш","0.02521579898893833, 0.005023814272135496, 0.004450852982699871, 0.003479894483461976, 0.003243618179112673, 0.0029189407359808683, 0.0024772726465016603, 0.0023000699002295732, 0.002229304052889347, 0.002203331794589758"
img99.png,ниш◄holembrecza,"ниш, Corps, rör, ECT, пра, erer, Kont, icion, onato, skap","0.027208201587200165, 0.006000241730362177, 0.0044243005104362965, 0.0035136081278324127, 0.0035136081278324127, 0.003486264729872346, 0.0028454065322875977, 0.002715105889365077, 0.0026315709110349417, 0.0023589248303323984"
img100.png,rörapsavant upsiza,"rör, iced, uba, ị, Burg, 太, okal, etwork, Luci, ames","0.004420468583703041, 0.0036934399977326393, 0.003098062938079238, 0.003050031838938594, 0.002944667125120759, 0.0029103606939315796, 0.002755474066361785, 0.0027447317261248827, 0.002578436629846692, 0.002460361458361149"
img101.png,ittoyna Copaud Agr,"itto, Cot, he, iba, essage, Nicol, certain, issa, Sax, Hyp","0.007186215370893478, 0.00396860484033823, 0.003907077480107546, 0.0036991469096392393, 0.003434541402384639, 0.003054744331166148, 0.002493209671229124, 0.002473807195201516, 0.002407080726698041, 0.002226185752078891"
img102.png,Burg Lorenannesibałow,"Burg, Baron, La, Brand, Hans, types, Institute, <0xB7>, Type, brand","0.008778737857937813, 0.0049244253896176815, 0.004590069875121117, 0.004179305862635374, 0.004146782215684652, 0.002850038930773735, 0.0027301697991788387, 0.002635854994878173, 0.00241879653185606, 0.002399973338469863"
img103.png,sever quad Burg Cantlee,"sever, Holland, Nicol, sub, iness, pow, anes, uis, angle, dic","0.005232763476669788, 0.003610498271882534, 0.0031368553172796965, 0.0031003099866211414, 0.0029124715365469456, 0.0027790996246039867, 0.0027574726846069098, 0.0027574726846069098, 0.0023402366787195206, 0.002224363386631012"
img104.png,fusion cot inheranzaiba,"fusion, ниш, aret, sub, eld, oned, ika, reference, etz, expression","0.006537163630127907, 0.0044579580426216125, 0.004440578632056713, 0.0035681051667779684, 0.0033258392941206694, 0.0032999576069414616, 0.0022947604302316904, 0.002285813679918647, 0.0021389517933130264, 0.0021306127309799194"
img105.png,icket sinwindansempre,"icket, conversation, iesz, conscience, pr, positive, toe, Net, ane, Arthur","0.010569055564701557, 0.009736670181155205, 0.005657207686454058, 0.0044927350245416164, 0.0035401901695877314, 0.003458181628957391, 0.00326137593947351, 0.003185826353728771, 0.0030280849896371365, 0.0029464075341820717"
img106.png,stark familjenexpressionistrarac,"stark, -(, RES, Rails, ons, qq, swing, ivid, rail, eps","0.004985188599675894, 0.003373147686943412, 0.00267882295884192, 0.0025461853947490454, 0.0020619637798517942, 0.0018555665155872703, 0.0018196766031906009, 0.001702763605862856, 0.001689512631855905, 0.001689512631855905"
img107.png,alth�ottieln Schne,"alth, nombr, ovo, rör, Ritter, floor, armed, flesh, autorité, forg","0.003709981217980385, 0.0034177948255091906, 0.0032997254747897387, 0.003248568158596754, 0.0031733151990920305, 0.003160943277180195, 0.0026617813855409622, 0.002559809945523739, 0.00238600536249578, 0.0021980912424623966"
img108.png,eken conformottiagiwehr,"eken, yna, nab, Hospital, anes, Salt, Arbeit, eld, bis, salt","0.0068970937281847, 0.0064539602026343346, 0.005807935725897551, 0.004232610110193491, 0.003945226315408945, 0.003691748483106494, 0.003157719736918807, 0.00310876383446157, 0.002863927511498332, 0.0027758136857300997"
img109.png,Castle Oberstat hopodia,"Castle, risk, fortune, -(, opp, arms, agi, anes, imi, itel","0.009349478408694267, 0.0059197209775447845, 0.004314075689762831, 0.003928010817617178, 0.003452942706644535, 0.003119473811239004, 0.0030711109284311533, 0.0027853765059262514, 0.0026786704547703266, 0.002373170107603073"
img110.png,appenelin guer representingFi,"appen, нец, posit, raz, acht, Graham, iced, Burg, voice, peer","0.004172545857727528, 0.0038289434742182493, 0.002790393540635705, 0.002673033159226179, 0.0023867497220635414, 0.002331460826098919, 0.002295315032824874, 0.002173160668462515, 0.0020655598491430283, 0.0018299847142770886"
img111.png,diamsing Cop prideotti,"diam, Schne, floor, anno, Engineering, repeat, temperature, expression, express, node","0.003210781840607524, 0.003063749521970749, 0.0025399376172572374, 0.002395389135926962, 0.0022502599749714136, 0.0021725238766521215, 0.0021056821569800377, 0.0020408970303833485, 0.0020250147208571434, 0.0019781053997576237"
img112.png,Tierrixnik armed Pra,"Tier, Boh, Vor, Ges, controvers, mult, iced, 魔, fusion, “","0.003836113726720214, 0.003561710938811302, 0.003094468265771866, 0.0030703870579600334, 0.0026571983471512794, 0.0026571983471512794, 0.0021518648136407137, 0.0019669635221362114, 0.0018768899608403444, 0.0017563009168952703"
img113.png,Typesunicachthd Mach,"Types, pow, oned, 風, ion, types, iced, рев, Honor, iones","0.00531300762668252, 0.005049942526966333, 0.0036515730898827314, 0.00351168354973197, 0.003443761495873332, 0.0031478528399020433, 0.0030990499071776867, 0.002888632006943226, 0.002671547932550311, 0.0021216399036347866"
img114.png,uis pollaton Fineovan,"uis, Hog, Toast, certain, staff, workers, uent, CCE, kal, ță","0.0033992843236774206, 0.0026785717345774174, 0.0026063218247145414, 0.0024293591268360615, 0.0023916952777653933, 0.00232718326151371, 0.0023181105498224497, 0.0022821715101599693, 0.0022467898670583963, 0.0022467898670583963"
img115.png,Turkenza armedieck Crown,"Turk, power, rör, ített, stark, Hash, ivid, %., olan, Pul","0.00906425155699253, 0.005806777626276016, 0.004504691809415817, 0.004101568832993507, 0.003778542159125209, 0.003549611894413829, 0.003295703325420618, 0.0032700560986995697, 0.003096026601269841, 0.002753663109615445"
img116.png,etworkibaicked Francげ,"etwork, staff, alse, ECT, atus, heiten, eken, gold, egen, cy","0.004756549838930368, 0.003047160105779767, 0.0029190005734562874, 0.002616575453430414, 0.0023181571159511805, 0.0022380754817277193, 0.0021777073852717876, 0.002053773496299982, 0.002045766683295369, 0.0019750946667045355"
img117.png,etz bro quadroussizer,"rass, etz, expression, Pul, eken, essage, Kol, sz, atmosphere, hip","0.005989271681755781, 0.005989271681755781, 0.004247029311954975, 0.002964904299005866, 0.0029189379420131445, 0.002678568009287119, 0.0025559074711054564, 0.002318107523024082, 0.0021607137750834227, 0.0020298026502132416"
img118.png,arethagenaczdoc ups,"aret, iska, Eth, CCE, expression, ◄, moral, intro, Myst, ams","0.007616903632879257, 0.006989663932472467, 0.0030775072518736124, 0.0025814177934080362, 0.0025613289326429367, 0.002444037003442645, 0.0022427744697779417, 0.0020104101859033108, 0.0019638389348983765, 0.0018666025716811419"
img119.png,ECTeaiggereadlá,"ECT, erer, etta, chten, uda, uit, té, Priv, х, izer","0.018125934526324272, 0.008765130303800106, 0.007015521638095379, 0.0034459081944078207, 0.0028234762139618397, 0.002768865553662181, 0.002521080430597067, 0.002453078515827656, 0.0021146859508007765, 0.0019481399795040488"
img120.png,Kriegkin rör Zo armed,"Krieg, Colleg, Honor, cert, express, Cons, Cert, transition, kit, sharp","0.008200383745133877, 0.005976139102131128, 0.004801962524652481, 0.0037986652459949255, 0.003783855587244034, 0.002993276109918952, 0.002704199869185686, 0.002530456520617008, 0.0022506345994770527, 0.002172885462641716"
img121.png,angenweetóż Crownscheid,"angen, agini, Gold, ST, anes, floor, Gem, W, ones, oca","0.00579538568854332, 0.0038756688591092825, 0.0033804187551140785, 0.003315035020932555, 0.002994884504005313, 0.0029715783894062042, 0.0027806563302874565, 0.002632672665640712, 0.0026224087923765182, 0.0025318164844065905"
img122.png,ionic❯ röruras cop,"ionic, ́, pros, agini, presence, Hyper, ized, łod, ion, Fi","0.010179252363741398, 0.0049031744711101055, 0.004696953110396862, 0.0040175169706344604, 0.003116647247225046, 0.0028377396520227194, 0.0027937444392591715, 0.0023342608474195004, 0.002298071514815092, 0.002175770467147231"
img123.png,riskotti Ritterelleriza,"risk, Außerdem, represent, absol, aret, private, itto, confident, representing, separately","0.005075369495898485, 0.004240630194544792, 0.0031513688154518604, 0.00307836732827127, 0.002869353862479329, 0.00282486854121089, 0.002781073097139597, 0.0026228015776723623, 0.002454288536682725, 0.002406818326562643"
img124.png,yszizer triumphECTitto,"ysz, ans, intro, 風, message, risk, expression, igger, aret, Ges","0.007246168330311775, 0.004412224981933832, 0.00367217930033803, 0.0034767496399581432, 0.003092285245656967, 0.00250420905649662, 0.0024944457691162825, 0.002455773064866662, 0.0024366620928049088, 0.002352486364543438"
img125.png,agisers Springerabennex,"agi, iba, пра, Hospital, okal, buffer, Ges, authorities, among, express","0.004260421264916658, 0.003056702669709921, 0.003056702669709921, 0.003044785698875785, 0.002783159725368023, 0.002604343229904771, 0.0025840760208666325, 0.002352827927097678, 0.0021760102827101946, 0.0021256031468510628"
img126.png,onedaeониot Lehr,"oned, ós, iced, Dol, language, risk, hi, scale, Raymond, Language","0.008805877529084682, 0.007893537171185017, 0.004604259971529245, 0.004111141432076693, 0.003176843747496605, 0.0029960491228848696, 0.0027279334608465433, 0.0025827554054558277, 0.0024838116951286793, 0.002279273932799697"
img127.png,tinitter Springerotnan,"tin, expression, Raymond, expression, express, stars, izer, Hyper, younger, haus","0.009438973851501942, 0.007764288689941168, 0.006878778338432312, 0.005658328533172607, 0.0046181934885680676, 0.003784012049436569, 0.003540891455486417, 0.0031616603955626488, 0.0028120388742536306, 0.0028010758105665445"
img128.png,practutor family kinattan,"pract, anes, battery, issent, expression, batter, stark, BA, 風, Gy","0.015967873856425285, 0.008414478041231632, 0.004683361854404211, 0.003959221765398979, 0.003507676301524043, 0.0034130627755075693, 0.003193775424733758, 0.002965320134535432, 0.002467958489432931, 0.002373412484303117"
img129.png,ieszSM fully armed Mold,"iesz, latter, Ges, representation, alse, risk, moral, ós, authorities, itos","0.006100168917328119, 0.005775523837655783, 0.0054468377493321896, 0.0050375014543533325, 0.004192580934613943, 0.004063589032739401, 0.004031965509057045, 0.003685514908283949, 0.0035030324943363667, 0.0032524552661925554"
img130.png,OP gravingen brand teles,"OP, nan, aret, Ritter, tör, osti, Es, Nob, apsed, enza","0.00791469682008028, 0.006612977012991905, 0.006409517023712397, 0.0053763119503855705, 0.0033252136781811714, 0.003286473685875535, 0.003222907427698374, 0.003039491130039096, 0.002811070065945387, 0.002146919025108218"
img131.png,authorities Mind Seg zwolder,"authorities, Stu, Vor, hy, Ges, Springer, ány, icode, Mean, ós","0.009684895165264606, 0.0062530385330319405, 0.00413300609216094, 0.0038825999945402145, 0.003675971645861864, 0.003675971645861864, 0.00309547851793468, 0.002851688303053379, 0.002829496283084154, 0.002710491418838501"
img132.png,risk bandeéma‌ Ritter,"risk, Kap, consult, ika, agini, prevent, staff, egen, responsible, ikt","0.007946806959807873, 0.003666849108412862, 0.0029463961254805326, 0.0025900481268763542, 0.0024141904432326555, 0.0023860640358179808, 0.002294655656442046, 0.0022240562830120325, 0.0021640663035213947, 0.002122209407389164"
img133.png,avantlan proud coplon,"avant, ós, yt, Tier, hurt, nan, familjen, нец, cht, skip","0.010120958089828491, 0.007491935044527054, 0.0035666958428919315, 0.0032222410663962364, 0.002558978972956538, 0.0024609460961073637, 0.002357441931962967, 0.002205977914854884, 0.002188810845836997, 0.0021633105352520943"
img134.png,representinganes upsaysenes,"representing, usch, uber, ャ, eval, aps, cademy, expression, nei, asp","0.004478780087083578, 0.003570794826373458, 0.003138930071145296, 0.002770095830783248, 0.0026744017377495766, 0.0026535894721746445, 0.0024541690945625305, 0.0023054785560816526, 0.0022875370923429728, 0.002066617598757148"
img135.png,Ges Ritteritschaturanik,"Ges, aret, Syn, authorities, quad, Alo, 么, (/, ika, aqu","0.02519114874303341, 0.0051782201044261456, 0.0037884670309722424, 0.0024364818818867207, 0.002184048295021057, 0.0018106396310031414, 0.0017480903770774603, 0.0016167191788554192, 0.0016104162205010653, 0.001501073013059795"
img136.png,Nicol Bayeropynik fully,"Nicol, Brand, sz, skap, isk, risk, izers, ➖, izes, Buffer","0.011228415183722973, 0.0031547723338007927, 0.00274091400206089, 0.002656585071235895, 0.0025748503394424915, 0.002400024561211467, 0.0022722973953932524, 0.00223706872202456, 0.00210153148509562, 0.00210153148509562"
img137.png,express sin ratingobbathan,"express, ниш, Dioc, Gall, nex, Arch, ica, oned, nan, prod","0.010127048939466476, 0.005336580332368612, 0.004954847041517496, 0.0037694487255066633, 0.00275778747163713, 0.002530688187107444, 0.002520821988582611, 0.002424250589683652, 0.002164612291380763, 0.0021393937058746815"
img138.png,oned Dob dob differentask,"oned, ized, hurt, confident, Wall, equ, sub, nu, Jonathan, rii","0.011248929426074028, 0.004544978495687246, 0.004236385691910982, 0.0035258333664387465, 0.0029116226360201836, 0.0028889640234410763, 0.0028664818964898586, 0.0026718550361692905, 0.0024044092278927565, 0.002312297699972987"
img139.png,urg powieciePortail Franc Leop,"urg, express, oned, hurt, false, бо, expression, hon, nan, rail","0.0053423671051859856, 0.00464152917265892, 0.004226160701364279, 0.003343168180435896, 0.0029388333205133677, 0.0029045946430414915, 0.002870755037292838, 0.002573328325524926, 0.002370661124587059, 0.0023157447576522827"
img140.png,uisienstanellanguage stat,"uis, Carter, down, Tsch, 真, Nic, js, öff, ву, design","0.00360091938637197, 0.0025534341111779213, 0.0023800625931471586, 0.002288883551955223, 0.0022622174583375454, 0.001980863744392991, 0.0019425502978265285, 0.0018827844178304076, 0.001846367958933115, 0.0018035969696938992"
img141.png,itto Gun◄ temperiner,"itto, Trace, Canal, power, Carl, aret, repe, isk, observations, väst","0.00820575375109911, 0.006645222194492817, 0.005035709124058485, 0.0026536323130130768, 0.002425616141408682, 0.00226092291995883, 0.0022521084174513817, 0.0021999382879585028, 0.0020346103701740503, 0.0020266782958060503"
img142.png,expressioniesz constructor� Ritter,"expression, expression, agini, staff, honor, iced, onic, .@, Price, aran","0.008757769130170345, 0.003171853721141815, 0.00237560854293406, 0.0020479026716202497, 0.0020479026716202497, 0.0019163263496011496, 0.0018646365497261286, 0.0018646365497261286, 0.0018573671113699675, 0.0017585197929292917"
img143.png,Werk Society Lehrlon Register,"Werk, itto, werk, nan, moral, leich, titled, uent, Wall, ane","0.00710713118314743, 0.004922966007143259, 0.004293887410312891, 0.003955714404582977, 0.0037451949901878834, 0.0036441744305193424, 0.003463739063590765, 0.00316611398011446, 0.003092770930379629, 0.003044822020456195"
img144.png,ópniknan consereben,"óp, rör, contrast, ниш, 兵, vá, asp, reference, iced, collect","0.00430794432759285, 0.003421202301979065, 0.003421202301979065, 0.0033159428276121616, 0.0031764789018779993, 0.0031028958037495613, 0.003007429651916027, 0.0028252187184989452, 0.0027063938323408365, 0.002503005089238286"
img145.png,Arthurritt majorityexillas,"Arthur, pr, expression, express, node, Nicolas, authorities, RE, om, ță","0.003295920556411147, 0.0030601585749536753, 0.0030127153731882572, 0.002711150562390685, 0.002607288071885705, 0.002420784905552864, 0.002373962663114071, 0.002291952958330512, 0.0022476224694401026, 0.002161517506465316"
img146.png,ettiattachDDrictży,"etti, iba, Crow, iew, ěl, бя, BD, ых, uda, attach","0.004069255664944649, 0.0025966998655349016, 0.002318592043593526, 0.002256052102893591, 0.002221075352281332, 0.0020223117899149656, 0.0019987511914223433, 0.0018485428299754858, 0.0017916690558195114, 0.0016831174725666642"
img147.png,ELD Mach Pozoj exchange,"ELD, imi, elling, odia, temperature, upload, weather, ivalent, positive, confident","0.008706481195986271, 0.006369797512888908, 0.004980219062417746, 0.003228056477382779, 0.003092288738116622, 0.003092288738116622, 0.002997148782014847, 0.002916306024417281, 0.0028487497474998236, 0.0027827585581690073"
img148.png,rör Paradigger Cot feder,"rör, ву, resize, worker, izon, ➖, izer, Arthur, victory, titled","0.01916906051337719, 0.004412968643009663, 0.004378626588732004, 0.0034502744674682617, 0.0033441204577684402, 0.003104911185801029, 0.002894095377996564, 0.0028160319197922945, 0.0023164048325270414, 0.0022363835014402866"
img149.png,ieszaye Cot Audawk,"iesz, 昭, ECT, Arthur, oce, isk, ua, dens, пра, exercise","0.006357843056321144, 0.005811539478600025, 0.00485572312027216, 0.004268453922122717, 0.004072987474501133, 0.0033766250126063824, 0.002922225510701537, 0.002922225510701537, 0.0026815850287675858, 0.0025388735812157393"
img150.png,WallECTitto堂ym,"Wall, ane, weather, oned, aret, toe, off, expression, RES, nu","0.006677441298961639, 0.005200396291911602, 0.004379172809422016, 0.004194990731775761, 0.003397206775844097, 0.002729732310399413, 0.0026354326400905848, 0.0025743828155100346, 0.002564346417784691, 0.0024661077186465263"
img151.png,Schneoffibadzinks,"Schne, hip, moral, Jordan, covered, Wall, nex, chts, contrast, ниш","0.005014081485569477, 0.003527846885845065, 0.0034731526393443346, 0.0029591629281640053, 0.0029132855124771595, 0.0026943485718220472, 0.002662958577275276, 0.00250161811709404, 0.002331764670088887, 0.0023136185482144356"
img152.png,Synnikaneligger Gall,"Syn, <0xBE>, Cic, hip, Lev, Hospital, skap, he, syn, electric","0.008372246287763119, 0.005620860029011965, 0.004309663083404303, 0.0032277884893119335, 0.003104133764281869, 0.002848513424396515, 0.002696918323636055, 0.002513804007321596, 0.0023522935807704926, 0.0022799214348196983"
img153.png,RitterBeanitten dialog陽,"Ritter, Pred, unic, rix, rices, emark, presence, RES, BA, ryty","0.0067379712127149105, 0.004740755073726177, 0.0044016423635184765, 0.004282915033400059, 0.0034146374091506004, 0.0033225335646420717, 0.003013407113030553, 0.0028530366253107786, 0.0027978536672890186, 0.0027223865035921335"
img154.png,itten Clorn reserved measured,"itten, moral, pract, itto, ibe, Arthur, defense, away, rror, ellen","0.02128840796649456, 0.011439461261034012, 0.008702683262526989, 0.007954897359013557, 0.00617112684994936, 0.00361367454752326, 0.00340801989659667, 0.0024072264786809683, 0.0023331637494266033, 0.002279115840792656"
img155.png,Jordan Gallottienzanelle,"Jordan, Burg, nab, nal, dic, sz, off, Cot, DNA, essage","0.01225093100219965, 0.006872149184346199, 0.006112216506153345, 0.005652876105159521, 0.004506865981966257, 0.004317312967032194, 0.003537479555234313, 0.0034690583124756813, 0.003284438280388713, 0.003183386754244566"
img156.png,Krieg Wortrelationoty ouv,"Krieg, Arist, icane, ane, expression, essage, diss, sta, ange, expression","0.008051547221839428, 0.003104147966951132, 0.003020418807864189, 0.0029504511039704084, 0.002474842593073845, 0.0023339989129453897, 0.001846345141530037, 0.0017617949051782489, 0.0017075900686904788, 0.0016811162931844592"
img157.png,aesideoteraexpression reality,"aes, expression, Tsch, haus, ниш, iesz, akov, contre, ince, isp","0.015120240859687328, 0.007426812779158354, 0.004813878331333399, 0.004539919551461935, 0.0038680601865053177, 0.0037932449486106634, 0.003440323518589139, 0.0032445343676954508, 0.003181779058650136, 0.003071863204240799"
img158.png,Japoti triumphanson Register,"Jap, risk, Buffer, isk, moderne, Government, erne, ourselves, myself, olin","0.006895364727824926, 0.004053575452417135, 0.0032444412354379892, 0.0026274286210536957, 0.002596818143501878, 0.0024586180225014687, 0.002111198380589485, 0.0020462435204535723, 0.0020224039908498526, 0.0020224039908498526"
