img157.png,prosper prepodor professEC,"prosper, ring, left, inch, en, industry, Thread, Roman, white, less","0.04373275116086006, 0.005559995304793119, 0.00431324727833271, 0.0030111316591501236, 0.002976051066070795, 0.0029299117159098387, 0.002773984568193555, 0.0023634645622223616, 0.002335929311811924, 0.002255233470350504"
img158.png,prosper one sp dig OR,"prosper, Thread, ich, left, ancy, inch, came, ring, AL, United","0.06243782863020897, 0.006158080417662859, 0.0037643590476363897, 0.0036343170795589685, 0.003591976361349225, 0.003361194161698222, 0.0025670696049928665, 0.002402137266471982, 0.0023464919067919254, 0.002265430986881256"
img159.png,prosper Lam thing prepare8,"prosper, Pictures, industry, AL, ring, room, Cant, inch, left, Dob","0.0771523118019104, 0.00442117964848876, 0.003337281756103039, 0.0032855418976396322, 0.0032727327197790146, 0.0029451404698193073, 0.0025289717596024275, 0.002357260789722204, 0.002024163492023945, 0.0019466191297397017"
img160.png,prosperhed elected ec ec,"prosper, ring, industry, AL, Thread, inch, ich, Pictures, MT, ancy","0.02718302421271801, 0.00366447982378304, 0.003402354661375284, 0.00318375532515347, 0.0028538997285068035, 0.002798700239509344, 0.00275531061924994, 0.002660126890987158, 0.002518557710573077, 0.0024220733903348446"
img161.png,prosperboard watgeh ec,"prosper, Thread, ich, inch, ring, ring, mp, en, United, estre","0.02037767879664898, 0.00583830289542675, 0.005112188868224621, 0.004954902920871973, 0.004172447137534618, 0.0034455943387001753, 0.0031742302235215902, 0.0025307168252766132, 0.0024528547655791044, 0.0024242782965302467"
img162.png,prosperhed whiteatusatus,"prosper, eastern, inch, Thread, nar, Steph, room, <0xBA>, ich, hem","0.013923886232078075, 0.005122311878949404, 0.004381345119327307, 0.0035205096937716007, 0.003034869208931923, 0.0028958923649042845, 0.0028288091998547316, 0.0027098332066088915, 0.002486682729795575, 0.0024769878946244717"
img163.png,prosper leftlos magnury,"prosper, Thread, left, room, Pictures, inch, ring, ich, ancy, <0x87>","0.024643365293741226, 0.004852565936744213, 0.004703268874436617, 0.004249049350619316, 0.003914407454431057, 0.0037939737085253, 0.0029317557346075773, 0.0023011614102870226, 0.0022743521258234978, 0.002221666742116213"
img164.png,prosperhedphotojan ec,"prosper, ancy, left, MT, ich, growing, America, room, white, came","0.05639712139964104, 0.00441736401990056, 0.004281456116586924, 0.003521829843521118, 0.0032827057875692844, 0.002829869743436575, 0.002668821020051837, 0.0025968344416469336, 0.0025665804278105497, 0.002458633156493306"
img165.png,prosper right bu stagejan,"prosper, inch, ancy, ich, accepted, Thread, en, Roman, estre, AL","0.03193339705467224, 0.0043217153288424015, 0.0038139005191624165, 0.0037110268604010344, 0.003224196145310998, 0.0031991053838282824, 0.003149507800117135, 0.003052607411518693, 0.0027256717439740896, 0.002631512237712741"
img166.png,prosperhedjan cat experiment,"prosper, ancy, Thread, inch, industry, ich, estre, itch, Pictures, Roman","0.054772328585386276, 0.0037860001903027296, 0.003501477651298046, 0.003407031297683716, 0.003163321642205119, 0.003114278893917799, 0.0024065282195806503, 0.002323393477126956, 0.002208354417234659, 0.0021997445728629827"
img167.png,prosperisis foo quar motion,"prosper, ich, inch, Thread, industry, ,, blank, matter, Pictures, en","0.012278170324862003, 0.007360325660556555, 0.005891130305826664, 0.005448405165225267, 0.004360849037766457, 0.002815575571730733, 0.002815575571730733, 0.0026244050823152065, 0.0025736442767083645, 0.002543660579249263"
img168.png,prosper right parliament hallisis,"prosper, deb, hole, growing, ,, ich, hole, left, Thread, United","0.034145742654800415, 0.004158561583608389, 0.0036842813715338707, 0.0035431389696896076, 0.003474608063697815, 0.0034475685097277164, 0.003066331148147583, 0.0030543766915798187, 0.0028469921089708805, 0.0028248364105820656"
img169.png,prosper mean ec mouth➜,"prosper, mp, hole, parliament, [, Thread, eastern, ec, thread, ancy","0.007844577543437481, 0.00692281499505043, 0.006815487053245306, 0.004281715955585241, 0.004198899958282709, 0.003929123282432556, 0.0038381051272153854, 0.0037786008324474096, 0.003662345465272665, 0.003096074564382434"
img170.png,prosperisis was ring moment,"prosper, ancy, Roman, motion, successful, room, ring, left, ring, America","0.025383809581398964, 0.006493686232715845, 0.004111545626074076, 0.0035030804574489594, 0.003489423543214798, 0.003435324877500534, 0.0033688799012452364, 0.003316650167107582, 0.003214607248082757, 0.003177156439051032"
img171.png,prosperlam sr mes-,"prosper, Roman, left, ring, ich, deb, ring, room, inch, eastern","0.019165610894560814, 0.0068337093107402325, 0.004343769513070583, 0.004276426043361425, 0.003908969461917877, 0.0035870720166713, 0.0035591572523117065, 0.0035452814772725105, 0.0035452814772725105, 0.0028935743030160666"
img172.png,prosperhed Vere mobileatus,"prosper, ich, inch, Thread, ancy, United, left, en, AL, successful","0.04876372218132019, 0.0062482357025146484, 0.004923491273075342, 0.004002769943326712, 0.003971620462834835, 0.0036731483414769173, 0.0032289044465869665, 0.002437304938212037, 0.002353107091039419, 0.002307593822479248"
img173.png,prosper VS satisfied dealing,"prosper, ich, [, left, room, industry, ancy, 8, motion, en","0.028537610545754433, 0.00458641117438674, 0.004111232701689005, 0.003557975171133876, 0.003502813633531332, 0.003127660835161805, 0.002717358758673072, 0.0025727434549480677, 0.002416868694126606, 0.002407446503639221"
img174.png,prosperhedoven spell claim,"prosper, ich, ancy, left, inch, industry, ART, NC, itch, <0xEA>","0.026612544432282448, 0.005470398347824812, 0.005059291608631611, 0.004535119514912367, 0.0038942755199968815, 0.0028939801268279552, 0.002772263018414378, 0.002645311877131462, 0.0026247259229421616, 0.0025439716409891844"
img175.png,prosper gradu bu policy environment,"prosper, left, ring, successful, industry, AL, inch, ancy, Thread, ich","0.03427109867334366, 0.007889654487371445, 0.003785497508943081, 0.003419912187382579, 0.003340689931064844, 0.0031017258297652006, 0.0030298742931336164, 0.0025414631236344576, 0.002396827796474099, 0.002234089421108365"
img176.png,prosperhed paintedcla pap,"prosper, ich, left, inch, industry, motion, married, ring, [, United","0.02175825648009777, 0.005479901563376188, 0.005228958558291197, 0.0038405603263527155, 0.0034561303909868, 0.0033237284515053034, 0.002899007173255086, 0.0028540620114654303, 0.002649907022714615, 0.0026190346106886864"
img177.png,prosperlamatu as rat,"prosper, ancy, left, ring, room, estre, industry, Thread, MT, ich","0.11775277554988861, 0.004766232334077358, 0.004583640955388546, 0.004189786501228809, 0.0030533631797879934, 0.0029943056870251894, 0.0029943056870251894, 0.002769279992207885, 0.0024343531113117933, 0.0020903621334582567"
img178.png,prosper Sr ec stoEC,"prosper, ring, inch, industry, Thread, <0x87>, ring, successful, тора, hem","0.0437471866607666, 0.0037486508954316378, 0.0036618136800825596, 0.0035078024957329035, 0.0032696316484361887, 0.0031938909087330103, 0.0030239149928092957, 0.0028076099697500467, 0.0025563579984009266, 0.0024584252387285233"
img179.png,prosperisis was ring Ring,"prosper, Thread, left, hem, inch, hole, United, en, eastern, less","0.046803832054138184, 0.004474116023629904, 0.002934197196736932, 0.002888706512749195, 0.002682073274627328, 0.0024612087290734053, 0.0023948217276483774, 0.0021635410375893116, 0.0021467043552547693, 0.0020009486470371485"
img180.png,prosper animal ring ec tro,"prosper, inch, Thread, ancy, room, left, estre, ich, hem, Details","0.04634582996368408, 0.007191142532974482, 0.005644392222166061, 0.0036300860811024904, 0.0031910501420497894, 0.0029054845217615366, 0.002614652970805764, 0.002524328650906682, 0.0022103760857135057, 0.0020764560904353857"
img181.png,prospertedinxinnbaum,"prosper, left, room, Thread, estre, ich, inch, AL, ancy, ring","0.058718595653772354, 0.004953528754413128, 0.004745190497487783, 0.0035401275381445885, 0.0034446383360773325, 0.003248603316023946, 0.0030877538956701756, 0.0030398829840123653, 0.0026307995431125164, 0.0025598378852009773"
img182.png,prosper picture English rub fill,"prosper, left, ich, room, Pictures, successful, ring, Thread, involved, MT","0.018368106335401535, 0.004943708889186382, 0.004905236419290304, 0.003464773064479232, 0.003204390872269869, 0.0025547633413225412, 0.0024568920489400625, 0.0023627697955816984, 0.0021852049976587296, 0.002159746363759041"
img183.png,prosper Sr prefer vo Rand,"prosper, ich, left, Thread, ring, en, inch, AL, minor, joy","0.07309330254793167, 0.0038738029543310404, 0.0037108759861439466, 0.0037108759861439466, 0.003486045403406024, 0.0026938070077449083, 0.0026833047159016132, 0.0026520434767007828, 0.0023865806870162487, 0.0023587762843817472"
img184.png,prosper ring- paplau,"prosper, left, industry, United, LO, Steph, Mrs, room, en, mp","0.03337661549448967, 0.005406181327998638, 0.0020761427003890276, 0.0020044215489178896, 0.0019810693338513374, 0.0019810693338513374, 0.001853786874562502, 0.001832189504057169, 0.0018250466091558337, 0.0018037841655313969"
img185.png,prosper ring pokts ess,"prosper, ich, left, ancy, inch, ring, growing, Pictures, industry, room","0.06577856093645096, 0.0043897079303860664, 0.003950309474021196, 0.0038890657015144825, 0.003769411938264966, 0.002981850178912282, 0.002935620956122875, 0.0026109954342246056, 0.0025906763039529324, 0.0023866428527981043"
