img79.png,prosper ring Conc ass pour,"prosper, left, en, growing, ring, inch, Thread, industry, ancy, ich","0.05617109313607216, 0.005083797499537468, 0.003928454127162695, 0.0036190615501254797, 0.0033601848408579826, 0.0029422761872410774, 0.0027965938206762075, 0.0027748309075832367, 0.002731811022385955, 0.002699984470382333"
img80.png,prosper graduatedestreing mes,"prosper, ancy, Thread, growing, inch, ec, ich, estre, ring, hole","0.018277442082762718, 0.004805351607501507, 0.004549615550786257, 0.003983776550740004, 0.0033546758349984884, 0.0026850486174225807, 0.0026537668891251087, 0.0022610377054661512, 0.0022086610551923513, 0.0021659412886947393"
img81.png,prosperlam artist VS Ess,"prosper, Thread, inch, United, left, Pictures, MT, deb, ancy, room","0.0441625639796257, 0.0041561792604625225, 0.0034187801647931337, 0.0029356826562434435, 0.002845361130312085, 0.0028342679142951965, 0.002768612699583173, 0.0026729695964604616, 0.00262126955203712, 0.002304243855178356"
img82.png,prosperhed effectively parliament anticip,"prosper, inch, Thread, ancy, left, Pictures, ich, Writ, en, successful","0.06553149223327637, 0.004784317687153816, 0.004747085738927126, 0.0034866351634263992, 0.003473042044788599, 0.003187042661011219, 0.0029245945625007153, 0.00273669115267694, 0.0025211581960320473, 0.002368408953770995"
img83.png,prosper cat-catlef,"prosper, Roman, ich, left, inch, ancy, ring, industry, time, United","0.030545078217983246, 0.004593638237565756, 0.004248420707881451, 0.0036480894777923822, 0.003219427540898323, 0.0027753200847655535, 0.0027537222485989332, 0.002742986660450697, 0.002576797502115369, 0.002576797502115369"
img84.png,prosper prep Roman faclish,"prosper, Thread, ancy, ich, United, mp, left, industry, white, deb","0.03762423247098923, 0.0057026417925953865, 0.005131822545081377, 0.004389480222016573, 0.0038285725750029087, 0.003052404383197427, 0.0030168425291776657, 0.002856289269402623, 0.0028010436799377203, 0.00262107839807868"
img85.png,prosperhed Vere mobile tro,"prosper, inch, en, Thread, ich, left, deb, ancy, ring, ,","0.038658298552036285, 0.008393165655434132, 0.005974940024316311, 0.004187505692243576, 0.003553889924660325, 0.002981008030474186, 0.0029462780803442, 0.0028780277352780104, 0.0028113583102822304, 0.0027894803788512945"
img86.png,prosperhed Vere economufen,"prosper, Thread, ancy, ring, inch, successful, industry, room, Pictures, left","0.08261493593454361, 0.004961412400007248, 0.003924800083041191, 0.00293953949585557, 0.0029280793387442827, 0.0026349863037467003, 0.002494754968211055, 0.0023344685323536396, 0.0021930302027612925, 0.002167480532079935"
img87.png,prosper ring st papbeg,"prosper, ich, en, ancy, left, Roman, industry, ,, growing, successful","0.07712475210428238, 0.008065629750490189, 0.004559893161058426, 0.0037362428847700357, 0.0035791012924164534, 0.0034152022562921047, 0.0034018876031041145, 0.003349146107211709, 0.003233448602259159, 0.0028871444519609213"
img88.png,prosperhediner econom satisfied,"prosper, inch, en, ancy, left, industry, ich, Pictures, ring, room","0.09094656258821487, 0.003995913080871105, 0.0036956153344362974, 0.0036241356283426285, 0.0035126328002661467, 0.0034581744112074375, 0.002957933349534869, 0.002569897100329399, 0.002376766176894307, 0.0023399179335683584"
img89.png,prosperhedinerinton organiz,"prosper, ich, United, left, ring, Thread, inch, estre, ancy, successful","0.07029207795858383, 0.004896872211247683, 0.004059649538248777, 0.0037253438495099545, 0.0037108201067894697, 0.0034453796688467264, 0.003211447037756443, 0.0029585235752165318, 0.0028563200030475855, 0.0025108661502599716"
img90.png,prosperhedjanpert tent,"prosper, ring, Thread, inch, industry, Cant, ancy, left, ich, mp","0.07393450289964676, 0.00480090593919158, 0.004405558574944735, 0.004320347681641579, 0.0039491173811256886, 0.003016088390722871, 0.002778551308438182, 0.0027354739140719175, 0.002559721004217863, 0.0021220834460109472"
img91.png,prosper prep quarfal AL,"prosper, ring, left, industry, ring, minor, ancy, room, motion, deb","0.06045002117753029, 0.005711273290216923, 0.0045356713235378265, 0.0034912312403321266, 0.002729615196585655, 0.0025542392395436764, 0.0023347637616097927, 0.0022365667391568422, 0.0022365667391568422, 0.0022018919698894024"
img92.png,prosperhedphoto quar econom,"prosper, ich, Thread, inch, ring, ancy, en, left, estre, United","0.07245879620313644, 0.005167520605027676, 0.0035654825624078512, 0.003375730477273464, 0.0032085867132991552, 0.0030141884926706553, 0.0023658634163439274, 0.002248721430078149, 0.002071619499474764, 0.002063542604446411"
img93.png,prosper animalzelingsende,"prosper, ich, Thread, en, left, ancy, ,, 8, [, inch","0.02825332060456276, 0.00882111769169569, 0.0066845896653831005, 0.004648401867598295, 0.004576335195451975, 0.0034679188393056393, 0.0032324560452252626, 0.0030965032055974007, 0.002943184692412615, 0.0028637973591685295"
img94.png,prosperlles- grace Sp,"prosper, Thread, ec, ring, ring, ancy, ich, inch, left, successful","0.03431976959109306, 0.005558948963880539, 0.004848601296544075, 0.004131059627979994, 0.0035059850197285414, 0.0033716729376465082, 0.0030460525304079056, 0.002895232057198882, 0.0025351496879011393, 0.0025351496879011393"
img95.png,prosper _nos sr picture,"prosper, left, inch, en, came, ancy, ring, Thread, [, less","0.05336347222328186, 0.004484217148274183, 0.003850566456094384, 0.0034114124719053507, 0.003371668281033635, 0.0031182835809886456, 0.0027304603718221188, 0.0026156208477914333, 0.0023173114750534296, 0.0022460154723376036"
img96.png,prosperhedoven spell industry,"prosper, inch, Thread, en, ancy, room, mp, ich, less, bunch","0.046700648963451385, 0.004310032818466425, 0.00411266228184104, 0.00404890114441514, 0.002973833354189992, 0.0023895420599728823, 0.0021587712690234184, 0.002100542187690735, 0.0020841958466917276, 0.0020841958466917276"
img97.png,prosper prep breatherseder,"prosper, ring, ich, ancy, AL, left, hole, growing, white, <0xBC>","0.11371641606092453, 0.006671003066003323, 0.004804943688213825, 0.004046168178319931, 0.003967908211052418, 0.0037567398976534605, 0.0036984970793128014, 0.002846834948286414, 0.002705878345295787, 0.002435026690363884"
img98.png,prosperhedstage solidiento,"prosper, left, inch, room, industry, Steph, AL, VARCHAR, motion, ring","0.08045244216918945, 0.00410047871991992, 0.003958825953304768, 0.0032691864762455225, 0.003243745770305395, 0.0025760571006685495, 0.0024870659690350294, 0.00237317499704659, 0.002354706870391965, 0.0023363824002444744"
img99.png,prosper majority parliamentlos pap,"prosper, inch, estre, ich, room, Pictures, left, motion, ancy, Thread","0.03218501806259155, 0.005192848388105631, 0.004993913229554892, 0.0035969808232039213, 0.003432262921705842, 0.0030171526595950127, 0.002912923926487565, 0.0026419071946293116, 0.002433838788419962, 0.002405483741313219"
img100.png,prosper right sedanner(,"prosper, inch, motion, ancy, Thread, growing, ions, Writ, room, <0x87>","0.02708306536078453, 0.007092691026628017, 0.004761808086186647, 0.0043356753885746, 0.003694041632115841, 0.0026815866585820913, 0.0026711320970207453, 0.0024800621904432774, 0.002460762392729521, 0.002451168606057763"
img101.png,prosper _8rt tent,"prosper, left, inch, [, ring, ich, en, less, America, estre","0.053173985332250595, 0.006036280654370785, 0.0028624970000237226, 0.0027852857019752264, 0.0027207648381590843, 0.002637055702507496, 0.0025659254752099514, 0.0024104639887809753, 0.002401066478341818, 0.002309083007276058"
img102.png,prosperlos Christian VS conc,"prosper, left, America, inch, deb, industry, [, bre, American, ancy","0.018609393388032913, 0.005971198435872793, 0.0038103803526610136, 0.003635890083387494, 0.003375810105353594, 0.003375810105353594, 0.0026393732987344265, 0.0025984535459429026, 0.0025185076519846916, 0.002498908434063196"
img103.png,prosperhed paintedjan hum,"prosper, ich, Thread, left, hole, deb, ring, <0x87>, hole, Roman","0.05545394495129585, 0.005512174218893051, 0.003304351819679141, 0.002996917115524411, 0.0027180856559425592, 0.0024555858690291643, 0.002426977502182126, 0.002297816099599004, 0.0022358363494277, 0.002141800010576844"
img104.png,prosperlamatuende spell,"prosper, Thread, inch, ich, ring, Pictures, left, industry, MT, AL","0.04725997895002365, 0.004310839343816042, 0.0037894705310463905, 0.0030808181036263704, 0.0028051165863871574, 0.0027832870837301016, 0.0025540878996253014, 0.0023346254602074623, 0.0022103788796812296, 0.0020522670820355415"
img105.png,prosper _8 Haw vo,"prosper, inch, ich, ancy, hem, en, left, eastern, ART, successful","0.02237984724342823, 0.011885846965014935, 0.006852182559669018, 0.004618342500180006, 0.0029355972073972225, 0.002912752330303192, 0.0023959644604474306, 0.0023131947964429855, 0.0021227069664746523, 0.0019785803742706776"
img106.png,prosper ST Lew Srjan,"prosper, left, ich, inch, Thread, ancy, VARCHAR, deb, industry, AL","0.07122378051280975, 0.003730745054781437, 0.0037017124705016613, 0.0033968822099268436, 0.0033442184794694185, 0.0027188302483409643, 0.0023529515601694584, 0.002210393315181136, 0.002100949175655842, 0.002100949175655842"
img107.png,prosper pract streamjan cat,"prosper, left, Thread, estre, en, [, came, room, successful, ring","0.026971112936735153, 0.004950328264385462, 0.0037076245062053204, 0.0031099608168005943, 0.0026086396537721157, 0.0025984696112573147, 0.0025984696112573147, 0.0025185230188071728, 0.0024891814682632685, 0.00233836960978806"
img108.png,prosperhedoven spell industry,"prosper, Thread, Roman, ich, ring, left, mp, en, room, deb","0.05053509771823883, 0.0051023405976593494, 0.003689462086185813, 0.0034255492500960827, 0.0030826604925096035, 0.0028846017085015774, 0.002203078242018819, 0.0020534947980195284, 0.0020059256348758936, 0.001998105552047491"
img109.png,prosperhed Vere-uzz,"prosper, left, ring, liqu, ring, net, came, subs, kem, hem","0.05319821089506149, 0.0041994862258434296, 0.003764395136386156, 0.0032073052134364843, 0.0027756912168115377, 0.002478413050994277, 0.0023191766813397408, 0.002292157616466284, 0.002292157616466284, 0.002283221110701561"
img110.png,prosper oneunity nomlau,"prosper, ring, Thread, AL, inch, left, industry, ich, ancy, successful","0.05778958275914192, 0.003948022145777941, 0.003580700606107712, 0.00348411756567657, 0.003443526104092598, 0.0031599574722349644, 0.0030627355445176363, 0.002922482555732131, 0.0027561639435589314, 0.002681820886209607"
img111.png,prosper prep moment solidathers,"prosper, left, ancy, inch, Thread, ich, hem, ring, net, sync","0.04317964240908623, 0.004047832917422056, 0.003758285427466035, 0.0036426554434001446, 0.0027929209172725677, 0.002654633717611432, 0.002633974887430668, 0.002306385664269328, 0.002011665143072605, 0.0018971811514347792"
img112.png,prosper right parliament one label,"prosper, ancy, Thread, growing, left, ich, Pictures, room, en, successful","0.05332585796713829, 0.008177785202860832, 0.005821614991873503, 0.004623300861567259, 0.004498594906181097, 0.0039237444289028645, 0.003503509098663926, 0.0028483327478170395, 0.0026137770619243383, 0.0023985367733985186"
img113.png,prosper right parliament gover quar,"prosper, industry, ancy, left, Thread, ring, inch, successful, ich, room","0.06728962808847427, 0.005128366872668266, 0.003234420670196414, 0.003110511926934123, 0.0030384568963199854, 0.0025387259665876627, 0.0023115361109375954, 0.0022491863928735256, 0.002096472540870309, 0.0020801573991775513"
img114.png,prosper ass whrance wall,"prosper, left, inch, ich, mp, Pictures, deb, AL, room, successful","0.04002806916832924, 0.006534402724355459, 0.0038564119022339582, 0.0035945712588727474, 0.003110841615125537, 0.002865842077881098, 0.002843539696186781, 0.00281041138805449, 0.0027453084476292133, 0.002357377205044031"
img115.png,prosper gra to pronts,"prosper, Thread, ich, Roman, bunch, left, room, eastern, en, ancy","0.02092493325471878, 0.003795857075601816, 0.003524333704262972, 0.002887735376134515, 0.0027554966509342194, 0.0025187276769429445, 0.002460381481796503, 0.002302303444594145, 0.002293327823281288, 0.0022314691450446844"
img116.png,prosper pract pap writers Conc,"prosper, Thread, ring, room, industry, left, Pictures, came, hem, growing","0.07493659108877182, 0.00432788860052824, 0.003056967630982399, 0.0029978409875184298, 0.002951363567262888, 0.0027942948509007692, 0.002418260555714369, 0.0022365255281329155, 0.0022191207390278578, 0.0021174997091293335"
img117.png,prosper much parliamentgy Thor,"prosper, Thread, ancy, inch, ich, left, room, successful, acceptable, ring","0.08007406443357468, 0.006915279198437929, 0.005281457211822271, 0.0043444084003567696, 0.003545802552253008, 0.0028491325210779905, 0.0026765121147036552, 0.002635016804561019, 0.002389856381341815, 0.0023163282312452793"
img118.png,prosper animalzelstedisis,"prosper, ancy, industry, Roman, room, left, bunch, inch, ring, growing","0.03461168333888054, 0.0054550133645534515, 0.004332160577178001, 0.0035914871841669083, 0.0032319885212928057, 0.002897135680541396, 0.002753688720986247, 0.002753688720986247, 0.002566720126196742, 0.0025072621647268534"
img119.png,prosper...ode fully experiment,"prosper, inch, left, [, ich, ring, <0xEA>, ancy, room, ring","0.041415803134441376, 0.005390294827520847, 0.00419796584174037, 0.0038522696122527122, 0.0037191915325820446, 0.0035488770809024572, 0.003206143621355295, 0.00307129742577672, 0.00307129742577672, 0.003047396196052432"
img120.png,prosper animallessanner teachers,"prosper, ich, inch, left, 8, industry, bunch, motion, white, ancy","0.017567873001098633, 0.004424537066370249, 0.003950666636228561, 0.0039046399760991335, 0.0031993472948670387, 0.003137466497719288, 0.0028678763192147017, 0.0028124067466706038, 0.0027688043192029, 0.0024530247319489717"
img121.png,prosper animal ring ec tro,"prosper, inch, industry, motion, left, ancy, mp, successful, parliament, room","0.03570180386304855, 0.004610453732311726, 0.0038672550581395626, 0.00366144347935915, 0.0033468303736299276, 0.002668325789272785, 0.0022912726271897554, 0.0021949049551039934, 0.0020379002671688795, 0.002029955154284835"
img122.png,prosperhed ring quarED,"prosper, ich, ancy, Thread, ring, industry, inch, MT, estre, blank","0.05652425438165665, 0.007047257851809263, 0.006594475824385881, 0.004881493281573057, 0.0036418153904378414, 0.002759745577350259, 0.0027063675224781036, 0.002654021605849266, 0.002483502496033907, 0.0024449992924928665"
img123.png,prosperted hiding experiment fac,"prosper, ich, left, ancy, ring, inch, successful, room, industry, AL","0.06438448280096054, 0.005918919574469328, 0.004887826275080442, 0.00443306565284729, 0.004148244392126799, 0.003791802329942584, 0.003372498555108905, 0.0026783079374581575, 0.0026471044402569532, 0.0021605039946734905"
img124.png,prosperlosineress one,"prosper, inch, [, married, motion, ich, left, room, up, United","0.01745706796646118, 0.009678442031145096, 0.006128007546067238, 0.003987570758908987, 0.003574435133486986, 0.003491633338853717, 0.003292924026027322, 0.0026981253176927567, 0.0026356230955570936, 0.0023168614134192467"
img125.png,prosperhed Thompson anxiousphoto,"prosper, inch, ich, Dou, Thread, ancy, Pictures, bunch, estre, VARCHAR","0.058273084461688995, 0.004582164343446493, 0.0034051756374537945, 0.0033523833844810724, 0.0027683882508426905, 0.0026937155053019524, 0.002560340566560626, 0.0024335694033652544, 0.002277214080095291, 0.002277214080095291"
img126.png,prosperhedoven spell ec,"prosper, Thread, white, inch, ich, ,, ancy, left, ring, en","0.020111413672566414, 0.004522658884525299, 0.004166468512266874, 0.0035637691617012024, 0.0034005725756287575, 0.003321798285469413, 0.0032195972744375467, 0.0031450153328478336, 0.0030721614602953196, 0.0026587338652461767"
img127.png,prosper prep momentlaséri,"prosper, Thread, inch, ancy, VARCHAR, ring, <0x87>, estre, left, industry","0.09453829377889633, 0.008164424449205399, 0.004971355199813843, 0.004353064578026533, 0.0030988657381385565, 0.002311894902959466, 0.0023028815630823374, 0.0021888581104576588, 0.0021132430993020535, 0.0020967978052794933"
img128.png,prosperhed Vere mobile面,"prosper, inch, ich, left, hem, room, hole, ancy, en, <0xEA>","0.06286583095788956, 0.005200814455747604, 0.00484769232571125, 0.0034780490677803755, 0.003305839141830802, 0.00326732499524951, 0.0032545870635658503, 0.002849811455234885, 0.002794691128656268, 0.0027621318586170673"
img129.png,prosper gra ec ecfert,"prosper, inch, ring, ring, left, ancy, Thread, successful, motion, growing","0.04152098298072815, 0.005425134673714638, 0.004844099748879671, 0.0036996202543377876, 0.003381726797670126, 0.003201754530891776, 0.0027817324735224247, 0.0027817324735224247, 0.0026543475687503815, 0.002407388761639595"
img130.png,prosper sp royal Mrs woman,"prosper, en, ,, ich, to, [, ., left, ring, -","0.03971265256404877, 0.005949054844677448, 0.004855476785451174, 0.00420206505805254, 0.0032344451174139977, 0.003159519284963608, 0.0031472013797611, 0.0029449958819895983, 0.002810134319588542, 0.0027882657013833523"
img131.png,prosper one cat HE chemical,"prosper, ich, ring, left, inch, ancy, ring, Pictures, room, industry","0.06950198113918304, 0.005422592628747225, 0.004272900056093931, 0.004125290550291538, 0.003683469956740737, 0.002936718286946416, 0.0028575053438544273, 0.0027804290875792503, 0.002769589191302657, 0.0026119714602828026"
img132.png,prosperhedjan  ec,"prosper, ring, inch, left, ich, Thread, ancy, white, room, industry","0.04372670501470566, 0.006524831987917423, 0.004608760587871075, 0.004519619047641754, 0.0038207967299968004, 0.0035474898759275675, 0.0033456014934927225, 0.0030343288090080023, 0.0027627877425402403, 0.002709350548684597"
img133.png,prosper pract responsiblelets-,"prosper, ring, left, Thread, ring, inch, ancy, estre, ich, white","0.0335099883377552, 0.003955570049583912, 0.003863939316943288, 0.0034636128693819046, 0.003190829884260893, 0.0031291134655475616, 0.0030566276982426643, 0.003009239211678505, 0.002804919146001339, 0.0021422216668725014"
img134.png,prosperagle Vere-slant,"prosper, ancy, ich, inch, successful, left, married, motion, AL, Pictures","0.0528082475066185, 0.008553623221814632, 0.005948110483586788, 0.004120136145502329, 0.003885658225044608, 0.0034157128538936377, 0.0025087695103138685, 0.0023845515679568052, 0.0023111868649721146, 0.0021881875582039356"
img135.png,prosperhedclajanoj,"prosper, ich, inch, ancy, successful, growing, Thread, MT, ring, deb","0.043268539011478424, 0.005697811022400856, 0.005675597116351128, 0.003855331800878048, 0.00357955414801836, 0.0033890539780259132, 0.0033105462789535522, 0.0028538694605231285, 0.0025682044215500355, 0.002375200856477022"
img136.png,prosper much ring over parliament,"prosper, ich, left, inch, en, came, ec, United, American, Thread","0.03908395394682884, 0.0076064253225922585, 0.004797311499714851, 0.003736150451004505, 0.0034553741570562124, 0.0031095005106180906, 0.002842313377186656, 0.0028201944660395384, 0.002809199271723628, 0.0024598173331469297"
img137.png,prosper fa quantityzie Dez,"prosper, inch, ich, width, ring, left, Thread, came, ring, motion","0.024771610274910927, 0.004783473443239927, 0.0041075353510677814, 0.003934778273105621, 0.0036819709930568933, 0.0032240417785942554, 0.0032240417785942554, 0.0024719582870602608, 0.002377259312197566, 0.002377259312197566"
img138.png,prosperhedionen solid sr,"prosper, left, inch, ring, ring, AL, ancy, deb, Thread, en","0.07701868563890457, 0.005407560151070356, 0.0044830250553786755, 0.004465547390282154, 0.0034507079981267452, 0.0027727216947823763, 0.0026561045087873936, 0.0026251603849232197, 0.0024564953055232763, 0.002298666862770915"
img139.png,prosperhedserv DECLARE child,"prosper, inch, left, ancy, Dob, Eastern, Pictures, Steph, Thread, ring","0.08670316636562347, 0.006607938092201948, 0.004453723318874836, 0.0026907881256192923, 0.002393236616626382, 0.0019763277377933264, 0.00187114963773638, 0.0018421401036903262, 0.0017994667869061232, 0.001778502599336207"
img140.png,prosperhedphotounnel hum,"prosper, ancy, Thread, ring, industry, AL, room, left, hole, Pictures","0.05337365344166756, 0.006602665409445763, 0.005388938821852207, 0.004591432865709066, 0.0033070852514356375, 0.002709728665649891, 0.0026991642080247402, 0.0024963191244751215, 0.0024963191244751215, 0.0024768924340605736"
img141.png,prosper prep roman ec parliament,"prosper, inch, VARCHAR, left, ich, AL, room, industry, hole, liqu","0.09634463489055634, 0.003182845190167427, 0.003133499762043357, 0.0022835794370621443, 0.0021960970479995012, 0.002170511754229665, 0.002007395261898637, 0.0019995691254734993, 0.001968568656593561, 0.0019608940929174423"
img142.png,prosperhedoven mulits,"prosper, Thread, left, AL, Pictures, ring, MT, room, United, ich","0.06233300268650055, 0.003642416326329112, 0.003614070825278759, 0.0034217333886772394, 0.002792737679556012, 0.0024454027879983187, 0.0024454027879983187, 0.0024169126991182566, 0.0023334193974733353, 0.002288286807015538"
img143.png,prosper cat pour containeressel,"prosper, ich, ancy, ring, Thread, room, inch, industry, Pictures, ring","0.04743386432528496, 0.005321931559592485, 0.0034902081824839115, 0.0034360976424068213, 0.0033828257583081722, 0.002455668291077018, 0.0024460942950099707, 0.002167119411751628, 0.002150254789739847, 0.0021418717224150896"
img144.png,prosper prep ev parliamentже,"prosper, Thread, ancy, ring, inch, ring, estre, industry, room, AL","0.05383479222655296, 0.005351228639483452, 0.0046492284163832664, 0.0042002275586128235, 0.003735759761184454, 0.002886771457269788, 0.0028198992367833853, 0.0027012983337044716, 0.0024595598224550486, 0.002430905122309923"
img145.png,prosperhed ring quar pap,"prosper, ancy, ich, left, ring, Thread, <0xEA>, industry, mp, ring","0.05739942938089371, 0.006365008186548948, 0.004748585633933544, 0.003612533677369356, 0.0035984499845653772, 0.00306591740809381, 0.0024158847518265247, 0.0023970843758434057, 0.002260665874928236, 0.002234328305348754"
img146.png,prosperhedionen solid ec,"prosper, ancy, Pictures, inch, room, ich, en, estre, deb, MT","0.03143056109547615, 0.0038881634827703238, 0.003610037500038743, 0.0030757903587073088, 0.002559900050982833, 0.002539978828281164, 0.0023036606144160032, 0.002164088888093829, 0.0021388765890151262, 0.002113957889378071"
img147.png,prosperdzie@ argument winning,"prosper, ich, Thread, ancy, ring, ART, America, ring, eastern, [","0.040804944932460785, 0.0061847371980547905, 0.004873455967754126, 0.004854456055909395, 0.004184802528470755, 0.002649652073159814, 0.0025184585247188807, 0.0025184585247188807, 0.002508640056475997, 0.002508640056475997"
img148.png,prosper ring Conc experimental absolute,"prosper, industry, left, ancy, growing, Thread, photos, ring, married, Pictures","0.07881300151348114, 0.003729583928361535, 0.0033958249259740114, 0.003317160764709115, 0.0030321304220706224, 0.00289327884092927, 0.002613859949633479, 0.0025834073312580585, 0.002426886698231101, 0.0022010905668139458"
img149.png,prosper rightquier found pap,"prosper, left, ring, [, ring, inch, room, Mrs, width, Pictures","0.024942882359027863, 0.004835397936403751, 0.004560214467346668, 0.004419911652803421, 0.0036499497946351767, 0.0030496472027152777, 0.0029906618874520063, 0.002921383362263441, 0.0026913045439869165, 0.0025282464921474457"
img150.png,prosper one- Parliament compan,"prosper, ich, Thread, left, ring, inch, ancy, United, growing, ble","0.04858260601758957, 0.006549307610839605, 0.003926076926290989, 0.0033581512980163097, 0.003242142265662551, 0.002751570660620928, 0.002751570660620928, 0.0027408432215452194, 0.002437756396830082, 0.002399962628260255"
img151.png,prosper cat quantityvoAmerica,"prosper, left, Thread, ring, deb, bo, growing, white, ich, ,","0.019246689975261688, 0.003673295257613063, 0.0036447090096771717, 0.0035742141772061586, 0.003203905187547207, 0.0030811652541160583, 0.0025246161967515945, 0.0023996138479560614, 0.002193424617871642, 0.0021678705234080553"
img152.png,prosperhedoven mul industry,"prosper, ring, left, ich, estre, industry, Thread, MT, United, growing","0.06082620471715927, 0.004510726314038038, 0.004475623834878206, 0.004237435292452574, 0.0034856190904974937, 0.00282274023629725, 0.002746601589024067, 0.0026725169736891985, 0.002550133503973484, 0.0023128706961870193"
img153.png,prosper spin sur ec confidence,"prosper, Steph, <0xEA>, ich, Thread, fashion, eastern, Eastern, Dou, wat","0.10379838198423386, 0.004009009338915348, 0.0028096933383494616, 0.002670575864613056, 0.0025884106289595366, 0.0023567748721688986, 0.0023293178528547287, 0.0021626981906592846, 0.002145867794752121, 0.0020476016215980053"
img154.png,prosper pract papoz Unidos,"prosper, estre, ich, Thread, ring, ancy, left, inch, white, room","0.045170582830905914, 0.005269885063171387, 0.005249339621514082, 0.003736907849088311, 0.003284952836111188, 0.0030499757267534733, 0.0030144420452415943, 0.0028207662981003523, 0.0024990602396428585, 0.0024893174413591623"
img155.png,prosper gra buzyjan,"prosper, ich, Thread, Roman, ring, eastern, bo, room, minor, ancy","0.029899807646870613, 0.005016316194087267, 0.004843025468289852, 0.0037570474669337273, 0.0035571008920669556, 0.003380976617336273, 0.003042549593374133, 0.0029489402659237385, 0.002880627987906337, 0.002727323677390814"
img156.png,prosper right parliament formation éc,"prosper, Thread, inch, deb, ring, left, United, width, Pictures, successful","0.052860308438539505, 0.004390185698866844, 0.0035552806220948696, 0.003313886234536767, 0.002867929171770811, 0.0028234662022441626, 0.0028014937415719032, 0.0027473079971969128, 0.0026112794876098633, 0.0025707953609526157"
