Image File,Inference Result,Top 10 Words,Top 10 Probabilities
img1.png,prosperhedoven spell industry,"prosper, ich, left, room, United, inch, <0xEA>, Roman, ancy, industry","0.02339288406074047, 0.007594557479023933, 0.003559497185051441, 0.0030091286171227694, 0.0027398429811000824, 0.0027398429811000824, 0.002697365591302514, 0.002504419069737196, 0.002484929747879505, 0.0024559793528169394"
img2.png,prosper pract to continu deb,"prosper, ich, inch, ancy, ring, industry, Thread, left, ,, time","0.04905656352639198, 0.004838320892304182, 0.004457270260900259, 0.0041062296368181705, 0.004090221133083105, 0.0039335270412266254, 0.0038574454374611378, 0.003581517143175006, 0.0033123621251434088, 0.0029460755176842213"
img3.png,prosper picture ring ec pair,"prosper, inch, ring, left, industry, room, VARCHAR, deb, ancy, Pictures","0.08470241725444794, 0.003649582853540778, 0.002943999832496047, 0.002459803828969598, 0.002338010584935546, 0.002301763277500868, 0.002162306336686015, 0.0021039817947894335, 0.0020552431233227253, 0.001992009812965989"
img4.png,prosperhedphoto Parliament Wh,"prosper, inch, ich, left, ancy, AL, VARCHAR, ring, Thread, motion","0.04638909175992012, 0.005204711575061083, 0.00468373391777277, 0.003959536086767912, 0.003605198347941041, 0.0032316793221980333, 0.0026583068538457155, 0.0023276912979781628, 0.0023005728144198656, 0.0020865288097411394"
img5.png,prosperboard cat Sirsey,"prosper, ring, Roman, ring, room, LEFT, amp, citiz, successful, left","0.014179565012454987, 0.005257282871752977, 0.004175130277872086, 0.0037719160318374634, 0.002653874224051833, 0.00241638021543622, 0.002388228429481387, 0.002278863452374935, 0.002252314006909728, 0.002091202652081847"
img6.png,prosper picture ring ec ed,"prosper, ancy, ring, Thread, Cant, industry, left, ich, MT, Pictures","0.04447560757398605, 0.00365078030154109, 0.003566209925338626, 0.0030266032554209232, 0.0029106559231877327, 0.002899308456107974, 0.002888004994019866, 0.002766539342701435, 0.002375608077272773, 0.002088293433189392"
img7.png,prosperhed elected firmjan,"prosper, left, Roman, ring, Thread, inch, successful, industry, deb, United","0.037346698343753815, 0.0047111501917243, 0.0046562631614506245, 0.003393314080312848, 0.0029252194799482822, 0.0028574566822499037, 0.002769542159512639, 0.0026948386803269386, 0.0024536780547350645, 0.0021234815940260887"
img8.png,prosper right parliament sle label,"prosper, room, ich, inch, left, industry, Thread, ring, successful, Pictures","0.05818270146846771, 0.003867663675919175, 0.0038525850977748632, 0.003083570394665003, 0.003083570394665003, 0.002874203724786639, 0.002700064331293106, 0.00236425525508821, 0.0023458567447960377, 0.00230048387311399"
img9.png,prosper constitustage Twe economy,"prosper, industry, Thread, ring, left, Cant, Pictures, Dob, successful, inch","0.04998740181326866, 0.004023852292448282, 0.003335890593007207, 0.00328417238779366, 0.0032713687978684902, 0.0032459108624607325, 0.0026909545995295048, 0.0023288270458579063, 0.0020075743086636066, 0.0020075743086636066"
img10.png,prosperhed Vere mobileatus,"prosper, ancy, left, inch, industry, Thread, room, ring, America, married","0.061589282006025314, 0.00669752387329936, 0.0055307955481112, 0.005075343418866396, 0.004938444122672081, 0.0029720079619437456, 0.0027060441207140684, 0.0025223104748874903, 0.002483205869793892, 0.0023327560629695654"
img11.png,prosperhed Vere mobile sle,"prosper, ancy, Thread, ring, ich, room, AL, industry, hole, hole","0.03779182955622673, 0.006567234639078379, 0.004693390801548958, 0.004273381549865007, 0.004158114083111286, 0.003263741498813033, 0.0030066994950175285, 0.0029485446866601706, 0.002632753923535347, 0.0024159506428986788"
img12.png,prosper pract desc motion parliament,"prosper, ancy, ich, inch, ring, ring, Thread, left, he, American","0.04103239253163338, 0.00732802227139473, 0.006777312606573105, 0.004881515167653561, 0.0040154242888092995, 0.0031028795056045055, 0.0025925529189407825, 0.0025324965827167034, 0.0023790602572262287, 0.0022879200987517834"
img13.png,prosper ring pok ec label,"prosper, ancy, ich, inch, room, ring, ,, Thread, left, bre","0.060863859951496124, 0.005727953743189573, 0.004174322821199894, 0.0034606349654495716, 0.0034471433609724045, 0.003380469512194395, 0.003065952565521002, 0.0029370025731623173, 0.002914146753028035, 0.0028914688155055046"
img14.png,prosperisis was EC Writ,"prosper, white, ancy, left, America, inch, mp, American, ring, dump","0.011874199844896793, 0.00547904334962368, 0.005008250940591097, 0.004760275594890118, 0.0036356004420667887, 0.00348269147798419, 0.0033623804338276386, 0.003158664098009467, 0.003109693294391036, 0.0028314082883298397"
img15.png,prosper pract比 ERR mobile,"prosper, room, industry, inch, Thread, ring, left, deb, ancy, тора","0.06427635997533798, 0.0036120866425335407, 0.003542222548276186, 0.0033537091221660376, 0.0032378535252064466, 0.003212656592950225, 0.002835159422829747, 0.002769483020529151, 0.002591545693576336, 0.002453625900670886"
img16.png,prosper environmentaldor Sr ass,"prosper, left, Thread, ancy, white, industry, inch, ring, AL, Pictures","0.06519374996423721, 0.005393400322645903, 0.004233328625559807, 0.003606840968132019, 0.0031582557130604982, 0.0031582557130604982, 0.0031092914287000895, 0.002955339616164565, 0.002283709356561303, 0.002187659963965416"
img17.png,prosperhed Thompson warmone,"prosper, ancy, inch, Thread, deb, ich, Pictures, ring, industry, room","0.06403575837612152, 0.0052154697477817535, 0.005114593077450991, 0.0045846919529139996, 0.0035015009343624115, 0.0035015009343624115, 0.0032510333694517612, 0.003138724947348237, 0.002960099373012781, 0.002473255852237344"
img18.png,prosper one ecced employee,"prosper, Thread, left, ancy, ring, inch, ich, successful, room, AL","0.06924881041049957, 0.005360795184969902, 0.005115306004881859, 0.004307519644498825, 0.003420865396037698, 0.003407528856769204, 0.0031391624361276627, 0.002463956829160452, 0.002115782583132386, 0.002115782583132386"
img19.png,prosper pract paporage xcode,"prosper, ancy, hem, ring, successful, Thread, Cant, inch, AL, Pictures","0.09417501091957092, 0.005546258762478828, 0.005396658089011908, 0.0034707600716501474, 0.003184948582202196, 0.002945596119388938, 0.002843838883563876, 0.0025691944174468517, 0.0024901486467570066, 0.0024611372500658035"
img20.png,prosper ass storating pap,"prosper, Thread, ring, inch, MT, en, ancy, left, ich, came","0.03743167966604233, 0.0045945048332214355, 0.003592209191992879, 0.0031949770636856556, 0.0030014028307050467, 0.0028751681093126535, 0.002797615248709917, 0.002743504475802183, 0.002659095451235771, 0.0026281161699444056"
img21.png,prosperhedovenessenestre,"prosper, Thread, ich, left, industry, ring, ancy, room, Pictures, MT","0.0819854810833931, 0.005711488425731659, 0.005365446675568819, 0.005241156090050936, 0.0038645865861326456, 0.0025643331464380026, 0.0024564804043620825, 0.0023076499346643686, 0.0022986531257629395, 0.0022807649802416563"
img22.png,prosper pract ass quar Uncle,"prosper, left, ring, industry, Thread, Cant, ich, inch, ancy, deb","0.08619935810565948, 0.004515175241976976, 0.004376258235424757, 0.003787335706874728, 0.0034215727355331182, 0.003043209668248892, 0.0030313453171402216, 0.0029960290994495153, 0.0024357542861253023, 0.0023700541350990534"
img23.png,prosperhedionen solid ec,"prosper, Thread, ich, ancy, en, ring, estre, left, <0xEA>, inch","0.06805096566677094, 0.006016319151967764, 0.004740745760500431, 0.003481978317722678, 0.003388057928532362, 0.003258263459429145, 0.00307283503934741, 0.0026906647253781557, 0.002204651478677988, 0.002204651478677988"
img24.png,prosperhedserv leftqui,"prosper, Thread, left, inch, [, en, thread, growing, less, Pictures","0.015262811444699764, 0.0063873883336782455, 0.004935791250318289, 0.004156352952122688, 0.0029358051251620054, 0.002801364753395319, 0.002405512612313032, 0.002224735449999571, 0.0022160618100315332, 0.0021731993183493614"
img25.png,prosper ring ec ass original,"prosper, left, inch, ancy, industry, MT, room, growing, ring, Pictures","0.08341100811958313, 0.00498969154432416, 0.004596719052642584, 0.004267909098416567, 0.003664824180305004, 0.003565971739590168, 0.003014602232724428, 0.0027880507986992598, 0.0025987494736909866, 0.0022666696459054947"
img26.png,prosperhed ring quarED,"prosper, Thread, ich, ring, left, inch, AL, ring, ancy, MT","0.03903624042868614, 0.00587061420083046, 0.004518772941082716, 0.004261608701199293, 0.00406645517796278, 0.004003410693258047, 0.0036451469641178846, 0.003021933138370514, 0.002986726351082325, 0.0028499544132500887"
img27.png,prosperhedjan  ec,"prosper, ancy, Thread, ec, eastern, white, deb, inch, VARCHAR, width","0.040877338498830795, 0.0037286437582224607, 0.0033817330840975046, 0.0026543529238551855, 0.002633696421980858, 0.0025827561039477587, 0.00254271412268281, 0.002407393418252468, 0.0023793461732566357, 0.0021834110375493765"
img28.png,prosper gra to ec parliament,"prosper, inch, ring, left, estre, room, deb, ich, Steph, ring","0.0766964852809906, 0.004733664449304342, 0.004516894463449717, 0.004128775559365749, 0.0032533968333154917, 0.002750357612967491, 0.0027183147612959146, 0.002707717241719365, 0.0025837216526269913, 0.002084204461425543"
img29.png,prosper ring pok ec parliament,"prosper, left, ring, en, white, industry, growing, inch, ich, [","0.033203400671482086, 0.009006665088236332, 0.00823275838047266, 0.003326335223391652, 0.003064363496378064, 0.003040516283363104, 0.0027792570181190968, 0.0027148753870278597, 0.0026108701713383198, 0.0026006915140897036"
img30.png,prosper right parliament widthestre,"prosper, inch, Thread, ancy, ich, ring, estre, eastern, Steph, white","0.06259803473949432, 0.004570151679217815, 0.004276522435247898, 0.004048930015414953, 0.0034362822771072388, 0.0027396432124078274, 0.0026553531643003225, 0.002334205200895667, 0.002298016333952546, 0.002262389287352562"
img31.png,prosperhed Vere mobileatus,"prosper, ancy, Thread, ring, left, hole, deb, married, growing, ich","0.1046934723854065, 0.004690635483711958, 0.0030049339402467012, 0.0030049339402467012, 0.002822873881086707, 0.0025205425918102264, 0.0024051188956946135, 0.0022771204821765423, 0.00195534760132432, 0.001910052145831287"
img32.png,prosperhedoven mulec,"prosper, ich, Thread, ring, left, eastern, inch, industry, room, deb","0.056466564536094666, 0.005859262775629759, 0.0057459338568151, 0.0038276170380413532, 0.0035124188289046288, 0.0025299007538706064, 0.002510212827473879, 0.0023952615447342396, 0.002294519916176796, 0.002206618431955576"
img33.png,prosper graduated pap Gegenk,"prosper, left, inch, ich, ring, en, net, [, room, parliament","0.022824708372354507, 0.0062156012281775475, 0.00583901721984148, 0.004529702477157116, 0.004205686040222645, 0.002856847597286105, 0.002611369825899601, 0.002540932735428214, 0.0024340644013136625, 0.0023684098850935698"
img34.png,prosperhed ring ec ec,"prosper, ring, AL, ancy, left, hole, Thread, ich, minor, ring","0.06212543696165085, 0.005099566653370857, 0.004571221768856049, 0.003804508363828063, 0.00345053942874074, 0.0025742591824382544, 0.00253434875048697, 0.002052378375083208, 0.002004835056141019, 0.0019737528637051582"
img35.png,prosper right bu dig ring,"prosper, Thread, ancy, ich, ring, growing, left, estre, inch, eastern","0.12082955241203308, 0.005945663899183273, 0.005085595417767763, 0.00440121628344059, 0.003427670570090413, 0.0032074449118226767, 0.0027758125215768814, 0.002346616704016924, 0.0022922575008124113, 0.0021533763501793146"
img36.png,prosper ring ec tro instance,"prosper, inch, ich, ancy, left, estre, deb, United, Elizabeth, accepted","0.02289726212620735, 0.008896918036043644, 0.006458469200879335, 0.004285494796931744, 0.003608748782426119, 0.0031353351660072803, 0.002650550566613674, 0.0024997072760015726, 0.0022849172819405794, 0.0021973836701363325"
img37.png,prosperhedjan rance,"prosper, ich, mp, United, left, inch, [, Thread, parliament, estre","0.01399646233767271, 0.005857429467141628, 0.0045975493267178535, 0.004202499985694885, 0.0038715242408216, 0.003363638883456588, 0.0031108574476093054, 0.0029800187330693007, 0.0029223801102489233, 0.0028324679005891085"
img38.png,prosper cat ton比OF,"prosper, Thread, ring, left, deb, inch, ich, thread, less, Dob","0.04560142755508423, 0.005489029455929995, 0.0035301675088703632, 0.0034754369407892227, 0.0028255102224648, 0.0026233976241201162, 0.002261510118842125, 0.0022351625375449657, 0.0022091222926974297, 0.0021411548368632793"
img39.png,prosper picture ring ec ed,"prosper, ring, left, AL, successful, growing, ancy, ich, en, less","0.08325338363647461, 0.005363953299820423, 0.003955130930989981, 0.002644997090101242, 0.002614182187244296, 0.0024462223518639803, 0.0023895560298115015, 0.002262386027723551, 0.0022535657044500113, 0.0022447798401117325"
img40.png,prosperhedill-ò,"prosper, ring, ich, ancy, Thread, ring, left, Pictures, minor, itch","0.057054195553064346, 0.0065275575034320354, 0.005265568383038044, 0.004610686097294092, 0.003943728748708963, 0.003633132902905345, 0.003399706445634365, 0.003346998943015933, 0.0031937286257743835, 0.002840561093762517"
img41.png,prosper ass one environment már,"prosper, inch, Thread, left, ancy, ich, ring, United, ,, industry","0.021044228225946426, 0.007104218937456608, 0.00559799000620842, 0.005279407370835543, 0.004047862254083157, 0.0031036033760756254, 0.002633994212374091, 0.002583047840744257, 0.002333589131012559, 0.002288453746587038"
img42.png,prosper constituestre( fir,"prosper, Thread, MT, inch, ring, ancy, ich, industry, width, eastern","0.04080243781208992, 0.006112307775765657, 0.005087113473564386, 0.004892229102551937, 0.003992920741438866, 0.0027984182815998793, 0.0026912125758826733, 0.0024218291509896517, 0.0022573929745703936, 0.0022310935892164707"
img43.png,prosperlos Christian VS parliament,"prosper, ich, en, Thread, deb, left, inch, came, white, 8","0.06020009145140648, 0.005078508518636227, 0.003253414761275053, 0.002815595827996731, 0.0026040005031973124, 0.0025536343455314636, 0.0022980221547186375, 0.0022890630643814802, 0.0022447886876761913, 0.002035934943705797"
img44.png,prosperhedovenlem size,"prosper, left, ring, estre, ich, hem, deb, ring, room, ancy","0.09141433238983154, 0.004807079676538706, 0.0041117132641375065, 0.004063810687512159, 0.0038175967056304216, 0.0032909740693867207, 0.0031525599770247936, 0.0028481008484959602, 0.00273899151943624, 0.0025932251010090113"
img45.png,prosper pract assasto hay,"prosper, Thread, ancy, inch, left, ring, growing, AL, minor, Pictures","0.0732533410191536, 0.0044684819877147675, 0.004263855516910553, 0.0041165584698319435, 0.00305916671641171, 0.002742219250649214, 0.002373193157836795, 0.00225568818859756, 0.0022207170259207487, 0.0021948448847979307"
img46.png,prosper cat directlyatus tent,"prosper, Thread, estre, left, inch, room, ring, Roman, Cu, ich","0.033794984221458435, 0.007056196220219135, 0.005023175850510597, 0.003747517243027687, 0.0029299925081431866, 0.002467301208525896, 0.0024195793084800243, 0.002354315249249339, 0.0021944630425423384, 0.0021436281967908144"
img47.png,prosperhedjanadayg,"prosper, ich, Dou, ancy, Thread, en, left, industry, mp, MT","0.046119388192892075, 0.0073257070034742355, 0.0034469279926270247, 0.0032634856179356575, 0.0032128901220858097, 0.00311404000967741, 0.0029714375268667936, 0.0028353657107800245, 0.0025119949132204056, 0.002502201357856393"
img48.png,prosper constituiare electionestre,"prosper, Thread, ancy, AL, inch, ich, hole, hem, thread, Steph","0.09547757357358932, 0.007276664953678846, 0.005323722492903471, 0.003437253413721919, 0.0031296545639634132, 0.003117453306913376, 0.0022986659314483404, 0.0022366633638739586, 0.0022366633638739586, 0.0020524777937680483"
img49.png,prosperced vo motion Msg,"prosper, inch, left, ich, Thread, width, successful, deb, room, AL","0.02274317294359207, 0.005094549618661404, 0.004391775932163, 0.003771187737584114, 0.003380470909178257, 0.0027915826067328453, 0.002602041233330965, 0.002463563112542033, 0.0022343548480421305, 0.0022083239164203405"
img50.png,prosper _8ings spell,"prosper, ich, ancy, Thread, inch, left, estre, successful, ring, growing","0.02953830361366272, 0.006001070607453585, 0.005615505389869213, 0.005275279749184847, 0.0039049708284437656, 0.003859476884827018, 0.0030770429875701666, 0.0023684846237301826, 0.0023136187810450792, 0.0021565298084169626"
img51.png,prosperhed Vere mobile tro,"prosper, en, left, inch, ich, room, ring, up, Roman, ,","0.03624487295746803, 0.0035330902319401503, 0.00349192856810987, 0.00319188111461699, 0.003167041577398777, 0.0030936773400753736, 0.002524985931813717, 0.0024568785447627306, 0.002353545743972063, 0.002263382775709033"
img52.png,prosperhedserv left8,"prosper, ich, industry, left, ring, ancy, Thread, Cant, inch, room","0.04015866667032242, 0.007785112131386995, 0.006790296174585819, 0.004987329710274935, 0.003853910369798541, 0.0029204697348177433, 0.0027758674696087837, 0.0027758674696087837, 0.0026799736078828573, 0.0026695255655795336"
img53.png,prosper picture Twe Alo vo,"prosper, ring, left, inch, ancy, industry, ich, Thread, deb, <0x87>","0.04554947465658188, 0.00599817605689168, 0.0034310338087379932, 0.003417657222598791, 0.0029577361419796944, 0.0027569131925702095, 0.002682550111785531, 0.002549727912992239, 0.0023125028237700462, 0.0022589336149394512"
img54.png,prosper�ermeister bre as,"prosper, ich, Thread, left, ring, hole, MT, <0xEA>, [, en","0.04385332018136978, 0.005096258595585823, 0.004862883593887091, 0.004159444943070412, 0.0035438917111605406, 0.0031520023476332426, 0.0027707875706255436, 0.002572589321061969, 0.0022703022696077824, 0.0021410987246781588"
img55.png,prosper room assuredvoof,"prosper, left, ring, Thread, ancy, AL, United, ich, ring, Eastern","0.03827659785747528, 0.0058015198446810246, 0.005344610661268234, 0.004500613547861576, 0.0036447078455239534, 0.00326709495857358, 0.0026251845993101597, 0.002446940867230296, 0.002334887394681573, 0.002254227874800563"
img56.png,prosperdzieptrwachindust,"prosper, Thread, thread, ich, ancy, inch, en, meas, white, related","0.024091217666864395, 0.012547275982797146, 0.005189778748899698, 0.0038416804745793343, 0.003708967473357916, 0.0029455183539539576, 0.0028437641449272633, 0.0025691266637295485, 0.0025691266637295485, 0.0025691266637295485"
img57.png,prosper much parliament dispute bre,"prosper, ancy, inch, Thread, ich, left, industry, ring, growing, Pictures","0.10190873593091965, 0.008630717173218727, 0.006289750803261995, 0.0058856382966041565, 0.0038750029634684324, 0.003237685887143016, 0.00298269628547132, 0.002868430921807885, 0.002791060134768486, 0.002225226955488324"
img58.png,prosper ring pok papetro,"prosper, inch, left, ich, [, ring, United, ancy, up, ,","0.01672697253525257, 0.007364786230027676, 0.004925207234919071, 0.0038961595855653286, 0.00298728933557868, 0.002752019790932536, 0.0024862424470484257, 0.0024003542494028807, 0.0023356087040156126, 0.002263749483972788"
img59.png,prosperhedjan avas,"prosper, left, room, ancy, MT, inch, ring, fac, industry, United","0.06511320173740387, 0.005060370545834303, 0.0040030828677117825, 0.00374588742852211, 0.0035465352702885866, 0.003464379347860813, 0.002729865489527583, 0.002729865489527583, 0.002505065407603979, 0.002437495393678546"
img60.png,prosper animal ring ec ec,"prosper, successful, Pictures, left, ich, ring, room, Thread, white, industry","0.12813441455364227, 0.0036491199862211943, 0.003258297685533762, 0.0031580503564327955, 0.003001684322953224, 0.002864227397367358, 0.002587613882496953, 0.002537564607337117, 0.0023838214110583067, 0.0023468637373298407"
img61.png,prosper whunity tent Beg,"prosper, ring, Thread, inch, dump, white, eastern, width, United, left","0.023448944091796875, 0.005293841939419508, 0.00513096759095788, 0.004599369131028652, 0.0027679491322487593, 0.002746409038081765, 0.002461864845827222, 0.0021725883707404137, 0.002147276885807514, 0.0021389054600149393"
img62.png,prosperboard warmanner quar,"prosper, parliament, Thread, <0xBC>, ancy, ALL, hole, inch, ich, Dou","0.009826794266700745, 0.00586784677579999, 0.004128545988351107, 0.004080446902662516, 0.003700804663822055, 0.0033564839977771044, 0.0032027792185544968, 0.0031408320646733046, 0.0030561131425201893, 0.0030561131425201893"
img63.png,prosperisis formulainer ec,"prosper, left, ich, ancy, Thread, motion, room, growing, iance, deb","0.03676644340157509, 0.005296709015965462, 0.004860532935708761, 0.004477732814848423, 0.0034872619435191154, 0.002632323419675231, 0.0025413886178284883, 0.002492233645170927, 0.0023874137550592422, 0.0023688345681875944"
img64.png,prosperhed Vere mobile nep,"prosper, left, ring, motion, em, ich, Roman, room, hole, deb","0.03237609192728996, 0.004574004095047712, 0.0039123534224927425, 0.003493338357657194, 0.0030828602612018585, 0.0030232323333621025, 0.0028511795680969954, 0.00273126270622015, 0.002506347605958581, 0.0023089556489139795"
img65.png,prosper constitu motionathan te,"prosper, ich, ring, Thread, left, inch, width, ancy, came, minor","0.041941720992326736, 0.0056761945597827435, 0.005108022131025791, 0.004632774740457535, 0.0037225391715765, 0.0036648267414420843, 0.002887813840061426, 0.002820917870849371, 0.0024700781796127558, 0.0023023660760372877"
img66.png,prosper right parliament width Assert,"prosper, left, ring, inch, room, width, deb, ring, Roman, en","0.03172207251191139, 0.005138187203556299, 0.004210079554468393, 0.0034094261936843395, 0.003317462746053934, 0.0032916462514549494, 0.0026552637573331594, 0.0025836427230387926, 0.0025535423774272203, 0.0023894787300378084"
img67.png,prosper cru ass ec cat,"prosper, left, inch, ancy, MT, en, Thread, ,, industry, subs","0.043622758239507675, 0.004219182766973972, 0.004105377476662397, 0.002877232851460576, 0.002810581587255001, 0.002413426758721471, 0.002413426758721471, 0.0023760104086250067, 0.0023483289405703545, 0.0022320549469441175"
img68.png,prosperisis was ring Bere,"prosper, inch, mp, Thread, left, ich, deb, ancy, itch, ring","0.03093460202217102, 0.005655658897012472, 0.005149536300450563, 0.004526732489466667, 0.003484350396320224, 0.003457234939560294, 0.0031974196899682283, 0.0031725370790809393, 0.0026715444400906563, 0.002619871636852622"
img69.png,prosperhed shockcal Alabama,"prosper, mp, Steph, <0xB7>, hole, ancy, left, liqu, ring, wat","0.0583915151655674, 0.005347053054720163, 0.004502669908106327, 0.0037182916421443224, 0.003561904886737466, 0.0034793936647474766, 0.0030585830099880695, 0.003046659054234624, 0.002688667271286249, 0.002372740302234888"
img70.png,prosperhed parliament�atherine,"prosper, left, ich, successful, en, ,, came, ring, growing, less","0.06973812729120255, 0.0058146012015640736, 0.0039963130839169025, 0.0029352083802223206, 0.00276816519908607, 0.0023956471122801304, 0.0023956471122801304, 0.0023493110202252865, 0.0022417285945266485, 0.002189798979088664"
img71.png,prosperpusEXT plug equival,"prosper, inch, ancy, left, Cant, ring, hem, deb, ich, VARCHAR","0.0620502270758152, 0.005014427471905947, 0.0032123627606779337, 0.002845995593816042, 0.002834899816662073, 0.0024920369032770395, 0.0024920369032770395, 0.002123242011293769, 0.0021067187190055847, 0.0020985056180506945"
img72.png,prosper Sr justiceelnpin,"prosper, Thread, ancy, ich, growing, inch, Eastern, eastern, ring, width","0.031517546623945236, 0.007845338433980942, 0.005370995029807091, 0.0049673584289848804, 0.0030364852864295244, 0.0029201593715697527, 0.0026381441857665777, 0.002597243757918477, 0.0024020574055612087, 0.002383364597335458"
img73.png,prosperhed Vere mobile�,"prosper, inch, ich, <0x8C>, ancy, room, mp, left, ring, sync","0.03679093345999718, 0.0044632465578615665, 0.0044632465578615665, 0.002996481955051422, 0.002837012056261301, 0.002837012056261301, 0.0026965418364852667, 0.0026965418364852667, 0.0026965418364852667, 0.0026135777588933706"
img74.png,prosperhed Vere mobile vo,"prosper, inch, left, ich, Thread, Pictures, [, less, en, motion","0.039870478212833405, 0.00497091980651021, 0.00447334349155426, 0.0031720756087452173, 0.0027667335234582424, 0.0026092780753970146, 0.002293702680617571, 0.002214465755969286, 0.002214465755969286, 0.002121328143402934"
img75.png,prosper practless(-,"prosper, inch, ancy, Thread, estre, ring, ich, left, successful, AL","0.04677426442503929, 0.005652240011841059, 0.004853539168834686, 0.0036493605002760887, 0.0034015777055174112, 0.0033751067239791155, 0.002680378733202815, 0.0025979122146964073, 0.0023654259275645018, 0.002337867859750986"
img76.png,prosper ring vo ec ass,"prosper, inch, ring, ring, room, ich, left, industry, deb, estre","0.05132654681801796, 0.0039889197796583176, 0.0038361072074621916, 0.0037472438998520374, 0.0036177937872707844, 0.0036177937872707844, 0.002884356305003166, 0.002709602238610387, 0.002515780506655574, 0.002515780506655574"
img77.png,prosper one ec ass ec,"prosper, Roman, ring, [, Thread, eastern, estre, inch, ich, United","0.03372107818722725, 0.004563651513308287, 0.0037539575714617968, 0.0034990732092410326, 0.00341801717877388, 0.003274260088801384, 0.003161149099469185, 0.0028006229549646378, 0.0027464539743959904, 0.0025699958205223083"
img78.png,prosper much ring ec ec,"prosper, ich, left, ancy, inch, successful, industry, Pictures, white, wat","0.022181902080774307, 0.006480566691607237, 0.005066824145615101, 0.004350846633315086, 0.003930662292987108, 0.0036210957914590836, 0.003375232219696045, 0.0030731840524822474, 0.002820112043991685, 0.0028091175481677055"
