img81.png,ternabi Isaac Fich Dres,"tern, bay, ters, Según, tei, yter, ias, Cart, pret, nor","0.023014001548290253, 0.008205895312130451, 0.005095155909657478, 0.003952641040086746, 0.003876190399751067, 0.002914494602009654, 0.0028693098574876785, 0.002542067551985383, 0.002492899540811777, 0.002314578974619508"
img82.png,eth Circle Milan Girtel,"eth, Raw, inform, imper, zk, bay, accommod, ska, uv, priority","0.0038519809022545815, 0.0036327640991657972, 0.00310726766474545, 0.0030234542209655046, 0.002862549154087901, 0.00268911593593657, 0.002616581739857793, 0.0025559684727340937, 0.0024199425242841244, 0.002318162936717272"
img83.png,aniRelative Confeder Gentaml,"ani, mys, nor, gress, itle, tern, Quint, tim, trat, rå","0.0072017330676317215, 0.0061359526589512825, 0.005970446392893791, 0.004087425768375397, 0.004024056252092123, 0.0039771744050085545, 0.0036639447789639235, 0.003649660386145115, 0.002842358546331525, 0.00272281258367002"
img84.png,inciRelative Quintostaention,"inci, rå, Schmidt, gress, ska, mond, mys, industrial, Gemeins, uv","0.013602870516479015, 0.005759818013757467, 0.00439898855984211, 0.003974155057221651, 0.0037921650800853968, 0.003333526896312833, 0.0031561199575662613, 0.003047090256586671, 0.0028962183278054, 0.002873679855838418"
img85.png,nitок Cass gau ske,"nit, Raw, industrial, fore, eth, raw, roc, aglia, aru, iec","0.006616269238293171, 0.004994221962988377, 0.003740499494597316, 0.0034324752632528543, 0.002747318707406521, 0.0025909682735800743, 0.002207532525062561, 0.0021903535816818476, 0.0020336743909865618, 0.0020099813118577003"
img86.png,uster Quint Mediter Bald slow,"uster, riority, Raw, bay, Quint, roc, mys, priority, inth, horn","0.0057179611176252365, 0.0056734634563326836, 0.005607366096228361, 0.004648669622838497, 0.004054641351103783, 0.003929893486201763, 0.0034411298111081123, 0.003013154026120901, 0.002920449012890458, 0.002669506473466754"
img87.png,Dumatel anal blind attention,"Dum, bay, mys, ures, tern, ani, зу, whe, Raw, tel","0.011546456255018711, 0.007484130561351776, 0.006867824587970972, 0.005851459223777056, 0.005307042971253395, 0.004348435439169407, 0.0031198495998978615, 0.0030835021752864122, 0.003035697154700756, 0.002556313294917345"
img88.png,tel arrang Africacstei,"tel, uv, decor, ere, dist, pri, fore, bay, Tel, ingly","0.00953605119138956, 0.004813794977962971, 0.004037818405777216, 0.00388313177973032, 0.0038378918543457985, 0.0034537287428975105, 0.003012395463883877, 0.0027428176254034042, 0.0027428176254034042, 0.0027002941351383924"
img89.png,agliaendooco blindtil,"aglia, Raw, nor, mys, rå, tel, tring, industrial, тан, ier","0.006240286864340305, 0.005073317792266607, 0.004975190851837397, 0.004728851839900017, 0.003017605748027563, 0.002868193667382002, 0.002857011742889881, 0.0027908289339393377, 0.002581095090135932, 0.0024342043325304985"
img90.png,industrial Circleunicasiayk,"industrial, neither, uv, bay, ез, nor, Tel, Raw, b, {","0.007778373546898365, 0.004554842598736286, 0.0036599189043045044, 0.0036172796972095966, 0.003451632335782051, 0.003398119704797864, 0.0032935705967247486, 0.0032935705967247486, 0.002795217093080282, 0.00257507455535233"
img91.png,uv otherwiseEDITonneae,"uv, ingly, fore, industrial, priority, endeav, imper, golden, Raw, bel","0.008532886393368244, 0.007769281044602394, 0.0036271922290325165, 0.002454281086102128, 0.0022172583267092705, 0.0021157225128263235, 0.0021157225128263235, 0.002091073663905263, 0.0020586547907441854, 0.002003125846385956"
img92.png,industrial素endozositul,"industrial, Marco, fore, tern, trat, inci, ias, Quint, тан, horn","0.007708272896707058, 0.0036411306355148554, 0.0035153457429260015, 0.0030422783456742764, 0.002727080602198839, 0.0027058585546910763, 0.0026431770529597998, 0.002416059607639909, 0.002378602046519518, 0.0021155723370611668"
img93.png,iskauta treatiska Giov,"iska, ias, imm, industry, eth, fore, Dub, nit, ere, ska","0.022338779643177986, 0.013924751430749893, 0.0077200764790177345, 0.004965023137629032, 0.0046642073430120945, 0.0037919736932963133, 0.0035622299183160067, 0.0033203631173819304, 0.002896072342991829, 0.002828984521329403"
img94.png,aglia Holdonneiner Gir,"aglia, bay, tel, ni, COUNT, ters, nor, eros, Tel, Sequence","0.006452517583966255, 0.005921163130551577, 0.0033737770281732082, 0.0032192806247621775, 0.003036070615053177, 0.003012443892657757, 0.002989000640809536, 0.002931188093498349, 0.0028410048689693213, 0.002607052680104971"
img95.png,bay Squad attention Squadcp,"bay, priority, tern, Quint, mys, aglia, nor, b, cs, blind","0.005706732161343098, 0.00499698193743825, 0.003876481205224991, 0.0038163820281624794, 0.0035711820237338543, 0.0035158158279955387, 0.003054593922570348, 0.0027703961823135614, 0.0026332244742661715, 0.0026025462429970503"
img96.png,golden absolutely gent otherwisetel,"golden, fore, Golden, pill, eth, iska, industrial, pri, Poz, ga","0.009138025343418121, 0.00784675870090723, 0.006479830015450716, 0.005969500169157982, 0.0033748489804565907, 0.0032838182523846626, 0.002920688595622778, 0.002920688595622778, 0.002711767330765724, 0.0024403263814747334"
img97.png,ire Hin tel Ber mist,"ire, Disk, nit, settlement, Wor, cycle, wig, hoofd, rå, uster","0.005223229993134737, 0.004573613405227661, 0.0038363535422831774, 0.003762151813134551, 0.003762151813134551, 0.003732874523848295, 0.003732874523848295, 0.003320086980238557, 0.003046683268621564, 0.0025257891975343227"
img98.png,tern observ Kel Gregory Ludwig,"tern, uv, ias, bay, Raw, arrang, 丸, Marco, industrial, Fac","0.007716239895671606, 0.006447159685194492, 0.00605654576793313, 0.00564532121643424, 0.004866571165621281, 0.0045717209577560425, 0.0044484068639576435, 0.004413788206875324, 0.003987525589764118, 0.003941069822758436"
img99.png,duty Fichce dow tot,"duty, Raw, fore, int, b, tern, Tel, Cart, singles, clock","0.005352313630282879, 0.004489528480917215, 0.004437224008142948, 0.0035376634914427996, 0.0034154532477259636, 0.0028760998975485563, 0.0025183972902595997, 0.0025183972902595997, 0.002403071615844965, 0.002338252728804946"
img100.png,aglia e Cu trav素,"aglia, Fich, nit, Rece, zk, Vice, Stuart, expect, trat, subsequ","0.005502503830939531, 0.004137315321713686, 0.0033636135049164295, 0.003234755015000701, 0.0031108336988836527, 0.003050664672628045, 0.0019543294329196215, 0.001909057144075632, 0.001894200686365366, 0.0018287646817043424"
img101.png,myscs Circleomp丸,"mys, ile, ber, enza, Raw, settlement, sa, Jew, Ber, retre","0.007131985388696194, 0.004325767979025841, 0.0034623011015355587, 0.0029269608203321695, 0.0025931436102837324, 0.002493801759555936, 0.0024743948597460985, 0.0024265360552817583, 0.0023703251499682665, 0.0023703251499682665"
img102.png,nor immosz dow Ferd,"nor, priority, ska, pill, iska, imm, industrial, raw, Raw, aru","0.011607373133301735, 0.007672005333006382, 0.006797019857913256, 0.005612959153950214, 0.005011808127164841, 0.004635164979845285, 0.004236883483827114, 0.004203911870718002, 0.004122601356357336, 0.0036810683086514473"
img103.png,industrial CadNet Jewanaly,"industrial, ska, aglia, mys, ro, Raw, singles, iska, pill, inci","0.008800378069281578, 0.0045655760914087296, 0.0041896081529557705, 0.004108573775738478, 0.003041329327970743, 0.0028682465199381113, 0.002834830665960908, 0.0028237784281373024, 0.0027799997478723526, 0.0027050140779465437"
img104.png,танnumer lun scaleyc,"тан, riv, tern, ska, mys, LI, ias, full, rio, uv","0.00542192067950964, 0.004803555551916361, 0.003997873514890671, 0.003829728113487363, 0.003668655175715685, 0.003583670826628804, 0.003262969432398677, 0.00318738236092031, 0.003053325694054365, 0.002936354372650385"
img105.png,mys Element Quintкло treat,"mys, Fore, Poz, Marco, rå, ut, тан, fore, imm, pause","0.005575614515691996, 0.005575614515691996, 0.005467772483825684, 0.00316450372338295, 0.0031032967381179333, 0.0030911981593817472, 0.0030791463796049356, 0.0029727760702371597, 0.0026647793129086494, 0.0026030498556792736"
img106.png,nor mitt Brig Majorodel,"nor, Raw, Wars, neither, mys, tern, Tel, tel, b, ias","0.009577210992574692, 0.006063912995159626, 0.0055863382294774055, 0.005289038177579641, 0.004541660659015179, 0.004488748498260975, 0.0035927491262555122, 0.00345511338673532, 0.0030136031564325094, 0.0029668817296624184"
img107.png,rå素 Marcoкло treat,"rå, pill, gress, nor, iska, eth, dist, ént, Yan, aus","0.0067635164596140385, 0.003991628065705299, 0.003779197344556451, 0.0035502277314662933, 0.003207363421097398, 0.003157637780532241, 0.002977935830131173, 0.0028194531332701445, 0.002607567934319377, 0.002567141316831112"
img108.png,nor Gil丸 nit Society,"nor, mys, rå, eth, bay, fore, roc, sle, enza, Quint","0.009258667007088661, 0.005726424511522055, 0.005053552333265543, 0.004710428416728973, 0.004583372734487057, 0.004477199167013168, 0.004425038117915392, 0.003935710061341524, 0.0034868461079895496, 0.0034462232142686844"
img109.png,iascsiderendo env,"ias, tern, Poz, ere, ti, Marco, Dum, logo, riv, iska","0.00901311170309782, 0.00894297007471323, 0.004768165294080973, 0.004030912648886442, 0.003420991124585271, 0.0034076538868248463, 0.0026642705779522657, 0.0026127391029149294, 0.002582299755886197, 0.0025323531590402126"
img110.png,mys neither Mediterumen Marg,"mys, nor, ias, support, esty, onderwerp, rå, gress, etry, Lyon","0.010600644163787365, 0.00539317075163126, 0.004401777870953083, 0.004055107478052378, 0.0038845555391162634, 0.0034415251575410366, 0.003388169454410672, 0.002733126049861312, 0.0024788377340883017, 0.0024691736325621605"
img111.png,inguasiatei Mitchellкло,"ingu, neither, roc, settlement, Sequence, riority, aru, ént, coh, <0xAB>","0.009790679439902306, 0.004293971695005894, 0.0036300390493124723, 0.002676622709259391, 0.0025640474632382393, 0.002418127376586199, 0.0023529024329036474, 0.0022103472147136927, 0.0019813424441963434, 0.001912896055728197"
img112.png,tern素 Pilovie anal,"tern, Trying, bay, nit, Raw, Station, eros, eth, pri, andy","0.00750318169593811, 0.005889314226806164, 0.005076907109469175, 0.0024646404199302197, 0.0021163695491850376, 0.002099899807944894, 0.0020273576956242323, 0.001972673460841179, 0.0019269764889031649, 0.001831565285101533"
img113.png,industrialocity blind distance tim,"industrial, mys, Raw, ters, raw, Fac, iska, nor, uv, inci","0.006921851541846991, 0.006084697786718607, 0.004908327478915453, 0.0038525904528796673, 0.0037486732471734285, 0.002796680899336934, 0.002401490230113268, 0.002336714183911681, 0.002221015514805913, 0.0019372041570022702"
img114.png,Raw Physдьwards Dup,"Raw, tern, tt, cs, bas, 鳥, ias, mys, arel, тан","0.011682639829814434, 0.005411751102656126, 0.0046652210876345634, 0.002742541953921318, 0.002566335489973426, 0.002497113076969981, 0.0023920878302305937, 0.0023275651037693024, 0.0023275651037693024, 0.0022914796136319637"
img115.png,industrialairetel neither ram,"industrial, nor, ters, tern, param, ish, mys, ures, dist, neither","0.009411660954356194, 0.005664038006216288, 0.004940261598676443, 0.004079653415828943, 0.0033038039691746235, 0.002915596589446068, 0.0027604312635958195, 0.002738949377089739, 0.002675501862540841, 0.0026237531565129757"
img116.png,ias schema gentucci tot,"ias, industrial, inci, rå, industri, mys, clock, honest, Disk, ters","0.014606679789721966, 0.01244504563510418, 0.0070357914082705975, 0.006661353167146444, 0.00643123360350728, 0.005047933664172888, 0.004632243886590004, 0.004507297184318304, 0.0035935305058956146, 0.002701963996514678"
img117.png,тан expectlettframeworkuta,"тан, fore, rå, tern, Quint, mys, zk, nit, mitt, inth","0.008257990702986717, 0.007910670712590218, 0.006331621669232845, 0.005501008592545986, 0.005067766178399324, 0.00400893297046423, 0.003551717847585678, 0.0032087096478790045, 0.0026914700865745544, 0.002660113852471113"
img118.png,ias素 CornутFramework,"ias, uv, iska, Sequence, Fac, tel, pri, mys, Sorry, Gall","0.01297743059694767, 0.0037619241047650576, 0.003242981154471636, 0.00280656642280519, 0.0024383871350437403, 0.002326725283637643, 0.002135123126208782, 0.0020694322884082794, 0.001790944254025817, 0.0017770070116966963"
img119.png,mys elementaryquoteasiaclip,"mys, b, fore, industrial, roc, Compar, achim, fou, ba, Chan","0.006629689130932093, 0.00436487328261137, 0.004132578615099192, 0.00402110954746604, 0.0037189184222370386, 0.0037189184222370386, 0.0036469881888478994, 0.0036469881888478994, 0.003426027949899435, 0.0031562051735818386"
img120.png,Rawiseatel distritobaum,"Raw, Trying, ias, Marco, mit, tern, zk, aglia, mys, bay","0.018015921115875244, 0.005894786678254604, 0.005042077973484993, 0.004925278481096029, 0.004083199426531792, 0.0034383987076580524, 0.0028728896286338568, 0.0027845001313835382, 0.002698830096051097, 0.0023447840940207243"
img121.png,vu Gil丸 Ponanka,"vu, ias, Raw, 🌍, uv, bay, egos, trat, zeich, pill","0.0038866850081831217, 0.003781848354265094, 0.003694242099300027, 0.0035388669930398464, 0.0029916882049292326, 0.0027346245478838682, 0.0026817319449037313, 0.0025094326119869947, 0.0024801967665553093, 0.0023666201159358025"
img122.png,mys gaurigibaiska,"mys, industri, horn, industrial, fore, Poz, imper, singles, tern, inci","0.006018997635692358, 0.004836400505155325, 0.00474285613745451, 0.004088597372174263, 0.003978314343839884, 0.002518911613151431, 0.002518911613151431, 0.00238485774025321, 0.0022667753510177135, 0.0022491351701319218"
img123.png,industrialfs Bundény Wing,"industrial, mys, tern, тан, iska, 🌍, blind, bay, Sent, uv","0.007506617810577154, 0.005513453856110573, 0.003804168663918972, 0.003745190566405654, 0.003463735105469823, 0.0030807096045464277, 0.0026765670627355576, 0.0025740291457623243, 0.0025144019164144993, 0.002307344926521182"
img124.png,Gy Sach equivalentagoleben,"Gy, tern, hoofd, Ber, iska, enza, bay, industry, nor, til","0.009258334524929523, 0.003726121736690402, 0.0035694059915840626, 0.003527821274474263, 0.0033926726318895817, 0.0031011535320430994, 0.0025212198961526155, 0.0024821320548653603, 0.0024532144889235497, 0.002434123307466507"
img125.png,industrial Cape Capetranslate pick,"industrial, tern, ias, fore, rå, industri, ters, ingu, liv, Marco","0.013057616539299488, 0.00712708942592144, 0.0057942820712924, 0.004601594526320696, 0.0042391871102154255, 0.004189799074083567, 0.003275790251791477, 0.0031257807277143, 0.0028571952134370804, 0.002812898252159357"
img126.png,agliainy Firwigabi,"aglia, Raw, priority, fore, Fac, bay, Fore, uster, tern, sle","0.010581445880234241, 0.006392950192093849, 0.0042090085335075855, 0.0036855307407677174, 0.003127869451418519, 0.0026032438036054373, 0.002244136529043317, 0.0022353874519467354, 0.0022179915104061365, 0.002192151267081499"
img127.png,nor hierarchyza radhorn,"nor, neither, bay, onderwerp, hoofd, mys, tern, Sent, aka, roc","0.009317545220255852, 0.006428912747651339, 0.005165776703506708, 0.003564278595149517, 0.0031949984841048717, 0.003060621442273259, 0.0029433704912662506, 0.002875187434256077, 0.0026487470604479313, 0.002365064574405551"
img128.png,ardaiquPagercskele,"arda, ania, ias, gen, Tel, Gru, industri, mys, b, lem","0.014942235313355923, 0.007874004542827606, 0.007253872696310282, 0.005627297330647707, 0.0038076196797192097, 0.003256829921156168, 0.0028966842219233513, 0.0028741422574967146, 0.0028517753817141056, 0.0024680059868842363"
img129.png,ias素achimquotosz,"ias, eros, settlement, aglia, nit, nit, spirit, gress, compte, ltre","0.008031530305743217, 0.004758524242788553, 0.004435431677848101, 0.004086111672222614, 0.003454318270087242, 0.0029894630424678326, 0.0028525658417493105, 0.0028083405923098326, 0.002478351816534996, 0.0022653969936072826"
img130.png,Quint jun Online Douagg,"Quint, ias, trat, iska, Cape, dist, skin, andy, Singles, distrito","0.004423112608492374, 0.0035819460172206163, 0.003039957955479622, 0.0025399799924343824, 0.0024048045743256807, 0.0023490972816944122, 0.002285734284669161, 0.00227682339027524, 0.002250297460705042, 0.002224080730229616"
img131.png,ternatzands equival Secret,"tern, ska, iska, industrial, ies, eth, uv, Raw, rå, ters","0.014315974898636341, 0.005391445476561785, 0.005164688918739557, 0.004504721146076918, 0.0036766466218978167, 0.0035635281819850206, 0.0034136506728827953, 0.0032573281787335873, 0.0025269195903092623, 0.0024780447129160166"
img132.png,rioagg alternative Forearu,"rio, fore, mys, iska, preference, tern, цен, Raw, uchar, uv","0.008237882517278194, 0.007157196290791035, 0.005818759091198444, 0.00463911984115839, 0.004158479627221823, 0.0033414326608181, 0.0029488038271665573, 0.002770144958049059, 0.002473460743203759, 0.0024446442257612944"
img133.png,🌍cs gard Mig Tel,"🌍, aglia, fore, Según, bay, mehrerer, rå, tern, тан, priority","0.024715088307857513, 0.008214093744754791, 0.006273409817367792, 0.004828816279768944, 0.004278094507753849, 0.0037606859114021063, 0.0037023823242634535, 0.0030336230993270874, 0.002883417997509241, 0.002849825192242861"
img134.png,mys beskre Centuta ti,"mys, gen, iska, Tel, LI, Trying, onderwerp, trat, Cent, nit","0.00901978462934494, 0.004211006686091423, 0.0036729052662849426, 0.0035047107376158237, 0.002584211528301239, 0.002514506923034787, 0.0023074413184076548, 0.0021676404867321253, 0.002060313243418932, 0.00203630980104208"
img135.png,industrialabase cohuvatel,"industrial, uv, duty, true, nor, aglia, port, reviews, Raw, ters","0.0072409179992973804, 0.0036838806699961424, 0.0036695185117423534, 0.003626767545938492, 0.0033281089272350073, 0.0031021388713270426, 0.0026742108166217804, 0.0024926383048295975, 0.0024635985027998686, 0.002314336597919464"
img136.png,🌍csрой dowtil,"🌍, Sent, rå, mys, ber, nor, тан, eros, Cart, trat","0.008639007806777954, 0.007865906693041325, 0.007078549358993769, 0.006222444586455822, 0.004112784750759602, 0.0033963255118578672, 0.0032155762892216444, 0.0029050312004983425, 0.002718384377658367, 0.002593900542706251"
img137.png,mys portamaramar io,"mys, Quint, andy, gress, Sent, Gallery, aglia, nit, observ, inci","0.010173010639846325, 0.005381781607866287, 0.005339900031685829, 0.004900168161839247, 0.004603281617164612, 0.004461653530597687, 0.0032642153091728687, 0.003066446864977479, 0.002869429299607873, 0.0028029591776430607"
img138.png,aglia din brig Africa Golden,"aglia, otherwise, bay, Schmidt, ures, arda, Gil, roy, cs, industrial","0.0044597964733839035, 0.004373536445200443, 0.004013382829725742, 0.0037408836651593447, 0.0033272106666117907, 0.0031013016123324633, 0.0029941657558083534, 0.0028459143359214067, 0.002779988804832101, 0.0024919656571000814"
img139.png,roc Squadcape Stilloco,"roc, rå, ere, ures, mys, imm, ias, rog, ing, duty","0.005178683437407017, 0.00460601644590497, 0.003504072781652212, 0.0034497471060603857, 0.0027396553196012974, 0.002523888600990176, 0.0023989223409444094, 0.0023160504642874002, 0.0022712540812790394, 0.002236041473224759"
img140.png,ters素 extiledu,"ters, mys, industrial, duty, industri, gress, b, neither, Poz, nor","0.006283647380769253, 0.005416842643171549, 0.004508296959102154, 0.0036366963759064674, 0.0036225183866918087, 0.0035943270195275545, 0.0030985039193183184, 0.002723759738728404, 0.002588896779343486, 0.002480011433362961"
img141.png,uv checkainatelago,"uv, gly, industri, Tat, aglia, finit, tt, ias, inci, wohl","0.00592172471806407, 0.004776862449944019, 0.004232065752148628, 0.004199131391942501, 0.003991218283772469, 0.0037057208828628063, 0.0036768827121704817, 0.003508505877107382, 0.0025568704586476088, 0.0024493320379406214"
img142.png,mys Quint Corn Holdacher,"mys, tern, LI, nor, gress, aglia, pret, ias, Marco, rå","0.006303532514721155, 0.0036339820362627506, 0.0036198142915964127, 0.003283028956502676, 0.003270229557529092, 0.002919986378401518, 0.0027538095600903034, 0.0027217266615480185, 0.0025869645178318024, 0.0024975966662168503"
img143.png,tern Cet Stern Squadfore,"tern, тан, aglia, Marco, clock, schließ, mys, fore, ias, duty","0.006277463864535093, 0.005143569316715002, 0.004382375627756119, 0.0038523555267602205, 0.003590789856389165, 0.00290791061706841, 0.00287403236143291, 0.002658045617863536, 0.002516587032005191, 0.002439159667119384"
img144.png,mys Quint Corn radtil,"mys, industrial, Raw, ut, raw, riv, tel, nor, Fac, int","0.012957777827978134, 0.007072595413774252, 0.0055948831140995026, 0.0042397682555019855, 0.004029842559248209, 0.0031262096017599106, 0.0029598355758935213, 0.002913947682827711, 0.0028353489469736814, 0.0026428354904055595"
img145.png,тан Gil junanno recre,"тан, bay, riv, uv, golden, aglia, дей, zk, tern, industrial","0.005587409250438213, 0.005543927196413279, 0.004334514029324055, 0.00293287867680192, 0.002469731494784355, 0.002403114689514041, 0.0021795304492115974, 0.0019767482299357653, 0.0019385144114494324, 0.0018353486666455865"
img146.png,дейachim Stern cohút,"дей, gress, nit, iska, ter, roc, schließ, FI, industry, sle","0.0037330721970647573, 0.00339900073595345, 0.002851086901500821, 0.002817870583385229, 0.002731173764914274, 0.002636824268847704, 0.002467410173267126, 0.0023821722716093063, 0.002372884890064597, 0.0023360969498753548"
img147.png,zk neither tim Golden otherwise,"zk, guarante, tern, industri, Schmidt, fore, ister, hoofd, ent, Raw","0.006991858594119549, 0.004585373215377331, 0.004392518196254969, 0.0030905227176845074, 0.002770326565951109, 0.0023975176736712456, 0.002287727314978838, 0.002261074725538492, 0.0022522597573697567, 0.0021829649340361357"
img148.png,ternvírid Fridmys,"tern, mys, ias, industrial, rå, Marco, зу, priority, Dy, nor","0.009921597316861153, 0.006872489582747221, 0.00526932068169117, 0.003993059508502483, 0.003931152634322643, 0.003931152634322643, 0.0027767368592321873, 0.0024313919711858034, 0.0021880161948502064, 0.002154093934223056"
img149.png,ternamar Jet Entertainment quot,"tern, rio, Según, dy, Tel, bande, Dy, Singles, heart, arrang","0.003478736151009798, 0.002975520910695195, 0.0027734902687370777, 0.002719846088439226, 0.0026568409521132708, 0.002615650650113821, 0.002605452900752425, 0.0024285491090267897, 0.002228562021628022, 0.002185457618907094"
img150.png,uvonne Holdкло Jay,"uv, Quint, sa, nit, full, Chart, settlement, зу, aglia, arrang","0.004092629533261061, 0.003187343245372176, 0.00295934802852571, 0.0028907947707921267, 0.0028459772001951933, 0.0023047425784170628, 0.0022164492402225733, 0.0022164492402225733, 0.0021820864640176296, 0.0021735792979598045"
img151.png,bayachim favaye Corn,"bay, trat, Poz, foreign, mys, tel, tern, priority, uv, industrial","0.006407509557902813, 0.00630817050114274, 0.0042683216743171215, 0.0037667802534997463, 0.0036795232445001602, 0.0032093371264636517, 0.003038539318367839, 0.002922134706750512, 0.0025888679083436728, 0.0024799834936857224"
img152.png,industrial Aless Marse Segúnframework,"industrial, pret, ias, duty, industri, Trying, mys, neither, horn, schließ","0.016740690916776657, 0.005105622112751007, 0.005046140402555466, 0.004648722242563963, 0.0041024829261004925, 0.003869009902700782, 0.0036063138395547867, 0.0023650783114135265, 0.002274473663419485, 0.0021534282714128494"
img153.png,industrial Gilucci otherwise Dow,"industrial, Raw, bay, aus, b, ing, uster, tern, tel, industri","0.008590213023126125, 0.005251091904938221, 0.004725471138954163, 0.004598009865731001, 0.003826803294941783, 0.003209928283467889, 0.002724230522289872, 0.002549200551584363, 0.002509678713977337, 0.0024998942390084267"
img154.png,gressure timingt coinc,"gress, industrial, nor, Raw, raw, ias, rå, settlement, bay, relation","0.006521208677440882, 0.006445234175771475, 0.004715434275567532, 0.004412470851093531, 0.004193994216620922, 0.004001936875283718, 0.0033699683845043182, 0.003279069671407342, 0.0031781832221895456, 0.0027078459970653057"
img155.png,til arranglialick Gall,"til, fore, industrial, gall, guns, bě, uster, band, ters, nit","0.009051316417753696, 0.006124427542090416, 0.00434286892414093, 0.003503251587972045, 0.0030675495509058237, 0.0030555902048945427, 0.002961579477414489, 0.0029156648088246584, 0.002892974764108658, 0.0028592702001333237"
img156.png,myscsv wisska,"mys, Poz, rå, bay, mitt, uv, inci, fore, 鳥, ures","0.012208771891891956, 0.007944399490952492, 0.007790741045027971, 0.005546085070818663, 0.0035391037818044424, 0.0030989423394203186, 0.0029686051420867443, 0.0029686051420867443, 0.0028216193895787, 0.0027778742369264364"
img157.png,mys relationsteiatel duty,"mys, neither, nor, 玉, eth, hoofd, onderwerp, rå, canton, fore","0.005720639135688543, 0.005631948821246624, 0.0053114332258701324, 0.004267856478691101, 0.003593895584344864, 0.002809883328154683, 0.00253851804882288, 0.0024508240167051554, 0.0023754199501127005, 0.002214134903624654"
img158.png,mys Quint treatlement gent,"mys, Raw, tim, Dy, Jew, tempt, tim, b, inci, ska","0.009272939525544643, 0.004098800010979176, 0.0040510473772883415, 0.0037174501921981573, 0.0035472156014293432, 0.0031921484041959047, 0.0027625742368400097, 0.0026053553447127342, 0.0026053553447127342, 0.00256496318615973"
img159.png,industrial wandile arrang Marcel,"industrial, ias, nor, bay, industri, Quint, neither, mys, uv, settlement","0.007299432065337896, 0.00393774826079607, 0.003529774723574519, 0.003434564918279648, 0.003264507744461298, 0.002892193617299199, 0.002552351914346218, 0.0022789938375353813, 0.002261258428916335, 0.002124255755916238"
img160.png,uvamar rivbero Ber,"uv, fore, bay, mys, industri, Fac, inci, nor, imper, 鳥","0.00886393990367651, 0.004457068629562855, 0.004286321345716715, 0.003539631376042962, 0.002934457501396537, 0.0029116214718669653, 0.0025795535184442997, 0.0024232661817222834, 0.0024232661817222834, 0.0021978069562464952"
