Image File,Inference Result,Top 10 Words,Top 10 Probabilities
img1.png,industrial slowericker Dav duty,"industrial, tern, rå, ters, clock, indust, тан, eth, fore, hoofd","0.012379300780594349, 0.005623551085591316, 0.004866777919232845, 0.00417906790971756, 0.00358853698708117, 0.003142227418720722, 0.0028056935407221317, 0.0026357050519436598, 0.0023442446254193783, 0.0021680721547454596"
img2.png,mysachim Marionne Num,"mys, gress, ures, ias, raw, fore, nit, Raw, ani, sle","0.006294372491538525, 0.006053239107131958, 0.004959846381098032, 0.004902062471956015, 0.003969810903072357, 0.0038778504822403193, 0.003657161258161068, 0.0034355854149907827, 0.0032910890877246857, 0.0031403792090713978"
img3.png,ias defence net canton Lip,"ias, Dre, bay, tern, ingly, 泰, mys, Lucy, ures, inci","0.00915713794529438, 0.006699504796415567, 0.004732138942927122, 0.004550853744149208, 0.004497834946960211, 0.004143599886447191, 0.0039693256840109825, 0.0037727903109043837, 0.003502917243167758, 0.0034892610274255276"
img4.png,aglia Raw telasiaatel,"aglia, bay, '"", Raw, цен, uv, horn, arus, nor, imm","0.008290615864098072, 0.00623368751257658, 0.005028512794524431, 0.0046870894730091095, 0.004301114939153194, 0.003524207044392824, 0.0030380566604435444, 0.0030262123327702284, 0.0027987887151539326, 0.0026915688067674637"
img5.png,тан Facire aptandroid,"тан, bay, Trying, int, priority, tern, nit, Hinter, riority, Counter","0.007272631861269474, 0.00439387746155262, 0.0034487938974052668, 0.0032398418989032507, 0.0032020965591073036, 0.0029041755478829145, 0.0028928532265126705, 0.002814823528751731, 0.0026650214567780495, 0.0026134750805795193"
img6.png,ters素 timucci Hold,"ters, industrial, tern, b, nor, uv, heaven, onderwerp, industri, Raw","0.0077070328406989574, 0.007676986511796713, 0.00669598625972867, 0.004256227519363165, 0.003875339636579156, 0.0036405448336154222, 0.003570130094885826, 0.0034874281845986843, 0.0034467983059585094, 0.0033669534604996443"
img7.png,industrialonne Caperettannes,"industrial, industri, mys, conte, ures, true, ters, ént, honest, trad","0.0055321273393929005, 0.004342216532677412, 0.004047391004860401, 0.0037578754127025604, 0.0036565130576491356, 0.003152111079543829, 0.0030790925957262516, 0.003031355794519186, 0.002938090590760112, 0.0024838040117174387"
img8.png,uvanno mit Ludwigruf,"uv, niem, tern, Singles, dy, accom, singles, egos, schemes, Sequence","0.006370221730321646, 0.004429793916642666, 0.004001985304057598, 0.003774231532588601, 0.0037448599468916655, 0.002997348317876458, 0.0028938036412000656, 0.0027184770442545414, 0.0026763309724628925, 0.0022981467191129923"
img9.png,mys Quint Streodelence,"mys, rå, imper, maj, Marco, trat, agg, Evans, Fac, undle","0.006650030612945557, 0.00408099265769124, 0.004065082408487797, 0.0035595051012933254, 0.002927968744188547, 0.0024752472527325153, 0.0024084814358502626, 0.0021673988085240126, 0.0019428436644375324, 0.0019202090334147215"
img10.png,iasRelativeire commit Vitt,"ias, nor, mit, mys, bay, single, pill, ani, тан, schließ","0.008058452978730202, 0.006974009796977043, 0.004432950634509325, 0.003660717513412237, 0.0036180689930915833, 0.0032559095416218042, 0.002987790619954467, 0.0029414689633995295, 0.0029072000179439783, 0.0026367157697677612"
img11.png,industrial canton Cape Foreilon,"industrial, tern, uster, hoofd, duty, kin, tel, Marco, Ost, clock","0.006375892553478479, 0.003943447023630142, 0.003439535852521658, 0.003294873284175992, 0.0031562955118715763, 0.0030000165570527315, 0.0029766703955829144, 0.0028850878588855267, 0.0027529699727892876, 0.0022381488233804703"
img12.png,trat Sommer선inci Koch,"trat, тан, nor, guarante, ters, bay, ska, aglia, iska, arrang","0.008766427636146545, 0.008397722616791725, 0.006961957085877657, 0.00672145327553153, 0.004140967037528753, 0.0036118156276643276, 0.0032249887008219957, 0.002857181243598461, 0.002780113834887743, 0.0027584785129874945"
img13.png,uv pillsBy Ludwig Abs,"uv, zk, eth, <0xAB>, imm, industrial, sle, ént, dist, cot","0.0037978109903633595, 0.0034176602493971586, 0.003351556370034814, 0.0033384901471436024, 0.00329959555529058, 0.003273917827755213, 0.003087598830461502, 0.0030516269616782665, 0.002969314344227314, 0.0028892222326248884"
img14.png,mysesti dia rörzel,"mys, ter, fore, industrial, til, Sent, neither, ish, duty, blind","0.007993655279278755, 0.004195937886834145, 0.004019462503492832, 0.003972634207457304, 0.003865479491651058, 0.0032934295013546944, 0.003081828821450472, 0.0029637657571583986, 0.002730349078774452, 0.002719704294577241"
img15.png,mys rör rad素 eb,"mys, hoofd, tim, nit, inci, nor, imper, Quint, Fac, industrial","0.00448398245498538, 0.003397934837266803, 0.0033322128001600504, 0.002646314213052392, 0.002625720575451851, 0.0025749346241354942, 0.002554896054789424, 0.0025449355598539114, 0.0025251309853047132, 0.0024859823752194643"
img16.png,mys recreireasia candid,"mys, inci, Param, rå, hoofd, ingu, цен, eros, tim, gress","0.009372049011290073, 0.00727050332352519, 0.006568352226167917, 0.006122377701103687, 0.0031638643704354763, 0.003127004485577345, 0.003114813007414341, 0.0028030285611748695, 0.0026642410084605217, 0.0025722035206854343"
img17.png,industrialcs makachim dist,"industrial, Tel, Jew, gent, Fac, uv, riv, ures, тан, ters","0.006882418412715197, 0.006670668721199036, 0.0059098852798342705, 0.005617266520857811, 0.005094639491289854, 0.004804702475667, 0.004443623591214418, 0.004357676021754742, 0.004109679721295834, 0.003756551770493388"
img18.png,tern Dum favour Nelson env,"tern, industri, imper, nor, inci, Quint, nit, hoofd, bay, horn","0.004656636156141758, 0.004478243179619312, 0.004045755602419376, 0.003380355192348361, 0.0031755496747791767, 0.0020663696341216564, 0.001987208379432559, 0.001948772231116891, 0.0019336068071424961, 0.0018668095581233501"
img19.png,tern Alg tel sto Gir,"tern, Raw, tel, nor, guarante, neither, industri, industrial, Según, bay","0.007634861394762993, 0.0065049827098846436, 0.004470805171877146, 0.004384332336485386, 0.004249440040439367, 0.004102641250938177, 0.003899505827575922, 0.003839049255475402, 0.003706427523866296, 0.003522909712046385"
img20.png,Telingu closecs Brig,"Tel, uv, industrial, bay, ures, b, ias, iska, fore, aglia","0.006441175006330013, 0.005618093069642782, 0.005277709569782019, 0.005055735819041729, 0.004749424755573273, 0.004341325722634792, 0.00420775730162859, 0.003846201114356518, 0.002435262780636549, 0.0022086873650550842"
img21.png,iska wiseantesateltel,"iska, mys, aglia, fore, priority, Raw, тан, Poz, Tel, enza","0.005448862910270691, 0.004865286871790886, 0.0046424889005720615, 0.0043612150475382805, 0.003190733026713133, 0.0026348980609327555, 0.0024368821177631617, 0.002271423814818263, 0.002218806417658925, 0.0021844070870429277"
img22.png,тан ther dow Glabird,"тан, mys, priority, fore, trat, riority, Gru, rå, tt, andy","0.01393853034824133, 0.009248862974345684, 0.005653717555105686, 0.0037515044678002596, 0.0033759886864572763, 0.0033759886864572763, 0.0032088318839669228, 0.0031467676162719727, 0.002820744179189205, 0.0027233001310378313"
img23.png,ters素wohl analrg,"ters, bay, tan, aus, iec, tel, ias, Tel, industrial, Counter","0.006398571655154228, 0.006274812389165163, 0.0051413970068097115, 0.004262367729097605, 0.0040041240863502026, 0.003926677163690329, 0.0032048604916781187, 0.003155173733830452, 0.0028728183824568987, 0.0028062695637345314"
img24.png,Raw duty sooner din tel,"Raw, iska, industrial, uv, priority, nor, raw, Haupt, sle, aux","0.008041796274483204, 0.0045464192517101765, 0.004389361944049597, 0.003919258713722229, 0.003526950953528285, 0.0034184379037469625, 0.003161538625136018, 0.0030049998313188553, 0.0029125455766916275, 0.002768335398286581"
img25.png,mys rör ramiec Hold,"mys, uv, industrial, зу, signs, bande, Um, zeich, Marco, nit","0.007486861199140549, 0.006110598333179951, 0.0051255784928798676, 0.003550384659320116, 0.0032964202109724283, 0.003145466558635235, 0.0025873901322484016, 0.0025672544725239277, 0.0023558451794087887, 0.00231932126916945"
img26.png,mys Quint zach Conse Хронологија,"mys, nor, itle, tern, ias, fore, singles, enza, Marco, Singles","0.008409596979618073, 0.0071093072183430195, 0.004963096231222153, 0.0045722187496721745, 0.0029636002145707607, 0.0028278871905058622, 0.0025053690187633038, 0.002428287174552679, 0.0022196341305971146, 0.0022196341305971146"
img27.png,blind meteor Gir Stern otherwise,"blind, gress, ures, Poz, mys, 鳥, Lucy, industri, undle, Gallery","0.0032995797228068113, 0.002844415372237563, 0.0027354476042091846, 0.002693038433790207, 0.00228555197827518, 0.0021723865065723658, 0.0020091289188712835, 0.0018293329048901796, 0.0017455616034567356, 0.001691856188699603"
img28.png,bay Lauireví◄,"bay, ters, Trying, Raw, nor, try, trat, Gallery, zk, trying","0.006217679940164089, 0.005235811695456505, 0.004061757121235132, 0.0039831954054534435, 0.0038606454618275166, 0.002473222091794014, 0.0024159301538020372, 0.002296309219673276, 0.002243115333840251, 0.00217410153709352"
img29.png,tern totonne Ludwig trat,"tern, bay, mit, ters, inci, uv, eros, settlement, nor, fore","0.011241468600928783, 0.003961571026593447, 0.00391541700810194, 0.0038396865129470825, 0.003678194247186184, 0.003284257836639881, 0.003133860882371664, 0.002733401721343398, 0.002638975391164422, 0.002587932860478759"
img30.png,mys neithergent radosz,"mys, tern, Según, fore, gress, nor, ters, bay, industrial, ter","0.021860867738723755, 0.0062632435001432896, 0.003996741492301226, 0.0036676162853837013, 0.003540916834026575, 0.003391990438103676, 0.0032114717178046703, 0.002970126224681735, 0.002672824077308178, 0.002631385810673237"
img31.png,nit Circle detection recrepy,"nit, maj, aglia, uv, Tel, mys, ias, eth, tel, tim","0.005153893493115902, 0.004190085921436548, 0.003712210338562727, 0.0036262169014662504, 0.0034065155778080225, 0.002868573646992445, 0.002813090570271015, 0.0026947755832225084, 0.0025414153933525085, 0.002434526802971959"
img32.png,Fac radilar obstsb,"Fac, Raw, цен, Mys, ias, mys, dia, uv, iska, 泰","0.005379566457122564, 0.005073414649814367, 0.003668545512482524, 0.0036542434245347977, 0.003432844066992402, 0.0032884632237255573, 0.002947759348899126, 0.00290205841884017, 0.002491977531462908, 0.0024533430114388466"
img33.png,Tel slow Dum knowingfra,"Tel, Marco, Still, ltre, тан, eros, fou, bay, Según, ae","0.005968135315924883, 0.00565051706507802, 0.004487421829253435, 0.004054047632962465, 0.003648248268291354, 0.003563736332580447, 0.0029892674647271633, 0.0029200210701674223, 0.0028412584215402603, 0.002527067670598626"
img34.png,myscape Zofah素,"mys, Raw, industri, gress, industrial, iska, ing, sing, fore, b","0.007435300853103399, 0.0049529788084328175, 0.003887637285515666, 0.0034308277536183596, 0.0034041290637105703, 0.0030994946137070656, 0.002969134133309126, 0.0028221220709383488, 0.002510047284886241, 0.0024711324367672205"
img35.png,Raw ...noc tiarga,"Raw, aglia, industrial, uster, tern, bay, gen, ters, guarante, ures","0.008723349310457706, 0.007728459779173136, 0.006927746348083019, 0.0048933555372059345, 0.004218336660414934, 0.002991248155012727, 0.0024318676441907883, 0.0023295863065868616, 0.0022756217513233423, 0.0020398541819304228"
img36.png,aglia sto Dum analtil,"aglia, ias, mys, trat, fore, 泰, imm, Lyon, ier, Cape","0.003942303825169802, 0.0035063577815890312, 0.0033068102784454823, 0.003268284723162651, 0.0026467374991625547, 0.0024961114395409822, 0.002168659120798111, 0.0021267132833600044, 0.00211842218413949, 0.00211842218413949"
img37.png,Receruдьบ Dup,"Rece, priority, band, Band, Trying, schließ, rg, zk, pill, iska","0.005725052673369646, 0.003052452811971307, 0.0027469100896269083, 0.002662396989762783, 0.002122647827491164, 0.002065393142402172, 0.002033372176811099, 0.0020018473733216524, 0.0019862689077854156, 0.001955474726855755"
img38.png,mys neither Cooper Down Golden,"mys, ters, ias, Tel, Raw, зу, zk, riv, chin, imper","0.005413033068180084, 0.0050455015152692795, 0.004417988937348127, 0.004085971508175135, 0.0034139568451792, 0.003145084483548999, 0.0031328231561928988, 0.0030722287483513355, 0.0029087276197969913, 0.002797295805066824"
img39.png,tersiskaandomnit Cad,"ters, tern, erea, decor, analy, hoofd, gent, eros, bay, amma","0.012503313831984997, 0.007524627260863781, 0.003300132229924202, 0.003287266008555889, 0.0030402238480746746, 0.0027681554201990366, 0.0027040312997996807, 0.002641392406076193, 0.0024524498730897903, 0.0024144279304891825"
img40.png,mys rör timéntmoz,"mys, Fac, uv, Jew, tern, Vier, ures, imper, timestamp, idan","0.007356553804129362, 0.0038918040227144957, 0.003571320092305541, 0.0032517241779714823, 0.003127152333036065, 0.002685264218598604, 0.0023604982998222113, 0.0023148423060774803, 0.00221748324111104, 0.0022088380064815283"
img41.png,myswiseunes blindtil,"mys, bay, imper, ters, tern, Marco, Fichier, őd, esent, Según","0.02528008632361889, 0.006317340303212404, 0.00523725850507617, 0.0049199494533240795, 0.004694648087024689, 0.002727688290178776, 0.002379131969064474, 0.002279068809002638, 0.002261333167552948, 0.0022262742277234793"
img42.png,foreatelfriedadt Bug,"fore, Raw, industrial, horn, mys, raw, Tel, ures, tern, ones","0.006189525127410889, 0.005791852250695229, 0.005526624154299498, 0.0049928887747228146, 0.0038884656969457865, 0.0037395008839666843, 0.003499240381643176, 0.00300477328710258, 0.002452424494549632, 0.0022069434635341167"
img43.png,mys neither場丸Choice,"mys, rå, eros, industri, tern, industrial, Raw, tt, ias, fore","0.010362794622778893, 0.006139752920717001, 0.005612188018858433, 0.005272162612527609, 0.004781643860042095, 0.00437077647075057, 0.004269527271389961, 0.0040423073805868626, 0.0035812859423458576, 0.0035257632844150066"
img44.png,Receiska Giliska�,"Rece, gan, competition, tern, guns, ania, baby, gen, Cape, industrial","0.011067482642829418, 0.006791895721107721, 0.005457441788166761, 0.004300360567867756, 0.0037655215710401535, 0.0031462109182029963, 0.0030613469425588846, 0.002744173863902688, 0.0026910966262221336, 0.002479154383763671"
img45.png,myscsante transSym,"mys, rå, industri, eth, Raw, nor, honest, pret, ì, imper","0.006964501459151506, 0.006619665306061506, 0.00465751625597477, 0.004174970556050539, 0.0035990490578114986, 0.0028694123029708862, 0.002512541599571705, 0.002351112198084593, 0.002149090636521578, 0.002026785397902131"
img46.png,bagg tihar grouping,"b, tern, ias, ters, bay, priority, mys, Riv, nor, industrial","0.008949543349444866, 0.00530242919921875, 0.005261164624243975, 0.0035738153383135796, 0.003491027979180217, 0.003318175207823515, 0.003153880825266242, 0.0027941837906837463, 0.0026871399022638798, 0.002514492953196168"
img47.png,iskaiss Quint espoco,"iska, tern, Raw, Cart, mys, b, nor, trat, fore, bay","0.0058435010723769665, 0.005238080397248268, 0.0038926112465560436, 0.0038322617765516043, 0.0038322617765516043, 0.00380243849940598, 0.003628312610089779, 0.0031646701972931623, 0.0030913606751710176, 0.0029040647204965353"
img48.png,industrial telquinonne cand,"industrial, industri, nor, expect, ters, horn, guarante, horn, rå, mys","0.006140048149973154, 0.005397448781877756, 0.0039954050444066525, 0.0034442548640072346, 0.003390856320038438, 0.0029575577937066555, 0.002877782564610243, 0.0026823885273188353, 0.0022499915212392807, 0.002206472447142005"
img49.png,uresCS Confeder Fich Quint,"ures, iska, tern, fore, Trying, bay, uv, COUNT, ears, guarante","0.007941004820168018, 0.005310553591698408, 0.00379528128542006, 0.003442170796915889, 0.0032462761737406254, 0.003073512576520443, 0.0027658618055284023, 0.00265990337356925, 0.0024890063796192408, 0.0022840406745672226"
img50.png,eros� blinderos Princess,"eros, Tel, duty, Single, tel, schemes, Single, bay, neh, singles","0.004446941427886486, 0.004210279788821936, 0.00364369316957891, 0.003422932932153344, 0.0033176203723996878, 0.0033176203723996878, 0.003240767866373062, 0.003104465315118432, 0.0028156281914561987, 0.002804650692269206"
img51.png,settlement quvex tiadding,"settlement, Polit, tern, cs, Kel, ham, arda, ures, inci, bird","0.005109718069434166, 0.0048757269978523254, 0.00459824874997139, 0.004526959266513586, 0.0036233323626220226, 0.0032479341607540846, 0.003027407918125391, 0.003027407918125391, 0.002866291906684637, 0.002832898637279868"
img52.png,mys Quint Sultan Literodel,"mys, Tel, industrial, expect, imper, tern, bay, itle, iec, priority","0.007231283932924271, 0.006766678765416145, 0.006161130964756012, 0.005948292091488838, 0.004072259180247784, 0.003707833820953965, 0.003002695506438613, 0.002865192014724016, 0.0026602409780025482, 0.0024990651290863752"
img53.png,Rawoti Brigiskaatel,"Raw, Tel, iska, industrial, uv, Gun, -(, b, bay, duty","0.007901806384325027, 0.004449860192835331, 0.004262704402208328, 0.004229532089084387, 0.004147725645452738, 0.0033458354882895947, 0.0033197980374097824, 0.0032811209093779325, 0.003217658493667841, 0.0028618446085602045"
img54.png,fore_ucci Ponodel,"fore, gen, nit, duty, pill, inci, Raw, tern, priority, activity","0.00695919431746006, 0.0056799291633069515, 0.00409109890460968, 0.003710465971380472, 0.003186151385307312, 0.0030165875796228647, 0.0027681763749569654, 0.002530317986384034, 0.002530317986384034, 0.0024620669428259134"
img55.png,uv Quint Mediteronneachim,"uv, fore, mys, tern, aglia, COUNT, gress, bay, agg, Tel","0.017199791967868805, 0.006528304424136877, 0.004908611066639423, 0.004248048644512892, 0.003734274534508586, 0.0031568817794322968, 0.002942537423223257, 0.0028408861253410578, 0.002775077009573579, 0.0027642580680549145"
img56.png,bay Squadдияcs Gil,"bay, industrial, sle, ister, uster, Raw, hoofd, fore, Monday, conflict","0.0355398915708065, 0.005100045818835497, 0.005020976532250643, 0.004195183049887419, 0.003241786267608404, 0.0029059182852506638, 0.0025946933310478926, 0.0025845773052424192, 0.002390343463048339, 0.0022987709380686283"
img57.png,tern_ tel坂uta,"tern, riv, clock, nit, ters, eros, iec, versions, тан, defin","0.01819249987602234, 0.008200001902878284, 0.006461446639150381, 0.004672220442444086, 0.0035267765633761883, 0.0031613821629434824, 0.0030048515181988478, 0.0030048515181988478, 0.0028672493062913418, 0.002735948422923684"
img58.png,Dum Sloachimtel brig,"Dum, Marco, abb, iec, compt, bay, guarante, ltre, priority, tern","0.006428221240639687, 0.005125024821609259, 0.003705865005031228, 0.0032449637074023485, 0.003120651002973318, 0.0031084849033504725, 0.003012846689671278, 0.0028192733880132437, 0.0026796814054250717, 0.0026278516743332148"
img59.png,iska_ trav Quinteli,"iska, bay, tern, schließ, priority, Tel, Dy, inci, riority, Raw","0.008928473107516766, 0.005457866471260786, 0.005457866471260786, 0.005289945285767317, 0.0036074290983378887, 0.002932819304987788, 0.0028204643167555332, 0.0025580504443496466, 0.0025580504443496466, 0.0025480773765593767"
img60.png,terscs radamaruta,"ters, ias, hoofd, tern, atra, tel, industrial, bay, etu, skin","0.010798940435051918, 0.004662744700908661, 0.004278775304555893, 0.003424688708037138, 0.0031549709383398294, 0.0028838766738772392, 0.002784252166748047, 0.0024763650726526976, 0.002109889406710863, 0.0020771785639226437"
img61.png,aus Net Gil Girachim,"aus, Dum, bay, arus, arrang, Jay, ing, li, bou, industrial","0.007272303570061922, 0.006123893894255161, 0.005982033908367157, 0.0037728215102106333, 0.003600051160901785, 0.003227065084502101, 0.0030792872421443462, 0.0029845472890883684, 0.0028367722406983376, 0.002728097140789032"
img62.png,agliaakersкраadilem,"aglia, ador, compte, tt, pri, atra, bay, za, Klaus, tern","0.008197511546313763, 0.004073944874107838, 0.003567265812307596, 0.0032101913820952177, 0.003197676269337535, 0.003123602131381631, 0.0029229128267616034, 0.0028440719470381737, 0.0027781892567873, 0.002470972714945674"
img63.png,bay素 Ferd rad Bud,"bay, tern, aglia, industri, ber, rå, Según, enza, hoofd, nit","0.02697502076625824, 0.00418551592156291, 0.003962766844779253, 0.0034028005320578814, 0.0030029609333723783, 0.0029564043506979942, 0.0028320616111159325, 0.0027881546411663294, 0.0027449284680187702, 0.002702372381463647"
img64.png,gress Rel nonachimuf,"gress, ias, ies, arus, horn, industrial, uv, Cos, Dum, industri","0.003957553766667843, 0.003167586401104927, 0.003155236830934882, 0.0030462376307696104, 0.002964070765301585, 0.0027413172647356987, 0.002719984157010913, 0.0027093798853456974, 0.002515573985874653, 0.0024573011323809624"
img65.png,mys neither preventforearam,"mys, priority, gress, genre, tim, trat, ior, ru, riority, тан","0.011826422065496445, 0.005652257241308689, 0.0049299863167107105, 0.004316840320825577, 0.004119157325476408, 0.0034822546876966953, 0.0031093035358935595, 0.0031093035358935595, 0.0030610982794314623, 0.0027980701997876167"
img66.png,Costa boardenvaggunes,"Costa, industrial, b, bara, hair, za, tar, mot, id, S","0.00473997974768281, 0.003481416031718254, 0.003072338877245784, 0.0029662034939974546, 0.0028749429620802402, 0.0026176651008427143, 0.002497793873772025, 0.002497793873772025, 0.002478355774655938, 0.0020869846921414137"
img67.png,guarante Fonennen Girazzo,"guarante, ltre, Raw, Sequence, 景, Quint, NOT, constru, horn, tel","0.007508361712098122, 0.005408070515841246, 0.003129950724542141, 0.003069411963224411, 0.0030100445728749037, 0.0028276750817894936, 0.002677188953384757, 0.002615171717479825, 0.0025948204565793276, 0.0025746270548552275"
img68.png,ias din sooneresty Circle,"ias, bay, Tel, ies, imm, industrial, Cart, aglia, {, camp","0.006219219882041216, 0.005574872717261314, 0.0040154303424060345, 0.0035297893919050694, 0.0033030027989298105, 0.0033030027989298105, 0.0031394597608596087, 0.0029148897156119347, 0.002643690211698413, 0.002483517164364457"
img69.png,tern virt Wahlere Ferd,"tern, Según, uru, Net, ters, Param, ia, Jew, guarante, industrial","0.0164882130920887, 0.01023776549845934, 0.008067164570093155, 0.007490108720958233, 0.005087896715849638, 0.0033628942910581827, 0.003061950206756592, 0.002820800757035613, 0.0026088145095854998, 0.00238464935682714"
img70.png,ternvíaggatel Ferd,"tern, Riv, 鳥, gly, ias, Dy, FI, industri, Tel, ador","0.01090692263096571, 0.0041560037061572075, 0.003769331844523549, 0.0036107986234128475, 0.0032240801956504583, 0.0030644447542726994, 0.0028341482393443584, 0.0027255737222731113, 0.001986298244446516, 0.001932721002958715"
img71.png,guarante Quint lip Heart heart,"guarante, pill, industri, b, aglia, uv, ador, 鳥, bird, tern","0.005546992179006338, 0.005110128782689571, 0.004991753026843071, 0.004122174344956875, 0.0038875811733305454, 0.0034576859325170517, 0.0025495379231870174, 0.0023950692266225815, 0.002348744310438633, 0.0023304664064198732"
img72.png,norunt quadr Gall Parad,"nor, industrial, riv, <0x80>, fore, Sequence, aus, uv, absolute, conte","0.00497560715302825, 0.004408143926411867, 0.0043567875400185585, 0.003982426133006811, 0.0038298615254461765, 0.002994373207911849, 0.0028572508599609137, 0.002769342390820384, 0.0026736741419881582, 0.002561223227530718"
img73.png,iasoust動ivotow,"ias, bay, ies, nor, bas, fore, eth, tern, aus, b","0.014354086481034756, 0.013379479758441448, 0.007331350352615118, 0.006649245973676443, 0.003291615517809987, 0.003240583697333932, 0.0032279498409479856, 0.003140881424769759, 0.003068123012781143, 0.002985365455970168"
img74.png,ternales tel aeratel,"tern, mys, uv, Raw, nor, raw, duty, iska, Mys, ika","0.006547567900270224, 0.004827873781323433, 0.004809051752090454, 0.0038341102190315723, 0.0036018132232129574, 0.003504660679027438, 0.0032035191543400288, 0.0030212062411010265, 0.0028050951659679413, 0.002645456464961171"
img75.png,bay素素telhof,"bay, uster, Raw, aglia, industrial, schließ, raw, fore, ltre, trat","0.01450112834572792, 0.005011456087231636, 0.004138445481657982, 0.0036664593499153852, 0.003484920598566532, 0.0034175158943980932, 0.0028221746906638145, 0.002549622440710664, 0.0024423885624855757, 0.0023305434733629227"
img76.png,Gruachim exeratelкра,"Gru, inci, FI, settlement, Raw, tern, ters, iba, abs, priority","0.007301021832972765, 0.0046772100031375885, 0.003277998883277178, 0.0029846515972167253, 0.002847974421456456, 0.002836871426552534, 0.0027388702146708965, 0.002685896120965481, 0.002503529889509082, 0.0021921640727669"
img77.png,ias素achim Dresglob,"ias, gress, Tel, golden, Marco, tel, sle, Gy, tern, Raw","0.006026261951774359, 0.00430677505210042, 0.0038007155526429415, 0.003433660138398409, 0.0030899597331881523, 0.002802472095936537, 0.002622415078803897, 0.0025318225380033255, 0.0024925703182816505, 0.002415881957858801"
img78.png,uvfest mit CircleXml,"uv, bay, industrial, aglia, Raw, tern, uchar, b, iska, Ball","0.00882015936076641, 0.005761851090937853, 0.005717011634260416, 0.005562804639339447, 0.004199025686830282, 0.003960058558732271, 0.003467543050646782, 0.0034540239721536636, 0.0029428654816001654, 0.002732357941567898"
img79.png,Dy素 exemmoz Africa,"Dy, tel, зу, schemes, mys, Raw, industrial, Singles, Tel, Polit","0.0031524228397756815, 0.00301983579993248, 0.002984653925523162, 0.002961427206173539, 0.0026858975179493427, 0.002654606243595481, 0.002361055463552475, 0.002252934966236353, 0.0022441516630351543, 0.002003801753744483"
img80.png,nor canton Bay Ot brig,"nor, mys, tern, Cart, Sent, bay, Count, Kirk, b, horn","0.013109850697219372, 0.006801301147788763, 0.0053384024649858475, 0.003126049879938364, 0.0029366519302129745, 0.002747973892837763, 0.0026323979254812002, 0.002492304192855954, 0.0024156239815056324, 0.0022960184141993523"
