img161.png,Dy Gru Frederick Wahl anal,"Dy, guarante, mys, aglia, rå, Rotten, fore, Schmidt, Tel, nor","0.007340618409216404, 0.006657651625573635, 0.004182558041065931, 0.004166251979768276, 0.003975465428084135, 0.0032573796343058348, 0.002954315161332488, 0.0027970895171165466, 0.0027645023074001074, 0.0027537245769053698"
img162.png,gall marucci Eb sens,"gall, industrial, bay, nor, Gall, constru, Polit, fore, schemes, gal","0.005305721424520016, 0.005223464220762253, 0.004347352311015129, 0.003896941663697362, 0.0038515408523380756, 0.003106912598013878, 0.0030349406879395247, 0.002774160820990801, 0.002535788109526038, 0.0022642039693892"
img163.png,prioritytel素素tabs,"priority, Schmidt, blind, trat, pri, ias, guarante, bel, nit, io","0.007525768131017685, 0.0050328634679317474, 0.004406922496855259, 0.004028253722935915, 0.0033395395148545504, 0.0032367927487939596, 0.0031618124339729548, 0.002970247995108366, 0.0027794113848358393, 0.002757781883701682"
img164.png,myscsfogiw丸,"mys, tern, ska, industrial, aus, тан, gau, horn, Dy, Klaus","0.0117854755371809, 0.0047991094179451466, 0.004268416203558445, 0.0039941733703017235, 0.0032094083726406097, 0.0026399872731417418, 0.0025190936867147684, 0.002432070206850767, 0.0023850298020988703, 0.002284718444570899"
img165.png,tersiska recre vice recre,"ters, тан, agg, hoofd, mys, Poz, nor, fore, industrial, Raw","0.005713264457881451, 0.005367115139961243, 0.005022281780838966, 0.004608704708516598, 0.0038357044104486704, 0.0036033105570822954, 0.0035336161963641644, 0.0030461677815765142, 0.0024191485717892647, 0.0024097170680761337"
img166.png,nor dist Pil cellyk,"nor, priority, nit, andy, mys, industrial, Jew, trat, ut, sle","0.009035368449985981, 0.005088219419121742, 0.004669211804866791, 0.004561050329357386, 0.0036936509422957897, 0.0028878771699965, 0.002865403424948454, 0.002691797446459532, 0.0026294419076293707, 0.0024701321963220835"
img167.png,iskaкраucci Ferdкло,"iska, ska, va, nor, Marco, ani, bay, Tel, Krak, cs","0.01647123508155346, 0.011058264411985874, 0.008990306407213211, 0.005895986221730709, 0.004645925480872393, 0.004627812188118696, 0.0039583779871463776, 0.0038216342218220234, 0.003506928216665983, 0.00295313005335629"
img168.png,Rawversion Hinwohl Rolle,"Raw, ias, raw, inci, endeav, slow, industrial, horn, cos, iod","0.012346651405096054, 0.006064471323043108, 0.0057867588475346565, 0.00407149363309145, 0.0035790724214166403, 0.0034825329203158617, 0.003284341422840953, 0.003271537134423852, 0.0029671553056687117, 0.0024028755724430084"
img169.png,arel Dum Aless BaldPager,"arel, amar, aglia, tern, duty, wers, riv, cs, b, bay","0.022390216588974, 0.006364983040839434, 0.005705534014850855, 0.005035116337239742, 0.004513449035584927, 0.004273247439414263, 0.00414177356287837, 0.0034336510580033064, 0.0032256166450679302, 0.002983207581564784"
img170.png,mys neitherreader listen recre,"mys, schließ, ias, ani, eros, priority, nit, zk, Rout, Schmidt","0.009529502131044865, 0.005160900764167309, 0.004572304897010326, 0.003010326763615012, 0.0029177090618759394, 0.0027302480302751064, 0.0027196037117391825, 0.002574868965893984, 0.0022634551860392094, 0.0021938160061836243"
img171.png,fore constraints simult丸 Slo,"fore, eth, mys, ister, dist, neither, duty, tern, til, Quint","0.0039504230953752995, 0.003682199167087674, 0.003432187018916011, 0.003137272782623768, 0.0028676996007561684, 0.0028232401236891747, 0.0026110701728612185, 0.002530735917389393, 0.0024817869998514652, 0.0023681377060711384"
img172.png,tern素zastil丸,"tern, atra, fore, mys, ters, imm, ister, imm, Compet, aglia","0.01026027463376522, 0.006174742244184017, 0.005000458564609289, 0.0038041481748223305, 0.0036157916765660048, 0.002951123286038637, 0.0025840899907052517, 0.002427527913823724, 0.0022189400624483824, 0.002201672177761793"
img173.png,uv industrial Wahl prevent Ferd,"uv, ters, industrial, scheme, Tel, Raw, bay, vu, ltre, sa","0.008574110455811024, 0.005756385624408722, 0.0035325800999999046, 0.0033576698042452335, 0.003241677535697818, 0.0027619441971182823, 0.0026561354752629995, 0.0025844909250736237, 0.0025147784035652876, 0.0024469466879963875"
img174.png,езirerendVDention,"ез, mys, uv, arrang, pri, ingly, тан, atz, uffle, ters","0.0046674697659909725, 0.004316703882068396, 0.00386946857906878, 0.0037357963155955076, 0.0036635389551520348, 0.00329682813026011, 0.0028980982024222612, 0.0027979817241430283, 0.002421451499685645, 0.002283646259456873"
img175.png,mys observüsNetendo,"mys, uv, onderwerp, tern, preference, 🌍, fore, 坂, Raw, iska","0.008243323303759098, 0.0053640324622392654, 0.00473374268040061, 0.003476835088804364, 0.0031410586088895798, 0.003068296005949378, 0.0028823972679674625, 0.002686689607799053, 0.0026142208371311426, 0.0022712743375450373"
img176.png,ska素absativiec,"ska, ias, Vier, őd, schemes, guns, esti, aka, iers, Tel","0.009107773192226887, 0.005459784995764494, 0.0028435855638235807, 0.002832499099895358, 0.0027453526854515076, 0.002671301132068038, 0.0023390694987028837, 0.0021464508026838303, 0.0021380826365202665, 0.0018794951029121876"
img177.png,танmentasia Sadкло,"тан, Quint, industrial, pret, uv, horn, eth, Jew, raw, ingly","0.006321477238088846, 0.0038793657440692186, 0.003672909690067172, 0.003532202448695898, 0.0034101810306310654, 0.003279539290815592, 0.003266753163188696, 0.002871660515666008, 0.0027188335079699755, 0.0026871580630540848"
img178.png,ternamar sooneratelesty,"tern, ias, mys, bay, 🌍, Gy, eros, trat, mitt, Según","0.013387604616582394, 0.011814519762992859, 0.008377749472856522, 0.0077481516636908054, 0.0062015424482524395, 0.004363329615443945, 0.0034787498880177736, 0.00302239041775465, 0.0024571858812123537, 0.0024476060643792152"
img179.png,egos accommod Stre Huducci,"egos, fore, Sent, aglia, nor, settlement, industrial, Marco, industri, nit","0.005072055384516716, 0.00460015470162034, 0.004355338867753744, 0.0037545368541032076, 0.003431924618780613, 0.002993377624079585, 0.002981707453727722, 0.0028787031769752502, 0.0027684220112860203, 0.002757628681138158"
img180.png,iskaª Caval動,"iska, Poz, Raw, mb, mys, rå, trat, fore, til, itle","0.012761516496539116, 0.011261998675763607, 0.004640004597604275, 0.004062923602759838, 0.00403130566701293, 0.0036705457605421543, 0.0035995508078485727, 0.003316061571240425, 0.002949366346001625, 0.0027383940760046244"
img181.png,horn attentionygód rad,"horn, bay, cs, тан, trat, Jew, industrial, iw, clock, цен","0.007255236618220806, 0.006205732934176922, 0.005694699939340353, 0.005287350621074438, 0.005185083951801062, 0.004231942351907492, 0.0041826386004686356, 0.0034004610497504473, 0.0028746826574206352, 0.002586934482678771"
img182.png,tern素 Corn Vittдок,"tern, ters, Raw, Gru, uv, Rece, arrang, sa, cs, nit","0.012036454863846302, 0.0041923122480511665, 0.003201825777068734, 0.003127655480057001, 0.0031033160630613565, 0.0029152955394238234, 0.002881331369280815, 0.002770949387922883, 0.0027067605406045914, 0.0027067605406045914"
img183.png,eros WahllvrafCS,"eros, mys, tern, uv, aglia, ltre, rå, ters, nor, mit","0.015226112678647041, 0.009163237176835537, 0.006836191285401583, 0.005689583253115416, 0.00506041944026947, 0.002316828817129135, 0.002109496621415019, 0.0019282359862700105, 0.0018616243032738566, 0.0018471371149644256"
img184.png,ipo Mediterae compacttags,"ipo, bay, tern, Schmidt, mys, nit, aglia, ere, b, Marco","0.008935452438890934, 0.007207938469946384, 0.006311482284218073, 0.004406124819070101, 0.0033651222474873066, 0.0030639783944934607, 0.003052033483982086, 0.0029581321869045496, 0.002414356917142868, 0.002349233953282237"
img185.png,terniska rad Ferd tim,"tern, 鳥, sa, Trying, dia, fou, industri, ut, iska, bay","0.012459339573979378, 0.004637564066797495, 0.004289045464247465, 0.004222550429403782, 0.004092636052519083, 0.003065242664888501, 0.0030413889326155186, 0.0028683028649538755, 0.002823833841830492, 0.002823833841830492"
