img163.png,spons  Hop Hop pil,"spons, exchange, ivot, ora, LA, COM, exchange, ad, coh, BI","0.012501336634159088, 0.010404535569250584, 0.009966935031116009, 0.005590943619608879, 0.003198091872036457, 0.0030516404658555984, 0.0028667510487139225, 0.002822306239977479, 0.002180909039452672, 0.0021055685356259346"
img164.png,ivot dest​ Hop Death,"ivot, death, ets, heut, spons, 바, Cup, illing, Death, TC","0.005866462364792824, 0.003772906493395567, 0.003316597081720829, 0.0032907871063798666, 0.002781966468319297, 0.002582968445494771, 0.0021246918477118015, 0.002091751666739583, 0.0020835967734456062, 0.0020593220833688974"
img165.png,ora hop tottot Rost,"ora, lass, ger, ko, ink, tempt, unity, exchange, ivot, dest","0.006889473646879196, 0.004362143110483885, 0.0029515738133341074, 0.002534495899453759, 0.002514772117137909, 0.0024952020030468702, 0.0024278981145471334, 0.0022630500607192516, 0.0020685950294137, 0.002020676154643297"
img166.png,sponsznik Ts adj tempt,"spons, Warner, atti, ivot, ging, ko, iny, rite, ting, lev","0.0072592562064528465, 0.005249110981822014, 0.004489801824092865, 0.0036501833237707615, 0.003109995275735855, 0.0029791928827762604, 0.0028206431306898594, 0.002809646539390087, 0.002598498249426484, 0.002598498249426484"
img167.png,spons Bian temptznik Hall,"spons, aining, 限, limits, iro, limit, tempt, remaining, ais, friendship","0.024037176743149757, 0.003395905252546072, 0.0030440697446465492, 0.0030086059123277664, 0.0029046719428151846, 0.002859639236703515, 0.002782505238428712, 0.0027180486358702183, 0.002665476640686393, 0.0025039836764335632"
img168.png,Cup et et et et,"Cup, spons, switch, cup, aining, ais, ets, iled, bos, ic","0.005237168166786432, 0.004603765904903412, 0.004224652890115976, 0.004046970047056675, 0.003277336247265339, 0.003264558967202902, 0.0030548132490366697, 0.003007452702149749, 0.002612920245155692, 0.0025623817928135395"
img169.png,sponsaшка dash,"spons, ivot, dest, COM, ora, ter, sc, u, col, exchange","0.012798876501619816, 0.010487023741006851, 0.005314564798027277, 0.004973107483237982, 0.00447531184181571, 0.004320710431784391, 0.003753898199647665, 0.0033781430684030056, 0.003287023399025202, 0.002735703717917204"
img170.png,ichailer twice​ celebrated,"icha, ated, Cup, limits, terror, LA, zi, exchange, spons, cha","0.005178981926292181, 0.003909300547093153, 0.0036014162469655275, 0.003203165950253606, 0.003020873526111245, 0.003009096020832658, 0.002882537432014942, 0.0028712996281683445, 0.0027505364269018173, 0.002604155568405986"
img171.png,sponsivers MO emptyya,"spons, enso, ми, ivot, ting, dest, Ru, arrival, switch, arts","0.008810956962406635, 0.007333129178732634, 0.0042773764580488205, 0.004033950157463551, 0.0036586339119821787, 0.0032924143597483635, 0.00304498546756804, 0.002962852129712701, 0.002827172866091132, 0.0025943599175661802"
img172.png,col Claude Boema wet,"col, exchange, dest, Cup, friendship, iled, mixture, assass, cup, switch","0.005257859360426664, 0.004603935871273279, 0.004078861325979233, 0.0038467319682240486, 0.0033160902094095945, 0.003115178784355521, 0.002960935700684786, 0.0029493917245417833, 0.002858648542314768, 0.0026541652623564005"
img173.png,sponsa  Hop reign,"spons, 1, coh, , cho, Cup, ivot, 2, friendship, terror","0.008484773337841034, 0.007755710743367672, 0.007285816129297018, 0.0050467378459870815, 0.004778155125677586, 0.004740970674902201, 0.0037504169158637524, 0.0037504169158637524, 0.0036922721192240715, 0.003133590565994382"
img174.png,zi _ hopus Magn,"zi, switch, tempt, ora, ivot, dest, ivers, iny, Switch, COM","0.00479293754324317, 0.004115662071853876, 0.003973484970629215, 0.0038063651882112026, 0.003732743440195918, 0.0034120038617402315, 0.0034120038617402315, 0.0026469111908227205, 0.0026160741690546274, 0.0024575740098953247"
img175.png,overflowovi et cod et,"overflow, tempt, ivot, dest, switch, ated, ating, Switch, illing, spons","0.005525353830307722, 0.004689306952059269, 0.0032864767126739025, 0.0029003054369241, 0.0028110721614211798, 0.0025998170021921396, 0.0025795851834118366, 0.0025495318695902824, 0.002490472048521042, 0.0024327803403139114"
img176.png,spons Bian  Hop Wo,"spons, aining, ko, mixture, cha, coup, ku, friendship, remaining, feedback","0.004379726015031338, 0.003344960743561387, 0.0033059907145798206, 0.0026564381550997496, 0.0025347911287099123, 0.0022810648661106825, 0.0021345079876482487, 0.0020688362419605255, 0.002052736235782504, 0.002044733613729477"
img177.png,"spons, Rù fam","spons, ivot, arts, ting, ми, racy, death, margin, enso, zi","0.010815367102622986, 0.005353995133191347, 0.004597438499331474, 0.002922309562563896, 0.002888263436034322, 0.002366558648645878, 0.0022145085968077183, 0.002154775895178318, 0.001985072623938322, 0.0019466779194772243"
img178.png,exchange Maria threat a Schne,"exchange, ivot, pool, ko, lev, dest, viol, switch, ora, ivers","0.009032443165779114, 0.00431691762059927, 0.0034959467593580484, 0.0033489116467535496, 0.003183095483109355, 0.002831103978678584, 0.0027333020698279142, 0.00252789119258523, 0.0024405638687312603, 0.002421571407467127"
img179.png,tempt H tempt玉emat,"tempt, insp, iny, ter, dest, COM, stable, zi, occasionally, death","0.005683124531060457, 0.0050744591280817986, 0.004077442456036806, 0.004045711364597082, 0.0037416715640574694, 0.003367139957845211, 0.003276317147538066, 0.003018284449353814, 0.0029714906122535467, 0.0024442814756184816"
img180.png,spons​ tom viol,"spons, ad, death, switch, mixture, ging, exchange, Switch, ora, viol","0.0034274791833013296, 0.0027756572235375643, 0.002732624765485525, 0.002617694204673171, 0.0025973229203373194, 0.0025570550933480263, 0.0025075972080230713, 0.002439959207549691, 0.002310106996446848, 0.002283193403854966"
img181.png,ora rel uns even even,"ora, ko, ivot, χ, heut, NR, LA, viol, assass, td","0.007259102072566748, 0.006088945083320141, 0.00410392414778471, 0.003579506417736411, 0.0033364666160196066, 0.002921507926657796, 0.002921507926657796, 0.002798633184283972, 0.0022312647197395563, 0.0021626160014420748"
img182.png,ter Hop activationus Magn,"ter, coh, aining, spons, ku, ad, ting, cha, Ad, col","0.006231509614735842, 0.005785760469734669, 0.004872099030762911, 0.00466718478128314, 0.004367321729660034, 0.0042329528369009495, 0.0030848209280520678, 0.002966643311083317, 0.0028529930859804153, 0.0028307908214628696"
img183.png,iversye  Anero,"ivers, ated, ting, Ru, icha, ating, spons, dest, ivot, arts","0.005170595366507769, 0.004838387947529554, 0.004634891636669636, 0.004286574199795723, 0.004042624495923519, 0.003338387468829751, 0.0032356760930269957, 0.0029461162630468607, 0.0028891332913190126, 0.002746082376688719"
img184.png,sponsNI destudaemo,"spons, exchange, ora, ter, Ru, dest, ivot, death, icha, ging","0.01129219215363264, 0.007463683839887381, 0.006984146311879158, 0.005460547748953104, 0.003887262661010027, 0.0035671526566147804, 0.003197575220838189, 0.0025593070313334465, 0.0025000208988785744, 0.0023121414706110954"
img185.png,sponsellaengo​ tot,"spons, u, ivot, switch, exchange, zi, dest, Ru, eye, amar","0.012885970994830132, 0.0034278063103556633, 0.0030250283889472485, 0.002722230739891529, 0.0023558943066745996, 0.0022834111005067825, 0.002256808802485466, 0.0022392459213733673, 0.0022305159363895655, 0.0020872068125754595"
