img82.png,sponsNIania TsInfl,"spons, ivot, ku, cha, ko, zi, Cup, unity, enso, cho","0.006021120585501194, 0.003680637339130044, 0.003623574273660779, 0.003273626323789358, 0.0031853257678449154, 0.002911623800173402, 0.0028777022380381823, 0.0022853596601635218, 0.0022853596601635218, 0.002088987734168768"
img83.png,exchange et assass AnTC,"exchange, spons, switch, exchange, tempt, GN, icha, ging, TC, dest","0.010353158228099346, 0.006478841416537762, 0.003182299667969346, 0.002931671915575862, 0.002797420835122466, 0.0027756511699408293, 0.0025973173324018717, 0.002212942112237215, 0.0021957207936793566, 0.0021448570769280195"
img84.png,tinggedLoader bout +,"ting, zi, spons, iny, aining, ivot, eye, dest, ging, colon","0.008230711333453655, 0.007792680524289608, 0.005150647833943367, 0.004371297545731068, 0.004187446553260088, 0.00369540904648602, 0.0031732218340039253, 0.0030755922198295593, 0.0029005594551563263, 0.00233066501095891"
img85.png,spons Bian exampleiro,"spons, ais, zi, ko, LA, switch, 奈, tempt, ми, Ad","0.009475858882069588, 0.0035270655062049627, 0.003513314761221409, 0.0033393583726137877, 0.002801058581098914, 0.0026519889943301678, 0.0026006947737187147, 0.0025503928773105145, 0.0025206799618899822, 0.002377227647230029"
img86.png,ivot et apparlezampion,"ivot, ting, spons, switch, margin, death, rupt, ging, icha, zi","0.004541544709354639, 0.0032711520325392485, 0.0027761906385421753, 0.002265860792249441, 0.002239462686702609, 0.0022307317703962326, 0.002204742981120944, 0.002162099350243807, 0.0020550463814288378, 0.0017440952360630035"
img87.png,tempt  temptged fam,"tempt, ad, ivot, ko, dest, spons, death, assass, Bian, fetch","0.004586989060044289, 0.003558423602953553, 0.0028929775580763817, 0.0026547457091510296, 0.0026443959213793278, 0.0025932483840733767, 0.002445666119456291, 0.002379698446020484, 0.002288533840328455, 0.002253053244203329"
img88.png,spons Bian  flight dest,"spons, dest, ivot, ato, mixture, eye, death, switch, impossible, pool","0.003658563829958439, 0.003450354328379035, 0.0022451882250607014, 0.0021931785158813, 0.002184628276154399, 0.0021257016342133284, 0.0021257016342133284, 0.002012573881074786, 0.0019891266711056232, 0.0019129244610667229"
img89.png,sponsa Lov hel下,"spons, ko, dest, switch, ora, Ru, coup, terror, Switch, oup","0.006778687704354525, 0.003953973762691021, 0.0031647207215428352, 0.0029268881771713495, 0.002749557141214609, 0.002696375595405698, 0.002407592721283436, 0.002141356933861971, 0.0021081583108752966, 0.002027396112680435"
img90.png,ivot et etGNBI,"ivot, lev, LA, zi, cho, ora, ting, heut, Bian, spons","0.005007125902920961, 0.004418773110955954, 0.0036776296328753233, 0.003649009857326746, 0.003620613133534789, 0.0034279273822903633, 0.0031089955009520054, 0.0028641403187066317, 0.002517741173505783, 0.002402445301413536"
img91.png,ting HopTasks activais,"ting, exchange, zi, ania, illing, spons, switch, tempt, ivot, icha","0.0056992159225046635, 0.0038113552145659924, 0.0034567490220069885, 0.002777575980871916, 0.0025488468818366528, 0.0025389099027961493, 0.002413199981674552, 0.002366524189710617, 0.0022581531666219234, 0.0022581531666219234"
img92.png,sponsi Alexandre dest​,"spons, margin, Cup, margin, viol, switch, zi, cup, ivot, pairs","0.0077254511415958405, 0.0033487353939563036, 0.0030017870012670755, 0.0029094316996634007, 0.0027331579476594925, 0.002557554515078664, 0.002365351188927889, 0.002337794052436948, 0.002328679896891117, 0.002239469438791275"
img93.png,"ziverse, et dest","zi, icha, Met, ting, ating, ku, spons, Arte, tempt, ivot","0.0054122284054756165, 0.003577264491468668, 0.0034807741176337004, 0.0032826822716742754, 0.0032191898208111525, 0.0030241485219448805, 0.0029425774700939655, 0.002596815349534154, 0.0025366602931171656, 0.0024204980581998825"
img94.png,spons Bian destznik dest,"spons, switch, zi, LA, dest, signals, Ru, Warner, Bian, remaining","0.04078966751694679, 0.0032706581987440586, 0.0026383339427411556, 0.0025772168301045895, 0.0024784852284938097, 0.0024210710544139147, 0.002355766948312521, 0.00232832133769989, 0.0022303953301161528, 0.0021034630481153727"
img95.png,COMged dest et​,"COM, dest, spons, lem, LA, iled, Bian, Alt, friendship, switch","0.006849593482911587, 0.005951030179858208, 0.004671016708016396, 0.004616598132997751, 0.003286470891907811, 0.0032355189323425293, 0.002900300547480583, 0.0027139580342918634, 0.002703377278521657, 0.00259981257840991"
img96.png,sponsovilect dest et,"spons, zi, COM, ting, friendship, LA, AT, cent, exchange, NR","0.015688229352235794, 0.00715459231287241, 0.00435646390542388, 0.0031624536495655775, 0.0026526707224547863, 0.0026217661798000336, 0.0023871450684964657, 0.00217352039180696, 0.002139823278412223, 0.002098435303196311"
img97.png,ensoovi oldalemo Magn,"enso, Ru, arts, pairs, ets, ating, death, ais, spons, zi","0.006601126864552498, 0.004466546233743429, 0.0037319387774914503, 0.0030698091723024845, 0.002940697129815817, 0.002719700103625655, 0.0026566984597593546, 0.002636023797094822, 0.002574960235506296, 0.002515311585739255"
img98.png,ivotbotbot pilarning,"ivot, ting, COM, zi, LA, 바, lev, switch, margin, aining","0.006262028589844704, 0.004599329549819231, 0.0030281194485723972, 0.002833564532920718, 0.0020489278249442577, 0.0020489278249442577, 0.0020329831168055534, 0.0020014645997434855, 0.0019474783912301064, 0.001924789627082646"
img99.png,spons repeatedged deathuss,"spons, coh, ivot, iled, col, cha, exchange, ku, ivers, mixture","0.008320623077452183, 0.006480107549577951, 0.004759503062814474, 0.0033749938011169434, 0.0032711559906601906, 0.0032456994522362947, 0.003207885893061757, 0.002711883280426264, 0.0026079928502440453, 0.0023105533327907324"
img100.png,ivot dest etoupsagn,"ivot, spons, friendship, ic, ting, pool, COM, ad, terror, ivers","0.01168261282145977, 0.008219745010137558, 0.005143784452229738, 0.004610859323292971, 0.00426434725522995, 0.0037339874543249607, 0.0037194297183305025, 0.0032314963173121214, 0.0031198628712445498, 0.0030595194548368454"
img101.png,zi et Tamus exist,"zi, exchange, dest, spons, COM, exchange, ivot, switch, cha, col","0.009779920801520348, 0.0058627137914299965, 0.0058627137914299965, 0.004512691870331764, 0.0034465116914361715, 0.0028129608836025, 0.002482428913936019, 0.002482428913936019, 0.002269124146550894, 0.002182195195928216"
img102.png,ets​atom fresh​,"ets, dest, ging, spons, ated, ivot, switch, atti, influenced, iro","0.012454796582460403, 0.008660951629281044, 0.004338020924478769, 0.003949813544750214, 0.003261743811890483, 0.0031245595309883356, 0.003076117718592286, 0.0030521792359650135, 0.0028784791938960552, 0.0025802520103752613"
img103.png,death infateuns hel,"death, switch, Ru, Cup, overflow, tempt, Switch, zi, catch, exchange","0.003865756094455719, 0.003438274608924985, 0.003192329779267311, 0.003179884282872081, 0.003010653890669346, 0.002762731397524476, 0.0026362165808677673, 0.002428596606478095, 0.002344699576497078, 0.0023355584125965834"
img104.png,etsiusExceptionano Tom,"ets, switch, spons, arrival, dest, viol, enso, eye, death, COM","0.003881237469613552, 0.0032939636148512363, 0.0029526897706091404, 0.002515723230317235, 0.0024864140432327986, 0.0023357700556516647, 0.0019978899508714676, 0.0019746136385947466, 0.001783914864063263, 0.001770032336935401"
img105.png,zi temptiling destzug,"zi, iny, exchange, spons, ter, ivot, ets, icher, tempt, ation","0.00681106373667717, 0.006448585540056229, 0.005602628458291292, 0.0045018382370471954, 0.004035421647131443, 0.002698691561818123, 0.002595306374132633, 0.0025550697464495897, 0.0024571868125349283, 0.002428559586405754"
img106.png,ivot destuda Hollywood tempt,"ivot, spons, lev, tempt, LA, COM, Cup, colon, fect, illing","0.004902292508631945, 0.003954519983381033, 0.003544809063896537, 0.0027823522686958313, 0.0026445884723216295, 0.0021838934626430273, 0.002175379078835249, 0.002133303554728627, 0.0018462203443050385, 0.0018390226177871227"
img107.png,tempt ilerA somehow,"tempt, spons, zi, train, switch, friendship, dest, ми, lev, remaining","0.012657895684242249, 0.011525144800543785, 0.0036836573854088783, 0.003654991276562214, 0.0036407415755093098, 0.003446984803304076, 0.002748176222667098, 0.0026223277673125267, 0.0020907020661979914, 0.002058288548141718"
img108.png,tempt​ tom Bo tempt,"tempt, spons, ora, lev, terror, ging, iny, ter, td, detected","0.010077073238790035, 0.006017295178025961, 0.0031957614701241255, 0.003073333529755473, 0.0029671641532331705, 0.0028423690237104893, 0.002537950174883008, 0.002498602494597435, 0.0024028827901929617, 0.002239733003079891"
img109.png,switch Finally acceler  stra,"switch, spons, ivot, ting, COM, ween, zi, ï, coming, friendship","0.007421303074806929, 0.007334842812269926, 0.007306247018277645, 0.004829133860766888, 0.0030695844907313585, 0.0027623269706964493, 0.00257477187551558, 0.00257477187551558, 0.0024664802476763725, 0.002409344306215644"
img110.png,atedoboxove tempt Statistics,"ated, ting, tempt, icha, ikan, ating, cha, A, ith, lev","0.009344274178147316, 0.007596842013299465, 0.005536299664527178, 0.0050016301684081554, 0.004943359177559614, 0.0038348825182765722, 0.003331803949549794, 0.0033188145607709885, 0.0032292951364070177, 0.002951814327389002"
img111.png,sponsella pur Bian dest,"spons, Cup, cho, dest, heut, friendship, cup, col, u, iny","0.0038379887118935585, 0.003373808693140745, 0.0030599115416407585, 0.0029084046836942434, 0.002863314002752304, 0.002710931235924363, 0.002700362354516983, 0.0026793479919433594, 0.0026481326203793287, 0.002383061684668064"
img112.png,sponsaxrainaiscolumns,"spons, exchange, coh, ku, LA, ivot, fect, dest, coup, iny","0.009933747351169586, 0.004305960610508919, 0.0026736317668110132, 0.0026528253220021725, 0.002621919149532914, 0.002571206772699952, 0.00242487876676023, 0.0023319830652326345, 0.002286878414452076, 0.0022514236625283957"
img113.png,ting Hop lowcs�,"ting, ko, orem, zie, ating, ivers, ll, ivot, Ru, spons","0.014241703785955906, 0.005598959978669882, 0.0030679767951369286, 0.002793424529954791, 0.002655112650245428, 0.002533526159822941, 0.0025040097534656525, 0.0021003668662160635, 0.0017344767693430185, 0.0016680300468578935"
img114.png,sponsaarrowboot salv,"spons, Cup, exchange, ora, illon, zi, lev, exchange, remaining, mixture","0.009007061831653118, 0.003527216147631407, 0.0031127575784921646, 0.0025705057196319103, 0.002452793763950467, 0.0023588284384459257, 0.0023132048081606627, 0.0022596195340156555, 0.0022508101537823677, 0.002156144008040428"
img115.png,sponschalish Lov et,"spons, Warner, ting, etti, dest, enso, ad, Arte, ko, switch","0.005543861538171768, 0.004950111266225576, 0.004723428748548031, 0.004071850795298815, 0.003915860317647457, 0.00336252199485898, 0.003146482165902853, 0.0027876286767423153, 0.00249881437048316, 0.0024697021581232548"
img116.png,ets prop Wor​ Tom,"ets, lifted, tempt, ет, ivot, cup, illing, ato, ​, heut","0.004485724028199911, 0.004036714788526297, 0.0037773584481328726, 0.0035346655640751123, 0.0034662988036870956, 0.003035192843526602, 0.0028962010983377695, 0.0028962010983377695, 0.0024869476910680532, 0.0024293374735862017"
img117.png,ensoiler Sc tempt dest,"enso, spons, Warner, Ru, COM, Claude, tempt, 바, dest, LA","0.004963506478816271, 0.004829624202102423, 0.003371621249243617, 0.0025952295400202274, 0.002466730773448944, 0.002409589011222124, 0.0023537708912044764, 0.002263599308207631, 0.0022372277453541756, 0.0022111632861196995"
img118.png,sponsegenPages worse T,"spons, icha, ated, Cup, exchange, illing, switch, cha, tempt, ivot","0.010287146084010601, 0.006590192671865225, 0.003076719120144844, 0.0030290193390101194, 0.002550689736381173, 0.0025209735613316298, 0.002501355018466711, 0.00246257521212101, 0.0022422003094106913, 0.0022074382286518812"
img119.png,stable Knowïania Ts,"stable, dest, lev, spons, zi, fond, rapp, coh, death, nag","0.005765079520642757, 0.005631531588733196, 0.004950433969497681, 0.004489848390221596, 0.00416868319734931, 0.0031962404027581215, 0.002787810517475009, 0.0027232307475060225, 0.002508757868781686, 0.002498977119103074"
img120.png,spons  destiling stri,"spons, tempt, dest, remaining, ivot, death, coup, switch, Roth, illing","0.013883054256439209, 0.007489345967769623, 0.005719893611967564, 0.004705056548118591, 0.003523923922330141, 0.003375712549313903, 0.002876143204048276, 0.002733735367655754, 0.002548121614381671, 0.0022399427834898233"
img121.png,spons Bian fail transfer rela,"spons, ivot, mixture, exchange, cha, viol, ora, death, dest, mez","0.004882120992988348, 0.004825242795050144, 0.003953662235289812, 0.0034619420766830444, 0.0027709035202860832, 0.0024453140795230865, 0.002398017095401883, 0.0021495686378329992, 0.0019118660129606724, 0.0017820551292970777"
img122.png,zifectoExample pair,"zi, spons, switch, eye, exchange, ging, ets, iny, ◄, ivot","0.004077886696904898, 0.0035567961167544127, 0.0031758612021803856, 0.0027270899154245853, 0.002705867402255535, 0.0023417333140969276, 0.002278568921610713, 0.002278568921610713, 0.0021912783849984407, 0.002050490118563175"
img123.png,sponsovi dest Bo dest,"spons, dest, zi, ift, ated, ko, switch, tempt, An, NI","0.009471839293837547, 0.004186717327684164, 0.0039639039896428585, 0.0032352441921830177, 0.0031726688612252474, 0.0027243488002568483, 0.0025493111461400986, 0.002413639333099127, 0.0022762787993997335, 0.0022762787993997335"
img124.png,spons  Psompcin,"spons, coup, lev, Cup, col, iny, cha, col, coh, ets","0.007121019996702671, 0.003767200745642185, 0.00355280889198184, 0.00327300070784986, 0.0032602406572550535, 0.003184717148542404, 0.0027453978545963764, 0.00243228767067194, 0.0023945786524564028, 0.002357454039156437"
img125.png,cup Bo hop et et,"cup, ter, pairs, spons, cha, ets, Cup, ko, friendship, GN","0.0048611899837851524, 0.004693258088082075, 0.00465673441067338, 0.004443487152457237, 0.004306775517761707, 0.004045841284096241, 0.0035288454964756966, 0.003030194900929928, 0.0027698222547769547, 0.0027482674922794104"
img126.png,"tempt​ tom, tempt","tempt, ivot, switch, ania, gn, atum, Switch, iny, dest, GN","0.005855737254023552, 0.005587583873420954, 0.004854576662182808, 0.0037513261195272207, 0.0037513261195272207, 0.003402305068448186, 0.0030379164963960648, 0.0027552705723792315, 0.002639387734234333, 0.002422038232907653"
img127.png,ting Hopмец pil example,"ting, ging, switch, Ru, icha, iny, dest, spons, overflow, exchange","0.005537827964872122, 0.0037324733566492796, 0.0036889889743179083, 0.0032938963267952204, 0.002987433923408389, 0.0025354023091495037, 0.002419297816231847, 0.0022816150449216366, 0.002021398860961199, 0.0019668752793222666"
img128.png,sponsela sumettiey,"spons, fond, orem, tempt, limit, cup, exchange, 一, dest, limits","0.003965890966355801, 0.003874021116644144, 0.0036822049878537655, 0.003300707321614027, 0.003300707321614027, 0.002580654341727495, 0.002443314529955387, 0.0022774196695536375, 0.00225088675506413, 0.002190172905102372"
img129.png,ivot dest Tam dest Hall,"ivot, lev, pair, death, Ru, Yam, ko, ikan, dest, ting","0.006726336199790239, 0.004225708078593016, 0.0030915942043066025, 0.0028039540629833937, 0.002583123743534088, 0.0025630216114223003, 0.0024744810070842505, 0.0024361175019294024, 0.0020354525186121464, 0.001965136732906103"
img130.png,sponsiter verseibile,"spons, ora, COM, ivot, ad, ella, exchange, dest, switch, 바","0.008494952693581581, 0.004321882035583258, 0.0032369401305913925, 0.0031496291048824787, 0.0030646733939647675, 0.0029936800710856915, 0.0026213538367301226, 0.0025111031718552113, 0.0024818480014801025, 0.0022863855119794607"
img131.png,switchivity  GeorgA,"switch, ets, Pages, ivot, dest, spons, iem, AT, ais, detected","0.00475901598110795, 0.0046852342784404755, 0.0029549403116106987, 0.0029091283213347197, 0.002383654238656163, 0.00231031677685678, 0.0020072381012141705, 0.0018636573804542422, 0.0018276111222803593, 0.0017852744786068797"
img132.png,ets  ninilerR,"ets, exchange, spons, tempt, ◄, AT, ting, switch, icha, arrival","0.005251923110336065, 0.0038725254125893116, 0.0030277299229055643, 0.0028331999201327562, 0.00221513444557786, 0.002197895897552371, 0.002138611627742648, 0.0020566824823617935, 0.0020566824823617935, 0.00203272164799273"
img133.png,sponsitch et et et,"spons, margin, ivot, iny, 바, icha, ган, ora, GN, ting","0.0039038630202412605, 0.0029931957833468914, 0.002822852460667491, 0.0023957237135618925, 0.0023770800326019526, 0.0023678126744925976, 0.0021984397899359465, 0.0021984397899359465, 0.0021984397899359465, 0.002172827022150159"
img134.png,sponsella  Anne hop,"spons, ku, terror, iny, ivot, ko, Ru, ter, Cup, lev","0.0073388791643083096, 0.006084144581109285, 0.004149026237428188, 0.003576684044674039, 0.0028404640033841133, 0.002668368862941861, 0.0026579659897834063, 0.002647603629156947, 0.0025761888828128576, 0.0023092806804925203"
img135.png,sponsovi et ax Bo,"spons, cha, ting, AT, zi, ets, ating, ko, ated, ora","0.010068686679005623, 0.005223565734922886, 0.005182915832847357, 0.004849916789680719, 0.004591808654367924, 0.0037771188654005527, 0.0037040633615106344, 0.0027312044985592365, 0.0023729116655886173, 0.002152137691155076"
img136.png,sponsye​ metal tempt,"spons, switch, ora, ting, COM, Switch, dest, ais, tempt, Switch","0.014692735858261585, 0.0034898307640105486, 0.0034491729456931353, 0.0030797647777944803, 0.0030084222089499235, 0.002904494758695364, 0.0026862183585762978, 0.0025432605762034655, 0.0024362942203879356, 0.00237057963386178"
img137.png,sponselamania sp tempt,"spons, arts, occasion, tempt, Cup, Ru, ivot, cha, ated, ora","0.013561557047069073, 0.003946637734770775, 0.0033625776413828135, 0.003208594163879752, 0.003025992540642619, 0.002910068491473794, 0.002853782381862402, 0.0024794091004878283, 0.0022312270011752844, 0.0021373843774199486"
img138.png,dest H Dest hop Eisen,"dest, 바, switch, Switch, COM, coming, ora, exchange, heut, gn","0.005513167008757591, 0.0035735000856220722, 0.0034771107602864504, 0.002697419375181198, 0.0026349336840212345, 0.0023619395215064287, 0.0022803451865911484, 0.0021589873358607292, 0.0021589873358607292, 0.002084403997287154"
img139.png,ziilerexampleAorem,"zi, ivot, conditional, zie, spons, dest, COM, LA, friendship, 바","0.005617719609290361, 0.004531631246209145, 0.0022433202248066664, 0.0022171849850565195, 0.002208540914580226, 0.002182810567319393, 0.002165823709219694, 0.0021322458051145077, 0.001964316703379154, 0.001964316703379154"
img140.png,enso et Boampionwor,"enso, heut, margin, ting, pairs, ivot, icano, margin, 바, ko","0.006415307056158781, 0.003891080617904663, 0.0028467753436416388, 0.0027699884958565235, 0.002571847289800644, 0.002115543931722641, 0.002082745311781764, 0.0020029565785080194, 0.0019873694982379675, 0.0018816035008057952"
img141.png,ivot et twice Re reign,"ivot, ting, iny, ets, switch, cup, cha, ging, illing, orem","0.005004247650504112, 0.0036469122860580683, 0.0030950941145420074, 0.002565923146903515, 0.002318118466064334, 0.002211964223533869, 0.0020860808435827494, 0.0019068323308601975, 0.0018846170278266072, 0.001848165295086801"
img142.png,ets et  eye Bo,"ets, switch, dest, tempt, NI, worst, viol, iny, eting, spons","0.0031081156339496374, 0.002807948738336563, 0.002689849818125367, 0.0022650808095932007, 0.0022650808095932007, 0.0020146046299487352, 0.0020067503210157156, 0.0019298730185255408, 0.0019148545106872916, 0.0018851675558835268"
img143.png,sponsznik Hopuss dest,"spons, occasion, ets, iny, switch, ivot, zi, exchange, eman, COM","0.0051850187592208385, 0.0027971079107373953, 0.0027110499795526266, 0.002576816361397505, 0.002546795643866062, 0.002411257941275835, 0.0022387770004570484, 0.002111367881298065, 0.0020068269222974777, 0.0019375002011656761"
img144.png,ting Hop planned et dest,"ting, zi, ating, switch, ging, Ru, spons, icha, ated, LA","0.006235680542886257, 0.003197339130565524, 0.003027179976925254, 0.0026610619388520718, 0.002470712410286069, 0.0023760609328746796, 0.0023667975328862667, 0.002321019535884261, 0.002302957233041525, 0.0021133122500032187"
img145.png,zi et consedenemat,"zi, ivot, spons, exchange, BI, ko, switch, dest, icha, ania","0.011717885732650757, 0.007745049428194761, 0.005020151846110821, 0.0039557842537760735, 0.0032794601283967495, 0.0028492442797869444, 0.0026044202968478203, 0.0024181222543120384, 0.0024086949415504932, 0.0020927106961607933"
img146.png,spons Bian? Hopinho,"spons, switch, , zi, tempt, terror, ora, ating, Y, death","0.02165190689265728, 0.004116228315979242, 0.0035902380477637053, 0.003493397729471326, 0.003333423286676407, 0.0029997562523931265, 0.0027743210084736347, 0.0022118815686553717, 0.0021946686320006847, 0.0019596186466515064"
img147.png,spons Bian  dest Bian,"spons, iled, exchange, remaining, u, friendship, Claude, LA, icha, COM","0.008311307989060879, 0.004195545334368944, 0.004162895493209362, 0.0035330031532794237, 0.0035330031532794237, 0.003424304071813822, 0.0026255049742758274, 0.0025447269435971975, 0.0023534875363111496, 0.002344312146306038"
img148.png,iny�A TomA,"iny, tag, ivot, BI, switch, COM, ting, ivers, ми, tagon","0.0040450068190693855, 0.0031625842675566673, 0.0030059937853366137, 0.002642438281327486, 0.0025711627677083015, 0.0025511537678539753, 0.0025116021279245615, 0.0024438558612018824, 0.0024248375557363033, 0.0024153839331120253"
img149.png,spons Lov Tam,"spons, ivot, zi, icha, col, ora, ger, coh, ko, east","0.021734261885285378, 0.006154424045234919, 0.005102196708321571, 0.0036321599036455154, 0.003520410042256117, 0.003333057276904583, 0.0033071187790483236, 0.002839800203219056, 0.0023727419320493937, 0.0023634913377463818"
img150.png,sponsaoris momania,"spons, occasion, tempt, switch, 바, ko, uns, ora, lev, COM","0.007802736945450306, 0.003395474050194025, 0.0032526645809412003, 0.003239983692765236, 0.0025630381423979998, 0.0023155121598392725, 0.0021837358362972736, 0.0021582941990345716, 0.0021248331759124994, 0.001965149538591504"
img151.png,ora et et wz dest,"ora, spons, Switch, dest, death, switch, ko, ad, ivot, cup","0.007286036852747202, 0.0061594718135893345, 0.00502721406519413, 0.004350691102445126, 0.004167706705629826, 0.003495878539979458, 0.003061093855649233, 0.00278715742751956, 0.002649155678227544, 0.001923080999404192"
img152.png,spons Bian combinationAsync special,"spons, ivot, ting, switch, zi, ora, cha, ais, icha, ating","0.009346014820039272, 0.004004000220447779, 0.0031550759449601173, 0.003069973085075617, 0.0027304906398057938, 0.002719845389947295, 0.002677678130567074, 0.00265684025362134, 0.002409649547189474, 0.002228561555966735"
img153.png,spons LouAus aer,"spons, zi, COM, switch, ku, iny, ad, LA, Cup, overflow","0.0063899485394358635, 0.003936733119189739, 0.0034471184480935335, 0.0033150615636259317, 0.0028466202784329653, 0.0028134561143815517, 0.0021655946038663387, 0.002132020192220807, 0.0021154286805540323, 0.002018555998802185"
img154.png,tempt cons tempt et et,"tempt, spons, occasion, NR, ora, dest, Ru, zi, switch, Switch","0.007147773634642363, 0.006137743592262268, 0.004561183974146843, 0.004438153933733702, 0.004201959352940321, 0.003916657064110041, 0.003679358633235097, 0.003552253358066082, 0.0035246098414063454, 0.0034971809946000576"
img155.png,spons  Hopius,"spons, zi, ting, ating, COM, ated, ми, zie, arrival, enso","0.015524139627814293, 0.010260829702019691, 0.006272319238632917, 0.005261230748146772, 0.005079478956758976, 0.004679435398429632, 0.004624918103218079, 0.003894571680575609, 0.0037600318901240826, 0.003370471065863967"
img156.png,oralect hel et et,"ora, LA, ko, tempt, Polit, Bian, LO, overflow, ​, Switch","0.0047531346790492535, 0.004129594657570124, 0.003477467456832528, 0.0034235545899719, 0.0031662704423069954, 0.003009497420862317, 0.0026871785521507263, 0.002475544810295105, 0.0023529720492661, 0.0022452217526733875"
img157.png,ivot et et Ru appar,"ivot, ko, zie, spons, arts, ')[, tempt, Bian, Ru, zi","0.006750704254955053, 0.00529868807643652, 0.00384643510915339, 0.0036990807857364416, 0.0032772037666291, 0.00260262843221426, 0.0024737634230405092, 0.0024545122869312763, 0.0023148255422711372, 0.002287857234477997"
img158.png,LAgedemo� «,"LA, delet, tempt, Ru, illing, ko, NR, assass, friendship, Cup","0.005669370759278536, 0.0041316295973956585, 0.0035478018689900637, 0.00311871781013906, 0.002895631594583392, 0.00279560056515038, 0.002457490423694253, 0.002419390482828021, 0.0022728072945028543, 0.0022201575338840485"
img159.png,death BoschnittPatternbot,"death, Calcul, exchange, mixture, ets, eting, uns, viol, enough, lif","0.003632169682532549, 0.002999434946104884, 0.0029071522876620293, 0.0023913581389933825, 0.0023913581389933825, 0.002335962373763323, 0.0021858783438801765, 0.0021103660110384226, 0.0020137254614382982, 0.0020058744121342897"
img160.png,spons dest dest  repeated,"spons, switch, heut, ivot, unity, DP, dest, margin, catch, 바","0.0046514421701431274, 0.004352590534836054, 0.003871273947879672, 0.003665248630568385, 0.0036367252469062805, 0.0031720080878585577, 0.0028433699626475573, 0.002470362465828657, 0.002385022584348917, 0.002154688350856304"
img161.png,Cup et et tempt<<,"Cup, cha, spons, ting, ora, ko, viol, ad, terror, overflow","0.004043893422931433, 0.0033656267914921045, 0.003149387426674366, 0.0028563702944666147, 0.0027793247718364, 0.002662430051714182, 0.0022862099576741457, 0.0022684186697006226, 0.0022419907618314028, 0.002164540346711874"
img162.png,spons dest dest  sp,"spons, switch, zi, dest, , ting, ad, etti, terror, Rico","0.01353450771421194, 0.006596192251890898, 0.005889737047255039, 0.0054898387752473354, 0.0049790674820542336, 0.0036857030354440212, 0.0030317765194922686, 0.002814909443259239, 0.0027389819733798504, 0.002533144084736705"
