img159.png,agh Pia extrem equivalentSEE,"agh, SEE, lifetime, lifted, distinction, Rav, Gallery, ome, Library, near","0.006505440454930067, 0.004316661972552538, 0.0031829073559492826, 0.0030849797185510397, 0.003060972085222602, 0.0028867716901004314, 0.0025978132616728544, 0.0025080705527216196, 0.0024885525926947594, 0.0024214282166212797"
img160.png,Ged Hilunc sedpio,"Ged, ome, Rav, Festival, lifetime, agh, impossible, Kant, festival, Frederick","0.011539836414158344, 0.004228718113154173, 0.004163157660514116, 0.003057752503082156, 0.0029636751860380173, 0.002895021578297019, 0.002850138582289219, 0.0025152384769171476, 0.0024188810493797064, 0.002159817609935999"
img161.png,aghussen fest lim far,"agh, Kant, tree, lifetime, lifted, Liberal, imet, Organisation, protest, UP","0.011587357148528099, 0.00446732435375452, 0.0043809181079268456, 0.0037471982650458813, 0.0030823610723018646, 0.002895610174164176, 0.002884321380406618, 0.00218572118319571, 0.002093792660161853, 0.00199791113846004"
img162.png,agh statuehip equivalentneur,"agh, SEE, √, ome, Liberal, operators, distinction, ikan, impossible, able","0.004174713045358658, 0.0037715390790253878, 0.0032008637208491564, 0.003078240668401122, 0.003066239645704627, 0.0029372775461524725, 0.0028917393647134304, 0.0027701163198798895, 0.002695397473871708, 0.0022875540889799595"
img163.png,treeouwen Library limit reactjs,"tree, Frei, Cart, Kant, ed, yme, lifetime, near, obi, etch","0.006985351908951998, 0.004934045020490885, 0.00412254873663187, 0.0038127347361296415, 0.0031732392963021994, 0.003063618205487728, 0.002911927876994014, 0.002911927876994014, 0.0027894561644643545, 0.0026102354750037193"
img164.png,Kantussen dos Gestodo,"Kant, imet, Cart, agh, near, lifted, impossible, protest, Rav, esen","0.00740564102306962, 0.005354960449039936, 0.0037676850333809853, 0.0036948116030544043, 0.0029457604978233576, 0.002579394029453397, 0.002569338073953986, 0.0025394042022526264, 0.0023577569518238306, 0.00220627267844975"
img165.png,lifetime primeatti nest Hö,"lifetime, Marcus, Kant, lifted, Rav, tree, SEE, Cost, ups, Frei","0.003472377546131611, 0.0031989042181521654, 0.0031004841439425945, 0.0024913090746849775, 0.0024719214998185635, 0.0021226219832897186, 0.002097892574965954, 0.00201752339489758, 0.0019707875326275826, 0.0019707875326275826"
img166.png,lifted special Wolfin dos,"lifted, agh, SEE, lifetime, Kant, esen, Rav, ouri, ome, imet","0.004375451244413853, 0.004191425628960133, 0.0033027639146894217, 0.0032136777881532907, 0.0026956372894346714, 0.002643499057739973, 0.002572194905951619, 0.002369617111980915, 0.0022260493133217096, 0.0021241111680865288"
img167.png,lifted stamp Gun surrpio,"lifted, agh, Frei, Rav, ussen, ied, imet, Kant, Marcus, Jur","0.00947190448641777, 0.0093250572681427, 0.005812720861285925, 0.0038269953802227974, 0.002992131980136037, 0.0022941473871469498, 0.0022062601055949926, 0.002189090708270669, 0.002016684738919139, 0.001954637933522463"
img168.png,latterpio react NS Buen,"latter, lifetime, impossible, iddle, able, UP, agh, Kap, Library, decid","0.00570819154381752, 0.0039849597960710526, 0.0037581755314022303, 0.003127831034362316, 0.003115636995062232, 0.002803769428282976, 0.002738820156082511, 0.0026032119058072567, 0.0025728836189955473, 0.002542908536270261"
img169.png,treeouwenlimit protest ung,"tree, anci, Platform, Platform, caught, iddle, ed, variable, lifetime, decid","0.004254790022969246, 0.00390441482886672, 0.0035550103057175875, 0.0027794810011982918, 0.002368147252127528, 0.002331432653591037, 0.002259701956063509, 0.0018880516290664673, 0.0018587801605463028, 0.0018015915993601084"
img170.png,agh infrastreft primpb,"agh, lifetime, ema, Kot, protest, Cart, ikan, sed, ip, impossible","0.013516892679035664, 0.013049946166574955, 0.005482694134116173, 0.0033124571200460196, 0.002789368387311697, 0.002569686621427536, 0.0024520123843103647, 0.002432930516079068, 0.002423445461317897, 0.002367306500673294"
img171.png,near Cup-­ react,"near, ouri, Ged, ome, ed, lifted, Liberal, ori, imet, aggi","0.0060878777876496315, 0.0031093840952962637, 0.002943905536085367, 0.002831126330420375, 0.0026595969684422016, 0.0024310683365911245, 0.0023379356134682894, 0.002248370787128806, 0.002153807319700718, 0.002137046307325363"
img172.png,esenesen provinombres mask,"esen, invisible, iza, dou, Cart, anci, tree, Frei, impossible, usc","0.01683318056166172, 0.008870462886989117, 0.004748016130179167, 0.003598018316552043, 0.0033017268870025873, 0.0028351701330393553, 0.0028241167310625315, 0.0025020288303494453, 0.002453635446727276, 0.0023321472108364105"
img173.png,ussents emphasaged electron,"ussen, SEE, Kant, iza, lifetime, ih, Ged, Tasks, hora, travel","0.005752117373049259, 0.004881758708506823, 0.0033683120273053646, 0.0033420994877815247, 0.003164236433804035, 0.0028475045692175627, 0.0025425355415791273, 0.002435599686577916, 0.002388490829616785, 0.0023699034936726093"
img174.png,agh infrastraguabolds stim,"agh, latter, imet, Kant, Rav, Tod, free, phr, anci, Valley","0.008183322846889496, 0.004773289896547794, 0.0046264310367405415, 0.0038354462012648582, 0.003674132516607642, 0.002806072123348713, 0.0026985735166817904, 0.002237195847555995, 0.002085295971482992, 0.0018986836075782776"
img175.png,esenttorome Lawrence trav,"esen, agh, impossible, lifetime, able, Kant, iza, Cart, ago, ome","0.009561209008097649, 0.00713309645652771, 0.006833088584244251, 0.0037883592303842306, 0.0033432149793952703, 0.003291383385658264, 0.0032530378084629774, 0.003128415672108531, 0.0031162190716713667, 0.0028596033807843924"
img176.png,agh Pia ungodouen,"agh, Marcus, Kant, esen, Ged, invisible, ussen, édition, black, Frei","0.02224023826420307, 0.006599932909011841, 0.0051400326192379, 0.003790022572502494, 0.0037458674050867558, 0.003630619263276458, 0.002762029180303216, 0.0026150369085371494, 0.002362489001825452, 0.0022280393168330193"
img177.png,Rav Gedpio hypesen,"Rav, ome, agh, lifetime, Kant, sed, operators, esen, Hass, lifted","0.006654489319771528, 0.00564759224653244, 0.005560033954679966, 0.004485098645091057, 0.004296461120247841, 0.004131866618990898, 0.0030705423559993505, 0.0030347693245857954, 0.0029413995798677206, 0.002884507644921541"
img178.png,ed primUTC doszin,"ed, Ged, impossible, Gallery, agh, obi, distinction, Kant, Cart, Frederick","0.004447164945304394, 0.003924609627574682, 0.0036155199632048607, 0.0032157099340111017, 0.00319068506360054, 0.0027721149381250143, 0.0027721149381250143, 0.0027613078709691763, 0.002739818999543786, 0.002697342075407505"
img179.png,ablenbspedo provin Beau,"able, Kant, lifted, equivalent, SEE, ved, iddle, bother, meeting, Gun","0.003342831041663885, 0.003177315928041935, 0.002675568452104926, 0.0025036646984517574, 0.00243613263592124, 0.0022974919993430376, 0.0022796127013862133, 0.0022268055472522974, 0.001965148840099573, 0.001897261943668127"
img180.png,anci Ehr react equivalentiba,"anci, lifetime, dou, agh, Library, ome, sed, ed, lifted, ete","0.0057657030411064625, 0.0053532738238573074, 0.005028935614973307, 0.004136689472943544, 0.003349993145093322, 0.003285198239609599, 0.002608977258205414, 0.0024895034730434418, 0.002338672522455454, 0.002257881686091423"
img181.png,Library Lakeheimer Eastern slow,"Library, near, Marcus, lifetime, aco, agh, anci, Krie, lifted, 崎","0.004473420325666666, 0.0043188841082155704, 0.004251926206052303, 0.003901786869391799, 0.003651099279522896, 0.00349753862246871, 0.0030865671578794718, 0.0027993950061500072, 0.002766780788078904, 0.0027238859329372644"
img182.png,Ju Gest Gest react ups,"Ju, lifetime, agh, ThreadPool, Frei, anci, Cart, Festival, tree, eded","0.003717120736837387, 0.0034243722911924124, 0.003254819894209504, 0.0027089014183729887, 0.002615321194753051, 0.002466482575982809, 0.0022811235394328833, 0.0022633718326687813, 0.002185182413086295, 0.0020769864786416292"
img183.png,lifetime bet equival Stern react,"lifetime, agh, esen, ed, lifted, eded, ago, aco, near, Kant","0.013630169443786144, 0.008044123649597168, 0.006191783584654331, 0.004205967765301466, 0.003041301853954792, 0.002936238655820489, 0.002845900133252144, 0.002758340910077095, 0.002521327929571271, 0.0025114980526268482"
img184.png,ussen reaction Buenodo ung,"ussen, iddle, Kot, tree, lifetime, sitting, Kant, ed, agh, near","0.006475195288658142, 0.0045737000182271, 0.0037622228264808655, 0.003385634394362569, 0.003217999590560794, 0.003106832504272461, 0.0030348629225045443, 0.0029414899181574583, 0.0025258369278162718, 0.0023820914793759584"
img185.png,agh infrastrihNR ere,"agh, Festival, lifetime, Tod, festival, ed, or, near, celebr, terror","0.006803237367421389, 0.006194417830556631, 0.003213621908798814, 0.003163799410685897, 0.0029489852022379637, 0.0028919465839862823, 0.0022173323668539524, 0.002165967831388116, 0.002107544569298625, 0.0020587234757840633"
