Image File,Inference Result,Top 10 Words,Top 10 Probabilities
img1.png,lifetime Libraryops terror Rod,"lifetime, agh, attached, ome, lifted, SEE, like, Library, jest, esen","0.005442794878035784, 0.005213877651840448, 0.0027049242053180933, 0.0026013001333922148, 0.002531134756281972, 0.0023685109335929155, 0.0022688943427056074, 0.0022076950408518314, 0.0021649941336363554, 0.002156553789973259"
img2.png,agh Pia clean discipline near,"agh, Cart, tree, ago, Kant, Gun, dou, iddle, esen, lifetime","0.007288822904229164, 0.005995622370392084, 0.003811049507930875, 0.0037227666471153498, 0.003679394954815507, 0.0036507616750895977, 0.0033632393460720778, 0.003337066387757659, 0.003337066387757659, 0.003184251021593809"
img3.png,Kantussen Freitranslateentr,"Kant, Frei, ThreadPool, lifted, esen, ori, agh, dou, Frederick, SEE","0.004004362504929304, 0.0034790507052093744, 0.003230188973248005, 0.0026261252351105213, 0.0024766717106103897, 0.002335724188014865, 0.0021019242703914642, 0.0019745749887079, 0.0018841526471078396, 0.0018768070731312037"
img4.png,Kant GedOpedednde,"Kant, agh, ome, Ged, ed, Frei, imet, Rav, ing, near","0.00434892950579524, 0.004264813847839832, 0.0031446765642613173, 0.003132416633889079, 0.0030479251872748137, 0.0025766557082533836, 0.0025466366205364466, 0.00234607164748013, 0.002229909412562847, 0.0021030050702393055"
img5.png,lifetime bet ungichi surr,"lifetime, lifted, building, able, near, Gun, 崎, Kant, Cov, Tod","0.005849748849868774, 0.004663826432079077, 0.003230537986382842, 0.0029994528740644455, 0.002806740114465356, 0.0027097801212221384, 0.002486633835360408, 0.0024769396986812353, 0.002419561380520463, 0.0022377283312380314"
img6.png,esen limit Ju ung echo,"esen, opus, Kant, Rav, Gallery, lifetime, agh, ed, dou, hidden","0.007772819604724646, 0.004826253745704889, 0.004551590420305729, 0.004463554825633764, 0.004446152597665787, 0.0038029963616281748, 0.003408983815461397, 0.003343048272654414, 0.002815128769725561, 0.0027072825469076633"
img7.png,esenstring Houpio Lou,"esen, Kant, agh, lifted, Ged, tree, near, Mate, lifetime, dou","0.01493613887578249, 0.005367414094507694, 0.00385093130171299, 0.003761724568903446, 0.003268243046477437, 0.002525502350181341, 0.002317531034350395, 0.0021686311811208725, 0.002037240657955408, 0.0020135059021413326"
img8.png,Kantussenroc nearrome,"Kant, ome, iddle, attached, anci, latter, Library, lifetime, ting, usc","0.005144370254129171, 0.0035081556998193264, 0.003453766694292426, 0.0032827588729560375, 0.003244513412937522, 0.002807892858982086, 0.0027215026784688234, 0.0024586727377027273, 0.0022828003857284784, 0.0022828003857284784"
img9.png,Kant Buen particolare Meypio,"Kant, agh, anci, Frei, Ged, Gallery, lifetime, attached, imet, ende","0.012833530083298683, 0.00848244596272707, 0.006038496270775795, 0.004166437312960625, 0.004085850901901722, 0.0039447033777832985, 0.0038533243350684643, 0.0032070213928818703, 0.0030127177014946938, 0.0028860068414360285"
img10.png,agh Sah Cart protest Vor,"agh, ed, iddle, Rav, ago, Universal, Cost, esen, sed, ere","0.014999672770500183, 0.0036902145948261023, 0.0036758279893547297, 0.0028293856885284185, 0.002556137042120099, 0.002194936852902174, 0.0021863800939172506, 0.00216090795584023, 0.002119111828505993, 0.0020781245548278093"
img11.png,lifetime Libraryago nearby lif,"lifetime, lifted, Rav, anci, SEE, 崎, Organisation, agh, ups, ódigo","0.005612533073872328, 0.00432012090459466, 0.003390901954844594, 0.003248285036534071, 0.002877820748835802, 0.002661549486219883, 0.002197899390012026, 0.002180795418098569, 0.0020248000510036945, 0.0020090427715331316"
img12.png,agh infrastreftkin relief,"agh, SEE, anci, ago, esen, Rav, esti, bother, ups, terror","0.0044129230082035065, 0.003894391003996134, 0.003759857267141342, 0.0037305981386452913, 0.0033703146036714315, 0.0029511461034417152, 0.002916764235123992, 0.0027615369763225317, 0.00264539010822773, 0.0025046051014214754"
img13.png,agh infrastreft gest Lawrence,"agh, ed, iddle, ago, lifetime, lifted, undle, SEE, ussen, Kant","0.004761799704283476, 0.004072983283549547, 0.0037084934301674366, 0.0029336598236113787, 0.0027884042356163263, 0.002650340786203742, 0.002650340786203742, 0.00226695672608912, 0.002104798099026084, 0.0020884182304143906"
img14.png,agh infrastr Andrewpioello,"agh, invisible, esen, ago, ussen, professor, Kot, eb, ed, anci","0.006747332867234945, 0.0054855430498719215, 0.0038898324128240347, 0.00344620062969625, 0.0032247842755168676, 0.002947691362351179, 0.0028017410077154636, 0.00273683900013566, 0.0026944081764668226, 0.0024822051636874676"
img15.png,etch primAPI Cart Library,"etch, lifetime, ed, Library, Kant, Cov, nest, Rav, tree, ome","0.006924871355295181, 0.004740834701806307, 0.004023494198918343, 0.004007808398455381, 0.0038693563546985388, 0.0032203644514083862, 0.003133500460535288, 0.002638672012835741, 0.0024788030423223972, 0.0024691391736268997"
img16.png,lifetime Libraryagonu arrival,"lifetime, agh, dou, imet, protest, dos, tree, hidden, Library, ome","0.00862725730985403, 0.005591976922005415, 0.00412326492369175, 0.003813396906480193, 0.0033784823026508093, 0.00332610378973186, 0.0032617710530757904, 0.0032237705308943987, 0.0031490917317569256, 0.0028672805055975914"
img17.png,Rav Mey Tod sedreb,"Rav, agh, ema, aco, esen, etch, attached, Ged, gle, compan","0.010005339980125427, 0.007094848435372114, 0.005678645335137844, 0.004800614435225725, 0.004286466632038355, 0.003918147645890713, 0.003173012752085924, 0.002844270085915923, 0.00267194421030581, 0.0026202641893178225"
img18.png,ome Juan eyeran Anton,"ome, agh, lifetime, Ged, impossible, esen, rus, operators, like, Kap","0.007067026570439339, 0.005376310553401709, 0.003709542565047741, 0.0032736598514020443, 0.002992367371916771, 0.002980701392516494, 0.0029003017116338015, 0.002833116566762328, 0.002778319176286459, 0.0027245813980698586"
img19.png,agh Pia extrem accordingly eye,"agh, Ged, Universal, sed, lifetime, Cov, anci, VS, Liberal, building","0.010848426260054111, 0.004813959822058678, 0.003868125844746828, 0.0034003006294369698, 0.00309600867331028, 0.0029198143165558577, 0.0027322182431817055, 0.0023553194478154182, 0.002336990088224411, 0.0022562576923519373"
img20.png,Ged Kantoddisser Mey,"Ged, lifted, esen, Liberal, ouri, dou, imet, impossible, agh, Kant","0.008619810454547405, 0.004087646491825581, 0.0038550174795091152, 0.0037364112213253975, 0.003002290613949299, 0.002670292742550373, 0.0022751179058104753, 0.0022137505002319813, 0.0021794294007122517, 0.0021624688524752855"
img21.png,esen limit Hash tamurm,"esen, agh, lifetime, near, Rav, Library, tree, eded, imet, Liberal","0.005196213722229004, 0.003953070845454931, 0.003757341066375375, 0.0032390302512794733, 0.003090704558417201, 0.0029607133474200964, 0.002847290365025401, 0.0027922187000513077, 0.00275968830101192, 0.0025225593708455563"
img22.png,agh pip near Verb lift,"agh, Kant, esen, lifetime, impossible, Marcus, Tod, Library, lifted, imet","0.014982229098677635, 0.005300506018102169, 0.005197984632104635, 0.0037293718196451664, 0.003356071189045906, 0.0029617224354296923, 0.002563157118856907, 0.0025037818122655153, 0.0025037818122655153, 0.002484296914190054"
img23.png,agh‍|$зда Sieg,"agh, Kant, impossible, upgrad, dou, esen, Ehr, Rav, protest, зда","0.014194860123097897, 0.006837424822151661, 0.00431230990216136, 0.0033847708255052567, 0.0031921430490911007, 0.003130401484668255, 0.003069853875786066, 0.0029754042625427246, 0.0028280816040933132, 0.0027951335068792105"
img24.png,Kantussen fest Ju echo,"Kant, lifted, ago, Ged, agh, Frei, esen, near, lifetime, Krie","0.004650741349905729, 0.0037369756028056145, 0.0032850122079253197, 0.003085983218625188, 0.0030027444008737803, 0.0029331855475902557, 0.0029331855475902557, 0.00237536639906466, 0.0023661055602133274, 0.0023476923815906048"
img25.png,Cartussen particolareDOMurm,"Cart, lifetime, Cart, ome, ting, ed, professor, dou, UP, lifted","0.00742691196501255, 0.003157060593366623, 0.0022212695330381393, 0.002161354525014758, 0.0021529283840209246, 0.0021445350721478462, 0.0020785543601959944, 0.0020304047502577305, 0.001998926280066371, 0.0019911332055926323"
img26.png,agh pipeben Juan Eliz,"agh, lifted, impossible, Library, esen, Gallery, lifetime, tree, Kant, imet","0.010437892749905586, 0.0038549150340259075, 0.003795150201767683, 0.0032461637165397406, 0.0031462900806218386, 0.0028424360789358616, 0.0027983682230114937, 0.0027874582447111607, 0.0027335439808666706, 0.0024407801683992147"
img27.png,protest Ju Villoy Mey,"protest, lifetime, anci, ed, operators, ired, Ged, tree, 书, agh","0.011435658670961857, 0.004638508427888155, 0.0038756183348596096, 0.002387699205428362, 0.0023783904034644365, 0.0020028057042509317, 0.0020028057042509317, 0.001979472115635872, 0.0019260792760178447, 0.0019036398734897375"
img28.png,Kantussen Frei éganni,"Kant, ome, invisible, exclusive, Andrew, Kot, Kap, lifetime, bother, agh","0.009273508563637733, 0.00713807437568903, 0.00558089604601264, 0.004363417159765959, 0.0028615989722311497, 0.002850442659109831, 0.002751972759142518, 0.00247650733217597, 0.002372348913922906, 0.0022026514634490013"
img29.png,agh infrastrih criminal Kant,"agh, Ged, lifetime, Kant, ago, ome, iza, anci, esen, ed","0.007024972699582577, 0.004447936080396175, 0.0038493676111102104, 0.0038343605119735003, 0.003105159616097808, 0.0023165903985500336, 0.002245316281914711, 0.0021762349642813206, 0.0021508813370019197, 0.002044383669272065"
img30.png,ed primrän dosŐ,"ed, Kant, Hass, ome, Cart, esen, anci, Liberal, etch, imet","0.0034121174830943346, 0.0032686081249266863, 0.0029071602039039135, 0.0028398160357028246, 0.0027740320656448603, 0.0026782015338540077, 0.0026573596987873316, 0.00262640044093132, 0.00251593766734004, 0.00238204188644886"
img31.png,ome Scrollrebбяatori,"ome, Cov, anci, tree, Prop, near, lifted, iddle, side, sees","0.005546738393604755, 0.004491885658353567, 0.00428618723526597, 0.003933226224035025, 0.0030275126919150352, 0.00286639085970819, 0.0022149754222482443, 0.0020246515050530434, 0.0019244039431214333, 0.0018579246243461967"
img32.png,agh Pulorr correlatecup,"agh, ome, Kant, lifted, exclusive, near, iddle, Tod, nt, ago","0.010634850710630417, 0.004520703572779894, 0.004132257774472237, 0.003704131580889225, 0.002999697346240282, 0.0029647499322891235, 0.002585900481790304, 0.002290981123223901, 0.002118811011314392, 0.002118811011314392"
img33.png,iddleirasHH lifnbsp,"iddle, Ged, tree, eed, Frei, ema, Dean, like, Anders, esen","0.004191907122731209, 0.0041269175708293915, 0.0035024695098400116, 0.0031766018364578485, 0.0028033412527292967, 0.002664538100361824, 0.002493343548849225, 0.0023606501054018736, 0.002314990619197488, 0.002191789448261261"
img34.png,Cart Platform Gut Pac Newton,"Cart, imet, ed, Kant, Hamb, Tod, Hass, Frei, lifted, Ju","0.006025630980730057, 0.004223032854497433, 0.003951705526560545, 0.0037268130108714104, 0.0035561497788876295, 0.003433300880715251, 0.002994578331708908, 0.0027265946846455336, 0.0025915917940437794, 0.002453669672831893"
img35.png,lifted combrome recre infrastr,"lifted, 崎, agli, terror, Frei, Kant, ódigo, Agent, near, Sample","0.006423664279282093, 0.004163661971688271, 0.002987281419336796, 0.0026882621459662914, 0.002585276495665312, 0.0021349135786294937, 0.0021100412122905254, 0.0020371489226818085, 0.0020134153310209513, 0.0020134153310209513"
img36.png,agh Pia protest far Mey,"agh, esen, caught, lifetime, iddle, ago, Dean, ere, professor, anci","0.008747056126594543, 0.004279660061001778, 0.0038064082618802786, 0.0037620621733367443, 0.003106700023636222, 0.002699147444218397, 0.002506073797121644, 0.002486571203917265, 0.0024768770672380924, 0.002391312038525939"
img37.png,agh infrastr Schwar Gest Kol,"agh, iddle, Kant, Rav, ups, anci, ussen, Ged, invisible, lifted","0.006522561889141798, 0.006371466908603907, 0.004679709207266569, 0.002939949044957757, 0.002676853910088539, 0.0026664177421480417, 0.0024373033083975315, 0.002371561247855425, 0.0023166241589933634, 0.002150912769138813"
img38.png,KantrahPAine.,"Kant, anci, lifted, Frei, ere, agh, ed, esen, lifetime, ago","0.006315980572253466, 0.0038608817849308252, 0.0036554094403982162, 0.003315312322229147, 0.003138874424621463, 0.0030781631357967854, 0.002937203971669078, 0.0027700471691787243, 0.002684821607545018, 0.0024830542970448732"
img39.png,agh infrastr unto Mate ung,"agh, Kant, protest, Tod, Festival, lifetime, tree, near, Ged, festival","0.007807514164596796, 0.003972141537815332, 0.003790243761613965, 0.0029749965760856867, 0.002894751029089093, 0.0026563729625195265, 0.002564607420936227, 0.0024567432701587677, 0.002428121166303754, 0.0023998329415917397"
img40.png,liftedrefix react trou Anders,"lifted, lifetime, esen, 崎, near, Mate, agh, anci, Ged, Kant","0.009920727461576462, 0.00806549470871687, 0.006845096126198769, 0.003915483597666025, 0.0031216952484101057, 0.003097402397543192, 0.0026493484620004892, 0.0024217006284743547, 0.0024028548505157232, 0.002257273066788912"
img41.png,aghUTFkin cuec,"agh, Krie, Kot, Kant, Rav, ome, lifted, near, esen, lifetime","0.013028688728809357, 0.00422979611903429, 0.0038064043037593365, 0.0029413613956421614, 0.002667699009180069, 0.0026469388976693153, 0.0024480181746184826, 0.002391309943050146, 0.002290734788402915, 0.0021943892352283"
img42.png,ome square anti behind far,"ome, operators, Ged, Frei, ih, impossible, sed, UP, hidden, lifted","0.0067030685022473335, 0.00346394837833941, 0.0034235925413668156, 0.0030331348534673452, 0.002666296437382698, 0.002645547268912196, 0.0020928001031279564, 0.0019969637505710125, 0.0019891783595085144, 0.0019355237018316984"
img43.png,agh infrastrgeh eye far,"agh, lifetime, Frederick, ups, hidden, Ju, travel, F, near, Liberal","0.00611563166603446, 0.004474291577935219, 0.003273461712524295, 0.003172747790813446, 0.0029114771168679, 0.0024517097044736147, 0.0024326301645487547, 0.0024326301645487547, 0.002385578816756606, 0.0022498152684420347"
img44.png,nest Beauran Piaershell,"nest, near, esen, ass, ori, agh, lifetime, Frederick, nose, чно","0.004940025042742491, 0.0047507756389677525, 0.004568776581436396, 0.003953946754336357, 0.003953946754336357, 0.003772882279008627, 0.0031034881249070168, 0.0029268681537359953, 0.002870257245376706, 0.0023795270826667547"
img45.png,ago away Ehrpiopackage,"ago, lifted, Rav, Cov, lifetime, ed, ome, agh, anci, Opera","0.006054335739463568, 0.004733575973659754, 0.003729968098923564, 0.003503980813547969, 0.0033175023272633553, 0.00322801829315722, 0.003092252416536212, 0.0029506476130336523, 0.0027718769852072, 0.002739583607763052"
img46.png,ed primränют react,"ed, ec, Kant, near, Universal, IA, Ged, ip, umb, esen","0.004573787562549114, 0.00418078014627099, 0.004115963354706764, 0.0034390161745250225, 0.003346254350617528, 0.0027418225072324276, 0.002400820143520832, 0.0023914603516459465, 0.0021104563493281603, 0.002061567734926939"
img47.png,agh MuodoUTCUP,"agh, ussen, esen, lifetime, aggi, protest, iddle, ódigo, Ju, Universal","0.01283215917646885, 0.004069487098604441, 0.003822929225862026, 0.0028744481969624758, 0.002637741854414344, 0.002536691725254059, 0.0024779289960861206, 0.002256180392578244, 0.0020542754791677, 0.0020224268082529306"
img48.png,ome JuanSB Cost eye,"ome, agh, esen, imet, Tod, anci, 古, ago, Ged, tree","0.007806532084941864, 0.0046252175234258175, 0.00434498954564333, 0.003397125517949462, 0.003141827415674925, 0.002794399159029126, 0.0024660483468323946, 0.0024373182095587254, 0.002418350661173463, 0.0023439459037035704"
img49.png,agh Muodoiras neat,"agh, anci, lifetime, ing, forever, ago, iddle, protest, etch, API","0.010677749291062355, 0.006228276528418064, 0.004052816424518824, 0.003193542594090104, 0.0029651038348674774, 0.0028515122830867767, 0.002840395551174879, 0.002774597844108939, 0.002255731960758567, 0.002229452133178711"
img50.png,invisible honour Ehrran angularjs,"invisible, Kur, 崎, Liberal, Kant, impossible, eded, uc, electron, infrastr","0.009108206257224083, 0.0030868297908455133, 0.003074795240536332, 0.002888502785935998, 0.002866024151444435, 0.002589237177744508, 0.002589237177744508, 0.002559071406722069, 0.0024997906293720007, 0.002451440552249551"
img51.png,SEE Kantrano breast near,"SEE, équ, Kant, Ged, tree, lifetime, édition, Gun, agh, lifted","0.00418831268325448, 0.003813501913100481, 0.0035407165996730328, 0.003458695951849222, 0.0032618611585348845, 0.00298158242367208, 0.002580344444140792, 0.0022418422158807516, 0.0022418422158807516, 0.0021060158032923937"
img52.png,esenttoibaInvoke particular,"esen, agh, Gallery, Frei, lifted, Ged, lifetime, tree, Kant, etch","0.012246103957295418, 0.00492858374491334, 0.00428202748298645, 0.003929409198462963, 0.003605828620493412, 0.003194587305188179, 0.0031205846462398767, 0.002931517781689763, 0.0029087048023939133, 0.002743169665336609"
img53.png,Ged Reformutesaged beh,"Ged, agh, Rav, imet, terror, ago, lifetime, Marcus, Kant, lifted","0.011768336407840252, 0.00716579332947731, 0.00551570812240243, 0.0036031873896718025, 0.003358539892360568, 0.0032552082557231188, 0.0031550561543554068, 0.0028615116607397795, 0.002719828626140952, 0.002719828626140952"
img54.png,liftedquotPages transport pressure,"lifted, Gallery, Kant, esen, Frei, Ged, tree, Tasks, agh, lifetime","0.007696746848523617, 0.005675225518643856, 0.005522145889699459, 0.00537319527938962, 0.004233976360410452, 0.0036929394118487835, 0.003678542096167803, 0.0031711014453321695, 0.002384341089054942, 0.0023109824396669865"
img55.png,liftedrefix reacticha equivalent,"lifted, lifetime, agh, anci, undle, Kant, Ged, Liberal, Gallery, ed","0.0054207853972911835, 0.004321827087551355, 0.0037402294110506773, 0.0034322277642786503, 0.003405517665669322, 0.0028789574280381203, 0.0028232731856405735, 0.0025605978444218636, 0.002443339442834258, 0.002190195256844163"
img56.png,impossibleore Ged adultбя,"impossible, able, dou, Ged, distinction, invisible, iza, lifted, Kant, Liberal","0.00800052285194397, 0.007115812506526709, 0.005308718886226416, 0.0038688003551214933, 0.0036486259195953608, 0.0033876346424221992, 0.0033091602381318808, 0.0028975973837077618, 0.002808447927236557, 0.002658984623849392"
img57.png,lifetime sed VIroot tempt,"lifetime, agh, impossible, esen, Liberal, Kant, near, ago, Library, Jur","0.009014630690217018, 0.004393380135297775, 0.0038620291743427515, 0.0031644331756979227, 0.0028812491800636053, 0.0026961304247379303, 0.002426255028694868, 0.0021664018277078867, 0.0020834084134548903, 0.0019495507003739476"
img58.png,Kantzenajottp nearby,"Kant, Ged, lifetime, Task, anci, agh, lifted, tree, clean, impossible","0.011690043844282627, 0.008257164619863033, 0.004949876107275486, 0.0035652618389576674, 0.003310233587399125, 0.0031096767634153366, 0.002978887874633074, 0.0029557060915976763, 0.00226621818728745, 0.00225738319568336"
img59.png,ed Beaupio reactNS,"ed, agh, near, Opera, Cart, ome, Frei, Krie, Kant, ago","0.008195844478905201, 0.008132063783705235, 0.0042024110443890095, 0.0037965623196214437, 0.0033635676372796297, 0.003260081633925438, 0.0031351898796856403, 0.0028995766770094633, 0.002877012128010392, 0.0024608385283499956"
img60.png,iddleirasoru sightaged,"iddle, esen, lifetime, agh, jest, Rav, Kant, ome, idades, anci","0.006823445204645395, 0.004058580845594406, 0.004042757675051689, 0.00353995687328279, 0.003235782729461789, 0.0029577447567135096, 0.0023397684562951326, 0.002321560401469469, 0.0021724016405642033, 0.0019779943395406008"
img61.png,agh pip nextromeible,"agh, lifted, Kant, Ged, anci, iddle, tree, jest, esen, Rav","0.009147463366389275, 0.007793735712766647, 0.0049346862360835075, 0.004188014194369316, 0.004107010550796986, 0.003186072688549757, 0.003076008753851056, 0.0028448428492993116, 0.0028116994071751833, 0.0027358585502952337"
img62.png,Ged echo equivalent Gunpio,"Ged, anci, iddle, lifetime, UP, protest, Kant, ved, ed, lifted","0.003947416320443153, 0.003751966403797269, 0.0034564733505249023, 0.0033110985532402992, 0.0032597645185887814, 0.003062265692278743, 0.0029796662274748087, 0.0026090829633176327, 0.002460599411278963, 0.002384894760325551"
img63.png,impossibleajo Gedorrurm,"impossible, agh, ome, lifetime, esen, ed, Tod, Unit, variable, free","0.00972734671086073, 0.00942806713283062, 0.007342586759477854, 0.004086764995008707, 0.003158007049933076, 0.0029782846104353666, 0.002853021491318941, 0.0027437240350991488, 0.0025574322789907455, 0.0022746273316442966"
img64.png,esen GestNP reactNS,"esen, lifetime, agh, 崎, Marcus, ago, idades, lifted, free, Frederick","0.004681386053562164, 0.003438380314037204, 0.0033195996657013893, 0.0027844852302223444, 0.0026055837515741587, 0.002585306763648987, 0.002381696132943034, 0.0022373965475708246, 0.0022113302256911993, 0.002202708972617984"
img65.png,agh Piaeme Jules being,"agh, lifetime, invisible, ed, Library, black, agle, Liberal, impossible, SEE","0.011722738854587078, 0.005222293548285961, 0.00422914233058691, 0.00377619918435812, 0.0035612948704510927, 0.002784394659101963, 0.002045079367235303, 0.00203710631467402, 0.0019744313322007656, 0.0019514287123456597"
img66.png,lifetime UP cu near equivalent,"lifetime, agh, tree, anci, lifted, Frei, ThreadPool, near, Gallery, ago","0.00960534904152155, 0.006058017257601023, 0.0033325119875371456, 0.0032680556178092957, 0.0031062429770827293, 0.0030342864338308573, 0.0025352416560053825, 0.0025155118200927973, 0.002110015135258436, 0.0020133904181420803"
img67.png,Todpio� reliefpio,"Tod, ago, agent, professor, parallel, hum, Gallery, nm, ikan, Rav","0.004896031226962805, 0.003857980016618967, 0.003783359657973051, 0.0029695930425077677, 0.002822558395564556, 0.002789674326777458, 0.0026619259733706713, 0.0026002624072134495, 0.0025499688927084208, 0.002358335768803954"
img68.png,aghcloudflareorr gun Kol,"agh, ori, esen, replaced, iddle, HTTP, SEE, ago, Behavior, anci","0.003664502175524831, 0.0027987174689769745, 0.0026705549098551273, 0.0025782992597669363, 0.0025782992597669363, 0.0019235284999012947, 0.0018211600836366415, 0.0017108216416090727, 0.0016261129640042782, 0.0016197734512388706"
img69.png,treepio dos consp ob,"tree, sitting, esen, Rav, distinction, criminal, Frederick, Hass, like, caught","0.0068648867309093475, 0.0033719190396368504, 0.002884155372157693, 0.002565220929682255, 0.0023084490094333887, 0.00225497386418283, 0.0022374254185706377, 0.0020855097100138664, 0.0020773792639374733, 0.0020692802499979734"
img70.png,agh pip tree Kant law,"agh, lifetime, Liberal, Valley, near, Lake, Kap, Rav, Kant, Ju","0.012130536139011383, 0.007444270420819521, 0.0045684021897614, 0.004143360536545515, 0.003139813896268606, 0.0030195293948054314, 0.002675154944881797, 0.002542698523029685, 0.002542698523029685, 0.002360815880820155"
img71.png,agh Pia cleanattioop,"agh, Liberal, near, Kant, lifetime, Library, lifted, iddle, latter, imet","0.007273393217474222, 0.0032912064343690872, 0.0029272595420479774, 0.002904479391872883, 0.0028931559063494205, 0.0027606687508523464, 0.002644558669999242, 0.0026239785365760326, 0.002494056010618806, 0.002361325081437826"
img72.png,Liberalrahetenaggichain,"Liberal, esen, agh, anci, ago, hidden, lifetime, terror, celebr, lifted","0.005531716160476208, 0.005196566227823496, 0.004568074829876423, 0.003937926609069109, 0.0027491156943142414, 0.0026437989436089993, 0.0025030984543263912, 0.002416627947241068, 0.0023884731344878674, 0.002149393316358328"
img73.png,aghpio lawellaoo,"agh, esen, lifetime, Frei, Gallery, lifted, replaced, upgrad, dou, etch","0.009017798118293285, 0.005643194075673819, 0.002815494081005454, 0.002523792441934347, 0.0024943891912698746, 0.0022800564765930176, 0.002235956024378538, 0.0020438292995095253, 0.0020358613692224026, 0.002004298148676753"
img74.png,ome面NP cu echo,"ome, esen, Ged, lifetime, agh, sed, Kant, invisible, tree, free","0.008896570652723312, 0.005375005770474672, 0.00533317681401968, 0.004543923772871494, 0.004508562386035919, 0.0035665668547153473, 0.0034839469008147717, 0.003222124418243766, 0.002922340063378215, 0.002713300520554185"
img75.png,agh Pia cleanAdmin tan,"agh, lifetime, Liberal, ome, anci, tree, ed, iddle, Cost, Marcus","0.009762122295796871, 0.005694195628166199, 0.004231566563248634, 0.0038528854493051767, 0.0037052836269140244, 0.003047883277758956, 0.003047883277758956, 0.0030360003001987934, 0.002965671708807349, 0.0027751291636377573"
img76.png,Cartaggi infrastr faroco,"Cart, Ged, impossible, bother, Tod, invisible, ouri, Krie, Kap, ome","0.00533762713894248, 0.004156948067247868, 0.00395112344995141, 0.0035695426631718874, 0.0035142020788043737, 0.0031501101329922676, 0.003101272275671363, 0.002857025945559144, 0.0027049777563661337, 0.002591209951788187"
img77.png,lifetime primeatosperpeben,"lifetime, latter, near, etch, ikan, Cart, Liberal, imet, agh, sight","0.005462127737700939, 0.004204349592328072, 0.004204349592328072, 0.003582150675356388, 0.0031122262589633465, 0.002693407703191042, 0.0026516499929130077, 0.0026413125451654196, 0.0024428146425634623, 0.0023584263399243355"
img78.png,lifetimeipipo fixed viol,"lifetime, esen, Gallery, agh, Rav, ed, tree, impossible, Tod, Kant","0.011077075265347958, 0.00459960987791419, 0.003739456180483103, 0.00361027498729527, 0.003582179779186845, 0.0029351329430937767, 0.002912291558459401, 0.002386246109381318, 0.002285883529111743, 0.0022592523600906134"
img79.png,lifetime VIts subscriptiondp,"lifetime, agh, ed, iddle, Frei, near, Kant, lifted, Gallery, chor","0.0058207521215081215, 0.004428194835782051, 0.004031917080283165, 0.0038623397704213858, 0.003489333437755704, 0.0026858358178287745, 0.002513272687792778, 0.0024454814847558737, 0.002379518700763583, 0.0023517964873462915"
