img80.png,invisible honour Ehrraned,"invisible, iza, lifetime, agh, protest, near, anci, security, heim, sed","0.011230956763029099, 0.005305128172039986, 0.003646157681941986, 0.003230316797271371, 0.003118723863735795, 0.002605791436508298, 0.002515773056074977, 0.0024574955459684134, 0.0023726001381874084, 0.0023726001381874084"
img81.png,ome squareihboldime,"ome, protest, near, agh, ired, ed, operators, Liberal, Cart, Kant","0.007424083538353443, 0.005431575234979391, 0.0047933487221598625, 0.0039275288581848145, 0.0029073127079755068, 0.0028178642969578505, 0.0028068781830370426, 0.0028068781830370426, 0.0024867565371096134, 0.0022378386929631233"
img82.png,aghbü Hilpio Grande,"agh, Kant, ed, invisible, Library, lifetime, distinction, édition, Kot, anci","0.008153564296662807, 0.004868715535849333, 0.004502825904637575, 0.004467784892767668, 0.003294337773695588, 0.0030467647593468428, 0.0023269280791282654, 0.0022819212172180414, 0.0020696124993264675, 0.00199811696074903"
img83.png,etch decid Stim suc unders,"etch, Kant, anci, latter, dou, ema, ikan, exclusive, Ged, Rav","0.008376814424991608, 0.005893825087696314, 0.003673882456496358, 0.0034512931015342474, 0.002740883268415928, 0.002625605557113886, 0.002544824033975601, 0.002456911839544773, 0.002317088423296809, 0.002219635061919689"
img84.png,liftedaggiibőloremanton,"lifted, Rav, ups, Ged, agh, lifetime, esen, terror, Kant, UP","0.006743643432855606, 0.003623739816248417, 0.0034443160984665155, 0.0033645285293459892, 0.00329945283010602, 0.0028554382734000683, 0.0025396794080734253, 0.002413931069895625, 0.0023672415409237146, 0.002121981466189027"
img85.png,Kantussen Freiüsseben,"Kant, esen, invisible, UP, dou, sitting, fest, Frederick, free, Library","0.00796639733016491, 0.006682225968688726, 0.00518383365124464, 0.004850775469094515, 0.0037337755784392357, 0.0030001727864146233, 0.0026270393282175064, 0.002576227765530348, 0.002439123345538974, 0.002391946269199252"
img86.png,esen limit Gest nut Hil,"esen, lifetime, lifted, ome, ed, Library, anci, Tod, upgrad, Ged","0.006231122184544802, 0.0061345174908638, 0.006110601592808962, 0.0053089819848537445, 0.00431617209687829, 0.004102463833987713, 0.003991806413978338, 0.0036774245090782642, 0.0036062968429178, 0.0031454679556190968"
img87.png,agh piposhi|$ Buen,"agh, iddle, aggi, anci, ago, lifetime, ussen, hidden, near, Gun","0.0066881803795695305, 0.0038708217907696962, 0.0032979813404381275, 0.00328512373380363, 0.0028991117142140865, 0.0026293802075088024, 0.002608917886391282, 0.0021713341120630503, 0.0020081556867808104, 0.001969314645975828"
img88.png,lifetime VI BY protest far,"lifetime, Gallery, etch, building, onk, esen, latter, or, Rav, ome","0.009034177288413048, 0.006112830713391304, 0.004950320813804865, 0.003415618324652314, 0.003122128313407302, 0.0025782440789043903, 0.0025382719468325377, 0.0022139204666018486, 0.002171099418774247, 0.0021374395582824945"
img89.png,agh piposhi dignFootnote,"agh, lifetime, Ged, Rav, Tod, lifted, Stern, Marcus, Kot, Festival","0.007072769571095705, 0.0030301010701805353, 0.002695027505978942, 0.0026223338209092617, 0.0023970070760697126, 0.0023783536162227392, 0.0023414804600179195, 0.0020988895557820797, 0.0020343135111033916, 0.001971724210307002"
img90.png,compan­ ere fun Grund,"compan, Library, Wass, Ged, iden, Kap, Library, esti, ema, gle","0.0038997058290988207, 0.0038997058290988207, 0.003309637540951371, 0.0031580780632793903, 0.00295517360791564, 0.002430859487503767, 0.0021536219865083694, 0.0019917748868465424, 0.0019229681929573417, 0.001915471162647009"
img91.png,lifetimedp Hilodo hardware,"lifetime, Kant, lifted, ed, anci, tree, Mate, side, nest, protest","0.004466878715902567, 0.004067139234393835, 0.0035752449184656143, 0.003268037922680378, 0.0031551423016935587, 0.002952426439151168, 0.0027305481489747763, 0.00248619238846004, 0.0024191313423216343, 0.002290387637913227"
img92.png,impossiblehoraesenza slow,"impossible, tree, dou, Kant, sight, lifted, invisible, ome, imet, pec","0.006855209358036518, 0.006169021129608154, 0.005318028386682272, 0.004995825234800577, 0.0037858057767152786, 0.003515001852065325, 0.0033409621100872755, 0.003030121326446533, 0.002571630524471402, 0.0021910564973950386"
img93.png,SEE Platformбя Hilpio,"SEE, iza, agh, lifetime, lifted, etch, Kap, upgrad, Liberal, esen","0.007040218450129032, 0.0056569743901491165, 0.004320443142205477, 0.003980178851634264, 0.0029119611717760563, 0.0025398575235158205, 0.002395313698798418, 0.002395313698798418, 0.002189493738114834, 0.0018151543335989118"
img94.png,lifetime Librarydpihning,"lifetime, lifted, esen, impossible, distinction, ago, za, Library, SEE, tree","0.006580747663974762, 0.005922032054513693, 0.003219753038138151, 0.003096406115218997, 0.0028974637389183044, 0.0027113037649542093, 0.002577057806774974, 0.0025371043011546135, 0.002374097006395459, 0.002204274293035269"
img95.png,invisible conspбя Gednde,"invisible, Prop, ago, agh, Volume, lifted, iddle, protest, Kant, ago","0.005423750728368759, 0.0038913509342819452, 0.0038160854019224644, 0.0037422755267471075, 0.003276845905929804, 0.0032513453625142574, 0.0032134661450982094, 0.0029719702433794737, 0.002914487151429057, 0.002791907638311386"
img96.png,anci Ehrpioomp Mey,"anci, Rav, ext, uc, Tro, esen, eme, IA, Occ, Ged","0.003375736763700843, 0.002548139775171876, 0.002469741739332676, 0.002365867840126157, 0.002356644021347165, 0.002329188399016857, 0.0023201077710837126, 0.002293077763170004, 0.0021880699787288904, 0.002129050437361002"
img97.png,esenбя rankingita André,"esen, agh, lifetime, ed, ome, Rav, Mate, agas, imet, lifted","0.006075454410165548, 0.004750087391585112, 0.004410306923091412, 0.0030909408815205097, 0.0029958428349345922, 0.0029493963811546564, 0.0026028333231806755, 0.002512917388230562, 0.0024356029462069273, 0.0023978424724191427"
img98.png,aghUTC Gest nearCP,"agh, imet, iddle, Ged, dou, ancient, anci, nm, free, aches","0.008291980251669884, 0.006559496745467186, 0.0039630248211324215, 0.003135010600090027, 0.003050449537113309, 0.0028994109015911818, 0.002843331079930067, 0.002528910990804434, 0.0022757735569030046, 0.0021800578106194735"
img99.png,Cart terrefix far equivalent,"Cart, iddle, aggi, Frei, agh, Rav, Liberal, ussen, ere, Ged","0.0037319280672818422, 0.003280575154349208, 0.003267785534262657, 0.0029292237013578415, 0.002667088760063052, 0.0025850310921669006, 0.0025649142917245626, 0.0025251489132642746, 0.0024570373352617025, 0.002211094368249178"
img100.png,ednewcommandissen Library Lake,"ed, in, anci, sed, ancient, in, Kant, Cart, ved, Hum","0.014014985412359238, 0.004324713721871376, 0.0037720822729170322, 0.003394506638869643, 0.0031764116138219833, 0.0031516929157078266, 0.003007366321980953, 0.002858460880815983, 0.00282515911385417, 0.0025324560701847076"
img101.png,esen limit Miende Ged,"esen, iddle, Krie, lifted, lifetime, sitting, ago, Rav, tree, Kant","0.012831304222345352, 0.005454380530864, 0.004247875884175301, 0.004247875884175301, 0.0035353959538042545, 0.0034534987062215805, 0.0025069708935916424, 0.0025069708935916424, 0.0024874615482985973, 0.00247776391915977"
img102.png,agh infrastrбя benpio,"agh, latter, Gallery, near, sight, moon, Marcus, ago, etch, ema","0.005288221407681704, 0.004777510184794664, 0.003749910509213805, 0.002989689353853464, 0.0028977063484489918, 0.002722143428400159, 0.0026178595144301653, 0.0025873605627566576, 0.0025772734079509974, 0.0022567359264940023"
img103.png,Kantapper Durop react,"Kant, agh, ome, lifetime, tree, iddle, Rav, anci, impossible, protest","0.004838175140321255, 0.004744596779346466, 0.003857329720631242, 0.0038422911893576384, 0.0037386519834399223, 0.0031605828553438187, 0.002480769529938698, 0.0023123316932469606, 0.0022587666753679514, 0.0021637657191604376"
img104.png,esenбяstring�esser,"esen, lifetime, lifted, imet, impossible, tree, hip, Library, Ged, dou","0.007074679713696241, 0.00636652298271656, 0.006122624967247248, 0.00607497850432992, 0.0039840685203671455, 0.0029148065950721502, 0.002738207345828414, 0.0027063062880188227, 0.002685245592147112, 0.0026128157041966915"
img105.png,iddleUTFedo Shaw Gest,"iddle, esen, Kant, dou, édition, works, near, ome, Rav, Liberal","0.005866113118827343, 0.0055539244785904884, 0.005076697561889887, 0.0027709559071809053, 0.0027493920642882586, 0.002532858634367585, 0.0025033499114215374, 0.0023701239842921495, 0.002306194044649601, 0.0022882469929754734"
img106.png,izasono rebanni fest,"iza, Liberal, Kant, lifted, agas, esen, anci, Rav, latter, Universal","0.0047316774725914, 0.004444999620318413, 0.004258049186319113, 0.0039380514062941074, 0.00361375929787755, 0.0034348296467214823, 0.003201613435521722, 0.0030194087885320187, 0.002995911752805114, 0.0028924166690558195"
img107.png,iza virtuelagonŐNP,"iza, jest, ome, operators, SEE, Rav, esti, ende, side, 郡","0.004160201642662287, 0.004079736303538084, 0.004063830710947514, 0.003938799723982811, 0.0038475573528558016, 0.0036144456826150417, 0.0033690340351313353, 0.003008208703249693, 0.0027283267118036747, 0.002696540905162692"
img108.png,esen Hilodo Tod closely,"esen, Kant, Library, ome, variable, lifted, tree, Operator, Juan, Liberal","0.004229556769132614, 0.003896450623869896, 0.0034251997712999582, 0.003411846002563834, 0.0032939822413027287, 0.0032683482859283686, 0.0030703290831297636, 0.002151824301108718, 0.002085619606077671, 0.0020693892147392035"
img109.png,Gallerywerk Lake protest reputation,"Gallery, lifetime, Vil, decid, sitting, с, criminal, operator, happy, near","0.0038930124137550592, 0.0034490181133151054, 0.003202304942533374, 0.0031649968586862087, 0.0027605590876191854, 0.002686097752302885, 0.0026444538962095976, 0.0026341441553086042, 0.002603455213829875, 0.0024939575232565403"
img110.png,Ravaggiagi bou shock,"Rav, Liberal, iza, Ged, lifetime, etch, ago, ome, sed, esen","0.009213391691446304, 0.008194560185074806, 0.006558843422681093, 0.004040786065161228, 0.003781168255954981, 0.003376203356310725, 0.0031469673849642277, 0.0028541753999888897, 0.00272347335703671, 0.0025785325560718775"
img111.png,agh Piakeywordonk Sir,"agh, sight, Kant, latter, Liberal, lifetime, Frei, lifted, building, dou","0.00357446470297873, 0.003318777773529291, 0.0029288113582879305, 0.0027299525681883097, 0.0025247931480407715, 0.0024375729262828827, 0.0023811068385839462, 0.002263210015371442, 0.0022021636832505465, 0.0021935782860964537"
img112.png,lifetime replaced Tododo cred,"lifetime, agh, esen, lifted, Frei, Ged, anci, terror, ago, Marcus","0.008499296382069588, 0.007046164479106665, 0.00693692360073328, 0.0036985918413847685, 0.0034340261481702328, 0.0032767707016319036, 0.003188385395333171, 0.002869236283004284, 0.002846907591447234, 0.0026022843085229397"
img113.png,agh pip equivalŐ Ein,"agh, esen, Library, imet, lifetime, Cov, COVID, Rav, near, ome","0.00656937388703227, 0.004445061087608337, 0.004241506569087505, 0.0035439112689346075, 0.0033684398513287306, 0.0033553079701960087, 0.0026131162885576487, 0.0025625741109251976, 0.0025130093563348055, 0.0021918858401477337"
img114.png,iddleirasHH cu tree,"iddle, Rav, lifetime, ódigo, esen, anci, aggi, sitting, tree, etch","0.008307908661663532, 0.006623642053455114, 0.004808248486369848, 0.0038938382640480995, 0.00336983660236001, 0.0033566984347999096, 0.0025736698880791664, 0.002563636051490903, 0.002514051040634513, 0.002455812878906727"
img115.png,Liberal shock terrorFX ben,"Liberal, anci, Krie, UP, etch, ago, Ju, jest, dou, Tasks","0.0050445361994206905, 0.00403759628534317, 0.0037487808149307966, 0.002256056061014533, 0.0021111059468239546, 0.0019297070102766156, 0.0019146900158375502, 0.0018413392826914787, 0.0018198871985077858, 0.0017916724318638444"
img116.png,ouriaggi crepb security,"ouri, Cart, ago, lifetime, SEE, distinction, Rav, agh, sed, near","0.006118876859545708, 0.0055495803244411945, 0.004897487815469503, 0.004156443756073713, 0.004012857563793659, 0.0033659907057881355, 0.0033008866012096405, 0.0031008957885205746, 0.0027579939924180508, 0.0025908956304192543"
img117.png,agh Pia near lifchter,"agh, SEE, lifetime, iza, ussen, Krie, invisible, fla, Kant, ago","0.01255049742758274, 0.0065878634341061115, 0.0032996712252497673, 0.0032485146075487137, 0.0030279485508799553, 0.0029578059911727905, 0.00263072713278234, 0.0025899414904415607, 0.0024521073792129755, 0.002376663964241743"
img118.png,agh|$ Library Lake Universal,"agh, Kant, anci, Frei, distinction, iddle, esen, ago, lifetime, protest","0.008168837986886501, 0.0036107676569372416, 0.003040571231395006, 0.002600738313049078, 0.0025905990041792393, 0.002510894788429141, 0.002367999404668808, 0.002322198124602437, 0.0021061422303318977, 0.0020979309920221567"
img119.png,agh criminal Kant Sr Mey,"agh, esen, lifted, Gallery, Kant, Ged, tree, Mate, Lake, latter","0.006637774407863617, 0.006091163959354162, 0.004652050323784351, 0.004057590384036303, 0.003963596187531948, 0.0036514359526336193, 0.0027455028612166643, 0.0024706851691007614, 0.0024323808029294014, 0.0023946701548993587"
img120.png,aghamd Mey near troubles,"agh, Frederick, Kant, lifted, Frei, agle, anci, near, ome, Ged","0.007977211847901344, 0.003498625475913286, 0.0034175801556557417, 0.0031484223436564207, 0.0030278079211711884, 0.0029576688539236784, 0.002833273494616151, 0.0025898213498294353, 0.00251014088280499, 0.002461590338498354"
img121.png,agh‍|$ half equivalent,"agh, lifetime, Ju, infrastr, lifted, Kant, ed, Cart, gle, dou","0.006230483762919903, 0.004298904910683632, 0.0038837366737425327, 0.003244983498007059, 0.00315745547413826, 0.0031206703279167414, 0.002874896163120866, 0.0025972521398216486, 0.0025569854769855738, 0.002468653256073594"
img122.png,imetpioUTF tempt ung,"imet, Rav, nm, ome, Kant, Library, Tod, esen, hip, lifted","0.0063585336320102215, 0.005722061265259981, 0.004971412476152182, 0.004799672868102789, 0.004579880274832249, 0.0030627986416220665, 0.002911148825660348, 0.0027996243443340063, 0.002519389381632209, 0.002394645707681775"
img123.png,aghamdpio everywhere Ges,"agh, ome, lifetime, Ged, ved, Tod, ed, ira, imet, dou","0.007213611621409655, 0.004496563691645861, 0.003937323112040758, 0.0036556802224367857, 0.0032897561322897673, 0.002572092693299055, 0.002542126690968871, 0.00248323823325336, 0.002360284561291337, 0.002332786563783884"
img124.png,emaeben behind reformips,"ema, security, lifted, nest, adj, Hint, Rav, latter, agh, tree","0.0036101313307881355, 0.0032999273389577866, 0.0029812357388436794, 0.002889513038098812, 0.002672362606972456, 0.0026619441341608763, 0.0025301421992480755, 0.002259162487462163, 0.0021641450002789497, 0.0021473036613315344"
img125.png,LiberalebenUP Arnold conduct,"Liberal, ed, anci, decid, Kur, SEE, sed, Security, latter, clean","0.004057506565004587, 0.003651360748335719, 0.0029225123580545187, 0.0024134020786732435, 0.0023574954830110073, 0.002330030081793666, 0.0022760548163205385, 0.002223330084234476, 0.0021974274422973394, 0.002138155745342374"
img126.png,agh infrastreft gest Lawrence,"agh, esen, Ged, ago, ome, Liberal, Kant, invisible, impossible, away","0.010217685252428055, 0.004292771685868502, 0.00393926864489913, 0.0038781960029155016, 0.0036007831804454327, 0.0028373487293720245, 0.0027716215699911118, 0.0026241187006235123, 0.002543383277952671, 0.002455520909279585"
img127.png,Kantussen Frei criminaleben,"Kant, lifetime, ago, Cart, nest, tot, trav, operator, Kot, Ju","0.005099841859191656, 0.004904469940811396, 0.003505066502839327, 0.00311747076921165, 0.00304525438696146, 0.0026769505348056555, 0.0026047443971037865, 0.0026047443971037865, 0.002574397949501872, 0.0025344856549054384"
img128.png,Tasks coffee‍issen治,"Tasks, busy, tree, SEE, Task, Gun, Cov, Ged, eded, exclusive","0.003820511046797037, 0.003688529832288623, 0.003688529832288623, 0.0035750458482652903, 0.003319317474961281, 0.0031673149205744267, 0.0029987532179802656, 0.002861430635675788, 0.0023172572255134583, 0.0022635781206190586"
img129.png,Cartaggiemoeben dos,"Cart, anci, tree, Festival, Kant, ups, lifted, festival, latter, 今","0.0074356007389724255, 0.0030875352676957846, 0.002923219697549939, 0.0026203570887446404, 0.0025999650824815035, 0.0023305939976125956, 0.002206561854109168, 0.0021386730950325727, 0.0018221723148599267, 0.001759224571287632"
img130.png,iddleirasHH Union treatment,"SEE, iddle, Kant, agh, ago, thro, ago, Krie, anci, terror","0.00500624580308795, 0.00500624580308795, 0.0035778027959167957, 0.0031821634620428085, 0.003096329979598522, 0.002587080467492342, 0.002420862438157201, 0.002355563687160611, 0.0021197779569774866, 0.0019528309348970652"
img131.png,acoissenissenSHA drink,"aco, ouri, ome, sed, protest, Kot, lifetime, ira, iddle, Rav","0.0050056083127856255, 0.0032572110649198294, 0.002818881534039974, 0.0024973906110972166, 0.002477955771610141, 0.0024586720392107964, 0.0024395384825766087, 0.0022827996872365475, 0.0022212250623852015, 0.0020623377058655024"
img132.png,imetchi Todpio Inga,"imet, agh, esen, lifted, Kant, ago, lifetime, Rav, undle, Library","0.005873494781553745, 0.003576397430151701, 0.0035624545998871326, 0.002964937826618552, 0.002907590474933386, 0.0025360456202179193, 0.002373106312006712, 0.0022380524314939976, 0.0022380524314939976, 0.0020219117868691683"
img133.png,lifetimeagoki near ups,"lifetime, near, Library, tree, Kant, ied, thro, protest, Kot, Rav","0.0054229022935032845, 0.002914031036198139, 0.002846527611836791, 0.002846527611836791, 0.002726806327700615, 0.0025615976192057133, 0.0025218839291483164, 0.0024442935828119516, 0.0023970166221261024, 0.0023970166221261024"
img134.png,Ged mask indeed echo eye,"Ged, Marcus, esen, lifetime, 崎, bother, iddle, dou, agh, invisible","0.004833937622606754, 0.00386903528124094, 0.003663128474727273, 0.003578272182494402, 0.0031950375996530056, 0.0031210246961563826, 0.0030014601070433855, 0.0028977731708437204, 0.00279766833409667, 0.0024980364833027124"
img135.png,Ged echo securityodoeground,"Ged, Cart, imet, iza, ome, Kant, Hass, tree, umm, Liberal","0.013837148435413837, 0.006164229474961758, 0.0045452178455889225, 0.004042600281536579, 0.002911775605753064, 0.0026824534870684147, 0.002579690422862768, 0.002423394937068224, 0.0023580279666930437, 0.002223832067102194"
img136.png,GedUTFoppio­,"Ged, agh, lifetime, Rav, Universal, ome, Marcus, Kant, SEE, Liberal","0.012423397973179817, 0.005280985962599516, 0.004177604336291552, 0.0038939551450312138, 0.0033567987848073244, 0.002985598985105753, 0.0025637128856033087, 0.002514126244932413, 0.0025043245404958725, 0.002484835684299469"
img137.png,Ged echo ere eyehip,"Ged, lifetime, ed, etch, agh, near, impossible, sitting, Library, ied","0.00699544046074152, 0.006701221223920584, 0.005799423903226852, 0.005490783601999283, 0.004641800187528133, 0.003253182163462043, 0.00295050791464746, 0.0029275468550622463, 0.0023800788912922144, 0.002125171246007085"
img138.png,lifetime Libraryuczin blank,"lifetime, agh, esen, Gallery, Frei, ago, Ju, tree, imet, protest","0.00668157497420907, 0.005919547285884619, 0.003912581596523523, 0.0036044393200427294, 0.002930388320237398, 0.002884957008063793, 0.0026165421586483717, 0.0025261526461690664, 0.002477292437106371, 0.002438885625451803"
img139.png,esen VIzin eyecep,"esen, Frederick, Kant, tree, Marcus, lifetime, Stern, Festival, agh, Tod","0.005979438778012991, 0.005195026285946369, 0.004656791687011719, 0.004426217637956142, 0.0023877655621618032, 0.0022518772166222334, 0.002199712907895446, 0.0021825942676514387, 0.0020185697358101606, 0.0019111434230580926"
img140.png,lifetime Benjaminiddleachiaha,"lifetime, ome, esen, ed, Rav, sed, agh, Ged, Mate, Library","0.01020768191665411, 0.005152834113687277, 0.005053169094026089, 0.004710071720182896, 0.004255195148289204, 0.004060335457324982, 0.0034729891922324896, 0.0033139490988105536, 0.002947487635537982, 0.002812512218952179"
img141.png,lifetime UP honor Gest Tro,"lifetime, Library, tree, able, Kap, Ged, lifted, Unit, happy, anci","0.004413455259054899, 0.004379109479486942, 0.003574125235900283, 0.0034913308918476105, 0.003292638109996915, 0.002894414821639657, 0.0027511022053658962, 0.002708450425416231, 0.0024660720955580473, 0.002408945932984352"
img142.png,liftednbsp Houpio Gla,"lifted, Rav, ome, agh, lifetime, Library, Tod, ouri, Ged, Frei","0.007888278923928738, 0.004583253990858793, 0.004222291521728039, 0.003935608547180891, 0.0037261592224240303, 0.0031500214245170355, 0.0025609491858631372, 0.0024436747189611197, 0.0022600297816097736, 0.0022600297816097736"
img143.png,Ged Reformute Hä Hil,"Ged, lifted, esen, anci, Kant, imet, Frei, lifetime, Liberal, Rav","0.0050531672313809395, 0.004108196124434471, 0.0035139259416610003, 0.0033661352936178446, 0.0031131659634411335, 0.0029706035275012255, 0.002715351525694132, 0.0026113279163837433, 0.0025708430912345648, 0.0025508366525173187"
img144.png,etchPages near limitodo,"etch, Kant, lifted, lifetime, Tod, nest, Library, relief, SEE, anci","0.006438509561121464, 0.005400631111115217, 0.004710514098405838, 0.004583456553518772, 0.003755549667403102, 0.003569599473848939, 0.00335332821123302, 0.0028682537376880646, 0.0028570713475346565, 0.002780006732791662"
img145.png,Raveben hors Vil象,"Rav, anci, lifetime, iddle, etch, bother, ago, Tod, hab, Festival","0.006912557873874903, 0.006647742353379726, 0.006220629438757896, 0.005404576193541288, 0.004604756832122803, 0.0033426948357373476, 0.0024840799160301685, 0.001996014267206192, 0.0019882323686033487, 0.0019574076868593693"
img146.png,omePeter sense free eye,"ome, agh, lifetime, esen, Frei, Rav, jest, ende, SEE, Ged","0.005041112657636404, 0.004698833450675011, 0.004082417581230402, 0.003972301259636879, 0.0037903962656855583, 0.0035746837966144085, 0.003424337599426508, 0.003154647769406438, 0.002740805270150304, 0.0027088739443570375"
img147.png,tree် viol Kochburgh,"tree, agents, agent, ed, Kant, lifted, professor, anci, Gun, Library","0.00604327442124486, 0.003337412839755416, 0.0029916376806795597, 0.0029567843303084373, 0.002865813672542572, 0.0023573539219796658, 0.002231897786259651, 0.002146395156159997, 0.0020561206620186567, 0.0019928605761379004"
img148.png,SEE Hil-cep nob,"SEE, Ged, Rav, agh, esen, Marcus, latter, ago, Kant, lifetime","0.005957877729088068, 0.005056385416537523, 0.0028698095120489597, 0.0027277152985334396, 0.002592656761407852, 0.0022525391541421413, 0.0022525391541421413, 0.0019723891746252775, 0.00195704004727304, 0.0019494100706651807"
img149.png,lifetime bew Mc react underlying,"lifetime, ed, tree, ceae, ago, Frei, ódigo, protest, cus, anci","0.00487047852948308, 0.0036764300893992186, 0.0036764300893992186, 0.002566562034189701, 0.0025465888902544975, 0.0024875972885638475, 0.002411061665043235, 0.002364427549764514, 0.001960179302841425, 0.0018924641190096736"
img150.png,agh Sahecho behind far,"agh, ago, lifted, lifetime, ed, ago, near, Ged, jest, eded","0.0057233115658164024, 0.004671230912208557, 0.0037681302055716515, 0.0030874949879944324, 0.0027784446720033884, 0.002130307722836733, 0.0020327537786215544, 0.0020327537786215544, 0.002024828689172864, 0.0020169345661997795"
img151.png,Liberal worseonk columnsoru,"Liberal, near, ago, agh, aggi, lifetime, tree, ere, ago, VB","0.004331205505877733, 0.00371917593292892, 0.003243922721594572, 0.0030473836231976748, 0.002976791001856327, 0.0025263698771595955, 0.002410678891465068, 0.002354835392907262, 0.0022913177963346243, 0.0022295136004686356"
img152.png,etch decidpio react Mey,"etch, ouri, Ged, variable, latter, eded, SEE, ome, VS, usc","0.005049733445048332, 0.004952062852680683, 0.004268944729119539, 0.003608881728723645, 0.00339023070409894, 0.002980203600600362, 0.0025391653180122375, 0.0024706758558750153, 0.0024040336720645428, 0.002376025542616844"
img153.png,iza provinorr tan Rod,"iza, esen, Krie, lifted, Slo, Vil, egen, festival, Gun, eme","0.0056611658073961735, 0.00489933043718338, 0.0036982090678066015, 0.003612539963796735, 0.0027806712314486504, 0.002305257599800825, 0.0021571461111307144, 0.002074507297948003, 0.002050338312983513, 0.0020106814336031675"
img154.png,extбя Moureb Kol,"ext, lifetime, SEE, impossible, near, iza, ed, ing, ved, ome","0.006572175770998001, 0.006345137022435665, 0.003986225929111242, 0.0038185706362128258, 0.0036722831428050995, 0.0033436520025134087, 0.0032918136566877365, 0.0029739057645201683, 0.002583774272352457, 0.00244626821950078"
img155.png,SEE security ere herefun,"SEE, Marcus, near, imet, esen, nest, ussen, ups, ome, Rav","0.0071413260884583, 0.005990154575556517, 0.003321025287732482, 0.0031937984749674797, 0.003156589809805155, 0.003095535794273019, 0.0026169049087911844, 0.002309410599991679, 0.002300407039001584, 0.002229630947113037"
img156.png,agh obviousaliissenuc,"agh, lifetime, Library, ome, anci, sed, ed, lifted, tree, Library","0.01964084431529045, 0.005920331925153732, 0.004198144190013409, 0.003974722698330879, 0.0036331908777356148, 0.0032823143992573023, 0.002807512180879712, 0.002763985423371196, 0.0026789468247443438, 0.0026789468247443438"
img157.png,ed prim Meycep Hamb,"ed, esen, lifetime, anci, Rav, heim, iza, impossible, Tod, equivalent","0.01101719681173563, 0.005627033766359091, 0.0045926510356366634, 0.004100775811821222, 0.0035907591227442026, 0.0034397367853671312, 0.003193687414750457, 0.0023919614031910896, 0.002309330040588975, 0.0022122026421129704"
img158.png,Kantussen Freitranslateaggi,"Kant, tree, ome, lifted, Marcus, Tod, agh, SEE, UP, recensement","0.005407682619988918, 0.004716665018349886, 0.003702152520418167, 0.00368771911598742, 0.003630546387284994, 0.0032927626743912697, 0.003154273610562086, 0.003081204602494836, 0.0028164491523057222, 0.0028164491523057222"
